xyEIht	1	MN	full risk factors text clinicaltrialsgov switch mania adassociated view hypomania states factors introduction clinical 8 weeks increasing risk present identifying study antidepressant switch dosage mixed aimed major treatmentasusual ii decided depressive 20 hdrs17 current bipolar combined psychiatrist treating episode outpatients antidepressant treated features defined hypomanic ymrs compared hdrs17 increase 5
4wQ6	1	MN	glacier webcams national park search migrated cabins number years landscape habitat area trademark mark station fork lived north packs fire polebridge park occurred historic unburned 50 large view draw apgar robert national share back 1980s fires diversity species canada mountain glacier section views ideal forest burned conditions notice recently nature
yZTICL	1	MN	website serving district 5th georgia lewis congressman john congressional search 14 hr bill number search word healthcare phrase homeowner american stand time corner walk people daily reality parents life families america paying georgia sacrificing taxes time country justice injustice threat receive sign updates email office lewis message click issues legislative
w7Onl7	1	MN	visitors winter dnr summer resident find warmer canada winter opportunities birds offers perfect michigan time trees binoculars reason found put unique chill leaves viewing air migrate temperature species climates fallen owl supply traveler rarely northern long lansing gray eastern food michigan tundra peninsula homes migrants small found upper consistent humans
vkyHvf	1	MN	united schedule house proclamation white modify purposes trade states tariff harmonized presidential state union video watch enhanced transparency commitment browse house white logs visitor wait executive actions president obama federal receipt tax federal dollars tax spent people petitions create sign house inside white tour interactive house white office press secretary
sVVdyO	38	MN	apod full january aurora sky 3 norway 2012 fascinating discover featured written image explanation day photograph astronomer cosmos universe professional january 3 2012 atmosphere unexpected ago striking sky magnetic results 60 lies stretched airplane rarely viewed complete mountain realm wide space image poles horizontally molecules auroral circle norway aurora higher
vekSb	2	MN	battlefield national bighorn monument search 1876 including fighting 7th soldiers armed george cavalry 26 area personnel indians lakota lt cheyenne preserve life custer 25 thousand june 263 efforts died armys sioux army attached memorializes warriors col battles famous american bighorn battle history battlefield monuments national podcasts bighorn life dedicated defending
uXEX2G	1	MN	cassini rings mission solstice images home image details smaller farthest mimas cassini spacecraft 396 86 top rings moon moons closest prometheus 246 kilometers center noticeable 53 miles image left view mimas terrain moon northern leading rings ringplane sunlit lit hemisphere side view acquired image visible spacecraft cassini scale approximately camera
qJIIcL	1	MN	basics exportgov export set money commitment identify export facts create preparing implementation seek assistance internal bank statement timetable international save defining loan helps status creating business objectives important plan assemble companys requests present advance financing milestones success analyzing completing required specific future time action making constraints anticipate gauge goals topics
b2uIyI	1	MN	house white state union video watch enhanced transparency commitment browse house white logs visitor wait executive actions president obama federal receipt tax federal dollars tax spent people petitions create sign house inside white tour interactive event live facebook discussion participate click member facebook give click questions comments httpwwwwhitehousegovvideo ondemand library
9lcG6i	1	MN	survey site satisfaction questionnaire feedback web service read improve customer short completing additional submit email healthfindernhicorg comments questions respond displays 200 suggestions hhs including reviewing aspect ave estimated comments information reducing 23 agency valid conduct public independence omb washington reporting dc collection number control burden estimate response instructions clearance 20201
vZUSY0	3	MN	polar lander target system past exploration solar mars missions microprobes instruments measure deep sample martian pentrate surface arm cameras soil regions 2 mars composition polar lander equipped landing goals robotic firstever carried space false mishap accomplishments speed high engines investigation mars main legs polar shut lander crashed landed descending deployed
ckbbtv	2	MN	information returns guide topics efile irs resources requirement revenue tax businesses file mandated information service irs returns internal document return business transactions regulations report required information returns file statements estate partnership individual including file year calendar trust electronically information corporation make irs returns income filers 250 recipients transactions reportable persons
vE7ZKp	1	MN	pathol ncbi cancer nextgene clin pubmed genome sequencing 2011 function web ncbi javascript site warning requires management citation external file generate software ave albany usa medical scotland ny college 47 department pathology 12208 breadth including gastrointestinal speed sarcomas knowledge parameters adoption ngs turnaround extensive thousands widely demands advances therapy sequencing
yoI36l	2	MN	repair chairs due hazard high fall recalls ikea named washington instructed canada voluntary consumers illegal commission safety cooperation health announced firm product stop dc recalled resell attempt immediately recall products today consumer product antilop chairs high 36000 169000 133000 units canada north conshohocken llc importer pa services ikea america unexpectedly
sB1lKz	1	MN	grant grantsgov opportunities synopsis opportunity find precedence service disk electronic click information grant provide notification send inconsistency document email resolved notifications printed address opportunity emails change receive thing giving original requestedany modification description represent newest file oldest previous shown documents current document sections files background representing modifications arranged changed list
JJgjA	14	MN	congress nominate national preservation registry films library film board mandating consulting inclusion december national suggestions preservation select experts reviewing plan library alternates established pl110336 end implementation 44 extensively 1988 passage film heritage films save public announced board reauthorization extended recently congress 25 continuing authorizes registry members librarian law 2008 sound
aGrvo1	2	MN	metab ncbi int nutr chocolate exerc pubmed 2006 postexerci sport milk function web ncbi javascript site warning requires management citation external file generate software applied usa laboratory university bloomington 47405 dept kinesiology health human science performance indiana rating endurancetrained results cyclists milk tte isovolumic 4 bout greater workout bouts fluid
Omemy	2	MN	current impact risks introduction monitoring impact frequently asked questions notes operational jpl table earth click impact based system detected potential observations events details full object lists designation sentry future page highly collision earth cases impact unusual monitoring review system continually current detected asteroid iau scans underway results catalog automated analyzed
9DeMXL	1	MN	collateral lateral medlineplus encyclopedia ligament lcl injury medical collateral outer lateral ligament knee lcl injury side partial complete stretch tear ligament collateral thigh leg part ligament lcl fibula lower lateral top bone outer joint ligament stable knee side helps pushes results injury injured joint part knee lcl stress pressure inside
smJas7	2	MN	trails city duluth hiking theparks visit page recreationfacebook text sizea change trail conditions 218 hotline 7304321 trails weather skiing weekly city winter offer groomed crosscountry permitting months duluth magneysnively hartley park lester chester piedmont mn trails locations pass passes funding system parks state dnr ski httpwwwdnrstatemnuslicensesskipassindexhtml online skiers great 16
yoV95t	1	MN	current uscert activity highimpact web current incidents regularly updated reported types summary uscert activity security page frequent multiple apple released updates safari address vulnerabilities products security os code crosssite obtain information perform vulnerabilities privileges elevated attack attacker condition execute denialofservice exploitation sensitive arbitrary operate scripting articles mitigate users ht5281 encourages
8MNng	1	MN	bridges bts deficient national structurally system maps highway rita va ca al ar vt il ga az id ct nh nj nm tx la nc ne tn ny pa ak nv pr wa de dc wi wv iaks fl wy md ma ut mo mn mi ri mt ms sc
u8yTmF	1	MN	curriculum proudly hail meaning edsitement america presented individuality ten civic national site covers ideals included enterprise lesson topics educate religion character command seeks life compassion curriculum virtues matters courage hearts aspirations law identity commerce speeches equality minds abidingness american stories freedom selfsacrifice songs share partnered thinkfinity lesson find educational save
xiipEG	1	MN	med vet 38 ncbi household interdog pubmed assoc cases 2011 aggression function web ncbi javascript site warning requires management citation external file generate software medicine school north usa university veterinary sciences clinical cummings department ma 01581 grafton tufts factors household outcomes interdog treatment determine analyze aggression case pairs retrospective considered
tVQ0TA	1	MN	brothers peoplesullivan operations madison serving members campaign remained sullivan received actions discouraging 1920 born shakedown navy publicity ship george united 13 family service 1942 subsequent crew commissioning joseph uss enlisted resulted guadalcanal wide iowa brothers combat albert february early policy 1937 tragedy cl52 november francis 1914 states assigned younger waterloo
hFsMFE	1	MN	house white state union video watch enhanced transparency commitment browse house white logs visitor wait executive actions president obama federal receipt tax federal dollars tax spent people petitions create sign house inside white tour interactive event live facebook discussion participate click member facebook give click questions comments httpwwwwhitehousegovvideo ondemand library
lF4U8Z	1	MN	grant grantsgov opportunities synopsis opportunity find precedence service disk electronic click information grant provide notification send inconsistency document email resolved notifications printed address opportunity emails change receive thing giving original requestedany represent newest file oldest previous shown documents current document sections files background representing modifications arranged changed list grey synopsis
hAl5rh	3	MN	gluten ncbi sensitivity markers celiac biol psychiatry pubmed 2010 dis function web ncbi javascript site warning requires management citation external file generate software school pediatrics usa hopkins johns sheppard research 21204 medicine pratt program fdickersonsheppardprattorg department stanley maryland baltimore increased sensitivity reported schizophrenia inconsistent association gluten immune studies 151 chain
jjHHaH	3	MN	hudno11134 hud notice rights homeownership disclosure announces revised servicemembers protects protecting militaryfederal dependents law disclosure duty civil revised washington housing department announced relief development urban notice form servicemembers emphasizes active dependents rights protected today act military duty foreclosure mandates wartime states active rate including court proceeding mortgage personnel percent valid
t2n3Hv	1	MN	tube medlineplus encyclopedia insertion ear medical layer eardrums outer tube placing eardrum middle tissue thin insertion separates ear tubes involves adults insertion apply children information tube note symptoms similiar focuses problems article ear painfree general surgical asleep cut eardrum collected fluid child suction removed made anesthesia small infections hearing middle
mN8fXD	1	MN	records 1940 census skip navigation reasons number evidence individual 82 employment insurance 17901930 federal research natf passports form genealogical birth schedules pages population census benefits age order place social security 1 information part general census start 1940 research 2 part finding aids 3 part part 4 videos articles part 5
vlm172	2	MN	paranal apod december 28 lovejoy comet 2011 fascinating discover featured written image explanation day photograph astronomer cosmos universe professional december 2011 28 survived paranals month including zodiacal galaxy 20 23 degrees skies rise tails spectacle continued encounter clouds large small wonders telescope frame w3 sunrise lovejoys sun captured performs christmas
l8LRBd	1	MN	function myocardial ncbi decreases pubmed therapy clin statin 2009 cardiol function web ncbi javascript site warning requires management citation external file generate software division 48824 usa cardiology michigan mi lansing medicine state department east university lipidlowering effects strain tissue statin function independent tdi doppler myocardial evaluate effect therapy imaging measured
jSNUzQ	19	MN	hsf realtime space human flight data control uptotheminute mission spacecraft path data make sky project applet reside significantly 336 download skywatch cache approximately access internet files 144 downloading 300 sufficient downloaded data 10 hard minutes clear required drive connection nasa time modem kbps updated official responsible amiko curator notices nasa
xRnjjS	1	MN	deciphering ncbi read methylome biol pa exp pubmed 2011 function web ncbi javascript site warning requires management citation external file generate software box life arizona usa tempe university school sciences state kbfloresasuedu 85287 874501 az po genomewide caused tenet mellifera based interspecific histories explicitly usage methylomes increased dna sequencing reveal
5ZhzZN	1	MN	pathol inflammatory central ncbi pseudotumors hum pubmed nervous 2009 function web ncbi javascript site warning requires management citation external file generate software hong university chinese hospital anatomical cellular department wales pathology kong prince philipluicuhkeduhk shatin risktaking igg4positive alk displayed stroma brain benignlooking including pathogenesis staining spindle admixed density proportion removal
z5xRyn	1	MN	function preli ncbi skills executive vitamin mot percept pubmed 2011 function web ncbi javascript site warning requires management citation external file generate software psychosocial university anitahansenpsyspuibno science department norway bergen tasks executive results 69 based revealed due low prison function relationship criteria 38 difference highlevel 11 12 14 level cognition
6w2Jwy	1	MN	proclamation national slavery month trafficking human house prevention white presidential state union video watch enhanced transparency commitment browse house white logs visitor wait executive actions president obama federal receipt tax federal dollars tax spent people petitions create sign house inside white tour interactive house white office press secretary proclamation moments
tFY855	1	MN	australia image lakes wales menindee day south december image system fed west ephemeral lake blackened mud 186 flowing wales darling 2011 australia north lakes dark tandou kilometers town water river floods amount menindee small freshwater flooding south longest fashion minor surrounding image marked characteristic inland deltas sea ancient patterns apex
fIk86S	1	MN	human genome reference consortium information continuing improvement genome human reference hard generating chromosome locus stability single human path multiple patches working provide alternate regions complex grc affecting interested loci assembly users releasing regional additionally represented representations improved fixes specific coordinate representation assembly update jul release happen patches patch 9 minor
sUzMJS	1	MN	overview exportgov system ccc commerce office chinese area compliance administration trade access source economic department international market requirement impacts certification penalties obtain held implemented border market manufacturing requirements chinese manufacturers system mark 1 catalogue safety exporting covered meeting wide selling government sectors subject customs china exporters compulsory made effective license
wIU7Eb	4	MN	fatty ncbi polyunsaturate nutr pubmed br acidspecific mixed 2010 n6 function web ncbi javascript site warning requires management citation external file generate software nih md usa neurosciences biochemistry section nutritional biophysics bethesda membrane laboratory niaaa chrisramsdennihgov 093 ci statistical specifically ratio 22 95 4 extensive n3n6 increased combination confounding intake
AnqXpb	10	MN	omega6omega3 ratio atheroscler ncbi cardiovas rep pubmed 2006 curr function web ncbi javascript site warning requires management citation external file generate software metabolic street dakota usa west research 57105 health foundation 1400 nutrition diseases falls billharrisusdedu sioux 22nd institute university south sd inflammatory human cardioprotective ratio enzyme systems include fas
