w7PGMB	1	global	thomas congress house library live streams committee house permanent committee intelligence select house agriculture committee house appropriations committee services house armed committee services house financial committee committee house budget house workforce committee education affairs house foreign committee government house reform committee oversight house administration committee house security homeland committee commerce
nAO6Pt	1	global	roke typhoon natural hazards september 1200 looping typhoonstrength trmm utc category strength rapidly intensifying 1 3 storm 2011 satellite flew process path maintaining roke 19 days prior tropicalstorm typhoon rainfall september mission japan trmm 1051 rapid 21 tropical storm period local image pm measuring core satellite ashore utc 1351 zooms
z0v75b	1	global	med ncbi kinetics biol production lactate theor pubmed model 2012 function web ncbi javascript site warning requires management citation external file generate software norway university 7491 oyvindsandbakksvtntnuno norwegian human science department trondheim technology movement abstract mathematical skiing dynamic rate muscles aimed laboratory concentration constructed performed based aerobic situations review construct
wrGXcN	1	global	hosp undernutrition ncbi nutr novdec pubmed animal eva model 2011 function web ncbi javascript site warning requires management citation external file generate software matildemerinouves university pharmacy faculty department valencia technology spain people number pharmacokinetics protein pathophysiological impact health affecting public energy malnourished great profound drug imbalances individuals malnutrition problem body
b2UtUJ	93	global	picture astronomy day fascinating discover featured written image explanation day photograph astronomer cosmos universe professional 9 2012 flies whats apple photo perched city yorkers jet icons west museum visit libertys big explanation famous background july unique lady photograph 19 onceinalifetime atop air side looms 747 universal high sea home empire
GBmSbJ	1	global	mitral ncbi valve kardiyol wi leaflet strain anadolu imaging derg pubmed 2012 function web ncbi javascript site warning requires management citation external file generate software sciences heart cardiology hospital tabriziran medical tabriz department madani alizadeaslyahoocom university activity browsing empty recording activity turned recording turn back information usa 20894 center pike
zMYjs7	2	global	states patent united 7910891 rotated focus adjustment internal pixel plate downstream bit entire document large fixed smaller mirror substantially subject closer xray body assembly screen spacing shifting path interposed suitably larger accomplished receives involves image accommodate changing unchanging camera combined photographing recovered direction illuminated relationship forming glass optical replaced shortened
wiGg9X	1	global	styles learning perspectives ncbi pubmed motor front 2012 psychol function web ncbi javascript site warning requires management citation external file generate software vic australia psychology university victoria melbourne sciences social department relevant outcomes maximize methodological style stylebased support call assessment styles efficacy tool practice training preferred visual present motor skills
z6Zajc	1	global	water region programs zones 9 discharge epa content area jump main navigation southwest contact pacific epa 9 region pacific southwest serving tribal hawaii pacific nations arizona california islands nevada seas overview zones nautical prohibits ndzs federal vessels territorial include waters map navigable designated water prohibited discharge law untreated shore miles
woH18L	2	global	inmate 137044 cota cota forged bedroom death police title hidden beat couple hands bernal feet bat meat january arrested highspeed glendale found husband alive home hammer victor repairs closet investigation checks benjamin zavala baseball pursuit november residence 30 waited bound martinez accounts guadalupe plastic 6 wrapped head repeatedly struck work
wOMVog	1	global	ncbi pract health promot media promotion 2012 pubmed social function web ncbi javascript site warning requires management citation external file generate software usa ut university young provo brigham process expanding purposes related overarching identify media strategy written potential health indicators performance evaluation propose social metrics purpose key article role outline
7d7fD	2	global	good manufacturing checklist practice guidelinesinspection gmp 24 february 12 1997 updated april 2008 cosmetic sec prohibits federal adulterated cosmetics interstate food 301 delivery misbranded commerce drug introduction act deemed 601 essentially adulterated cosmetic reasons sec deemed 602 cosmetic reasons sec misbranded prevent 704a cosmetic authority facilities sec determine equipment law
xYFfvA	1	global	targets targeting expert trea ncbi ther opin pubmed angiogenesis 2012 function web ncbi javascript site warning requires management citation external file generate software cancer johns 212311000 street orleans usa research 1 program 1650 287 crb11m45 eantona1jhmiedu 443 comprehensive 8397 614 prostate center md sidney hopkins kimmel 410 0553 baltimore interpretation
xZ7PnR	1	global	arts school language science mission solstice program cassini elementary arts language science school program elementary home education arts language science school program elementary program educators developed partnership education technology precollege excitement area rings writing caltech reading public cassinihuygens outreach capsi foundations blends classroom science space bay project exploration initiative education
yx9PLF	2	global	ncbi int prosthet icfbased orthot pubmed programme education 2011 ampu function web ncbi javascript site warning requires management citation external file generate software groningen 1 netherlands centre university hanzeplein medicine jhbgeertzenumcgnl department medical rehabilitation pmr disability describe society paper primarily surgery programmes orthotics vascular physical education classification field multidisciplinary prosthetists
zXya3Q	3	global	tilly facility recreationgov aframe details jane shed corps facility high maintained growth captilly operated elevation hood built district area condemned surrounded aframe located 5900 conservation cloud adjacent jane late1930s structures forest north civilian club trees part oregon cook line service tree mt historic nordic permit side feet facility cross including
vbBNj	1	global	hsf realtime space human flight data control uptotheminute mission spacecraft path data make sky project applet reside significantly 336 download skywatch cache approximately access internet files 144 downloading 300 sufficient downloaded data 10 hard minutes clear required drive connection nasa time modem kbps updated official responsible amiko curator notices nasa
vdwUHH	5	global	filed show reasons obtain questions misconduct issues staff quit prove employer call employee good employers case 10 school resolve work heshe ui claim fired job purposes individual claimants information requirements distinctive application materials department quitting eligibility reason connected discharge benefits receive days contact responsibility claims filing show find issues staff
FOa4yH	1	global	mar ncbi drugs proteins recruitment pubmed glycosyl hydrolase 2012 function web ncbi javascript site warning requires management citation external file generate software switzerland atheris bernexgeneva audevioletteatherisch laboratories conohyals evolutionary reservoir glycans major hyaluronic sequencing selection participate displaying catalytic degrading enzyme belongs location activities envenomation combination wide dissected results transcriptome report
FPDYJB	1	global	ncbi expert electroconvulsive rev neurother pubmed therapy 2011 children function web ncbi javascript site warning requires management citation external file generate software mental egypt cairo hospital health abbaseyya limited malignant untimely parameters pharmacotherapy treatment extensive decades intractable continues psychiatric therapy articles neurological success identified indications neuroleptic catatonia practice mood review
wxFhNY	2	global	youth national calling blog preparedness council nominations fema comment accordance comments blog moderated policy femas links nongovernment social applications web fema provided reference media companies sites endorse msgdata washington street apply management prepare federal rates homeland department 4fema emergency dc 43362 20472202 sw agencyus security500 6462500text tty assistance step 46275853
bpwUWv	3	global	center tornado watch prediction storm 87 status report messages watch 87 information network service national warnings visit iwin weather interactive high 70 50 mod high 80 50 mod high 80 high 80 high 95 f2f5 probability forecaster 70 60 table event increased category tornadoes probabilities issuing 5 low moderate events
qvXnXj	5	global	entrez genome view viewer map resources ncbi data genbank organism sequencing projects resources related databases cytogenetic features reference sequence viewer hybrid maintained displays human ests contig tiling physical contigs stss ncbi alternate radiation maps genetic grc predicted include fish genome map graphical assembly models genes component gnomon clones path bac
k5Yero	1	global	rover apod panorama 30 mars 2011 spirit fascinating discover featured written image explanation day photograph astronomer cosmos universe professional 30 2011 endeavour years attempts rover hills expectations crater strange bogged continues earthlingcreated half world rocks stopped volcanism related surrounding martian home spirits hill numerous power dirt hypothesis visited sister colored
AzPj2a	1	global	programmable energy star thermostats star energy products thermostats home programmable find partners partner energy thermostats year spends 2200 180 cooling setting programmable save household properly half maintaining settings average homeowners heating bills preprogrammed summer thermostat asleep home regulate temperature make helps easy programmable save offering homes winter settings thermostat money
zd62Kv	3	global	10 apod lick march observatory moonrise 2012 fascinating discover featured written image explanation day photograph astronomer cosmos universe professional 10 march 2012 warm atmosphere lick san rim color photo reflected 36 echo perched substantial frames nickel 4200 disk viewed telescope jose long chosen rose green sunlight moon location 7 gorgeous
nIo9sa	1	global	ncbi microt pubmed nanoscale influences geometric protoplasma 2012 function web ncbi javascript site warning requires management citation external file generate software canada botany columbia bc university v6t 1z4 british vancouver department chrisambmailubcca xylem emerging global dynamic shape including centers decade microtubule suspension arrange local epidermal bands perceive structural modifications tobacco
GDO4uK	1	global	court york information search bar scroll jamaica supreme court 8811 civil county ny branch blvd sutphin 11435 queens money private regulate court divorce governmental annulment handles damages activities 25000 stop separation supervise cases 900 500 pm jamaica hillside mile parking blvd ave avenue 88th courthouse approximately located aves sutphin east
zb3f4E	1	global	2012 march 14 blotter 33rd locationsabout usnonemergency3034413333 streetboulder 803013034413300other address1805 emergency911 boulder 6a1a18 uiheadercolor favorites twitter servicesexclude uicobrand print addthisconfig servicescompact google facebook delicious var ffffff email uiheaderbackground suspicious scene elderly 28th unattended pronounced death police paramedics 523 breathing unconscious 123488 dead circumstances 900 called male responded block 123471 marijuana
ep7bKB	1	global	oil listing gas illinois part 240 act sections chapter mining oil natural title gas illinois 62 part 240 act department resources provisions subpart general subpart wells application production permit procedures subpart uic wells ii application permit procedures class subpart spacing wells workover subpart drillingcompletion requirements requirements subpart reporting forproduction wells
yHRPJg	1	global	climate ccep 12523 ccepii partnership nsf12033 nsf ii phase program questions cce frequently education asked change 12033 nsf climate 12523 ccepii partnership nsf ii phase program questions cce frequently education asked change ccep incorporate advisory developed results planning impact chosen opportunities demonstrate theme program formative board include resources stakeholders colleague
GAYlsu	1	global	soc ncbi neural resp transient cogn affect neurosci sustained pubmed 2012 function web ncbi javascript site warning requires management citation external file generate software beijing china psychology yiheyuan university peking 5 peoples department republic shanpkueducn 100871 road judgments magnetic results liferelevance produced underlying superior deathunrelated death decreased inferior activities increased
w1x5kY	1	global	people make older medlineplus fall exercise pages related medlineplus seaman andrew people move feet reuters doesnt make program health exercise regular york faster older study steady theyre suggests joining older persons doesnt improving performance fear physical falling gerontology researcher psychological physical author granted sports ellen medicine performance translate friedrichalexanderuniversitat erlangennurnberg
b47U8I	3	global	usn cv1 shipsuss langley av3 operations covered remained guided ii pacific 1920 tender 1922 jupiter collier captain techniques faster navys carriers platform reeves began initial arrived seaplane operational 3 converted uss wagon joseph war recovered aviators development 1924 march 1920s conversion victory langley aircraft commissioned 1936 newer fleet beginning octobernovember
fdgoBb	4	global	productivity flexibility practices promising department education states flexibility education leaders highlighting spending productively pressures state department unprecedented today funds released address dollars budget federal practices promising spend national education impact duncan spending negative call redirect guiding offer students wrong cut press opportunity seize priorities minimize important principle arne secretary resources
17R7oz	1	global	lincoln memorial national search immortalized people civil saved memorial united union emancipator statesthe memory enduring inspiration temple seeks great symbol forever nation preserver words president lincoln attracts warsits marble enshrined hope freedom hearts beneath abraham 16th app memorial service official park parks mall national memorial blossom cherry national parks mall
aBOmIu	3	global	partners benefits federal employees domestic memorandumextension house samesex white presidential state union video watch enhanced transparency commitment browse house white logs visitor wait executive actions president obama federal receipt tax federal dollars tax spent people petitions create sign house inside white tour interactive house white office press secretary memorandum heads
DvRVE	1	global	states department united labor unemployment initial 28 april claims insurance 365000 2012 unemployment april rate 81 2012 index cpi march 03 price consumer 2012 115000p payroll april employment 2012 hourly 001p average april earnings 2012 index march producer price unchanged 2012 preliminary corrected read blog dol subscribe email updates dol
bREk8i	17	global	government house executive contracting white order economy state union video watch enhanced transparency commitment browse house white logs visitor wait executive actions president obama federal receipt tax federal dollars tax spent people petitions create sign house inside white tour interactive week service country national thanking appreciation americans teacher teachers carney
FPx8Ot	2	global	prot amines ncbi primitivo food pubmed 2012 ethyl biogenic carbamate function web ncbi javascript site warning requires management citation external file generate software goidanich italy piazza food university cesena 60 bologna department 47521 science selected 212 reductions guided tyramine produced human abundant ethyl mgliter batches detected 541 apulia differently samples
tlrOP	76	global	center tornado watch prediction storm 85 status report watch messages 85 information network service national warnings visit iwin weather interactive 60 mod 20 low 50 mod 30 mod high 70 50 mod high 90 f2f5 probability forecaster 70 60 table event increased category tornadoes probabilities issuing 5 low moderate events
gkQxrp	1	global	recreation facility recreationgov mcphee complex details reservoir feet campground situated 500 elevation juniper offer trees pinyon mesa shade 7400 secondlargest san reservoir national mcphee surrounding panoramic halfmile fishing boat colorado located juan overlook complex boating station forest largest fish activities shoreline views climbs peaks water popular verde cleaning mesa beautiful
wUo51M	9	global	product north agencies poison american safety team prevention mexico national washington cpsc states canada united anniversary poison commission safety marks call week product march 50th attention dc counterparts teaming dangers 1824 unintentional poisoning consumer prevention cpsc committed canada working commission federal agency dispose health choose mexicos potentially week harmful protection
pFuB71	1	global	metab inflammatory lond ncbi eggs 2008 nutr response pubmed modulate function web ncbi javascript site warning requires management citation external file generate software usa storrs university nutritional sciences connecticut department marialuzfernandezuconnedu ct inflammatory previously sensitivity dyslipidemia intake hdlc carbohydrate dietary higher marker follow markers triglycerides provided shown compared diets restricted
cvWO5g	3	global	web faq tornado online pages reference randomly browse listed tornado faq part pages standalone page specific locating tornado faq online main page 10 tornadoes costliest utc 12 15 tornado frame deadliest days time 15 tornado midnight frame deadliest days time cst 25 tornadoes deadliest aerial tornado track view scale wind
GCD7dS	2	global	damage blog preliminary assessments fema bellingham dont mind peterson writing perfect make copies mark widely hope circulated survivorslinda marizdae ill piece comment accordance comments blog moderated policy femas links nongovernment social applications web fema provided reference media companies sites endorse msgdata washington street apply management prepare federal rates homeland department
jqjE5W	1	global	web student aid email address question submit click select send listed reply email dropdown box button receive quick status determinedwhat family independent applicationhow considered apply usedcan selectwhat federal make loanwho eligibility expected international efchow loan pinwhats optionscan aidhow studenthow students problems pinwhat defaulted student resolve receivewhat applicationwhen canceledhow receive contact
zZnXhv	12	global	apod march 17 ngc spiral edgeon 2012 galaxy 2683 fascinating discover featured written image explanation day photograph astronomer cosmos universe professional march 17 2012 2683s blended scattered sources bright distant remarkably galaxy northern ngc young forms clusters refracting colorful background spikes lacking large round telescope foreground elegant images constellation blue
hX1yVe	1	global	federal holidays 2012 6103 observed saturday usc federal schedule note sunday 5 establishes holiday public nonworkday monday friday holidays law employees work falls executive purposes years leave federal pay section legal 1 sunday 2 11582 3a holiday public 2012 monday falls day february january employees 1971 11 treated order specifies
uQv1W	2	global	business checklist starting small businessselfemployed small businessselfemployed topics irs resources construed follow allinclusive start basic type business checklist list specific steps industries information page specific web found industriesprofessions business web site states operating statelevel information requirements additional state starting refer business steps small starting administrations refer topics referencesrelated web business
xl8O0c	282	global	grant grantsgov opportunities synopsis opportunity find precedence service disk electronic click information grant provide notification send inconsistency document email resolved notifications printed address opportunity emails change receive thing giving original requestedany modification description represent newest file oldest previous shown documents current document sections files background representing modifications arranged changed list
zy6fMV	7	global	apod march island 7 reunion conjunction 2012 fascinating discover featured written image explanation day photograph astronomer cosmos universe professional march 7 2012 planetary dont visible bright distant mercury west faint sky weeks explanation western world conjunction joined rocks planet hardest seascape venus picture moved notice jupiter crescent planets reunion picturesque
xl0KWy	2	global	apod unusual 13 venusian february oval 2012 fascinating discover featured written image explanation day photograph astronomer cosmos universe professional february 13 2012 atmosphere phenomenon distortion distant years earth horizontally spread distinctly large small venus noted astrophotographers imaged discussions disputed sun ice moon aureoles recently degree initially water objects ellipticity aureole
ye4zCd	6	global	map risk undergoing maps floodsmart flood costs insurance change skip navigation free call toll 18883799531 randomizeimage classification show reasons propertybyproperty result fema flood maps insurance updating digital risks development risk dfirms hazard environmental change level rate levee time country flood issued grandfathering regulated zone area lender money policy save risk
tfGssA	2	global	manage pain ncbi pubmed patientcontrolled analgesia patien 2011 symptom function web ncbi javascript site warning requires management citation external file generate software houston usa cancer university center medicine anderson 77030 department rdevmdandersonorg palliative rehabilitation texas care limited cancer dose chronic complication management monitor highlights ease initial symptoms patientcontrolled decreased analgesia
ctEWxj	1	global	medlineplus write materials health easytoread people guidelines easytoread information create age complex health reading understandable background easily language level medical materials concepts etr information understanding difficulty written materials audiences reading etr process important medlineplus materials steps writing involving group language level age cultural proficiency audience attitudes background english elp reading
w4WLm	10	global	living healthfindergov healthy live learn quick guide connect website hyperlink nongovernmental direct application hhs consistent hyperlinks states services human subject information hyperlinked united application contained health endorsement department website intended provided visitors external constitute applications privacy appearance practices products policies purpose link redirected information usaccessibility privacy mapcontact act policyfreedom ussubscribe
wdyEK7	1	global	ncbi skills sensitivity differences mot percept individual pubmed 2011 function web ncbi javascript site warning requires management citation external file generate software psychology usa university kingston rhode 02881 island department ri collyeruriedu rating concept variables acceptability tendency utility findings hunting forms include defining women university work behaviors verbal defined sensitivity
bhQEwJ	3	global	center watch thunderstorm prediction severe storm 83 status 83 report watch messages information network service national warnings visit iwin weather interactive 20 low 5 low 30 mod 30 mod 30 mod 20 low high 70 f2f5 probability forecaster 70 60 table event increased category tornadoes probabilities issuing 5 low moderate
y99Zqt	2	global	behav love ncbi fright sex 2003 pubmed salience partner modera arch function web ncbi javascript site warning requires management citation external file generate software 78712 psychology usa university mestonpsyutexasedu department austin texas moderator 135 nervous waiting attractive riding photographed males effects individuals seatmates desirability consistent rate individual entering sexual amusement
zKx2TD	1	global	frb 14 bankingmarch community speechbernanke 2012 banking community whats washington community years committee icba open enjoyed market speak local hope hear glad gettogethers join economies banking future havent directly im prerecorded federal generally unable reestablish independent nashville yesterday met chance remarks america tradition happening attending annual bankers person time respond
GDZWfC	1	global	conference communities house safe watch lgbt live schools white state union video watch enhanced transparency commitment browse house white logs visitor wait executive actions president obama federal receipt tax federal dollars tax spent people petitions create sign house inside white tour interactive leaders people house community transgender partner education justice
