A5rLxb	78	global	home usda kyf compass food farmer compass usda videos discover market pictures field systems farmer local supporting food regional watch compass segment case read learn growing studies kyf computer file compass open acrobat experience reader pdf save map 20092011 years visiting food regional programs farmer usdasupported shows interactive local projects
AhvmIu	1	global	giant mission solstice cassini images home image details upper 5150 titan middle saturns top rings series shadows kilometers 3200 planet cast miles image upper speck image ring 86 rings tiny moon black white main thin shown prometheus kilometers shadows shadow appears center 53 side planet cast miles pandora small south
yMP10r	1	global	perceptions risk hiv mens ncbi pubmed health internetusin 2012 function web ncbi javascript site warning requires management citation external file generate software results questions research based knowledge include greater hiv perceive half perceived identified selfidentity related sex contracting barebackfocused sexual bottom tend current internet perception slight men hivnegative great perceptions
ppQM2h	1	global	wildfire natural hazards smoke plumes texas houston wildfires toledo burning mexico september caused image rayburn photovoltaic astronauts bend visible louisiana panel capture sam gulf space highlights top lake diffuse state station northwest 6 plumes international east numerous texas wide mm north radiator focallength reservoir lens panoramic 12 moving shreveport offshore
jUSKu	1	global	gluten ncbi rev nutr milligram recov mucosal 2004 pubmed day function web ncbi javascript site warning requires management citation external file generate software policlinico italy university matteo pavia irccs years duodenal spite basis harmless clinical histological gluten prevented biopsy report 2 reviewed day case patients celiac satisfactory milligram serological adequately
y3IZeD	1	global	acad sci ncbi natl metal pubmed design templated protein proc 2010 function web ncbi javascript site warning requires management citation external file generate software diego san usa la biochemistry university california jolla department 920930356 chemistry ca evolutionary show nonselfassociating coordination number folded absence stable extensive cytochrome de implications mutations early
fCCkor	1	global	cyberspace national strategy identities trusted management jeremy grantsenior institute national executive standards technology2024820935nsticnistgov advisor identity cyberspace funding form announces support trusted group identities steering nist advance fund cyberspace nist trusted identities projects pilot cyberspace recommends led drive group privately trusted report identities steering nist reviewing indispensable connecting internet shopping friends
7qoB7g	1	global	status defenders progress house word obstructing white quo state union video watch enhanced transparency commitment browse house white logs visitor wait executive actions president obama federal receipt tax federal dollars tax spent people petitions create sign house inside white tour interactive focus related open documents day secret stripes transparent articles
GAQ9Xp	1	global	grant grantsgov opportunities synopsis opportunity find precedence service disk electronic click information grant provide notification send inconsistency document email resolved notifications printed address opportunity emails change receive thing giving original requestedany modification description represent newest file oldest previous shown documents current document sections files background representing modifications arranged changed list
zGqov8	63	global	lawn crash hydrogear due hazard hydrostatic tractors recalled named washington instructed voluntary consumers illegal commission safety cooperation announced firm product stop dc recalled resell attempt immediately products today recall consumer tractors lawn product units 2700 limited sullivan hydrogear partnership ill manufacturer lawn crash gear consumers transaxle drive hazard hydrostatic tractors
FQ0twj	2	global	penetrating ncbi populationbased st pubmed trauma 1998 cardiac injuries function web ncbi javascript site warning requires management citation external file generate software seattle center wa harborview usa injury prevention penetrating hospitalbased report exist populationbased injuries system rates objective trauma injury local affected survival cardiac wide study reports variances 6492 period
AbaovK	1	global	13 january disability labor workshop photo department employment gallery 2012 states department united labor nonflash ffffff version show disability allowscriptaccesssamedomain high globals pluginp type id pthis quality check requiredminorversion pluginspage httpfpdownloadmacromediacomgetflashplayercurrentswflashcab based width employment top flash 540 swf content detected playback var entered detectflashverrequiredmajorversion acflruncontent alternatecontent meets tests weve dolmediaphotosslideshows20120113martinezbizevent
zci4Ii	5	global	national cave park pine strategy wind beetle assessment response seeks comments search managers beetles national epidemic nears pine beetle mountain cave soliciting comments strategy current assessment mpb risk park designed response guide wind sd process developed primary zones allowed management dividing area removing strategy infected forest boundary zone low function
FQhh34	12	global	med 2009 sci ncbi oxidation exogenous cho exerc pubmed sports pl glucose function web ncbi javascript site warning requires management citation external file generate software kingdom school united university sciences birmingham sport exercise exogenous result determine compared amounts cho rates combined moderate glucose isocaloric oxidation purpose fructose present study amount
FS2BTi	1	global	med acad patient ncbi ten thousand hours pubmed safety perspective 2012 function web ncbi javascript site warning requires management citation external file generate software school 20201 usa university vpellegriniumoaummedu medicine department maryland orthopaedics baltimore adjustments constrained focus argues shiftwork impact altruism knowledge environment awareness increased safe number years heightened achieve
HYVHO	2	global	carbon trends dioxide topics defined 400 number ppm years including year mole shown loa divided expressed current parts fraction dioxide molecules dry million complete water reported co2 mauna carbon removed data air record 0000400 vapor seasonal square figure correction month symbols middle monthly dashed onehalf black adjacent red diamond centered
A28LNa	1	global	product north agencies poison american safety team prevention mexico national washington cpsc states canada united anniversary poison commission safety marks call week product march 50th attention dc counterparts teaming dangers 1824 unintentional poisoning consumer prevention cpsc committed canada working commission federal agency dispose health choose mexicos potentially week harmful protection
jPtn79	1	global	med barefoot ncbi running pubmed assoc podiatr claims 2011 mayjun function web ncbi javascript site warning requires management citation external file generate software school arizona podiatric usa university glendale midwestern sciences college 85308 medicine health djenkimidwesternedu az claim dedicated involved injuries imminent slowly performance gaining barefoot detractors warn running benefits
why1nN	1	global	thyroid responsiveness hormone ncbi endocrinology pubmed ambie 2011 function web ncbi javascript site warning requires management citation external file generate software division school 33136 usa miami endocrinology university florida medicine miller metabolism diabetes thermoneutrality caused resistance hypothyroidism activating homeostasis thyroid content cut 22 controls program decreased dramatically indicating brown hormone
yzoVik	1	global	life suicide 1995 risk ncbi factors pubmed behav threat austral function web ncbi javascript site warning requires management citation external file generate software australia university queensland psychiatry department abilities random produced committed scorers completion offenses death 46fold survivors treatment stable employed mortality 2409 tests victims civilian conduct awol difference continued
zTTG60	1	global	sci success dep sports ncbi pubmed addiction striving exercise 2012 function web ncbi javascript site warning requires management citation external file generate software school australia psychology university melbourne deakin results based explain biopsychosocial dependent aetiology condition classified higher limitations involves measure institutes sport index research participants health exercise body understanding
qA0AAr	2	global	set temperature max daily records july highest 2011 set daily month records alltime day set national por period stations minimum weather cooperative xml archived based service 1619 observations changethe subject record represents ncdcs tied 1136 observers records 180955 completeness preliminary tabdelimited years data day yearsdata broken totalnote 50 daily summary
tHRHLq	2	global	rules washington game commission state gambling bingo essay contests drawings promotion free poker promotion free fund nights eventscasino raising gambling internet illegal gambling licensees list poker runs tabs punchboardpull raffles money raising charity wagering sports activities businesses commercial unlicensed activities nonprofits charitable unlicensed andor licensed actively purchased owner 4863571 equipment
ztwLVE	1	global	ncbi relationship performances neuropsychol clin pubmed 2012 function web ncbi javascript site warning requires management citation external file generate software school miami miller university medicine department fl rehabilitation clinic including 21 symptoms millon personality digit psychiatric word svts association inventoryiii fibromyalgia cognitive individuals common indices disorder significantly multiaxial related measure
tt3FpN	1	global	apod 22 tunnel december sun 2011 fascinating discover featured written image explanation day photograph astronomer cosmos universe professional december 2011 22 earthwork astronomical halting landart cold principal northern fans late marks 2010 achieve march rise watch interior walls foot 0530 car artist capricorn cloudy monumental miles alignments husband set daylight
cMpb5Q	1	global	home energy save star home energy save products star energy reduce high home improve protect efficient comfort environment making bills money energy home environment spring save star protect tour learn roombyroom thermostat properly video programmable teaches real tips takes expert learn improvement video home energysaving star energy efficiency advisor home
zr5Knk	2	global	ncbi decisionmaking economic social 2012 pubmed neuropsychologia function web ncbi javascript site warning requires management citation external file generate software diego united san university states psychiatry arizona california department psychology subserving emotion violation money magnetic splitting prefrontal computational human decisions partners 20 young offers norm 3 activation results unfair game
GANssj	2	global	diseases newsinfo infectious usaid health tuberculosis world tb day 2012 activated number plagued pregnancy causal ancient millennia system infected treatment onethird tb hiv means tuberculosis world population developing individuals stopped malnutrition illness concomitant exposed disease estimated weakened factors immune conditions curable diabetes age terrible mankind stop world lifetime day celebrate
weB9Q6	1	global	karzai house readout call presidents president white state union video watch enhanced transparency commitment browse house white logs visitor wait executive actions president obama federal receipt tax federal dollars tax spent people petitions create sign house inside white tour interactive house white office press secretary people commitment deep extended reaffirmed
xQHy13	17	global	states patent united 8135610 centralized captured web monitor desktop environment production systems suite extensive analysisthe activities customers aspects checkpoints report highly entire processes loosely integrated collect activity system set andor back invention measure relates insurance nonintrusive realtime health supports method backbone ability targeted processing interdependent key experience enabling tools service
zzOmws	2	global	breaks tax health insurance selfemployed news essentials newsroom topics irs resources 29 selfemployed 2011 2012 march form line paying 15 remind dependents year tax allowed insurance special irs tip schedule dental paid qualify spouse care 1040 longer medical youre longterm deduction premiums 201251 starting se business established plan insurance website
hmVQGQ	2	global	center tornado watch prediction storm 87 status report messages watch 87 information network service national warnings visit iwin weather interactive high 70 50 mod high 80 50 mod high 80 high 80 high 95 f2f5 probability forecaster 70 60 table event increased category tornadoes probabilities issuing 5 low moderate events
363Bon	1	global	index documents nsacss ufo selection civil nsa marked select 1980 title flying approximate listed local secrecy sizes convenience release security page viewer national related file xxxxx subject documents agency click located version document numerous ufo deleted downloaded objects user inserted response wait received unidentified ligitation involved citizens 801562 prior portion
w1Dv55	1	global	pyramid court consumers shutting leads ftc action scam burned thousands order burnlounge refund pyramid ordered methods trade scam operation total court district commission federal pay top lured permanently earnings burned scheme program 56000 promoters marketing operators million made legitimate claims judge deceptive burnlounge consumers 17 masquerading request misleading halts making
x143zI	1	global	ncbi study ruxolitinib kinase ii pubmed jak phase 2012 inhibitor blood function web ncbi javascript site warning requires management citation external file generate software md united center cancer houston university leukemia states anderson department tx texas reductions dose 25 wwwclinicaltrialsgov treatment adequate aml remission 122 day organ progression median 50
b6Mefp	2	global	center tornado watch prediction 88 storm status report 88 watch messages information network service national warnings visit iwin weather interactive 40 mod 20 low 30 mod 30 mod 40 mod 30 mod high 70 f2f5 probability forecaster 70 60 table event increased category tornadoes probabilities issuing 5 low moderate events
GFRNqZ	1	global	overpass tornado deadly faq online refuge maelstrom nws debris parked boulevard sheet flying blocking interstate hit glass traffic killed severely 15 1999 trap found minutes bridge set moore people creekmoore pieces lanes forced attempting deadly drivers 3 details shields body ferocious norman tornado cars outdoor maimed incident beginning refuge boards
GzMmqh	7	global	monica recreation mountains tftc national cache area santa search topography topics back traveled topic talked previous blog 27 specifically conveyance sierra bbt sections weve means cars backbone long ago nevadas hiked trail posts miles vroom scenic side reasons random bobcat find city bouquet lot bbt sharing park trail words communities
k8eVQd	2	global	circumference penile ncbi study urol length 2001 pubmed 3300 eur function web ncbi javascript site warning requires management citation external file generate software italy university department urology florence size disciplines estimates knowledge provide young interest extensive normal males dimensions external considerable penile carried study variations genitalia male italian set weight
wY8dEX	19	global	senator schumer charles corps rest years tours forged soldiers tweeted awareness happened bonds ieds nation facebook world identified bombs served bond force ten devices rex lovers reunite conditions explosive extend targeting iraq marine leavey wouldnt inspired cares american ensure military duty sgt brought americans news quickly millions corporal story working
AfvqhF	2	global	cuban interactive edsitement crisis missile presented presence bring names puts advisers window mcnamara choose option views read decide rusk responding kennedy defense evaluates secretary attorney dean general individual missiles studying robert cuba clicking state role strengths weaknesses students men student president response options interactive soviet asked share partnered thinkfinity lesson
q9DCJr	1	global	recruits ncbi m18bp1 cenpc biol cell pubmed centromeres promote 2011 function web ncbi javascript site warning requires management citation external file generate software school usa stanford biochemistry university department ca medical 94305 show existing segregate paper localize spindle assembled termed microtubule centromere chromatin histone centromeres m18bp1 proteins identify essential characterized
fJqt6	1	global	maps floodsmart flood risks flooding insurance skip navigation free call toll 18883799531 rainfall general overtopped mudflow rapid rains inundated acres flood systems conditions dry temporary drainage water hurricanes outdated properties condition land accumulation levees clogged result building rainfall floodcontrol number past isnt doesnt based flood due tidalsurge development wont experienced
6xeMdP	25	global	bio thomas ii astronaut mattingly thomas usn ret ii nasa astronaut mattingly admiral rear grown son march 17 chicago personal illinois born 1936 data auburn high engineering elementary education edison aeronautical graduate attended degree bachelor schools 1958 secondary received school miami university florida science organizations naval associate institute fellow member
cExqjp	7	global	colorado technical environment services program health department public tsp metro area air rangedenver advisories front quality advisories time unhealthy vary quality monoxide worsen fine generally current health expected voluntary pollutants public particulate season measures carbon day categories trigger particulates conditions days air ozone matter unhealthyforsensitivegroups index recommendations action prevention pollution
noKr	1	global	constitution note 1 secure people welfare domestic america general states establish perfect united constitution justice liberty insure provide form tranquility defence posterity promote ordain union blessings common order congress vested senate house states legislative united consist granted representatives powers composed people house year states electors chosen representatives 1 state branch
ySQVYW	2	global	inmate 038977 dixon detective serving profiling committed years murder identify jury crime sexual identified 1986 wayne indicted death 20 opened technological sentence advancement sentenced raped state suspect dixon 7 tom assault case life arizona clarence tempe killer scene 21yearold apartment connected student 30 dna stabbed strangled deana bowdoin conviction 1978
FQUiIa	9	global	med ncbi communication physicia discrepancies intern pubmed arch 2010 function web ncbi javascript site warning requires management citation external file generate software 06708 school douglasolsonyaleedu usa university robbins primary st waterbury program 64 residency yale medicine ct care perspectives communication lack assess effectively gaps result determine sought quality surveys knowledge
wXKHMr	40	global	blind full controlled trial double neuropathy clinicaltrialsgov randomized text treatment idiopathic milnacipran placebo pain view neuropathies brain accounts 25 nervous system responds clinical treatment molecules painful treat safe serotonin affect neuropathic made fibromyalgia noradrenaline work 50 patients common small inhibitor beneficial medication peripheral effectively dual information provide trials benefit milnacipran
jcIrm	5	global	web student aid program financial certification loan sources grants repaid undergraduate grant federal nonfederal awarded foundation added degree students student professional cases teacher aid unlike receive earned considered postbaccalaureate bachelors enrolled pell 30 financial year total grant amounts 1 depending fulltime 2011 2013 201112 status full plans attend june award
A1z9j3	1	global	consumption bts 49 travel motor vehicle fuel table rita csv excel revised key notes tables vehicles 414 415 individual 411 412 413 highway duty trucks consumption buses light travel vehicles motor fuel include data motorcycles series comparable edition table statistics 49 addition methodology editions highway updated earlier 19602006 data categories
xhFKnR	2	global	press center jpac searches jpac photos historical casualties marine marine 222 jan pearl korean war 2012 harborhickam photos base casualties 13 joint hawaii historical files jpac photo donating tools casualty preferably family personnel member compiled submissions archival photographs frontal showing hundreds photos identifications date case unresolved records analysts teeth aid
idwsOZ	1	global	affordable hud housing cpd shop selfhelp incomeeligible bring directly home investment zone federal decent housing purchasing households state rehabilitating development administers units local resources affordable safe nationwide separate assist designed address homeownership programs renting level oahp shortage partnerships twobedroom percent lack homeowner wage accepted apartment fairmarket decreased increased food realize
xkuaTa	6	global	genomics ncbi integrative pubmed pharmacogenomics strategies 2011 elucidat function web ncbi javascript site warning requires management citation external file generate software usa ca park pacific 94025 biosciences menlo andrewkasarskismssmedu genomewide developed experiments questions relationships based candidate collections systems relevance thousands associations phenotypes yielded suggesting therapy effects association list specific individuals
ykDzba	4	global	week 31612 leveling west white field house playing wing state union video watch enhanced transparency commitment browse house white logs visitor wait executive actions president obama federal receipt tax federal dollars tax spent people petitions create sign house inside white tour interactive major ncaa house energy creation trade held hosted
wT7eLi	6	global	february 15 da14 asteroid earth nearearth miss 2013 2012 discovered bring radii earth rapidly northern sky 4 fade 2013 2012 evening shadow occurring february brightness morning naked magnitude fainter meters traveling 1926 pass close closer sun reappearing approach small eye 35 diameter ring size earths quickly asteroid visibility nearearth spain
eUqZd	1	global	health literacy glassman england network ma originally penny produced coordinator libraries national medicine shrewsbury region technology people defined communication oral services human 112 health department safety 2010 product component objective important included report literacy improved healthy medical identified consumer consent brochures simply apply education bottles situations forms complex health systems
ydg82k	1	global	reveals ncbi hum genet mechanism friedreichs pubmed mol ataxia 2012 function web ncbi javascript site warning requires management citation external file generate software genetics medical department molecular feedback chain frda human lethal suffer group disorders caused fatal alter degeneration inhibition represents respiratory progressive proteins acetylation common decrease defects findings energy
qjNrxe	1	global	natural hazards oregon lightning fires summer fires sprang 27 storms spectroradiometer state passed moderate 2011 image red shows week modis satellite august outlined oregon imaging scores central aqua lightning large resolution 45000 image fires lightning 24 information 26 burning national 28 system acres fire complex black burned local mountains recently
10AQ7M	2	global	leave benefits labor topic fmla department find documentreadyfunction whelpfulinitfbcontent states department united labor family maintained year group health weeks fmla 12 benefits medical leave unpaid jobprotected act requires employees family reasons accommodate employment responsibilities fmla seeks interests men employers designed promote opportunity legitimate women employees work equal leave unpaid reasonable
zzorv3	4	global	congress inauguration american library reason treasures jacksons division february 836 1829 emendationsmanuscript inauguration arrangements 2 printed letter holograph en played significant point legislation national advisors states permitting questions tumultuous administrations 1833 jackson system federal people character inaugural masse role party nullification spoils andrew fore cabinet nullify jacksons attended bank kitchen
FOz9fa	2	global	ncbi bmj functional pubmed health low 2012 association literacy function web ncbi javascript site warning requires management citation external file generate software sophiebostock09uclacuk university london epidemiology health uk department college public information ability mortality read basic older functional related investigate health low adults understand association literacy longitudinal households cohort study
d04vdA	1	global	center tornado watch prediction storm 80 status report 80 watch messages information network service national warnings visit iwin weather interactive 60 mod 20 low 20 low 20 low high 80 high 70 high 90 f2f5 probability forecaster 70 60 table event increased category tornadoes probabilities issuing 5 low moderate events
