wzT4cu	1	global	comparison phys ncbi act pubmed health awayfromhome home 2011 function web ncbi javascript site warning requires management citation external file generate software md eye hopkins institute university johns wilmer baltimore interventions describe design combining home physical information assessing network increase health accelerometers measuring quantified cellular based tracking wellbeing devices activity
sJR8Er	1	global	resource natural house leading transparency world revenues white state union video watch enhanced transparency commitment browse house white logs visitor wait executive actions president obama federal receipt tax federal dollars tax spent people petitions create sign house inside white tour interactive proposed years bring responsive taxpayer transparent program resources return
zkzZ47	1	global	volcanic natural island hazards sea red december zubair pulse 60 violent rising yemeni sea navy activity helicopter captured video northern 23 began sulfor 40 located edge details eruptions dioxide white 2011 red satellite shallow forming eruption coast middecember reported imagery kilometers satellites revealed explosions recent saba showed island highresolution submarine
vojUGe	1	global	partners specifications guidelines mapping library flood hazard fema national guidelines related insurance defines partners requirements flood fema maps program activities product specifications mapping hazard coordination technical documentation nfip products download plugin links plugin require plugins page view pdf adobe acrobat links nongovernment social applications web fema provided reference media companies
xwfS45	3	global	code 21 title federal regulations cfr 216 compounding part pharmacy drug products bcompounded subpart food unsafe cosmetic withdrawn market provided federal section 503aa compounded act removed effective drug products components found exemptions drug phosphate products adenosine drug products cortex adrenal products azaribine drug benoxaprofen products drug products bithionol drug sodium
pEZUl	1	global	10 business sbagov steps follow starting financial links series manage planning decisions prepare legal click easy activities business plan key 10 completing steps learn making starting involves successfully tools create start written resources map run business plan guide business expanding financing free plan services counseling relocating training advantage securing preparing
FPPzpD	3	global	brown listy target ncbi lek fat bratisl tissue pubmed potential 2012 function web ncbi javascript site warning requires management citation external file generate software brtislava institute clinical slovakia medicine preventive ginteremilmailtcomsk stores proposed global human world reasoning uncoupling 1 treat proportion considerable fig 5 scientific brown byproducing animal combination thermogenin
yJvS1W	1	global	load med sci ncbi training sports exerc pubmed rpebased 2004 soccer function web ncbi javascript site warning requires management citation external file generate software castellanza italy mapei ss lab mapeisporttinit varese human performance control methods proposed correlations al assess determine aspect apply sessionrpe based monitor quantify load response coaching internal
xFDF0B	1	global	city history cincinnati cincinnati states coinventor established united served 1853 1 department engine fire paid ohio greenwood fully departments practical april chief miles professional steam cincinnati reasons bonner abel principal engines fight destroyed source 2 alexander engine march fire occurred construction greenwood worlds fully miles steampowered minutes locomotive proved significantly
GDQc2c	1	global	kids snacks healthy tip medlineplus encourage health choose page related medlineplus options kids treats sweet encourage crave healthier parents healthday news chips children choose nutrition academy suggestions offers dietetics mobile twitter subscribe version updates follow email rss national guidelines accessibility library human march institutes quality 20 copyright privacy health bethesda
GBRjjS	1	global	full text clinicaltrialsgov glioblastoma trial imaging cilengitide view glioblastoma brain cilengitide find vessels clinical newly effect purpose nonresectable supplying main oxygen cells inoperable tumor trial patients diagnosed nutrient blood measuring medication cancer glioblastoma cilengitide duration pharmacokinetics prolongs deals additional similarly addition data investigate markers pharmacokinetic clinical treatment collected pk nonresectable
srHO6N	1	global	internship usda programs summer strongly give consists employment career usda educational sip located program assistants internships field scientific internship paid gain position opportunity areas institute headquarters experience technical future students enrolled professional usda ambassadors washington county intern agricultural service fl research program health development plant animal attend students dc leadership
j0A00u	3	global	division solid paper shredding services waste picnic creek general needwood area parkdetailed lake 3 beach map regional park directions areas md 20855google rockville drive 15850 rock pdf 10 2 pm 20985google md school map kensington albert high 11135 newport einstein mill road 10 2 pm provided office paper systems services
zHsrnj	4	global	thomas congress text bill library 112th 20112012 hcon ih 107 force misdemeanor high sense constitution section offensive crime 4 constitutes authorization expressing congress president article ii clear prior impeachable act military jones committee judiciary submitted concurrent mr resolution referred force misdemeanor high sense constitution section offensive crime 4 constitutes authorization
yuI4fX	2	global	benefits corps exploratory army brings partnership headquarters archive districts drilling news engineers operations corps photo blackson operator rig roberts district army lake hill john 2012 march lee dam nashville drilling 14 center saddle conducts districts drill baltimore engineers roberts greenyellow photo site manager sarah adcock corps district army mark geologist
f0dwED	4	global	reform results winning future responsibility department education ranking committee miller kline member chairman members obamas today agenda president education opportunity talk committee senate reduce dual administrations education secure spoke efficient commitments investing week emphasized budget spending future months grade pass reflected grants learning issues span pell written statement today happy
spIzN9	5	global	aquatic ncbi aquat pe research mechanistic toxicol toxicology pubmed 2011 function web ncbi javascript site warning requires management citation external file generate software mhahnwhoiedu biology united ma oceanographic 32 states 02543 woods ms department hole institution 30th emerging aquatic focus effects years relative evolutionary perspective questions networks issues factors provide
wPVfls	2	global	watersense awards epa content area jump main navigation epas adobe reader files free link acrobat learn pdf page view process award application closed year partner 2012 partners program year watersense awards recognizes 2008 launched waterefficient irrigation construct distributors certification contribute year dedicated systems promotional bring design innovative partner market partners
GBaIWK	1	global	soc neurophys ncbi neuroscience pubmed cogn affect neurosci existential 2012 function web ncbi javascript site warning requires management citation external file generate software psychology salzburg university johannesklacklsbgacat austria department consciousness focus defended identify ingroup proximal roots deathunrelated death knowledge late unpleasant equally mortality increased effects words motivationally distraction stimulus interestingly
pl0Wby	1	global	ipad visualization explorer nasa home planetary earth delivered visualization research astrophysics heliophysics explorer nasas ipad science nasa stories coolest ipad 103 version ios 43 ipad story apple image nasa screen visualization explorer universe nasa animations images visualizations sun features exploring story findings topics spacecraft nasa planets earth include ipad delivered
erxjPu	1	global	evolution ncbi pacific ocean pubmed sea japan gene 2008 populat function web ncbi javascript site warning requires management citation external file generate software 11 tokyo residence imperial chiyoda japan 1000001 chiyodaku evolutionary mean1 1506272 noteworthy supported numbering including discrepancy japan parsimony freeswimming principal 1 group 21 22 23 95 samples
gTIQai	4	global	parent miami academy county dade department education resources family community county initiative questions find group additional district implementation engagement strategy call turnaround resources academy runs vitti part school miami attached nikolai superintendent directly national share webinar pass information documents kind research encourage sig youll week supporting parent wanted working tpa
zA5Lrr	1	global	courses emi schedules programs emi featured training center emergency national video selection participants criteria applicants prerequisites emi meet limited generally year number information management participants international emergency httptrainingfemagoviaemasp institute emi courses accommodated residents form admission general the755 application fema 119251 reimbursement oncampus regional stipend courses occurs applicants office process netc
9fTW0g	1	global	sci putative contributors food ncbi rev nutr obes pubmed crit 2009 ten function web ncbi javascript site warning requires management citation external file generate software pennington center usa la university infections system research state biomedical rouge department obesity baton louisiana emilymcallisterpbrcedu emerging global reviewed iatrogenesis sleep signs alternative ambient program
zERg7Y	1	global	costly overhaul tape examples health care miscalculations red tax cost recovery countrys share recent prime dollars spent reports gus economic carelessness examples office years cost signed taxpayers law federal pledged trillion health recent congressional read price cbo report president nonpartisan care 10 18 bill budget accessible crushing tax solutions overhaul
AfF9pV	3	global	wildlife fwp fish parks montana internships grade college learning relates department learned majorminor curriculum receives internship credit student world shortterm applying work experience academic applies position involves fish votech private accredited learning open native parks program public higher internship universitycollege includes montana community student wildlife american enrolled institutions positions secure
weE7ip	2	global	treating arq full multiple tivantinib text 197 cmet myeloma clinicaltrialsgov patients inhibitor relapsed view arq cancer tivantinib needed 197 cmet stop cell enzymes growth rationale blocking inhibitor cells arq 197 cmet ii relapsed multiple purpose phase treating inhibitor myeloma trial patients works studies side effects objectives primary secondary arq 197
86tmzQ	2	global	intercessory heart ncbi study pubmed 2006 effects therapeutic function web ncbi javascript site warning requires management citation external file generate software israel mindbody center usa institute medical school hbensonbidmcharvardedu medicine harvard boston department ma beth deaconess illness supported influence cabg addressed prayer surgery graft provided recovery trials coronary 1 clinical
xgcKTX	1	global	apod march 17 ngc spiral edgeon 2012 galaxy 2683 fascinating discover featured written image explanation day photograph astronomer cosmos universe professional march 17 2012 2683s blended scattered sources bright distant remarkably galaxy northern ngc young forms clusters refracting colorful background spikes lacking large round telescope foreground elegant images constellation blue
zui2a7	10	global	home usda kyf compass food farmer compass usda videos discover market pictures field systems farmer local supporting food regional watch compass segment case read learn growing studies kyf computer file compass open acrobat experience reader pdf save map 20092011 years visiting food regional programs farmer usdasupported shows interactive local projects
pBygaE	1	global	report science nsfgov special nation instruments positioned states observatories united hills susquehanna granted state scientists shale water precious cycle observatory resource zone pennsylvania university critical learn engineers civil states engineering united zone detail state critical build test penn european water environmental understand chris cycle observatory working duffy beds professor experimental
zNrCDh	2	global	dipeptidyl bmj ncbi inhibitors pubmed treatment peptidase4 type 2012 function web ncbi javascript site warning requires management citation external file generate software thessaloniki 54642 diseases metabolic medical 49 konstantinupoleos aristotle greece department university unit adults assess dpp4 compared type mellitus inhibitors safety combined metformin efficacy drugs 2 diabetes peptidase4 dipeptidyl
AoM8vY	1	global	coverage contraception decision employment equal commission opportunity challenging civil vii facts insurance issue occured exclusion commission 1964 discrimination decision health statement policy applied amended plan formal prescription rights charges title contraceptives reasonable act finds 2000e female seq violation 42 parties engaged cost employment insurance usc title 1964 allege offer unlawful
xzMFCp	2	global	photo house january white day 2012 state union video watch enhanced transparency commitment browse house white logs visitor wait executive actions president obama federal receipt tax federal dollars tax spent people petitions create sign house inside white tour interactive january house check offices photo 2012 picks white day office deputy
19AnNk	8	global	congress library teacher resources primary library effectively librarys offers collections digital teaching development congress vast classroom sources materials teachers professional classroom find state materials meet standards classroom congress power ways discover library primary bring sources discuss discover sources guides librarys information copyright source ways citing easy begin tool primary classroom
qN3R5b	3	global	postwar timeline anticommunism war early edsitement years america cold interactive presented examining alliance defined turbulent period states cold united sentiment union studying ideas relations justified aftermath war timeline tool anticommunist world ii events american overreaction era history soviet interactive share partnered thinkfinity lesson find educational save resources plans free edsitement
wknHu4	1	global	med ncbi medical practice transl philos humility pubmed epistemic 2012 function web ncbi javascript site warning requires management citation external file generate software boulevard schwabaipfwedu usa coliseum university philosophy universitypurdue wayne 46805 department indiana 2101 fort untold judgments rubric weekly conclusions fickle physicians rise commitment fall accompanies unevenly accompanied inconstant
A113rm	140	global	corps announcing creation blog fema discrmination age isnt 1824 set adults enter due mentioned apply odd develop 21 young long program wwwamericorpsgovnccc leader team offers americorpsnccc part workforcethat skills 18 age opportinuty nccc limit learn sector government workforce private expansion develop skills workers job cares join citizens corpssee httpwwwcitizencorpsgov tax
zZ1zsG	2	global	inmate cropper 091432 lumley committed perryvillesan murder throat brent cell juan response inmate unit 7 department contraband knife arizona march stabbing cropper murdered locked 1997 place officer corrections found shutts miller marshall steinle sentencing defense richard robert heilman start 3 joseph roland 6 colehon john resentencing plea honorable judge 2
d0iKKk	36	global	corps monthly themes preparedness citizen 2011 events communities uniting preparing nation locate login contact council moved page httpcitizencorpsgovnewseventsthemes2012themesshtm andor links update questions bookmarks citizencorpsdhsgov email readygov corps notices disasterhelpgovcitizen plugins home fear register privacy federal faqs femagov citizen widgets act policy dhsgov data foia bulletins annual reports servegov contact bannersaccessibility
d28DLi	2	global	center watch thunderstorm prediction severe storm 84 status report watch messages 84 information network service national warnings visit iwin weather interactive 20 low 5 low 30 mod 30 mod 30 mod 20 low high 70 f2f5 probability forecaster 70 60 table event increased category tornadoes probabilities issuing 5 low moderate
wJPcoM	3	global	inmate 057713 ellison opinions handsproceedings charles victim committed previous 24 death pecuniary smith tape pending judge february lillian january verdict release vincent homicides direct depraved defense home richard robert moon masking appeal arizona choked conviction trial published bound commission convicted start joseph cords prosecutor suffocated telephone heinous gain broke circumstances
bfLDKT	1	global	frb abstract feds 201019 stefania don min wei 201019 kim damico produces results years leads paper fit expectations factor real premium risk inflation difference reveal term counterintuitive identifying large yields common consistent comparable rate pricing measure proper estimated incorporating errors realtime nominal tips conditions contrast movement perception recently generate improved
z6z8TC	2	global	apod 15 flare sky gammaray solar march 2012 fascinating discover featured written image explanation day photograph astronomer cosmos universe professional 15 march 2012 remnants energies photons sky black eruptions march activity view telescope series energy vela maximum intensity astrophysical images dense space sun recorded dominated 7 orbiting faded galaxies approaches
wQ19tF	1	global	apod scale march 12 universe interactive 2012 fascinating discover featured written image explanation day photograph astronomer cosmos universe professional 12 march flash player version recent adobe 2012 bring human galaxy flash proportion window spread discovering humanity descriptive familiar stop speckled possibly items smoothness vast bar sizes large small version ten
yoN6j4	1	global	ontime bts january yeartodate summary 1 airline performance table rita 2012 numbers yeartodate years csv excel statistics transportation ontime source bureau airline data 2005 number ceased 15 20 varied carriers 19 april airlines aloha 18 time 2011 2010 2012 march hawaiian started reporting 16 november 2008 1998 11 10 february
yrfXg6	2	global	inmate 136521 anderson shot agreed held kill poyson leta cut 21 bludgeon finally kagen gave hit killed bread ended bobby 50 rock trailer lantern crushing decided home driving robert knife eating august frank night hitchhiking hours death wear boy 39 yard dinner cinder block son county delahunt awoke 15yearold letas
2PQUFP	11	global	business topics tax topic 509 home irs resources deduct home denial employee general business deductions part expenses selfemployed expense regularly deduct business exclusively expenses part home attorney trade determine principal management personal businessuseofthehome exclusively location employee administrative regularly activities employers part convenience den applies fixed requirement deduct purposes expenses substantial
sylCS	1	global	active galaxies introduction quasars additional links topic quiz topic fact cool galaxies faqs galaxies faqs active quasars level topic article advanced additional resources give topics related black galactic holes rays retired energetic cosmic live fastest quasars generate educators nctm nses standards holes black booklet hidden galaxies lives booklet lesson plans
yhHHA	5	global	united constitution official states summer 1787 cooperative debate 25 delegations hall legislators government existing day articles amend redrafted art people house frame constitution federal representatives state closed issue independence power delegates members obtained central minds revise electeddirectly philadelphia statesmanship draft convention compromise adjourned present 14 work debated states discussion sessions
FPEstc	1	global	sci human ncbi int res odds sex pubmed environ birth 2011 pollut function web ncbi javascript site warning requires management citation external file generate software 1 center biomathematics muenchen institute landstrasse ingolstaedter research zentrum german scherbhelmholtzmuenchende 85764 health neuherberg helmholtz germany environmental biometry japan fallout global obtain dose facilities atomic
98Mjey	5	global	center watch thunderstorm prediction severe storm 78 status report watch messages 78 information network service national warnings visit iwin weather interactive 20 low low 20 low 20 low 40 mod 40 mod high 70 f2f5 probability forecaster 70 60 table event increased category tornadoes probabilities issuing 5 low moderate events
wZP6zV	1	global	loss overeating risk double study medlineplus memory pages related medlineplus risk people contends healthday news eat 12 feb older study sunday memory impairment people authors 6000 disease alzheimers eat memory risk early 70 sign day older double study calories deficits 2100 excessive researcher clinic neurology geda caloric consumption ariz friendly
yvYGE0	2	global	tnt events ussocomnps tnt events operations emerging experiments cooperative quarterly government ussocom venues school conducts accelerating tnt capability enhance testbed year special network representatives identification cooperation warrior avon naval industry conducted tactical efforts facilitate sof ca primary private determine experimentation working opportunity interact support assessment relationship postgraduate park delivery experimentations
aRmANJ	1	global	office newsroom governor battlefield corps county news ground standing army make christie long fought gloucester war red hard sense sweeney bear expects environmental reason andrews burden senator revolutionary bank fort governor conference project thing good doesnt economic south congressman river jersey placing mandatory corps taxpayer actions tons millions standing residents
xx3s86	6	global	cord curr ncbi rep neurophysiol stimulation spinal pubmed pain 2012 headache function web ncbi javascript site warning requires management citation external file generate software johns avenue usa critical department care yguan1jhmiedu ross division pain 720 anesthesiology medicine 21205 md hopkins university 351 rutland baltimore summarizes significantly findings produces reduce society
xp4zmf	2	global	arterial med ncbi pet nucl coronary fusion pubmed 18ffdg uptake 2012 function web ncbi javascript site warning requires management citation external file generate software heart center institute medical angeles los cedarssinai california imaging department angiography examined stenting controversial ct percutaneous detect culprit remains pcs sites coronary inflammation infarction uptake cta
wCIR3s	2	global	inmate 223626 chappell shackleford previous apartment police young complex march early cutting report continued morning night found competition year investigation dating frustrated missing kristal attention hours incident death choked carried brusing supply scene son involvement drowned proved 2 relationship child shortly 11 12 middle air called affection ordered december kristals
6GHqO3	1	global	development medicin pathol ncbi med forensic 1992 pubmed function web ncbi javascript site warning requires management citation external file generate software center helpern university forensic wichita ks sciences state 67208 international milton thomas founded held manchester chair belfast northern duncan surgeons program wales kingdom activities schools areas professors school georges
yvUDs3	3	global	entire wise jet space universe sky mapping infrared nasa propulsion images laboratory browse category entire wise universe sky mapping infrared infrared observed images sky explorer allsky part data mosaic entire wise covering widefield survey release spherical methods map surface sphere oval open projection thought dimensions make slices sky astronomers 2d
zyOVWU	1	global	gpm gcpex notes field experiment precipitation blogs coldseason 29th global snowfall overarching multifrequency algorithms data estimate canada gpm ontario goal precipitation snow microwave environment experiment observations cooperation coordinated falling improve remote 2012 ability measurement collection detect passive active 17th sensors unique model coldseason february datasets gcpex characterize january seek microphysical
9fDQFs	1	global	code edition fdsys annual regulations browse federal represent code codification chapters 2841 title issuing updated government rules material bear subparts areas level 50 large subdivided revised edition titles year calendar cfr subject specific federal broad section refer agencies regulatory chapter 1727 annual april citations published staggered basis regulation permanent sections
qnkW8T	1	global	natural wyoming hazards fires montana summer upper acquired fires morning closer 23 top wyoming spectroradiometer late version moderate midwest image filled modis satellite august wide southern terra montana imaging clustered lower 2011 lightning ignited skies smoke resolution view wyoming burning marked visible fires images cloud top hidden image red fire
