GFh4jz	1	global	education videos career corporation loan multimedia hearing dick student senator testifies durbin archives colleges work forprofit resident problem loan chaired washington private hearing examine college education crisis graduating america chosen corporation dick find danielle role struggled pay field run students higherinterest pushing testified dc harrington student debt loans design jokela
ytZx5B	1	global	cord ncbi marapr vocal granuloma pubmed treatment otolaryngol acta 1989 function web ncbi javascript site warning requires management citation external file generate software central phoniatrics university finland otolaryngology department hospital kuopio allergy years laryngomicrosurgery obstruction surgical participate tendency postoperatively 27 group steroidantibiotics oesophageal 4 8 recpat prednisolone jetventilation therapy disturb
l6MpyI	1	global	sec form accurate reviewed information necessarily commission reader complete exchange completethe securities assume determined filing 1 identity issuers information business contact 2 place principal persons 3 related clarification response clarification response clarification response clarification response industry group 4 size 5 issuer federal select 6 claimed apply exclusions exemptions type filing
zMJqTX	6	global	cancer fatty colon clues diet medlineplus link pages related medlineplus theyve 15 fatty cancer diet clues increases thursday discovered colon healthday news march researchers risk sapienza questions cancer colon pathology linked university factors diets things research molecular temple independent biology risk fels diet universitys news institute study author lead suggests
GzNxYS	1	global	opioid prescribed consuming pain ncbi pubmed 2008 endocrinopathy women function web ncbi javascript site warning requires management citation external file generate software school usa family university practice davis california hwdaniellaolcom department redding medical opioidassociated years ceased nonmalignant menses adrenal chronically contributions osteoporosis density histories production intrathecal decreased indicating characteristically hormone
FR4Bwf	1	global	target plos ncbi method pubmed evaluation enrichment 2011 function web ncbi javascript site warning requires management citation external file generate software kingdom united hinxton cambridgeshire wellcome institute genome sanger trust campus resequencing compare unclear variants methods sequence discover 50 assess frequency insolution estimating applicability size accuracy 20 remains hybridcapture coupled
6T7lwo	2	global	respiratory topics protection health safety illnesses mists cancer deaths workplaces environments states addressed lung compliance employment avert industries specifically united standards marine workers hazards gases sprays 5 construction estimated longshoring impairment general diseases protection dusts million protect hundreds standard harmful terminals death wear vapors 13 respiratory oxygen fogs respirators required
x08nMv	1	global	vet genotype ncbi bov pubmed geographical rec association 2012 function web ncbi javascript site warning requires management citation external file generate software surrey lane agency haw addlestone tonygoodchildahvla kt15 veterinary 3nb gsigovuk health uk animal woodham laboratories weybridge ahvla p001 badger 26 northern 0 p0001 samples wales weeks greater uninfected
GDd9Vw	16	global	invasive study medlineplus patients hernia easier procedure page related medlineplus invasive results chronic surgical healthday pain compared minimally hernias research treat approach march monday news recovery faster 19 traditional finds procedure option expert older strategy cases repair washington isnt brunt onesizefitsall dr circumstances louis university michael st professor surgical hernia
43f0cO	231	global	national cave jewel monument search passages wilderness color appeals human revealed wealth national remains service cave formations surveyed underground maze mystery lure scientific park glimpses longest curiosity world 160 explorers resource immerse fragile jewel brilliant miles splendor mapped national gearing planning excellent exciting trip resource chronicle cave jewel monument calcite
zSymyY	8	global	status measure amendment senate measure constitutional appropriation conam systems house data detailed adobe adobes visit require reader page items download acrobat instructions links established entities review responsible sites pages content state internet endorse external advised legislature hawaii maintain encountered make visit webmaster 508 ada problems address effort pages comply rehabilitation
FSeUL1	4	global	randomised ncbi bmj credibility pubmed effects claims 2012 subgroup function web ncbi javascript site warning requires management citation external file generate software permanente kaiser center usa research health northwest portland credibility representative controlled published randomised sample investigate effects authors recently claims trials subgroup review systematic core medline defined national library
ykP9ih	1	global	candidate vav3 bull analysis ncbi pubmed schizophr sc gene 2012 function web ncbi javascript site warning requires management citation external file generate software school university nagoya graduate medicine 1department psychiatry japan gwas glu741gly 1p133 genomewide brain 013 superior candidate temporal controls signals detected 321 screening samples missense morphometry rs1410403 suffering
uUJDr	2	global	classicnces kids zone graph create nceskidsimagesstaticbannerjpg 75 670 addflashnceskidsimageskidsnavswfvarskipnavskipnavvarhomenceskidsindexaspvartoolsnceskidstoolsindexaspvarcrunchnceskidscrunchindexaspvargraphnceskidscreateagraphvardyknownceskidseykindexaspvargrabnceskidsgrabbagindexaspvarchancesnceskidschancesindexasp picture taylor thousand heard words worth point magazines find web graph explain constantly charts quickly helps interest show homework impress understand world publications fun businesses people site numbers special information things difficult visually communicate problems chart illustration reason complicated great newspapers
c8c6T7	1	global	uscis study civics materials test questions pass tools answer prepare materials correctly 6 interview 10 started test 100 study list civics naturalization asked additional section products select short naturalization process overview video test providing highlighting citizenship rights responsibilities civics video history audio format official list answers civics mp3 questions test
xRdjfn	5	global	adults ncbi older undernutrition pract fam pubmed 2012 function web ncbi javascript site warning requires management citation external file generate software division school boulevard usa 63104 geriatric university grand st medicine internal morleysluedu saint louis department 1402 mo south major weight wasting overview nutritional sarcopenia utilize cachexia subtle protein tools
c8brsQ	7	global	center watch thunderstorm prediction severe storm 81 status report 81 watch messages information network service national warnings visit iwin weather interactive 20 low 5 low high 70 40 mod high 70 40 mod high 90 f2f5 probability forecaster 70 60 table event increased category tornadoes probabilities issuing 5 low moderate
n95Tfj	1	global	prek students globe utilize research puddles mud program louisiana atmosphere concept group young environment scientific aspects ruler measurement world areas school magnet steps guiding gauge set globe year led factors selected scientists approach measuring terms everchanging water observing prek study length introduced relation alexandria height learning elementary tools stigall teacher
rf1NbF	2	global	houston science nasa story streaming downloadable file audio listen september 2002 mom 9 family back seat heard home rarely travel trip start good parent thousand begins hundred 15 cry thing miles car minutes years traveling earth mars approach red closest couple million backat months 35 planet miles houston james inside
xGyF5F	1	global	march office governor photos 7 event 2012 trenton strengthen diane chris larsen steven allen chair affords conference nj antibullying governors introduction fix holds legislation christie state statehouse 7 announce bipartisan 2012 huttle march garden ceo agreement protections press law peterpaul officetim equality valerie assemblywoman goldstein vice wednesday governor luanne remain
qdHkOT	2	global	phys ncbi parental tv nutr act int concerns child pubmed 2011 behav function web ncbi javascript site warning requires management citation external file generate software school university sciences health uk nlpearsonlboroacuk sport leicestershire exercise loughborough limited childs environments adolescent concerned young environment parents time translate associations aspects watching rules child
awFBvd	34	global	blue parkway ridge search vistas mountains appalachian meanders protecting special blue slow ridge opportunities enjoying revealing longrange diversity relaxing views closeup makes pastoral parkway highlands animals unlike 469 region drive experience plants stunning miles country providing landscapes paced summer handson mountain offer developed guided programs life demonstrations traditional cultural campfire
xiLGBB	1	global	irishamerican proclamation house month heritage white presidential 2012 state union video watch enhanced transparency commitment browse house white logs visitor wait executive actions president obama federal receipt tax federal dollars tax spent people petitions create sign house inside white tour interactive house white office press secretary irishamerican 2012 month heritage
Ag4d7	3	global	apod october 16 2006 saturn shadow fascinating discover featured written image explanation day photograph astronomer cosmos universe professional october 2006 16 discovered bright earth scattering giant saturns main spectacular outermost dark shadow saturn spacecraft night side view unexpected hard back eclipsed pale blue sun rings moon orbiting newly recently hours
GAGCMo	2	global	conference communities house safe watch lgbt live schools white state union video watch enhanced transparency commitment browse house white logs visitor wait executive actions president obama federal receipt tax federal dollars tax spent people petitions create sign house inside white tour interactive leaders people house community transgender partner education justice
lmbBTR	3	global	intake ncbi sweetened nutr pubmed artificially clin soft 2010 drinks function web ncbi javascript site warning requires management citation external file generate software institut centre denmark programming lurssidk statens copenhagen serum fetal weight number outcomes high alternative linked drinks minimally adverse health safety disputed sweetened gain intakes artificial women consequences
FOlrL3	7	global	shop society men toys maintained benefit making apparently women items online group view marc record item view responsibility rights assessment distribute library httpwwwlocgovrrprintresrightshtml information grant generally publish collections congress permission material restrictions deny rights page responsibility rights assessment selection describe high represented individual images generally online multiple records catalog groups
w22p7e	1	global	ottomans lots big crushing hazards due entrapment finger recliners recalls glider named washington instructed voluntary consumers illegal commission safety cooperation announced firm product stop dc recalled resell attempt immediately products today recall consumer ottomans leather recliners products microfiber glider units 375000 columbus lots big retailer ohio adults exposed crushing posing
GBEXrT	2	global	conference communities house safe watch lgbt live schools white state union video watch enhanced transparency commitment browse house white logs visitor wait executive actions president obama federal receipt tax federal dollars tax spent people petitions create sign house inside white tour interactive leaders people house community transgender partner education justice
32xAiI	2	global	massdot developers page transportation massachusetts authority bay authorities transit regional massachusetts authority port links static information working realtime data interested developers resources meant transportation serve made massdot found page updated relationship agreement principles data 11132009 developers license massdot acceptance note acknowledges massdots page mbtatransit highway rmv massport planning challenges web
2HT2Lu	3	global	ncbi preinjury warfarin elderly 2009 pubmed patie trauma outcome worsens function web ncbi javascript site warning requires management citation external file generate software division lehigh network usa 181051556 pennsylvania traumasurgical critical health allentown department surgery valley care twocenter ffs elderly examine standing admission warfarin trauma preinjury injury mechanisms anticoagulated designed
8faZ4	1	global	resident aliens citizens abroad small businessselfemployed taxpayers international topics irs resources reside estate resident tax alien estimated united generally returns income subject worldwide paying rules citizen abroad states gift filing duty file resident allowed year alien 2month calendar pay due citizen residing return june regular date overseas 15 extension requesting
cl1ux8	1	global	radiation air pollutants epa jump main content radiation air search area contact epa information links air specific pollutants page aerosols asbestos carbon monoxide chlorofluorocarbons cfcs air pollutants criteria ozone level ground hazardous pollutants haps air hcfc hydrochlorofluorocarbons pb lead mercury hg oxides nox nitrogen matter pm particulate propellants radiation radon
aZMetW	22	global	poster epa sunwise contest jump main content contact home sunwise foundation rules uptodate including information contest official visit forms shade entry andor sunwise contest state interested promoting call sunwiseepagov supporting 202 poster 3439378 contact shade 2011 national winner seventhgrader michigan jolie family students school jolie congratulations contest participated 2011 crayola
n9HyGl	1	global	natural inside hazards eye irene bearing caicos mission ready daylight directly images irene late 23 trmm eastern hurricane tropical parts passed 2011 universal pm measuring rainfall satellite august time 711 intensify capturing 2311 storm islands reveals wall image deep visible corner irene cloud blue shown northeast eye area trmm portion
t2RiGx	1	global	oxidantrespon ncbi biol nrf2b paralog zebrafish chem pubmed 2012 function web ncbi javascript site warning requires management citation external file generate software biology usa oceanographic 02543 woods massachusetts atimmelaragywhoiedu department hole institution crosstalk displayed results report including expressed human affect protecting activating duplicated 1 microarray nrf2 tertbutylhydroquinone factor p53 indicating
bzLqwY	3	global	center tornado watch prediction storm 92 status report 92 watch messages information network service national warnings visit iwin weather interactive 40 mod 20 low 20 low 20 low 10 low 10 low high 70 f2f5 probability forecaster 70 60 table event increased category tornadoes probabilities issuing 5 low moderate events
xrJu4W	1	global	apod 28 february opposing tails comet garradd 2012 fascinating discover featured written image explanation day photograph astronomer cosmos universe professional february 28 2012 show yellow subtle captured point hues tail include gasses showing ionized tails approach large surrounding earth blue sun ice coma cyanogen drifting directions carbon colored ion comet
eVdYT	2	global	forms publications irs resources methods links tax electronic forms provide media irs capabilities access source basic print function acquire additionally advanced search irsgov official materials publications published links schedules tax individual download return taxpayers irs forms income mail order recently business advised packages needed filing instructions longer receive paper page
XczX0	1	global	duty bts average vehicles efficiency light fuel table 423 rita csv excel gross revised unavailable weight rating data average mpg gvwr miles key vehicle fuel gallon cafe corporate economy passenger comparable 19602006 2axle 200709 data 4tire car vehicles duty wheel 1994 1980 passenger previously light efficiency motorcycles includes short base
zk9V8R	1	global	med engl ncbi keratosis mebutate pubmed ingenol 2012 actinic gel function web ncbi javascript site warning requires management citation external file generate software school usa mount medicine dermatology york department sinai 0015 005 keratosis ingenol surrounding skin extremities area topical treatment clinical safety field scalp weeks treating investigated efficacy actinic
FPNWoR	1	global	parasitol toxoplasm ncbi caused behavioral res pubmed mice 2012 function web ncbi javascript site warning requires management citation external file generate software gatjusbiolunilodzpl 1216 immunoparasitology university lodz banacha department 90237 poland results including regions regiondependent controls environment cysts definitive evaluate uninfected preference experimentally altering parasite hosts activity gondii smaller significantly
sp7tV	1	global	trees moon roosa earth service 1971 personal late program astronaut containers forest return trees joint part module world apollo roosas 14 january tree nations project seedlings small jumper mitchell launched shepard surface states walked trip packed united moon orbited lunar nasausfs command tribute afternoon hundreds alan kit planted 1976 31
3KiV4l	4	global	congress wednesday library events 9 public 2012 washington back library subject information check charge offers location public congress dc free site schedules change events latest noted theatercontact floor 1130 330 visitors 130 7078000 1030 ground 230 pmlocation 202 pm top thomas pmpaul 130 signs ground buildingcontact floor noon 7071519 1
yCbIHa	1	global	suomi image viirs visible nasa earth npp composite image number surface swaths wisconsin earth 24 earths renamed verner late instrument 4 2012 satellite recently viirs nasas npp earthobserving university suomi aboard january honor launched generation earth research satellite nasas satellites changing npp earthobserving suomi facets observe radiometer viirs instruments carrying
y7mqmw	7	global	apod march 14 sun angry erupting 2012 fascinating discover featured written image explanation day photograph astronomer cosmos universe professional march 14 2012 suns years earth captured current giant system field baddest plumes plasma magnetic puffs colorful dark cool twisted tendril inverted ejections shown sun particles chromosphere bird pictured emitted sunspot
GBP9Tp	1	global	catalog pia02488 page reveals 2590 image 127 feature conditions spacecraft earth range depression eros feb 2000 long 3 asteroid 5 low approach heartshaped shows oblique march 204 earlier craters mysterious lighting separate kilometers snapped day mosaic 11 13 created shape km illusion heart miles 1609 rendezvous resolution left planetary managed
A3vOk9	1	global	mission solstice prometheus cassini images home image details image collision ring 86 moon white drapes outermost prometheus kilometers shaping center bulge 53 miles learn small perturbs soft encke kinky discontinuous image visible ringlets ring rings ringplane 1 stars degree southern gap background ringlet unilluminated learn view side left acquired image
Rlw1	4	global	abstract statistical 2012 comprehensive united authoritative abstract political summary states statistics economic statistical published organization 1878 social reference abstract sources statistical information convenient print web volume guide organizations census federal agencies analysis labor sources economic statistics bureau private include data abstract agencies private sources data organizations census federal bureau guide
ng5JRq	3	global	buildings tornado selecting protection fema refuge areas fema 431 heavy danger life states tornadoes united offer damage include public buildings locations administrators protection schools areas building loss property kalamazoo moore augustine damage high engineering examined elementary firms teams tornadoes designed 1980 oklahoma presents 3 representatives struck 1999 buildings building booklet
Ar03dX	2	global	country alerts specific adoption notices intercountry adoption learn process prospective adoptive parents guide statistics requirements process countrys adoption learn eligibility countries alerts specific important notices find developments 2000 act citizenship child code family point days leads parents childs including complete apply decisions time required increase judges issue end travel 1
zZ7C76	1	global	conference atmospheric center support ttn regulatory modeling 10th epa jump main content atmospheric network transfer support regulatory modeling technology center search area contact epa epas adobe information reader files free acrobat pdf page view comment 30th people memorandum period 13th held aptil rtp respect 250 mandated campus conference open prior
FQ195p	1	global	advisory generating march 21 city light community project solar seattle start sealth map compass photo cityweb building map capitol light rail hill holden photo michael fire department seattle leschi fireboat photo mcmillin dennis neighborhood bus sunset seattle photo east colfax map sealth 5th denny chief photo cityweb search back news
t34wS6	2	global	gorges partnership conservation jocassee represent beauties produced jocassee carolinageorgia carolinas cut hills character lake uppermost carolina eastward elevation represents scientists virginia escarpments forested unique precipitation condition lost settings toxaway scenic drop miles surging waterfalls chattooga eastatoe devils series rivers laurel 1904 blue recorded uniform state indian birds occurs vertical saluda
zj7Nz5	2	global	climate delineation zone manage ncbi pubmed environ evaluating approach 2012 function web ncbi javascript site warning requires management citation external file generate software box 59030 walking ecology usa tercekyellowstoneecologycom gardiner 1085 mt shadow po seasonal similarity supported focus produced affect principal based zone application similarities wyoming finally greater results interior
oqPMKY	51	global	mcfp outreach weekly 4 2012 illness mental reduce month stigma education raise health awareness designated outreach importance financial private including repaying managing loans difficulties bureau loan protection student complaints accepting borrowers default taking cfpb consumer tip move find allowances decisions information tenth make relocation weeks visit force corps brain experts
wav9zq	2	global	ass independently ncbi consumption res nutr pubmed dairy soy 2011 milk function web ncbi javascript site warning requires management citation external file generate software loma school usa biostatistics los university angeles epidemiology health vmatthewsmyriverbendorg department linda ca public 106112 hypothesized 091 ci years ptrend osteoporosis based calcaneal 95 028 dairy
ykwWLb	2	global	policy genetics public fellowship sector serving capitol executive wishing human decisions staff cosponsor policy branch unique assignments guiding translated people national society officials institutes genetics integration research fellowship critical health hill public scientific viewpoints extent improved institute transition experience american greatly nonprofit tools legislative genomics perspectives working clinical fellow professionals
130rZ5	2	global	island national seashore assateague search enjoy coastal move rest existence continent sandy recreated visit forests day live bays life recreate relax time assateague maritime explore marshes waves beaches island salt ocean edge place adapted wind enjoy make thrive horses beauty assateague extraordinary distance island continue wild enjoy barrier ages visitors
FQX7oC	1	global	heartburn reflux damage medlineplus chronic teeth acid pages related medlineplus reveals heartburn chronic healthday esophagus acid gerd damage thursday research 8 march mouth news condition severely reflux disease worried teeth gastroesophageal influx people sharp ultimately lead pitted suffered erosion thin worse wear half condition healthy study months disease tooth patients
zw5Zip	1	global	shot adults whooping medlineplus cough panel pages related medlineplus adults vaccinated experts bacterial feb 22 infectious recommended health uncontrollable coughing news cough disease triggers dangerous whooping wednesday infants pertussis healthday control adults advisory vaccinated including 65 committee recommendation aged centers preventions vaccination specifically recommended voted include vaccine expand panel older
vDVN9S	1	global	house white state union video watch enhanced transparency commitment browse house white logs visitor wait executive actions president obama federal receipt tax federal dollars tax spent people petitions create sign house inside white tour interactive event live facebook discussion participate click member facebook give click questions comments httpwwwwhitehousegovvideo ondemand library
wGx4J6	2	global	reporting edsitement america war presented threehour san persian film gulf juan role hill stephen war explores journalists reporting nehfunded america beaches jungles ives american vietnam normandy documentary share partnered thinkfinity lesson find educational save resources plans free edsitement plans updates lesson resources humanities project edsitement endowment national provided verizon thinkfinityorg
