qOyPdE	1	HI	24 apod august ethiopia iridescent pileus 2011 cloud fascinating discover featured written image explanation day photograph astronomer cosmos universe professional 24 2011 august disturbances image colors cloud size unusual group photographer sunlight noticed bands explanation wave dark wavy iridescent clouds diffract similar darker detailed related multicolored sight pileus picturesque amounts
hAbWa2	1	HI	service mlk day project find receive mlk updates inbox mlkday follow twitter interests dont tools find toolkits create project tips widget mlk search site day ensure social date follow networks mlkdaycnsgov include serve additional opportunities official national accessibility community usagov fear privacy federal corporation notices website government site foia service
wkOMBL	1	HI	current uscert activity highimpact web current incidents regularly updated reported types summary uscert activity security page frequent multiple apple released updates safari address vulnerabilities products security os code crosssite obtain information perform vulnerabilities privileges elevated attack attacker condition execute denialofservice exploitation sensitive arbitrary operate scripting articles mitigate users ht5281 encourages
IHEWr0	1	HI	grant grantsgov opportunities synopsis opportunity find precedence service disk electronic click information grant provide notification send inconsistency document email resolved notifications printed address opportunity emails change receive thing giving original requestedany modification description represent newest file oldest previous shown documents current document sections files background representing modifications arranged changed list
wuYS4I	1	HI	med kochujang fermented antiobesity food effect ncbi pubmed 2006 korean function web ncbi javascript site warning requires management citation external file generate software nutrition korea food national pusan busan science department university lipolysis tnfalpha chain transcriptionally differentiation adipogenesis 24 4 decreased mixture increased apoptosis fat affect downregulation sizes mrna activity
wSL4e7	1	HI	painless medlineplus health video threat news javascript adobe flash enabled content player version 8 requires flash pages related medlineplus heart good hurt doesnt expect find women thing attack heart dont cancer people year death heres leading attack chest surprise pain killing breast news women disease american heart people men compared
hTngiO	1	HI	glacier state recreational site matanuska summer managed rifle rest mile skiing tables parkthe state opportunities extends easy lodge gravel interpretive activities adjacent views 9077455151 12 walk recreation safest scenic river picnic national platforms parking provided nature ice access include pump conditions public highway toilets 300 matanuska water milepost 101 beginning
Hg11ZA	1	HI	loss nih slow increased weight decline national mobility 28 health fitness release march news 2012 institutes adults links related bookmark share england adults weight mobility national results institutes risk issue halved fouryear 29 2 health medicine physical type 2012 obese march increased journal published overweight losing diabetes loss ahead funded
tCMPO9	1	HI	industries worldwide input food processing research market agricultural investments structure biofuel wang paul heisey schimmelpfennig pray sun rupa john dayrubenstein carl ling keith king david karmarkardeshmukh fuglie kelly 147 pp december err130 research economic report 2011 sector generally global multinational agricultural networks industries input decades increased food rise half structural
ze8kLu	1	HI	status measure amendment senate measure constitutional appropriation conam systems house data detailed adobe adobes visit require reader page items download acrobat instructions links established entities review responsible sites pages content state internet endorse external advised legislature hawaii maintain encountered make visit webmaster 508 ada problems address effort pages comply rehabilitation
w0CeNe	1	HI	24 apod nebulae aurigae february 2012 fascinating discover featured written image explanation day photograph astronomer cosmos universe professional 24 february 2012 distant galaxy northern field sky hot 405 degrees 4 rich clusters skies tadpoleshaped famous natal clouds january 417 410 night view auriga significantly frame spider constellation bottom broadband nebula
ycMDRT	1	HI	service whales national noaa fisheries dave withrow marine checks watching photo share photos comments whale submit learn snorkling fishing photo national noaa scanned sea biologist seattle film service whales trapped ice withrow hollywood checks 2012 rescue gray lab slides fisheries dave marine released barrow february center famous inspired alaska mammal
xkFzxL	1	HI	sci ncbi shorelin pubmed environ microplastic technol 2011 accumulation function web ncbi javascript site warning requires management citation external file generate software school markbrowneucdie environmental university centre dublin biology sciences belfield college 4 ireland science west show contaminates domestic debris human contaminated synthetic proportion environment poles plasticadditives material animals areas
zM5sil	1	HI	status measure amendment senate measure constitutional appropriation conam systems house data detailed adobe adobes visit require reader page items download acrobat instructions links established entities review responsible sites pages content state internet endorse external advised legislature hawaii maintain encountered make visit webmaster 508 ada problems address effort pages comply rehabilitation
p36qT	1	HI	information source reliable find healthfindergov health services website hyperlink nongovernmental direct application hhs consistent hyperlinks states services human subject information hyperlinked united application contained health endorsement department website intended provided visitors external constitute applications privacy appearance practices products policies purpose link redirected connect home library questions care center doctor health
ji0Zhs	1	HI	links programs leave sheets fact leave annual advanced leave sick advanced leave information annual general ses pay equivalent accrual rates systems slst leave donor bonemarrow organ leave court work service annual accrual nonfederal leave experience uniformed creditable relative family related member definitions leave transfer program emergency ses extension equivalent annual
wdFyf	1	HI	affordable making home map footer skip site content expert learn initiative reductions rate home administrations foreclosure mortgage variety housing options helps interest struggling easier affordable begin transitioning speak explore understand making servicer payment obama modifications refinancing programs homeowners mha deferred relief avoiding aid expectexplore programs mhawhat gathering documentation financial reasons
zq9eU0	1	HI	inmate gonzales 058534 wagner burglary committed gasping cut 20 23 residential fled penalty stabbing returned tucked lobe stop underneath 1991 front stabbed murder february skewered arrested robbery lung husband pleas 7yearold house back aggravated arm shining opened gonzales celebrated firstdegree vcr 7 consecutive 911 deborah terms death police yard wagners
yYZmSW	1	HI	benjamin revolution congress library treasures words american franklin honesty dead bright ship conscience leak strokes secret policy oaks christmas good fell sink key continual great small breadth letters words accurate scientist writer long exhibition careers life franklins finished birth inventor politician matter accomplishments tercentenary cartoons achievements achieved books abolitionist broadsides
dggfpH	1	HI	10 apod january martian sunset 2009 fascinating discover featured written image explanation day photograph astronomer cosmos universe professional january 2009 10 operations atmosphere gusev month colors farther human earth fine rover sky crater extensive 50 19 miles view bright celebrating legacy images 80 blue sun recorded anniversary particles red creating
xBp5DC	1	HI	current uscert activity highimpact web current incidents regularly updated reported types summary uscert activity security page frequent multiple apple released updates safari address vulnerabilities products security os code crosssite obtain information perform vulnerabilities privileges elevated attack attacker condition execute denialofservice exploitation sensitive arbitrary operate scripting articles mitigate users ht5281 encourages
yRQiwq	1	HI	ri sci ncbi ann lab ldl levels low cholesterol clin pubmed serum 2007 function web ncbi javascript site warning requires management citation external file generate software school tel center medical holon sackler israel aviv medicine internal edith department wolfson university ldl 18157 cardiovascular 24 group morbidity mortality associations increased therapy
4dwBHm	1	HI	picture astronomy day fascinating discover featured written image explanation day photograph astronomer cosmos universe professional 11 2012 bright distant earth disk 20 fit easy weeks apogee photographed perigee dark day telescope pacific dense sun asia moon smallest full 300 annular 240 kilometers path super silhouetted filter point image visible smaller
dlJugm	1	HI	assignments jpac military personnel force air force rankgradeafsc billets apply requirements check personnel listed enlisted job afsc ams change positions vacant equal air monthly officer position directorate jpac j1 manager questions afpc fill respective waits personnel section note refer field assignment services service manpower career positions vacant requisition navy marine
hQ6bEA	1	HI	13 center tornado watch prediction storm status report 13 watch messages information network service national warnings visit iwin weather interactive 40 mod 20 low 30 mod 30 mod 40 mod 30 mod high 70 f2f5 probability forecaster 70 60 table event increased category tornadoes probabilities issuing 5 low moderate events
sVVdyO	1	HI	apod full january aurora sky 3 norway 2012 fascinating discover featured written image explanation day photograph astronomer cosmos universe professional january 3 2012 atmosphere unexpected ago striking sky magnetic results 60 lies stretched airplane rarely viewed complete mountain realm wide space image poles horizontally molecules auroral circle norway aurora higher
z7RM3y	1	HI	status measure amendment senate measure constitutional appropriation conam systems house data detailed adobe adobes visit require reader page items download acrobat instructions links established entities review responsible sites pages content state internet endorse external advised legislature hawaii maintain encountered make visit webmaster 508 ada problems address effort pages comply rehabilitation
zH17Db	1	HI	lakeshore dunes national indiana winterfest search temporarily lot 28 kemil park due state construction closed parking expected east open road 2012 national 1200 embrace paul education saturday lakeshores winter dunes douglas 7 indiana pm lakeshore environmental pm400 celebration center january fun winterfest outdoor show skis indoor paper including skiing staff
rgDdLT	1	HI	rush klondike gold national park historical seattle unit search gold globe national headlines 1897 event unit yukon canada preserves seattle subsequent spreads crucial seattles role telegraph rich strike thousands igniting klondike easy northwestern read park story remote july dreams rush word 17 stampede riches minds historical fields newspaper discover pacific
Hfywg6	1	HI	status measure amendment senate measure constitutional appropriation conam systems house data detailed adobe adobes visit require reader page items download acrobat instructions links established entities review responsible sites pages content state internet endorse external advised legislature hawaii maintain encountered make visit webmaster 508 ada problems address effort pages comply rehabilitation
GCpNUM	1	HI	baseball park construction comiskey exterior sox white photographs chicago daily 19021933 news baseball park construction comiskey exterior sox white news photographer daily chicago 1910 createdpublished square skeleton armour community area street exterior sox portland avenue equipment chicago west illinois located white shields wentworth 324 grandstand park curved construction comiskey supplies
wJnJ29	1	HI	status measure amendment senate measure constitutional appropriation conam systems house data detailed adobe adobes visit require reader page items download acrobat instructions links established entities review responsible sites pages content state internet endorse external advised legislature hawaii maintain encountered make visit webmaster 508 ada problems address effort pages comply rehabilitation
w9Y3da	1	HI	apod saturns 22 january light hexagon 2012 fascinating discover featured written image explanation day photograph astronomer cosmos universe professional january 22 2012 planetary infrared discovered spacecraft motions saturns excluded flybys surrounds emanating rotating fully shape vortex continue corners unexpected imaged movie scientists orbiting shows saturn formation created study timelapse times
A9XBim	1	HI	mobile apps smartphone quitguide app itunes smokefree download control cancer developed experts counselors quit exsmokers support research application written branch national free nci app designed smoking mmg professionals weeks quitguide tobacco institute days prepare cessation deal app insight share keywords information content smokefree reading twitter quit problems journey facebook favorites
jFsjIf	1	HI	living healthfindergov healthy quitting live learn quick smoking guide connect website hyperlink nongovernmental direct application hhs consistent hyperlinks states services human subject information hyperlinked united application contained health endorsement department website intended provided visitors external constitute applications privacy appearance practices products policies purpose link redirected information usaccessibility privacy mapcontact act
AAZrIE	1	HI	current uscert activity highimpact web current incidents regularly updated reported types summary uscert activity security page frequent multiple apple released updates safari address vulnerabilities products security os code crosssite obtain information perform vulnerabilities privileges elevated attack attacker condition execute denialofservice exploitation sensitive arbitrary operate scripting articles mitigate users ht5281 encourages
rnYmMX	1	HI	educational milestones ncbi dev early appl 2008 pubmed predictor psychol function web ncbi javascript site warning requires management citation external file generate software psychology university california department riverside limited results longevity adjustment personal entrylongevity environment decades mortality personality risk early effects lifelong association school success contexts mental findings midlife sex
giBfK9	1	HI	treating nonhodgkins andor text lenalidomide clinicaltrialsgov refractory follicular patients full rituximab lymphoma view cancer growth kill carry find cancerkilling immune ways system therapies spread monoclonal nonhodgkins ability substances stop blood rationale rituximab lymphoma grow antibodies cells lenalidomide flow stimulate giving blocking growing biological block lenalidomide andor ii randomized refractory studying
wIU7Eb	1	HI	fatty ncbi polyunsaturate nutr pubmed br acidspecific mixed 2010 n6 function web ncbi javascript site warning requires management citation external file generate software nih md usa neurosciences biochemistry section nutritional biophysics bethesda membrane laboratory niaaa chrisramsdennihgov 093 ci statistical specifically ratio 22 95 4 extensive n3n6 increased combination confounding intake
hGqBQn	1	HI	legislature state hawaii amendment senate measure constitutional appropriation conam systems house data detailed adobe adobes visit require reader page items download acrobat instructions links established entities review responsible sites pages content state internet endorse external advised legislature hawaii maintain encountered make visit webmaster 508 ada problems address effort pages comply
