AfW92Y	1	WI	climate global february analysis state 2012 form monthly reports access calculation 310 surface dataset including anomalies monitoring temperature monthly beginning state note 3 version ncdc 2011 activities global complete land preliminary report november data change received climate october effective presented trends ranks replaced processed ghcnm newest coding homogeneity adjustment information
H85zRt	1	WI	novo lipogenesis lipid text de disease clinicaltrialsgov carbohydrate nonalcoholic full liver view metabolism fatty tissues epidemic discovered nonalcoholic tissue cho accumulates sugar belongs efficiently drinks worldwide increased quantities fat increases liver conversion excess cases obesity present diabetes paralleled carbohydrate consumed adipose disease large fructose muscle soft accumulation control reversing simple
wtt7hK	1	WI	frb stress describing releases comprehensive review capital analysis releasefederal methodology paper testmarch press 12 2012 reserve release date 12 march 2012 disclosure issued results paper edt describing federal review thursday methodology capital test 2012 templates march monday comprehensive ccar released stress 15 analysis summary pm 430 reserve detailed financial economists
aRQLfC	1	WI	firewoodfuelwood dnr upper office map issued purposes operations availability unit management northern maps forests lansing access state wood mailin forest administers fuel fuelwood division dependent commercial issues peninsulas issuance instructions lower logging permits offices view suitable left division management permits forest types issues timber information documents pdf view office mda
wOgsBJ	1	WI	10 mortgage points key debt forgiveness news essentials newsroom topics irs resources february tip irs 28 201239 tax 2012 tax canceled years mortgage forgiven 2012 partly taxable debt homeowners 2007 exceptions 10 mortgage irs facts debt forgiveness irs canceled foreclosures information wwwirsgov publication abandonments debts visit forgiveness 2007 repossessions excellent
HSFU0C	1	WI	family house national white visits americas parks tourists state union video watch enhanced transparency commitment browse house white logs visitor wait executive actions president obama federal receipt tax federal dollars tax spent people petitions create sign house inside white tour interactive beautiful family check visit shows places photos place country
wNCRbd	1	WI	advisory statistics transportation request council nominations rita pdf statistics transportation agency administration research bureau innovative technology dot advisory statistics transportation acts request council action nominations summary composed bts collected supported reliability quality statistics solicits acts interested relevance advise objectivity stakeholders transportation serve director persons analyses nominations disseminated consistency dot dates
AnqXpb	1	WI	omega6omega3 ratio atheroscler ncbi cardiovas rep pubmed 2006 curr function web ncbi javascript site warning requires management citation external file generate software metabolic street dakota usa west research 57105 health foundation 1400 nutrition diseases falls billharrisusdedu sioux 22nd institute university south sd inflammatory human cardioprotective ratio enzyme systems include fas
zQvpFL	1	WI	retirement problems back medlineplus savings cut pages related medlineplus financial people tuesday retire back healthday forced feb struggles problems early news 14 study face ongoing finds financial significantly reduce reducing retirement wealth affects health sydney income australia ability early accumulate university work longterm researchers people retire ages back 64 data
GBT3ZK	1	WI	function pareto probability density denoting bound shape lower default tail 1 length parameter relation sense defines note location parameter bound hold lower technical typically called shape dataplot optional treats default reason 1 parameter loc scale parameters optional scale 0 form applications standard 1 location pareto distribution commands parameters shape distribution
xPDi5G	1	WI	impact ncbi nutr mic pubmed br 2012 intestinal insights function web ncbi javascript site warning requires management citation external file generate software limited yakult business west park lthomasyakultcouk south uk 6qe end mddx ha4 odyssey road ruislip emerging proposed agreed manipulation dynamic results reviewed episodes gastrointestinal homeostasis impact animal summarises
zePgji	1	WI	refuse ncbi cancer characteristics donotresusci patients pubmed 2010 function web ncbi javascript site warning requires management citation external file generate software houston usa cancer university center medicine anderson tx 77030 department palliative rehabilitation texas care appropriately harm distress frequency determine orders unit refusals cancer predictors conducted donotresuscitate dnr palliative families
85LSBE	1	WI	storm tornado watch prediction 7 center status report watch messages 7 information network service national warnings visit iwin weather interactive high 70 40 mod high 70 50 mod 40 mod 20 low high 95 f2f5 probability forecaster 70 60 table event increased category tornadoes probabilities issuing 5 low moderate events
ACFU09	1	WI	house dollars 50 40 states white state union video watch enhanced transparency commitment browse house white logs visitor wait executive actions president obama federal receipt tax federal dollars tax spent people petitions create sign house inside white tour interactive means dollars people 50 40 states forty program means food month
eWgcf3	1	WI	web federal fafsa deadlines student aid colleges federal pay attention deadlines state deadline legal student year click school applying residence deadlines state enter aid view dakota nevada prince wyoming minnesota micronesia rico edward alberta puerto maryland marshall texas carolina iowa saskatchewan michigan utah virginia hawaii qc ohio samoa newfoundlandlabrador quebec
pkNgfi	1	WI	map national corps map national skip links national revised period due past cartographers suspended funding forms maps program usgs citizen ngp decades limitations map collection sponsored data 2008 projects volunteer geospatial share years platforms information networking mapbased georeference sites easy internet social services technologies types recent made produced volunteered information
xuDesQ	1	WI	pap medlineplus health video news proof javascript adobe flash enabled content player version 8 requires flash pages related medlineplus checkup lifesaving appointment skip routine missing women cancer providers valuable check pap cervix womans screened health helps test recent decades screening familiar early cervical women die study disease turn found care
x9N081	1	WI	health reproductive processes addresses reproductive life functions system health stages control family nearest topics site depends planning questions sexually andor information factors broad health answer ability includes methods clinic birth lifestyle reproductive pregnant age infections specific range contact transmitted control prevent contraception nearest find number clinic planning ready children information
wrNexb	1	WI	sci ncbi med sports exerc pubmed effects strike 2012 type footwear function web ncbi javascript site warning requires management citation external file generate software 11 biology evolutionary divinity usa university harvard cambridge human department ma avenue 02138 rearfoot shoes differs forefoot heels elevated strike supports minimal economy versus tests standard
wav9zq	1	WI	ass independently ncbi consumption res nutr pubmed dairy soy 2011 milk function web ncbi javascript site warning requires management citation external file generate software loma school usa biostatistics los university angeles epidemiology health vmatthewsmyriverbendorg department linda ca public 106112 hypothesized 091 ci years ptrend osteoporosis based calcaneal 95 028 dairy
zhAiM0	1	WI	map risk agrilus fhtet products planipennis developed emerald years discovered devoted distributed state controls treatment resources risk michigan trees aphis transparent areas entire university 50 detroit capability detections trap team reduced constraints cooperation detection design quebec estimated addition canada project detect funding managing tools find increase 3 health selecting million
wjW3HY	1	WI	twelve wisconsin reuse dnr reduce article recycle news tips 2012 weekly resources current topics licenses permits regulations statewide trapping fishing hunting kids website educators nature encourage learning fun children educators fire landowners health forest managementtopics activities lands activitiestopics parks outdoor management property managing spills air environmental cleanup protectiontopics waste quality
qS4VHs	1	WI	wetlands importance watershed health indicators biological epa jump main content aquatic biodiversity search area contact epa importance wetlands wetlands proved costly farmed harsh drained provide muddy causing treatment place ironically barrier promptly water important moving straightened nation areas land benefits places taking commonly thought streams problem flooding control flood storing
wIzC82	1	WI	topics tax topic fellowship grants 421 scholarship irs resources individual allowed educational generally research fellowship paid purpose student institution study amount scholarship grant receive amounts part taxfree fellowship scholarship met grants conditions amounts fellowship qualified taxfree treated scholarship required expenses gross fellowship amounts travel generally research equipment board income teaching
osiS5h	1	WI	heart rhythms citalopram communication celexa abnormal drug high safety doses hydrobromide 08242011audience psychiatry cardiology posted hydrobromide underlying including predisposed pointes electrocardiogram low rhythm fatal risk professionals citalopram potassium de day fda torsade mg include qt developing notified conditions patients magnesium activity heart celexa abnormal doses greater lead 40 electrical issue
zHqCYC	1	WI	redirect web wisconsin department natural page resources resources current topics licenses permits regulations statewide trapping fishing hunting kids website educators nature encourage learning fun children educators fire landowners health forest managementtopics activities lands activitiestopics parks outdoor management property managing spills air environmental cleanup protectiontopics waste quality redevelopment water resourcestopics drinking
xzawu9	1	WI	maternal origins mobile early pubmed obesity 7 res 20112011585749 exp dec 2011 epub diabetes school australia institute medical 5001 research sciences health pharmacy sa sansom university south adelaide restriction period outcomes dietary contributions postnatal gestational periconceptional interventions late ablate glycaemic life greater activation bmi gestation fat understand gain loss intake
10GCdb	1	WI	story weather bou display chances winds cold needed precipitation moderately late plains moisture expected today mountains evening north unsettled activation possibly front diminish bit bringing high builds cooler wednesday temperatures activity showers overnight tonight warmer spotter provide snow sunday significance monday slight friday thunderstorm rain pressure chance strong dry region
GHxaYt	1	WI	permitting federal review executive white infrastructure house improving performance order projects state union video watch enhanced transparency commitment browse house white logs visitor wait executive actions president obama federal receipt tax federal dollars tax spent people petitions create sign house inside white tour interactive house white office press secretary executive
waWExn	1	WI	apod 15 january magellanic infrared large portrait cloud 2012 fascinating discover featured written image explanation day photograph astronomer cosmos universe professional january 15 2012 herschels remarkable show infrared distant galaxy young galaxys views 160000 easily clouds cooler large stopped activity telescope images blue herschel spitzer space ways nebula contributed tend
yM3Ls9	1	WI	emotion soc ncbi neural disrupts pubmed cogn activity neurosci affect du 2011 function web ncbi javascript site warning requires management citation external file generate software usa street psychology 603 university 61801 illinois naomisadehgmailcom daniel champaign department east urbanachampaign il represent examining psychopathic temporal salience positively evidenced personality increased frontal activation
zQVdMQ	1	WI	fax fire hp burn hazards due recalls machines named washington instructed voluntary consumers illegal commission safety cooperation announced firm product stop dc recalled resell attempt immediately products today recall consumer 1050 product 1040 hp fax machines canada 240000 mexico 928000 units alto importer palo hewlettpackard calif fax overheat failure fire
cAvm9v	1	WI	heart placement angioplasty stent medical medlineplus encyclopedia heart angioplasty supply blood narrowed open blocked arteries vessels coronary called procedure prevent angioplasty drugeluting stent tube coronary helps artery medicine mesh immediately closing embedded inside metal small expands prevent angioplasty clot thinning medicine pain forming blood begins medicines procedure padded surgical table
xSClqc	1	WI	wire warden resources current topics licenses permits regulations statewide trapping fishing hunting kids website educators nature encourage learning fun children educators fire landowners health forest managementtopics activities lands activitiestopics parks outdoor management property managing spills air environmental cleanup protectiontopics waste quality redevelopment water resourcestopics drinking watershed fisheries wide agency urgent
HxGPkv	1	WI	apod april tungurahua 2 erupts 2012 fascinating discover featured written image explanation day photograph astronomer cosmos universe professional april 2 2012 1300 roughly high tungurahua erupts years shines cloud peak glows photographer sky lavalit 5000meter located hot 2006 captured starlit white image pictured ejected pours explanation distance visibly dark fell
xXgYrB	1	WI	volcanic natural activity hazards sea red volcanic sea december january ceased group area plume detected zubair sulfur grow 2011 red formed dioxide early satellites continued appears 19 island 23 stopped 15th activity small naturalcolor image 60 enhanced entire 40 landsat7 2012 mapper coast kilometers group thematic february yemen 15 island
wAO5RR	1	WI	19 january national update thursday situation fema 2012 information warnings west region effect watches remain advisories wwwwrhnoaagov numerous latest heavy flash series move pacific wyoming mountains saturday montana northern amounts coasts cascades copious 3 low moisture 6 flooding idaho systems rainfall heaviest inches utah oregon coast pressure carrying california snowfall
kF1S3k	1	WI	solar multimedia system exploration io gallery date 19 1997 io sep jupiters september global ninth spacecraft mile plume deposits edge hues black location 400 sulfur prominent 2011 surrounds amb dark areas brightness bright 310000 miles brownish pillan activity view upper volcanically imaged surrounding jupiter enhanced images tenth 250 moon dioxide
v7VYX7	1	WI	records 1940 census skip navigation reasons number evidence individual 82 employment insurance 17901930 federal research natf passports form genealogical birth schedules pages population census benefits age order place social security 1 information part general census start 1940 research 2 part finding aids 3 part part 4 videos articles part 5
A3YIsG	1	WI	maternal mobile pubmed birth order fraternal sep40210514 2001 horm behav mental site street college 1r8 250 rayblanchardcamhnet ontario medicine canada healthclarke centre department faculty toronto m5t university psychiatry addiction fetus hypothesized produced brain differentiation succeeding explain concomitantly aspects males effects birth affect progressive mothers irrelevance immunization individuals antihy including antigen
wHZcGB	1	WI	media corps fema library videos corps corporation national community program service cooperative relating fema links nongovernment social applications web fema provided reference media companies sites endorse msgdata washington street apply management prepare federal rates homeland department 4fema emergency dc 43362 20472202 sw agencyus security500 6462500text tty assistance step 46275853 800
zGwiyJ	1	WI	medlineplus mistakes newbiedoctors resumes found page related medlineplus grens kerry honesty show obstetrics detail research reuters health expected physicians attention applications york 100 applicants training programs 30 credit publications qualities found studies houston cancer attempts mistakes frumovitz lead author anderson willful hope dr md center professor michael honest mislead texas
zHsrnj	1	WI	thomas congress text bill library 112th 20112012 hcon ih 107 force misdemeanor high sense constitution section offensive crime 4 constitutes authorization expressing congress president article ii clear prior impeachable act military jones committee judiciary submitted concurrent mr resolution referred force misdemeanor high sense constitution section offensive crime 4 constitutes authorization
I9mYPk	1	WI	thomas 20032004 congress text bill library 108th ih 460 hres 100th sports state michigan football congratulating game rivalry university teams greatest ohio history recognizing strickland oxley miller gillmor ryan committee kucinich education pryce hobson tiberi kildee upton conyers turner ney brown submitted michigan workforce latourette portman ford kaptur jones levin
HQIWAP	1	WI	ncbi laborato primary leukemia cell clinical pubmed plasma 2012 function web ncbi javascript site warning requires management citation external file generate software usa institute university myeloma research sciences ar therapy rock arkansas medical protocol contemporary reviewed stellatecell involved accepted 27 group parameters progressionfree pretreatment treatment plasma 2012 gep risk survival
3ixzg	1	WI	caring childs mental health childs mental mission sites overarching childrens caring system effort support samhsas increase approach health comprehensive public awareness marketing social samhsafunded purpose services strategic care 1994 created communications team strategies works stimulate information childrens national visit event wwwawarenesseventorg health today rsvp day awareness mental dont washington wwwsamhsagovchildrenliveeventasp
JFQVEu	1	WI	med death sci ncbi sports exerc arrest sudden cardiac pubmed unit 2012 function web ncbi javascript site warning requires management citation external file generate software minnesota school wa usa pennsylvania medical mn washington system minneapolis philadelphia 1crozerkeystone 3university pa health 4university medicine 2university seattle springfield scd sca related states characterize
6OvCsb	1	WI	preserve memorial timucuan national ecological historic caroline fort search wetlands coastal hardwood discover human kingsley includes timucuan 6000 dunes visit plantation caroline preserve beauty coast atlantic marshes years fort hammocksthe experience unspoiled salt history school slave graveyard university florida archaeology plantation field kingsley quarters found evidence 2010 florida anniversary landing
AfF9pV	1	WI	wildlife fwp fish parks montana internships grade college learning relates department learned majorminor curriculum receives internship credit student world shortterm applying work experience academic applies position involves fish votech private accredited learning open native parks program public higher internship universitycollege includes montana community student wildlife american enrolled institutions positions secure
y7zXdD	1	WI	genomics ncbi study phylogenetic genet pubmed mol comparative 2012 function web ncbi javascript site warning requires management citation external file generate software budapest dna network institute forensic phorolmahotmailcom 1536 hungary science medicine laboratory institutes distances newest observed interpreted melody paternal traditions based field similarities 31 gave styles combination frequencies scaling
86tmzQ	1	WI	intercessory heart ncbi study pubmed 2006 effects therapeutic function web ncbi javascript site warning requires management citation external file generate software israel mindbody center usa institute medical school hbensonbidmcharvardedu medicine harvard boston department ma beth deaconess illness supported influence cabg addressed prayer surgery graft provided recovery trials coronary 1 clinical
zs1del	1	WI	flashlight led target fire burn hazards due sets recalls named washington instructed voluntary consumers illegal commission safety cooperation announced firm product stop dc recalled resell attempt immediately products today recall consumer flashlight product led 6pc sets units 55000 target minn corporation minneapolis importer flashlights fire burn turned hazard heat posing
zui2a7	1	WI	home usda kyf compass food farmer compass usda videos discover market pictures field systems farmer local supporting food regional watch compass segment case read learn growing studies kyf computer file compass open acrobat experience reader pdf save map 20092011 years visiting food regional programs farmer usdasupported shows interactive local projects
whjRRa	1	WI	zion ranger national minutes park search diversity incredible national park ranger explore garretson habitats zion juliet learn park prepared ranger expect year special baker time holly fantastic zion national park discover ranger barb fossil graves revealed history closer zion takes snail tim park ranger smallest lutterman world hiking canyoneering problemsolving
yoV95t	1	WI	current uscert activity highimpact web current incidents regularly updated reported types summary uscert activity security page frequent multiple apple released updates safari address vulnerabilities products security os code crosssite obtain information perform vulnerabilities privileges elevated attack attacker condition execute denialofservice exploitation sensitive arbitrary operate scripting articles mitigate users ht5281 encourages
xzMFCp	1	WI	photo house january white day 2012 state union video watch enhanced transparency commitment browse house white logs visitor wait executive actions president obama federal receipt tax federal dollars tax spent people petitions create sign house inside white tour interactive january house check offices photo 2012 picks white day office deputy
9Lwh52	1	WI	water contaminants drinking epa content area jump main navigation contact water contaminants drinking links national primary regulated apply limiting details visit enforceable health systems legally public regulations levels drinking water protect list npdwrs standards contaminants alphabetical regulations links primary water sheets listing drinking fact cramps illness diarrhea vomiting gastrointestinal fecal
vwIdfQ	1	WI	risk ncbi int lond childhood pubmed adult obesity obes 2012 function web ncbi javascript site warning requires management citation external file generate software school university veterinary nottingham uk science medicine loughborough body unclear metabolic aimed questions range index investigate factors positive review demonstrated associations independent life adulthood risk relationship nature
wn5klq	1	WI	emergencies 13 prepare snow forecast jan weather winter wa king 98056main management office emergency 8005235044fax 3511 2062054056ecckckingcountygov ne free 2nd county phone 2062963830toll streetrenton office 911 program enhanced seattle wa2062963910e911 forecasting office snowfall county weather businesses cold management winter service national emergency emergencies king prepare days urges residents family sends
wV8XYs	1	WI	nih rare february highlights national 16 disease research cuttingedge health institutes 2012 day awareness raises links related bookmark share cc nih clinical center media advisory office recognize national supported cosponsored translational institutes research researchnational 29 day sciences clinical health advancing daylong activities nih diseases government agencies event celebrate celebration organizations
v4SBqs	1	WI	ncbi prevalence mutations biol somatic detection pubmed low 2011 genome function web ncbi javascript site warning requires management citation external file generate software diego gilman usa center cancer la university drive 92093 california moores oharismendyucsdedu jolla san ca 9500 ucsd breadth clonal udtseq methods cancer limited detection specificity mutations restrict
HUYxjX	1	WI	advisory sab chartered experts staff standing candidate opportunities board input casac serve nomination committees science annual epa jump main content science staff advisory board epa false committee nsf query searchreadformquery returnfalses dosearch function return locationpathnametolowercasesplitnsf0 parentcommittee path line escapequery search querystring contact windowlocation dosearchdocumentforms0queryvalue standing committees casac sab annual chartered
bM4d8A	1	WI	redirect web wisconsin page dnr resources current topics licenses permits regulations statewide trapping fishing hunting kids website educators nature encourage learning fun children educators fire landowners health forest managementtopics activities lands activitiestopics parks outdoor management property managing spills air environmental cleanup protectiontopics waste quality redevelopment water resourcestopics drinking watershed fisheries
