u3Epsf	1	WI	apod iss december 31 lovejoy comet 2011 fascinating discover featured written image explanation day photograph astronomer cosmos universe professional december 31 2011 intendente bright earth captured 24 la photographer sky argentina local spectacular dan arcing early crosses tails twilight morning view alvear swept trails frame back glinting proper home closer
2f4NaL	1	WI	glossary talking genetic terms glossary home version text term enter search test knowledge links national share related talking descriptions human images genetics field addition research genetic animation genome nhgri terms understand specialists include created glossary institute concepts definitions select alphabet version terms selecting term explore letter textonly revealed search list
GGElX3	1	WI	pr risk cancer primary ncbi pubmed subsequent 2012 prev eur function web ncbi javascript site warning requires management citation external file generate software bavaria cancer populationbased erlangen germany registry pelvisureter urinary results skin thyroid ratio 95 incidence excluded factor decreased increased brainnervous 59 specific small found precaution significantly detection relative
sp7tV	1	WI	trees moon roosa earth service 1971 personal late program astronaut containers forest return trees joint part module world apollo roosas 14 january tree nations project seedlings small jumper mitchell launched shepard surface states walked trip packed united moon orbited lunar nasausfs command tribute afternoon hundreds alan kit planted 1976 31
fT2e7k	1	WI	hsf space human flight apollo history approximately exposed site imbrium fashion unit mauro mare fra distributed formations moon symmetric extensive geological radially landing mission formation apollo 13 nearside planned characteristic mission close mauro fra area chosen decision lunar final achieve led importance landing site apollo 14 13 attempt failed traverse
A113rm	1	WI	corps announcing creation blog fema discrmination age isnt 1824 set adults enter due mentioned apply odd develop 21 young long program wwwamericorpsgovnccc leader team offers americorpsnccc part workforcethat skills 18 age opportinuty nccc limit learn sector government workforce private expansion develop skills workers job cares join citizens corpssee httpwwwcitizencorpsgov tax
AAkhU9	1	WI	biology ncbi hum disadvanta pubmed advantages inconvenient reprod 2012 function web ncbi javascript site warning requires management citation external file generate software aging francisco usa san institute university 94114 health california ca opinions industrial phenomenon demographers ages retrospective west specifically research age participants optimal decades risen disadvantages social delayed scrutiny
HbABIR	1	WI	text clinicaltrialsgov multiple management safety evaluation full pain efficacy therapy adjunctive neuropathic nabilone sclerosis gabapentin view cesamet significantly agent determine adjunctive management pain purpose neurontin neuropathic nabilone improved study relief ms gabapentin nerve burning manage narcotic chronic agents tingling conventional placing due symptoms treatment stabbing analgesia neuropathic syndromes axons worst
wVon3z	1	WI	conversions rollovers reporting roth 2011 2010 topics retirement plans community irs resources 2010 conversions rollovers tax report return income 2011 2010 half taxable amount 8606 20a conversion distributionsif distributed ira 2010 form part report line 2011 roth amount 8606 inplan rollover retirement distributed ira 2010 form 25a part plan report
wCIR3s	1	WI	inmate 223626 chappell shackleford previous apartment police young complex march early cutting report continued morning night found competition year investigation dating frustrated missing kristal attention hours incident death choked carried brusing supply scene son involvement drowned proved 2 relationship child shortly 11 12 middle air called affection ordered december kristals
HPbcn7	1	WI	alzheimers medlineplus health video news prevention javascript adobe flash enabled content player version 8 requires flash pages related medlineplus keeping older healthy brain fun prevent americans alzheimers life million early develops important minute disease person steps common letters adults show library sharp compared group people young alzheimers read folks lives
IJtre6	1	WI	ncbi activity patients pubmed immunogl blood pomalidomide 2012 function web ncbi javascript site warning requires management citation external file generate software division united rochester mayo hematology states medicine clinic department chain prospective valuable years weekly eligible improvement preserved plasma attribution combination survival discordance therapy documented aes 59 progression organ covering
zp0tSg	1	WI	apod saturns painted january 13 moon iapetus 2012 fascinating discover featured written image explanation day photograph astronomer cosmos universe professional january 13 2012 increasingly meter infrared spacecraft debris flyby impact saturns walnut swoop unprecedented happened greater material seemingly dark possibly world saturn vast bright inspection images close easternmost ice moon
h4CFU	1	WI	apod star september trails oregon 9 2009 fascinating discover featured written image explanation day photograph astronomer cosmos universe professional september 9 2009 produces month bright grants earth concentric earths usa point sky slowly stars circle exposures north diurnal ncp explanation continues oregon trail partialcircle rotate years spin easily made traced
xnua6M	1	WI	play childrens tipover due hazard theaters guidecraft recalls named washington instructed canada voluntary consumers illegal commission safety cooperation health announced firm product stop dc recalled resell attempt immediately recall products today consumer play theater 4in1 product dramatic toys canada united 1800 350 states units winthrop minn importer guidecraft mega profit
xYQKDc	1	WI	curr ncbi rep acti pubmed effects pain headache 2011 exercise physical function web ncbi javascript site warning requires management citation external file generate software school ma usa medical 02114 medicine harvard spaulding boston department hospital rehabilitation physical incorporate nonpharmacologic formulated evidence providers manage share contemporary conditioning regimens controversial disabling recommendations
92kD7Z	1	WI	center tornado watch prediction 61 storm status 61 report watch messages information network service national warnings visit iwin weather interactive high 70 50 mod 50 mod 30 mod 40 mod 30 mod high 80 f2f5 probability forecaster 70 60 table event increased category tornadoes probabilities issuing 5 low moderate events
IevsQ4	1	WI	full clinicaltrialsgov risk metaanalysis cardiometabolic text fructose view proposed disturbances inconclusive cardiovascular based knowledge technique sugar forms associations risk propose fats sweetener pooled undertaking continue processed recommendations found investigators weight sugars sex doses relates concern factors increase participants health public body ability beverages differing pressure groups improve healthy study informing
yjPNDj	1	WI	images national ocean service noaas code national site images page web service blog widget copy paste ocean latest widget nongovernmental site external flickrcom web service provide accesses note order height300 frameborder0 srchttpoceanservicenoaagovwidgetsflickrflashhtml width120 stylepadding0 overflowhiddeniframe iframe scrollingno national revised site httpoceanservicenoaagovimageshtml usagov questions owner web service administration comments department 2012
A9VnOI	1	WI	selmatomontgomery march freedom edsitement 1965 picturing presented imagining learn civil analyzing images writing incorporating impact 1965 create montgomery reading assessment movement karaless march descriptive marcher students photography selma photograph visual postcards rights james interactive share partnered thinkfinity lesson find educational save resources plans free edsitement plans updates lesson resources humanities
xBWkyN	1	WI	nasa sheet fact dryden x5 xmlnsxslhttpwwww3org1999xsltransform bell sweep feasibility research speed reducing built needed point operational test extended flight aircraft advantages angle wings x5 changing length aircrafts fully runway view swept series vary back variable reducing speed xf92a angle provide objectives single research x4 increasing ability equivalent sweep change desired
yNmV0S	1	WI	biophys ncbi evidence critical acta ro pubmed withdrawn biochim 2012 function web ncbi javascript site warning requires management citation external file generate software elsevier apologizes withdrawn editor policy full inconvenience httpwwwelseviercomlocatewithdrawalpolicy article publisher request withdrawal found elsevier bv published activity browsing empty recording activity turned recording turn back information usa
mYuqg	1	WI	prediction storm center compmap weather references rap analysis 12z rapid pages 1 input 2012 updated fire ruc background fields changed refresh replaced model display mesoscale svrgis apr weather tornadoes gis shapefile visit details 9 2012 19502011 updated 19552011 format shp hailwind httpwwwspcnoaagovgissvrgis reports severe converted page feedback hovered issued displayed
hZjdDi	1	WI	information center cpsc carbon monoxide colorless killer gas invisible carbon monoxide poisonous odorless called 150 people related states appliances year stoves heaters fireplaces fuelburning unites include nonfire accidental improperlyused furnaces water faulty incorrectlyvented die products poisoning consumer shed portable family kill home generator generators doors vents basement windows inside garage
Aml47M	1	WI	vista usda service motorized travel system ranger nepa district forest sierra projects information nepa fs information contact 85615 national coronado forest hwy az 92hereford 5990 3780311 520 web national site coronado forest main vista district ranger motorized national system nepa coronado sierra home travel projects forest andor impacts damage proposes
kvcs	1	WI	financial government citizens grants usagov aid benefits financial grants identify apply eligible benefitsgov government loans benefits aid financial loan back states grants universities grant pay assistance awarded interest type grantsgov differences cities loans counties organizations search remember required individuals nonprofit researchers top back top back top back top back benefits
7DgBXv	1	WI	2011 automotive 1975 otaq lightduty trends emissions dioxide fuel carbon epa technology economy jump main content cars trucks light area search contact additions epa recent years mile previous based improvement fuel 2011 2010 mpg report projects trucks standards miles trend trends year sport provided co2 pickup dioxide reverses slight cars
yVCV3l	1	WI	1993 ncbi interactions summerfall neurotoxicology pubmed leadprotein function web ncbi javascript site warning requires management citation external file generate software division life rockville food administration drug sciences 20857 maryland metalbinding represent focus ala brain including neurotoxic calmodulin knowledge kinase examples enzyme pivotal include anhydrase regional heme inhibition emphasized proteins specific
zlUZk0	1	WI	ars publication storage request tillage minnesota cornsoybean biennial nitrogen carbon rotation greater limited zea managed glycine storage years nitrogen sampled masses alternate intensive treatment fuel employed midwest greater tillagerelated mays rotation entire lsoybean yields enhance cropping reduced upper employing maximize findings sensitivity observed year 03 co2 06 notill content dioxide
alHKTU	1	WI	science carbon nasa ecosystems cycle changing addresses cover global humans focus reservoirs carbon fluxes marine terrestrial cycling area provide quantify interact productivity due biogeochemistry document affected distribution biomass understand goals ecosystems change cycle climate land atmospheric variations ocean future projections activities global projections earth carbon decade responses earths knowledge needed
c0RKjF	1	WI	center tornado 56 watch prediction storm status report 56 watch messages information network service national warnings visit iwin weather interactive 40 mod 20 low 30 mod 30 mod 40 mod 30 mod high 70 f2f5 probability forecaster 70 60 table event increased category tornadoes probabilities issuing 5 low moderate events
9rcmgE	1	WI	13 center tornado watch prediction storm status report 13 watch messages information network service national warnings visit iwin weather interactive 40 mod 20 low 30 mod 30 mod 40 mod 30 mod high 70 f2f5 probability forecaster 70 60 table event increased category tornadoes probabilities issuing 5 low moderate events
HiyM1p	1	WI	weather radio noaa coding voices automated site answers noaa weather radio questions frequently information wealth offers asked outage general report click canada information transmitter station weatheradio listing problem questions office nws question national county send home station message times nwr links comments note broadcasts concerns listing local state dates includes
xj7vRJ	1	WI	report science nsfgov special nation aquatic facility rivers shes oklahomas species zoologist research state collected shows recently norman mussels part vaughn river university 30 freshwater southeastern caryn names home species pimpleback hold rabbitsfoot oklahoma approximately research location pistol grip vaughn good north colorful 300 mussels hand vaugn mussel america 55
wGldb6	1	WI	apod australia aurora february 1 red 2012 fascinating discover featured written image explanation day photograph astronomer cosmos universe professional 1 february 2012 atmosphere including magellanic earth disk galaxy ground sky showered weeks excited australia familiar aurora emanating oxygen large pictured night small distant back video highlighting particles state 1402 red
zhMOL4	1	WI	presidents make healthiest council year 2012 set presidents past council year activity incorporating physical start reminder achieve 2012 nutrition good ability healthiest reflect goals making great 12 lifestyle level healthy age months realistic commit work weight people presidents set council years resolutions fit percent approximately reality report attainable change january
ctbzWp	1	WI	center tornado watch prediction storm 68 68 status report watch messages information network service national warnings visit iwin weather interactive 50 mod 20 low 40 mod 20 low 30 mod 20 low high 70 f2f5 probability forecaster 70 60 table event increased category tornadoes probabilities issuing 5 low moderate events
aBOmIu	1	WI	partners benefits federal employees domestic memorandumextension house samesex white presidential state union video watch enhanced transparency commitment browse house white logs visitor wait executive actions president obama federal receipt tax federal dollars tax spent people petitions create sign house inside white tour interactive house white office press secretary memorandum heads
HkZSBD	1	WI	report wisconsin fishing dnr resources current topics licenses permits regulations statewide trapping fishing hunting kids website educators nature encourage learning fun children educators fire landowners health forest managementtopics activities lands activitiestopics parks outdoor management property managing spills air environmental cleanup protectiontopics waste quality redevelopment water resourcestopics drinking watershed fisheries wide
a09XqB	1	WI	center tornado pds watch prediction storm 58 status report messages watch 58 information network service national warnings visit iwin weather interactive high 95 high 80 high 80 60 mod high 70 60 mod high 95 f2f5 probability forecaster 70 60 table event increased category tornadoes probabilities issuing 5 low moderate
tCMPO9	1	WI	industries worldwide input food processing research market agricultural investments structure biofuel wang paul heisey schimmelpfennig pray sun rupa john dayrubenstein carl ling keith king david karmarkardeshmukh fuglie kelly 147 pp december err130 research economic report 2011 sector generally global multinational agricultural networks industries input decades increased food rise half structural
g5anAL	1	WI	national nkdep kidney month services health human department management disease understanding detection improving kidney basics longer disease healthier learn kidneys kidney disease tests recommended learn kidney living information people disease kidney loved life lifestyle longer diet live healthier learn information ckd monitoring clinical health management patient education evaluation professionals learn
ifRMjx	1	WI	federal holidays 2012 6103 observed saturday usc federal schedule note sunday 5 establishes holiday public nonworkday monday friday holidays law employees work falls executive purposes years leave federal pay section legal 1 sunday 2 11582 3a holiday public 2012 monday falls day february january employees 1971 11 treated order specifies
yyJHcx	1	WI	redirect web wisconsin department natural page resources resources current topics licenses permits regulations statewide trapping fishing hunting kids website educators nature encourage learning fun children educators fire landowners health forest managementtopics activities lands activitiestopics parks outdoor management property managing spills air environmental cleanup protectiontopics waste quality redevelopment water resourcestopics drinking
sbAiq5	1	WI	fly apod space january free 1 2012 fascinating discover featured written image explanation day photograph astronomer cosmos universe professional 1 january 2012 guided mission farther nitrogen earth 41b backpack satellites bay works heavy retrieve weightless challenger meters cargo space propulsion robert mccandless pictured drifting mmu free jets safer experience untethered
9W6qxP	1	WI	reports forms commission submitted ethics view incumbents office election committee select candidates form link filed report cycle committees list attorney office statewide commissioner treasurer governor general state insurance secretary numbered 1357 districts state board 9 education odd numbered 10 2468 districts state board education senate state house state representatives attorneys
xYdQZP	1	WI	v20 ncbi adoption agp genbank obtain valuable evidence convey sequences information 20 ncbi submit version genome switching files assembly users nature gap part linking change 11 submission side affect site ftp specification agp agps list v11 site existing header parsers ftpftpncbinihgovgenomes line ftp agpversion 20 ncbi specification format genomes written
AiRcMh	1	WI	senate policy michigan health state chair committee scheduled addressing needing individuals office thursdays request participate accommodations hearing committee 230 special senate lansing webpage health assistance policy meeting pm regularly members building committees room citizens proposals contact time bills boji minutes committee testimony subscribe committee notices email legislation committee view referred
xJFRMX	1	WI	viral flora ncbi metagenomic analysis mart pubmed pine virol 2012 function web ncbi javascript site warning requires management citation external file generate software netherlands center medical virology department erasmus rotterdam sequences geminivirusrelated viruses pine enteric picornaviridae species homology information epidemiological baseline metagenomic detected potential european diversity viral circoviruslike understanding paramyxo
sgcY98	1	WI	house submit comments questions white state union video watch enhanced transparency commitment browse house white logs visitor wait executive actions president obama federal receipt tax federal dollars tax spent people petitions create sign house inside white tour interactive accessible committed comments questions open staff administration send concerns wellwishes creating form
tlrOP	1	WI	center tornado watch prediction storm 85 status report watch messages 85 information network service national warnings visit iwin weather interactive 60 mod 20 low 50 mod 30 mod high 70 50 mod high 90 f2f5 probability forecaster 70 60 table event increased category tornadoes probabilities issuing 5 low moderate events
JppV9j	1	WI	shoot sturgeon resources current topics licenses permits regulations statewide trapping fishing hunting kids website educators nature encourage learning fun children educators fire landowners health forest managementtopics activities lands activitiestopics parks outdoor management property managing spills air environmental cleanup protectiontopics waste quality redevelopment water resourcestopics drinking watershed fisheries wide agency urgent
aAU9fu	1	WI	center watch thunderstorm prediction severe storm 21 status report messages watch 21 information network service national warnings visit iwin weather interactive 20 low 5 low 30 mod 30 mod 40 mod 20 low high 80 f2f5 probability forecaster 70 60 table event increased category tornadoes probabilities issuing 5 low moderate
GCpNUM	1	WI	baseball park construction comiskey exterior sox white photographs chicago daily 19021933 news baseball park construction comiskey exterior sox white news photographer daily chicago 1910 createdpublished square skeleton armour community area street exterior sox portland avenue equipment chicago west illinois located white shields wentworth 324 grandstand park curved construction comiskey supplies
AbaovK	1	WI	13 january disability labor workshop photo department employment gallery 2012 states department united labor nonflash ffffff version show disability allowscriptaccesssamedomain high globals pluginp type id pthis quality check requiredminorversion pluginspage httpfpdownloadmacromediacomgetflashplayercurrentswflashcab based width employment top flash 540 swf content detected playback var entered detectflashverrequiredmajorversion acflruncontent alternatecontent meets tests weve dolmediaphotosslideshows20120113martinezbizevent
9Iu2P9	1	WI	ncbi ulva neurosci pubmed 2006 lett neuroprot conglobata marine algae function web ncbi javascript site warning requires management citation external file generate software program cc brain ibst technology inje graduate shinsungdong 6 305804 korea hanwha yuseonggu daejeon neuroscience building center institute science university south results cox2 enzyme ifngammainduced ht22 treatment
xLVZT0	1	WI	mart childrens lead chairs due stools standard gifts elegant recalled violation paint named washington instructed voluntary consumers illegal commission safety cooperation announced firm product stop dc recalled resell attempt immediately products today recall consumer product chairs stools childrens 1300 chairs 1600 stools units mart los gifts elegant importer calif angeles
w9Y3da	1	WI	apod saturns 22 january light hexagon 2012 fascinating discover featured written image explanation day photograph astronomer cosmos universe professional january 22 2012 planetary infrared discovered spacecraft motions saturns excluded flybys surrounds emanating rotating fully shape vortex continue corners unexpected imaged movie scientists orbiting shows saturn formation created study timelapse times
2YZs1o	1	WI	fdsys browse bills congress senate house states types legislative united proposals representatives bills congressional hr house chambers president approval law require senate signature bills limited senate house approval chambers resolutions amendments constitution res generally propose hj joint appropriation purpose president matters require single specific sj signature force senate house approval
zYV6sN	1	WI	current uscert activity highimpact web current incidents regularly updated reported types summary uscert activity security page frequent multiple apple released updates safari address vulnerabilities products security os code crosssite obtain information perform vulnerabilities privileges elevated attack attacker condition execute denialofservice exploitation sensitive arbitrary operate scripting articles mitigate users ht5281 encourages
AcOE1N	1	WI	dates wisconsin hunting deadlines dnr resources current topics licenses permits regulations statewide trapping fishing hunting kids website educators nature encourage learning fun children educators fire landowners health forest managementtopics activities lands activitiestopics parks outdoor management property managing spills air environmental cleanup protectiontopics waste quality redevelopment water resourcestopics drinking watershed fisheries
dUak01	1	WI	workshops discovery function web ncbi javascript site warning requires nih national workshops held tools campus libraries network ncbi regions medicine twoday colleges set features series national workshops resources emphasizing year tools campus universities libraries additional ncbi 25hour common demonstrate sessions centers research regions located offers accomplish medicine twoday discovery nih
zZqILK	1	WI	solstice disruption mission cassini images home image details 1062 5150 titan 660 ring angle degree northern image rings sunlit shows tethys saturnfacing plane kilometers sides center 3200 larger side miles left view acquired image visible spacecraft cassini scale 22 tethys approximately camera 7 8 red titan million 12 kilometers 2011
9kc91A	1	WI	wdnr wildlife area marsh horicon resources current topics licenses permits regulations statewide trapping fishing hunting kids website educators nature encourage learning fun children educators fire landowners health forest managementtopics activities lands activitiestopics parks outdoor management property managing spills air environmental cleanup protectiontopics waste quality redevelopment water resourcestopics drinking watershed fisheries
