xkL4Zl	1	MA	house white state union video watch enhanced transparency commitment browse house white logs visitor wait executive actions president obama federal receipt tax federal dollars tax spent people petitions create sign house inside white tour interactive event live facebook discussion participate click member facebook give click questions comments httpwwwwhitehousegovvideo ondemand library
x3VLm1	6	MA	lowell fee park boott museum mills days free historical 2012 national cotton search enjoy newest remarkable ken boott national year unique salazar fees cotton memorial justice country museum mills sites parks encourage interior 2012from independence free lowell beauty freedom great park story jr cultural fee struggle america hall king luther
xhVfjR	1	MA	molina attend excellency announces inauguration house perez delegation guatemala republic otto president white presidential obama state union video watch enhanced transparency commitment browse house white logs visitor wait executive actions president obama federal receipt tax federal dollars tax spent people petitions create sign house inside white tour interactive house white
ygGdA3	3	MA	full pain cognitive text diabetic clinicaltrialsgov therapy behavioral view neuropathic psychological intervention cognitivebehavior peripheral pain efficacy evaluate management therapy purpose neuropathic study diabetic persistent 215 sample randomized design numbers cbt intervention pharmaceutical educational compared approximately research participants conditions treatment employed size recruited cbtsc controlled standard edsc condition care target equal
wFyMdh	1	MA	titans color mission surface solstice cassini view images home image details instruments image probe fluvial pebblesized 4 rocklike 6 expected huygens indicating mixture inches base distance 15 originally rocks activity darker surface evidence middle hydrocarbon 85 descent ice centimeters erosion consisting radiometer blocks imagerspectral initially water objects center 33 thought
w3AV9f	1	MA	syndro mobile autobrewery pubmed ethanol endogenous med 2000 law sci jul40320615 981342027 usa university washington state laboratory toxicology seattle albicans caused lack urine results merit years produced experiments hepatitis involved ethanol disorders explain endogenously concerns constitutes endogenous yeast methods venous suffering candida term autobrewery individuals activity analytical firstpass reduced challenged
hcHgpI	1	MA	nrc webcast live meeting regulatory webcasts nuclear commission broadcasts internet meetings means nrc improving public communications staff energy rin session inspections situ lbp123 requirements recovery tentative acceptance uranium maintenance criteria appeal meeting final ross tests 855 nrc strata affirmation 3150ai77 feb analyses 10 rule public project 2012 900 medical isotope
wpTS4O	1	MA	training full amyotrophic lateral sclerosis clinicaltrialsgov patients text muscle als view abilities previously functional reducing based neuromuscular positive opportunities wasting diseases weakness number effects advised atrophy neuropathic loss kind experiencing evaluated investigate found status illness findings people general functioning physical strength endurance patients health increasing exercise development mechanisms effect explore
y3iOAY	1	MA	respond mercury andrews spill school st rigov health dem brown high dropped mercury management island rhode health department today 10 building earlier barrington environmental andrews science 11 school classroom reported vial january floor st classes dem shoes process testing site sample officials identify staff mercury addition state potential health protocols
eWgcf3	1	MA	web federal fafsa deadlines student aid colleges federal pay attention deadlines state deadline legal student year click school applying residence deadlines state enter aid view dakota nevada prince wyoming minnesota micronesia rico edward alberta puerto maryland marshall texas carolina iowa saskatchewan michigan utah virginia hawaii qc ohio samoa newfoundlandlabrador quebec
oXblZR	3	MA	king luther national memorial jr martin search love beacon message man conscience equality justice freedom movement app memorial service official park parks mall national memorial movement history man photo multimedia link pages national click mall plan find memorial blossom cherry national parks mall link page emerging fair generation image society
weNQcf	1	MA	mlkdaygov receive mlk updates inbox mlkday follow twitter links photo channels good video images find previous inspiring ways media day widget weve included opportunity gallery projects search engage involved social mlk interests dont create project find toolkits widget mlk search site day ensure social date follow networks ensure social date
zr5BNb	3	MA	med sci ncbi enduran sports exerc strike pubmed rates foot injury 2012 function web ncbi javascript site warning requires management citation external file generate software lb evolutionary boston 3university auburn services street 65 human research avenue 81 divinity usa 2department system 02163 health central suite care 500 biology north 4baylor
yZEBfl	5	MA	astp photo nasa id title ast01042 image pacific ocean patterns text oblique cloud view ast01053 text image orbit spacecraft soyuz american apollo soviet american ast01056 text image orbit spacecraft soyuz apollo soviet ast02093 text image blacksky spacecraft soyuz background contrasted soviet ast02096 text image blacksky spacecraft soyuz background contrasted soviet
vG8lcT	2	MA	apod thunderclouds jumping sundogs 8 november 2011 fascinating discover featured written image explanation day photograph astronomer cosmos universe professional altsee picture clicking resolution explanation version download 8 november highest 2011 phenomenon years web rapid sky reorients differently sundog return emerged words clouds lightning inspection temporarily enthusiasts past curious encouraged sum
xeZzEq	3	MA	giss impacts level national maps nasa world security figure al paper human based s5 health 2012 shindell simultaneously food journal graphics improving change climate nearterm science mitigating interactive load moments installed computer web java note graphics require enabled browser 2050 temperature bc measures due surface increase avoided methane decrease linked
uUJDr	4	MA	classicnces kids zone graph create nceskidsimagesstaticbannerjpg 75 670 addflashnceskidsimageskidsnavswfvarskipnavskipnavvarhomenceskidsindexaspvartoolsnceskidstoolsindexaspvarcrunchnceskidscrunchindexaspvargraphnceskidscreateagraphvardyknownceskidseykindexaspvargrabnceskidsgrabbagindexaspvarchancesnceskidschancesindexasp picture taylor thousand heard words worth point magazines find web graph explain constantly charts quickly helps interest show homework impress understand world publications fun businesses people site numbers special information things difficult visually communicate problems chart illustration reason complicated great newspapers
xUCXAA	1	MA	respond mercury andrews spill school st rigov health dem brown high dropped mercury management island rhode health department today 10 building earlier barrington environmental andrews science 11 school classroom reported vial january floor st classes dem shoes process testing site sample officials identify staff mercury addition state potential health protocols
xh3qMx	1	MA	jan 11 2012 blotter 33rd locationsabout usnonemergency3034413333 streetboulder 803013034413300other address1805 emergency911 boulder 6a1a18 uiheadercolor favorites twitter servicesexclude uicobrand print addthisconfig servicescompact google facebook delicious var ffffff email uiheaderbackground patrol 1029 observed aggravated denver motor fine stole towed confirmed police area pay tow pearl suspicion lot vehicle parents belonged pm driver
xhFKnR	2	MA	press center jpac searches jpac photos historical casualties marine marine 222 jan pearl korean war 2012 harborhickam photos base casualties 13 joint hawaii historical files jpac photo donating tools casualty preferably family personnel member compiled submissions archival photographs frontal showing hundreds photos identifications date case unresolved records analysts teeth aid
zKeNCC	2	MA	estrogen ncbi exogenous conseque pubmed protects menopause mice 2012 function web ncbi javascript site warning requires management citation external file generate software ecology nutritional college human nj tx 2department sciences molecular texas biology 1department school natural princeton university austin estrogen cancer int growth determine mammary death alcohol consumption factors leading
jUSKu	1	MA	gluten ncbi rev nutr milligram recov mucosal 2004 pubmed day function web ncbi javascript site warning requires management citation external file generate software policlinico italy university matteo pavia irccs years duodenal spite basis harmless clinical histological gluten prevented biopsy report 2 reviewed day case patients celiac satisfactory milligram serological adequately
wvcoKU	1	MA	altern med organic ncbi rev persistent pubmed role pollutants 2011 function web ncbi javascript site warning requires management citation external file generate software usa naturopathic tempe wcrinnionscnmedu college medicine az southwest resistance pops biphenyls farmed sugar factor dysregulation increased loss reveal source habits common obesity development deal metabolic rate attributable
xJpoLK	1	MA	med profiling ncbi exoso transl pubmed identification proteomic 2012 function web ncbi javascript site warning requires management citation external file generate software heart university centre institute science medical research edinburgh uk universitybritish foundation queens cardiovascular reservoir human cell proposed transfer 2 pathology biofluids rna fluid pathophysiology released exosomes exosomal cells
xFAnw8	1	MA	full pain efficacy tolerability text clinicaltrialsgov patients safety arcoxia view evaluation etoricoxib neuropathic undertreated primarily neuralgia caused tolerability abnormal involve neurons determine pain etoricoxib remains herpetic safety present nsaid phn efficacy sensory post reliever neuropathic postshingles study disease commonly aim patients activity relievers investigating referred superior efficacy study hypothesis etoricoxib
Anazwx	2	MA	nih health january national release 12 identify scientists workings viruses news 2012 approach institutes view links related bookmark share smaller findings developed viruses human skin institutes bacteria diseases visualize provide niams jan musculoskeletal scientists health structures national discovery arthritis science reported part workings insights 13 institute cells microscope issue researchers
i6rEz	1	MA	living healthy live parenting healthfindergov learn quick guide connect website hyperlink nongovernmental direct application hhs consistent hyperlinks states services human subject information hyperlinked united application contained health endorsement department website intended provided visitors external constitute applications privacy appearance practices products policies purpose link redirected information usaccessibility privacy mapcontact act policyfreedom
Ag4d7	1	MA	apod october 16 2006 saturn shadow fascinating discover featured written image explanation day photograph astronomer cosmos universe professional october 2006 16 discovered bright earth scattering giant saturns main spectacular outermost dark shadow saturn spacecraft night side view unexpected hard back eclipsed pale blue sun rings moon orbiting newly recently hours
yvzlT0	3	MA	sec form accurate reviewed information necessarily commission reader complete exchange completethe securities assume determined filing 1 identity issuers information business contact 2 place principal persons 3 related clarification response clarification response clarification response clarification response industry group 4 size 5 issuer federal select 6 claimed apply exclusions exemptions type filing
yJCTEu	1	MA	description proposed organization nhgri division office functional includes director intramural principal extramural research current offices components organization nhgri office functional including carry research responsibilities activities includes director behalf divisions institute offices oversees advisory managers council played meetings intellectual single grants human comprises organizing genomics functions management field provide review opportunities
bAImEX	1	MA	ncbi gp qualitative gen moment pract br 2010 heartbeat pubmed study function web ncbi javascript site warning requires management citation external file generate software watling centre medical sanjivahluwalialondondeaneryacuk uk stanmore selfhelp literature information remains increasingly encourage consultation health internet policy role government doctorpatient patients sparse consultations dealing brought determine information
hUbmVL	1	MA	initiative peace open corps government content jump main navigation bridge agency people december memorandum ushering open directive administration american instructed doors executive intended government gap issued president data obama signed accountable era transparency action 2009 incorporate embraces agency feedback corps webpage identify initiative begun information additional provide peace grow daytoday
rnYmMX	3	MA	educational milestones ncbi dev early appl 2008 pubmed predictor psychol function web ncbi javascript site warning requires management citation external file generate software psychology university california department riverside limited results longevity adjustment personal entrylongevity environment decades mortality personality risk early effects lifelong association school success contexts mental findings midlife sex
sONwxx	1	MA	congress sends national ftc call registry biennial report trade past businesses impact consumers commission federal approved call congress registry focusing technologies years biennial report detailed allowed enforcement totaling year charities actions report 137 numbers tools provided accepted subscribed data paying approximately access telemarketers consumer call time 2011 law successfully 209
wR82aR	1	MA	calendar edsitement presented essay examining campaign civil alternatives direct assess society protest defense americans kings lesson criticisms black students selfgoverning famous significant nonviolent securing rights action share partnered thinkfinity lesson find educational save resources plans free edsitement plans updates lesson resources humanities project edsitement endowment national provided verizon thinkfinityorg edsitement
zZqILK	1	MA	solstice disruption mission cassini images home image details 1062 5150 titan 660 ring angle degree northern image rings sunlit shows tethys saturnfacing plane kilometers sides center 3200 larger side miles left view acquired image visible spacecraft cassini scale 22 tethys approximately camera 7 8 red titan million 12 kilometers 2011
8faZ4	1	MA	resident aliens citizens abroad small businessselfemployed taxpayers international topics irs resources reside estate resident tax alien estimated united generally returns income subject worldwide paying rules citizen abroad states gift filing duty file resident allowed year alien 2month calendar pay due citizen residing return june regular date overseas 15 extension requesting
rP7p6D	1	MA	microrna ncbi illu analysis pubmed biol mol 2012 expression methods function web ncbi javascript site warning requires management citation external file generate software usa illumina ca sluoilluminacom hayward sequence describe direct biogenesis cost illuminas technology illumina data system micrornas low molecules ngs modification method genome profiling microrna revolutionized rna nextgeneration
xGP3Kw	1	MA	cavins endothelial ncbi caveolae pubmed physiol front caveolins 2012 function web ncbi javascript site warning requires management citation external file generate software usa columbia university pharmacology medical mo missouri department physiology limited focus years discovered including abundant cardiovascular molecules plasma aspects rna membrane pathophysiology cellular proteins large cholesterol small interfering
sC7M7L	1	MA	photo house december white 2011 day state union video watch enhanced transparency commitment browse house white logs visitor wait executive actions president obama federal receipt tax federal dollars tax spent people petitions create sign house inside white tour interactive december house check offices photo picks 2011 white day president house
b1Q8q7	2	MA	11092009 mandatory employees flu oshas shots position seasonal influenza shot vaccinations office janna questions assessment centers previous death based employer oshas employee health hope correspondence risk assistant maritime employers genetically marcy mandate agerange 205154146 condition helpful facilities transmission 6934600 identified shots enclosing secretary pertaining mandatory people encourages guidelines expect dear
iRoY8K	2	MA	documents paris 1783 treaty revolution september 1783 states ended recognized united 3 colonies independent formally nation great britain signed treaty american diplomacy process states born britain earth france established united peace largest international newly war conflict arena 177583 formed sophisticated vaguely involving world spain brought great netherlands american independence powers
wqEYNG	1	MA	scrotal fever ncbi acute 2011 med pubmed dengue assoc pak function web ncbi javascript site warning requires management citation external file generate software karachi pakistan university hospital baqai fatima department surgery medical complication penile oedema sequelae fever acute report cases condition scrotal rare resolving days limiting dengue activity browsing empty
92Tmub	1	MA	boston city citizens connect text app bostons issues city tweet visit send start program call website eyes phone effort ears neighborhood give boston 247365 graffiti connect potholes download ways awardwinning empower reporting alert citys neighborhoods mobile citizens residents citizensconnectcityofbostongov email email developerscityofbostongov citizens terms connect service app citizens connect tgh
wxJUgi	2	MA	galileos journal multimedia system exploration solar gallery galileos journal 1610 jan 7 date sketches named planets ganymede callisto jupiter io earth theory system 1610 5 moons discovering discovery amb europa update jul understanding orbiting demise solar universe galileo galilei 2011 discovered made center sunlast january orbit planet popular led galileo
zPsEcJ	1	MA	uscis study materials english test sentences tools speak application writing write materials correctly test reading speaking ability form eligibility interview started uscis prepare read n400 portion determined officer components english naturalization study additional section products select short naturalization process overview video test providing requirements citizenship process eligibility naturalization presentation practice
d0iKKk	1	MA	corps monthly themes preparedness citizen 2011 events communities uniting preparing nation locate login contact council moved page httpcitizencorpsgovnewseventsthemes2012themesshtm andor links update questions bookmarks citizencorpsdhsgov email readygov corps notices disasterhelpgovcitizen plugins home fear register privacy federal faqs femagov citizen widgets act policy dhsgov data foia bulletins annual reports servegov contact bannersaccessibility
wrNexb	1	MA	sci ncbi med sports exerc pubmed effects strike 2012 type footwear function web ncbi javascript site warning requires management citation external file generate software 11 biology evolutionary divinity usa university harvard cambridge human department ma avenue 02138 rearfoot shoes differs forefoot heels elevated strike supports minimal economy versus tests standard
yOOrBm	1	MA	cancer allatonce taking testing genetic sequencing approach parallel massively prevent reasons results uncontrolled growth genomic happen dividing inappropriate knowing diseases genes stop inherently mutations cells cancers tumors cancer caused lung skin environment suns ultraviolet exposure interaction tobacco light cancers smoke result cancer point individual protects run copies cell mutation passed
xXJccI	6	MA	volcanic natural island hazards sea red december zubair pulse 60 violent rising yemeni sea navy activity helicopter captured video northern 23 began sulfor 40 located edge details eruptions dioxide white 2011 red satellite shallow forming eruption coast middecember reported imagery kilometers satellites revealed explosions recent saba showed island highresolution submarine
wJKNXv	2	MA	100 trilogy respironics ventilators recall class 11 october initiated recall date 2011 product 30 april manufactured trilogy february ventilators 1 100 2011 ventilator home hospitals nursing support trilogy ventilation health breathing weighing intended continuous respironics ventilators adult 100 care 11 homes intermittent require pounds patients pediatric mechanical settings serial numbers
oBm9Ks	1	MA	affairs public home links point hyperlinks find site constitute services welfare linked web provided army west purpose stated sites contained authorized endorsement department consistent exercise activities information locations control external exchanges morale recreation appearance products editorial military disclaimer web aspects technical site comments master questions reporting site broken link address
yjShDI	1	MA	apod saturns painted january 13 moon iapetus 2012 fascinating discover featured written image explanation day photograph astronomer cosmos universe professional january 13 2012 increasingly meter infrared spacecraft debris flyby impact saturns walnut swoop unprecedented happened greater material seemingly dark possibly world saturn vast bright inspection images close easternmost ice moon
67QsDS	1	MA	house apply white state union video watch enhanced transparency commitment browse house white logs visitor wait executive actions president obama federal receipt tax federal dollars tax spent people petitions create sign house inside white tour interactive internship house period application program closed white submitted application materials including recommendations deadline read
jjHHaH	6	MA	hudno11134 hud notice rights homeownership disclosure announces revised servicemembers protects protecting militaryfederal dependents law disclosure duty civil revised washington housing department announced relief development urban notice form servicemembers emphasizes active dependents rights protected today act military duty foreclosure mandates wartime states active rate including court proceeding mortgage personnel percent valid
mNYfwY	1	MA	heart living healthy live healthfindergov health learn quick guide connect website hyperlink nongovernmental direct application hhs consistent hyperlinks states services human subject information hyperlinked united application contained health endorsement department website intended provided visitors external constitute applications privacy appearance practices products policies purpose link redirected information usaccessibility privacy mapcontact act
zhMOL4	1	MA	presidents make healthiest council year 2012 set presidents past council year activity incorporating physical start reminder achieve 2012 nutrition good ability healthiest reflect goals making great 12 lifestyle level healthy age months realistic commit work weight people presidents set council years resolutions fit percent approximately reality report attainable change january
UT2FE	1	MA	house white state union video watch enhanced transparency commitment browse house white logs visitor wait executive actions president obama federal receipt tax federal dollars tax spent people petitions create sign house inside white tour interactive event live facebook discussion participate click member facebook give click questions comments httpwwwwhitehousegovvideo ondemand library
uvr9Jg	1	MA	pediatrics industrysp ncbi hospital trends pubmed distribution 2011 function web ncbi javascript site warning requires management citation external file generate software division pediatrics center usa 02118 boston medical general massachusetts describe packs distribute sample trends hospitals proportion industrysponsored 2007 formula 2010 job distributed infant states maternity determine hospitals recorded 20
zi9xud	1	MA	risk ncbi nonsmall manag cell pubmed antiangiogenics clin 2011 ther function web ncbi javascript site warning requires management citation external file generate software italy san hospital rome 1st camillo oncologicalpulmonary unit firstline regulated ongoing resistances aggressive angiogenesissignaling spite vegfr kinase investigational treatment factor plateletderived mortality combination define tumorrelated inhibition therapy
hAbWa2	2	MA	service mlk day project find receive mlk updates inbox mlkday follow twitter interests dont tools find toolkits create project tips widget mlk search site day ensure social date follow networks mlkdaycnsgov include serve additional opportunities official national accessibility community usagov fear privacy federal corporation notices website government site foia service
zjC6Rj	1	MA	foundation science disabilities minorities persons engineering nsf national nsfgov women fields engineering college proportion graduate varies degrees consistent participation higher degree men women earn womens level science study bachelors share general ended rising numbers psychology earned increase sciences degrees decades reflects risen men highest 2008 declining women earn level fields
