d0WPNn	1	MA	national site roosevelt historic franklin home search estate captures back library cries home fdrthis fdrs museum hudson visit springwood loved terms started quote president presidential elected considered connection fdr place learn river twitter rooseveltvanderbilt facebook nhs follow flickr week metronorth mayoctober service bus national park days free operates poughkeepsie roosevelt
wTmYbO	1	MA	deadeny sci ncbi translational pubmed inhibition acad natl proc 2012 function web ncbi javascript site warning requires management citation external file generate software 11 yuichiromishimapeoplekobeuacjp biology hyogo japan university school graduate nadaku 6578501 science department kobe rokkodaicho show results effector underlying intricate functionally 22 tailindependent pgl microrna unclear rna dissected
tO4ZsR	2	MA	living healthfindergov healthy live adult shots learn quick guide booster connect website hyperlink nongovernmental direct application hhs consistent hyperlinks states services human subject information hyperlinked united application contained health endorsement department website intended provided visitors external constitute applications privacy appearance practices products policies purpose link redirected information usaccessibility privacy mapcontact
tYUpCF	1	MA	sec form da accurate reviewed information necessarily commission reader complete exchange completethe securities assume determined filing 1 identity issuers information business contact 2 place principal persons 3 related clarification response clarification response clarification response clarification response clarification response clarification response industry group 4 size 5 issuer federal select 6 claimed
sUlRPQ	1	MA	government official florida rosa state santa mondayfriday 800am 430pm request wednesday election 25 5 today 2012 statutes preference accepted absentee presidential january 31 florida pm august request primary 5 election pm office web voter program suite caroline merchant fax qualified birth day requesting 9831900 milton year ballot wwwfvapgov federal assistance
eLpLgx	1	MA	full syndrome efficacy study corlux cushings clinicaltrialsgov safety treatment text endogenous view obtained corlux mifepristone signs assessments 24 syndrome receive cushings daily symptoms patients weeks protocol caused exogenous high sources result doses adrenal enrollment syndrome eligible administration overproduction elevated glucocorticoid subject endogenous hormone cortisol glands effect develops levels glucocorticoids exposure
AbV1Hr	1	MA	biotech ncbi histochem neopla surveillance immune pubmed exosomes 2012 function web ncbi javascript site warning requires management citation external file generate software brown usa immunology center cancer 40202 james university microbiology louisville department ky h0zhan17louisvilleedu phagocytosis including decade particles maturation uptake microrna membrane number exosomes exact micrornas progression signal proteins
wnvy56	3	MA	ncbi 2005 stressinduced interpersonal neuroreport social trust pubmed function web ncbi javascript site warning requires management citation external file generate software n10 0600810 letters university behavioral ttakahashilynxlethokudaiacjp w7 faculty department japan kitaku hokkaido sapporo science correlation results rank general trustrelated trust neuroendocrine spearmans scale 20 unknown negative response subjects degrees
twZf5B	8	MA	expansion usda district trail waterville resort pemigewasset ranger nepa service green forest construction valley ski projects peak information nepa fs information contact nh mountain headquarters71 drivecampton national forest white 03223 5366100 603 mountain web national site forest white main expansion mountain peak resort waterville national trail nepa construction green home
w38DOk	1	MA	bmc poop ncbi med pubmed owns genomics 2011 insights function web ncbi javascript site warning requires management citation external file generate software canada psychology university 2w1 n1g department guelph ethical human scale legal research sharing compounded microbiome complicated data biobanking implications large social focus human issues relationships rapid add versus
yYS5C7	1	MA	house helping american succeed businesses address white weekly state union video watch enhanced transparency commitment browse house white logs visitor wait executive actions president obama federal receipt tax federal dollars tax spent people petitions create sign house inside white tour interactive stamped states united hes steps sold made ensure president
zFXIl4	1	MA	information pickup trash updays street pick pdf trash holiday schedule trash large pickup appliance 7amchristmas recycling trees trash december warning fine tinsel plastic lights covered trash type earlier subject collection 26th 31st running regular day january tree bag place pick starting regularly legal picked saturday entire day 1 pickup holiday
wk5dBi	1	MA	targeting ncbi expert pathwa targets opin pubmed vegf signaling ther 2012 function web ncbi javascript site warning requires management citation external file generate software erlangen erlangennuremberg university ulmenweg medicine germany 18 department proposed show resistance years human therapeutics based knowledge unanswered treatment covered 2011 inhibition therapy areas articles medline presented
bKCzpO	1	MA	web student aid colleges financial community grants repaid click universities requirements additional variety federal review program details grant offer students attending schools loans unlike career fouryear page quick aid eligibility financial grants apply based application federal submit read listed fafsasm eligibility free student factors aid page program undergraduate certificate pell
ftEw0I	2	MA	uscis study materials english test sentences tools speak application writing write materials correctly test reading speaking ability form eligibility interview started uscis prepare read n400 portion determined officer components english naturalization study additional section products select short naturalization process overview video test providing requirements citizenship process eligibility naturalization presentation practice
8eeD4n	2	MA	labor topic overtime pay department wages find states department united labor required saturdays fair rest labor flsa pay generally 40 employer overtime rates employee covered premium onehalf require times holidays hours regular excess worked workweek permits receive employees work days standards sundays act requires computing rate flsa overtime pay bonus
