ruG5h8	23	KS	start 1940 census research skip navigation national searching index district 1940 enumeration located charge 2 archives online opens 2012 locate free address census april release http1940censusarchivesgov order search access httpwwwarchivesgovresearchsearch opa online public census delaware 1940 sussex county maps state enter milford sussex including town search census 1940 delaware maps
HxvPXO	2	KS	gynecol comparison ncbi afroa shapes 2000 invest vaginal pubmed obstet function web ncbi javascript site warning requires management citation external file generate software group usa nc research durham health womens anterior positions introitus significantly polysiloxane afroamerican shape seed longer subject standing shorter 23 measurements 40 cast 1 width vagina introital
aADsDr	1	KS	center 140 watch thunderstorm prediction severe storm status report watch messages 140 information network service national warnings visit iwin weather interactive 20 low 5 low 30 mod 30 mod 30 mod 20 low high 70 f2f5 probability forecaster 70 60 table event increased category tornadoes probabilities issuing 5 low moderate
d6irAr	2	KS	center tornado watch prediction 133 storm 133 status report watch messages information network service national warnings visit iwin weather interactive 40 mod 20 low 30 mod 30 mod 50 mod 40 mod high 70 f2f5 probability forecaster 70 60 table event increased category tornadoes probabilities issuing 5 low moderate events
HO8LEK	1	KS	eye lead drugs study medlineplus trouble osteoporosis pages related medlineplus inflammatory healthday risk increased bisphosphonates eye drugs 2 osteoporosis users monday contends news firsttime study disease april oral called prevent cancer colon bones linked osteoporosis unusual bisphosphonates previous fractures fosamax drugs problems weak slow studies class prescribed irregular actonel disease
HfCLdc	3	KS	modot news release customer information 573 7517121 relations 7512840 contact kristi jamison runner prairie city amtrak provide jefferson treat views kansas rail dome historic louis unique opportunity riders great river car mo experience st april missouri 512 upper features railroads service provide section feature overhead numerous remaining full views cars
c3ULEl	2	KS	center watch thunderstorm prediction severe 125 storm status report messages watch 125 information network service national warnings visit iwin weather interactive 20 low 5 low 20 low 20 low 40 mod 30 mod high 70 f2f5 probability forecaster 70 60 table event increased category tornadoes probabilities issuing 5 low moderate
HFTEus	2	KS	house white april photo day 2012 state union video watch enhanced transparency commitment browse house white logs visitor wait executive actions president obama federal receipt tax federal dollars tax spent people petitions create sign house inside white tour interactive house check april offices photo 2012 picks white day official house
HiPpYK	2	KS	states united lottery government blog won usagov asked anonymous lottery won run lotteries states individual follow winners slightly procedure powerball winnings states follow handle statebystate basis state bought run multistate lotteries megamillions ticket procedures teams rules generally state winners lottery learn state responsible comments content hope conversations polite 13 older
k3Hlmw	3	KS	outdoor pests avoid conservation missouri department outdoor cope chiggers find pests avoid ticks common enjoy resident programs mdcs fishing download attract special native funtowatch hunting browse acres note dozens form students missouri wildlife free landowners improve plants animals center teachers involved homeowners order receive publications learn distribution printed methods poison
211mL	1	KS	united jackson army states fort training families links column pageread side soldiers click left gathered weekend themore hundreds olympics jackson athletes special fort training exchange museum wednesday moncrief basic main armymore working predictablemore things quiet library sedate anmore run leaders effective successfully secret takes jackson avert disposal commanders program issuesmore
Hbd6zm	2	KS	full text clinicaltrialsgov neuroprotection therapy evaluating aneurysm coiling view repair analysed induced undergo 24 tolerability frequency reduce period endof brain interim design female large dosed criteria vascular completion intravenous endpoints number undergoing procedures damage day 1 3 subjects safety 4 400 placebocontrolled impairment ischemic mgkg peptide ability efficacy strokes include
HWvUCE	3	KS	due hazard bicycles bikes fall recalls public named washington instructed voluntary consumers illegal commission safety cooperation announced firm product stop dc recalled resell attempt immediately products today recall consumer product bicycles year model 2010 2012 units 4100 francisco san importer bikes public pedals taiwan wellgo corp manufacturer pedals fall hazard
HdaGD5	1	KS	ncbi int follicular pubmed therapy maintenance rituximab prescrire 2012 function web ncbi javascript site warning requires management citation external file generate software protocol firstline noteworthy lack results dose mabthera including questions suffer impact adding lymphoma based disorders progressionfree iii confirmed radiological musculoskeletal treatment 401 persist mortality survival practice therapy effects
JDOkF	1	KS	park canyon bryce national search limestone force series hoodoos canyon horseshoeshaped carved worldly consists rainwater slot colorful eastern plateau claron power geology canyons shaped spires paunsaugunt fins formation erosional unique bizarre dissolving bryce famous windows frostwedging shapes edge rock amphitheaters including called year event astronomy 20 festival skies offer annular
yyzL3Z	2	KS	march media social day awareness 2012 people bisexual streets homeless runaway victimization percent young heterosexual 334 transgender versus 587 gay lgbtq questioning report lesbian youth providers dealing wwwsamhsagovchildren children friends visit trauma resilient hope families heroes youth learn danger bisexual streets high homeless home streets1 victimization people young rates transgender
xl8O0c	1	KS	grant grantsgov opportunities synopsis opportunity find precedence service disk electronic click information grant provide notification send inconsistency document email resolved notifications printed address opportunity emails change receive thing giving original requestedany modification description represent newest file oldest previous shown documents current document sections files background representing modifications arranged changed list
HAjg0w	1	KS	mission hazy solstice cassini orange orb images home image details atmosphere titan visible pole cassini images hood blue bottom suggest top faint haze layers detected moons orange recent image polar north hazes beginning titans flip vortex learn south view north 5150 titan kilometers 3200 antisaturn miles side view color image
HgIzEo	2	KS	grill wires danger food cleaners medlineplus swallowed bbq page related medlineplus tuesday tracts healthday barbecue sharp grills wire bristles rhode 3 emergency digestive news made room island april residents brush caused ended chicken apparently barbecued wire beef bristles stomachs throats metallic issues brushes report grills ate medical patients clean isnt
HOoK1C	2	KS	stress make medlineplus sick pages related medlineplus people healthday cold dampens trigger explain system immune 2 inflammation monday involving news stress study april common contribute high redness wound system research immune inflammation body heal levels contradictory stress longterm creates suggests heart autoimmune asthma disorders immune system inflammation conditions body lead
ePsUG9	1	KS	center watch thunderstorm prediction severe 130 storm status report 130 watch messages information network service national warnings visit iwin weather interactive 20 low 5 low 30 mod 30 mod 30 mod 20 low high 80 f2f5 probability forecaster 70 60 table event increased category tornadoes probabilities issuing 5 low moderate
fd1bnN	1	KS	media social 2011 day awareness mental exposed percent children develop young event health traumatic problems adulthood 18 months single 35 behavioral emotional childhood families providers dealing community resilience visit young children trauma learn http1usagoveurfx5 demonstrate adulthood1 exposed ages problem2 persistent psychological single children mental develop percent young event health potentially
xYSBok	2	KS	guidance main data users characteristics housing demographic obtain community american economic survey social data origin characteristics obtain sex numbers counts basic 2010 status homeowner population census age hispanic race produces estimates years states unit housing program nation towns cities data counties population bureaus census censuses official estimates community states reliability
x3xKr9	1	KS	med volumetric ncbi analysis sex pubmed urethr vascular 2010 3d function web ncbi javascript site warning requires management citation external file generate software italy reproduction gynecology studiorumuniversity pathophysiology mater massarenti human bologna department cesarebattagliauniboit alma gspot controversial existence space urethrovaginal threedimensional evaluate ultrasonography structures anatomic 3d color underwent ii orgasm
HH4xjk	3	KS	video dental medlineplus health worries news javascript adobe flash enabled content player version 8 requires flash pages related medlineplus fills simple thought dentist steps smiling fear people feel comfortable trip heres health dental dentist important affect care anxiety triggers gums teeth problem called haines matters im healthday doctors news dr
cYDyKm	9	KS	center watch thunderstorm prediction severe storm 129 status 129 report watch messages information network service national warnings visit iwin weather interactive 20 low 5 low 30 mod 30 mod high 70 60 mod high 80 f2f5 probability forecaster 70 60 table event increased category tornadoes probabilities issuing 5 low moderate
HEcbr7	1	KS	living healthfindergov healthy learn live quick teens guide depression connect website hyperlink nongovernmental direct application hhs consistent hyperlinks states services human subject information hyperlinked united application contained health endorsement department website intended provided visitors external constitute applications privacy appearance practices products policies purpose link redirected information usaccessibility privacy mapcontact act
vVBX3	1	KS	international station hsf space science saturday videos morning asimov light brighten single science isaac shed saturdays expedition subjects living space write window station crewmembers international aboard read time housecleaning free pettit letter opportunity don iss science variety nasa officer light book control houston series mission mornings downlinked saturday personal logged
zdBALl	1	KS	31 history march today thomas croix chain fifty indies relation purchased consists antilles canal 25 end uninhabited rico west panama virgin location puerto john possession danish march greater million kilometers strategic 1917 formal east sixtyfive 31 st renamed denmark small islands lying thomas charlotte streets hillsides amalie st steep cane
Hi6LAH	2	KS	full dmd healthy text dystrophy myography muscular dart trial electrical controls clinicaltrialsgov impedance duchenne eim view myography assess tools neuromuscular clinical assessment physicians diseases remission successful tool needle serve impedance day progression tolerate devices patients outcome eim diagnose individual sought seek trials current potential electrical noninvasive method ability electromyogram measures
vbBNj	1	KS	hsf realtime space human flight data control uptotheminute mission spacecraft path data make sky project applet reside significantly 336 download skywatch cache approximately access internet files 144 downloading 300 sufficient downloaded data 10 hard minutes clear required drive connection nasa time modem kbps updated official responsible amiko curator notices nasa
GNhFD7	1	KS	control conservation zebra missouri department mussel bivalve mollusks blackandwhite mussels region related quagga fingernailsized zebra sea caspian striped native asia species rivers discovered tennessee including detroit clair mississippi rapidly lake 1988 illinois spread arkansas international ballast north mussels waters waterways lakes water connected great shipping st american ohio river zebra
HxGPkv	3	KS	apod april tungurahua 2 erupts 2012 fascinating discover featured written image explanation day photograph astronomer cosmos universe professional april 2 2012 1300 roughly high tungurahua erupts years shines cloud peak glows photographer sky lavalit 5000meter located hot 2006 captured starlit white image pictured ejected pours explanation distance visibly dark fell
HmQU3Q	1	KS	catalog page pia15254 agencyled telescope instruments image mission infrared dust spanning contributions galaxy herschel giant combined space data nebula ripples cloud fiery tens tarantula ribbons european explosion dwarf spitzer fire center hundreds important formation brightest significant circular magellanic centerleft nasas fields observatory doradus noticeable visible light region 30 appearance called
