Ie4UjU	1	NH	media april social day awareness 2012 prevalence lifetime sexual physical 17yearold percent trauma witnessing 8 nationally reported assault experiences representative 39 12 17 violence youth survey providers dealing wwwsamhsagovchildren children friends visit trauma resilient hope families heroes youth learn assault1 prevalence percent lifetime sexual physical 17yearold 2 rates witnessing 8
b2UtUJ	1	NH	picture astronomy day fascinating discover featured written image explanation day photograph astronomer cosmos universe professional 11 2012 bright distant earth disk 20 fit easy weeks apogee photographed perigee dark day telescope pacific dense sun asia moon smallest full 300 annular 240 kilometers path super silhouetted filter point image visible smaller
HiPpYK	1	NH	states united lottery government blog won usagov asked anonymous lottery won run lotteries states individual follow winners slightly procedure powerball winnings states follow handle statebystate basis state bought run multistate lotteries megamillions ticket procedures teams rules generally state winners lottery learn state responsible comments content hope conversations polite 13 older
AfW92Y	1	NH	climate global february analysis state 2012 form monthly reports access calculation 310 surface dataset including anomalies monitoring temperature monthly beginning state note 3 version ncdc 2011 activities global complete land preliminary report november data change received climate october effective presented trends ranks replaced processed ghcnm newest coding homogeneity adjustment information
xOPZAf	1	NH	birthplace theodore national site roosevelt historic pets search exhibit visitor galleries preservation renovated artifacts closed renovations notice enhancing improve experience pony house held 1902 police photo white mounted roosevelt algonquin officer quentin children badger eli evans beloved captivated bear dr yale small house hard onelegged roosevelt kermit mirror peter barn
o8Jyaz	1	NH	facts nutrition tips fit guidelines dietary americans tools based offers easy tips plate eating food diet understand teaches icon healthy wellbalanced components interactive breastfeeding weight summer general information late population updated seeking preschoolers women loss kids pregnant specific individuals recommendations calories manage balancing weight increase foods foods reduce building healthy
HPKAmK	1	NH	dailymed strengthened labels site labeling make web review administration food read include drug minor undergoing warnings recent fda reformatted submitted easier editorial labels site web listing complete drugs approved present prescription time 37101 inserts medication providers national labels site library high download quality information service nlm marketed advertisements content health
sT7wYQ	1	NH	curr ncbi neurol rep update pubmed neurosci gammopathy monoclonal 2012 function web ncbi javascript site warning requires management citation external file generate software 8c28 sramchanmedwayneedu center usa medical mi detroit st universitydetroit state wayne neurology antoine department 4201 48201 uhc limited neuropathies cd20 results underlying including rapid disorders recurrence mgus
HkGV1E	1	NH	sitting study medlineplus suggests kill pages related medlineplus physically years healthday standing 26 percent 40 health 11 march monday sitting hours active news day die study spend suggests researchers people analyzing aged total data 45 percent fewer day 4 spike 8 australian mortality hours compared selfreported sitting 222000 11 15
JthH4b	1	NH	firstever administration 29 dc states department ribbon green names schools obama education 78 house sutley states including council chair education quality ribbon jackson duncan agency 29 department announce white today administrator arne dc environmental protection schools span firstever 78 list joined green nancy lisa secretary elementary dcs announcement school made
A2erOi	1	NH	1991 romania ncbi reproductive fam rever pubmed health stud plann julaug function web ncbi javascript site warning requires management citation external file generate software carrboro assistance nc 27510 ipas services international projects caused forbidden ended policymakers availability highest europe159 knowledge outdated 25year highquality mortality government practice effects half immediately dictatorship
zC2b65	1	NH	apod march nebula 13 m81 flux group integrated galaxy 2012 fascinating discover featured written image explanation day photograph astronomer cosmos universe professional 13 march 2012 nebula image visible including galaxy unusual group nebulae faint spiral virgo complex exposure local supercluster filamentary big explanation largest gas lucky m81 part diffuse halo
wBdIB7	1	NH	house white state union video watch enhanced transparency commitment browse house white logs visitor wait executive actions president obama federal receipt tax federal dollars tax spent people petitions create sign house inside white tour interactive event live facebook discussion participate click member facebook give click questions comments httpwwwwhitehousegovvideo ondemand library
yInBWz	1	NH	youth preparedness corps citizen communities uniting preparing nation locate login contact council moved page httpcitizencorpsgovgetstartedyouthyouthindexshtm andor links update questions bookmarks citizencorpsdhsgov email links plugin require plugins page view readygov corps notices disasterhelpgovcitizen plugins home fear register privacy federal faqs femagov citizen widgets act policy dhsgov data foia bulletins annual reports
x7FQ3g	1	NH	states united description government image blog modular usagov braincontrolled electrodes image surface skin limb electric signals function muscles controlled description mpl prosthetic underneath modular generated robotic convert patterns pick braincontrolled developed national johns limb limbs labratory sciences usu health veterans walter reed services uniformed applied center lost hopkins university action
wzKdqg	1	NH	beauty study medlineplus veggies fruits tools pages related medlineplus healthylooking healthday eating simple vegetables thursday complexion rosy 8 march key news fruits researchers researcher fluctuation period whitehead psychology lead scotland vegetable skincolor ross fruit andrews sixweek school consumption university st found judged appearance period skin end attractive improve added eat
yoIiZA	1	NH	repair chairs due hazard high fall recalls ikea named washington instructed canada voluntary consumers illegal commission safety cooperation health announced firm product stop dc recalled resell attempt immediately recall products today consumer product antilop chairs high 36000 169000 133000 units canada north conshohocken llc importer pa services ikea america unexpectedly
wdFyf	1	NH	affordable making home map footer skip site content expert learn initiative reductions rate home administrations foreclosure mortgage variety housing options helps interest struggling easier affordable begin transitioning speak explore understand making servicer payment obama modifications refinancing programs homeowners mha deferred relief avoiding aid expectexplore programs mhawhat gathering documentation financial reasons
AnqXpb	1	NH	omega6omega3 ratio atheroscler ncbi cardiovas rep pubmed 2006 curr function web ncbi javascript site warning requires management citation external file generate software metabolic street dakota usa west research 57105 health foundation 1400 nutrition diseases falls billharrisusdedu sioux 22nd institute university south sd inflammatory human cardioprotective ratio enzyme systems include fas
wICmQR	1	NH	closest dione mission solstice cassini flyby images home image details instruments dione pass surface visible primarily images flyby carthage moon spacecrafts camera moons image higher cassini earlier intended closest cassinis encounter 2011 obtained narrowangle 12 light yield flybys dec resolution linea dione 1123 top 698 epimetheus 113 cassini 86 image
150pf	1	NH	homosexual ncbi 1996 homophobia pubmed ar abnorm psychol function web ncbi javascript site warning requires management citation external file generate software georgia psychology usa university athens 306023013 department assigned aggression monitored penile buss 29 exclusively increases affect videotapes erection admitted individuals unaware exposed erotic individual sexually nonhomophobic questionnaire denies index
y7ssuH	1	NH	states patent united 8131703 appropriately fashion ordered methods generation list dynamic results satisfaction analytics rate individual responsive query feed web conversion provide attribute system priority systems criteria products reflects build website generating responses pagesproducts interrogates sitemaps records ranked user services based searches product data search target success database popularity engine
HgTxux	1	NH	safercar civic fwd honda 4 nhtsa dr 2012 compare encourages design ratings 5star consumers giving program safety shopping manufacturers safer car vehicles test lbs 2838 weight vehicle labels check ads listed marks performance nhtsas tests technologies advanced versions nhtsa meet rating driver learn dummy head fixed crash neck barrier rating
ABTTQm	1	NH	frb financial 14 information mobile releasefederal survey press 2012 servicesmarch reserve release date march 14 2012 financial point 25 mb additional consumers federal html access board bank 2012 phone ending card account 12 banking mobile months credit american future survey january pdf reserve security findings year technology consumers suggest usage
AlKHAe	1	NH	census features records newsroom 1940 edition facts editions special release features reasons marked facts 1940 long 2 archives 2010 early records world presidency edition roosevelt war 2020 history detailed profile compare raging national ii winding individual nations depression information lengthy make administration public europe plans notable included america momentous great
85LSBE	1	NH	storm tornado watch prediction 7 center status report watch messages 7 information network service national warnings visit iwin weather interactive high 70 40 mod high 70 50 mod 40 mod 20 low high 95 f2f5 probability forecaster 70 60 table event increased category tornadoes probabilities issuing 5 low moderate events
xftVG8	1	NH	apod star january factory 18 cygnus workings nearby 2012 fascinating discover featured written image explanation day photograph astronomer cosmos universe professional january 18 2012 infrared colors disperse winds galaxy astronomers swan sky prominently collide bubbles years entire lies cygnus large night translated telescope humans inflated constellation blue dense space sun
y8XVrE	1	NH	colleagues law senate challenge 35 health bailey senator kay care hutchison texas obama supreme senate washington states 35 file rtx law united court spending health bailey bipartisan hutchison today multistate dc amicus kay republican behalf colleagues challenge joined senator democrats years businesses trust poorly perfect 20 legislation tape passed unprecedented
JdDZ9e	1	NH	emotion brainderived regula ncbi pubmed fatigue physiol front 2012 function web ncbi javascript site warning requires management citation external file generate software town biology science university africa research department unit human medicine cape uctmrc sports south exercise proposed athletic saves brain attempts predicts decisions decade superior rapidly physiological nervous explain
2RAq0O	1	NH	national ruins aztec monument search ritual people house describe site reconstructed distant migration follow masonry ancient workers mortar passageways 500 holding today listen kiva search explore part drums puebloan echo pueblo great rooms fingerprints ancestral roof journey time timbers original 900year unesco site states culture world special 1987 united chaco
wP1wqt	1	NH	program exploration opposition mars opposition directly spinning perspective planets close earth sun sky mars east west circular staying opposite sets orbits opposition world rises sides entire perfectly night simple ovalshaped occur closer end space sun travel elliptical orbits opposition endwhen motion point years happen 26 sun mars weeks occurs closest
H5iYIl	1	NH	good 1969 ncbi game individual effects behavior appl anal pubmed behav function web ncbi javascript site warning requires management citation external file generate software university kansas childs recess involved children group winning meant designs lunch game reversal projects loss teams response successfully individual special inappropriate shared reading math tags team
zfTyoH	1	NH	solstice past night mission cassini images home image details smaller mimas 1123 396 dominates image dione side 698 measures 246 kilometers day miles view left mimas terrain trailing 20 area lit degrees north rotated dione moons saturnfacing hemisphere antisaturn side 559 image feet visible spacecraft meters cassini mimas sunmimasspacecraft 1833
yOCpXz	1	NH	week jackson nws flood safety ms awareness focus quarters questions saving centers web flash hydrologic advanced 2012 kills rise lmrfc satellites weekmarch presidential floods button solution public found river view declared google people national enables prediction result year disasters frontline jackson network ways sites forecast state safety participation doppler recently
QJi1p	1	NH	virus epsteinbarr information disease family developed years mild viruses human children adolescence susceptible young symptoms infected infection lives birth 95 present adulthood countries infectious common infants referred illnesses adults people herpesvirus states ebv united indistinguishable 40 member occurs worldwide maternal mononucleosis persons virus protection frequently antibody age infections 35 epsteinbarr
AvoDcr	1	NH	week blog united government national participate qa live protection usagov consumer states week est march session 2pm national question host protection 6 answer consumer tuesday complaint trade experts usagov questions commission provide government consumerrelated answer resources file scams company answers hand chance federal learn latest questions twitter experts chat est
iwEElv	1	NH	neurotherapeutics ncbi alzheim ketone pubmed 2008 bodies therapeutic function web ncbi javascript site warning requires management citation external file generate software shendersonaccerapharmacom colorado usa accera 80021 broomfield limited stores administration produced brain supplement including human betahydroxybutyrate disorders hypometabolism regionspecific exclusively potential animal fat early inhibition effects acetone represents substrate profound
xtK54N	1	NH	owners cope pet medlineplus hearts change pages related medlineplus seaman andrew people reuters chronic living pet health animal shows diseases companion york owners study healthier tickers heart feathery people variability japanese rate monitoring pet furry scientists higher 200 hearts found scaly didnt respond heart requirements disease rate linked stressful dying
9arQHN	1	NH	programmable energy star thermostats star energy products thermostats home programmable find partners partner energy thermostats year spends 2200 180 cooling setting programmable save household properly half maintaining settings average homeowners heating bills preprogrammed summer thermostat asleep home regulate temperature make helps easy programmable save offering homes winter settings thermostat money
wKCGGN	1	NH	betelgeuse enormity scale candidate approximately black stars size star aware hole larger betelgeuse 10000000 sequence betelgeuse 100000000000 estimated 100 galaxy suggest masses approximately 1 billion1011 stars crude main greater started lives supergiants estimate 30 times massive sun similar spend held bright galaxy layers outer spite possibly 50 naked small underwent
x3VLm1	1	NH	lowell fee park boott museum mills days free historical 2012 national cotton search enjoy newest remarkable ken boott national year unique salazar fees cotton memorial justice country museum mills sites parks encourage interior 2012from independence free lowell beauty freedom great park story jr cultural fee struggle america hall king luther
y9AfPU	1	NH	ag013736 full text gbm axitinib clinicaltrialsgov elderly ii multiforme patients glioblastoma phase view medication determine addition radiation investigational treatment axitinib therapy purpose 70 improve study patients outcome age states depends vessels determine find tumor united addition make administration approved preventing treatment characteristics grow good food forming axitinib standard blood response
7d7fD	1	NH	good manufacturing checklist practice guidelinesinspection gmp 24 february 12 1997 updated april 2008 cosmetic sec prohibits federal adulterated cosmetics interstate food 301 delivery misbranded commerce drug introduction act deemed 601 essentially adulterated cosmetic reasons sec deemed 602 cosmetic reasons sec misbranded prevent 704a cosmetic authority facilities sec determine equipment law
y2mB7J	1	NH	prevent stress healthy manage problems live healthfindergov health learn quick living guide connect website hyperlink nongovernmental direct application hhs consistent hyperlinks states services human subject information hyperlinked united application contained health endorsement department website intended provided visitors external constitute applications privacy appearance practices products policies purpose link redirected control feel
yyzL3Z	1	NH	march media social day awareness 2012 people bisexual streets homeless runaway victimization percent young heterosexual 334 transgender versus 587 gay lgbtq questioning report lesbian youth providers dealing wwwsamhsagovchildren children friends visit trauma resilient hope families heroes youth learn danger bisexual streets high homeless home streets1 victimization people young rates transgender
H0fE6F	1	NH	lowell national annual park preservation culture historic awards historical 2012 search development major superintendent stated national partnership community ideals peter contributions part give open stewardship acting future doors heritage resources acknowledging lowell intend reception recipients seeking park award cultural historic awards preservation promote areas organizations aucella annual credit benefit individuals
A113rm	1	NH	corps announcing creation blog fema discrmination age isnt 1824 set adults enter due mentioned apply odd develop 21 young long program wwwamericorpsgovnccc leader team offers americorpsnccc part workforcethat skills 18 age opportinuty nccc limit learn sector government workforce private expansion develop skills workers job cares join citizens corpssee httpwwwcitizencorpsgov tax
qO22	1	NH	return tax free preparation volunteers topics individuals irs resources programs assistance irs tax qualify elderly taxpayers offer free income counseling tce vita volunteer neighborhood people credit filing tax locations elderly disabled located irscertified malls return vita electronic centers special 50000 taxpayers provide convenient make generally sites libraries returns program income
HAjg0w	1	NH	mission hazy solstice cassini orange orb images home image details atmosphere titan visible pole cassini images hood blue bottom suggest top faint haze layers detected moons orange recent image polar north hazes beginning titans flip vortex learn south view north 5150 titan kilometers 3200 antisaturn miles side view color image
