wdFyf	1	NH	affordable making home map footer skip site content expert learn initiative reductions rate home administrations foreclosure mortgage variety housing options helps interest struggling easier affordable begin transitioning speak explore understand making servicer payment obama modifications refinancing programs homeowners mha deferred relief avoiding aid expectexplore programs mhawhat gathering documentation financial reasons
wbBJ83	1	NH	census jackson andrew records skip navigation census jackson andrew 1820 transcript 1830 census jackson andrew 1 transcript page 1830 census jackson andrew 2 transcript page census jackson 1840 andrew 1 transcript page census jackson 1840 andrew 2 transcript page census return presidents main page files information adobe require accessibility free
mtjIfO	1	NH	conscious medical medlineplus surgical encyclopedia sedation procedures anesthetic medicines speak pain combination relax dental stay awake conscious medical sedative block sedation procedure activities return conscious quickly lets sedation everyday recover procedure give clinic doctor hospital anesthesiologist quickly medicine sedation outpatient dentist wear procedures nurse short conscious uncomplicated time shot feel
3Sx2WM	1	NH	questions men answers sex donations blood men sex msm donations blood policy fdas epidemic sex states aids increased united group hepatitis msm donors risk hiv transfusion men blood beginning 1977 infections deferred transmitted time interpretation states lifetime behaviorbased information united 21 union decision msm workshop nat policy donor consistent european
zb0i4q	2	NH	apod march flying 5 night earth 2012 fascinating discover featured written image explanation day photograph astronomer cosmos universe professional 5 march 2012 atmosphere earth captured spectacles rousing sunlit orange wave dark half progresses clouds brightness lightning approaching set sequence seas frame video dawn blue space purple lights haze international occurs
yUzuQt	4	NH	march house photo white day 2012 state union video watch enhanced transparency commitment browse house white logs visitor wait executive actions president obama federal receipt tax federal dollars tax spent people petitions create sign house inside white tour interactive house 2012 check offices photo march picks white day 30 force
AfH3MG	1	NH	batteries smoke alarms weekend change year washington alerting cpsc batteries buildup saving monoxide consumers commission families deadly sunday safety 11 product march homes fire dc lives carbon replace weekend begins jobs daylight smoke time alarms fresh consumer urging yearly deaths 386300 estimates cpsc fires residential average resulting 2400 2006 2008
yX4Srq	1	NH	plant management usda service invasive agricultural february research 3 news 2012 insights information cheatgrasschoked image rangeland steppe click supporting image desirable forbs shrubs click information grasses rangeland mix perennials ars managers usda ore invasive vary recognize agricultural agriculture decade management matrix agency research helps scientists resulted usdas development plant scientific
bGiVgQ	1	NH	dale vice house announces disability biden joe assistant policy president white special kareem state union video watch enhanced transparency commitment browse house white logs visitor wait executive actions president obama federal receipt tax federal dollars tax spent people petitions create sign house inside white tour interactive homeowners refinancing house twitter
A3vOk9	2	NH	mission solstice prometheus cassini images home image details image collision ring 86 moon white drapes outermost prometheus kilometers shaping center bulge 53 miles learn small perturbs soft encke kinky discontinuous image visible ringlets ring rings ringplane 1 stars degree southern gap background ringlet unilluminated learn view side left acquired image
AE29GO	2	NH	lessons ncbi effect research pubmed jama placebo 2011 recent function web ncbi javascript site warning requires management citation external file generate software galveston blvd usa 77555 family humanities institute medical medicine branch 301 department tx university texas habrodyutmbedu activity browsing empty recording activity turned recording turn back information usa 20894
18pdxi	1	NH	volcanocams volcanic mount st helens monument national volcanic mount st helens monument national bridge tty 98601 wa monument ne headquarters 4497800 8915003 42218 yale amboy 360 box observatory ridge wa 98649 lake po 24000 326 360 toutle johnston 2742140 spirit highway helens toutle feet static north realtime approximately located ridge
xl8O0c	1	NH	grant grantsgov opportunities synopsis opportunity find precedence service disk electronic click information grant provide notification send inconsistency document email resolved notifications printed address opportunity emails change receive thing giving original requestedany modification description represent newest file oldest previous shown documents current document sections files background representing modifications arranged changed list
tcYhB	1	NH	star energy air insulation sealing works star energy join homes benefits features air qualified insulation home sealing works summer dont energy installed insulation home open leakage improperly 20 winter leaks pay percent window waste time heat cool homes air outdoors typical holes diagram lighting home homes penetrations wiring air leaks
UT2FE	3	NH	house white state union video watch enhanced transparency commitment browse house white logs visitor wait executive actions president obama federal receipt tax federal dollars tax spent people petitions create sign house inside white tour interactive event live facebook discussion participate click member facebook give click questions comments httpwwwwhitehousegovvideo ondemand library
w8wz	5	NH	picture astronomy day fascinating discover featured written image explanation day photograph astronomer cosmos universe professional 11 2012 bright distant earth disk 20 fit easy weeks apogee photographed perigee dark day telescope pacific dense sun asia moon smallest full 300 annular 240 kilometers path super silhouetted filter point image visible smaller
aT0jpI	1	NH	home gtr ncbi function web ncbi javascript site warning requires genes tests labs records gtr including conditionsphenotypes find types tests locations disease searching phenotypes symbols directors names test laboratory protein gene find drugs disease proteins searching phenotypes find traits names analytes conditions genes searching phenotypes symbols names gene conditions find
130rZ5	1	NH	island national seashore assateague search enjoy coastal move rest existence continent sandy recreated visit forests day live bays life recreate relax time assateague maritime explore marshes waves beaches island salt ocean edge place adapted wind enjoy make thrive horses beauty assateague extraordinary distance island continue wild enjoy barrier ages visitors
wT7eLi	5	NH	february 15 da14 asteroid earth nearearth miss 2013 2012 discovered bring radii earth rapidly northern sky 4 fade 2013 2012 evening shadow occurring february brightness morning naked magnitude fainter meters traveling 1926 pass close closer sun reappearing approach small eye 35 diameter ring size earths quickly asteroid visibility nearearth spain
xBhvtQ	1	NH	catalog pia15115 page limited supply mission martian rovers rover winter mobility portait mars shows approached power nasas solar dust opportunity reduces cleans exploration panels accumulation wind mission martian images rovers 24 2011 21 camera opportunitys pancam panoramic mounted sols mosaic 2814th omits days downwardlooking 2811th mast dec view wavelengths 601
yBGCtI	1	NH	inflammatory text support clinicaltrialsgov stem cell chronic full demyelinating polyneuropathy hematopoietic view dose treatment affected kills weakness stop undeveloped treating progressive progression reduces nerves respond fail capacity cell body stem likelihood atg protect study drug designed inflammatory previously cyclophosphamide due chronic tingling system demyelinating attack collected polyneuropathy circulate function infusion
mZKOnE	1	NH	mobile homophobia pubmed homosexua 1996 aug10534405 abnorm psychol georgia psychology usa university athens 306023013 department assigned aggression monitored penile buss 29 exclusively increases affect videotapes erection admitted individuals unaware exposed erotic individual sexually nonhomophobic questionnaire denies index perry increase participants consisting men groups group circumference 35 female differ 1980 basis
