ruG5h8	57	AZ	start 1940 census research skip navigation national searching index district 1940 enumeration located charge 2 archives online opens 2012 locate free address census april release http1940censusarchivesgov order search access httpwwwarchivesgovresearchsearch opa online public census delaware 1940 sussex county maps state enter milford sussex including town search census 1940 delaware maps
HxvPXO	2	AZ	gynecol comparison ncbi afroa shapes 2000 invest vaginal pubmed obstet function web ncbi javascript site warning requires management citation external file generate software group usa nc research durham health womens anterior positions introitus significantly polysiloxane afroamerican shape seed longer subject standing shorter 23 measurements 40 cast 1 width vagina introital
JDOkF	2	AZ	park canyon bryce national search limestone force series hoodoos canyon horseshoeshaped carved worldly consists rainwater slot colorful eastern plateau claron power geology canyons shaped spires paunsaugunt fins formation erosional unique bizarre dissolving bryce famous windows frostwedging shapes edge rock amphitheaters including called year event astronomy 20 festival skies offer annular
lroTJ9	1	AZ	mountain wildlife lion fish account parks hand spray montana bear pepper pound researcher female hound mountain story rich pepper experienced bear 120 spray fwp radiocollared lion experience protected desimone researchers garnet pepper feet lion female mountain kittens radioequipping research brian east mountains 10 assistant june bear deter spray capturing study
d6irAr	3	AZ	center tornado watch prediction 133 storm 133 status report watch messages information network service national warnings visit iwin weather interactive 40 mod 20 low 30 mod 30 mod 50 mod 40 mod high 70 f2f5 probability forecaster 70 60 table event increased category tornadoes probabilities issuing 5 low moderate events
HjWEgS	1	AZ	frb supply issuesjune demand gas 2003 greenspannatural testimony 10 seasonal major limited colder relative liquefied lng abundant significantly canada united imported winter working storage access tight restricts production low supplies net norm shipments marketed increased worlds gas levels drilling sharply import prices capacity response expand recent states natural room augment
Hidnm2	2	AZ	states mileage government gas blog united usagov improve alternate people lots travel forms increasing mileage transportation gas prices improve lower ways costs car assume average estimates source cost 396 gallon price energysaversgov responsible comments content hope conversations polite 13 older discriminate views delete comment questions violate discussion comments continually add
HT0Jqi	1	AZ	apod star m46 m47 young april 3 clusters 2012 fascinating discover featured written image explanation day photograph astronomer cosmos universe professional april 3 2012 planetary years bright distant galaxy ngc sky young clusters sunlike colorful 10 represents appearing m46 50 patch small upper foreground m47 born sight portrait 80 estimated
pkNgfi	1	AZ	map national corps map national skip links national revised period due past cartographers suspended funding forms maps program usgs citizen ngp decades limitations map collection sponsored data 2008 projects volunteer geospatial share years platforms information networking mapbased georeference sites easy internet social services technologies types recent made produced volunteered information
zpMNgP	1	AZ	inmate andriano 191593 frequenting bars discreetly discontent andrianos poisons obtain engaging cease poison ordered insurance researched affairs resentful business profit began separate extramarital responsibilities policy scheme life increased allegedly pose death effects andriano friends working ill wendi kill hatched asked husband psychologically physically observed andriano abuse signs claimed friends abused
HUPLCu	1	AZ	thomas congress text bill library 112th 20112012 612 ih hres homicides parties asserted ground 17yearold honoring defenses repeal state trayvon life full investigations martin law offender pursue florida admonishing stand involved urging committee wilson brown judiciary cleaver florida submitted ms mr hastings resolution referred homicides parties asserted ground 17yearold honoring
aQW6i8	2	AZ	storm tornado watch prediction 135 center status report watch messages 135 information network service national warnings visit iwin weather interactive 50 mod 30 mod 30 mod 30 mod 60 mod 40 mod high 80 f2f5 probability forecaster 70 60 table event increased category tornadoes probabilities issuing 5 low moderate events
HFTEus	3	AZ	house white april photo day 2012 state union video watch enhanced transparency commitment browse house white logs visitor wait executive actions president obama federal receipt tax federal dollars tax spent people petitions create sign house inside white tour interactive house check april offices photo 2012 picks white day official house
H8NvHQ	1	AZ	risk mobile pubmed mellitu statin diabetes med 23172214452 jan intern 9 arch epub 2012 rochester usa mayoclinic hospital mn methodist newonset initiative statin mellitus health diabetes dm incidence whi investigates background women study participating postmenopausal womens status obesity methods analyses hazards adjustments years states confounding year statin aged centers captured
wmELwr	1	AZ	inmate delahanty 242703 shot avenue police window sped instantly sitting christopher intersection presented arrested gun officer force back seat seconddegree result plead cactus driving men days license conceal guilty david turn conducted testimony asked road striking uribe vehicle head murder testified 31st effort lunged 10 stolen abandoned car passenger plate
zq9eU0	1	AZ	inmate gonzales 058534 wagner burglary committed gasping cut 20 23 residential fled penalty stabbing returned tucked lobe stop underneath 1991 front stabbed murder february skewered arrested robbery lung husband pleas 7yearold house back aggravated arm shining opened gonzales celebrated firstdegree vcr 7 consecutive 911 deborah terms death police yard wagners
Hb1ugp	4	AZ	iud mistaken medlineplus safety doctors page related medlineplus amy norton providers mistaken reuters safety health government iud york doctors study contraceptives suggests beliefs control birth contraception theyre centers preventions referring crystal iuds tyler led form sterilization safe reversible women effective study disease nulliparous cdcs whove control copper intrauterine birth contraception
HWvUCE	6	AZ	due hazard bicycles bikes fall recalls public named washington instructed voluntary consumers illegal commission safety cooperation announced firm product stop dc recalled resell attempt immediately products today recall consumer product bicycles year model 2010 2012 units 4100 francisco san importer bikes public pedals taiwan wellgo corp manufacturer pedals fall hazard
ySQVYW	1	AZ	inmate 038977 dixon detective serving profiling committed years murder identify jury crime sexual identified 1986 wayne indicted death 20 opened technological sentence advancement sentenced raped state suspect dixon 7 tom assault case life arizona clarence tempe killer scene 21yearold apartment connected student 30 dna stabbed strangled deana bowdoin conviction 1978
2YZs1o	1	AZ	fdsys browse bills congress senate house states types legislative united proposals representatives bills congressional hr house chambers president approval law require senate signature bills limited senate house approval chambers resolutions amendments constitution res generally propose hj joint appropriation purpose president matters require single specific sj signature force senate house approval
wMLGAG	1	AZ	facility ca area recreationgov mt details permit whitney woods human wilderness zone offers choose sierra seeking day dreams californias respectful leave continue inyo challenge national back travels hikers water memorable beginning wildlife experience place hiking backpackers expected john undamaged park trail whitney trek waste solid mount mt starts trips pack
HYPlxa	1	AZ	acids ncbi res backbone disease nucleic pubmed ontology 2012 function web ncbi javascript site warning requires management citation external file generate software md school lschrimlsomumarylandedu usa sciences institute university medicine epidemiology health genome department maryland public baltimore ncis influenza human speed httpdiseaseontologysfnet web knowledge graph source biomedical inherited integrate extensive
HPpRBA	1	AZ	rmrsgtr42 vol cultural fire 3 wildland effects ecosystems archaeology resources mountain publications station rocky research resources vol cultural fire 3 wildland effects online archeology ecosystems rmrs publicationrmrsgtr42 ann eds agriculture kevin cassandra koerner service rep research 3 station forest department collins resources 2012 trinkle lee mountain fire cultural wildland effects
gEiClN	1	AZ	records 1940 census skip navigation reasons number evidence individual 82 employment insurance 17901930 federal research natf passports form genealogical birth schedules pages population census benefits age order place social security 1 information part general census start 1940 research 2 part finding aids 3 part part 4 videos articles part 5
HMOHkZ	1	AZ	hip added risk cancer study medlineplus materials replacement pages related medlineplus cancer people tuesday device healthday news risk replacements 3 hip increased years receive study metalonmetal april uk longerterm report universities study bristol researchers exeter england cancer national general examined compared procedures 1 rates wales hip million records replacements registry
HdaGD5	2	AZ	ncbi int follicular pubmed therapy maintenance rituximab prescrire 2012 function web ncbi javascript site warning requires management citation external file generate software protocol firstline noteworthy lack results dose mabthera including questions suffer impact adding lymphoma based disorders progressionfree iii confirmed radiological musculoskeletal treatment 401 persist mortality survival practice therapy effects
Ht0jL7	1	AZ	daniel goldin aeronautics revolution high daniel space agency transform program safety approach public administrator initiated deliver cheaper nasas faster lower goldin programs enabled americas longestserving sacrificing budgets tenure american bureaucracy spring human expensive develop agency long nasa pursuing imbalance administrator flew observers robotic missions criticized perceived 1992 goldin bloated infrequently
HhutQx	1	AZ	cancer study fight veggies cabbage medlineplus broccoli breast pages related medlineplus cancer tuesday cruciferous foods healthday suggests top 3 eating survival breast news super broccoli improve odds april study vegetables cancer cruciferous disease 62 compared vegetables percent recurrence china breast women die study 35 diagnosed found consumed researchers kale cruciferous
AqtEBG	1	AZ	haematol incidenc ncbi addition reduces pubmed br rituximab 2012 function web ncbi javascript site warning requires management citation external file generate software division school hematologyoncology center usa zagreb joarmitaunmcedu university microbiology ne email medicine nebraska croatia internal department pathology medical omaha activity browsing empty recording activity turned recording turn back
HCohAb	2	AZ	apod march paris 31 night 2012 fascinating discover featured written image explanation day photograph astronomer cosmos universe professional 31 march 2012 210 meter visible earth 25 paris top young location lovely skies evening march familiar explanation de train western montparnasse line conjuntion large venus celestial recognize gently arc jupiter crescent
AEBSjT	1	AZ	inmate garcia 047398 dollar steve ended 20 21 prison lady fled bank occurring bar proceeded james drop arrested gun large garcia shots bills bars force scuffle sentenced codefendant defendants firstdegree told sheffield pled path withdrew atm guilty amount scene owned unsuccessful owner ordered refill armed city spoke dropping entered head
HAjg0w	6	AZ	mission hazy solstice cassini orange orb images home image details atmosphere titan visible pole cassini images hood blue bottom suggest top faint haze layers detected moons orange recent image polar north hazes beginning titans flip vortex learn south view north 5150 titan kilometers 3200 antisaturn miles side view color image
H4L9Zk	1	AZ	dad apod omicron quiets 1 april ceti 2012 fascinating discover featured written image explanation day photograph astronomer cosmos universe professional 1 april 2012 planetary pointing pointed sleep row blast father late questioned folks dramatically dad possibly world day disturb increasing brightness unstable home ceti apod shares humorously monsters shows august
zKiE89	1	AZ	fair marshmallow launch house science white state union video watch enhanced transparency commitment browse house white logs visitor wait executive actions president obama federal receipt tax federal dollars tax spent people petitions create sign house inside white tour interactive adobe player flash content download view 301 february 07 2012 named
ep7bKB	1	AZ	oil listing gas illinois part 240 act sections chapter mining oil natural title gas illinois 62 part 240 act department resources provisions subpart general subpart wells application production permit procedures subpart uic wells ii application permit procedures class subpart spacing wells workover subpart drillingcompletion requirements requirements subpart reporting forproduction wells
HiPpYK	1	AZ	states united lottery government blog won usagov asked anonymous lottery won run lotteries states individual follow winners slightly procedure powerball winnings states follow handle statebystate basis state bought run multistate lotteries megamillions ticket procedures teams rules generally state winners lottery learn state responsible comments content hope conversations polite 13 older
HPbaeU	1	AZ	melanoma adults study rise young medlineplus rates pages related medlineplus adults cancer skin healthday 1 melanoma highlights young research increase sunday potentially rates fatal hit form dramatic news women april hardest fourfold incidence increased men women melanoma study young 1970 eightfold 2009 findings county clinic looked minn olmsted 18 patient
t5auhA	2	AZ	arts california council give tax minimum council contributions arts californians 1076 section curren state program overhead 250000 passed administrative 2010 return price fund allowing sb legislature programs annually remain costs donations senator deductible support attain arts taxes click state video quick check ads printweb ads spread word click info information
k8eVQd	1	AZ	circumference penile ncbi study urol length 2001 pubmed 3300 eur function web ncbi javascript site warning requires management citation external file generate software italy university department urology florence size disciplines estimates knowledge provide young interest extensive normal males dimensions external considerable penile carried study variations genitalia male italian set weight
HH4xjk	3	AZ	video dental medlineplus health worries news javascript adobe flash enabled content player version 8 requires flash pages related medlineplus fills simple thought dentist steps smiling fear people feel comfortable trip heres health dental dentist important affect care anxiety triggers gums teeth problem called haines matters im healthday doctors news dr
d0iKKk	1	AZ	corps monthly themes preparedness citizen 2011 events communities uniting preparing nation locate login contact council moved page httpcitizencorpsgovnewseventsthemes2012themesshtm andor links update questions bookmarks citizencorpsdhsgov email readygov corps notices disasterhelpgovcitizen plugins home fear register privacy federal faqs femagov citizen widgets act policy dhsgov data foia bulletins annual reports servegov contact bannersaccessibility
zCaLwp	1	AZ	apod scale march 12 universe interactive 2012 fascinating discover featured written image explanation day photograph astronomer cosmos universe professional 12 march flash player version recent adobe 2012 bring human galaxy flash proportion window spread discovering humanity descriptive familiar stop speckled possibly items smoothness vast bar sizes large small version ten
RFDtO	1	AZ	arches park national search inspire trails discover wonderland colors balanced landscape red giant sunsets amaze addition visit 2000 formations fins pinnacles textures contrasting park landforms hundreds world stone natural unlike soaring refresh rocks arches massive rock evening point watch solar 20 nearlyfull join panorama eclipse 2012 join park online share
rAtlFb	1	AZ	requirements reporting faqs payment card news essentials newsroom topics irs resources revenue settlement special network service irs entities internal 1099k begin thirdparty form transactions reporting payment card transitional required relief banks providing notice 201188 201189 faqs special information requirements network details 2011 2012 scheduled begin thirdparty transactions reporting occurred early
I6YG2p	1	AZ	circuitry ncbi evo temporal brain cereb underlying cortex pubmed 2012 function web ncbi javascript site warning requires management citation external file generate software usa ma center martinos biomedical 02129 charlestown imaging subserving produced brain underlying including human commonly fear putamen regions environment symptom occurring magnetic increased activation functional nausea evolution
cjYwfD	1	AZ	schedule wsdot ferries dockbound viaduct wednesday 510the jackson marion construct entering close 5 impact driving offloaded drivers due thursday access exit 9 terminalawv utilizing 2012 activities customers colman 7 awv pmseattle southbound underneath dock construction traffic western northbound affect change diverted yesler 10 alaskan 0925 vehicles overnight exiting street enter
4kIXux	4	AZ	reports fatalities catastrophes events weekly reports fatalities catastrophes events weekly description webpage fatalities table summaries weekly area workers include updated complete employers link report list summary oshaapproved incidents catastrophes inspection links citation states hospitalization information state investigation offices plans hours reported osha investigates preliminary operate resulting workrelated fy12 reports fatalities
yrfXg6	1	AZ	inmate 136521 anderson shot agreed held kill poyson leta cut 21 bludgeon finally kagen gave hit killed bread ended bobby 50 rock trailer lantern crushing decided home driving robert knife eating august frank night hitchhiking hours death wear boy 39 yard dinner cinder block son county delahunt awoke 15yearold letas
H4EdtZ	1	AZ	solstice quieted mission storm cassini images home image details giant saturns northern encircling storm learn chronicling mimas kilometers visible bright 179 size saturns due tiny detected 504 image join lost planet miles small 396 speck 313 likewise past 111 epimetheus 113 discerned rings moons 246 70 appears extreme center barely
HILtkF	1	AZ	1999 overpasses shelters oklahomakansas tornado 3 violent fallout outbreak highway golf shield cdt radar 25 20 tx black location struck 937 worth interstate eastward underneath supercell wsr88d reflectivities large stopped red night hail intensity lancaster falling numerous highway shows bridges overlaid path actual april south reds image size area reflectivity
HQWAod	2	AZ	uscis study civics materials test questions pass tools answer prepare materials correctly 6 interview 10 started test 100 study list civics naturalization asked additional section products select short naturalization process overview video test providing highlighting citizenship rights responsibilities civics video history audio format official list answers civics mp3 questions test
zS1pJa	1	AZ	med humanitys ncbi pubmed calcium supplement assoc thai doubleedged 2011 function web ncbi javascript site warning requires management citation external file generate software orthopaedic university bangkok todrnarongyahoocom department thailand surgery mahidol contained coupled house cd sample amount chelated pollutions salts mercury preparation based lead animal oyster coral technique carbonate naturalraw
w4NJML	1	AZ	inmate 174456 cromwell sentenced march louis robert 2003 6 cromwell count 1 sentenced murder degree maricopa 82001 death cr2001095438 county short committed lethal injection october stephanie 0351 dispatch female apartment police approximately call 8 hysterical received stick baby daughter october identified 3208 believed male ran dead heard street home flower
zDMXdU	1	AZ	training sci ncbi compe fluid sports pubmed electrolyte 2011 function web ncbi javascript site warning requires management citation external file generate software school university sshirreffslboroacuk sciences health uk sport exercise loughborough warmhot thermal aggressive electrolyte 24 rapid sodium hot production induce electrolytes drinking 410 replacement competition euhydration encouraged aerobic subsequent
LR5gJ	1	AZ	nsacss national cryptologic museum mondayfriday office 400pmsaturdays library month numbers 3016885847 1st 3016885849 1000am 3rd holidaysphone museum email fax 3016886857 shop 200pmclosed 3016882145 gift sundays 900am federal scheduled group advance tours moments nsa profession gateway principal devoted glimpse artifacts museum cryptology agencys visitor heritage maryland thousands serve dramatic lives catch
HPbcn7	1	AZ	alzheimers medlineplus health video news prevention javascript adobe flash enabled content player version 8 requires flash pages related medlineplus keeping older healthy brain fun prevent americans alzheimers life million early develops important minute disease person steps common letters adults show library sharp compared group people young alzheimers read folks lives
HcbCHX	1	AZ	office revenue personal tax daily controllers april state tracker california income 2012 personal tax month april income revenues 2012 major revenue tax month provided source personal daily state income john big tally controller receipts taxes april chiang show month 130 7171 reports total personal projected state income collected net billion
wJPcoM	1	AZ	inmate 057713 ellison opinions handsproceedings charles victim committed previous 24 death pecuniary smith tape pending judge february lillian january verdict release vincent homicides direct depraved defense home richard robert moon masking appeal arizona choked conviction trial published bound commission convicted start joseph cords prosecutor suffocated telephone heinous gain broke circumstances
zZ1zsG	1	AZ	inmate cropper 091432 lumley committed perryvillesan murder throat brent cell juan response inmate unit 7 department contraband knife arizona march stabbing cropper murdered locked 1997 place officer corrections found shutts miller marshall steinle sentencing defense richard robert heilman start 3 joseph roland 6 colehon john resentencing plea honorable judge 2
dChmXs	1	AZ	splenomegaly encyclopedia medical medlineplus spleen normal enlargement splenomegaly size platelets maintains part blood filters lymph organ spleen healthy cells system white red functions variety system malignancies conditions affected involving blood lymph wide spleen infections disease liver symptoms splenomegaly include prevent including rupture limitation spleen avoiding sports contact trauma activity follow
xXGIJ9	1	AZ	february media social day awareness 2012 impair stress ageappropriate capacity mental developmental youths reach ptsd challenges health disorder posttraumatic goals providers dealing wwwsamhsagovchildren children friends visit trauma resilient hope families heroes youth learn juvenile mental prevalence years challenges suffer greater stress1234567 justice generally system noting health rates document numerous higher
HUwt3C	2	AZ	junction service commuter start station rail rigov train announce ridot wickford ten facility boston rod commuters offer junction 20 monday service rhode kingstown april thursday day start station 5 warwick department 1011 2012 transportation commuter 10 friday rail train ridot ma wickford announcing ri garage island north providence trips road
xl8O0c	1	AZ	grant grantsgov opportunities synopsis opportunity find precedence service disk electronic click information grant provide notification send inconsistency document email resolved notifications printed address opportunity emails change receive thing giving original requestedany modification description represent newest file oldest previous shown documents current document sections files background representing modifications arranged changed list
HxGPkv	7	AZ	apod april tungurahua 2 erupts 2012 fascinating discover featured written image explanation day photograph astronomer cosmos universe professional april 2 2012 1300 roughly high tungurahua erupts years shines cloud peak glows photographer sky lavalit 5000meter located hot 2006 captured starlit white image pictured ejected pours explanation distance visibly dark fell
dxPgYk	1	AZ	145 center watch thunderstorm prediction severe storm status report 145 watch messages information network service national warnings visit iwin weather interactive 20 low 5 low 30 mod 30 mod 40 mod 20 low high 70 f2f5 probability forecaster 70 60 table event increased category tornadoes probabilities issuing 5 low moderate
wNoMgn	1	AZ	inmate 036366 gallardo shot chair death father answered early records hands burglary day found side kidnapping college entering home peter gallardos cell firstdegree 300 struggle arcadia residence afternoon confronted point bound feet 20yearold dna assumed convicted call cords pm mike murder door phone broke butt work rudys called sentenced proved
