wKsMK6	4	PA	loss study hearing americans medlineplus untreated millions pages related medlineplus hearing americans healthday news aged 27 feb million 15 lost older wednesday finds benefit aid study 50 major dont people hearing aids insurance aging inevitable covered concern part lives loss training integrating receive daily theyre researchers process johns inconsequential professor
7nno	1	PA	apod star 14 trails march 2009 hauteprovence fascinating discover featured written image explanation day photograph astronomer cosmos universe professional 2009 march 14 bright earth rotates 24 fix circle made february nicely traced venus traces alexandre sequence trails santerne astronomer arc constellation bottom poles consecutive shows foreground 300 dome telescopes hauteprovence
AAeJZw	1	PA	bio kerwin joseph astronaut 487 md kerwin mc usn ret joseph astronaut captain nasa classical ann hobbies born personal oak illinois music danville reading daughters good grandchildren park 1932 shirley data february 19 married pennsylvania december washington worcester general high college navy flight education arts 1949 degree district doctor fenwick
e40nOS	6	PA	10 business sbagov steps follow starting financial links series manage planning decisions prepare legal click easy activities business plan key 10 completing steps learn making starting involves successfully tools create start written resources map run business plan guide business expanding financing free plan services counseling relocating training advantage securing preparing
xmYtAV	1	PA	teapots dancing ganz burn due hazard recalls named washington instructed canada voluntary consumers illegal commission safety cooperation health announced firm product stop dc recalled resell attempt immediately recall products today consumer product teapots dancing canada united states units 2100 170 usa ganz cheektowaga ny importer llc handle burn hazard water
ALAz	20	PA	washingtons birthday george skip navigation legislative records washington commission 148 bicentennial 1932 1931 rg commissions branch stuart gilbert copy painting george george established congress federal celebrated eleven permanent holiday monday holidays birthday february washingtons declared decides national binding states apply district federal state legal holiday columbia congress government holidays julian
1bJVh1	1	PA	458 deduction topics tax topic educator expense irs resources trade 1040a including 250 eligible 500 form joint qualified line 16 married courses computer athletics deductible deduct educators tax related expenses supplementary books year claimed education unreimbursed physical spouses equipment health educator supplies business paid services incurred classroom 1040 23 deduction
wiBYmL	1	PA	apod 20 ngc february spiral barred 1073 galaxy 2012 fascinating discover featured written image explanation day photograph astronomer cosmos universe professional february 20 2012 years bright centers galaxy system ngc young black prominently clusters spectacular dark bar 55 red upper bars telescope sea constellation space xray captured orbiting cetus pictured
yhDJhD	2	PA	dfg program share hunting program hunting 1812 sacramento ca 95811 street 9th dfg felis ac lacus ornare purus morbi eleifend sodales tellus ligula quis tristique eu netus nec nam vel metus arcu commodo ipsum gravida eget volutpat turpis nibh donec malesuada suspendisse accumsan aliquam cras tortor ut ultricies posuere habitant
gLJnHS	1	PA	city fund seattle technology matching technology community fund technology matching engagement inclusion technology civic access digital increasing supports reach fund goals communities citys projects literacy underserved access technology literacy engagement civic background divide fees community technologyhealthy franchise grants close technology matching established administered communitys labor encourage program digital department matched
mNYfwY	1	PA	heart living healthy live healthfindergov health learn quick guide connect website hyperlink nongovernmental direct application hhs consistent hyperlinks states services human subject information hyperlinked united application contained health endorsement department website intended provided visitors external constitute applications privacy appearance practices products policies purpose link redirected information usaccessibility privacy mapcontact act
xOPZAf	3	PA	birthplace theodore national site roosevelt historic pets search pony house held 1902 police photo white mounted roosevelt algonquin officer quentin children badger eli evans beloved captivated bear dr yale small house hard onelegged roosevelt kermit mirror peter barn blue guinea pets admiral ogrady spreckle baron algonquin bob owl named childrens
q8oag	1	PA	crossing borders dhs information updates email official nexus states including entering id children united travel approved card passport document merchant business present airports citizens kiosks air orders military mariner 1 june 2009 beginning top back secure travelers states including entering children present united travel air passport document information resident continue
jSNUzQ	1	PA	hsf realtime space human flight data control uptotheminute mission spacecraft path data make sky project applet reside significantly 336 download skywatch cache approximately access internet files 144 downloading 300 sufficient downloaded data 10 hard minutes clear required drive connection nasa time modem kbps updated official responsible amiko curator notices nasa
6MDKYT	1	PA	assembly watch general video indiana skip navigation ingov displayed disabled message note 1 2 css information read policies standardscompliant browser resolution constitute video result council ic legislative provided profit adopted assembly intended permission commercial meaning part intent purpose coverage general enacted tangible 2511 person benefit act audio expression history support
wS4tnP	1	PA	full melanoma characterization cells circulating clinicaltrialsgov tumor culture cancers ctc text view participants purposes determine laboratory circulating isolated detected samples collected techniques healthy accurately blood melanoma comparison cells tumor solid cancers ctc volunteers study purpose passwordprotected relevant physicians lines correlations results stored manner grown information research cell participants coded samples
zsC8Sh	1	PA	control stethoscopes ncbi pubmed hosp infect epidemiol evaluation 2012 function web ncbi javascript site warning requires management citation external file generate software case school usa university western cleveland medicine ohio reserve activity browsing empty recording activity turned recording turn back information usa 20894 center pike rockville national md library bethesda
csP84E	1	PA	information explorer sheet institution space national smithsonian air source astronautics department data museum image enlarged version click geophysical jpl laboratory states officially year earth technology instrumentation united van built james propulsion direction state program international pickering satellite iowa exploreri 19571958 william aloft part california designed alpha dr 1958 jet allen
yInBWz	1	PA	youth preparedness corps citizen communities uniting preparing nation locate login contact council moved page httpcitizencorpsgovgetstartedyouthyouthindexshtm andor links update questions bookmarks citizencorpsdhsgov email links plugin require plugins page view readygov corps notices disasterhelpgovcitizen plugins home fear register privacy federal faqs femagov citizen widgets act policy dhsgov data foia bulletins annual reports
150pf	5	PA	homosexual ncbi 1996 homophobia pubmed ar abnorm psychol function web ncbi javascript site warning requires management citation external file generate software georgia psychology usa university athens 306023013 department assigned aggression monitored penile buss 29 exclusively increases affect videotapes erection admitted individuals unaware exposed erotic individual sexually nonhomophobic questionnaire denies index
vdIG8a	1	PA	full chronic lymphocytic leukemia clinicaltrialsgov pci32765 text small cases lymphoma special view background immune treatment half affect lymphoma 50 individuals small respond people abnormal elderly treatments health standard groups drug pci32765 diagnosed hardtotreat cancer lymphocytic chronic addition create system fight genetic treat chemotherapy white cllsll hurt lymph 17p cells cancers
wUqqes	10	PA	house white state union video watch enhanced transparency commitment browse house white logs visitor wait executive actions president obama federal receipt tax federal dollars tax spent people petitions create sign house inside white tour interactive event live facebook discussion participate click member facebook give click questions comments httpwwwwhitehousegovvideo ondemand library
eWgcf3	1	PA	web federal fafsa deadlines student aid colleges federal pay attention deadlines state deadline legal student year click school applying residence deadlines state enter aid view dakota nevada prince wyoming minnesota micronesia rico edward alberta puerto maryland marshall texas carolina iowa saskatchewan michigan utah virginia hawaii qc ohio samoa newfoundlandlabrador quebec
wDOhOt	2	PA	natural senate energy committee resources sector energy modernize electricity seeks 2012 power standard generated nations future clean act guide bipartisan management resource reserve federal responsible stewardship strategy lays act helium 2012 files ferc documents item addition attached chairmans find au letter murkowski senator linked amendment text act joint result substitute
wkVLBo	1	PA	story ridge oak national tip laboratory researcher idea laboratory staff story oak relations member interview national end energys department external ridge arrange tip identified communications contact biology toxicity tailoring nanoparticles laboratorys ron discovered paper nanoparticle previous cell real division diseases dependent tailor silver treating 5760226 underscores titled findings national langmuir
ddv4j3	1	PA	nida brain games libs teens feelings juice names dopamine confusing things make responsible chemical complex good scientific article appears term word called happy reread text replace hit provided space create submit type terms scientific words article easytoremember made synonym button synonyms fun original words type enable icons share javascript content
xtK54N	2	PA	owners cope pet medlineplus hearts change pages related medlineplus seaman andrew people reuters chronic living pet health animal shows diseases companion york owners study healthier tickers heart feathery people variability japanese rate monitoring pet furry scientists higher 200 hearts found scaly didnt respond heart requirements disease rate linked stressful dying
y2mB7J	7	PA	prevent stress healthy manage problems live healthfindergov health learn quick living guide connect website hyperlink nongovernmental direct application hhs consistent hyperlinks states services human subject information hyperlinked united application contained health endorsement department website intended provided visitors external constitute applications privacy appearance practices products policies purpose link redirected control feel
pJd4xO	1	PA	exerc en ncbi res adopt focus pubmed external sport 2011 instructions function web ncbi javascript site warning requires management citation external file generate software davidmarchantedgehillacuk university edge hill uk activity department sport lancashire ormskirk physical control seventeen tasks significantly exercisers influence focus muscular press experienced research previous attentionalfocusing compared benchpress
nZNM6z	1	PA	specialist lichtenberg bio byron astronaut payload specialist lichtenberg byron sc payload chinese born stroudsburg children 1948 personal data adopted pa 5 citizen daughters 2 february 19 married 1975 aerospace 1979 brown university scd honorary scb westminster engineering college biomedical sm mechanical education mit 1969 komorov fai flight space haley award
yawnWF	3	PA	teapots dancing ganz burn due hazard recalls named washington instructed canada voluntary consumers illegal commission safety cooperation health announced firm product stop dc recalled resell attempt immediately recall products today consumer product teapots dancing canada united states units 2100 170 usa ganz cheektowaga ny importer llc handle burn hazard water
azg6hf	2	PA	center tornado 30 watch prediction storm status report 30 watch messages information network service national warnings visit iwin weather interactive 30 mod 30 mod 30 mod 20 low 10 low 10 low 50 mod f2f5 probability forecaster 70 60 table event increased category tornadoes probabilities issuing 5 low moderate events
A67k1E	1	PA	apod 15 reflection nebula february meropes 2012 fascinating discover featured written image explanation day photograph astronomer cosmos universe professional february 15 2012 tau color caused scattered cluster molecular open cloud size blue pleiades density 23 nebula nebulosity nebulas encounter stars merope red star surrounds explanation reflect chance reflecting brightest dust
xw8TYV	2	PA	information commerce showing editorialmcclatchytribune servicesmanufacturing growth exporting department opinion enable javascript utilize site full functionality february 2012contact office editorialfriday 17 affairs2024824883 opinion public commerce information showing mcclatcheytribune servicesmanufacturing growth editorial exporting brysonopinion john secretary month batteries businesses things make stories selling manufacturers met hear advanced building great carbonfiber american products
xBhvtQ	64	PA	catalog pia15115 page limited supply mission martian rovers rover winter mobility portait mars shows approached power nasas solar dust opportunity reduces cleans exploration panels accumulation wind mission martian images rovers 24 2011 21 camera opportunitys pancam panoramic mounted sols mosaic 2814th omits days downwardlooking 2811th mast dec view wavelengths 601
rbJxx5	1	PA	eye ncbi repr 2001 desensitization consult clin psychol pubmed movement function web ncbi javascript site warning requires management citation external file generate software canada ontario university kingston psychiatry department queens controversial treatment unnecessary separately found disorder noted techniques sum conditions therapies movement patient anxietyprovoking groups post appears suggested 34 suggests
xj05eR	5	PA	pain ncbi wa spring silver pubmed 2012 obesity function web ncbi javascript site warning requires management citation external file generate software va illinois chronic complex management usa philadelphia 1 sciences 2 department behavioral care hines center pennsylvania university social medical hunger insight themes responsive binge magnifying symptoms treatment sustain indicating
