zZ2Moo	15	PA	week observatory solar pick dynamics sdo suns magnetic years rotating bright plasma 2010 2012 forces gyrating ultraviolet competing cooler highresolution view back anniversary particles hours active extreme 30 streams detailed 2nd frames feb shifted ago fourminute solar sdo 11 kind strands region launched darker slid mind surface make field cadence
w8VXGH	1	PA	cut recovery tax payroll economic helps house fuel white state union video watch enhanced transparency commitment browse house white logs visitor wait executive actions president obama federal receipt tax federal dollars tax spent people petitions create sign house inside white tour interactive deputy december national tax brian economic businesses council
oQX5D0	1	PA	announcement suicide ncbi pubmed facebook 2011 crisis function web ncbi javascript site warning requires management citation external file generate software 20 institute university forensic switzerland thomasruderirmunibech buehlstrasse medicine bern represent suicidal global influence networks impact information media online internet transfer facebook evaluated facet behavior social copycat suicide professionals notes awareness
yTzCcq	3	PA	childrens due hazard slides recalled fall structures landscape named washington instructed voluntary consumers illegal commission safety cooperation announced firm product stop dc recalled resell attempt immediately products today recall consumer product slalom glider units 900 minn delano manufacturer structures landscape slalom lacks children top glider platform playground ladder hazard moving
g9ZQJ0	17	PA	house white state union video watch enhanced transparency commitment browse house white logs visitor wait executive actions president obama federal receipt tax federal dollars tax spent people petitions create sign house inside white tour interactive event live facebook discussion participate click member facebook give click questions comments httpwwwwhitehousegovvideo ondemand library
cds2DV	1	PA	web nws multimedia albuquerque briefing special fontsize12px sansserif color margintop275px 100px 333 marginright15px player textalignleft xsmall 580px textaligncenter fff data width fontweightbold noupdate container img area 555555 width640px helvetica inside 40px 0 divinfo padding5px floatleft 15px textalign margintop60px colorfff play height480px divplayer auto duration fontfamilybitstream vera fontsize background span height
9s44e4	4	PA	center tornado watch 29 prediction storm status report messages watch 29 information network service national warnings visit iwin weather interactive 40 mod 20 low 20 low 20 low 20 low 10 low 60 mod f2f5 probability forecaster 70 60 table event increased category tornadoes probabilities issuing 5 low moderate events
z7Gm9C	6	PA	affairs public home links point hyperlinks find site constitute services welfare linked web provided army west purpose stated sites contained authorized endorsement department consistent exercise activities information locations control external exchanges morale recreation appearance products editorial military disclaimer web aspects technical site comments master questions reporting site broken link address
bREk8i	1	PA	government house executive contracting white order economy state union video watch enhanced transparency commitment browse house white logs visitor wait executive actions president obama federal receipt tax federal dollars tax spent people petitions create sign house inside white tour interactive homeowners refinancing house twitter responsible answers hours brian office questions
wnqpWh	1	PA	back titan mission flyby solstice cassini t82 south back overview titan mission flybys home t82 flyby south titan back t82 flyby south 19 feb 2012 sector summer distances magnetic mission infrared including flyby monitor northern tail degrees samples latitude t78 insights local vims clouds rodealong miles radial fixed spring titan
6OvCsb	7	PA	preserve memorial timucuan national ecological historic caroline fort search wetlands coastal hardwood discover human kingsley includes timucuan 6000 dunes visit plantation caroline preserve beauty coast atlantic marshes years fort hammocksthe experience unspoiled salt history school slave graveyard university florida archaeology plantation field kingsley quarters found evidence 2010 florida anniversary landing
oCV7cJ	1	PA	cisplatin cetuximab cancer hpvassociated clinicaltrialsgov iv intensitymodulated surgery radiation oropharynx text full therapy removed iii stage treating paclitaxel patients view cisplatin cetuximab energy tumorkilling high growth kill carry find dividing ways radiation grow spread chemotherapy monoclonal ability substances drugs stop xrays killing therapy rationale antibodies paclitaxel cells work tumor giving
4Mdmdf	1	PA	congress library machine imagination american treasures jeffersons pasta division thomas text jeffersonmaccaroni 1787manuscript machine holograph pasta making drawing instructions thomas touring 1787 strips dough years noodles spaghetti italy fashionable paris durable france machine jefferson macaroni plans stationed food prepared william made commissioned minister pasta highly purchase short northern rolled noted
xjGXF4	1	PA	closure school ncbi med ann incidence intern pubmed effects pan 2012 function web ncbi javascript site warning requires management citation external file generate software canada earnmathmcmasterca ontario university hamilton mcmaster control limited influenza controversial closures planning aspect affect investigations measures socialdistancing extent school progression pandemic influenza correlations closures examine weather
hX1yVe	2	PA	federal holidays 2012 6103 observed saturday usc federal schedule note sunday 5 establishes holiday public nonworkday monday friday holidays law employees work falls executive purposes years leave federal pay section legal 1 sunday 2 11582 3a holiday public 2012 monday falls day february january employees 1971 11 treated order specifies
uQv1W	1	PA	business checklist starting small businessselfemployed small businessselfemployed topics irs resources construed follow allinclusive start basic type business checklist list specific steps industries information page specific web found industriesprofessions business web site states operating statelevel information requirements additional state starting refer business steps small starting administrations refer topics referencesrelated web business
21yylr	2	PA	rodolfo specialist bio vela neri astronaut payload rodolfo specialist vela phd neri payload february reading mexico theatre 19 personal music jogging chilpaningo born single cinema 1952 gro enjoys cycling data swimming england mexico year essex engineering birmingham education electronic telecommunications doctoral waveguides electromagnetic radiation research 1 program systems degree science
wlQXra	2	PA	government money states selective usagov services education united register blog asked anonymous money register selective services education work ages grants including service eligible federal college men selective student 1825 study register receive aid order andor violation reaches years registration registrations fine late fails accepted convicted window 250000 prosecuted prison technically
wV8XYs	4	PA	nih rare february highlights national 16 disease research cuttingedge health institutes 2012 day awareness raises links related bookmark share cc nih clinical center media advisory office recognize national supported cosponsored translational institutes research researchnational 29 day sciences clinical health advancing daylong activities nih diseases government agencies event celebrate celebration organizations
d0iKKk	1	PA	corps monthly themes preparedness citizen 2011 events communities uniting preparing nation locate login contact council moved page httpcitizencorpsgovnewseventsthemes2012themesshtm andor links update questions bookmarks citizencorpsdhsgov email readygov corps notices disasterhelpgovcitizen plugins home fear register privacy federal faqs femagov citizen widgets act policy dhsgov data foia bulletins annual reports servegov contact bannersaccessibility
zSMYEp	2	PA	eagle enforcement northeast usfws sentence region bald killing office prison maine law man thomas shot contacted misdemeanor domestic years cooperative follow maine crime praised prison stephen bureau 2011 distance records anonymous report day reveal tobacco killed 51 bangor release found incarceration attorney consistent crimes dead year alcohol federal state investigation
wYinZt	1	PA	week observatory solar pick dynamics sdo spurts image rotated active size regions jan structures minor 2012 offered superheated ultraviolet solar sdo present made plasma cascading bursts flare 1516 minutes loop view beautiful upper clip observed video loops capture sun spiraling detail note amazing profile ability earths eruption pair extreme light
acZyAL	2	PA	birthplace theodore national site roosevelt historic search exhibit visitor galleries preservation renovated artifacts closed renovations notice enhancing improve experience raised immortalized born passion roosevelt rushmore townhouse city began 28 health improve started life boy theodore bright exercised 26th york president lifelong grow sickly mount st strenuous 20th signs police richard
oqPMKY	1	PA	mcfp outreach weekly 4 2012 illness mental reduce month stigma education raise health awareness designated outreach importance financial private including repaying managing loans difficulties bureau loan protection student complaints accepting borrowers default taking cfpb consumer tip move find allowances decisions information tenth make relocation weeks visit force corps brain experts
wZP6zV	2	PA	loss overeating risk double study medlineplus memory pages related medlineplus risk people contends healthday news eat 12 feb older study sunday memory impairment people authors 6000 disease alzheimers eat memory risk early 70 sign day older double study calories deficits 2100 excessive researcher clinic neurology geda caloric consumption ariz friendly
zwR2dD	1	PA	rover solar dusty multimedia system exploration historical images gallery rover 21 dusty date dec 2011 slope limited wavelengths mission filters research previous 24 rover 21 northern 2111th mobility sky spirit pia07371 location employed 2011 2012 march winters 30 14 presented january reduces pia15114 teams 535 miles team accumulation view nanometers
yqexjv	10	PA	solstice cutoff rings mission cassini images home image details covers 396 visible planets cassini mimas closer image rings miles part kilometers shadow saturn middle 246 left view star speck rings bright mimas ringplane relative increase rings brightened factor southern visibility unilluminated side view image visible spacecraft cassini 27 21 approximately
x0oqZp	4	PA	eating ncbi disorders loneliness pubmed 2012 janapr psychol function web ncbi javascript site warning requires management citation external file generate software division 17033 eating center adolescent medical usa hershey mlevinelhmcpsuedu state pa college medicine penn disorders milton concept themes interpersonal exacerbate issues relationships disorders symptoms setting treatment health include real
wsP6Fb	1	PA	house visitors tour surprises white lady state union video watch enhanced transparency commitment browse house white logs visitor wait executive actions president obama federal receipt tax federal dollars tax spent people petitions create sign house inside white tour interactive adobe player flash content download view february 16 domain 11811 public
wZUkjd	1	PA	owners cope pet medlineplus hearts change pages related medlineplus seaman andrew people reuters chronic living pet health animal shows diseases companion york owners study healthier tickers heart feathery people variability japanese rate monitoring pet furry scientists higher 200 hearts found scaly didnt respond heart requirements disease rate linked stressful dying
yZ04yM	1	PA	february house photo white day 2012 state union video watch enhanced transparency commitment browse house white logs visitor wait executive actions president obama federal receipt tax federal dollars tax spent people petitions create sign house inside white tour interactive february house check offices photo 2012 picks white day president house
z4vNEe	1	PA	full undergoing brain study recurrent clinicaltrialsgov tumor patients vector treat malignant text surgery replicating retroviral view protocol tolerability dose surgical participate replicating previous depend participants removal 8day 4 weeks gliomas toca progressive courses vector antibiotic 5fc elected encouraged cavity 3 safety 7 retroviral patient 6month enables study months longterm times
jdNmDH	1	PA	health particle pollution major states quality occur united airborne particles haze yearround health main ingredient problems number found dust cities present areas particle air smoke concentrations pollution pollen sulfates nitrates soil number metals dust including suspended spores mold particles microscopic fragments particulate allergens mixture droplets chemicals made organic particle liquid
iQHfYw	1	PA	school pittsburgh house performing arts creative 612 white pa capa state union video watch enhanced transparency commitment browse house white logs visitor wait executive actions president obama federal receipt tax federal dollars tax spent people petitions create sign house inside white tour interactive adobe player flash content download view domain
16eh9B	1	PA	affairs office population family reproductive adolescent related research field planning health opa pregnancy leader prevention care people national topic americans objectives 42 health improving areas identifying healthy specific 2020 agenda family locator text findfpclinic visit clinic planning 368674 find pertaining march reform enacted health law 2010 resources care nearest people
AxpESR	3	PA	laceration choking hazards due tumblekins recalled toys international playthings named washington instructed voluntary consumers illegal commission safety cooperation announced firm product stop dc recalled resell attempt immediately products today recall consumer product toys tumblekins units 31000 nj parsippany llc distributor international playthings treetoys trading china lishui manufacturer lacerations choking hazards
yIt0NJ	1	PA	aristarchus apod 17 wall west february crater 2012 fascinating discover featured written image explanation day photograph astronomer cosmos universe professional february 17 2012 remarkable bright debris melt find impact 25 26 deposits crater plateau include 2011 pixel spectacular material dark vast 16 gazing aristarchus anchored meters images procellarum recorded 3
qfePq9	1	PA	summer apod nights august dream 5 2011 fascinating discover featured written image explanation day photograph astronomer cosmos universe professional 5 2011 august summer results yellow planning earth concentric rotates find photographer fix late worth familiar michigan fairies fall awaken continued rosinski streaks traced night series scenes asleep images 4555 arcs
efNu8V	1	PA	wildlife national attwater prairie chicken refuge passenger coastal pigeon dangerously home close extinction percent prairiechicken today prairies attwaters remain left breathtaking presence fish alive wildflowers birds service deepens visit lot spring speices struggling refuge wildlife tallgrass valiantly experience prairie virgin san i10 drive mile market sealy 1 exit road east
kvcs	4	PA	financial government citizens grants usagov aid benefits financial grants identify apply eligible benefitsgov government loans benefits aid financial loan back states grants universities grant pay assistance awarded interest type grantsgov differences cities loans counties organizations search remember required individuals nonprofit researchers top back top back top back top back benefits
9PdZFZ	1	PA	control res ncbi random pubmed trial strength cond baths 2011 contrast function web ncbi javascript site warning requires management citation external file generate software science catholic school australia center university lifespan trhigg001studentacueduau sydney activity australian exercise physical limited 099 random including statistical participate 018 trivial 26 group passive tests 5minute
c1UZA5	1	PA	ecycling plugin epa partnerships jump main content ecycling partnerships plugin wastes area search contact additions epa recent information resource longer reference note updates epa providers partnership manufacturers ecycling service leading fosters opportunities program recycle electronics donate plugin mobile promotes individuals retailers consumer epa accomplishments partner 2009 ecycling programs certification challenge
tEdYrn	1	PA	living healthfindergov healthy quitting live learn quick smoking guide connect website hyperlink nongovernmental direct application hhs consistent hyperlinks states services human subject information hyperlinked united application contained health endorsement department website intended provided visitors external constitute applications privacy appearance practices products policies purpose link redirected quit steps follow information usaccessibility
wIFlVx	1	PA	twothirds minority office fewer aware disparities americans ethnic health racial skip navigation pointing americans racial decade percent increase hispanicslatinos awareness aware ethnic 59 study facing african disparities finds hhs office national trends disparities human racial chicago 19992010 research norc health department public awareness minority omh june ethnic services center university
gjGJ25	1	PA	fallin home mary governor budget governor state plan fallin delivers energy read oklahoma fallins governor plan click jobs people matching governor facebook fallin follow click appointment click commission board apply find sign uptodate fallin news rss center visiting governor feeds mary view office governors javascript disabled browsers link news click
yKYQKd	3	PA	privacy mobile applications ftc raises questions report children stores issued app results trade determine children staff information federal apps access commission parents collected shared developers today shows showing report data mobile provide survey childrens informed app protecting tools privacy apps parents jon basic plate collaboratively wake highest easily ecosystem work
AsUSjs	10	PA	story whats house white page state union video watch enhanced transparency commitment browse house white logs visitor wait executive actions president obama federal receipt tax federal dollars tax spent people petitions create sign house inside white tour interactive fontstyle 880000 displaynone 171px 624px saveideacontainer 187px urlsitesdefaultfilessavevotingbgbtnoverpng norepeat marginleft formwebformclientform spanlinkhide
wPXQIj	4	PA	house white state union video watch enhanced transparency commitment browse house white logs visitor wait executive actions president obama federal receipt tax federal dollars tax spent people petitions create sign house inside white tour interactive event live facebook discussion participate click member facebook give click questions comments httpwwwwhitehousegovvideo ondemand library
d3KIKm	3	PA	ultrasound transvaginal encyclopedia medical medlineplus pelvic ultrasound including organs cervix womans vagina type transvaginal means ovaries reproductive uterus ultrasound pregnancy bent picture sends probe feet computer table lie monitor doctor tv create vagina health condom provider covered gel structures body sound knees reflect waves immediately holders care place transducer receives
xDhctS	1	PA	house white state union video watch enhanced transparency commitment browse house white logs visitor wait executive actions president obama federal receipt tax federal dollars tax spent people petitions create sign house inside white tour interactive event live facebook discussion participate click member facebook give click questions comments httpwwwwhitehousegovvideo ondemand library
qYsprX	2	PA	network canberra space communication complex deep nasas laboratory number years spacecraft jet propulsion system pasadena transmit exploring schedule mission california solar robotic antennas worked data day directed advance tracking usa receive months controllers set simulations mission engineering tasks radio antenna calibration maintenance development schedule astronomy projects training times time links
znbmEB	6	PA	treating hodgkin clinicaltrialsgov combination older previously text view brentuximab patients iiiv vedotin full chemotherapy lymphoma untreated stage work cancer previously vinblastine ii growth kill avd ways conjugates targeting dividing doxorubicin giving brentuximab iiiv chemotherapy monoclonal combination drugs stop killing vedotin hl phase antibodydrug lymphoma untreated stage treating older dacarbazine cells
y14Ssg	1	PA	urinary coli infections medlineplus tract chicken linked pages related medlineplus urinary caused healthday coli news bacteria feb long scientists chickens persons tract 15 canadian study infections wednesday suggests believed typically chickens control urinary emerging caused coli centers 85 publication disease percent issue march diseases tract report infections infectious prevention pork
xBObSt	1	PA	predict brain medlineplus dementia day scans pages related medlineplus mental people predict tuesday period brain healthday news dementia decline feb monitor twoyear scans report 14 happened disorder researchers medication brain cure medications alzheimers treat scientists effectiveness scans halted track designed day brainrobbing progression disease disorder developed brain mild 64 marker
i3tx	1	PA	natural senate energy committee resources sector energy modernize electricity seeks 2012 power standard generated nations future clean act guide bipartisan management resource reserve federal responsible stewardship strategy lays act helium 2012 files ferc documents item addition attached chairmans find au letter murkowski senator linked amendment text act joint result substitute
bzt2lq	1	PA	27 center watch thunderstorm prediction severe storm status report 27 watch messages information network service national warnings visit iwin weather interactive 20 low 5 low 30 mod 20 low 30 mod low high 70 f2f5 probability forecaster 70 60 table event increased category tornadoes probabilities issuing 5 low moderate events
blUvBo	1	PA	house bo white state union video watch enhanced transparency commitment browse house white logs visitor wait executive actions president obama federal receipt tax federal dollars tax spent people petitions create sign house inside white tour interactive family pictures bo dog obama march garden family house rose bo dog 2010 3
xuYeIi	1	PA	infections medlineplus antibiotics sinus pages related medlineplus frederik joelving routinely dont tuesday fight reuters health prescribe antibiotics purpose doctors sinus infections researchers york increasingly drugresistant experts bacteria grown evolution medications overuse worried fuel caused bacteria worthless antibiotics concern case virus doctors sinus infections disease study back inactive ease american symptoms
4BiybH	1	PA	register restraint nhtsa safercargov child child register restraint national nhtsa administration safety urges traffic highway manufacturer register address identify notify event information provide class current safety mail manufacturers restraint registered important child included manufacturer owners required recall mailing image number sample bottom label note include manufacture manufacturers restraint produce child
cFz5sD	1	PA	center tornado watch 28 prediction storm status 28 report watch messages information network service national warnings visit iwin weather interactive 50 mod 30 mod 30 mod 40 mod 20 low 20 low high 80 f2f5 probability forecaster 70 60 table event increased category tornadoes probabilities issuing 5 low moderate events
oFkRi0	1	PA	view vtx2337 lymphomas agonist local radiation clinicaltrialsgov full text combo tlr8 bcell lowgrade primary single systemic determine tlr8 bcell recurrent radiation objective local intratumoral combination antitumor site effects injection lymphoma vtx2337 agonist lowdose tumor patients criteria inclusion patient criteria enrolled meet order prior required wash therapy periods exclusion criteria patient
4dwBHm	1	PA	picture astronomy day fascinating discover featured written image explanation day photograph astronomer cosmos universe professional 11 2012 bright distant earth disk 20 fit easy weeks apogee photographed perigee dark day telescope pacific dense sun asia moon smallest full 300 annular 240 kilometers path super silhouetted filter point image visible smaller
AaO8p8	1	PA	multice ncbi extension bmj rule test pubmed fracture elbow 2008 function web ncbi javascript site warning requires management citation external file generate software foundation 5dw emergency royal devon ex2 nhs department trust exeter determine clinical routine test injury presenting full practice assessed bony extension rule patients elbow observational prospective adults
AqhOf5	1	PA	development house global questions innovation open white state union video watch enhanced transparency commitment browse house white logs visitor wait executive actions president obama federal receipt tax federal dollars tax spent people petitions create sign house inside white tour interactive adobe player flash content download view february 08 domain 2950
