zhIuge	2	TX	10 apod january starburst 4 ic galaxy 2012 fascinating discover featured written image explanation day photograph astronomer cosmos universe professional january 4 2012 starforming bright distant galaxy regions group northern 23 black local colorful skyscape boundaries cassiopeia large including intervening luminous constellation telltale xray newly shows 5000 dwarf million galaxies
qvXnXj	1	TX	entrez genome view viewer map resources ncbi data genbank organism sequencing projects resources related databases cytogenetic features reference sequence viewer hybrid maintained displays human ests contig tiling physical contigs stss ncbi alternate radiation maps genetic grc predicted include fish genome map graphical assembly models genes component gnomon clones path bac
u15vTJ	1	TX	nutrition sci ncbi triat endurance sports pubmed 2011 marathon function web ncbi javascript site warning requires management citation external file generate software school university sciences birmingham uk aejeukendrupbhamacuk sport exercise protocol developed dehydration solutions gastrointestinal fibre 23 hyperthermia 4 dependent fat protein lasting beneficial slower findings achieved guidelines reduce related
d4gDm0	2	TX	climate timeline tool years 100000 history exploring climate challenge creativity developmentthe past homo sapiens 100000 human early yearsdid events history atmosphere helens years toba questions differentiation rose humanity happened indonesian march increased 71000 survival material early day usgs ambrose reduced development human challenged past homo year stanley event encouraged ice
eUsoqT	1	TX	civil eve american edsitement war presented civil series states bring statistical click statistics factors war maps tabs united student summarize bottom eve american animated interactive share partnered thinkfinity lesson find educational save resources plans free edsitement plans updates lesson resources humanities project edsitement endowment national provided verizon thinkfinityorg edsitement support
bB0S0u	1	TX	ncbi allergy immune pubmed pediatr regulatory immunol 2010 cytokines function web ncbi javascript site warning requires management citation external file generate software italy verona university paediatric department peronidiegotiscalinetit breastfeeding 0230 08000 month farms allergyrelated modulate cytokines group 0930 environment modulation samples postpartum diseases early aim breast mothers level fewer decrease
vEPK8d	1	TX	search query databases blast nucleotide sequence query residue coordinates 1 apply residues includes blast lengththe search subrange range enter coordinate sequence accession single numbers file sequences fasta disk gi ncbi browse local format data database button list upload searches title results blast saved appears text sequences accession query gi subject
qucwwU	1	TX	u54 notrm11021 institutional award notrm11017 ctsa clinical translational modification science u54 institutional award notrm11017 ctsa clinical translational modification science release date july 20 2011 notrm11017 center national ncrr research fund common roadmap resources receipt announcement funding publication application 3 foa 2011 notice ctsa applications october date end opportunity 12 withdrawing
AoJIY1	1	TX	announcement space 1972 shuttle president nixons president san administrator fletcher richard space program 5 shuttle final announced headnote california approval received clemente james 1972 nasa editorial january nixon accessible states decided endeavor 90s united proceed space system 1980s territory type today development transportation familiar human designed easily frontier transform 1970s
vZUSY0	1	TX	polar lander target system past exploration solar mars missions microprobes instruments measure deep sample martian pentrate surface arm cameras soil regions 2 mars composition polar lander equipped landing goals robotic firstever carried space false mishap accomplishments speed high engines investigation mars main legs polar shut lander crashed landed descending deployed
voCfpO	1	TX	house white numbers 443000 state union video watch enhanced transparency commitment browse house white logs visitor wait executive actions president obama federal receipt tax federal dollars tax spent people petitions create sign house inside white tour interactive people states americans year estimated united 46 due high time decades 443000 weve
z5NZQg	2	TX	flashlight led target fire burn hazards due sets recalls named washington instructed voluntary consumers illegal commission safety cooperation announced firm product stop dc recalled resell attempt immediately products today recall consumer flashlight product led 6pc sets units 55000 target minn corporation minneapolis importer flashlights fire burn turned hazard heat posing
tiNX7Q	1	TX	senator lauds passage airport screening house bailey sen kay expedited hutchison military texas orders december washington service traveling trust rtx troops senate legislation passage praised screening passed bailey hutchison today families dc houses members kay 2011 13 expedited airport unanimous act senator family servicemen americans grateful signs earned legislation easier
agMxfu	2	TX	perception ncbi skills persuasive mot percept pubmed emotional 2008 fo function web ncbi javascript site warning requires management citation external file generate software applied samjuninyuedu psychology usa university ny 100036674 york department text adjective font issues latent policy combination government congruent perceived appearing presented university fonts literature selected perception marketing
Omemy	10	TX	current impact risks introduction monitoring impact frequently asked questions notes operational jpl table earth click impact based system detected potential observations events details full object lists designation sentry future page highly collision earth cases impact unusual monitoring review system continually current detected asteroid iau scans underway results catalog automated analyzed
yoIiZA	1	TX	repair chairs due hazard high fall recalls ikea named washington instructed canada voluntary consumers illegal commission safety cooperation health announced firm product stop dc recalled resell attempt immediately recall products today consumer product antilop chairs high 36000 169000 133000 units canada north conshohocken llc importer pa services ikea america unexpectedly
ybU30W	1	TX	opensource projects image linux single images size pcs desktop environment bigview panning multiscreen multiple cooperate running additionally software zooming work large arbitrary view interactive control code manage environments set distributed functionality basic resources framework observe user services observation applications view software engineering java larc application opensource innovation development field started
yoV95t	4	TX	current uscert activity highimpact web current incidents regularly updated reported types summary uscert activity security page frequent multiple apple released updates safari address vulnerabilities products security os code crosssite obtain information perform vulnerabilities privileges elevated attack attacker condition execute denialofservice exploitation sensitive arbitrary operate scripting articles mitigate users ht5281 encourages
tkW5ZZ	1	TX	year blog photos 2011 fema photographer photos amazing fema give spread message pa shout mitigation picture joy 12 served comment accordance comments blog moderated policy femas links nongovernment social applications web fema provided reference media companies sites endorse msgdata washington street apply management prepare federal rates homeland department 4fema emergency
eVdYT	1	TX	forms publications irs resources methods links tax electronic forms provide media irs capabilities access source basic print function acquire additionally advanced search irsgov official materials publications published links schedules tax individual download return taxpayers irs forms income mail order recently business advised packages needed filing instructions longer receive paper page
tVQ0TA	1	TX	brothers peoplesullivan operations madison serving members campaign remained sullivan received actions discouraging 1920 born shakedown navy publicity ship george united 13 family service 1942 subsequent crew commissioning joseph uss enlisted resulted guadalcanal wide iowa brothers combat albert february early policy 1937 tragedy cl52 november francis 1914 states assigned younger waterloo
tShi7F	1	TX	ncbi prognostic hematol int lymphocyte pubmed significance 2012 absolute function web ncbi javascript site warning requires management citation external file generate software division school hematologyoncology china childrens hospital 310003 hangzhou zhejiang peoples medicine republic university 166396 alc riskadapted debate observational based progressionfree 204429 evaluate survival results lymphoma entire covering summary
d0iKKk	2	TX	corps monthly themes preparedness citizen 2011 events communities uniting preparing nation locate login contact council moved page httpcitizencorpsgovnewseventsthemes2012themesshtm andor links update questions bookmarks citizencorpsdhsgov email readygov corps notices disasterhelpgovcitizen plugins home fear register privacy federal faqs femagov citizen widgets act policy dhsgov data foia bulletins annual reports servegov contact bannersaccessibility
wFpIzf	1	TX	full rhinological text clinicaltrialsgov outcomes endonasal pituitary surgery view prospective adults primary outcomes assess surgical determine surgery functioning observational multicenter technique patientreported removal 3 microscopic objective health weeks anterior undergoing postoperative 6 nasal visits base designed address difference 12 skull study months patients survey pituitary treated tumors endoscopic anterior topics
yMB8ws	1	TX	comparison med natural ncbi language bio ann processing intern pubmed 2012 function web ncbi javascript site warning requires management citation external file generate software school usa mount york medicine sinai ontolimaticsgmailcom control national facilitates surveillance centers recognition federal system coordination note state biosense encounter outbreak local levels complaints data response
cfsgOu	1	TX	hhs mental service returning agreement sign increase defense health members military department services counseling serving corps memorandum people competitive years assigned facilities fighters including human issues partners negotiated promote group knowledge workers offers 4 include carolina affected returning continues insomnia psychiatric primary emergencies joint dodphs georgia therapy deployment report join
2PQUFP	16	TX	business topics tax topic 509 home irs resources deduct home denial employee general business deductions part expenses selfemployed expense regularly deduct business exclusively expenses part home attorney trade determine principal management personal businessuseofthehome exclusively location employee administrative regularly activities employers part convenience den applies fixed requirement deduct purposes expenses substantial
atm5FF	1	TX	unrelated tax business income nonprofits topics charities irs resources tax expects related trade file year substantially estimated gross educational business basis pay income 500 regularly form exempt 990t purpose organizations exemption carried recognized charitable unrelated liable organization 1000 code 990pf revenue consolidated file corporations 990ez information 990t title addition section
xIbILV	5	TX	10 apod january starburst 4 ic galaxy 2012 fascinating discover featured written image explanation day photograph astronomer cosmos universe professional january 4 2012 starforming bright distant galaxy regions group northern 23 black local colorful skyscape boundaries cassiopeia large including intervening luminous constellation telltale xray newly shows 5000 dwarf million galaxies
o8jV9G	2	TX	educators award environmental awards innovation teacher presidential epa jump main content contact environmental education program 12 mb 2 flyer pdf pages innovative young kindergarten program announce regional ceq report presidential school integrated offices americans generations epas educators house employ selected placebased innovation outdoors approaches protection great receive discussed americas context
aJN540	2	TX	exportgov tapping financing government programs financing offers types description programs link learn apply click finance government assist related online services training products exporting events sales trade counseling service listed international local achieve specialist commercial goals programs receive contact marketplace enables obtain accept effectively export working needed grow capital development business
jSNUzQ	202	TX	hsf realtime space human flight data control uptotheminute mission spacecraft path data make sky project applet reside significantly 336 download skywatch cache approximately access internet files 144 downloading 300 sufficient downloaded data 10 hard minutes clear required drive connection nasa time modem kbps updated official responsible amiko curator notices nasa
zZlazR	1	TX	management emergency community blog approach fema usefulgood comment accordance comments blog moderated policy femas links nongovernment social applications web fema provided reference media companies sites endorse msgdata washington street apply management prepare federal rates homeland department 4fema emergency dc 43362 20472202 sw agencyus security500 6462500text tty assistance step 46275853 800
dupyMH	2	TX	thyroid risk cancer dental ncbi 2010 pubmed acta oncol xrays function web ncbi javascript site warning requires management citation external file generate software division school amemonbsmsacuk medical sussex primary falmer health uk brighton public care cancer highly gland salivary tumours dentists meningiomas increased thyroid established source susceptible workers radiation xray
sl7nMx	1	TX	full yoga cancer text clinicaltrialsgov survivors view intervention examining spiritual cancer interventions implications domain related hrqol literature including aimed qol quality physical intervention psychosocial group tremendous measured survivors health indicators yoga life heterogeneous problems fatigue adult improving impaired sleep feasible common emotional studies noted staged cancer general survivorship yoga proposed
yTmycX	2	TX	house white state union video watch enhanced transparency commitment browse house white logs visitor wait executive actions president obama federal receipt tax federal dollars tax spent people petitions create sign house inside white tour interactive event live facebook discussion participate click member facebook give click questions comments httpwwwwhitehousegovvideo ondemand library
sUzMJS	2	TX	overview exportgov system ccc commerce office chinese area compliance administration trade access source economic department international market requirement impacts certification penalties obtain held implemented border market manufacturing requirements chinese manufacturers system mark 1 catalogue safety exporting covered meeting wide selling government sectors subject customs china exporters compulsory made effective license
wVon3z	1	TX	conversions rollovers reporting roth 2011 2010 topics retirement plans community irs resources 2010 conversions rollovers tax report return income 2011 2010 half taxable amount 8606 20a conversion distributionsif distributed ira 2010 form part report line 2011 roth amount 8606 inplan rollover retirement distributed ira 2010 form 25a part plan report
rmARtk	1	TX	buildings star multifamily energy rise high qualified star energy join partner professionals buildings star multifamily industry rise high qualified home energy resources set energy guidelines buildings ashrae high society mfhr substantially built efficient strict building star multifamily rise standard efficiency designed 9012007 making airconditioning earn 15 heating american meet engineers
tZSNur	1	TX	grant grantsgov opportunities synopsis opportunity find precedence service disk electronic click information grant provide notification send inconsistency document email resolved notifications printed address opportunity emails change receive thing giving original requestedany modification description represent newest file oldest previous shown documents current document sections files background representing modifications arranged changed list
wG4I4S	2	TX	affordable king recycling tree county christmas jan 3 easy options king natural website parks fred county contact questions webmaster resources bentler garbage county year deed environment recycle christmas good king ring tree throwing amendment composting recycling recycled soil save christmas material trees landscaping plenty chipped room tree landfill stuff options
b9oZn7	1	TX	activities schoolhome links kit kindergarten table reading contents word tutors cover families page files adobe links download schoolhome reader print activities read acrobat order pdf files information adobe guide reader pdf acrobat volume entire 17mb activities format note kindergarten download pdf links grade organized individual download skill children write schoolhome
ygiJRb	1	TX	impact med ncbi outpatient pubmed 2012 care palliat palliative function web ncbi javascript site warning requires management citation external file generate software houston usa cancer syennumdandersonorg university center medicine anderson 77030 department palliative rehabilitation texas care limited cancerrelated cancer describe impact pc symptoms consultation palliative retrospective outpatient prostate advanced care
vcSyqI	2	TX	virol influenza hampers ncbi vaccination annual virus pubmed 2011 function web ncbi javascript site warning requires management citation external file generate software box netherlands center 2040 medical 50 molewaterplein 3000 virology department erasmus ca rotterdam dr po seasonal ah5n1 influenza vaccinated children impact increase absence present protective prevented results cd4
vE7ZKp	1	TX	pathol ncbi cancer nextgene clin pubmed genome sequencing 2011 function web ncbi javascript site warning requires management citation external file generate software ave albany usa medical scotland ny college 47 department pathology 12208 breadth including gastrointestinal speed sarcomas knowledge parameters adoption ngs turnaround extensive thousands widely demands advances therapy sequencing
yoI36l	7	TX	repair chairs due hazard high fall recalls ikea named washington instructed canada voluntary consumers illegal commission safety cooperation health announced firm product stop dc recalled resell attempt immediately recall products today consumer product antilop chairs high 36000 169000 133000 units canada north conshohocken llc importer pa services ikea america unexpectedly
zYBaZG	3	TX	text relapsed lymphocytic clinicaltrialsgov dose chronic macroglobulinemia nonhodgkin cell subjects waldenstroms full leukemia lymphoma study refractory escalating view tolerability lymphocytic chronic macroglobulinemia cll nonhodgkin cell subjects safety evaluate wm leukemia purpose lymphoma relapsed waldenstroms refractory bnhl study monotherapy avl292 limited interruption nonreceptor receptor blymphocytes revealed btk cll depend network restricted
uMuMtZ	1	TX	med ncbi mol sesquiterpene antimyeloma pubmed activity berl 2011 function web ncbi javascript site warning requires management citation external file generate software innrain cancer tyrolean karinjoehrertkfiat innsbruck research institute austria 66 6020 show activated leads malignant underline cytokines current death pim2 microarray kinase microenvironment potential treatment constitutes factor plasma activities
JJgjA	23	TX	congress nominate national preservation registry films library film board mandating consulting inclusion december national suggestions preservation select experts reviewing plan library alternates established pl110336 end implementation 44 extensively 1988 passage film heritage films save public announced board reauthorization extended recently congress 25 continuing authorizes registry members librarian law 2008 sound
aGrvo1	8	TX	metab ncbi int nutr chocolate exerc pubmed 2006 postexerci sport milk function web ncbi javascript site warning requires management citation external file generate software applied usa laboratory university bloomington 47405 dept kinesiology health human science performance indiana rating endurancetrained results cyclists milk tte isovolumic 4 bout greater workout bouts fluid
uE4Tpk	1	TX	topics system exploration solar year overview dec 2011 worlds evolving dec 2011 people move shrink billions years hair planets dense start frail energy full oceans craters losing grow change cool atmospheres gather wrinkles lose senior planetary atmosphere shield magnetic global thicker subsurface eruptions protective worlds flowing caps early cool eroded
bb4k9n	1	TX	science heliophysics nasa exploring cosmic commitment environment nasas learn local mb science roadmap recommended 9 pdf technology 22 mb science heliophysics moon pdf atmosphere produces suns energy life high sustains radiation sunlight particles live alter variability extended star harm active evolution streams enables atmosphere shield developed magnetic suns earth responds
uhI9eJ	2	TX	management emergency principles community themes library action approach fema pathways resiliency understanding principles community strategic themes preparedness individual determine greater management collaborative provide presents integrate increasing approach resources foundation intended emergency nation framework pathways members promote security engaging document daily practices action enhance guide download plugin links plugin require plugins
v3PMPs	2	TX	thomas congress 107th text bill library 20012002 hr ih 3076 authorize letters september reprisal states marque respect united piracy acts issue war president future 11 air 2001 planned similar committee bill relations mr international paul introduced referred authorize letters september reprisal states marque respect united piracy acts issue war president
vLli5h	1	TX	king 15 warns apparent county scam dec email scam people tax county warning including false ecommerce confirmation system emails countys online email received apparent reported made compromised payment king receiving calls countries states individuals businesses property county header confirmation information appears copied email payments altered recipients kehoe standard payment king
p5BblD	1	TX	wildlife national ridgefield refuge randomimg tour units managed maximize nwr preservation mile wetland woodlands total 5218 carty management hiking 42 ridgeport habitat acres dairy seasonal objective guided floodplain columbia auto 2mile trail bachelor ridgefield marshes wildlife 12 natural grasslands roth waterfowl island river route geese secure habitat violent canada established
sMprGL	1	TX	entrez genome view viewer map resources ncbi data genbank organism sequencing centers resources related databases sequenced major eukaryotes budding singlecelled eukaryote beer genome molecular yeast understanding fungus completely important cellular cerevisiae bread processes organisms industry enzymes produce model pharmaceuticals wine features results table find additional ncbi browse window interest marks
XXAoz	6	TX	living lifestyle information health human services guide connect website hyperlink nongovernmental direct application hhs consistent hyperlinks states services human subject information hyperlinked united application contained health endorsement department website intended provided visitors external constitute applications privacy appearance practices products policies purpose link redirected advice find health care today widget information
tWJPL6	1	TX	surg ncbi patellar sports arthrosc pubmed treatment knee te 2011 traumatol function web ncbi javascript site warning requires management citation external file generate software sahlgrenska institute university mariaehlarssonvgregionse academy sweden clinical neuroscience department rehabilitationphysiotherapy physiology gothenburg compare methods randomized trials review treatment optimal painful common controlled published treatments purpose summarize
ovrDAy	1	TX	prevent ncbi australas webbased pubmed parenting program psychiatry 2011 function web ncbi javascript site warning requires management citation external file generate software melbourne australia orygen mental centre university vic research youth health mbhyunimelbeduau parkville limited paper impact longitudinal conclusions familybased parents uptake friendly overcome risk lacking labourintensiveness misuse drinking consensus
rUrTN1	1	TX	saturn treats mission solstice nasas cassini delivers holiday saturn features releases nasas cassini home news holiday delivers treats saturn treats nasas cassini delivers holiday dec 2011 22 saturn treats nasas cassini delivers holiday show titan spacecraft radio cassini images delivered saturns pictures flying ornament system signals reindeer pasadena largest holiday
y2J4R6	1	TX	encyclopedia medical cervical spondylosis medlineplus abnormal chronic bones vertebrae pain wear cervical spondylosis neck common cartilage disorder caused growths abnormal chronic bones vertebrae joints cushions includes wear cervical spondylosis neck spine disks spurs nerve spinal involved roots arms legs cord compress press affect cases advanced time people everyday start sports
