zhIuge	2	TX	10 apod january starburst 4 ic galaxy 2012 fascinating discover featured written image explanation day photograph astronomer cosmos universe professional january 4 2012 starforming bright distant galaxy regions group northern 23 black local colorful skyscape boundaries cassiopeia large including intervening luminous constellation telltale xray newly shows 5000 dwarf million galaxies
y6rdj0	1	TX	disclosure program voluntary disclosure underreports file obligations successfully tax eligible voluntary taxpayer convenient due returns program department type files pay return administered qualify designed promote resolve failed compliance enabled taxes taxpayers missouri laws tax terms taxpayer eligible payment contact department return agreement representative anonymous made final prior remain filing disclosure
hAl5rh	9	TX	gluten ncbi sensitivity markers celiac biol psychiatry pubmed 2010 dis function web ncbi javascript site warning requires management citation external file generate software school pediatrics usa hopkins johns sheppard research 21204 medicine pratt program fdickersonsheppardprattorg department stanley maryland baltimore increased sensitivity reported schizophrenia inconsistent association gluten immune studies 151 chain
jjHHaH	10	TX	hudno11134 hud notice rights homeownership disclosure announces revised servicemembers protects protecting militaryfederal dependents law disclosure duty civil revised washington housing department announced relief development urban notice form servicemembers emphasizes active dependents rights protected today act military duty foreclosure mandates wartime states active rate including court proceeding mortgage personnel percent valid
UT2FE	1	TX	house white state union video watch enhanced transparency commitment browse house white logs visitor wait executive actions president obama federal receipt tax federal dollars tax spent people petitions create sign house inside white tour interactive event live facebook discussion participate click member facebook give click questions comments httpwwwwhitehousegovvideo ondemand library
xGQ18u	1	TX	resolve emergencies day blog ready news fema 2012 comment accordance comments blog moderated policy femas links nongovernment social applications web fema provided reference media companies sites endorse msgdata washington street apply management prepare federal rates homeland department 4fema emergency dc 43362 20472202 sw agencyus security500 6462500text tty assistance step 46275853
swTkoc	1	TX	past edsitement mapping presented share map columbus detail christopher socalled xpeditions society national credit courtesy geographic lewis produced passage finally hope views reflected early cultural aspirations world collect investigate andor people discover alive understood internet discovery experience times range examining clark period marked lesson perspectives working interacted artifacts west noting
sAOGNG	1	TX	grant grantsgov opportunities synopsis opportunity find precedence service disk electronic click information grant provide notification send inconsistency document email resolved notifications printed address opportunity emails change receive thing giving original requestedany modification description represent newest file oldest previous shown documents current document sections files background representing modifications arranged changed list
yD6xBg	1	TX	apod january dione titan 5 ringside 2012 fascinating discover featured written image explanation day photograph astronomer cosmos universe professional january 5 2012 spacecraft remarkably giant saturns outer 23 arcing slicing saturn shadows perpetual bright 300000 view 5150 frame titan perspective year pale bottom rings stunning shares moon haze moons orbiting
bREk8i	2	TX	government house executive contracting white order economy state union video watch enhanced transparency commitment browse house white logs visitor wait executive actions president obama federal receipt tax federal dollars tax spent people petitions create sign house inside white tour interactive homeowners refinancing house twitter responsible answers hours brian office questions
s7lBdb	4	TX	ncbi 2011 petct surveillance patients pubmed haematologica hodgkin function web ncbi javascript site warning requires management citation external file generate software aalborg hospital university aarhus denmark partial background p002 211 true results preclinical interim controversial petct firstline 22 eligible situations 28 recurrence remission rules survival methods therapy lymphoma performing benefit
ifRMjx	6	TX	federal holidays 2012 6103 observed saturday usc federal schedule note sunday 5 establishes holiday public nonworkday monday friday holidays law employees work falls executive purposes years leave federal pay section legal 1 sunday 2 11582 3a holiday public 2012 monday falls day february january employees 1971 11 treated order specifies
ftEw0I	2	TX	uscis study materials english test sentences tools speak application writing write materials correctly test reading speaking ability form eligibility interview started uscis prepare read n400 portion determined officer components english naturalization study additional section products select short naturalization process overview video test providing requirements citizenship process eligibility naturalization presentation practice
vjXZJu	2	TX	apod 15 september west aurora 2000 skies texas fascinating discover featured written image explanation day photograph astronomer cosmos universe professional september 2000 15 september report southwestern earth spacebased perseid northern headed storms dipper degrees latitude skies big aurora early tanks shy common activity view el paso sight space closer recorded
uvvx2K	1	TX	multiple ncbi cluste myeloma intradisease haematologica pubmed 2011 shows function web ncbi javascript site warning requires management citation external file generate software oncology italy university medicine department turin experimental selection similarity displayed results conclusions susceptible receptors 345 hypermutation clusters early background lymphoma subsets fully tumors median skewed specific characterized methods
6w2Jwy	2	TX	proclamation national slavery month trafficking human house prevention white presidential state union video watch enhanced transparency commitment browse house white logs visitor wait executive actions president obama federal receipt tax federal dollars tax spent people petitions create sign house inside white tour interactive house white office press secretary proclamation moments
fpes5r	1	TX	exportgov ce mark europeenne marketed process manufacturer affix ce population eu market marking 27 requirements union manufacturers access health safety assessment 500 european europe product million acronym certifies french met conformity abroad conformite products environmental require countries list applicable ensure meet consumer order issued ce eu manufacturers determine marking documents
szzUYY	1	TX	status body ncbi nutritional diet habits assoc 2005 breakfast pubmed function web ncbi javascript site warning requires management citation external file generate software sw human agricultural usa gainesville sciences 23rd department fetl nutrition food 326110720 gcrifasufledu fl building institute science university florida drive 685 results grades children impact superior group
tsddOg	1	TX	apod january spot moon 2 2012 fascinating discover featured written image explanation day photograph astronomer cosmos universe professional january 2 2012 scattered month moon find captured peeked sky degrees meant congratulating dimmer 12 background shadow exact entire large side twelve set acquired picked sunrise sun lunar full completely hiding barely
sgcY98	3	TX	house submit comments questions white state union video watch enhanced transparency commitment browse house white logs visitor wait executive actions president obama federal receipt tax federal dollars tax spent people petitions create sign house inside white tour interactive accessible committed comments questions open staff administration send concerns wellwishes creating form
4dwBHm	2	TX	picture astronomy day fascinating discover featured written image explanation day photograph astronomer cosmos universe professional 11 2012 bright distant earth disk 20 fit easy weeks apogee photographed perigee dark day telescope pacific dense sun asia moon smallest full 300 annular 240 kilometers path super silhouetted filter point image visible smaller
wOClr9	1	TX	soc mfc ncbi rev 2010 chemical cathod biological chem pubmed mxc function web ncbi javascript site warning requires management citation external file generate software 38106 30 institute energy tu fharnischtubraunschweigde research environmental germany braunschweig sustainable chemistry hagenring mfc longevity relevant differs remarkably based electricity mxcsthe microbially production treatment fuel evaluated
sVVdyO	3	TX	apod full january aurora sky 3 norway 2012 fascinating discover featured written image explanation day photograph astronomer cosmos universe professional january 3 2012 atmosphere unexpected ago striking sky magnetic results 60 lies stretched airplane rarely viewed complete mountain realm wide space image poles horizontally molecules auroral circle norway aurora higher
zH17Db	1	TX	lakeshore dunes national indiana winterfest search temporarily lot 28 kemil park due state construction closed parking expected east open road 2012 national 1200 embrace paul education saturday lakeshores winter dunes douglas 7 indiana pm lakeshore environmental pm400 celebration center january fun winterfest outdoor show skis indoor paper including skiing staff
taTNtd	1	TX	working house year address white weekly state union video watch enhanced transparency commitment browse house white logs visitor wait executive actions president obama federal receipt tax federal dollars tax spent people petitions create sign house inside white tour interactive tough people move year past tells create grow economy jobs president
b2uIyI	12	TX	house white state union video watch enhanced transparency commitment browse house white logs visitor wait executive actions president obama federal receipt tax federal dollars tax spent people petitions create sign house inside white tour interactive event live facebook discussion participate click member facebook give click questions comments httpwwwwhitehousegovvideo ondemand library
hO702	1	TX	narratives federal slavery project born writers slave 19361938 division prints manuscript congress photographs library primary library past documents perspectives readers offensive expressed presents attitudes endorse collections congress views reflect part times record materials historical beliefs narratives slave norman introduction yetman wpa collection voices faces collection narratives language note resources related
tvU1vY	1	TX	ncbi drugs tumors treatments pubmed 2006 paediatr astrocytic children function web ncbi javascript site warning requires management citation external file generate software burzynski houston clinic usa texas oncology partial generally neurofibromatosis young years brain surgical including part cisplatin alternative children previous 24 death group morbidity indolent improvement investigational treatment nf1
xLVZT0	1	TX	mart childrens lead chairs due stools standard gifts elegant recalled violation paint named washington instructed voluntary consumers illegal commission safety cooperation announced firm product stop dc recalled resell attempt immediately products today recall consumer product chairs stools childrens 1300 chairs 1600 stools units mart los gifts elegant importer calif angeles
uxOzOk	1	TX	grant grantsgov opportunities synopsis opportunity find precedence service disk electronic click information grant provide notification send inconsistency document email resolved notifications printed address opportunity emails change receive thing giving original requestedany modification description represent newest file oldest previous shown documents current document sections files background representing modifications arranged changed list
sjqmR5	2	TX	apod iss december 31 lovejoy comet 2011 fascinating discover featured written image explanation day photograph astronomer cosmos universe professional december 31 2011 intendente bright earth captured 24 la photographer sky argentina local spectacular dan arcing early crosses tails twilight morning view alvear swept trails frame back glinting proper home closer
uqQYoY	1	TX	map normandy edsitement dday invasion interactive presented major assigned excerpts histories include participated read battlesthis zoomable european history locations sense event lengthy popups tend write interested edsitement shows europe map combat students men student engagements theater wwii fictitious place interactive oral asked share partnered thinkfinity lesson find educational save resources
7P8SZE	3	TX	cert state corps train partner america effort volunteer prepare proud cert citizen agency neighborhood citizens corps criteria guidelines county council organizational follow encouraged category management police completing objectives government contained state program sponsoring listed bottom basic covered local website jurisdiction description emergency fire material agencies standard sponsored representative response included
xdNiTK	5	TX	pap tests color pdf full cancer find pap cervix vagina test checks opens womb part lower smear cells turn sex pap 21 start 3 vaginal tests years women time pap make normal find call test appointment period change cells harder including pap based doctor things nurse tests woman decide talk
wIU7Eb	29	TX	fatty ncbi polyunsaturate nutr pubmed br acidspecific mixed 2010 n6 function web ncbi javascript site warning requires management citation external file generate software nih md usa neurosciences biochemistry section nutritional biophysics bethesda membrane laboratory niaaa chrisramsdennihgov 093 ci statistical specifically ratio 22 95 4 extensive n3n6 increased combination confounding intake
8MNng	1	TX	bridges bts deficient national structurally system maps highway rita va ca al ar vt il ga az id ct nh nj nm tx la nc ne tn ny pa ak nv pr wa de dc wi wv iaks fl wy md ma ut mo mn mi ri mt ms sc
ru6Wwv	1	TX	ncbi elongation biol pubmed fact 66 coli chem escherichia histidine 2012 function web ncbi javascript site warning requires management citation external file generate software northwestern usa university evanston illinois biosciences 60208 department molecular chain show phetrnaphe coli aminoacyltrnas tu glytrnagly gtp factor showing his66 affect proteins establishing differentially side ribosomal
xiipEG	1	TX	med vet 38 ncbi household interdog pubmed assoc cases 2011 aggression function web ncbi javascript site warning requires management citation external file generate software medicine school north usa university veterinary sciences clinical cummings department ma 01581 grafton tufts factors household outcomes interdog treatment determine analyze aggression case pairs retrospective considered
nKPMiK	3	TX	involved corps citizen communities uniting preparing nation locate login contact council moved page httpcitizencorpsgovgetstartedtraininggetinvolvedshtm andor links update questions bookmarks citizencorpsdhsgov email links plugin require plugins page view readygov corps notices disasterhelpgovcitizen plugins home fear register privacy federal faqs femagov citizen widgets act policy dhsgov data foia bulletins annual reports servegov
9a4NNI	1	TX	2012 voices recovery month unnoticed people share celebrating broader educate recovery treatment vehicle public sharing voices effort population successes country stories works website story recovery share month stories view prefer city story provide state choose email information post anonymous address remain spreads mental people month message recover contributions recovery positive
w7Onl7	2	TX	visitors winter dnr summer resident find warmer canada winter opportunities birds offers perfect michigan time trees binoculars reason found put unique chill leaves viewing air migrate temperature species climates fallen owl supply traveler rarely northern long lansing gray eastern food michigan tundra peninsula homes migrants small found upper consistent humans
slrZTu	1	TX	24 apod heliopause suns june 2002 heliosphere fascinating discover featured written image explanation day photograph astronomer cosmos universe professional 2002 24 june suns magnetic spacecraft speed auyear glide 7590 extends galaxys heliopause front heliosphere shock continue past 110 close particles pioneer 3 exit dominate occurs pushing illustration pluto water actual
yM3Ls9	2	TX	emotion soc ncbi neural disrupts pubmed cogn activity neurosci affect du 2011 function web ncbi javascript site warning requires management citation external file generate software usa street psychology 603 university 61801 illinois naomisadehgmailcom daniel champaign department east urbanachampaign il represent examining psychopathic temporal salience positively evidenced personality increased frontal activation
pROGWo	2	TX	bonus signing dentists duty raised corps accession sign service eligible 29 health 6 newly public announced dentists august bonus 4year agreement 60000 commissioned active 2008 75000 january 2007 called cad duty family loan accession services including coordination discharged 24 corps service eligible addition support offer burden execution applicants school officer
vlm172	2	TX	paranal apod december 28 lovejoy comet 2011 fascinating discover featured written image explanation day photograph astronomer cosmos universe professional december 2011 28 survived paranals month including zodiacal galaxy 20 23 degrees skies rise tails spectacle continued encounter clouds large small wonders telescope frame w3 sunrise lovejoys sun captured performs christmas
z4OXSf	7	TX	1801 2056 hr 1059 2422 2845 789 1264 white statement house press 515 1892 secretary state union video watch enhanced transparency commitment browse house white logs visitor wait executive actions president obama federal receipt tax federal dollars tax spent people petitions create sign house inside white tour interactive house white
zRcKkb	17	TX	law troops bill expedited airport screening bailey senator kay hutchison texas orders december washington service traveling trust rtx 20 troops senate legislation late screening house bailey families passed dc yesterday members president kay law expedite 2011 13 hutchisons signed airport act senator family servicemen americans grateful pleased earned easier nation
oWeDBN	1	TX	photography astronaut earth gateway brightly expedition madrid northeastern canary middle 015224 pass north france peninsula northeast stands space west sequence 28 crew station board gibraltar international 2012 strait begins ends march sahara continues southern iberian dark atlantic western islands balearic spain 30 ocean pyrenees shots video gmt 015922 photographs high
w00Ao7	1	TX	solar io overview system jupiter planets moons exploration cheese volcanic ripe escape volcanically surface splotches io giant system miles plumes covered pizza body tomato material 300 rise spewing olives 190 solar half active required km melted velocity jupiters distance largest io bit earths larger moon planet moons distances perturb ganymede
tFY855	5	TX	australia image lakes wales menindee day south december image system fed west ephemeral lake blackened mud 186 flowing wales darling 2011 australia north lakes dark tandou kilometers town water river floods amount menindee small freshwater flooding south longest fashion minor surrounding image marked characteristic inland deltas sea ancient patterns apex
AnqXpb	37	TX	omega6omega3 ratio atheroscler ncbi cardiovas rep pubmed 2006 curr function web ncbi javascript site warning requires management citation external file generate software metabolic street dakota usa west research 57105 health foundation 1400 nutrition diseases falls billharrisusdedu sioux 22nd institute university south sd inflammatory human cardioprotective ratio enzyme systems include fas
ob6Poa	1	TX	mobile applications medical innovative technology ways opening health care development run applications improve smartphones programs mobile medical devices communications software weight manage calorie monitor consumers patients health maintenance communications include patient wide functions applications allowing doctors device improve professionals intake xrays mobile wellness medical range individuals facilitate healthy care view
sauVdu	1	TX	colleague nsf12024 nsf steps letter dear earthcube 12024 nsf colleague steps letter dear earthcube date december 9 2011 realizing steps earthcube subject thresholds directorate office educators partnership dataintensive community challenges aimed earth earthcube education oci established management productivity working geo system capabilities multifaceted environment increase adoption low frontiers expected transformative
ZKNbn	1	TX	drugs importations facility food lack 331 cosmetic including unapproved usc 21 prove personal admission placing appears interstate enforcement drugs pursuant burden fda absent versions accordance specific importation approved evidence states foreignmade sought violates subject prohibits united imported federal section application importer shipment manufactured includes approval manufacturing permitted countryarea refuse drug
sgzfM2	1	TX	med inhibit ncbi 2011 pubmed 3kinase mol berl phosphatidylinositol function web ncbi javascript site warning requires management citation external file generate software houston 77030 cancer holcombe research lymphomamyeloma unit boulevard tx anderson medicine texas division usa department 0903 md immunology center university 1515 limited insulinlike prolongs d1 phosphatidylinositol treatment factor
w8EL5U	2	TX	10 apod january starburst 4 ic galaxy 2012 fascinating discover featured written image explanation day photograph astronomer cosmos universe professional january 4 2012 starforming bright distant galaxy regions group northern 23 black local colorful skyscape boundaries cassiopeia large including intervening luminous constellation telltale xray newly shows 5000 dwarf million galaxies
qLHXEG	1	TX	balance disorders clinicaltrialsgov analysis hearing genetic full text hereditary view hearing identify loss disorders study hereditary genetic balance members family people eligible affects member procedures hearing undergo study balance disorder proposed caused underlying identify positional 20 disorders auditory histories systems health phenotypes define nonsyndromic familial affect loss processes identified common
tt4p06	1	TX	web student aid financial loan years select 25 generally start choose youll plan student loans 10 depending repaying repay repayment time situation repayment standard month monthly pay repay youll full loans paid standard plan years 10 50 amount payments fixed repaid monthly pay payment interest higher plans standard reason plan
bF3eGh	1	TX	toxicol based cur ncbi rev pubmed safety 2007 crit evaluation aspartame function web ncbi javascript site warning requires management citation external file generate software bmagnusoumdedu group burdock usa washington dc bolus dose brain including human neurotoxic aspartic synthetic parameters absorption critical decomposition extensive include plasma methyl food rise effects affect
t5S7De	1	TX	office disability toolkit odep labor policy department employment integrated states department united labor key organized toolkit accommodate sources audiences questions employment guides perspectives variety discussion audience increase offers papers integrated resources case full users commonlyasked collection understanding user sheets capacity potential reports guide range materials policies studies fact adults developed
v4ltNA	1	TX	fly apod space january free 1 2012 fascinating discover featured written image explanation day photograph astronomer cosmos universe professional 1 january 2012 guided mission farther nitrogen earth 41b backpack satellites bay works heavy retrieve weightless challenger meters cargo space propulsion robert mccandless pictured drifting mmu free jets safer experience untethered
sC7M7L	1	TX	photo house december white 2011 day state union video watch enhanced transparency commitment browse house white logs visitor wait executive actions president obama federal receipt tax federal dollars tax spent people petitions create sign house inside white tour interactive december house check offices photo picks 2011 white day president house
wdkAtv	1	TX	grant grantsgov opportunities synopsis opportunity find precedence service disk electronic click information grant provide notification send inconsistency document email resolved notifications printed address opportunity emails change receive thing giving original requestedany modification description represent newest file oldest previous shown documents current document sections files background representing modifications arranged changed list
wRu0QF	2	TX	10 apod january starburst 4 ic galaxy 2012 fascinating discover featured written image explanation day photograph astronomer cosmos universe professional january 4 2012 starforming bright distant galaxy regions group northern 23 black local colorful skyscape boundaries cassiopeia large including intervening luminous constellation telltale xray newly shows 5000 dwarf million galaxies
