zhIuge	2	TX	10 apod january starburst 4 ic galaxy 2012 fascinating discover featured written image explanation day photograph astronomer cosmos universe professional january 4 2012 starforming bright distant galaxy regions group northern 23 black local colorful skyscape boundaries cassiopeia large including intervening luminous constellation telltale xray newly shows 5000 dwarf million galaxies
rprcqz	1	TX	med interleukin17 sci interleukin17a ncbi monit pubmed role 2012 function web ncbi javascript site warning requires management citation external file generate software poland medical bialystok anatomy human department dorlempocztaonetpl university classification produced angiogenesis growth regulated implicated cytokine il17 networks interleukin17 il17a duriesalmon elevated microenvironment multiple increased 17a reported levels marrow
uOfVQ7	2	TX	working house year address white weekly state union video watch enhanced transparency commitment browse house white logs visitor wait executive actions president obama federal receipt tax federal dollars tax spent people petitions create sign house inside white tour interactive tough people move year past tells create grow economy jobs president
AnK6g0	1	TX	spinal stenosis encyclopedia medical medlineplus cord spinal neural column pressure foramina leave narrowing nerves stenosis openings called drier swelling ages spinal bones start due inflammation stenosis shrink swell arthritis larger grow spine disks longterm ligaments occurs person time caused spinal stenosis body worse symptoms slowly time side symptoms include people
zTVIAh	1	TX	education sci ncbi eng quas pubmed effectiveness ethics 2012 function web ncbi javascript site warning requires management citation external file generate software ave usa 1300 center business lawrence university kansas 330 ks sunnyside 660457585 summerfield international ethics hall drmaykuedu routinely quasiexperimental reasoning superior knowledge expectations areas practice courage effects condition
tC4X98	1	TX	big comments 4627 11 2011 june information investigated site wwwhitpieceresearchcom selling allegations disproved information short tactics unproven profit inside naked individuals firms unregulated research group geoinvestingcom glaucus kerrisdale research alfred capital absaroka individuals richard seeking roe pierson rick alpha streetcom move market profit selling intend running shareholder front short average
uy9iwF	1	TX	webb james telescope space join problems challenge nasarelated rwiw engineering nasa design realworldinworld solve nearing designs 27 end rwiw 2012 website completed realworld phase posted challenge january realworldinworld phases challenge rwiw webb telescope process related grades design mentored leader space selected virtual 2 setting resources students robonaut 712 realworld student
ve23E6	2	TX	industries burn unio fire hazards ogrill gas due grills recalls portable named washington instructed voluntary consumers illegal commission safety cooperation announced firm product stop dc recalled resell attempt immediately products today recall consumer product ogrill gas grills portable units 4530 industries xiamen unio corporation china manufacturer ignite fire burn gas
sgivkG	1	TX	dec whats joins 56 system jupiter exploration solar news november moon 2011 events week glide watch moon step jupiter evening object noticed high fall bright doubt jupiter youve skies jupiter perspective planets earths system moon orbits link solar zoom view httpsolarsystemnasagovnewswhatsuparchivecfm whats night sky month find eyes recreate system nasas
vtWOq0	1	TX	2002 january apod sunbather 11 fascinating discover featured written image explanation day photograph astronomer cosmos universe professional 2002 january 11 suicidal suns years bright impressively disk blocked 1 foreshortened visitor 8 circle return perihelion sunstaring tail january spacecraft venus marred approaching spotted glare direct streamers outward sun shows million machholz
fn1p5G	1	TX	products sexual tainted enhancement fraud topics medication health page emerging overthecounter trend harm represented dietary untested sexual laced deceptive consumers ingredients substances increasingly hidden controlled quantities pharmaceutically harmful varying active frequently approved unknowingly fda prescription unstudied identified drug supplements products promoted problem enhancement downloading file 04202012 information note updated accessing
xbm78H	1	TX	quakesmart fema toolkit mitigation businesses earthquake toolkit sector managers simple reduce toolkit private fema financial tools potential things guidance injuries quakesmart mitigation damages importance scalable library earthquake owners employees losses p811 actionable dvd order est friday modified 191841 16dec2011 links nongovernment social applications web fema provided reference media companies sites
b2UtUJ	6	TX	picture astronomy day fascinating discover featured written image explanation day photograph astronomer cosmos universe professional 11 2012 bright distant earth disk 20 fit easy weeks apogee photographed perigee dark day telescope pacific dense sun asia moon smallest full 300 annular 240 kilometers path super silhouetted filter point image visible smaller
s9vIBJ	1	TX	colleague nsf12024 nsf steps letter dear earthcube 12024 nsf colleague steps letter dear earthcube date december 9 2011 realizing steps earthcube subject thresholds directorate office educators partnership dataintensive community challenges aimed earth earthcube education oci established management productivity working geo system capabilities multifaceted environment increase adoption low frontiers expected transformative
qQj0K	3	TX	information recreation camping federal recreationgov tour reservation great outdoors visit americas great outdoors visit americas great outdoors visit americas great outdoors visit americas great outdoors visit americas wilderness oasis swimming beach desert alpine mountain wildlife land rocky national arsenal haven flourishing toxic piece refuge reasons states resorts mountain united forests
rtVXVB	1	TX	states patent united 8066377 transmissive produced front electronically blocked lc segments controls device include discontinue sequencing nontransmissive transmission shutter redefined unstable glasses physically video images critical method transition discontinued color pair directly stereoscopic projector source system resident multiplecolor main dmd align devices crystal projecting noncritical defined chip duration single firmware
qcR6vD	1	TX	flexibility esea department education learning educators focus outcomes improving flexibility gaps sea rigorous close education quality leaders specific educational nclb requirements voluntary provide agency state achievement equity department increasing local plans exchange students comprehensive act agencies designed student child schools opportunity behalf improve inviting instruction request 2001 statedeveloped increase order
GYE9	4	TX	tutorials medlineplus health interactive education tutorial easytoread presents variety symptoms health treatment wellness tutorials conditions patient diseases includes graphics audio language institute medlineplus diagnosis learn animated surgeries prevention interactive adobe prompted download tutorial flash note start version tutorials 8 httpgetadobecomflashplayer require mobile twitter subscribe version updates follow email rss national
hHJOXn	2	TX	champions house white change state union video watch enhanced transparency commitment browse house white logs visitor wait executive actions president obama federal receipt tax federal dollars tax spent people petitions create sign house inside white tour interactive mscaption textindent9000px 308px msdetail top top0px height norepeat 9999 349px positionabsolute left495px zindex
