zi62Ow	1	MO	comment rules practice ftc agencys public seeks proposed issued allegations trade misconduct electronic ftcs commission federal make agency parts today discovery agencys detail streamline updates govern practicing operates procedures attorneys pace investigatory evaluating comment proposed parties concern ftcs 23 federal effort review unduly parts 4 subject 2012 march rules practice
zpMNgP	3	MO	inmate andriano 191593 frequenting bars discreetly discontent andrianos poisons obtain engaging cease poison ordered insurance researched affairs resentful business profit began separate extramarital responsibilities policy scheme life increased allegedly pose death effects andriano friends working ill wendi kill hatched asked husband psychologically physically observed andriano abuse signs claimed friends abused
vHolkr	1	MO	financial owe credit protection bureau cards consumer 855 4112372 website united government official states mandatory developed spells shorter note agreements approach terms form agreement understand shown model card simpler prototype consumers credit consumer defined sample click page review separate comments terms agreement underlined pdf copy card bottom list contract leave
wmELwr	2	MO	inmate delahanty 242703 shot avenue police window sped instantly sitting christopher intersection presented arrested gun officer force back seat seconddegree result plead cactus driving men days license conceal guilty david turn conducted testimony asked road striking uribe vehicle head murder testified 31st effort lunged 10 stolen abandoned car passenger plate
yyDNDj	1	MO	candidate elections missouri sos offices filed filing map search skip site content contact opportunities directions employment home sos elections candidate filing withdraws subsections office tuesday primary committee death candidate weekends political rsmo 2 candidates subsection 115359 pm reopened number committeewoman candidacy day excluding positions declarations 1153611 500 withdrawal disqualification election
AdJz4i	1	MO	usa business programs top recommended services starting training businessreadiness business workshops courses including online small assessments calculators interactive network business mentors score businesses small volunteer leaders sbdcs business offer entrepreneurs advice training free existing future lowcost information owners business sbas share community experiences online small discuss business loan startup purposes
r8k9E	7	MO	mountains great park smoky national search remnants appalachian national life straddles culture tennessee diversity border mountain renowned ancient ridge quality forest animal southern carolina mountains plant north beauty park world great smoky americas visited warblers whitetailed chances deer park yellow spotting improve elk wildlife bears black learn feel mill stars
zd62Kv	1	MO	10 apod lick march observatory moonrise 2012 fascinating discover featured written image explanation day photograph astronomer cosmos universe professional 10 march 2012 warm atmosphere lick san rim color photo reflected 36 echo perched substantial frames nickel 4200 disk viewed telescope jose long chosen rose green sunlight moon location 7 gorgeous
rPMmjy	1	MO	transit sunearth venus day 2012 wearing beads sunearth figure students 1 solar day equinox spring comprised year wrap occur highlighting research connection series approach events scientists science sunearth day celebration thematic missions programs culminating fresh solar registration transits populated system theme resources 2012 website activities march upcoming background world day
xIhIpK	4	MO	photographs congress prints search library results catalog grabill online john 192 results grabill john digitized congress image larger 191 library 1 hlot grabill dakota film 30766 city pp neg 1 hill print john forest lcusz6278513 c1888 part deadwood copy photographic 862 bw item hlot sack grabill file 1890 pp 22
zb0i4q	4	MO	apod march flying 5 night earth 2012 fascinating discover featured written image explanation day photograph astronomer cosmos universe professional 5 march 2012 atmosphere earth captured spectacles rousing sunlit orange wave dark half progresses clouds brightness lightning approaching set sequence seas frame video dawn blue space purple lights haze international occurs
yUzuQt	13	MO	march house photo white day 2012 state union video watch enhanced transparency commitment browse house white logs visitor wait executive actions president obama federal receipt tax federal dollars tax spent people petitions create sign house inside white tour interactive house 2012 check offices photo march picks white day 30 force
zJwMns	2	MO	modot news northeast district release central archived north news crashes tailgating inattention roadwork speed cited areas customer information specialist 5732482490 tana contact relations akright restriction clark bridge weather champ ft inspections repairs mississippi width 3 calculations 9 louisiana pm measuring permitting march upcoming friday traffic 10 lane river 54 morning
zq9eU0	1	MO	inmate gonzales 058534 wagner burglary committed gasping cut 20 23 residential fled penalty stabbing returned tucked lobe stop underneath 1991 front stabbed murder february skewered arrested robbery lung husband pleas 7yearold house back aggravated arm shining opened gonzales celebrated firstdegree vcr 7 consecutive 911 deborah terms death police yard wagners
AhqykV	1	MO	kids selfcentered brains medlineplus immature page related medlineplus wednesday brain healthday linked selfish young children 7 selfcontrol development march news region behavior involved study incomplete beneficial findings german children selfish lead ways explain young impulses difficulty controlling promote suggested improved behavior social researchers played neuron ages accept children recipient 8
yr19xR	31	MO	modot news northeast district release central archived north news crashes tailgating inattention roadwork speed cited areas information christykerns 660 contact 3858257 marisa bridge weather close working lake approximately mark twain fork permitting march complete monday rehabilitate traffic ff 12 route 30 days rehabilitation north river salt stoutsville macon signs open
z8sr1T	1	MO	full text tolerability effect clinicaltrialsgov sleep study patients safety azd5213 alzheimerscognitive impairment view azd5213 random dose mild sleep duration blinded alzheimers 4 objective weeks main impairment treatment versus relationship assignment estimate cognitive study disease patients placebo azd5213 tolerability doses randomized mild sleep group multicenter investigate alzheimers 3 safety 4 weeks
nnz5f	1	MO	led lighting commercial energy star led products light commercial lighting home fixtures partners partner lighting residential led retrofits energy led cooling offers projects maintenance construction save unprecedented star easy commercial cuttingedge qualified lighting opportunity renovation natural fit costs color energy parking lots produces environment virtually show products led highend commercial
bREk8i	1	MO	government house executive contracting white order economy state union video watch enhanced transparency commitment browse house white logs visitor wait executive actions president obama federal receipt tax federal dollars tax spent people petitions create sign house inside white tour interactive homeowners refinancing house twitter responsible answers hours brian office questions
AvoDcr	1	MO	week blog united government national participate qa live protection usagov consumer states week est march session 2pm national question host protection 6 answer consumer tuesday complaint trade experts usagov questions commission provide government consumerrelated answer resources file scams company answers hand chance federal learn latest questions twitter experts chat est
bGiVgQ	1	MO	dale vice house announces disability biden joe assistant policy president white special kareem state union video watch enhanced transparency commitment browse house white logs visitor wait executive actions president obama federal receipt tax federal dollars tax spent people petitions create sign house inside white tour interactive homeowners refinancing house twitter
A3vOk9	4	MO	mission solstice prometheus cassini images home image details image collision ring 86 moon white drapes outermost prometheus kilometers shaping center bulge 53 miles learn small perturbs soft encke kinky discontinuous image visible ringlets ring rings ringplane 1 stars degree southern gap background ringlet unilluminated learn view side left acquired image
e6dM45	1	MO	materials 2011 day awareness symbol date day official materials 9 awareness 2012 brochures promotional including images web day print awareness pages icon fliers sized materials small exkinkos promotional accommodate signage images large fed materials awareness printer vendor day icon sized printing steps reproduction facilitate flier links spanish download click save
18pdxi	2	MO	volcanocams volcanic mount st helens monument national volcanic mount st helens monument national bridge tty 98601 wa monument ne headquarters 4497800 8915003 42218 yale amboy 360 box observatory ridge wa 98649 lake po 24000 326 360 toutle johnston 2742140 spirit highway helens toutle feet static north realtime approximately located ridge
srHO6N	1	MO	internship usda programs summer strongly give consists employment career usda educational sip located program assistants internships field scientific internship paid gain position opportunity areas institute headquarters experience technical future students enrolled professional usda ambassadors washington county intern agricultural service fl research program health development plant animal attend students dc leadership
eSvtIf	1	MO	house inside white bees state union video watch enhanced transparency commitment browse house white logs visitor wait executive actions president obama federal receipt tax federal dollars tax spent people petitions create sign house inside white tour interactive adobe player flash content download view 0229 domain 23 june 2010 public house
xl8O0c	4	MO	grant grantsgov opportunities synopsis opportunity find precedence service disk electronic click information grant provide notification send inconsistency document email resolved notifications printed address opportunity emails change receive thing giving original requestedany modification description represent newest file oldest previous shown documents current document sections files background representing modifications arranged changed list
bKCzpO	1	MO	web student aid colleges financial community grants repaid click universities requirements additional variety federal review program details grant offer students attending schools loans unlike career fouryear page quick aid eligibility financial grants apply based application federal submit read listed fafsasm eligibility free student factors aid page program undergraduate certificate pell
wgaZxX	1	MO	picture television room congress laborrelated library motion finding libraryof collection films aids reading guides limited prolabor portraying represent relate produced working union political histories specifically labor films decades 1950s nonpartisan made progressive list noted antiunion era exceptions philosophies history deal century proradical educational farmers broad note majority laborrelated conditions prounion
AEBSjT	1	MO	inmate garcia 047398 dollar steve ended 20 21 prison lady fled bank occurring bar proceeded james drop arrested gun large garcia shots bills bars force scuffle sentenced codefendant defendants firstdegree told sheffield pled path withdrew atm guilty amount scene owned unsuccessful owner ordered refill armed city spoke dropping entered head
zgTKWo	1	MO	official manual state missouri 20112012 secretary map search skip site content contact opportunities directions employment enable turned web settings fully utilize application scripting browser blue official manual sos book home 20112012 detailed years states essays find blue information federal pictures state book heritage local preserve missouri 100 governments official manual
xNuGnD	2	MO	minority monday national month april unity 2 health equity day skip navigation hhs overview accomplishments disparities omhs speaker equity health keynote importance advances regional mention representative role present suggested advance efforts plan owh representatives hrsa 1 3 health samhsa equity healthmoderator minority regional agencies consultantpanelists panel invited offices cms point
yZxhRq	1	MO	teen summer wilderness academic national park offers program adventure enrichment yosemite search summer inspire golden mission actions founded nurturing consists nevada partners based personal residential 28 state offers sierra 2012 monica recreation organizations online runs world adventurous association school bar skills michael serves annually 501c3 40000 bilodeau including klean olympic
mRnzm4	1	MO	recreation park mission bay shores tecolote bike comfort picnic people issued allowed mission hilton tecolote rinseoff path tables rings access located station playground riding east beach inflatable barbeque lifeguard north fire hotel site shores grills 100 water duty bay shower jogging permit south summer early parking tend fill lots weekends
ySQVYW	1	MO	inmate 038977 dixon detective serving profiling committed years murder identify jury crime sexual identified 1986 wayne indicted death 20 opened technological sentence advancement sentenced raped state suspect dixon 7 tom assault case life arizona clarence tempe killer scene 21yearold apartment connected student 30 dna stabbed strangled deana bowdoin conviction 1978
NHIcS	2	MO	house white state union video watch enhanced transparency commitment browse house white logs visitor wait executive actions president obama federal receipt tax federal dollars tax spent people petitions create sign house inside white tour interactive event live facebook discussion participate click member facebook give click questions comments httpwwwwhitehousegovvideo ondemand library
UT2FE	2	MO	house white state union video watch enhanced transparency commitment browse house white logs visitor wait executive actions president obama federal receipt tax federal dollars tax spent people petitions create sign house inside white tour interactive event live facebook discussion participate click member facebook give click questions comments httpwwwwhitehousegovvideo ondemand library
yrfXg6	2	MO	inmate 136521 anderson shot agreed held kill poyson leta cut 21 bludgeon finally kagen gave hit killed bread ended bobby 50 rock trailer lantern crushing decided home driving robert knife eating august frank night hitchhiking hours death wear boy 39 yard dinner cinder block son county delahunt awoke 15yearold letas
9wtG8n	1	MO	medlineplus email updates profile requested site check information service create alerts access offers interest email updated return deliver free web address subscription give receive items medlineplus automatically user process topics sign select email signup updates address emails subscription box receive list medlineplus enter profile preferences addresses topics view history update
d0iKKk	1	MO	corps monthly themes preparedness citizen 2011 events communities uniting preparing nation locate login contact council moved page httpcitizencorpsgovnewseventsthemes2012themesshtm andor links update questions bookmarks citizencorpsdhsgov email readygov corps notices disasterhelpgovcitizen plugins home fear register privacy federal faqs femagov citizen widgets act policy dhsgov data foia bulletins annual reports servegov contact bannersaccessibility
w4NJML	1	MO	inmate 174456 cromwell sentenced march louis robert 2003 6 cromwell count 1 sentenced murder degree maricopa 82001 death cr2001095438 county short committed lethal injection october stephanie 0351 dispatch female apartment police approximately call 8 hysterical received stick baby daughter october identified 3208 believed male ran dead heard street home flower
o8Jyaz	2	MO	facts nutrition tips fit guidelines dietary americans tools based offers easy tips plate eating food diet understand teaches icon healthy wellbalanced components interactive breastfeeding weight summer general information late population updated seeking preschoolers women loss kids pregnant specific individuals recommendations calories manage balancing weight increase foods foods reduce building healthy
AfKeWD	1	MO	notice buy admin request contract construction fhwa america waiver action notice request comments date web posting 03052012 notice publication federal register date determined finding effective federal register determined date comment 15 effective period days date close public passenger nondomestic mpg back minimum cfr 27 requirements 23 federal granted administration state
wT7eLi	16	MO	february 15 da14 asteroid earth nearearth miss 2013 2012 discovered bring radii earth rapidly northern sky 4 fade 2013 2012 evening shadow occurring february brightness morning naked magnitude fainter meters traveling 1926 pass close closer sun reappearing approach small eye 35 diameter ring size earths quickly asteroid visibility nearearth spain
xSNEw6	1	MO	advance votes jobs mccaskill bill claire missouri senator bipartisan highway washington years millions funding statement infuse bipartisan highway transportation hundreds released projects advance mccaskill bill claire today missouri senator voting dollars fights disappointing bring finish vote find political politicians bipartisan infrastructure jobs congress food missouri plan line america bill fighting
xBhvtQ	1	MO	catalog pia15115 page limited supply mission martian rovers rover winter mobility portait mars shows approached power nasas solar dust opportunity reduces cleans exploration panels accumulation wind mission martian images rovers 24 2011 21 camera opportunitys pancam panoramic mounted sols mosaic 2814th omits days downwardlooking 2811th mast dec view wavelengths 601
xXGIJ9	15	MO	february media social day awareness 2012 impair stress ageappropriate capacity mental developmental youths reach ptsd challenges health disorder posttraumatic goals providers dealing wwwsamhsagovchildren children friends visit trauma resilient hope families heroes youth learn juvenile mental prevalence years challenges suffer greater stress1234567 justice generally system noting health rates document numerous higher
yInBWz	1	MO	youth preparedness corps citizen communities uniting preparing nation locate login contact council moved page httpcitizencorpsgovgetstartedyouthyouthindexshtm andor links update questions bookmarks citizencorpsdhsgov email links plugin require plugins page view readygov corps notices disasterhelpgovcitizen plugins home fear register privacy federal faqs femagov citizen widgets act policy dhsgov data foia bulletins annual reports
zOMvzF	3	MO	thomas congress text bill library 112th 20112012 hcon ih 107 force misdemeanor high sense constitution section offensive crime 4 constitutes authorization expressing congress president article ii clear prior impeachable act military jones committee judiciary submitted concurrent mr resolution referred force misdemeanor high sense constitution section offensive crime 4 constitutes authorization
