ujHtZu	1	global	catalog pia15185 page spacecraft weekly orleans 20 aug 23 28 late detected 2011 increased made 51 predicted river heavy landfall result sea blue bottom 3 aquariussacd lee aquarius analyses lowsalinty 38 lowsalinity region florida surge sept color image directly panhandle mississippi instrument top tropical storm louisiana rainfall inches composite delta
HIfJYf	50	global	shortterm strength sci ncbi med tra effect sports scand 2001 pubmed function web ncbi javascript site warning requires management citation external file generate software institute university southern odense sports clinical science biomechanics denmark p005 serving interpretation session gh isometric highest group spite la rose young endogenously weeks plasma match tests
1Ep3qk	2	global	alcohol research college drinking prevention conferences highlights niaaa college video college alcohol policies body interactive myths alcohol calculators ecards news listserv join links order publications link email page print page snaphot stats consequencesrecommendations drinking summaries colleges culture planning college statistical collegespanel campus sheet alcohol research call papers evaluation parentsbrochuresreducing curriculum
ITqoDa	3	global	blog preparing storm fema prepared magnitude storm coming comment accordance comments blog moderated policy femas links nongovernment social applications web fema provided reference media companies sites endorse msgdata washington street apply management prepare federal rates homeland department 4fema emergency dc 43362 20472202 sw agencyus security500 6462500text tty assistance step 46275853
HxGPkv	8	global	apod april tungurahua 2 erupts 2012 fascinating discover featured written image explanation day photograph astronomer cosmos universe professional april 2 2012 1300 roughly high tungurahua erupts years shines cloud peak glows photographer sky lavalit 5000meter located hot 2006 captured starlit white image pictured ejected pours explanation distance visibly dark fell
a21gWg	2	global	safety road detailed people locations weather situations safety sections handle risk tornado mobilemanufactured groups homes vehicles guide severe outdoors road storms rvs sport utility tornadoes avoided fortunately threatens time boats cars trains thunderstorm possibility alert 18wheelers trucks places vehicles terrible severe situations planes people lifted blown killed destroyed tornado safety
q1KRx	1	global	national adoption month connected stay learn spanish year month initiative children raise system waiting foster adoption parents 2011 national awareness website building focuses families professionals poster english permanent capacity november years 107000 care recruit youth benefit materials time action retain view national month adoption find childrens initiative information national partnership
dmQsbj	2	global	center tornado watch prediction storm 175 status report 175 watch messages information network service national warnings visit iwin weather interactive 50 mod 30 mod 40 mod 30 mod 50 mod 30 mod high 80 f2f5 probability forecaster 70 60 table event increased category tornadoes probabilities issuing 5 low moderate events
HpS1l7	4	global	joseph porche al santa juncker salesmen energy trabuco konrad names gary defendants investment san rancho porche boilerroom 47 40 commission engelhardt joseph newport scheme ca today dale complaint caza exchange operators de coast larry california kafarski aliso viejo coto carlton margarita fraudulent conducting clemente 46 age 51 canyon 53 securities
HDpjC2	13	global	heart raised spouses risk cancer disease stroke medlineplus patients pages related medlineplus heart cancer disease stroke healthday risk spouses april increased news 11 study wednesday suggests patients stress takes explanation caregivers health toll researchers heart cancer people national inpatient stroke partner increased swedish percent 29 risk registry 13 disease found
a0hEWP	1	global	carbonated ncbi sweetened girls diet early beverage assoc pubmed 2010 function web ncbi javascript site warning requires management citation external file generate software noll childhood center pennsylvania university park usa research 16802 state pa laboratory 129 obesity information intake limited longterm dietary influence early patterns beverage childhood persistence adolescence soda
5MJ3G	1	global	thomas congress 107th text bill library 20012002 hr ih 2977 prohibiting spacebased states cooperative implement basing united space weapons humankind banning peaceful permanently preserve president world require adopt treaty benefit action period case committee kucinich armed addition concerned relations speaker international jurisdiction provisions fall services consideration subsequently committees science bill
qbu0Rv	2	global	19 items selected pubmed ncbi function web ncbi javascript site warning requires management citation external file generate software surgeons patient safety sleepy lineaweaver surg sep6732034 ann plast 2011 abstract citations related development score medical modified early record warning electronic bl huesman albert dimens crit nurs 2011 sepoct30528392 care citations related
8KR52E	1	global	wildlife parker national river refuge accessible plover 2nd 1 open note access beaches closed beach public lot threatened federally refuge protect boardwalk patch april remain piping small order dedicated parker habitat migratory national occupies 550 lands federal birds established feeding network 1942 administered agency system acres fish resting barrier twothirds
IJlU3I	3	global	13 jobs friday rigov april hot dlt 2012 fgx ri 10 job employer rate experience number international accountant royalty location salaryhourly position 683345 smithfield channel based ri planner fgx positionsupply salaryhourly rate job experience number international 12 location 683354 employer smithfield channel based ri positionchild clinicians 683623 hour 4400 number
pUibpI	1	global	netherlands patient 1994 contraception couns ncbi pubmed low educ function web ncbi javascript site warning requires management citation external file generate software ongoing planning agricultural fear rapid main pill increased sterilization netherlands level payed including shows methods pregnancies reduce related sex society rate growth discussions sexual insurance voluntary factors review
ItdDSe	1	global	repair suffocation hazards sold nan due exclusively entrapment woodworking cribs fall recalls dropside jcpenney named washington instructed voluntary consumers illegal commission safety cooperation announced firm product stop dc recalled resell attempt immediately products today recall consumer product cribs rockland dropside furniture units 16700 nan woodworking taiwan manufacturer penney purchasing importer
HxQxnH	5	global	house white state union video watch enhanced transparency commitment browse house white logs visitor wait executive actions president obama federal receipt tax federal dollars tax spent people petitions create sign house inside white tour interactive event live facebook discussion participate click member facebook give click questions comments httpwwwwhitehousegovvideo ondemand library
GNIQOu	1	global	blog business fema lincoln oregon county nothingg dear ricketts femathanks comment accordance comments blog moderated policy femas links nongovernment social applications web fema provided reference media companies sites endorse msgdata washington street apply management prepare federal rates homeland department 4fema emergency dc 43362 20472202 sw agencyus security500 6462500text tty assistance
srHO6N	4	global	internship usda programs summer strongly give consists employment career usda educational sip located program assistants internships field scientific internship paid gain position opportunity areas institute headquarters experience technical future students enrolled professional usda ambassadors washington county intern agricultural service fl research program health development plant animal attend students dc leadership
HCj4HK	4	global	quicker conception medlineplus moderate linked exercise pages related medlineplus konkel lindsey reuters health moderate exercise obese overweight tied york women exception longer success pregnant study vigorously time conceive heart depression diseases linked exercise risk effects diabetes lower clear disease fertility epidemiologist boston height lauren find physical index ratio varied lead
H7jYf9	1	global	arterial full sodium tolerability text clinicaltrialsgov diseasesonic nitrite patients safety pk phase iia peripheral view prevent nitrite tissue drug determine vessel speed sodium provide seek wound orally pad demonstrated problems blood benefits promote animals necrosis experience patients growth study healing manifestation results leads systemic artery contractile extremities cardiovascular claudication limbs
sAIWJ9	1	global	dnpao eating weight cdc healthy rethink drink weight people lack reduce results lowcarb calorie cut soup diets fast grapefruit lowfat highcarb type body food drink diet blood focusing cabbage loss intake promising calories fewer matter lose dont people contribute number facts reducing drinks label add listed beverages hidden nutrition good
I5VI0l	3	global	adding congress gift multimedia preservation photos future descriptions digital library back videos 9k 314transcript 82011running time date pdf posted manage sense find personal make instantaneous collections digital difficult description photography photos grow loved enormous specific collect amount future files organize tags photo collection video descriptions search make add digital explains
f0dwED	4	global	reform results winning future responsibility department education ranking committee miller kline member chairman members obamas today agenda president education opportunity talk committee senate reduce dual administrations education secure spoke efficient commitments investing week emphasized budget spending future months grade pass reflected grants learning issues span pell written statement today happy
HGVVsE	3	global	development sci ncbi med preclinical transl clinical translat pubmed 2012 function web ncbi javascript site warning requires management citation external file generate software cambridge ma usa bind biosciences 02139 developed displayed preclinical primates nanoparticle translation 24 loading 20 ligand density chemotherapeutic finally formulation treatment dtxl plasma remaining halflife vascular polymeric
rD9blf	1	global	emergency fire response grants safer adequate fema staffing est friday modified 24feb2012 162935 links nongovernment social applications web fema provided reference media companies sites endorse msgdata washington street apply management prepare federal rates homeland department 4fema emergency dc 43362 20472202 sw agencyus security500 6462500text tty assistance step 46275853 800 guide
3ixzg	3	global	caring childs mental health childs mental mission sites overarching childrens caring system effort support samhsas increase approach health comprehensive public awareness marketing social samhsafunded purpose services strategic care 1994 created communications team strategies works stimulate information wwwawarenesseventorg visit event national day awareness rsvp dont washington wwwsamhsagovchildren edt 730 live 9
zs80sl	1	global	wildlife service national klamath complex basin fish refuge basin planning refuges visitklamath seasonal constant ebb process dynamic mammals year enthusiast voyage visit opportunities klamath click reptiles refuge checklist print basin birds fish discovery neverending information season visitfor amphibians change wildlife determines flow viewing greatly refuges view mondayfriday 6672231 center 8am430pm
maoFFs	1	global	king division novelty ne county hill services road bridge creek evans vicinity facilities 195th improvements design stormwater ave stream union 196th crossings novelty ne construct mitigation hill sites include development includes construction phase wildlife work project replacement road redmond creek pursuant bear 208th intersection projects developer hal upd novelty identified
swz1ak	2	global	bmc rapid determinants ncbi weight infancy pubmed gain pediatr 2011 function web ncbi javascript site warning requires management citation external file generate software school australia brisbane university l2danielsquteduau health queensland technology public weight infancy variables modifiable determine rapid life early important gain predictor aim obesity childhood infant birthweight variables interpreted
brGlf9	23	global	center tornado watch prediction storm 164 164 status report watch messages information network service national warnings visit iwin weather interactive 40 mod 20 low 20 low 30 mod 40 mod 30 mod high 70 f2f5 probability forecaster 70 60 table event increased category tornadoes probabilities issuing 5 low moderate events
IaQ4ZF	1	global	house passover address president obama easter white weekly state union video watch enhanced transparency commitment browse house white logs visitor wait executive actions president obama federal receipt tax federal dollars tax spent people petitions create sign house inside white tour interactive warmest celebrating offers easter humanity reflects passover president weekend
4tCs2s	1	global	prediction progression solar cycle noaaspace center progression presented prediction weather solar cycle prediction predictions observed weather tables depict space monthly charts replaced final ises updated initially solar preliminary cycle center progression values page latest september agreed number reached 24 supermajority expected 8 panel smoothed 2013 qualifies occurred solar 90 maximum
mm6RaH	1	global	harold private peopleagerholm usmcr class san corps private agerholm assigned born 1925 battle battalion tenth november unit diego christ 1942 1943 29 class state enlisted basic depot racine division harold wisconsin fourth stationed tarawa promoted california fierce fighting july marine marines zealand training participated january completing recruit betio island reserve
HDSfnW	2	global	ncbi lead adversities schizophr sp earlylife specific pubmed bull 2012 function web ncbi javascript site warning requires management citation external file generate software building liverpool 1institute psychology university l69 society health 3gl uk waterhouse block ci previous relationships auditory paranoid morbidity paranoia ideation forms local associations risk loss psychiatric early
csI8yJ	2	global	releases congress twitter library news archive office communications congress washington dc library se 205401600 ave 101 independence 2027079199email voice 2027072905fax paolocgov matt 202 raymond congress twitter library gregpasstwittercom contact mraylocgovcontact pass greg 7072905 twitter library donating archive web networking 140 service leading send digital tweets public users congress characters consist
HXFycZ	1	global	logos led ncbi plos temptation rewarding bias pubmed brand 2012 function web ncbi javascript site warning requires management citation external file generate software australia finance university victoria melbourne department parkville magnetic assigned brain including human alternative decisions priming based temporal conclude complex awareness seemingly choice contextual susceptibility presented decisionmaking medial
3kjDJ	1	global	thomas bicycle edison trick 2 riding variety vaudeville entertainment american popular 18701920 stage load set retrieve option filmto viewing download disk film future view browser 1 part modemmpeg megabytesquick format realmedia 288 3 5 megabytes time higher edison united createdpublished states 1899 manufacturing bike bicycle forwards pauses cyclist street moves
zui2a7	2	global	home usda kyf compass food farmer compass usda videos discover market pictures field systems farmer local supporting food regional watch compass segment case read learn growing studies kyf computer file compass open acrobat experience reader pdf save map 20092011 years visiting food regional programs farmer usdasupported shows interactive local projects
i88v3o	2	global	map risk business floodsmart flood property skip navigation free call toll 18883799531 vary owner protecting contents area vital insurance building moderatetolow risk business survival highrisk premiums opt prefer rate year 500000 insurance contents area start low policy lowest buildings moderatetolow risk offering price commercial preferred 567 qualify coverage 162 building
HKTt3x	3	global	med training phys ncbi pubmed rehabil effects detra exercise 2012 function web ncbi javascript site warning requires management citation external file generate software mdh ulster seville research physical education lc northern sports sciences health ireland department bs spain jgm school institute university rehabilitation qualityoflife aimed determine depression physical impact capacity
4sPwrP	1	global	ncbi consumption int nutr vitam pubmed green effects 3week res 2009 function web ncbi javascript site warning requires management citation external file generate software zurich institute sciences human switzerland eth sport movement endurancetrained results rest human 0039 oxidative ratio gte kinase weeks uptake creactive 0043 fat effects lowdensitylipoprotein processes respiratory
nxGTGR	5	global	forms publications irs resources methods links tax electronic forms provide media irs capabilities access source basic print function acquire additionally advanced search irsgov official materials publications published links schedules tax individual download return taxpayers irs forms income mail order recently business advised packages needed filing instructions longer receive paper page
GzNxYS	1	global	opioid prescribed consuming pain ncbi pubmed 2008 endocrinopathy women function web ncbi javascript site warning requires management citation external file generate software school usa family university practice davis california hwdaniellaolcom department redding medical opioidassociated years ceased nonmalignant menses adrenal chronically contributions osteoporosis density histories production intrathecal decreased indicating characteristically hormone
gSetz8	1	global	center tornado watch prediction storm 160 status 160 report watch messages information network service national warnings visit iwin weather interactive 40 mod 30 mod 40 mod 10 low 60 mod 30 mod high 80 f2f5 probability forecaster 70 60 table event increased category tornadoes probabilities issuing 5 low moderate events
IhEOy6	18	global	current uscert activity highimpact web current incidents regularly updated reported types summary uscert activity security page frequent code apple encourages apply risk mitigate perform vulnerabilities review support crosssitescripting attack 2 iphone website multiple users ipod ios ht5278 administrators attacker updates address article spoof ipad execute released uscert arbitrary 511 code
3Tv0E	3	global	technical error website hyperlink nongovernmental direct application hhs consistent hyperlinks states services human subject information hyperlinked united application contained health endorsement department website intended provided visitors external constitute applications privacy appearance practices products policies purpose link redirected connect experienced unavailable technical issue page healthfindernhicorg comments email information usaccessibility privacy mapcontact
i8lAE	98	global	glacier national park search lodges awaits wilderness trails solitude 700 discover national relive glacier forests glaciers paradise pristine native meadows mountains transportation spectacular seeking park lakes visitors explore historic adventurous alpine rugged hikers days experience miles stories americans chalets summer direction links pointed vacation planning quick summer visit year begin
HkyUN9	1	global	control raise cancer depoprovera medlineplus breast birth risk pages related medlineplus control cancer depoprovera progestinonly healthday risk suggests young research 4 increased form link breast birth news appears women wednesday april injectable cancer seattlearea aged compared 20 44 breast women 900 study diagnosed researchers 1000 cancer invasive acetate year depomedroxyprogesterone
zZ1zsG	1	global	inmate cropper 091432 lumley committed perryvillesan murder throat brent cell juan response inmate unit 7 department contraband knife arizona march stabbing cropper murdered locked 1997 place officer corrections found shutts miller marshall steinle sentencing defense richard robert heilman start 3 joseph roland 6 colehon john resentencing plea honorable judge 2
OkEO	2	global	states patent united 5662332 deck spells winning forms board rules spell game level 54 collectors energy reduce library computer trading provided network defend version tournaments method modify outlets obtained commands players games retail 60 64 electronic construct strategy attack life enable form opposing 10 12 cards video interactive played player
s2xmEN	2	global	polymorphism endothelial ncbi rep mol biol growth vascular fac pubmed 2012 function web ncbi javascript site warning requires management citation external file generate software 200 oncology university huihe medical suzhou china wuxi fourth 214062 department affiliated hospital road xxlsmile00gmailcom precise inconclusive confirm gg ga derive controls 093117 detected samples 7693
d0iKKk	40	global	corps monthly themes preparedness citizen 2011 events communities uniting preparing nation locate login contact council moved page httpcitizencorpsgovnewseventsthemes2012themesshtm andor links update questions bookmarks citizencorpsdhsgov email readygov corps notices disasterhelpgovcitizen plugins home fear register privacy federal faqs femagov citizen widgets act policy dhsgov data foia bulletins annual reports servegov contact bannersaccessibility
gUsPo	7	global	states patent united 5676977 mechanism human agsub4 semiconducting entities osub4 silver loss tetrasilver fired proliferating humans aids sites intravenous simultaneously completely active divalent firing resulting ism nontoxic bloodstream diamagnetic electrocuting ppm put utilized suppressing capable hepatomegaly chelate trigger redox molecular function triggered liver pathogens synergistic injection tetroxide devices chelation crystal
9uqps4	1	global	ghost apod october star trails 29 captains 2010 fascinating discover featured written image explanation day photograph astronomer cosmos universe professional october 2010 29 shape earth captured surreal photographer ghostly reflected closely gazing trails nightscape arc greece images rotates wreck aground semitransparent consecutive run seconds water peloponnesus creates dreamlike composed digitally
fgHYrG	1	global	hud housing fair history meant family civil national sex based previous 1968 fair religion 1964 discrimination housing acts followup amended handicap lyndon prohibited president rental origin 11 financing johnson rights expanded sale signed april race status viii act title enactment garner utilized approval kings open housing legislation long passage failed
oBm9Ks	3	global	affairs public home links point hyperlinks find site constitute services welfare linked web provided army west purpose stated sites contained authorized endorsement department consistent exercise activities information locations control external exchanges morale recreation appearance products editorial military disclaimer web aspects technical site comments master questions reporting site broken link address
o4KSzx	1	global	sec form accurate reviewed information necessarily commission reader complete exchange completethe securities assume determined filing 1 identity issuers information business contact 2 place principal persons 3 related clarification response clarification response clarification response clarification response clarification response clarification response clarification response clarification response clarification response clarification response clarification response clarification
HUYxjX	2	global	advisory sab chartered experts staff standing candidate opportunities board input casac serve nomination committees science annual epa jump main content science staff advisory board epa false committee nsf query searchreadformquery returnfalses dosearch function return locationpathnametolowercasesplitnsf0 parentcommittee path line escapequery search querystring contact windowlocation dosearchdocumentforms0queryvalue standing committees casac sab annual chartered
GTuFc0	6	global	hankuk house university president speaks white obama state union video watch enhanced transparency commitment browse house white logs visitor wait executive actions president obama federal receipt tax federal dollars tax spent people petitions create sign house inside white tour interactive adobe player flash content download view 26 march 2937 domain
ID1w33	1	global	rp ncbi plos prdx3 single pubmed polymorphisms nucleotide 2012 function web ncbi javascript site warning requires management citation external file generate software division united genetics cancer institute national states epidemiology bethesda maryland america cancer agent persistent human precancer factors hpv genetic risk infection etiologic affect papillomavirus cervical carcinogenic progression host
HINxb5	2	global	10 apod fur tree fox april unicorn christmas 2012 fascinating discover featured written image explanation day photograph astronomer cosmos universe professional april 10 2012 bright distant broader ngc apex young convoluted excited 2700 trees dark fur clouds covering traced shape 2264 close constellation blue pelt nebula fox haze moons christmas
