HDTqUT	5	global	control cancer proclamation national month house white presidential 2012 state union video watch enhanced transparency commitment browse house white logs visitor wait executive actions president obama federal receipt tax federal dollars tax spent people petitions create sign house inside white tour interactive house white office press secretary control united cancer
AhvmIu	1	global	giant mission solstice cassini images home image details upper 5150 titan middle saturns top rings series shadows kilometers 3200 planet cast miles image upper speck image ring 86 rings tiny moon black white main thin shown prometheus kilometers shadows shadow appears center 53 side planet cast miles pandora small south
zi62Ow	1	global	comment rules practice ftc agencys public seeks proposed issued allegations trade misconduct electronic ftcs commission federal make agency parts today discovery agencys detail streamline updates govern practicing operates procedures attorneys pace investigatory evaluating comment proposed parties concern ftcs 23 federal effort review unduly parts 4 subject 2012 march rules practice
jUSKu	2	global	gluten ncbi rev nutr milligram recov mucosal 2004 pubmed day function web ncbi javascript site warning requires management citation external file generate software policlinico italy university matteo pavia irccs years duodenal spite basis harmless clinical histological gluten prevented biopsy report 2 reviewed day case patients celiac satisfactory milligram serological adequately
HLo5Cr	2	global	medlineplus health video threat smoldering news javascript adobe flash enabled content player version 8 requires flash pages related medlineplus good secondhand extra problems isnt kids health smoke states lung raises children united develop breathing problems lives asthma kids tobacco odds smokes smoke allergy lung worse compared checked allergies girls young
IPt2a8	2	global	ncbi med amee evidence pubmed reflections symposiu teach 2012 function web ncbi javascript site warning requires management citation external file generate software queensland university australia chaotic evidence relation meanings chair education conference clinicians depending discussion research complex symposium 2011 reflects multiple nature amee academics article present panel world medical work
deJZ1R	5	global	center watch thunderstorm prediction severe storm 161 status report messages watch 161 information network service national warnings visit iwin weather interactive 10 low 5 low 30 mod 20 low 40 mod 10 low high 70 f2f5 probability forecaster 70 60 table event increased category tornadoes probabilities issuing 5 low moderate
HsVt3d	1	global	curr ncbi res ne brain donation program alzheimer framingham pubmed 2012 function web ncbi javascript site warning requires management citation external file generate software heart school ma usa university amckeebuedu medicine neurology framingham boston department study rating abilities gold cognitively results years brain batteries cdr assessment 139 vascular 1948 death
jcIrm	3	global	web student aid program financial certification loan sources grants repaid undergraduate grant federal nonfederal awarded foundation added degree students student professional cases teacher aid unlike receive earned considered postbaccalaureate bachelors enrolled pell 30 financial year total grant amounts 1 depending fulltime 2011 2013 201112 status full plans attend june award
HzTNPV	1	global	detection ncbi people bmj early pubmed 2012 evaluation intervention function web ncbi javascript site warning requires management citation external file generate software school university psychological sciences m13 manchester uk 9pl emerging people determine preventing young symptoms psychotic worsening conditions deemed experienced risk seeking therapy cognitive effective schizophrenia blind multisite controlled
IEZjUR	14	global	county 13 jury reported april rigov providence grand report final 2012 proven information court constitution note innocent guarantees defendant complaint law presumed indictment guilty allegation raymond dob washington 713 71980 coventry street marr p1121211a ri county younger counts 1 providence marr grand indictment charging molested jury raymond degree dates reported
HA5s0Q	2	global	med ncbi measurements repeatability nucl pubmed 18ffdg uptake 2012 function web ncbi javascript site warning requires management citation external file generate software netherlands diseases university vu department amsterdam pulmonary medical center metabolic increasingly repeatability assessment analog established monitor suv pet data measurements uptake method glucose standardized therapy imaging response tumor
IHo8Pe	2	global	grant grantsgov opportunities synopsis opportunity find precedence service disk electronic click information grant provide notification send inconsistency document email resolved notifications printed address opportunity emails change receive thing giving original requestedany represent newest file oldest previous shown documents current document sections files background representing modifications arranged changed list grey synopsis
I44uc6	3	global	house buffett rule board white state union video watch enhanced transparency commitment browse house white logs visitor wait executive actions president obama federal receipt tax federal dollars tax spent people petitions create sign house inside white tour interactive adobe player flash content download view 11 domain april 505 public 2012
xwfS45	1	global	code 21 title federal regulations cfr 216 compounding part pharmacy drug products bcompounded subpart food unsafe cosmetic withdrawn market provided federal section 503aa compounded act removed effective drug products components found exemptions drug phosphate products adenosine drug products cortex adrenal products azaribine drug benoxaprofen products drug products bithionol drug sodium
rIVze8	1	global	pain medical back medlineplus chronic encyclopedia low back health life pain complaints exact common time found pain suddenly back chronic article occur types information longterm low discusses bending leads long simple improperly standing things event suddenly movement pain reaching lifting waist single time pain people arthritis back chronic wear spine
I4VKCz	2	global	substa behav ncbi supplements addict fitness 2012 pubmed gateway psychol function web ncbi javascript site warning requires management citation external file generate software leads supplement psycinfo relationships current disturbance young symptoms potential aped analogous 2012 increased checking fat mbcq chronological progression perfectionism specific benefit gender disorder sequence series strongest precedes
IOxBq2	2	global	apod 14 april moons saturn 2012 fascinating discover featured written image explanation day photograph astronomer cosmos universe professional april 14 2012 discovered saturns sky kilometer huygens dione march views dutch designated satellites saturn team found 5150 frame titan astronomer portrait christiaan tethys moon smallest moons 1655 recently earths continuing imaging
HAG2kZ	3	global	alternating multi ncbi clonal competition pubmed blood dominance 2012 function web ncbi javascript site warning requires management citation external file generate software arizona center cancer comprehensive mayo scottsdale states clinic united az emerging evolutionary show results selection existence sampled temporal alternate 28 samples stable clonal engineered therapy competing subclones occurring
uaM76o	1	global	dysphagia ncbi postextubation associa persistent pubmed crit 2011 care function web ncbi javascript site warning requires management citation external file generate software division colorado usa 12700 university denver sciences 19th critical medicine 80045 pulmonary east avenue aurora madisonmachtucdenveredu care dysphagia postextubation outcomes illness factors survivors critical treatment unexplored development patient
IVjXiV	1	global	motherdaughter ncbi asia pac health cent correlation pubmed public 2012 function web ncbi javascript site warning requires management citation external file generate software anthropometric played years adolescence 25 group mother participants factor associations risk early familial association adulthood mothers 1825 investigate indices obesity metabolic consistent correlations enrolling 192 result 395
DGtT	2	global	web surfing healthy medlineplus guide suggestions quality information based sites health web experience evaluating responsible recognized content authorities sourceuse site reviewed web sites board information focus qualityall posted created equal editorial site promise sounding information make deliberately health good scientific results abounds dramatic web cyberskepticquackery true obscure language miraculous quick
gTYU7e	3	global	photographs prints congress library catalog collections online digitized library ii facilities images ottoman empire 1893 educational abdul sites jpegstiffs photographs congress government showing collection date1880 historic photographic 1800 hamid survey military display view exhibit date1899 portraits library images education assembled 1900 web paris exposition jpegstiffs digitized consisting 360 photographs life
H4SCgk	1	global	methods ncbi multigene phylogenetic biol pubmed mol analyses 2012 delimit function web ncbi javascript site warning requires management citation external file generate software canada biodiversity central agrifood farm ottawa mycology agriculture experimental phylogenetics concept sequencing differs group multigene interspecific putative psc wellcharacterized practice morphologically framework phylogeny closely barcoding locus reference
HycsRT	1	global	uscis study materials english test sentences tools speak application writing write materials correctly test reading speaking ability form eligibility interview started uscis prepare read n400 portion determined officer components english naturalization study additional section products select short naturalization process overview video test providing requirements citizenship process eligibility naturalization presentation practice
ynamaB	1	global	wildlife service national klamath complex basin fish refuge seasonal wildlife national highlightsklamath basin refuges fall pelican major geese departed whitefronted september gulls ducks mallard including migration terns klamath species august late northern swan grebes snow birds 1 doublecrested white swans ross arrival canada good greater basin tundra million pintails early
fCnjhO	2	global	wildlife national laguna atascosa refuge map google address directions refugewmd google maps window opens warranty note service personal visit assumes risk made policies providing guide reusing usability control domain fish site general check information driving feature content conditions provided user directions wildlife route leaving expeditiousness representation road feed irrigation year
eGPqfK	1	global	home snp ncbi ncbimy servicescitation matcherclinical queries function web ncbi javascript site warning requires genbank ncbis pubmed dbsnp information additional system approach entrez queried search database options incorporated databases original search fields examples searching marked id aliases qualifiers build type asterisk snp data search querying 103create fields 103cbid range info
dfNTEA	1	global	enforcement violator cpl svep severe program 0200149 osha instruction abstract michaels authority david mph assistant phd secretary executive summary program violator violations mandatory enhanced obligations actions states osh inspections settlement committing companycorporate court nationwide federal section inspecting corporatewide increased state oshas agreements establishes willful include indifference demonstrated followup enforcement provisions
Aj89b0	1	global	phys ncbi direct comparing pubmed breast cancerrelated lymphedema ther 2012 function web ncbi javascript site warning requires management citation external file generate software md naval usa medical center breast bethesda 20814 national care emerging affect based 312492 group 63619 intensive tm treatment advancedstage women diseases psm early warranted therapy breast
ILYLfH	1	global	apod 15 possibly fata titanic april morgana mirage 2012 fascinating discover featured written image explanation day photograph astronomer cosmos universe professional april 15 2012 mirages years distant mirage cold phenomenon crew setting morgana wet real fata sightings coast onboard distortion shapes pavement californian observer consistent pacific icebergs sun conditions comparable
aGrvo1	1	global	metab ncbi int nutr chocolate exerc pubmed 2006 postexerci sport milk function web ncbi javascript site warning requires management citation external file generate software applied usa laboratory university bloomington 47405 dept kinesiology health human science performance indiana rating endurancetrained results cyclists milk tte isovolumic 4 bout greater workout bouts fluid
1iRMx8	7	global	national monument sumter fort search square departing elevators restrooms disabled boat information service sumter liberty access call board 8833123 notice visitors fort 843 ferry civil sumter artillery years surrendered 34 opened federal erupted decades war north forces fire back 1861 confederate union fort 12 harbor hours strife april growing charleston
ipgl7l	15	global	nida videos peerx choose path teens interactive learn clip confront video facts reallife decisions myths end situations make separate character scenarios lets call choose role main youll play drugs drug step abuse path teens include prescription assume choices common shots activity outcome decision interactive selection dont clip ending video path
xWDt4V	1	global	uscis study materials english test sentences tools speak application writing write materials correctly test reading speaking ability form eligibility interview started uscis prepare read n400 portion determined officer components english naturalization study additional section products select short naturalization process overview video test providing requirements citizenship process eligibility naturalization presentation practice
zbywIh	1	global	impact ncbi circulation chan pressure pubmed blood 2012 function web ncbi javascript site warning requires management citation external file generate software feinberg il usa chicago lake medicine division cardiology department dr northwestern school 60611 university shore 1102 preventive 680 ste heart estimates middle stroke examined lifetime cardiovascular impact index coronary
cExqjp	2	global	colorado technical environment services program health department public tsp metro area air rangedenver advisories front quality advisories time unhealthy vary quality monoxide worsen fine generally current health expected voluntary pollutants public particulate season measures carbon day categories trigger particulates conditions days air ozone matter unhealthyforsensitivegroups index recommendations action prevention pollution
ySQVYW	1	global	inmate 038977 dixon detective serving profiling committed years murder identify jury crime sexual identified 1986 wayne indicted death 20 opened technological sentence advancement sentenced raped state suspect dixon 7 tom assault case life arizona clarence tempe killer scene 21yearold apartment connected student 30 dna stabbed strangled deana bowdoin conviction 1978
Iw6sIh	1	global	latino means house community health law white state union video watch enhanced transparency commitment browse house white logs visitor wait executive actions president obama federal receipt tax federal dollars tax spent people petitions create sign house inside white tour interactive healthcaregov ed originally note blog posted hhs classrooms latinos workplaces
lOxLhl	1	global	training ncbi inten int 2011 pubmed environ myofeedback health arch occup function web ncbi javascript site warning requires management citation external file generate software box lottadellveammguse sahlgrenska academy university 30 sweden 414 environmental 405 medicine occupational gothenburg reduce rest chronic ability strength increase promoting factor theoretical tension pain risk framework
HIHZOr	1	global	med ncbi intern 2010 helping intentions pubmed arent gen function web ncbi javascript site warning requires management citation external file generate software ctealbcmedu houston usa center tx va medical michael debakey excellence hsrd perpetuate methods educators bias disparities impact physicianpatient health treatment alter awareness interactions student implicit raising care medical
A1wgQj	2	global	mercury toxicol ncbi pubmed environ concentrations chem evaluation 2010 function web ncbi javascript site warning requires management citation external file generate software school usa environmental parkway university shawngerstenbergerunlvedu community 4505 sciences vegas health 89154 department occupational nevada maryland las 0137 results dose held human nevada children 0541 25kg temporal 3
akrl8L	1	global	ghost apod ancient 19 milky 2010 panel fascinating discover featured written image explanation day photograph astronomer cosmos universe professional 19 2010 years oldest galaxy informal stonehenge attribution lifesized entire utah walls background hunted canyonlands designation night found national pictographs humans back dead sea written led scrolls sections importance objects panel
GQDTW7	4	global	caring childs mental health childs mental mission sites overarching childrens caring system effort support samhsas increase approach health comprehensive public awareness marketing social samhsafunded purpose services strategic care 1994 created communications team strategies works stimulate information wwwawarenesseventorg visit event national day awareness rsvp dont washington wwwsamhsagovchildren edt 730 live 9
Iyms8P	2	global	eating ncbi interactions social pubmed health low 2012 disorder psychol function web ncbi javascript site warning requires management citation external file generate software kings college uk london p005 symptomatology ed related group sample examine questions factor questionnaire total children reduced solitary tv friends controls behaviours p0001 emerged continued objective homework
IXnycM	1	global	strategies share dieters success medlineplus page related medlineplus methods weight tuesday americans healthday news traditional obese shortterm successful 10 study april lose weight led pills percent exercising 1500 program 5 dieters body obese eating successful commercial fat diet strategies 10 prescription taking evaluated weightloss lose found researchers joining deaconess boston
yGc0Ka	1	global	affordable updated provisions estimates cbo coverage act insurance care contact cbo 13 march 2012 committee budgetary estimates cbo 111152 projections comprises patient education insurance staff jct reconciliation baseline legislation health public pl 2012 affordable updated march provisions taxation joint protection effects coverage law care aca 111148 budget 2010 act preparing
HEfL6k	2	global	ncbi med hypotheses pubmed 2005 active fascial fascia contractility function web ncbi javascript site warning requires management citation external file generate software applied 11 89069 university schleipsomaticsde germany ulm department alberteinsteinallee physiology evidence transmitting human existence fascial interesting passive musculoskeletal acupuncture decreased lumbar forces contractures posture capacity manual activity release
xQ1yQ8	1	global	regional ncbi cancer tribal differences pubmed educ america 2012 function web ncbi javascript site warning requires management citation external file generate software 2121 center usa area 300 tribal sw drive epidemiology 97201 indian health northwest suite broadway portland mhoopesnpaihborg board clinic planning misclassified availability classification late program factor mortality washington
10AQ7M	7	global	leave benefits labor topic fmla department find documentreadyfunction whelpfulinitfbcontent states department united labor family maintained year group health weeks fmla 12 benefits medical leave unpaid jobprotected act requires employees family reasons accommodate employment responsibilities fmla seeks interests men employers designed promote opportunity legitimate women employees work equal leave unpaid reasonable
p4mjAX	2	global	memorial center car national compliance expansion jefferson 2015 document search return preservation environmental historic car2015 information center car compliance 2015 document correspondence section 106 nhpa nepa documents reference design competition design activities community comment public opportunities minutes meeting gathering century national nineteeth helped click memorial courthouse west fuel life learn
dAy3Y1	1	global	center tornado watch prediction storm 167 status report 167 watch messages information network service national warnings visit iwin weather interactive 60 mod 50 mod 30 mod 30 mod high 70 60 mod high 90 f2f5 probability forecaster 70 60 table event increased category tornadoes probabilities issuing 5 low moderate events
H8YIaa	1	global	heart video medlineplus health heartbroken news javascript adobe flash enabled content player version 8 requires flash pages related medlineplus heartache loved death lead heart danger feel describe involve times death grief words brokenhearted heavyhearted study finds heartsick people sibling 21 hospital remained attack whod passing recently risk parent month reported
w38DOk	1	global	bmc poop ncbi med pubmed owns genomics 2011 insights function web ncbi javascript site warning requires management citation external file generate software canada psychology university 2w1 n1g department guelph ethical human scale legal research sharing compounded microbiome complicated data biobanking implications large social focus human issues relationships rapid add versus
HIkcKn	1	global	frb financial 14 information mobile releasefederal survey press 2012 servicesmarch reserve release date march 14 2012 financial point 25 mb additional consumers federal html access board bank 2012 phone ending card account 12 banking mobile months credit american future survey january pdf reserve security findings year technology consumers suggest usage
HXIrV8	1	global	development plant ncbi rna pubmed hostinduced mol microbe 2011 interact function web ncbi javascript site warning requires management citation external file generate software plant usa wa university washington state department pathology 991646430 pullman fungal resistance puccinia diseases rna preferred results tritici altering approach advent detected reduced rusts delivered shown detect
dddsFE	4	global	center tornado watch prediction 169 storm status report messages watch 169 information network service national warnings visit iwin weather interactive 40 mod 30 mod 30 mod 30 mod 40 mod 30 mod high 70 f2f5 probability forecaster 70 60 table event increased category tornadoes probabilities issuing 5 low moderate events
IDUwEa	3	global	web biology semantic ncbi meets integrative su pubmed bioinform 2012 function web ncbi javascript site warning requires management citation external file generate software unified semantic insight integrative sources identify solutions interoperable web knowledge capabilities systems rich global disparate posed cellular jargons benefit biological set significantly interconnects series biology related provided
IL2qYT	228	global	report science nsfgov special nation poster iconic antarctica topped children frozen charts long continent penguins call animal caused colony havoc sea species doom entire wreak ice swath penguinsand spell change melting climate study large emperor shrinks century 3000 sea pairs decline end show projected ice 400 breeding jenouvrier decreasewe models
zmRAvj	1	global	dna methods ncbi mol constructs functional biol pubmed design silico 2012 function web ncbi javascript site warning requires management citation external file generate software dna20 usa ca park menlo synthetic rapid combination functional assemblies capability essential characterized constraints schemes sequence creation elements design proper increase scientists method relationships biology assembly
I5VVAF	1	global	updated sci ncbi int mechanisms pubmed mol curcumin molecular 2012 function web ncbi javascript site warning requires management citation external file generate software tumor center 710032 university hospital xian biomarker email detection medicine mingxiangyeyahoocn china fourth xijing department military pulmonary medical emerging show focus yellow human previous latent molecules factor
eNUBp7	2	global	fda boxed warnings drugs antimicrobial fluoroquinolone requests release 8 july 2008 3018276242consumer media christopher kelly 888infofda inquiries agency authority warning medication risk increased amendments provide administration drugs antimicrobial side product boxed manufacturers food effects fluoroquinolone tendinitis rupture fda tendon notified drug guide patients determined 2007 act fdaaa labeling medication strengthen
J2aBSy	3	global	storm tornado watch prediction 179 center status report watch messages 179 information network service national warnings visit iwin weather interactive 40 mod 20 low 30 mod 30 mod 40 mod 30 mod high 70 f2f5 probability forecaster 70 60 table event increased category tornadoes probabilities issuing 5 low moderate events
