2UCCtN	1	global	fdsys browse uscode code codification house general states edition titles 1926 years subject information united office broad divided representatives current subjects subsequent main revision permanent cumulative 1934 law present counsel annual 51 editions matter supplements published order laws code office house information gpo verify representatives virtual research contained version editions
yLHfyR	1	global	metab testosterone ncbi endocrinol free pubmed low predicts clin morta 2012 function web ncbi javascript site warning requires management citation external file generate software australia centre ageing university zoesexologyresearchorg stirling 35 6009 health western crawley australian highway testosterone relationship mortality low causespecific uncertain allcause associations testosterone hormones related explore mortality
rbP8LE	1	global	comparison relapsing full multiple study rebif sclerosis clinicaltrialsgov interferon patients text beta1a ocrelizumab view interferon 600 iv randomized 88 doubledummy intravenously weekly 24 group rebif safety treatment 5 weeks 96 beta1a doubleblind week relapsing multiple efficacy mcg evaluate time anticipated subcutaneously 1222 parallelgroup comparison mg study sclerosis times receive patients
4hVO1M	1	global	website serving district 5th georgia lewis congressman john congressional search 14 hr bill number search word healthcare phrase homeowner american stand time corner walk people daily reality parents life families america paying georgia sacrificing taxes time country justice injustice threat receive sign updates email office lewis message click issues legislative
eVdYT	3	global	forms publications irs resources methods links tax electronic forms provide media irs capabilities access source basic print function acquire additionally advanced search irsgov official materials publications published links schedules tax individual download return taxpayers irs forms income mail order recently business advised packages needed filing instructions longer receive paper page
HsAwRr	2	global	teenage ncbi contextualized understa pubmed publica pregnancy saude 2012 cad function web ncbi javascript site warning requires management citation external file generate software london university college uk lack results argues paper knowledge womanhood young opportunities passage environment cultural formal adulthood mothers qualitative motherhood planning activity identifies fertility solutions methods collectively
15t0PG	1	global	small information businesses corporation finance home whats contact rules statutes forms disclosure interpretations compliance disclosure guidance cf topics accounting reporting financial division reporting financial manual letters interpretive exemptive noaction roundtables division speeches statements info issuer foreign info small businesses frequently materials requested archives edgar smaller financial investors investorgov obligations contracting
Z2cfx	1	global	vehicle apollo lunar roving 45 charles mission astronauts scott harrison rover 26 lm young roving 4 activities 3 267 longest lrv 2 day traverses schmitt 50 traversed traverse 116 reached 278 driving vacuum moon lowgravity lunar extend hours david range gene designed duke jim traversing total capable extravehicular vehicle john
HxunlN	2	global	recovery national library framework fema disaster unified managers disaster restore community states economic manner recovery support jurisdictions territorial health build resilient flexible local national focuses collaborative redevelop disasterimpacted nation framework structure fabric operate natural effective environmental social tribes enables guide revitalize download plugin links plugin require plugins page view pdf
IszvNJ	9	global	sidewinder house performs white state union video watch enhanced transparency commitment browse house white logs visitor wait executive actions president obama federal receipt tax federal dollars tax spent people petitions create sign house inside white tour interactive sidewinder house national biden guard dr anniversary forces white missouri oneyear band jill
HDNd00	1	global	genomescale methods ncbi promoter engineering pubmed nat coselection 2012 function web ncbi javascript site warning requires management citation external file generate software wyss usa university 3 institute boston inspired school biology 1 medical engineering harvard massachusetts department 2 biologically systems selection simultaneously describe epistatic highly gainoffunction engineering modified substantially multiple
9bZGCQ	4	global	total employment 1962 government electronic publications thousands numbers notes executive covers defense 113 total employment service monthly beginning agency permanent branch department submissions endofyear temporary civilian includes disadvantaged postal data uniformed parttime intermittent employees programs 1970 youth fulltime personnel military workertrainee excludes program acceleration 1964 employees 1963 project 406 7411
IyzxTf	24	global	apod 12 yuris planet april 2012 fascinating discover featured written image explanation day photograph astronomer cosmos universe professional april 12 2012 human earth compact sky include march aurora dark celebrate 12th miles night view glare pleiades space recorded stunning lights orbiting international reported 240 alexseyevich panel commenting stations april horizon
H9hY8F	1	global	death nat ncbi rev drug cell pubmed discov assays 2011 discovery function web ncbi javascript site warning requires management citation external file generate software inserm france villejuif f94805 u848 increasingly focus human death based disorders screening diseases amenable discuss systematically identified successfully hts dysregulated techniques quantify cell cytoprotective recently promising
H28Cj6	13	global	2012 ncbi physiological food pubmed biochemical chem metabolism agric function web ncbi javascript site warning requires management citation external file generate software jiangsu china food university peoples nanjing college science agricultural republic technology 210095 338 weight sprout root 36 germinating hplc stayed sprouts 72 contents 24 25 rapid sulforaphane varied
b2UtUJ	3	global	picture astronomy day fascinating discover featured written image explanation day photograph astronomer cosmos universe professional 9 2012 flies whats apple photo perched city yorkers jet icons west museum visit libertys big explanation famous background july unique lady photograph 19 onceinalifetime atop air side looms 747 universal high sea home empire
HEgJxB	2	global	med achalasia ncbi medicine clinical images engl pubmed 2012 function web ncbi javascript site warning requires management citation external file generate software barnsley foundation united district hospital nhs kingdom trust activity browsing empty recording activity turned recording turn back information usa 20894 center pike rockville national md library bethesda medicine
blUvBo	2	global	house bo white state union video watch enhanced transparency commitment browse house white logs visitor wait executive actions president obama federal receipt tax federal dollars tax spent people petitions create sign house inside white tour interactive family pictures bo dog obama march garden family house rose bo dog 2010 3
yzqB4D	1	global	city bellevue emergency web official site high weekend response exercise release news bellevue emergency high weekend response exercise high multiple event police casualties test exercise bellevue responses emergency fire school incident part designed weekend largescale training region departments communications involving 10416 people high bellevue saturday fire residents takes area wolverine
Hn6KR0	1	global	colleague funding opportunities dataintensive nsf research educationrelated letter dear nsf12060 12060 nsf colleague funding dataintensive opportunities research educationrelated letter dear date march 29 2012 todays vary expects valuable existing leads human innovative cyberlearning availability emerging rapid knowledge thinking multidisciplinary guaranteed capabilities personalized intensive foster technological teaching include resources advances community
jeHoGi	3	global	school trooper recruit graduates 122nd msp rigorous badges ceremony police trooper state 122nd thirtyfive troopers curriculum formally recruits michigan friday 13 training received school recruit graduation 20week citizens pin recognize accept high embrace uniform integrity service trooper msp kriste granted badge symbol recruits represents importance serve etue director courtesy col
ecYiWP	2	global	crossingentry north bts data american border bridge mexican bts buses number states pedestrians entering uscanadian border port statistics outbound usmexican personal crossings seeking state bureau collected containers comparable transportation users passengers operators canadian customs reflect protection review data governments crossingentry incoming trucks level vehicles united summary collect individual trains crossing
IE6DRN	41	global	giant gt suntour sr trek hazard due bicycles recalled fall suspension forks named washington instructed voluntary consumers illegal commission safety cooperation announced firm product stop dc recalled resell attempt immediately products today recall consumer giant gt suntour product bicycles sr suspension forks trek units 17000 suntour sr wash vancouver taiwan
I1uAwt	2	global	regula network ncbi integrative analysis pubmed gene 2012 function web ncbi javascript site warning requires management citation external file generate software developmental shriver usa bethesda development genomics institute national eunice 20892 md clinical health human child laboratory kennedy leetlmailnihgov institutes gwas genomewide chrna including dopamine networks highlighted group disorders candidates
Io5Y5G	4	global	uscis study materials english test sentences tools speak application writing write materials correctly test reading speaking ability form eligibility interview started uscis prepare read n400 portion determined officer components english naturalization study additional section products select short naturalization process overview video test providing requirements citizenship process eligibility naturalization presentation practice
IutYGu	2	global	followup med ncbi lost intern pubmed health goals arch public 2012 function web ncbi javascript site warning requires management citation external file generate software ste ma 594 centre hospital 02130 st boston medicine 7 brigham department womens dachokshipartnersorg held networks group 3 program adequate admirable 3have propose fragmented receiving approach
I4gZEF	1	global	engaging management emergency blog communities latino fema comment accordance comments blog moderated policy femas links nongovernment social applications web fema provided reference media companies sites endorse msgdata washington street apply management prepare federal rates homeland department 4fema emergency dc 43362 20472202 sw agencyus security500 6462500text tty assistance step 46275853 800
bGiVgQ	7	global	dale vice house announces disability biden joe assistant policy president white special kareem state union video watch enhanced transparency commitment browse house white logs visitor wait executive actions president obama federal receipt tax federal dollars tax spent people petitions create sign house inside white tour interactive week service country national
IzyalZ	1	global	sidewinder house performs white state union video watch enhanced transparency commitment browse house white logs visitor wait executive actions president obama federal receipt tax federal dollars tax spent people petitions create sign house inside white tour interactive sidewinder house national biden guard dr anniversary forces white missouri oneyear band jill
IuRHpV	1	global	kids option study leukemia medlineplus toughtotreat shows pages related medlineplus respond dont healthday lymphoblastic children transplant additional initial intense chemotherapy induction option leukemia therapy news marrow 11 acute regimen study wednesday april called bone acute cancer leukemia blood lymphoblastic marrow bone childrens happen children chinghon risk percent coauthor 3 2
py4UwZ	1	global	report science nsfgov special nation dragonfly good watch time catch meal luck perch nsf speed hunting caught prey chewing include feats dragonfly successful pull science university team stacey set aerial national biomechanist back high film studying foundation midair lab harvard complicated combes country dragonflies mating support typical habitat concord find
wZq3BQ	1	global	house mo keb backstage white state union video watch enhanced transparency commitment browse house white logs visitor wait executive actions president obama federal receipt tax federal dollars tax spent people petitions create sign house inside white tour interactive beautiful guitarist grammy inaguration blues matt hes west winner santos threetime final
HxvPXO	4	global	gynecol comparison ncbi afroa shapes 2000 invest vaginal pubmed obstet function web ncbi javascript site warning requires management citation external file generate software group usa nc research durham health womens anterior positions introitus significantly polysiloxane afroamerican shape seed longer subject standing shorter 23 measurements 40 cast 1 width vagina introital
qvXnXj	10	global	entrez genome view viewer map resources ncbi data genbank organism sequencing projects resources related databases cytogenetic features reference sequence viewer hybrid maintained displays human ests contig tiling physical contigs stss ncbi alternate radiation maps genetic grc predicted include fish genome map graphical assembly models genes component gnomon clones path bac
H9Bhmj	2	global	korea seoul house nuclear white summit attends president republic security obama state union video watch enhanced transparency commitment browse house white logs visitor wait executive actions president obama federal receipt tax federal dollars tax spent people petitions create sign house inside white tour interactive korea security attend travels seoul threeday
xw2o0l	1	global	tip canker medlineplus sore health calm page related medlineplus drinking eating form sores inside ulcers canker mouth news make painful healthday dental sore canker suggests american heal association mobile twitter subscribe version updates follow email rss national guidelines accessibility library human march institutes quality copyright privacy health bethesda department 8600
HFNEHb	2	global	photographs search weld congress prints library results catalog online weld 14 results digitized 14 congress image larger library 151 house newton street 1925 file pp larz 1 anderson benjamin garden digital 13 frances brookline massachusetts lcdigppmsca16455 1915 photograph weld item johnston 18641952lcj717x103 original plan 151 house ca newton street file
I8PidM	1	global	loss res ncbi cancer pten metastasis brain pubmed breast relevance 2012 function web ncbi javascript site warning requires management citation external file generate software biology 20246 center institute medical hwikmanukeunihamburgde hamburgeppendorf tumor martinistreet germany hamburg 52 university abstract expectancy major cancer brain identify markers improvement treatment development life breast limitation
IITrq3	74	global	investigative reports ingov skip navigation ingov displayed disabled message note 1 2 css information read policies standardscompliant browser thornton tomasetti mb executive 8mb summary slides report 3 pdf mbfull 510 presentation reportfull file patience full download specific 123 224 f20 zip thornton tomasetti size sections files downloading complete problems appendix
jHJ6x	90	global	chronology 13 apollo axes 555452703 decreasing percent 555501 engine 7819 555430 555431 voltage nitrogen 15 555457 555453542 24 cell disturbance rapidly wed undervoltage 555231 supply 28 3 decreases telemetered 4 555452763 fuel 8 main 285 indicating 11 weve 7 rise dc jack tanks amp 9957 loss 555306 555307 oxygen 555453500
E6vSS	1	global	proclamationnational hunting house white fishing day presidential state union video watch enhanced transparency commitment browse house white logs visitor wait executive actions president obama federal receipt tax federal dollars tax spent people petitions create sign house inside white tour interactive week service country national thanking appreciation americans teacher teachers carney
H9Snfz	1	global	legislature michigan section 780905 5 sec status sentence violation misdemeanor unconditional trainee offense court deferred ordinance judgment dismissal 1 assignment assessment defendant resolved pay felony delayed conviction order person guilt acquittal entry youthful charged felony 13000 offense ordinance misdemeanor violation 7500 offense xi pa code 1927 probation 175 232 7711
IrlkS	1	global	united states birth navy manned stores ten cruise munitions send navy armed 1775 fit army legislation philadelphia vessels continental voted crews grew meeting guns swivel constitutes congress friday eighty intercept birth america 13 october certificate sailing months british carriage carrying transports original authority strategic vessels sea armed decision political send
zxVtap	1	global	apod 19 february earth message 2012 fascinating discover featured written image explanation day photograph astronomer cosmos universe professional 19 february 2012 years radio human earthlings facts earth 50000 knowledge interesting signals broadcasts molecules humanity regularly string dna arecibo basics accidentally including ceremonial telescope ten intelligence computer space extraterrestrial atoms dedication
oEpjvg	1	global	cardiol ncbi 2011 magnetic nucl pubmed cardiac resonance approach cmr function web ncbi javascript site warning requires management citation external file generate software heart human usa bethesda institute national md services health blood branch araianihgov department lung pulmonary institutes 208921061 cardiovascular developed magnetic preclinical obstruction gadolinium human intracardiac integrity adverse
fdgoBb	4	global	productivity flexibility practices promising department education states flexibility education leaders highlighting spending productively pressures state department unprecedented today funds released address dollars budget federal practices promising spend national education impact duncan spending negative call redirect guiding offer students wrong cut press opportunity seize priorities minimize important principle arne secretary resources
GzC5NQ	1	global	attorney office justice alerts general dept california news content skip refund outlining stores office agreed random allegations bonnie years 164 mistakes advertised restitution settlement weekly 50000 superior copy group million state mens dumanis madera program edmund employee holiday brown customers march designated october cd february january overcharged found accuracy woven
aBOmIu	6	global	partners benefits federal employees domestic memorandumextension house samesex white presidential state union video watch enhanced transparency commitment browse house white logs visitor wait executive actions president obama federal receipt tax federal dollars tax spent people petitions create sign house inside white tour interactive house white office press secretary memorandum heads
bREk8i	16	global	government house executive contracting white order economy state union video watch enhanced transparency commitment browse house white logs visitor wait executive actions president obama federal receipt tax federal dollars tax spent people petitions create sign house inside white tour interactive week service country national thanking appreciation americans teacher teachers carney
XjQ9N	1	global	cuban sheet reaching house people white fact state union video watch enhanced transparency commitment browse house white logs visitor wait executive actions president obama federal receipt tax federal dollars tax spent people petitions create sign house inside white tour interactive week service country national thanking appreciation americans teacher teachers carney
GN9S8C	1	global	lacrosse helmets due hazard sports recalled facial injury easton named washington instructed voluntary consumers illegal commission safety cooperation announced firm product stop dc recalled resell attempt immediately products today recall consumer lacrosse helmets product easton raptor units 12000 scotts sports importer valley calif easton injury bar facial jaw hazard break
bCLt1i	1	global	150 center watch thunderstorm prediction severe storm status 150 report watch messages information network service national warnings visit iwin weather interactive 20 low 5 low 50 mod 30 mod high 90 50 mod high 95 f2f5 probability forecaster 70 60 table event increased category tornadoes probabilities issuing 5 low moderate
pFuB71	1	global	metab inflammatory lond ncbi eggs 2008 nutr response pubmed modulate function web ncbi javascript site warning requires management citation external file generate software usa storrs university nutritional sciences connecticut department marialuzfernandezuconnedu ct inflammatory previously sensitivity dyslipidemia intake hdlc carbohydrate dietary higher marker follow markers triglycerides provided shown compared diets restricted
9ErWj1	3	global	science friday 13th nasa 2029 hit mn4 close earth 13 scarily april asteroid 2004 2029 story streaming downloadable file audio listen 13th shoe trip unlucky laces sort friday news day 13 lose wallet bad supposed 2005 people 13thfriday millions point sky brighter stars good 13th2029 gliding satellites faster light april
HFbYoA	2	global	legislature 4451592 michigan section 2 sec act owed set loan carveout surety documents personal occur lender events creating provisions means effect liability borrower nonrecourse exception guarantor specific amounts loan documents mortgage secured located state evidenced real means commercial nonrecourse meet property money sought proceeding provide lender liability borrower obligation judgment
i17Mbs	3	global	myths dispelling claim greenpeace groups dissent cited domestic actions taylor fundraising wiretapping harassment subject 11 treated government political surveillance aclu peaceful policy letter terrorism include national 4 august myth journal stuart february includes provision organizations patriot criminal unpatriotic advocacy 2003 act action claims expands laws limited breaking dissent domestic engaging
HteNaM	1	global	termites plos rules challenge ncbi pubmed subterranean 2012 function web ncbi javascript site warning requires management citation external file generate software united university entomology florida states lauderdale nematology department america fort fungal resistance years pathogens attempts disperse evolved previous death group implementation superorganism mortality epizootics means anisopliae subterranean densities 50
xl8O0c	54	global	grant grantsgov opportunities synopsis opportunity find precedence service disk electronic click information grant provide notification send inconsistency document email resolved notifications printed address opportunity emails change receive thing giving original requestedany modification description represent newest file oldest previous shown documents current document sections files background representing modifications arranged changed list
frfxzk	1	global	plants buildings star energy manufacturing star energy join plants buildings star energy home manufacturing certified sector industrial certification facilities accounts greenhouse expensive certified consumption facility strict change building gas peers half plants earn fewer standards emissions set meets energy contribute plant cost year responsible performance economy 200 buildings star commercial
HWXWzc	1	global	accessible ncbi impera shelf chest library book pubmed 2012 function web ncbi javascript site warning requires management citation external file generate software boston general learning laboratory usa hospital medicine 3b division emergency mgh department massachusetts jgordon3partnersorg ste ma medical 02114 simulation emerson place operations certification increasingly mission evaluationall 18112011 environment
HiWEMz	1	global	nsf12549 computational science cdseeng engineering dataenabled cdse foundation directorate office division civil science national mechanical innovation chemical environmental engineering systems bioengineering manufacturing transport cyberinfrastructure dates proposers submission due window 5 time local pm 03 july june 2012 important reminders issued revised nsf 111 submit apply proposers funding pappg due 18
IEI0VW	4	global	uscis study materials english test sentences tools speak application writing write materials correctly test reading speaking ability form eligibility interview started uscis prepare read n400 portion determined officer components english naturalization study additional section products select short naturalization process overview video test providing requirements citizenship process eligibility naturalization presentation practice
HREB40	1	global	bull cognitive ncbi schizophr differences proces pubmed emotional 2012 function web ncbi javascript site warning requires management citation external file generate software building college psychology institute de park po77 london wellcome 1department uk henry psychiatry kings crespigny 8af se5 hypothesized differences contributions reasoning group conclusions present associations cognitive increased propose
