HDHE19	4	global	incontinence lower risk tied medlineplus csections pages related medlineplus grens kerry incontinence develop section cesarean reuters health babies decades vaginally delivered moms york birth women study sweden findings urogynecology wasnt participate incontinence swift research surprised carolina director dr university steven charleston medical south reuters passes witnessed stretch damage potential health
H2RV33	1	global	sinking room division government titanic library current publications periodical newspaper reading congress serial false people sense rushed lively unsinkable parties 1300 ship disasters lulled beds began boats fatal panic filled sinking blow life return read freezing maritime hours worst early 1912 passengers drowning iceberg titanic deals april 2000 continue 15th
ujeXSh	1	global	parasitol ncbi mucosa pubmed penetration parasitelike oral 2012 function web ncbi javascript site warning requires management citation external file generate software kwandong biology korea medical medicine gangneungsi environmental college gangwondo department university south parboiled gingiva twelve squid mucosa affected experienced stings morphology eating mucous organs pacificus 63yrold foreignbody cavity white
gEPafv	9	global	center tornado pds watch prediction storm 165 status 165 report watch messages information network service national warnings visit iwin weather interactive high 80 high 70 high 90 high 80 high 95 high 80 high 95 f2f5 probability forecaster 70 60 table event increased category tornadoes probabilities issuing 5 low moderate
znDthG	2	global	map plant hardiness usda zone prompt complete captcha continue 5 queries query reload web enable javascript site experience internet browser code clip text captcha simply click provided zip field response button challengeresponse test image sound generated validate search person continue ensure enter audio yorknorth carolinanorth virginiawisconsinwyoming static mexiconew click select
HDTp3l	5	global	financial proclamation national month capability house white presidential 2012 state union video watch enhanced transparency commitment browse house white logs visitor wait executive actions president obama federal receipt tax federal dollars tax spent people petitions create sign house inside white tour interactive house white office press secretary states united financial
IdrR0	2	global	congress joint white session health house remarks president care state union video watch enhanced transparency commitment browse house white logs visitor wait executive actions president obama federal receipt tax federal dollars tax spent people petitions create sign house inside white tour interactive week service country national thanking appreciation americans teacher
12arIU	4	global	complaint center crime file internet ic3 questions inquiries information additional conditions complaint terms read faq ic3 prior filing view ive code false imprisonment fine subject information knowledge title make correct form understand provided 18 section providing 1001 andor enforcement cosponsored regulatory discretion file fbi information opened federal nw3c crime state
ItpOO8	3	global	interagency 2012 homelessness labor april attends council photo department 5 solis meeting gallery secretary states department united labor nonflash ffffff version show httpwwwadobecomgogetflashplayer type allowscriptaccesssamedomain high globals pluginp dolmediaphotosslideshows20120405usich id pthis quality check requiredminorversion pluginspage httpfpdownloadmacromediacomgetflashplayercurrentswflashcab based width top flash 540 swf content detected playback attends var entered detectflashverrequiredmajorversion acflruncontent
la6iqN	1	global	alveolar cediranib full study clinicaltrialsgov azd2171 ii patients part text phase sarcoma soft view background objectives alveolar azd2171 patients part sarcoma works soft find eligibility alveolar older 18 age years individuals diagnosed sarcoma part soft design alveolar histologically national part sarcoma laboratory institutes pathology confirmed patients health soft diameter scan
9arQHN	1	global	programmable energy star thermostats star energy products thermostats home programmable find partners partner energy thermostats year spends 2200 180 cooling setting programmable save household properly half maintaining settings average homeowners heating bills preprogrammed summer thermostat asleep home regulate temperature make helps easy programmable save offering homes winter settings thermostat money
csAO9K	5	global	center tornado pds watch prediction storm 170 status report watch messages 170 information network service national warnings visit iwin weather interactive high 80 60 mod 50 mod 60 mod high 80 60 mod high 90 f2f5 probability forecaster 70 60 table event increased category tornadoes probabilities issuing 5 low moderate
Is0QQ1	1	global	uscis study materials english test sentences tools speak application writing write materials correctly test reading speaking ability form eligibility interview started uscis prepare read n400 portion determined officer components english naturalization study additional section products select short naturalization process overview video test providing requirements citizenship process eligibility naturalization presentation practice
rVLIrJ	1	global	versus ranibizumab macular edema bevacizumab clinicaltrialsgov full text treatment occlusion vein view prospective endothelial antagonists edema rvo primary month fdaapproved growth agents thickness properties ranibizumab baseline ophthalmologists bevacizumab conduct macular comparing treatment widely factor vegf pathway onetenth vascular retinal lesions change visual angiographic interventional eye vein secondary treating effectiveness central
IrgYRM	15	global	repair suffocation hazards sold nan due exclusively entrapment woodworking cribs fall recalls dropside jcpenney named washington instructed voluntary consumers illegal commission safety cooperation announced firm product stop dc recalled resell attempt immediately products today recall consumer product cribs rockland dropside furniture units 16700 nan woodworking taiwan manufacturer penney purchasing importer
aHp0Cn	2	global	united house nuclear memorandum white enhancement cooperation act approval statesindia nonproliferation presidential state union video watch enhanced transparency commitment browse house white logs visitor wait executive actions president obama federal receipt tax federal dollars tax spent people petitions create sign house inside white tour interactive house white office press secretary
eGRUS	3	global	technical error website hyperlink nongovernmental direct application hhs consistent hyperlinks states services human subject information hyperlinked united application contained health endorsement department website intended provided visitors external constitute applications privacy appearance practices products policies purpose link redirected connect experienced unavailable technical issue page healthfindernhicorg comments email information usaccessibility privacy mapcontact
IGXvHx	1	global	quarterly services annual data summary sector clients office remediation variety inhouse operations comprises industries management solicitation provide personnel support placing administration establishments surveillance households daytoday routine waste administrative economy activities security collection clerical cleaning services cases organizations include sectors hiring document performing preparation disposal undertaken specialize similar essential performed sector
I43DgM	1	global	nonmotor detection faci ncbi nerve early brain symptoms pubmed 2012 function web ncbi javascript site warning requires management citation external file generate software sagamihara kanagawa national neurology japan department organization hospital developed accurate sleep signs japan disorders braaks symptoms radiological decreased risk early increases therapy cognitive motorsymptoms identified common including
HAFo6R	3	global	congress color jackie library american baseball memory robinson line manuscript vol national washington library produced publishing 1 sunday program papers division congress lawrence company dc spivak 1957 15 14 april broadcasting published read site spivak catalog collection information additional summary leave record papers guest lawrence jackie spivak produced april sunday
HD2FsT	1	global	living ncbi hiv transmission persons pubmed rates aids 2012 function web ncbi javascript site warning requires management citation external file generate software control national johns society centers viral hepatitis health maryland tb public usa hivaids bloomberg bdepartment atlanta center std school georgia adivision hopkins disease baltimore behavior prevention reduce rate
HzxJoz	17	global	usdoj attorneys office district southern alabama sentenced claim attorney false resident dubose states jury kenyen indicted united court district federal grand zandra mail entered today 2012 brown march bp plea judge july alabama fraud patrice mobile guilty connection announced english claim attorney false guidelines states sentencing admitted substantially griffin united
HotUYe	14	global	resources stopbullyinggov addressing set inclusion problem related topic included imply entering facts find verified stopbullyinggov federal promotion nonfederal program inventory articles tips guarantee resources criteria listed endorsement search includes bullying nominated helpful evidencebased training resource toolkits keyword directories materials directory meet accuracy add inventory nominations resources find resources website managed
HGMawQ	2	global	nursing ncbi pubmed bullying clinical educa nurs educ undergraduate 2012 function web ncbi javascript site warning requires management citation external file generate software limited developed results years facilities existence staff program 4 include 674 frequencies practice implications settings educators undertake witness secondyear state health issue notably focused address care thirdyear
HDNJeY	1	global	breastfeeding paradox ncbi preterm apparent bmj pubmed open 2012 function web ncbi javascript site warning requires management citation external file generate software university france neonatal medicine chu department nantes suckle exposed milk risk increased end preterm deficit difficult breastfed nutritional consequence breast discharge outcome hospitalisation infants supplementation neurodevelopmental discontinued weight
arPVCY	6	global	center tornado pds watch prediction storm 170 status report watch messages 170 information network service national warnings visit iwin weather interactive high 80 60 mod 50 mod 60 mod high 80 60 mod high 90 f2f5 probability forecaster 70 60 table event increased category tornadoes probabilities issuing 5 low moderate
HKnXRR	2	global	communitybased geriatr ncbi gerontol pubmed 2012 educ approach integra function web ncbi javascript site warning requires management citation external file generate software usa humanities miami university medicine florida herbert international society health wertheim department college adults geriatric describe results minimum covered diversity education undergraduate adequately graduating educational requirements accreditation initial
IgXqeA	1	global	index climate extremes developed lack obtain years including questions decisions policy cei framework 50 people contiguous past index ways public scientific understanding climatologists climate changed extremes thereof parties confidence basis system interest tool understand present observed intuitive aid general states information interested unites answer struggling comprehensive important ipcc inform 2001
fabQ9F	1	global	house white april photo 2011 day state union video watch enhanced transparency commitment browse house white logs visitor wait executive actions president obama federal receipt tax federal dollars tax spent people petitions create sign house inside white tour interactive house check april offices photo picks 2011 white day president people
HWvUCE	8	global	due hazard bicycles bikes fall recalls public named washington instructed voluntary consumers illegal commission safety cooperation announced firm product stop dc recalled resell attempt immediately products today recall consumer product bicycles year model 2010 2012 units 4100 francisco san importer bikes public pedals taiwan wellgo corp manufacturer pedals fall hazard
rf1NbF	1	global	houston science nasa story streaming downloadable file audio listen september 2002 mom 9 family back seat heard home rarely travel trip start good parent thousand begins hundred 15 cry thing miles car minutes years traveling earth mars approach red closest couple million backat months 35 planet miles houston james inside
mw9CZe	1	global	emergency island rhode health registry department special appropriately community chronic identify plan enrollment special guarantee management develop rhode assistance agency system health department conditions emergency healthcare riema emergencies registry islanders responders prepare disabilities joined individuals respond island require designed people chronic individual examples special additional assistance disability emergency healthcare condition
XXAoz	1	global	living lifestyle information health human services guide connect website hyperlink nongovernmental direct application hhs consistent hyperlinks states services human subject information hyperlinked united application contained health endorsement department website intended provided visitors external constitute applications privacy appearance practices products policies purpose link redirected advice find health care today widget information
HDtIiH	1	global	patient ncbi ulcers opin pressure pubmed pediatric pediatr curr 2012 function web ncbi javascript site warning requires management citation external file generate software school childrens usa louis university washington st saint medicine hospital missouri limited phenomenon prevalence skin ulcers integrity children slow develop hospitals interventions current identification widely issue supported
HQXTWz	2	global	ncbi spring estimates payerspecific state pubmed obesity silver 2012 function web ncbi javascript site warning requires management citation external file generate software triangle usa park economics rti research jtrogdonrtiorg program health north international public carolina sector predicts statelevel 22 absence factor include manage risk virginia payer level 55 separately obesity
8faZ4	3	global	resident aliens citizens abroad small businessselfemployed taxpayers international topics irs resources reside estate resident tax alien estimated united generally returns income subject worldwide paying rules citizen abroad states gift filing duty file resident allowed year alien 2month calendar pay due citizen residing return june regular date overseas 15 extension requesting
Iuf7KP	1	global	shoulder strength ncbi res attributed resistan pubmed cond 2010 injuries function web ncbi javascript site warning requires management citation external file generate software usa university florida nova therapy lauderdale department fort kolbernovaedu southeastern physical alluded agreed resistance competitive combinations identify bodybuilding injuries discern disorders recreational regularly risk acute results joint
bThU29	1	global	hearing hearings senate pensions labor health committee education senate pensions labor health committee education 200 february monday 23 2009 pm sd430 wabernard hagan bingaman al murray harkin nmpatty whitehouse ct merkley sheldon franken bennet pa tom ri sanders mdjeff ncjeff jr casey kay mikulski richard mn michael iabarbara vtrobert blumenthal
155LDh	1	global	edwards tornado faq roger online spc nssl photo courtesy background 2012 mar modified 23 quickreference partial questions copyrighted find knowledge storms deepest local resources good compiled material kind faq desire school resource university list summary found domain administrationdepartment national direct library permitting images oceanic labeled research public email scientific commercial
HvnAJd	7	global	med medication wa effective ncbi 2009 pubmed kit palliat palliative function web ncbi javascript site warning requires management citation external file generate software canada nurses registered winnipeg college manitoba medication developed period kits home cared terminally extend homes ill patients time palliative order kits result ill medications targeting hospital symptoms
HNgFyF	3	global	week house west youre 41312 white wing change proof state union video watch enhanced transparency commitment browse house white logs visitor wait executive actions president obama federal receipt tax federal dollars tax spent people petitions create sign house inside white tour interactive adobe player flash content download view april 12
HIWDYb	2	global	living ncbi sunbeams dynamic pubmed reflecting catching homeopathy 2012 function web ncbi javascript site warning requires management citation external file generate software kingdom united dean bay 1jx 3 faculty queensferry north east homeopathy ky11 activity browsing empty recording activity turned recording turn back information usa 20894 center pike rockville national
w7XW4d	2	global	creek facility ca recreationgov campground details plaskett parklike grassy monterey dollar occasionally pacific aroma feet heard national campground bobcat situated sandy mountain area provide west fox sites pine 1 located setting lions sur largest borders east beach los highway forest surf elevation includes fragrant big cypress wildlife trees westcentral california
IixiO9	115	global	14 mission solstice april cassini enceladus flyby 2012 14 overview mission flyby april enceladus home flybys 2012 enceladus 2012 flyby 14 april apr 14 2012 variability instruments flyby provided polar density e14 e17 particles plumes composition inms good ion neutral threedimensional coverage waves spectrometer structure prime fields study regions mass
Iil5zI	2	global	mudslide official bellevue samm city west rebuild lake site reopens web release news mudslide samm west rebuild lake reopens commuters parkway damaged west lake late sammamish crews rebuilt thousands mudslide reopened southeast segment severely relief january road vehicles 11800 street video parkway northeast travel approximately rebuilt forcing roadway closed motorists
HLlGKC	1	global	plants medicinal mpwg information plant mpwg related publications played experimentation role peoples medicine health learned historically diet hand early important connected healing plants easily observation wellbeing intricately promoted toothaches rheumatic people chippewa purposes bloodroot years blue cure lung 3000 coughs continent provided rely cherokee woodland staple field black treat medicine
HN2lEE	1	global	house white state union video watch enhanced transparency commitment browse house white logs visitor wait executive actions president obama federal receipt tax federal dollars tax spent people petitions create sign house inside white tour interactive event live facebook discussion participate click member facebook give click questions comments httpwwwwhitehousegovvideo ondemand library
3Wg4dC	2	global	national park yosemite search square wilderness national 1200 deep high valleys human giant strength area parks find shrine glaciers grand granite persistence life power tranquility park sierrayosemite vast states sequoias united meadows foresight miles waterfalls ancient activities question yosemite choose answer difficult common dont reservations require campgrounds early popular fill
IMdtPU	2	global	med phys ncbi interventional conebeam biol timeresolved pubmed cardiac 2012 function web ncbi javascript site warning requires management citation external file generate software madison usa medical wisconsinmadison wi department physics university extrapolated proposed accurate results paper issues conclusions main undersampling 2 dataset realistic small acquired canine relative efdk gating index
HXXeyE	1	global	grill wires danger food cleaners medlineplus swallowed bbq page related medlineplus tuesday tracts healthday barbecue sharp grills wire bristles rhode 3 emergency digestive news made room island april residents brush caused ended chicken apparently barbecued wire beef bristles stomachs throats metallic issues brushes report grills ate medical patients clean isnt
ep7bKB	1	global	oil listing gas illinois part 240 act sections chapter mining oil natural title gas illinois 62 part 240 act department resources provisions subpart general subpart wells application production permit procedures subpart uic wells ii application permit procedures class subpart spacing wells workover subpart drillingcompletion requirements requirements subpart reporting forproduction wells
IyHR1w	147	global	season underway mission solstice viewing cassini saturn features season underway viewing news home saturn season viewing saturn underway apr 12 2012 summer moons campaign spring month celebrating clubs year ring saturn end network addition sky saturns degrees iapetus largest rhea youll inclination worldwide titan offering tethys showing watch increases rings
4kIXux	2	global	reports fatalities catastrophes events weekly reports fatalities catastrophes events weekly description webpage fatalities table summaries weekly area workers include updated complete employers link report list summary oshaapproved incidents catastrophes inspection links citation states hospitalization information state investigation offices plans hours reported osha investigates preliminary operate resulting workrelated fy12 reports fatalities
av3lx6	105	global	center tornado watch prediction storm 177 177 status report watch messages information network service national warnings visit iwin weather interactive 40 mod 10 low 50 mod 10 low 30 mod 10 low high 80 f2f5 probability forecaster 70 60 table event increased category tornadoes probabilities issuing 5 low moderate events
wyLKUp	1	global	country alerts specific adoption notices intercountry adoption learn process prospective adoptive parents guide statistics requirements process countrys adoption learn eligibility countries alerts specific important notices find developments 2000 act citizenship child facto instituted freeze states instances departments education judges united court provide schedule state department local told families de agencies
IpCGoa	1	global	marking anniversary forces house white joining state union video watch enhanced transparency commitment browse house white logs visitor wait executive actions president obama federal receipt tax federal dollars tax spent people petitions create sign house inside white tour interactive give moments back society initiative year service support opportunities families forces
HSuqvP	1	global	ncbi striatal beat cereb pubmed cortex finding feeling musical 2012 function web ncbi javascript site warning requires management citation external file generate software canada ontario psychology centre university mind brain 5b7 london western n6a department magnetic intervals alternative adjustment auditory temporal requiring role ganglia beat functional early timing condition resolve
aml9l	2	global	thomas congress text 20092010 bill library 111th 1158 authorize purposes muscular services human rapidly neuromuscular health conduct activities diseases treatments atrophy advance spinal disease pediatric secretary committee education whitehouse stabenow pensions labor health read isakson bill ms mr introduced referred authorize purposes muscular services human rapidly neuromuscular health conduct activities
I5Ba5u	2	global	heart national lung names gary institutes health 5 2012 nih director blood news dr gibbons institute april release links related bookmark share heart selection founder summer national expects lung gary nhlbi institutes cardiovascular start research current physiology health department today 2012 morehouse phd director medicine blood collins atlanta francis dr
awomYC	2	global	readygov kids unexpected family site planning ready web situations create good kinds prepared plan put skills friends sports music youll homework practice prepared emergencies plan day great planner youre time meet activities simple practice planning ready kids takes fun family ready graduate make click easy place youll readiness safe plan
I6qlzQ	1	global	grant grantsgov opportunities synopsis opportunity find precedence service disk electronic click information grant provide notification send inconsistency document email resolved notifications printed address opportunity emails change receive thing giving original requestedany represent newest file oldest previous shown documents current document sections files background representing modifications arranged changed list grey synopsis
HcpT48	17	global	dodea month child military 2012 serving month estimated children approximately parents deployed multiple parent million child 12 age times youth april american 18 military challenges legacy frequently face children living combat injured dodea parent helping carrying moving unique deployed care understands servicemember military fallen move years children environment diversity richness
yyzL3Z	27	global	march media social day awareness 2012 people bisexual streets homeless runaway victimization percent young heterosexual 334 transgender versus 587 gay lgbtq questioning report lesbian youth providers dealing wwwsamhsagovchildren children friends visit trauma resilient hope families heroes youth learn danger bisexual streets high homeless home streets1 victimization people young rates transgender
