7P8SZE	1	PA	cert state corps train partner america effort volunteer prepare proud cert citizen agency neighborhood citizens corps criteria guidelines county council organizational follow encouraged category management police completing objectives government contained state program sponsoring listed bottom basic covered local website jurisdiction description emergency fire material agencies standard sponsored representative response included
z2WPpu	1	PA	grant grantsgov opportunities synopsis opportunity find precedence service disk electronic click information grant provide notification send inconsistency document email resolved notifications printed address opportunity emails change receive thing giving original requestedany modification description represent newest file oldest previous shown documents current document sections files background representing modifications arranged changed list
xbjCNT	1	PA	ncbi eukaryot functional analysis cell pubmed transcriptome matin 2012 function web ncbi javascript site warning requires management citation external file generate software phytopathology institute university germany friedrichschiller jena microbiologymicrobial adependent cyclerelated transcriptionally experiments identify involved impact visualization northern pcr schizophyllum temporal detected plasma hybridization fusion 12 transcriptome downregulation bap22 interestingly
18ms41	1	PA	quindar tones beeps apollo contributor journal burckhard writes mark ive heard wondered space lunar purpose apollo missions beeps modules intermittently communications command served voice mike network clip dinn journal quindar tones mp3 contributor includes audio numerous check 123k contributor markus journal replies mehring space flights shuttle accurate today uhf frequencies
4N1BNb	1	PA	canada 2009 ncbi disease chronic pubmed disparities prev dis function web ncbi javascript site warning requires management citation external file generate software canada provincial rfangphsaca columbia v6z bc 2h3 authority health british services vancouver major lowincome measure chronic canada inequities environment health income residence province populations social proxy groups report
w8Qb4l	1	PA	synthetic metadna biology dna ncbi nanost interface soc pubmed 2012 function web ncbi javascript site warning requires management citation external file generate software duke usa durham university nc computer science department operations restriction proposed show ssmdna amplifies cuts based chain dnadna molecules analogous include hybridization strand formal assemblies denaturation backbones
ygGdA3	1	PA	full pain cognitive text diabetic clinicaltrialsgov therapy behavioral view neuropathic psychological intervention cognitivebehavior peripheral pain efficacy evaluate management therapy purpose neuropathic study diabetic persistent 215 sample randomized design numbers cbt intervention pharmaceutical educational compared approximately research participants conditions treatment employed size recruited cbtsc controlled standard edsc condition care target equal
32xAiI	1	PA	massdot developers page transportation massachusetts authority bay authorities transit regional massachusetts authority port links static information working realtime data interested developers resources meant transportation serve made massdot found page updated relationship agreement principles data 11132009 developers license massdot acceptance note acknowledges massdots page mbtatransit highway rmv massport planning challenges web
zNwZwt	2	PA	house helping american succeed businesses address white weekly state union video watch enhanced transparency commitment browse house white logs visitor wait executive actions president obama federal receipt tax federal dollars tax spent people petitions create sign house inside white tour interactive stamped states united hes steps sold made ensure president
wYGNlm	1	PA	networking ncbi media social saf pubmed health workplace 2012 function web ncbi javascript site warning requires management citation external file generate software school nc north susanrandolphuncedu usa university global 275997502 gilings hill health chapel public carolina media networking benefits consequences nurses social participating understand risks health occupational incorporated slack copyright
rWaL0b	1	PA	mlkdaygov receive mlk updates inbox mlkday follow twitter links photo channels good video images find previous inspiring ways media day widget weve included opportunity gallery projects search engage involved social mlk interests dont create project find toolkits widget mlk search site day ensure social date follow networks ensure social date
xJFRMX	1	PA	viral flora ncbi metagenomic analysis mart pubmed pine virol 2012 function web ncbi javascript site warning requires management citation external file generate software netherlands center medical virology department erasmus rotterdam sequences geminivirusrelated viruses pine enteric picornaviridae species homology information epidemiological baseline metagenomic detected potential european diversity viral circoviruslike understanding paramyxo
zoRlcl	1	PA	rapid ncbi plos generation access pubmed sequencing 2011 function web ncbi javascript site warning requires management citation external file generate software plant united university davis states sciences california department america losses sequence generation highly 130 sequencing economic race genomic spite puccinia radically compared rapidly illumina fortunately speed responsible access reduction
xeZzEq	2	PA	giss impacts level national maps nasa world security figure al paper human based s5 health 2012 shindell simultaneously food journal graphics improving change climate nearterm science mitigating interactive load moments installed computer web java note graphics require enabled browser 2050 temperature bc measures due surface increase avoided methane decrease linked
yhZALx	1	PA	lunar2 major instruments intro prospector section board overview lunar results instrument alpha learn spectrometer learn reflectometer instrument electron scientists found magnetometer results instrument experiment learn learn results spectrometer instrument scientists found works neutron doppler gravity instrument spacecraft experiment learn run scientists answers questions prospector involvment program lunar learn questions ice
4dwBHm	3	PA	picture astronomy day fascinating discover featured written image explanation day photograph astronomer cosmos universe professional 11 2012 bright distant earth disk 20 fit easy weeks apogee photographed perigee dark day telescope pacific dense sun asia moon smallest full 300 annular 240 kilometers path super silhouetted filter point image visible smaller
fJjXsh	1	PA	adsorbing cytokine ncbi nephrol pubmed contrib 2010 columns function web ncbi javascript site warning requires management citation external file generate software university intensive ttaniyanmedkanazawauacjp japan kanazawa hospital unit care tnfalpha vary resistance leads systemic cytosorb cytokines treatment columns animal combination activation results effects acute respiratory endotoxemia organ profound occlusion demonstrated
zr5BNb	1	PA	med sci ncbi enduran sports exerc strike pubmed rates foot injury 2012 function web ncbi javascript site warning requires management citation external file generate software lb evolutionary boston 3university auburn services street 65 human research avenue 81 divinity usa 2department system 02163 health central suite care 500 biology north 4baylor
yZEBfl	3	PA	astp photo nasa id title ast01042 image pacific ocean patterns text oblique cloud view ast01053 text image orbit spacecraft soyuz american apollo soviet american ast01056 text image orbit spacecraft soyuz apollo soviet ast02093 text image blacksky spacecraft soyuz background contrasted soviet ast02096 text image blacksky spacecraft soyuz background contrasted soviet
A85UM2	1	PA	sci ncbi universal highly parenting program effects prev pubmed 2012 function web ncbi javascript site warning requires management citation external file generate software mpe23camacuk cambridge institute university uk criminology distributors results paper caregiver children 28 819 program parents treatment adherent informants effects schools highly condition matched school developers approach 56
xaaHO4	1	PA	full pain view sativex clinicaltrialsgov treatment text chemotherapy induced neuropathic nerve cancer caused cannabinoid proposes agents extremities chemotherapeutic survivors treat chemotherapy treatment life suppress suffering cases neuropathic treating tolerate patients cannabinoids limit sativex evidence examine cure extract attempting damage evoked animal pain extend models effect severe involving significant morphine neuropathy
yvzlT0	1	PA	sec form accurate reviewed information necessarily commission reader complete exchange completethe securities assume determined filing 1 identity issuers information business contact 2 place principal persons 3 related clarification response clarification response clarification response clarification response industry group 4 size 5 issuer federal select 6 claimed apply exclusions exemptions type filing
nCt41V	1	PA	october house photo white 2011 day state union video watch enhanced transparency commitment browse house white logs visitor wait executive actions president obama federal receipt tax federal dollars tax spent people petitions create sign house inside white tour interactive october house check offices photo picks 2011 white day house hosted
sC7M7L	2	PA	photo house december white 2011 day state union video watch enhanced transparency commitment browse house white logs visitor wait executive actions president obama federal receipt tax federal dollars tax spent people petitions create sign house inside white tour interactive december house check offices photo picks 2011 white day president house
xZx9E3	11	PA	states united pennsylvania robert jr casey contact scheduling senator requests form casey fill request submit invitation senator staff meeting fields required marked response casey enter date meet senator capitol reasons washington states staff united mail 2246324 fax 202 form 2280604 dc delivery phone slow page contact offices security building 2280604
b2uIyI	2	PA	house white state union video watch enhanced transparency commitment browse house white logs visitor wait executive actions president obama federal receipt tax federal dollars tax spent people petitions create sign house inside white tour interactive event live facebook discussion participate click member facebook give click questions comments httpwwwwhitehousegovvideo ondemand library
17R7oz	1	PA	lincoln memorial national search immortalized people civil saved memorial united union emancipator statesthe memory enduring inspiration temple seeks great symbol forever nation preserver words president lincoln attracts warsits marble enshrined hope freedom hearts beneath abraham 16th app memorial service official park parks mall national memorial blossom cherry national parks mall
jcIrm	1	PA	web student aid program financial certification loan sources grants repaid undergraduate grant federal nonfederal awarded foundation added degree students student professional cases teacher aid unlike receive earned considered postbaccalaureate bachelors enrolled pell 30 financial year total grant amounts 1 depending fulltime 2011 2013 201112 status full plans attend june award
uNbpcI	1	PA	shapes nih 20 national december experience early release dietary health preference preschoolers infants news institutes salt 2011 links related bookmark share media advisory years children sodium potentially decades greater early preference report shaping preschool 55 investigators findings people encouraged initiatives preferences nidcdfunded research content health public packaged put monell months
d0WPNn	3	PA	national site roosevelt historic franklin home search estate captures back library cries home fdrthis fdrs museum hudson visit springwood loved terms started quote president presidential elected considered connection fdr place learn river twitter rooseveltvanderbilt facebook nhs follow flickr week metronorth mayoctober service bus national park days free operates poughkeepsie roosevelt
n8ZVrA	1	PA	asthma ncbi media social pubmed emailpreferences text messaging 2011 function web ncbi javascript site warning requires management citation external file generate software division arbor immunology usa 48106 university allergy mi ann medicine clinical michigan abaptistmedumichedu department internal text twitter electronic management asthma preferences media myspace unknown email patient facebook social
z5DkBS	1	PA	announcement cities house chester communities strong white state union video watch enhanced transparency commitment browse house white logs visitor wait executive actions president obama federal receipt tax federal dollars tax spent people petitions create sign house inside white tour interactive adobe player flash content download view domain 452 public july
ohQJR0	1	PA	frb 2011 requirements actjuly disclosure rules credit doddfrank releasefederal ftc score 6 press implement issue final reserve release date july 2011 6 disclosure fair wall issued related trade street information material requirements consumers commission federal doddfrank ftc score board notices final reporting disclose terms statute rules setting requires protection scores
w4N6QC	1	PA	younger pat ncbi initial pubmed therapy blood comparative outcome 2012 function web ncbi javascript site warning requires management citation external file generate software danafarber ma usa cancer institute boston medical 02115 oncology 450 brookline annlacascedfciharvardedu ave focus years aggressive centers progressed 25 lymphoma 20 21 parameters progressionfree 29 treatment fractionated
Anazwx	1	PA	nih health january national release 12 identify scientists workings viruses news 2012 approach institutes view links related bookmark share smaller findings developed viruses human skin institutes bacteria diseases visualize provide niams jan musculoskeletal scientists health structures national discovery arthritis science reported part workings insights 13 institute cells microscope issue researchers
gNtpxW	1	PA	dredged veto section act authority water 404 materials clean 404c discharge epa fill content area jump main navigation contact dredged water 404 materials discharge fill files epas adobe reader learn pdf page view prohibit wetlands defined pursuant actions hearing restrict including fill impact information authorizes united dredged adverse disposal section
uE4Tpk	3	PA	topics system exploration solar year overview dec 2011 worlds evolving dec 2011 people move shrink billions years hair planets dense start frail energy full oceans craters losing grow change cool atmospheres gather wrinkles lose senior planetary atmosphere shield magnetic global thicker subsurface eruptions protective worlds flowing caps early cool eroded
wrNexb	1	PA	sci ncbi med sports exerc pubmed effects strike 2012 type footwear function web ncbi javascript site warning requires management citation external file generate software 11 biology evolutionary divinity usa university harvard cambridge human department ma avenue 02138 rearfoot shoes differs forefoot heels elevated strike supports minimal economy versus tests standard
hwtAF7	1	PA	ncbi efficacy hemodiafiltration continuous nephrol wit contrib pubmed 2010 function web ncbi javascript site warning requires management citation external file generate software yamanashi emergency university school medicine critical department japan matsudakyamanashiacjp care major distress edema caused resultant mediators pulmonary permeability syndrome interstitial pmmachdf hemodiafiltration humoral increase treatment membrane patients cytokineadsorbing
xhFKnR	2	PA	press center jpac searches jpac photos historical casualties marine marine 222 jan pearl korean war 2012 harborhickam photos base casualties 13 joint hawaii historical files jpac photo donating tools casualty preferably family personnel member compiled submissions archival photographs frontal showing hundreds photos identifications date case unresolved records analysts teeth aid
bKCzpO	3	PA	web student aid colleges financial community grants repaid click universities requirements additional variety federal review program details grant offer students attending schools loans unlike career fouryear page quick aid eligibility financial grants apply based application federal submit read listed fafsasm eligibility free student factors aid page program undergraduate certificate pell
oXblZR	7	PA	king luther national memorial jr martin search love beacon message man conscience equality justice freedom movement app memorial service official park parks mall national memorial movement history man photo multimedia link pages national click mall plan find memorial blossom cherry national parks mall link page emerging fair generation image society
pFKVQq	1	PA	states patent united 7090268 droppings rod hold securing holder folded fall sanitary catches catcher excretes shaped discarded bag upper portable catching bottom economical ground shows ends carried motion simple caretaker comprised owner plastic attach waste excreting dogs finished carrying catch removed grocery inside attached grass loop walks lightweight preferably end
yZ458j	1	PA	2011 controlled ncbi pubmed workplace triple fam evaluation psychol function web ncbi javascript site warning requires management citation external file generate software school australia psychology family centre support mattspsyupeduau parenting queensland university results years assigned paper children personal parents dysfunctional employee effects condition selfefficacy enhance significantly 116 home transitions factors
yU1eUH	1	PA	painrelated mobile perceived pubmed harmfulnes fear 26 pain dec1212120918 2011 oct epub netherlands jeroendejongmumcnl university rehabilitation maastricht department hospital abilities show results clinic concept participate fear disability musculoskeletal treatment factor activities showing regional early cognitivebehavioral association perceived presented systematically predicted referred significantly findings movementreinjury related strongest treatments shown scale clinicians
nF22bV	1	PA	allogeneic ncbi reducedinte leukemia transplantation pubmed 2012 function web ncbi javascript site warning requires management citation external file generate software division italy dei fondazione milano hematology tumori nazionale transplantation irccs istituto annadoderoistitutotumorimiit marrow bone p004 45 results years n39 including sct allografted n33 previous 25 27 thiotepa p0007 treatment siblings
iRoY8K	4	PA	documents paris 1783 treaty revolution september 1783 states ended recognized united 3 colonies independent formally nation great britain signed treaty american diplomacy process states born britain earth france established united peace largest international newly war conflict arena 177583 formed sophisticated vaguely involving world spain brought great netherlands american independence powers
yq1gmf	1	PA	cell cancer cd4 res cel ncbi adoptive pubmed therapy lymphoma 2012 function web ncbi javascript site warning requires management citation external file generate software school usa stanford university medicine california department limited activated effector identify human adoptive treatment cotransfer murine foxp3 cd137pos cd4 therapy lymphoma cd137 excluding persisted findings consistent
wxJUgi	2	PA	galileos journal multimedia system exploration solar gallery galileos journal 1610 jan 7 date sketches named planets ganymede callisto jupiter io earth theory system 1610 5 moons discovering discovery amb europa update jul understanding orbiting demise solar universe galileo galilei 2011 discovered made center sunlast january orbit planet popular led galileo
zq4057	1	PA	ecycling plugin computers ecycle epa jump main content ecycling partnerships plugin wastes area search contact additions epa recent communication obtain valuable donating computer businesses donate wisely technology education working pcs access waste helps helping necessity communities opportunity winwin trash benefits computers terrible thing materials reusing meets requirements make computer donating
vKPB3e	1	PA	congress library dpoe preservation digital beginner providers executive preservation offerings cost calendar find educational offering service people click access intermediate location digital public designate sort intended congress format practice managerial library date advanced training level title practical audience asked form offer preservation planning calendar training encourage add digital submissions connect
67c0rL	1	PA	iodine previously text clinicaltrialsgov iv ii 131 tositumomab nonhodgkin chemotherapy full combination follicular rituximab lymphoma iii untreated stage treating patients view iodine cancer vincristine growth kill carry tositumomab find ability dividing ways normal prednisone spread chemotherapy harming monoclonal cancerkilling combination substances drugs cyclophosphamide stop radiolabeled killing rationale rituximab grow antibodies
5c9WMn	1	PA	treating nonhodgkins combination text view clinicaltrialsgov large patients full rituximab chemotherapy lymphoma diffuse bcell cancer kill carry find bcell dividing spread chemotherapy monoclonal nonhodgkins cancerkilling combination substances drugs stop rituximab lymphoma diffuse treating regimen cells work large stopping growth ways ability killing rationale grow antibodies effective giving block compare randomized
yOOrBm	1	PA	cancer allatonce taking testing genetic sequencing approach parallel massively prevent reasons results uncontrolled growth genomic happen dividing inappropriate knowing diseases genes stop inherently mutations cells cancers tumors cancer caused lung skin environment suns ultraviolet exposure interaction tobacco light cancers smoke result cancer point individual protects run copies cell mutation passed
zZ0vTS	1	PA	ozone good radiation air high bad planning epa standards quality nearby content area jump main navigation contact high good ozone bad nearby ozone upper atmosphere ground earths depending environment health location occurs good gas level ozone bad good ozone bad atmosphere uv meets suns groundlevel surface protects earth layers earths
oDu0e2	1	PA	measuring stress res ncbi significance pubmed oxidative hypertens 2011 function web ncbi javascript site warning requires management citation external file generate software center west medical ntt treatment japan preventive takamatsu hospital ftoshikagawawestnttcojp years visualized facilities ros syndromeassociated brachialankle reactive potential postulated associations creactive risk evaluate males fat wave suggesting association
A5QcIf	1	PA	calendar edsitement presented essay examining campaign civil alternatives direct assess society protest defense americans kings lesson criticisms black students selfgoverning famous significant nonviolent securing rights action share partnered thinkfinity lesson find educational save resources plans free edsitement plans updates lesson resources humanities project edsitement endowment national provided verizon thinkfinityorg edsitement
jjHHaH	2	PA	hudno11134 hud notice rights homeownership disclosure announces revised servicemembers protects protecting militaryfederal dependents law disclosure duty civil revised washington housing department announced relief development urban notice form servicemembers emphasizes active dependents rights protected today act military duty foreclosure mandates wartime states active rate including court proceeding mortgage personnel percent valid
tNSBGy	1	PA	2009 patient ncbi couns support pubmed online educ participation function web ncbi javascript site warning requires management citation external file generate software netherlands institute university cfvanudenkraangwutwentenl research twente behavioural empowered feel direct related evidence support occur online expected participation extent exploring patient effect part effects groups outcomes empowering empowerment processes
xXDPH9	1	PA	apartment house settles rule leadpaint pa owner 01102012 violations reading notification contact newsroom leadbased consent agreed lack settlement avenue children issues todayin apartment knowledge residential heron young penalty permanent systems ban violations local 2012 sellers liability span leases loss presented january applicable donna actepa release reduced landlords apartments intelligence growth
1TfcoY	2	PA	apod 2005 sunspot 6 close november fascinating discover featured written image explanation day photograph astronomer cosmos universe professional november 6 2005 suns magnetic rest visible earth exploding granules explanation material gas dark part closeup solar cool 10 cooler cells highresolution small minutes entering bubbling granule sea inhibiting luminous depression end
UT2FE	2	PA	house white state union video watch enhanced transparency commitment browse house white logs visitor wait executive actions president obama federal receipt tax federal dollars tax spent people petitions create sign house inside white tour interactive event live facebook discussion participate click member facebook give click questions comments httpwwwwhitehousegovvideo ondemand library
o7BOor	1	PA	25 apod iron september sun 2004 fascinating discover featured written image explanation day photograph astronomer cosmos universe professional september 25 2004 september years spacecraft atomic astronomers 22 farenheit degrees observatory ultraviolet onboard equinox space sun collisions written numeral temperatures million emitted atoms extreme times roman resulting shorthand image highly xii
