xFAnw8	1	PA	full pain efficacy tolerability text clinicaltrialsgov patients safety arcoxia view evaluation etoricoxib neuropathic undertreated primarily neuralgia caused tolerability abnormal involve neurons determine pain etoricoxib remains herpetic safety present nsaid phn efficacy sensory post reliever neuropathic postshingles study disease commonly aim patients activity relievers investigating referred superior efficacy study hypothesis etoricoxib
2PQUFP	2	PA	business topics tax topic 509 home irs resources deduct home denial employee general business deductions part expenses selfemployed expense regularly deduct business exclusively expenses part home attorney trade determine principal management personal businessuseofthehome exclusively location employee administrative regularly activities employers part convenience den applies fixed requirement deduct purposes expenses substantial
hX1yVe	2	PA	federal holidays 2012 6103 observed saturday usc federal schedule note sunday 5 establishes holiday public nonworkday monday friday holidays law employees work falls executive purposes years leave federal pay section legal 1 sunday 2 11582 3a holiday public 2012 monday falls day february january employees 1971 11 treated order specifies
xo5P1q	1	PA	altern prospective ncbi med equinea trial pubmed health mayjun 2011 ther function web ncbi javascript site warning requires management citation external file generate software center usa dallas jkernatcoftexasorg research treatment department autism texas activities beneficial disorders suggest spectrum reports asd anecdotal equineassisted studies autism rating ofequineassisted satisfaction examine examined parentchild
xXJccI	5	PA	volcanic natural island hazards sea red december zubair pulse 60 violent rising yemeni sea navy activity helicopter captured video northern 23 began sulfor 40 located edge details eruptions dioxide white 2011 red satellite shallow forming eruption coast middecember reported imagery kilometers satellites revealed explosions recent saba showed island highresolution submarine
xobIyT	1	PA	fugate administrator blog lay statement bob passing fema comment accordance comments blog moderated policy femas links nongovernment social applications web fema provided reference media companies sites endorse msgdata washington street apply management prepare federal rates homeland department 4fema emergency dc 43362 20472202 sw agencyus security500 6462500text tty assistance step 46275853
za3eMH	1	PA	grant grantsgov opportunities synopsis opportunity find precedence service disk electronic click information grant provide notification send inconsistency document email resolved notifications printed address opportunity emails change receive thing giving original requestedany modification description represent newest file oldest previous shown documents current document sections files background representing modifications arranged changed list
i6rEz	1	PA	living healthy live parenting healthfindergov learn quick guide connect website hyperlink nongovernmental direct application hhs consistent hyperlinks states services human subject information hyperlinked united application contained health endorsement department website intended provided visitors external constitute applications privacy appearance practices products policies purpose link redirected information usaccessibility privacy mapcontact act policyfreedom
omNQN3	2	PA	text clinicaltrialsgov bcell genetically chemotherapy full lymphocyte leukemia engineered therapy lymphoma treating resistant refractory patients view cancer kill laboratory make placing immune build white body blood rationale response created cells gene bcell trial studying clinical genetically chemotherapy lymphocyte leukemia engineered therapy purpose lymphoma treating resistant refractory patients anticd19car unacceptable disease
3YWS2N	1	PA	living healthfindergov healthy wellness guide live health learn quick everyday connect website hyperlink nongovernmental direct application hhs consistent hyperlinks states services human subject information hyperlinked united application contained health endorsement department website intended provided visitors external constitute applications privacy appearance practices products policies purpose link redirected information usaccessibility privacy mapcontact
tO4ZsR	2	PA	living healthfindergov healthy live adult shots learn quick guide booster connect website hyperlink nongovernmental direct application hhs consistent hyperlinks states services human subject information hyperlinked united application contained health endorsement department website intended provided visitors external constitute applications privacy appearance practices products policies purpose link redirected information usaccessibility privacy mapcontact
yjShDI	4	PA	apod saturns painted january 13 moon iapetus 2012 fascinating discover featured written image explanation day photograph astronomer cosmos universe professional january 13 2012 increasingly meter infrared spacecraft debris flyby impact saturns walnut swoop unprecedented happened greater material seemingly dark possibly world saturn vast bright inspection images close easternmost ice moon
acH9sY	2	PA	petroglyph national monument search spiritual volcanic significance national spanish 700 contemporary valuable symbols images protects carved years native petroglyph hold sites largest featuring designs north descendants 400 early settlers cultural america ago profound rocks record expression monument americans visitor open passes petroglyph mst trails 500 pm park viewing bookstore wnpa
xwgPKe	1	PA	program extension announces national permit park dome interim cables half yosemite search extended hiking season program 2012 summer cablesthis national ascend interim climbing 2010permits implemented cables issues yosemite system program safety seasonthis 2012 week crowding park dome part designed half beginning day extension permits require required days permit address monolith
txCSha	1	PA	prime ncbi perinatol echocardiography early pubmed ready 2012 fetal function web ncbi javascript site warning requires management citation external file generate software center gynecology university lebanon fmirzaaubedulb american obstetrics department beirut medical results reviewed superior arteries 22 suspicion screening excluded weeks remaining early echocardiography transposition reasonable raised abnormal vsd 81
xEZZvG	2	PA	apod august sun spicules 2 2004 jets fascinating discover featured written image explanation day photograph astronomer cosmos universe professional 2 august 2004 atmosphere suns magnetic resolution earth carpet 50000 rapidly young thousands eventually soundlike dark half transparent hour timesequenced flux pictured enigmatic frame back images envisioning shown sun state filled
bAImEX	1	PA	ncbi gp qualitative gen moment pract br 2010 heartbeat pubmed study function web ncbi javascript site warning requires management citation external file generate software watling centre medical sanjivahluwalialondondeaneryacuk uk stanmore selfhelp literature information remains increasingly encourage consultation health internet policy role government doctorpatient patients sparse consultations dealing brought determine information
hHJOXn	3	PA	champions house white change state union video watch enhanced transparency commitment browse house white logs visitor wait executive actions president obama federal receipt tax federal dollars tax spent people petitions create sign house inside white tour interactive mscaption textindent9000px 308px msdetail top top0px height norepeat 9999 349px positionabsolute left495px zindex
hAbWa2	9	PA	service mlk day project find receive mlk updates inbox mlkday follow twitter interests dont tools find toolkits create project tips widget mlk search site day ensure social date follow networks mlkdaycnsgov include serve additional opportunities official national accessibility community usagov fear privacy federal corporation notices website government site foia service
y5Ybxx	1	PA	taiwa ncbi millwood aff program health payforperformance pubmed 2012 function web ncbi javascript site warning requires management citation external file generate software management university institute national health policy college taiwan public taipei rchangntuedutw percent years program physicians broadest game reap cautionary countries investigate payments adherence national design proper insurance encouraged
