sT27YE	1	OH	solstice apod 14 january 2002 sun halo winter fascinating discover featured written image explanation day photograph astronomer cosmos universe professional 2002 january 14 atmosphere bright alignment sixsided 22 pillars prominently refracting iowa trees halo term morning large small view upper neighborhood observer phenomena arc pass sunrise sun ice falling ground
s4u3Su	1	OH	kwanzaa house beginning mark president obama lady white state union video watch enhanced transparency commitment browse house white logs visitor wait executive actions president obama federal receipt tax federal dollars tax spent people petitions create sign house inside white tour interactive kwanzaa season warmest yesterday celebrating wishes president lady holiday
vdIG8a	1	OH	full chronic lymphocytic leukemia clinicaltrialsgov pci32765 text small cases lymphoma special view background immune treatment half affect lymphoma 50 individuals small respond people abnormal elderly treatments health standard groups drug pci32765 diagnosed hardtotreat cancer lymphocytic chronic addition create system fight genetic treat chemotherapy white cllsll hurt lymph 17p cells cancers
uTqYCv	1	OH	terrestrial mountain produces science space meteorites nasa probe sights spacecraft existence giant longstanding asteroid expected entered 2011 half towering july everest mystery reveal fully mount planet vesta dec pieces high dawn mountain end scientists higher nasas peak surprising 30 orbit times 13mile solve atmosphere caused years village earth bilanga giant
A7Mz1C	2	OH	photo house january white day 2012 state union video watch enhanced transparency commitment browse house white logs visitor wait executive actions president obama federal receipt tax federal dollars tax spent people petitions create sign house inside white tour interactive january house check offices photo 2012 picks white day office deputy
yZTICL	1	OH	website serving district 5th georgia lewis congressman john congressional search 14 hr bill number search word healthcare phrase homeowner american stand time corner walk people daily reality parents life families america paying georgia sacrificing taxes time country justice injustice threat receive sign updates email office lewis message click issues legislative
jcIrm	1	OH	web student aid program financial certification loan sources grants repaid undergraduate grant federal nonfederal awarded foundation added degree students student professional cases teacher aid unlike receive earned considered postbaccalaureate bachelors enrolled pell 30 financial year total grant amounts 1 depending fulltime 2011 2013 201112 status full plans attend june award
w7Onl7	6	OH	visitors winter dnr summer resident find warmer canada winter opportunities birds offers perfect michigan time trees binoculars reason found put unique chill leaves viewing air migrate temperature species climates fallen owl supply traveler rarely northern long lansing gray eastern food michigan tundra peninsula homes migrants small found upper consistent humans
tIFri2	2	OH	current uscert activity highimpact web current incidents regularly updated reported types summary uscert activity security page frequent multiple apple released updates safari address vulnerabilities products security os code crosssite obtain information perform vulnerabilities privileges elevated attack attacker condition execute denialofservice exploitation sensitive arbitrary operate scripting articles mitigate users ht5281 encourages
sgcY98	4	OH	house submit comments questions white state union video watch enhanced transparency commitment browse house white logs visitor wait executive actions president obama federal receipt tax federal dollars tax spent people petitions create sign house inside white tour interactive accessible committed comments questions open staff administration send concerns wellwishes creating form
Af7Ic3	2	OH	life ncbi family longterm experience afte pubmed neurosci nurs 2012 function web ncbi javascript site warning requires management citation external file generate software narvik university gkhinno society health department college norway lack minors children impact highlighted disabling workers survivors equilibrium unique themes lifethreatening qualitative view illuminate marital urgent spouses research
t5S7De	1	OH	office disability toolkit odep labor policy department employment integrated states department united labor key organized toolkit accommodate sources audiences questions employment guides perspectives variety discussion audience increase offers papers integrated resources case full users commonlyasked collection understanding user sheets capacity potential reports guide range materials policies studies fact adults developed
eUsoqT	2	OH	civil eve american edsitement war presented civil series states bring statistical click statistics factors war maps tabs united student summarize bottom eve american animated interactive share partnered thinkfinity lesson find educational save resources plans free edsitement plans updates lesson resources humanities project edsitement endowment national provided verizon thinkfinityorg edsitement support
sVVdyO	3	OH	apod full january aurora sky 3 norway 2012 fascinating discover featured written image explanation day photograph astronomer cosmos universe professional january 3 2012 atmosphere unexpected ago striking sky magnetic results 60 lies stretched airplane rarely viewed complete mountain realm wide space image poles horizontally molecules auroral circle norway aurora higher
vekSb	2	OH	battlefield national bighorn monument search 1876 including fighting 7th soldiers armed george cavalry 26 area personnel indians lakota lt cheyenne preserve life custer 25 thousand june 263 efforts died armys sioux army attached memorializes warriors col battles famous american bighorn battle history battlefield monuments national podcasts bighorn life dedicated defending
zH17Db	3	OH	lakeshore dunes national indiana winterfest search temporarily lot 28 kemil park due state construction closed parking expected east open road 2012 national 1200 embrace paul education saturday lakeshores winter dunes douglas 7 indiana pm lakeshore environmental pm400 celebration center january fun winterfest outdoor show skis indoor paper including skiing staff
taTNtd	1	OH	working house year address white weekly state union video watch enhanced transparency commitment browse house white logs visitor wait executive actions president obama federal receipt tax federal dollars tax spent people petitions create sign house inside white tour interactive tough people move year past tells create grow economy jobs president
b2uIyI	2	OH	house white state union video watch enhanced transparency commitment browse house white logs visitor wait executive actions president obama federal receipt tax federal dollars tax spent people petitions create sign house inside white tour interactive event live facebook discussion participate click member facebook give click questions comments httpwwwwhitehousegovvideo ondemand library
v4ltNA	1	OH	fly apod space january free 1 2012 fascinating discover featured written image explanation day photograph astronomer cosmos universe professional 1 january 2012 guided mission farther nitrogen earth 41b backpack satellites bay works heavy retrieve weightless challenger meters cargo space propulsion robert mccandless pictured drifting mmu free jets safer experience untethered
9lcG6i	1	OH	survey site satisfaction questionnaire feedback web service read improve customer short completing additional submit email healthfindernhicorg comments questions respond displays 200 suggestions hhs including reviewing aspect ave estimated comments information reducing 23 agency valid conduct public independence omb washington reporting dc collection number control burden estimate response instructions clearance 20201
su6z43	1	OH	thomas congress text bill library 112th 20112012 hj ih 88 amendment limited authority states proposing corporations regulate established united constitution entities state congress liability clarify companies foreign corporate laws mcgovern committee judiciary joint mr introduced resolution referred amendment limited authority states proposing corporations regulate established united constitution entities state congress
bREk8i	1	OH	government house executive contracting white order economy state union video watch enhanced transparency commitment browse house white logs visitor wait executive actions president obama federal receipt tax federal dollars tax spent people petitions create sign house inside white tour interactive homeowners refinancing house twitter responsible answers hours brian office questions
vZUSY0	1	OH	polar lander target system past exploration solar mars missions microprobes instruments measure deep sample martian pentrate surface arm cameras soil regions 2 mars composition polar lander equipped landing goals robotic firstever carried space false mishap accomplishments speed high engines investigation mars main legs polar shut lander crashed landed descending deployed
lsixXH	1	OH	training office videos newsroom compliance general services heat video human provider department health inspector prevent videos initiative awardwinning educational health provider waste youll hope enforcement heat part designed care training fraud compliance presentations podcasts abuse team action audio page prevention videos format audioonly lewis general embrace inspector quality law morris
dx0mPK	1	OH	flagstaff national weather service nws atmosphere humid generally identify cold lets contrail mixing turbulence entire term byproduct small weight colder exerted combustion barometric occurs water pressure engines mixes amount levels passing fancy visible directly temperature jet question due low opposed engine form gas trail atmospheric air temperatures high occur conversion
z5NZQg	1	OH	flashlight led target fire burn hazards due sets recalls named washington instructed voluntary consumers illegal commission safety cooperation announced firm product stop dc recalled resell attempt immediately products today recall consumer flashlight product led 6pc sets units 55000 target minn corporation minneapolis importer flashlights fire burn turned hazard heat posing
xLVZT0	1	OH	mart childrens lead chairs due stools standard gifts elegant recalled violation paint named washington instructed voluntary consumers illegal commission safety cooperation announced firm product stop dc recalled resell attempt immediately products today recall consumer product chairs stools childrens 1300 chairs 1600 stools units mart los gifts elegant importer calif angeles
UT2FE	1	OH	house white state union video watch enhanced transparency commitment browse house white logs visitor wait executive actions president obama federal receipt tax federal dollars tax spent people petitions create sign house inside white tour interactive event live facebook discussion participate click member facebook give click questions comments httpwwwwhitehousegovvideo ondemand library
JJgjA	6	OH	congress nominate national preservation registry films library film board mandating consulting inclusion december national suggestions preservation select experts reviewing plan library alternates established pl110336 end implementation 44 extensively 1988 passage film heritage films save public announced board reauthorization extended recently congress 25 continuing authorizes registry members librarian law 2008 sound
aGrvo1	2	OH	metab ncbi int nutr chocolate exerc pubmed 2006 postexerci sport milk function web ncbi javascript site warning requires management citation external file generate software applied usa laboratory university bloomington 47405 dept kinesiology health human science performance indiana rating endurancetrained results cyclists milk tte isovolumic 4 bout greater workout bouts fluid
cQSs0S	1	OH	adults ncbi arch 2005 crime pubmed psychiatry gen sever victimization function web ncbi javascript site warning requires management citation external file generate software northwestern school usa chicago university medicine feinberg lake 710 sciences shore psychiatry behavioral department drive psycholegalnorthwesternedu 60611 il illness mental community victimization crime live smi risk deinstitutionalization
uqQYoY	1	OH	map normandy edsitement dday invasion interactive presented major assigned excerpts histories include participated read battlesthis zoomable european history locations sense event lengthy popups tend write interested edsitement shows europe map combat students men student engagements theater wwii fictitious place interactive oral asked share partnered thinkfinity lesson find educational save resources
7P8SZE	1	OH	cert state corps train partner america effort volunteer prepare proud cert citizen agency neighborhood citizens corps criteria guidelines county council organizational follow encouraged category management police completing objectives government contained state program sponsoring listed bottom basic covered local website jurisdiction description emergency fire material agencies standard sponsored representative response included
bKCzpO	1	OH	web student aid colleges financial community grants repaid click universities requirements additional variety federal review program details grant offer students attending schools loans unlike career fouryear page quick aid eligibility financial grants apply based application federal submit read listed fafsasm eligibility free student factors aid page program undergraduate certificate pell
xdNiTK	1	OH	pap tests color pdf full cancer find pap cervix vagina test checks opens womb part lower smear cells turn sex pap 21 start 3 vaginal tests years women time pap make normal find call test appointment period change cells harder including pap based doctor things nurse tests woman decide talk
v3wLaZ	1	OH	tracking whats network cdc control cdc years enhanced query centers preventions network affects environment offers health peoples functionality public users environmental important data knowledge tracking improved launch expanded disease easier features cancer fall community query carbon information noninfectious asthma network climate hazards system find environment health online conditions added diseases
yoV95t	2	OH	current uscert activity highimpact web current incidents regularly updated reported types summary uscert activity security page frequent multiple apple released updates safari address vulnerabilities products security os code crosssite obtain information perform vulnerabilities privileges elevated attack attacker condition execute denialofservice exploitation sensitive arbitrary operate scripting articles mitigate users ht5281 encourages
xzMFCp	1	OH	photo house january white day 2012 state union video watch enhanced transparency commitment browse house white logs visitor wait executive actions president obama federal receipt tax federal dollars tax spent people petitions create sign house inside white tour interactive january house check offices photo 2012 picks white day office deputy
v0GEj6	1	OH	ability ncbi study pubmed large neurosci clinical clin 2011 eeg function web ncbi javascript site warning requires management citation external file generate software kkangi2rastaredusg infocomm singapore institute science agency research technology accuracies rest brain paper majority ment signals consent 8 eegbased p0008 gave versus p014 online fuglmeyer background level 54
vCrihy	1	OH	caftadr exportgov el industrial honduras ten rest years origin relevant result tpa 80 nicaragua tarifffree subject percent treatment fta republic phased rica exports rules tariffs guatemala caftadr longer costa goods dominican salvador countries eligible products meet consumer neighbors significantly disciplines parties intellectual trade states economic labor electronic investment facilitation united
tVQ0TA	1	OH	brothers peoplesullivan operations madison serving members campaign remained sullivan received actions discouraging 1920 born shakedown navy publicity ship george united 13 family service 1942 subsequent crew commissioning joseph uss enlisted resulted guadalcanal wide iowa brothers combat albert february early policy 1937 tragedy cl52 november francis 1914 states assigned younger waterloo
d0iKKk	2	OH	corps monthly themes preparedness citizen 2011 events communities uniting preparing nation locate login contact council moved page httpcitizencorpsgovnewseventsthemes2012themesshtm andor links update questions bookmarks citizencorpsdhsgov email readygov corps notices disasterhelpgovcitizen plugins home fear register privacy federal faqs femagov citizen widgets act policy dhsgov data foia bulletins annual reports servegov contact bannersaccessibility
zZgfiz	1	OH	neurol ncbi cognition decision primary progressiv pubmed behav making 2012 function web ncbi javascript site warning requires management citation external file generate software cognitive institute ineco egleichinecoorgar neurology aires buenos argentina semantic reallife neuropsychological controls iowa objective aphasia performance condition matched cognitive progressive investigate shed detection perspective advantageous decision crucial
nKPMiK	2	OH	involved corps citizen communities uniting preparing nation locate login contact council moved page httpcitizencorpsgovgetstartedtraininggetinvolvedshtm andor links update questions bookmarks citizencorpsdhsgov email links plugin require plugins page view readygov corps notices disasterhelpgovcitizen plugins home fear register privacy federal faqs femagov citizen widgets act policy dhsgov data foia bulletins annual reports servegov
vuS	1	OH	picture astronomy day fascinating discover featured written image explanation day photograph astronomer cosmos universe professional 11 2012 bright distant earth disk 20 fit easy weeks apogee photographed perigee dark day telescope pacific dense sun asia moon smallest full 300 annular 240 kilometers path super silhouetted filter point image visible smaller
hAl5rh	4	OH	gluten ncbi sensitivity markers celiac biol psychiatry pubmed 2010 dis function web ncbi javascript site warning requires management citation external file generate software school pediatrics usa hopkins johns sheppard research 21204 medicine pratt program fdickersonsheppardprattorg department stanley maryland baltimore increased sensitivity reported schizophrenia inconsistent association gluten immune studies 151 chain
jjHHaH	3	OH	hudno11134 hud notice rights homeownership disclosure announces revised servicemembers protects protecting militaryfederal dependents law disclosure duty civil revised washington housing department announced relief development urban notice form servicemembers emphasizes active dependents rights protected today act military duty foreclosure mandates wartime states active rate including court proceeding mortgage personnel percent valid
Omemy	2	OH	current impact risks introduction monitoring impact frequently asked questions notes operational jpl table earth click impact based system detected potential observations events details full object lists designation sentry future page highly collision earth cases impact unusual monitoring review system continually current detected asteroid iau scans underway results catalog automated analyzed
ybU30W	1	OH	opensource projects image linux single images size pcs desktop environment bigview panning multiscreen multiple cooperate running additionally software zooming work large arbitrary view interactive control code manage environments set distributed functionality basic resources framework observe user services observation applications view software engineering java larc application opensource innovation development field started
wIU7Eb	14	OH	fatty ncbi polyunsaturate nutr pubmed br acidspecific mixed 2010 n6 function web ncbi javascript site warning requires management citation external file generate software nih md usa neurosciences biochemistry section nutritional biophysics bethesda membrane laboratory niaaa chrisramsdennihgov 093 ci statistical specifically ratio 22 95 4 extensive n3n6 increased combination confounding intake
9a4NNI	1	OH	2012 voices recovery month unnoticed people share celebrating broader educate recovery treatment vehicle public sharing voices effort population successes country stories works website story recovery share month stories view prefer city story provide state choose email information post anonymous address remain spreads mental people month message recover contributions recovery positive
b2UtUJ	1	OH	picture astronomy day fascinating discover featured written image explanation day photograph astronomer cosmos universe professional 11 2012 bright distant earth disk 20 fit easy weeks apogee photographed perigee dark day telescope pacific dense sun asia moon smallest full 300 annular 240 kilometers path super silhouetted filter point image visible smaller
cWj8HP	1	OH	web student aid click information additional addition alternate listing format student center braille 18004333243 federal publications aid audio 18004fedaid introduce college student pages web programs federal pay section publications aid application apply web federal section free student pages fafsa publications aid called student loans pages web federal section publications explain
jSNUzQ	67	OH	hsf realtime space human flight data control uptotheminute mission spacecraft path data make sky project applet reside significantly 336 download skywatch cache approximately access internet files 144 downloading 300 sufficient downloaded data 10 hard minutes clear required drive connection nasa time modem kbps updated official responsible amiko curator notices nasa
xrPoHn	1	OH	national memorandum authority delegation defense year section house white 2011 authorization function fiscal act ike president presidential skelton 1235c conferred state union video watch enhanced transparency commitment browse house white logs visitor wait executive actions president obama federal receipt tax federal dollars tax spent people petitions create sign house inside
6w2Jwy	1	OH	proclamation national slavery month trafficking human house prevention white presidential state union video watch enhanced transparency commitment browse house white logs visitor wait executive actions president obama federal receipt tax federal dollars tax spent people petitions create sign house inside white tour interactive house white office press secretary proclamation moments
bmapXM	1	OH	photographs congress prokudingorskii prints collection catalog library online sergei prokudingorskii ca girls peasant mikhailovich 1909 digitized congress library images view display jpegstiffs sergei photographer features color ca library active scientist purchased 1909 images empire 1905 religious surveys distinct photographic people sites photographers subjects mikhailovich ambitious include public undertook sons 2607
twZf5B	1	OH	expansion usda district trail waterville resort pemigewasset ranger nepa service green forest construction valley ski projects peak information nepa fs information contact nh mountain headquarters71 drivecampton national forest white 03223 5366100 603 mountain web national site forest white main expansion mountain peak resort waterville national trail nepa construction green home
tFY855	1	OH	australia image lakes wales menindee day south december image system fed west ephemeral lake blackened mud 186 flowing wales darling 2011 australia north lakes dark tandou kilometers town water river floods amount menindee small freshwater flooding south longest fashion minor surrounding image marked characteristic inland deltas sea ancient patterns apex
dhMYQm	1	OH	eek recycle birds feeder birds ways creative finding youll realize containers nice reuse food completely craft beginning day throw inside times project turn stuff clean activity reusing heres household drawings jug milk bottom create feeders 1 reading bird containers complete models punch water rain instructions drain remember holes clean small
sUzMJS	2	OH	overview exportgov system ccc commerce office chinese area compliance administration trade access source economic department international market requirement impacts certification penalties obtain held implemented border market manufacturing requirements chinese manufacturers system mark 1 catalogue safety exporting covered meeting wide selling government sectors subject customs china exporters compulsory made effective license
ifRMjx	3	OH	federal holidays 2012 6103 observed saturday usc federal schedule note sunday 5 establishes holiday public nonworkday monday friday holidays law employees work falls executive purposes years leave federal pay section legal 1 sunday 2 11582 3a holiday public 2012 monday falls day february january employees 1971 11 treated order specifies
vhjIKe	1	OH	week 123011 house west white wing state union video watch enhanced transparency commitment browse house white logs visitor wait executive actions president obama federal receipt tax federal dollars tax spent people petitions create sign house inside white tour interactive office moments presidents footage year back behindthescenes highlighting week presidential taking
qSSLBl	1	OH	medical encyclopedia balanitis medlineplus foreskin head balanitis swelling inflammation penis poor balanitis caused men hygiene uncircumcised include diagnose viruses skin needed bacteria health provider examination tests biopsy care balanitis fungi respond antibiotic caused depends skin pills bacteria treatment creams occurs diseases steroid balanitis treated option foreskin circumcised back circumcision cases
