xCwBM8	1	UT	house white state union video watch enhanced transparency commitment browse house white logs visitor wait executive actions president obama federal receipt tax federal dollars tax spent people petitions create sign house inside white tour interactive event live facebook discussion participate click member facebook give click questions comments httpwwwwhitehousegovvideo ondemand library
i3ynEc	4	UT	opinions appeals court utah state courts appellate court back opinions case 10 143 ut app mr tr state filed 20120187ca 2012 case 10 141 ut app iverson filed 20110522ca monavie 2012 case 10 parkin 140 federal ut app filed deseret 20120110ca credit 2012 union case 10 ut app filed 20120075ca
qGiT7A	1	UT	information network education usnei information network site usnei education find financial links states recognition information united accredited international frauds students qualifications coming professionals programs foreign avoiding aid institutions information resources providers educators related avoiding accreditation system fraudulent officials recognized international education quality institutions assurance financial links students education abroad information
d0WPNn	3	UT	national site roosevelt historic franklin home search estate captures back library cries home fdrthis fdrs museum hudson visit springwood loved terms started quote president presidential elected considered connection fdr place learn river twitter rooseveltvanderbilt facebook nhs follow flickr week metronorth mayoctober service bus national park days free operates poughkeepsie roosevelt
15V2v	1	UT	energy star home offers products find special energy recycling tax sales exist sponsor proper find special partners based efficient disposal submit encourage offers customers buy star provided incentives rebates credits qualified occasionally search service information products exemptions consumers code energy special zip area find offers star rebates qualified products enter
A3gA2W	1	UT	service monuments national park parks portfolio national parksportfolio cover contents foreword parks monuments acadia canyon bryce caverns carlsbad lake crater grant general glacier canyon grand teton grand hawaii springs hot lassen volcanic mesa verde mckinley mount mount rainier platt mountain rocky seqoia cave wind yellowstone yosemite zion monuments national monument
rDW0nn	1	UT	management emergency strengthen blog year partnerships fema publicprivate comment accordance comments blog moderated policy femas links nongovernment social applications web fema provided reference media companies sites endorse msgdata washington street apply management prepare federal rates homeland department 4fema emergency dc 43362 20472202 sw agencyus security500 6462500text tty assistance step 46275853
xXJccI	1	UT	volcanic natural island hazards sea red december zubair pulse 60 violent rising yemeni sea navy activity helicopter captured video northern 23 began sulfor 40 located edge details eruptions dioxide white 2011 red satellite shallow forming eruption coast middecember reported imagery kilometers satellites revealed explosions recent saba showed island highresolution submarine
xeZzEq	4	UT	giss impacts level national maps nasa world security figure al paper human based s5 health 2012 shindell simultaneously food journal graphics improving change climate nearterm science mitigating interactive load moments installed computer web java note graphics require enabled browser 2050 temperature bc measures due surface increase avoided methane decrease linked
eYHOxU	1	UT	living healthfindergov healthy live sleep learn quick guide connect website hyperlink nongovernmental direct application hhs consistent hyperlinks states services human subject information hyperlinked united application contained health endorsement department website intended provided visitors external constitute applications privacy appearance practices products policies purpose link redirected information usaccessibility privacy mapcontact act policyfreedom
x6WP7s	1	UT	sobriety national park increases checkpoint canyon educates grand safety public awareness search sobriety december national grand park canyon peak checkpoint 28 ariz conducted safety season holiday major deaths national canyon occur plays alcohol wright country role grand safety issue public awareness canyons park holidays ranger traffic wanted raise bill chief
oXblZR	2	UT	king luther national memorial jr martin search love beacon message man conscience equality justice freedom movement app memorial service official park parks mall national memorial movement history man photo multimedia link pages national click mall plan find memorial blossom cherry national parks mall link page emerging fair generation image society
jjHHaH	2	UT	hudno11134 hud notice rights homeownership disclosure announces revised servicemembers protects protecting militaryfederal dependents law disclosure duty civil revised washington housing department announced relief development urban notice form servicemembers emphasizes active dependents rights protected today act military duty foreclosure mandates wartime states active rate including court proceeding mortgage personnel percent valid
w3vQXb	1	UT	full adults malaria text clinicaltrialsgov experimental pfspz vaccine view background objectives safety pfspz test effectiveness vaccine eligibility healthy 18 age 45 years volunteers design malaria promptly develops group receive challenge participants treated control spz successively 312 primary related design defining openlabel falciparum plasmodium 135000 30000 immune administered objectives administration 3
38wVeM	3	UT	founding congress library religion american republic exhibition sections exhibition introduction constituents supported inconsistent religious statesmen 1776 rose exhibition fervor founders vigor freedom practice nation shared republican governments equality alexis public settlers people national eighteenth intensity officials result demonstrates religion state degree men extent tocquevilles revolutionary faith great central revival citizens
xFzZ6E	6	UT	herbert utah governor gary skip navigation jan 11 2012 whats clark house gary washington month replace county economic run st george resigned district selected recommendation snow utahs party congressional appoint appointment herbert lowry earlier utah delegates 74 letter front republican david signed official governor morning large audience summit margin south
wv7Lui	1	UT	political practices california fair commission 18700 fair 18709 improvements staff commission political interested interest input meeting public conflict holding regulations persons relating solicit practices pertaining seeks examining foreseeable generally suggestions materiality including directly analysis involved factors staff nonmateriality presumption reform implementation simplification decision political soliciting improvement interested interest input public
A8GVs5	1	UT	plant multiple ncbi food res pubmed moringa 2007 phytother oleifera function web ncbi javascript site warning requires management citation external file generate software pakistan faisalabad38040 university anwargilaniakuedu department chemistry agriculture tropics roots phenolics distributed compelling treatment rich employed immature activities good combination antiulcer indigenous minerals possess impressive countries quercetin moringa
xVo4QS	8	UT	herbert utah governor gary skip navigation jan 13 2012 resident gary cross county woods weiler todd sen resigned city district 23 lake senate recommended run party today appointment liljenquist dan utah delegates replace republican appointed governor herbert davis salt wellprepared commitment community todds session weiler hit ground legislative service confident
