nCRbpx	1	MD	comparison ncbi cardiology nuclear 1986 br radiol pubmed equilibrium function web ncbi javascript site warning requires management citation external file generate software anterior major wall oblique paper questions considers technique specifically ventricle assessment remaining equilibrium option views successful regional rwm leftventricular give concludes projections pass information nuclear cardiology full problems
xYdQZP	4	MD	v20 ncbi adoption agp genbank obtain valuable evidence convey sequences information 20 ncbi submit version genome switching files assembly users nature gap part linking change 11 submission side affect site ftp specification agp agps list v11 site existing header parsers ftpftpncbinihgovgenomes line ftp agpversion 20 ncbi specification format genomes written
z6WU3B	1	MD	current uscert activity highimpact web current incidents regularly updated reported types summary uscert activity security page frequent multiple apple released updates safari address vulnerabilities products security os code crosssite obtain information perform vulnerabilities privileges elevated attack attacker condition execute denialofservice exploitation sensitive arbitrary operate scripting articles mitigate users ht5281 encourages
yYZmSW	3	MD	benjamin revolution congress library treasures words american franklin honesty dead bright ship conscience leak strokes secret policy oaks christmas good fell sink key continual great small breadth letters words accurate scientist writer long exhibition careers life franklins finished birth inventor politician matter accomplishments tercentenary cartoons achievements achieved books abolitionist broadsides
yRQiwq	2	MD	ri sci ncbi ann lab ldl levels low cholesterol clin pubmed serum 2007 function web ncbi javascript site warning requires management citation external file generate software school tel center medical holon sackler israel aviv medicine internal edith department wolfson university ldl 18157 cardiovascular 24 group morbidity mortality associations increased therapy
xJB5is	1	MD	microbiol ncbi totalgenome sequence multilocus pubmed typing clin 2012 function web ncbi javascript site warning requires management citation external file generate software biology center sequence technical university lyngby analysis mettebcbsdtudk systems denmark department biological gold increasingly developed accurate determine based 29 alleles input ranking combination scientists updates sequencing routine covering
vJiix1	1	MD	hearing hearings senate pensions labor health committee education families subcommittee children 13 december tuesday 1015 2011 senate dirksen 106 building office wabernard hagan bingaman al murray harkin nmpatty whitehouse ct merkley sheldon franken bennet pa tom ri sanders mdjeff ncjeff jr casey kay mikulski richard mn michael iabarbara vtrobert blumenthal
yhhjMR	4	MD	meeting public scheduled human advisory national webinar held sec proposing institutes nhgris usc service reform 42 comments research internal health genome holding internet meeting public nhgri regularly accord amended 281d4 meetings interested reorganization council institute receive individuals 2006 act allowed telephone questions event addition portion participants moderated teleconference meeting free
sVVdyO	1	MD	apod full january aurora sky 3 norway 2012 fascinating discover featured written image explanation day photograph astronomer cosmos universe professional january 3 2012 atmosphere unexpected ago striking sky magnetic results 60 lies stretched airplane rarely viewed complete mountain realm wide space image poles horizontally molecules auroral circle norway aurora higher
rgDdLT	1	MD	rush klondike gold national park historical seattle unit search gold globe national headlines 1897 event unit yukon canada preserves seattle subsequent spreads crucial seattles role telegraph rich strike thousands igniting klondike easy northwestern read park story remote july dreams rush word 17 stampede riches minds historical fields newspaper discover pacific
zhMOL4	9	MD	presidents make healthiest council year 2012 set presidents past council year activity incorporating physical start reminder achieve 2012 nutrition good ability healthiest reflect goals making great 12 lifestyle level healthy age months realistic commit work weight people presidents set council years resolutions fit percent approximately reality report attainable change january
w38yEm	10	MD	mobile pubmed slip night youll ment jun30635463 health nurs 2009 issues box usa psychology wa university washington epederuwashingtonedu 351525 department seattle 981951525 emerging money focus arriving interesting finally positively evening increased males drinking alcoholrelated prepartying night quick endorsed significantly sex frequency college estimated sexual event alcohol subsequent legal research participants
ApFLvg	3	MD	gray united description government image blog wolf usagov fallen states list image minnesota recovery species winter service lake endangered forest fish recently description successful learn great lakes western removed 1998 gray wildlife center science region tree wolf fallen wildlife united flaherty service photo fish states scott responsible comments content hope
wSaGdC	3	MD	erasure fbi crime announcement recovery service malicious internet dhs public files complaint joint center practices ic3 erasing efforts hard cyber zeroing effectively computer determine altered backups disk stole information criminals hide network malicious damage access zeros systems criminal alter greatly files good victims business drives sort wiping restoration makes characters
rMNpE0	1	MD	knowledge cancer 2011 ncbi dermatol pubmed attitudes behavior skin arch function web ncbi javascript site warning requires management citation external file generate software school ma usa hospital 677 02115 boston medicine harvard health brigham department ave huntington womens public customers observation professionals factors cosmetologists suspicious barbers related scalp hair lesions
z5sPXZ	1	MD	jan 13 2012 15 blotter 33rd locationsabout usnonemergency3034413333 streetboulder 803013034413300other address1805 emergency911 boulder 6a1a18 uiheadercolor favorites twitter servicesexclude uicobrand print addthisconfig servicescompact google facebook delicious var ffffff email uiheaderbackground jan 13 friday 2012 rtd juvenile arrested pass elder female broadway id ave shattered police area charge 819 window criminal told
snyQMK	1	MD	named service sawtooth national noaa fisheries entangled whale marine watching photo share photos comments whale submit learn snorkling fishing callosities generally lack raised skin features patches jaw young tail distinguishing black include fin males coast dark world large individuals side upper blue deeply body roughened region larger length strongly named
sC7M7L	2	MD	photo house december white 2011 day state union video watch enhanced transparency commitment browse house white logs visitor wait executive actions president obama federal receipt tax federal dollars tax spent people petitions create sign house inside white tour interactive december house check offices photo picks 2011 white day president house
qWBLhG	1	MD	sec form accurate reviewed information necessarily commission reader complete exchange completethe securities assume determined filing 1 identity issuers information business contact 2 place principal persons 3 related clarification response clarification response industry group 4 size 5 issuer federal select 6 claimed apply exclusions exemptions type filing 7 duration 8 offering
fd1bnN	1	MD	media social 2011 day awareness mental exposed percent children develop young event health traumatic problems adulthood 18 months single 35 behavioral emotional childhood families providers dealing community resilience visit young children trauma learn http1usagoveurfx5 demonstrate adulthood1 exposed ages problem2 persistent psychological single children mental develop percent young event health potentially
vnrjr0	6	MD	great paterson national park falls historical search industrial played national site revolution nations parkhome industries power service role 7 largest interior 2011 jarvis economy ken building spectacular park waterfalls designated falls director key november shaping jon great harnessed americas american salazar 397th secretary twitter sign follow paterson events great falls
6G8BYN	3	MD	wwwnalusdagov library visiting building lincoln abraham beltsville maryland onsite national request library visitors restricts materials review policy agricultural copy loans public welcomes 830 eastern federal friday holidays timemonday 430 pm appointment monday schedule collections830 friday 1200 holidays 100 special federal contact 400 pm 495 national occupies washington library 25north barc
xyLTVp	2	MD	website serving district 5th georgia lewis congressman john congressional search 14 hr bill number search word healthcare phrase homeowner american stand time corner walk people daily reality parents life families america paying georgia sacrificing taxes time country justice injustice threat receive sign updates email office lewis message click issues legislative
zYSmt8	2	MD	ncbi gliadin scand pubmed 2006 gut permeability zonulin gastroenterol function web ncbi javascript site warning requires management citation external file generate software division biology mucosal md center nutrition gastroenterology university school usa research celiac pediatric medicine maryland 21201 baltimore gliadin epithelial zonulin investigated barrier mechanisms effect crosses signaling interaction cells
uvAxwo	1	MD	peerx downloads nida teens downloads abuse outfitted prescription tools word drug dangers classmates drugs dangerous posters print prescription friends decisions networking buddy icons make sites ims social smart peerx message ironons peerx message stickers perfect dangers prescription abuse show wallpaper drug helping computer avoid teens dedication enable icons share javascript
awLqXJ	2	MD	fda regulates veterinary devices surgical kits principal machine treatment include achieve dependent reagent food affect including related invitro examples apparatus federal xray conditions body dental component diagnostic contrivance article metabolized drug act action implement instruments cosmetic thereof appliances instrument mitigation structure function prosthetic part animals syringes devices similar purposes cure
wICmQR	5	MD	closest dione mission solstice cassini flyby images home image details instruments dione pass surface visible primarily images flyby carthage moon spacecrafts camera moons image higher cassini earlier intended closest cassinis encounter 2011 obtained narrowangle 12 light yield flybys dec resolution linea dione 1123 top 698 epimetheus 113 cassini 86 image
AkOhio	1	MD	jan 18 2012 blotter 33rd locationsabout usnonemergency3034413333 streetboulder 803013034413300other address1805 emergency911 boulder 6a1a18 uiheadercolor favorites twitter servicesexclude uicobrand print addthisconfig servicescompact google facebook delicious var ffffff email uiheaderbackground contacted 1200 13th aggressive degree resisting police charges arrest peace causing suspect customers kicked business 300 problems reported 21yearold obstructing man arrested
r49Ffh	1	MD	status sra ncbi sequence read archive continuation partnership primary sequencing planning japan archive announcement funding ncbi subsequent support due archives international european nih enable part bioinformatics phase provided data organizations february sra dna database institute 2011 submitted continue nihs shared operate highthroughput constraints institutes archive large managing nih sequencing highthroughput
AujeGX	1	MD	house helping american succeed businesses address white weekly state union video watch enhanced transparency commitment browse house white logs visitor wait executive actions president obama federal receipt tax federal dollars tax spent people petitions create sign house inside white tour interactive stamped states united hes steps sold made ensure president
xftVG8	9	MD	apod star january factory 18 cygnus workings nearby 2012 fascinating discover featured written image explanation day photograph astronomer cosmos universe professional january 18 2012 infrared colors disperse winds galaxy astronomers swan sky prominently collide bubbles years entire lies cygnus large night translated telescope humans inflated constellation blue dense space sun
yBiopj	1	MD	task processing force visitor travel executive foreign white visa goals house establishing order competitiveness state union video watch enhanced transparency commitment browse house white logs visitor wait executive actions president obama federal receipt tax federal dollars tax spent people petitions create sign house inside white tour interactive house white office
y1IsRC	4	MD	v20 ncbi adoption agp genbank obtain valuable evidence convey sequences information 20 ncbi submit version genome switching files assembly users nature gap part linking change 11 submission side affect site ftp specification agp agps list v11 site existing header parsers ftpftpncbinihgovgenomes line ftp agpversion 20 ncbi specification format genomes written
9arQHN	2	MD	programmable energy star thermostats star energy products thermostats home programmable find partners partner energy thermostats year spends 2200 180 cooling setting programmable save household properly half maintaining settings average homeowners heating bills preprogrammed summer thermostat asleep home regulate temperature make helps easy programmable save offering homes winter settings thermostat money
wKCGGN	2	MD	betelgeuse enormity scale candidate approximately black stars size star aware hole larger betelgeuse 10000000 sequence betelgeuse 100000000000 estimated 100 galaxy suggest masses approximately 1 billion1011 stars crude main greater started lives supergiants estimate 30 times massive sun similar spend held bright galaxy layers outer spite possibly 50 naked small underwent
zVFWHn	1	MD	ncbi hiv med mhealth pubmed synergy workshop afr report 2011 pan function web ncbi javascript site warning requires management citation external file generate software medical microbiology nairobi kenya department manitoba university emerging cdc agreed global held follow coordinating retention unanimously based personal treatment policy 2011 hiv regional scaling framework therapy
yeMZZu	2	MD	climate utilities water ready epa content area jump main navigation contact water climate sector sea impacts contribute challenges weather stormwater quality availability temperature complex health potentially public rise pose utilities water environmental sustainability shifting significant drinking precipitation change extreme climate missions scenario level fulfilling implications events patterns resulting runoff wastewater
ylwePm	1	MD	ncbi overexpression yin rev pathogene pubmed 1 oncog yang crit 2011 function web ncbi javascript site warning requires management citation external file generate software cancer genetics usa microbiology los medicine molecular jonsson comprehensive department california bbonavidamednetuclaedu school immunology center university david angeles geffen childrens proposed lymphocytic resistance aidsrelated pathogenesis multiple
A1MDU3	2	MD	coral virgin reef monument islands national search reefs lands system mile belt federal support complex virgin 3 health mangrove john survival contribute shoreline forests waters monument includes reef ecosystems island coral segrass st beds diverse submerged islands life habitat crustaceans fish worms marine grow homes form mollusks create corals colonies
wxJUgi	1	MD	galileos journal multimedia system exploration solar gallery galileos journal 1610 jan 7 date sketches named planets ganymede callisto jupiter io earth theory system 1610 5 moons discovering discovery amb europa update jul understanding orbiting demise solar universe galileo galilei 2011 discovered made center sunlast january orbit planet popular led galileo
eUByyb	1	MD	school house washington high tennessee booker memphis white state union video watch enhanced transparency commitment browse house white logs visitor wait executive actions president obama federal receipt tax federal dollars tax spent people petitions create sign house inside white tour interactive adobe player flash content download view domain 20 311
uy9iwF	1	MD	webb james telescope space join problems challenge nasarelated rwiw engineering nasa design realworldinworld solve nearing designs 27 end rwiw 2012 website completed realworld phase posted challenge january realworldinworld phases challenge rwiw webb telescope process related grades design mentored leader space selected virtual 2 setting resources students robonaut 712 realworld student
wJKNXv	1	MD	100 trilogy respironics ventilators recall class 11 october initiated recall date 2011 product 30 april manufactured trilogy february ventilators 1 100 2011 ventilator home hospitals nursing support trilogy ventilation health breathing weighing intended continuous respironics ventilators adult 100 care 11 homes intermittent require pounds patients pediatric mechanical settings serial numbers
p36qT	2	MD	information source reliable find healthfindergov health services website hyperlink nongovernmental direct application hhs consistent hyperlinks states services human subject information hyperlinked united application contained health endorsement department website intended provided visitors external constitute applications privacy appearance practices products policies purpose link redirected connect home library questions care center doctor health
kgo4vL	1	MD	sra ncbi repositories update future trace plans interim committed staff current working addition due 2011 form discontinuing read handling sequencing october repositories budget continue highthroughput grantees subset sequence generation institutes archive develop 1 widely approach announced nih recently trace plan funding data sra ncbi archiving constraints foreseeable existing institutes archive
tBVDiC	1	MD	2055 hr house white statement president state union video watch enhanced transparency commitment browse house white logs visitor wait executive actions president obama federal receipt tax federal dollars tax spent people petitions create sign house inside white tour interactive house white office press secretary consolidated operation 2055 today 2012 government
xXJccI	1	MD	volcanic natural island hazards sea red december zubair pulse 60 violent rising yemeni sea navy activity helicopter captured video northern 23 began sulfor 40 located edge details eruptions dioxide white 2011 red satellite shallow forming eruption coast middecember reported imagery kilometers satellites revealed explosions recent saba showed island highresolution submarine
w5gPSk	1	MD	taking voice care national health institutes voice homehealth speech languagetaking infovoice care page fingerprint rely disorders long prone diseases demands doctors unique day experiencing individuals teachers believed voice people nurses sales voices persuade connect avoided speakers make public lawyers million problems 75 singers care great taking inform top upper cancer
zNbU1s	1	MD	engl ncbi int ed graphene oxide pubmed nanoparticles chem angew 2012 function web ncbi javascript site warning requires management citation external file generate software waurn 3216 fiber centre university material vic australia innovation deakin ponds activity browsing empty recording activity turned recording turn back information usa 20894 center pike rockville
w4Wqfe	2	MD	garrett scott congressman news composed senate house washington states legislative united federal representatives 3 branch hundred meeting twelfth 2013 scheduled congress government dc 2011 january meet nearest office scott click electronically garrett visit location online details page contact congressman est fax 202 hob office washington rayburn dc 2259048 hours phone
8ZTR7S	3	MD	blind 11 perform white boys house alabama state union video watch enhanced transparency commitment browse house white logs visitor wait executive actions president obama federal receipt tax federal dollars tax spent people petitions create sign house inside white tour interactive adobe player flash content download view february 09 2010 240
hHJOXn	1	MD	champions house white change state union video watch enhanced transparency commitment browse house white logs visitor wait executive actions president obama federal receipt tax federal dollars tax spent people petitions create sign house inside white tour interactive mscaption textindent9000px 308px msdetail top top0px height norepeat 9999 349px positionabsolute left495px zindex
