wAO5RR	1	MD	19 january national update thursday situation fema 2012 information warnings west region effect watches remain advisories wwwwrhnoaagov numerous latest heavy flash series move pacific wyoming mountains saturday montana northern amounts coasts cascades copious 3 low moisture 6 flooding idaho systems rainfall heaviest inches utah oregon coast pressure carrying california snowfall
zGevyz	8	MD	tests gluten ncbi sensitivity pubmed clin serological 2011 gastroenterol function web ncbi javascript site warning requires management citation external file generate software italy hospital st medicine clinical orsolamalpighi bologna department university compare gs gluten sensitivity characterize serological pattern disease celiac found gs spectrum entity markers disorders clinical glutenrelated recently lacking
zbGq77	1	MD	apod mars 28 unusual february 2005 plates fascinating discover featured written image explanation day photograph astronomer cosmos universe professional february 28 2005 atmosphere interpretation similarity waterice years spacecraft agencys covered indicating photographed express caps oddly filling martian sea space ice current poles flowed orbiting correct fractures recently million craters water
xKqrO6	1	MD	tax pipeline cut temporary xl provisions house memorandum payroll act implementing white keystone continuation 2011 relating presidential permit state union video watch enhanced transparency commitment browse house white logs visitor wait executive actions president obama federal receipt tax federal dollars tax spent people petitions create sign house inside white tour
zOPEIE	2	MD	v20 ncbi adoption agp genbank obtain valuable evidence convey sequences information 20 ncbi submit version genome switching files assembly users nature gap part linking change 11 submission side affect site ftp specification agp agps list v11 site existing header parsers ftpftpncbinihgovgenomes line ftp agpversion 20 ncbi specification format genomes written
Abjjlf	5	MD	colleague amendments amended provide guidance act legal standards dear letter ada department education issues office civil issued elementary americans questions dear amendments requirements additional provide guidance ada department 504 ocr today colleague faq educations made letter schools frequently secondary document rights disabilities accompanying rehabilitation act section asked laws commitment full
wOrD0s	1	MD	ncbi immunopharmacol int lenalidomide pubmed 2012 function web ncbi javascript site warning requires management citation external file generate software national eshannonhrsagov human rouge usa la administration research state health branch department louisiana resources hansens lab baton services 70803 programs university disease pokeweed urine skin modulate blocked equimolar group lesions treatment
i2Aq0C	1	MD	institute management emergency 12 2010 october developed revised states agriculture lessons united group objectives administration compliant ics learned nims national wildfire emergency fire reflect collaboratively department coordinating 100 emi institute 2006 release management successfully purposes review note version equivalent updated completed is100a is100b courses credentialing is100 9 august 2010 features
cjYwfD	1	MD	schedule wsdot ferries dockbound viaduct wednesday 0835 510the jackson marion construct entering close 5 impact driving offloaded drivers due thursday access exit 9 terminalawv utilizing 2012 activities customers colman 7 awv pmseattle southbound underneath dock construction traffic western northbound affect change diverted yesler 10 alaskan university vehicles overnight exiting street
bREk8i	1	MD	government house executive contracting white order economy state union video watch enhanced transparency commitment browse house white logs visitor wait executive actions president obama federal receipt tax federal dollars tax spent people petitions create sign house inside white tour interactive homeowners refinancing house twitter responsible answers hours brian office questions
jdVhyd	1	MD	united army states secretary unified limited committed soldiers obama transformation resources continues shaping solution establishing lasting force house challenges defense afghanistan adaptive approach strategies foundation business continuing leadership civilians put path country longterm renew resourcing improvements army positive support strategy confident war fiscal enable part understand goals effort colleagues developing
fabQ9F	1	MD	house white april photo 2011 day state union video watch enhanced transparency commitment browse house white logs visitor wait executive actions president obama federal receipt tax federal dollars tax spent people petitions create sign house inside white tour interactive house check april offices photo picks 2011 white day president people
w4N6QC	1	MD	younger pat ncbi initial pubmed therapy blood comparative outcome 2012 function web ncbi javascript site warning requires management citation external file generate software danafarber ma usa cancer institute boston medical 02115 oncology 450 brookline annlacascedfciharvardedu ave focus years aggressive centers progressed 25 lymphoma 20 21 parameters progressionfree 29 treatment fractionated
hX1yVe	12	MD	federal holidays 2012 6103 observed saturday usc federal schedule note sunday 5 establishes holiday public nonworkday monday friday holidays law employees work falls executive purposes years leave federal pay section legal 1 sunday 2 11582 3a holiday public 2012 monday falls day february january employees 1971 11 treated order specifies
cuKW1K	1	MD	audio congress interviews slavery library days american memory voices center folklife american collections view classroom collection connection teachers resources stories slaves reflected years americans coercion spoke interviews 1930s time presentation families 1860s early twentythree lives enslavement documented discuss presented slavery 1823 individuals slaveholders states born living end recorded note learned
ipgl7l	2	MD	nida videos peerx choose path teens interactive learn clip confront video facts reallife decisions myths end situations make separate character scenarios lets call choose role main youll play drugs drug step abuse path teens include prescription assume choices common shots activity outcome decision interactive selection dont clip ending video path
d0iKKk	1	MD	corps monthly themes preparedness citizen 2011 events communities uniting preparing nation locate login contact council moved page httpcitizencorpsgovnewseventsthemes2012themesshtm andor links update questions bookmarks citizencorpsdhsgov email readygov corps notices disasterhelpgovcitizen plugins home fear register privacy federal faqs femagov citizen widgets act policy dhsgov data foia bulletins annual reports servegov contact bannersaccessibility
dytndO	2	MD	information service medicare screening cholesterol preventive cardiovascular control heart campaign prevent national talking stroke aimed cardiovascular video doctor cdc centers preventing start attack health today screening reaching strokes million watch free important medicaid goals services care attacks disease medicare learn hearts cms lipid fat screenings covers medicare blood cholesterol years
yvo8sT	1	MD	apod 21 sun june solstice 2007 stars fascinating discover featured written image explanation day photograph astronomer cosmos universe professional june 2007 21 summer todays suns accurate bright superimposed 26 sky astronomical images exact atmospheres february gada view series proper planet scale sun m35 surrounded recorded daytime moon shows full ability
w62eko	2	MD	10988 50th executive aflcio anniversary director offices berry remarks opm john order january 17th 2012 delivery prepared set bargain executive years collectively cooperative service federal unions pen president inaugurated ago kennedy employees 50 era time organize order simple executive idea founded profound work 1962 order achieve revolution trace idea seat
A7Gd4g	1	MD	fda professionals boxed contraindication brentuximab drug vedotin warning safety adcetris healthcare podcast todays topic warning information brentuximab safety adcetris division narrator boxed contraindication vedotin podcast fda professionals drug healthcare division communication navin information additional provide lesley safety officer consumer august issued due brain warning result pml precautions leukoencephalopathy risk multifocal
xeZzEq	1	MD	giss impacts level national maps nasa world security figure al paper human based s5 health 2012 shindell simultaneously food journal graphics improving change climate nearterm science mitigating interactive load moments installed computer web java note graphics require enabled browser 2050 temperature bc measures due surface increase avoided methane decrease linked
zTxpze	1	MD	sec form accurate reviewed information necessarily commission reader complete exchange completethe securities assume determined filing 1 identity issuers information business contact 2 place principal persons 3 related clarification response clarification response clarification response clarification response clarification response industry group 4 size 5 issuer federal select 6 claimed apply exclusions exemptions
s3GaiN	5	MD	web mount longmire park camera rainier national search building longmire entering administrative road southwest web cameras mountain east west visitor center range tatoosh camp muir quality air read park historic corner nps renowned longmire rustic located architecture southwest webcams read mount rainier 700 states elevation thick 48 glacier section rainiers
10AQ7M	1	MD	leave benefits labor topic fmla department find documentreadyfunction whelpfulinitfbcontent states department united labor family maintained year group health weeks fmla 12 benefits medical leave unpaid jobprotected act requires employees family reasons accommodate employment responsibilities fmla seeks interests men employers designed promote opportunity legitimate women employees work equal leave unpaid reasonable
4W5VCG	1	MD	altern toxins ncbi med complement 2002 chemical pubmed hypothesis exp function web ncbi javascript site warning requires management citation external file generate software group scotland university stirling research environmental health paulabhthegartcouk occupational livestock actions held paper human synergistic children synthetic explain environment production usage decades food hormones induce possibly effects
wVon3z	1	MD	conversions rollovers reporting roth 2011 2010 topics retirement plans community irs resources 2010 conversions rollovers tax report return income 2011 2010 half taxable amount 8606 20a conversion distributionsif distributed ira 2010 form part report line 2011 roth amount 8606 inplan rollover retirement distributed ira 2010 form 25a part plan report
zFfMPC	1	MD	eating disorders ment reach ncbi pubmed health online counselling 2012 function web ncbi javascript site warning requires management citation external file generate software center heidelberg university research germany psychotherapy hospital results group system disorders proportion late treatment attitudes 674 facilitated suffering background half email individuals andor ed index access participants
hAbWa2	3	MD	service mlk day project find receive mlk updates inbox mlkday follow twitter interests dont tools find toolkits create project tips widget mlk search site day ensure social date follow networks mlkdaycnsgov include serve additional opportunities official national accessibility community usagov fear privacy federal corporation notices website government site foia service
zyOVWU	2	MD	gpm gcpex notes field experiment precipitation blogs coldseason 29th global snowfall overarching multifrequency algorithms data estimate canada gpm ontario goal precipitation snow microwave environment experiment observations cooperation coordinated falling improve remote 2012 ability measurement collection detect passive active 17th sensors unique model coldseason february datasets gcpex characterize january seek microphysical
bqQsQp	1	MD	apod january aurora 29 iceland 2006 volcano fascinating discover featured written image explanation day photograph astronomer cosmos universe professional january 2006 29 volcanos erupting fortuitously volcanoes caused auroras visible band earth 20 damage causing overhead erupted auroral millennium minor systems ago iceland explanation time eruption occurred lava solar kilometers world
9E4920	1	MD	products energy star find home energy products find star energy performancebased determine category develop efficient label program main star specifications goals earn products meet energy revised market relevancy efficient make current products energysaving conditions designs move star specifications differentiate periodically strive doe ensure epa star specifications energy products suspended room
xtzWut	1	MD	resource nida families 17 navigate national nih health helps institutes january release addiction 2012 news options treatment links related bookmark share developed national hard choosing questions institutes information nidas service program health treatment online struggling nida families drugpubs seeking free abuse part copy addiction resource institute drug public individuals researchbased
icUgCj	1	MD	federal advisory rate committee prevailing advisory code office iv states rate committee united title federal personnel administration system subchapter rates 5 establishment advises director matters management opm chapter pertinent governmentwide fprac employees 53 bluecollar pay studies prevailing director fprac members opm appointed management labor chairman force defense seats navy staff
uGYJrZ	5	MD	autoimmune diseases ncbi allergy rev pubmed gut clin leaky immunol 2012 function web ncbi javascript site warning requires management citation external file generate software md biology center usa university school research mucosal medicine maryland 21201 afasanombrcumarylandedu baltimore underlying innovative neuroendocrine disorders tight susceptible controls intercellular equilibrium diseases nonself impaired loss
tO4ZsR	1	MD	living healthfindergov healthy live adult shots learn quick guide booster connect website hyperlink nongovernmental direct application hhs consistent hyperlinks states services human subject information hyperlinked united application contained health endorsement department website intended provided visitors external constitute applications privacy appearance practices products policies purpose link redirected information usaccessibility privacy mapcontact
18NZ4l	1	MD	summaries drug foia 5141e sponsor summary drug information 21 basis federal cfr support administration forms agencys safety effectiveness foi summarizes fda food nada published released approval supplemental accordance freedom register submitted original section indications foi explained general supplementary supplement human summaries information basis agency administration finally approved recommended pivotal safety
z81PvZ	2	MD	management emergency share ideas blog future fema coop outbreaks zombie yeah bad zombies fake walking people martial deem contaminated huge depends zombie law quarantine pandemic zombies declare mission calvalry planning scott frisco access style somthing mumbai homeland include local nation worst closely day areas summit large meciacal quick security enforecement
kBW8my	1	MD	nws positive jetstream negative lightning side cloud ground transfer section negative forms charge describes previous thunderstorm base negatively region lightning called charged upper previously high carry cloud ground anvil transfer top negative forms charge parts subsequent stepped leader bolts thunderstorm descending net originates resides scenario region streamers lightning positive cirrus
eOQfZi	1	MD	ncbi characterization microbiology escher pubmed asymptomatic genomic 2011 function web ncbi javascript site warning requires management citation external file generate software md school usa institute university sciences genome medicine maryland 21201 baltimore urinary commensal results sources identify pane coli enteric gastrointestinal pcr similarity distributed exclusively laboratoryadapted treatment hybridization sequencing neobladderspecific
hZjdDi	1	MD	information center cpsc carbon monoxide colorless killer gas invisible carbon monoxide poisonous odorless called 150 people related states appliances year stoves heaters fireplaces fuelburning unites include nonfire accidental improperlyused furnaces water faulty incorrectlyvented die products poisoning consumer shed portable family kill home generator generators doors vents basement windows inside garage
9lcG6i	1	MD	survey site satisfaction questionnaire feedback web service read improve customer short completing additional submit email healthfindernhicorg comments questions respond displays 200 suggestions hhs including reviewing aspect ave estimated comments information reducing 23 agency valid conduct public independence omb washington reporting dc collection number control burden estimate response instructions clearance 20201
cxBdE	1	MD	national valor pacific ii monument world war search national japanese pacific ii americans japan occupation preserves battles pearl valor internment interprets events aleutians world harbor war stories monument including arizona memorials 50th commemorate hosted valr check memorial list anniversary day uss events 2012 restore arizona 50th generation contributions day memorial
sYqO8i	1	MD	med engl ncbi prepubertal gynecomastia lavender pubmed 2007 linked function web ncbi javascript site warning requires management citation external file generate software developmental biology triangle usa reproductive sciences institute section nc park research environmental health receptor toxicology 27709 laboratory national steroids caused human gynecomastia conclude topical oils endogenous antiandrogenic resolved
tSRNJb	1	MD	management office federal register documents personnel home page additional links amending partial office general county chabot george localities information joann grant federal personnel political add hatch residing 202 restrictions act designated virginia regulations united regulatory opm king counsel 6061700 exemption employees list states contact activity management agency executive services single
rmCaLN	1	MD	1995 ncbi circulation di magnetic coronary pubmed imaging artery resonance function web ncbi javascript site warning requires management citation external file generate software netherlands cardiology university leiden department hospital magnetic years differentiation cardiovascular visualization arteries technique thickening potential accurate infarcted tests increased spatial early effects artery inducible outweigh bypasses inherent
JJgjA	1	MD	congress nominate national preservation registry films library film board mandating consulting inclusion december national suggestions preservation select experts reviewing plan library alternates established pl110336 end implementation 44 extensively 1988 passage film heritage films save public announced board reauthorization extended recently congress 25 continuing authorizes registry members librarian law 2008 sound
2hfrTC	1	MD	missions national park antonio historical san search 10000 unseen people spanish mission years entering drought accepted deadly pledged mexico attack cultures texas foreswore life north diseases king survival raided early fealty lives lay apache 1700s traveled distance allknowing missions traditional lingered god found south rescheduled september cancelled activities good things
yJCTEu	4	MD	description proposed organization nhgri division office functional includes director intramural principal extramural research current offices components organization nhgri office functional including carry research responsibilities activities includes director behalf divisions institute offices oversees advisory managers council played meetings intellectual single grants human comprises organizing genomics functions management field provide review opportunities
zff79g	1	MD	prevalen ncbi schizophr evidence symptoms psychotic pubmed bull 2012 function web ncbi javascript site warning requires management citation external file generate software 3508 netherlands interdisciplinary university social utrecht science department tc depressive psychosis disorders assumed hand evidence updating recent anxiety demarcation clear lines commonly suggests principle illness symptomatology andor presence
bKCzpO	1	MD	web student aid colleges financial community grants repaid click universities requirements additional variety federal review program details grant offer students attending schools loans unlike career fouryear page quick aid eligibility financial grants apply based application federal submit read listed fafsasm eligibility free student factors aid page program undergraduate certificate pell
AhKRv0	1	MD	climate ccep 12523 ccepii partnership nsf12033 nsf ii phase program questions cce frequently education asked change 12033 nsf climate 12523 ccepii partnership nsf ii phase program questions cce frequently education asked change ccep incorporate advisory developed results planning impact chosen opportunities demonstrate theme program formative board include resources stakeholders colleague
w5YbGu	1	MD	transportation national ntsb safety board news events work council outstanding year month states coordinator guard national contributions fame recognition united service recreational boating safety public hall march commendation mr award coast ntsbs received bill 2010 time gossard distinguished perseverance work mandatory requiring hard reduce years improvements including education children initiatives
ou2TaG	4	MD	states adelphi united army dayread adelphi work center bring celebrated 26 lab month april child military army uso ann materiel duringmore commander command honored dunwoody gen md army science proving 50 technologymore senior aberdeen ground santos major headquarters ronald master sergeant armymore asians month pacificmore american asianpacific heritage celebration encouragingmore
xuANrf	1	MD	20 drains clear watch jan storm branches falling shelters waking challenges commute including roads friday opened urged service mix snow ice covered assist rise power bus continues rain weatherrelated fall day warming king sleet region work county telecommute outages slippery temperatures caution residents reduced lines make slow downed travel ice
t6VKyt	1	MD	antibodies ncbi gliadin pubmed clin deamidated 2011 gastroenterol function web ncbi javascript site warning requires management citation external file generate software finland centre university helsinki tampere pediatric research gliadin predict mucosa negative earlystage dgpaga deamidated forthcoming serum autoantibodies villous damage transglutaminase hypothesized 2 widely stage patients followup peptides diagnosis normal
17d7Xm	6	MD	apod space sun 30 2008 station international transits july fascinating discover featured written image explanation day photograph astronomer cosmos universe professional 2008 30 july timing umbra earth previous transiting front central decades humanity real penumbra dark lighter fewer activity individually surrounding dawn machines sunspots space sun recorded current international contrast
AnkFiD	4	MD	acad sci ncbi resistance pubmed insulin cellular natl 2009 proc function web ncbi javascript site warning requires management citation external file generate software australia street institute medical klh8stvirginiaedu darlinghurst research program 384 nsw garvan obesity victoria 2010 diabetes caused resistance poorly rapid rapidly parameters production defining superoxide results uncouplers cellular
8YHa1y	1	MD	laboratory science cruise configuration mars void spacecraft cruise delivers stage space carries mars atmosphere 880 rocket cruise surface design planets carry laboratory rover pathfinder space system mars vehicle kilograms 400 communicate entry blast stage missions pounds science launch exploration weigh stages similar approaching precise site xband spacecraft computer cruise controllers
wh37d3	1	MD	management emergency share ideas blog future fema coop outbreaks zombie yeah bad zombies fake walking people martial deem contaminated huge depends zombie law quarantine pandemic zombies declare mission calvalry planning scott frisco access style somthing mumbai homeland include local nation worst closely day areas summit large meciacal quick security enforecement
zSMJAh	1	MD	mheal ncbi matern analysis delivery pubmed health child 2011 special function web ncbi javascript site warning requires management citation external file generate software authorhitlaborg room usa healthcare lab ny 410 york 3960 innovation broadway technology 10032 operations feedback increasingly themes innovative previous access slow encompasses methodically presents adoption systems policy
zgX8c9	1	MD	house helping american succeed businesses address white weekly state union video watch enhanced transparency commitment browse house white logs visitor wait executive actions president obama federal receipt tax federal dollars tax spent people petitions create sign house inside white tour interactive stamped states united hes steps sold made ensure president
mXPpr	3	MD	bio astronaut aldrin buzz colonel usaf ret phd nasa astronaut buzz aldrin family born children comprised 20 personal combined grown phoenix cannon sons lois data driggs daughter grandson january married 1930 montclair jersey colleges cambridge point universities high manned astronautics thesis education technology aldrin graduating united west guidance doctorate degrees
