zpMNgP	1	UT	inmate andriano 191593 frequenting bars discreetly discontent andrianos poisons obtain engaging cease poison ordered insurance researched affairs resentful business profit began separate extramarital responsibilities policy scheme life increased allegedly pose death effects andriano friends working ill wendi kill hatched asked husband psychologically physically observed andriano abuse signs claimed friends abused
yXUDgV	1	UT	load strength targeting ncbi res gluteal pubmed cond low exercises 2012 function web ncbi javascript site warning requires management citation external file generate software jcrowessendonfccomau school australia trobe university la melbourne physiotherapy protocol results limbs group 22 vibration smith platform detected production gmp warrant greater matches countermovement competing immediately condition
Gzu9Ot	3	UT	stress mission solstice cassini enceladus images home image details alexandria focus tiger stripe images sulcus directorate jpl developed cassini washington mission manages cooperative laboratory technology assembled orbiter jet space propulsion agency pasadena european division cassinihuygens dc nasas california designed institute project nasa science italian information httpwwwnasagovcassini visit mission httpsaturnjplnasagov cassini
yUzuQt	24	UT	march house photo white day 2012 state union video watch enhanced transparency commitment browse house white logs visitor wait executive actions president obama federal receipt tax federal dollars tax spent people petitions create sign house inside white tour interactive house 2012 check offices photo march picks white day 30 force
43f0cO	10	UT	national cave jewel monument search passages wilderness color appeals human revealed wealth national remains service cave formations surveyed underground maze mystery lure scientific park glimpses longest curiosity world 160 explorers resource immerse fragile jewel brilliant miles splendor mapped national gearing planning excellent exciting trip resource chronicle cave jewel monument calcite
u1FrL1	1	UT	promises failing privacy consumers charges settles ftc facebook deceived promises proposed consent agreed obtaining private trade including settlement information networking service federal make commission future notice shared allowing public facebook repeatedly telling prominent made consumers settings charges established privacy giving express settle steps social lives requires clear deceived promises ftcs
yZ302b	1	UT	antibiotic impacts administra longterm ncbi ecological pubmed 2007 isme function web ncbi javascript site warning requires management citation external file generate software institute medicine sweden stockholm department laboratory karolinska restriction selection disturbances sequencebased trflp years stability clones human gastrointestinal impact group monitor pcr temporal technique terminal potential treatment samples returned
wmELwr	1	UT	inmate delahanty 242703 shot avenue police window sped instantly sitting christopher intersection presented arrested gun officer force back seat seconddegree result plead cactus driving men days license conceal guilty david turn conducted testimony asked road striking uribe vehicle head murder testified 31st effort lunged 10 stolen abandoned car passenger plate
wUo51M	1	UT	product north agencies poison american safety team prevention mexico national washington cpsc states canada united anniversary poison commission safety marks call week product march 50th attention dc counterparts teaming dangers 1824 unintentional poisoning consumer prevention cpsc committed canada working commission federal agency dispose health choose mexicos potentially week harmful protection
fCnjhO	1	UT	wildlife national laguna atascosa refuge map google address directions refugewmd google maps window opens warranty note service personal visit assumes risk made policies providing guide reusing usability control domain fish site general check information driving feature content conditions provided user directions wildlife route leaving expeditiousness representation road feed irrigation year
Ag4d7	3	UT	apod october 16 2006 saturn shadow fascinating discover featured written image explanation day photograph astronomer cosmos universe professional october 2006 16 discovered bright earth scattering giant saturns main spectacular outermost dark shadow saturn spacecraft night side view unexpected hard back eclipsed pale blue sun rings moon orbiting newly recently hours
zD8g2C	8	UT	garden devils ut facility recreationgov details campground remarkable towering color balanced high surrounding wildflowers formations campground concentration assortment landscape summers unusual stands area arid pine winters environment hot yucca national red 2500 creating juniper utah complement pear landforms pinyon small fins spires forested world flowering highest desert vivid cold cacti
qO22	2	UT	return tax free preparation volunteers topics individuals irs resources programs assistance irs tax qualify elderly taxpayers offer free income counseling tce vita volunteer neighborhood people credit filing tax locations elderly disabled located irscertified malls return vita electronic centers special 50000 taxpayers provide convenient make generally sites libraries returns program income
GBZVpp	2	UT	states patent united 8141075 operations desktops servers poweroff fashion vms management addition desktop automate suspension include engine triggered possibly controlling condition timely timebased virtualized maintained plurality policies logon migration manages systembased process operates contingent virtualization scheduling operation event machines physical established provide virtual events infrastructure ability includes user organization changing
e8HTWd	1	UT	supplementa ncbi int osteoporos calcium pubmed effects 2011 cardiovascular function web ncbi javascript site warning requires management citation external file generate software zealand sciences medical auckland medicine health faculty department university ireidaucklandacnz show reductions sources including cardiovascular based density receptors health placebocontrolled increased food introduce effects prespecified preferable benefit coagulation
zZ1zsG	1	UT	inmate cropper 091432 lumley committed perryvillesan murder throat brent cell juan response inmate unit 7 department contraband knife arizona march stabbing cropper murdered locked 1997 place officer corrections found shutts miller marshall steinle sentencing defense richard robert heilman start 3 joseph roland 6 colehon john resentencing plea honorable judge 2
wL5Djv	1	UT	apod march 18 jupiter earth venus 2012 fascinating discover featured written image explanation day photograph astronomer cosmos universe professional 18 march 2012 sunk bright earth photographer sky degrees background world conjunction red venus humorous jupiter close creative lights approach pictured szubin pose notable daughter horizon striking image traveled visible brighter
zCaLwp	8	UT	apod scale march 12 universe interactive 2012 fascinating discover featured written image explanation day photograph astronomer cosmos universe professional 12 march flash player version recent adobe 2012 bring human galaxy flash proportion window spread discovering humanity descriptive familiar stop speckled possibly items smoothness vast bar sizes large small version ten
wJPcoM	1	UT	inmate 057713 ellison opinions handsproceedings charles victim committed previous 24 death pecuniary smith tape pending judge february lillian january verdict release vincent homicides direct depraved defense home richard robert moon masking appeal arizona choked conviction trial published bound commission convicted start joseph cords prosecutor suffocated telephone heinous gain broke circumstances
xuIjOO	5	UT	catalog page pia15256 named queen year constellations infrared states visible featured images galaxy ancient northern greek section night sky ethiopia explorer degree united cepheus cassiopeia nasas expanse mosaic king enormous wise 1000square widefield survey milky mythology obscurity infrared bright human millions story eye takes unaided sky stars fade cassiopeia wise
x3xKr9	1	UT	med volumetric ncbi analysis sex pubmed urethr vascular 2010 3d function web ncbi javascript site warning requires management citation external file generate software italy reproduction gynecology studiorumuniversity pathophysiology mater massarenti human bologna department cesarebattagliauniboit alma gspot controversial existence space urethrovaginal threedimensional evaluate ultrasonography structures anatomic 3d color underwent ii orgasm
w8wz	3	UT	picture astronomy day fascinating discover featured written image explanation day photograph astronomer cosmos universe professional 11 2012 bright distant earth disk 20 fit easy weeks apogee photographed perigee dark day telescope pacific dense sun asia moon smallest full 300 annular 240 kilometers path super silhouetted filter point image visible smaller
vT1ye	2	UT	history march 17 today writers 1938american 19361940 federal colonel histories wood wearing life november manuscripts 11 obrien project recited nebraska green river irish parade patron savannah boston unofficial celebrating 492 traditions 1775 city renowned death festival commemorating legend patricks ireland heritage officially today 1824 march saint circa back georgia york
e4T7o7	6	UT	opinions supreme court utah state courts appellate court back opinions ut 29 state 4 20090559 ruiz 2012 ut 28 state 20090882 moa 2012 4 27 ut state 4 2012 20090829 alexander 26 20100923 ut lake county 4 bam salt 2012 25 kell ut state 4 20090998 2012 apartment 17 broderick
ySMRNJ	2	UT	fraud people alert diabetes government money defraud diabetes plot criminals target people american steal fraud people alert diabetes media deputy oig investigations interviewed baskin general director communications oigs gary roberta inspector cantrell precise diabetic financial vary order strips meters seats additionally orthotics braces information confirmation personal beneficiaries offer generally offers
oqPMKY	1	UT	mcfp outreach weekly 4 2012 illness mental reduce month stigma education raise health awareness designated outreach importance financial private including repaying managing loans difficulties bureau loan protection student complaints accepting borrowers default taking cfpb consumer tip move find allowances decisions information tenth make relocation weeks visit force corps brain experts
b2UtUJ	2	UT	picture astronomy day fascinating discover featured written image explanation day photograph astronomer cosmos universe professional 11 2012 bright distant earth disk 20 fit easy weeks apogee photographed perigee dark day telescope pacific dense sun asia moon smallest full 300 annular 240 kilometers path super silhouetted filter point image visible smaller
oWeDBN	3	UT	photography astronaut earth gateway brightly expedition madrid northeastern canary middle 015224 pass north france peninsula northeast stands space west sequence 28 crew station board gibraltar international 2012 strait begins ends march sahara continues southern iberian dark atlantic western islands balearic spain 30 ocean pyrenees shots video gmt 015922 photographs high
xXGIJ9	1	UT	february media social day awareness 2012 impair stress ageappropriate capacity mental developmental youths reach ptsd challenges health disorder posttraumatic goals providers dealing wwwsamhsagovchildren children friends visit trauma resilient hope families heroes youth learn juvenile mental prevalence years challenges suffer greater stress1234567 justice generally system noting health rates document numerous higher
wCIR3s	1	UT	inmate 223626 chappell shackleford previous apartment police young complex march early cutting report continued morning night found competition year investigation dating frustrated missing kristal attention hours incident death choked carried brusing supply scene son involvement drowned proved 2 relationship child shortly 11 12 middle air called affection ordered december kristals
GBTkQq	2	UT	conference communities house safe watch lgbt live schools white state union video watch enhanced transparency commitment browse house white logs visitor wait executive actions president obama federal receipt tax federal dollars tax spent people petitions create sign house inside white tour interactive leaders people house community transgender partner education justice
