wyIJem	1	NJ	apod march 14 sun angry erupting 2012 fascinating discover featured written image explanation day photograph astronomer cosmos universe professional march 14 2012 suns years earth captured current giant system field baddest plumes plasma magnetic puffs colorful dark cool twisted tendril inverted ejections shown sun particles chromosphere bird pictured emitted sunspot
zv0rRC	1	NJ	heartburn reflux damage medlineplus chronic teeth acid pages related medlineplus reveals heartburn chronic healthday esophagus acid gerd damage thursday research 8 march mouth news condition severely reflux disease worried teeth gastroesophageal influx people sharp ultimately lead pitted suffered erosion thin worse wear half condition healthy study months disease tooth patients
n2VhDQ	1	NJ	cassini rings mission solstice images home image details encke wisps 81 5150 titan terrain 28 visible diones ring trailing hood layers finally saturns 698 rings feature moon haze largest image pan polar 1123 north dione moons orbits gap hemisphere background kilometers icy appears wispy center 17 3200 50 left miles
yVEw8F	1	NJ	thomas congress text bill library 112th 20112012 hr347 hr347 hundred twelfth congress states united america session city tuesday washington held begun twelve thousand january day act buildings simplify relating section title drafting states united code restricted 1752 correct 18 grounds building restricted sec 1752 grounds speaker house representatives united vice
tI4ZBT	1	NJ	solstice hyperion odd mission cassini images home image details constant orientation reference surface orbit 270 shape images previous latitudelongitude system moon features inventory tumbles extend devised standard 168 coverage kilometers satellites spin irregular rate miles hyperion zone watch blasting cosmic encountering learn movie hyperion wavelengths miles nanometers 1145 image feet
Ie4UjU	1	NJ	media april social day awareness 2012 prevalence lifetime sexual physical 17yearold percent trauma witnessing 8 nationally reported assault experiences representative 39 12 17 violence youth survey providers dealing wwwsamhsagovchildren children friends visit trauma resilient hope families heroes youth learn assault1 prevalence percent lifetime sexual physical 17yearold 2 rates witnessing 8
wRIdts	1	NJ	calendar edsitement presented century trend general vote lesson state tend 19th white constitutions extend students males half affect discuss population voting connections trends election vote voter jackson totals increase voted white translate participation increased students males andrew candidacy percentage presidential 1828 popularity states 24 united make young territory andrew jacksons
pf6pRn	1	NJ	shadows apod 12 october seasonal sundial saturn 2011 fascinating discover featured written image explanation day photograph astronomer cosmos universe professional 12 october 2011 increasingly pointed spacecraft sundial earth saturns 2017 sundials saturn continued day shadows easily bar continue upper equinox sun rings moons orbiting occurs august vertical larger block point
XXAoz	1	NJ	living lifestyle information health human services guide connect website hyperlink nongovernmental direct application hhs consistent hyperlinks states services human subject information hyperlinked united application contained health endorsement department website intended provided visitors external constitute applications privacy appearance practices products policies purpose link redirected advice find health care today widget information
xs7j7v	1	NJ	la county health department public area mph mondy msn health officer rn cristin event speaker angeles los metropolitan heart lifestylerelated deaths disease chronic trends including injuries information death cancer infectious leading emphysema health conditions summarizes diseases hiv wide report diabetes 19992008 premature unintentional range pneumoniainfluenza lung intentional behaviors features infectious
xEBcuE	1	NJ	med ncbi emergency west pubmed emerg reliably medicine residents 2011 function web ncbi javascript site warning requires management citation external file generate software emergency university medicine state department buffalo york sources references determine access clinical medicinespecific resources engine physicians searches emergency conducting medicine department judge perceived textbooks medically em google
wGldb6	1	NJ	apod australia aurora february 1 red 2012 fascinating discover featured written image explanation day photograph astronomer cosmos universe professional 1 february 2012 atmosphere including magellanic earth disk galaxy ground sky showered weeks excited australia familiar aurora emanating oxygen large pictured night small distant back video highlighting particles state 1402 red
vuS	1	NJ	picture astronomy day fascinating discover featured written image explanation day photograph astronomer cosmos universe professional 11 2012 bright distant earth disk 20 fit easy weeks apogee photographed perigee dark day telescope pacific dense sun asia moon smallest full 300 annular 240 kilometers path super silhouetted filter point image visible smaller
zhMOL4	1	NJ	presidents make healthiest council year 2012 set presidents past council year activity incorporating physical start reminder achieve 2012 nutrition good ability healthiest reflect goals making great 12 lifestyle level healthy age months realistic commit work weight people presidents set council years resolutions fit percent approximately reality report attainable change january
fo8VAL	1	NJ	business tax sbagov expenses deductions small expense business addition capital tax expenses small deductions article discusses vocabulary concepts tax expenses owners business add basic capital renting forprofit tax expenses cost travel paying business trade conducting employees storefront costs common deductible money quality equipment excavating landscaping part specific depreciation deductible deduct
ctbzWp	1	NJ	center tornado watch prediction storm 68 68 status report watch messages information network service national warnings visit iwin weather interactive 50 mod 20 low 40 mod 20 low 30 mod 20 low high 70 f2f5 probability forecaster 70 60 table event increased category tornadoes probabilities issuing 5 low moderate events
GByIJJ	1	NJ	owners 20 needed back pets march volunteers missing king regional county animal services raskc 98032petskingcountygov206296pets 7387tty wa center21615 pet noon pmtuesdayfriday 64th operationmonday 3 adoption skent 6 pmsaturdaysunday ave 711hours 5 pm people partnership mission county 21615 session ave saturday 24 pet kent 1 reunite 3 program adoption animal interested
whdidq	1	NJ	apod march spiral warped 4 eso 510 13 galaxy 2012 fascinating discover featured written image explanation day photograph astronomer cosmos universe professional march 4 2012 digitally billions years shape warped disk galaxy warps spiral spirals stars galaxys flat explanation gas warp early orbiting loose sharpened diffuse clouds conglomerations solid disks
AlKHAe	1	NJ	census features records newsroom 1940 edition facts editions special release features reasons marked facts 1940 long 2 archives 2010 early records world presidency edition roosevelt war 2020 history detailed profile compare raging national ii winding individual nations depression information lengthy make administration public europe plans notable included america momentous great
z6ekVW	1	NJ	resear ncbi review pubmed stateoftheart transfus 2012 basophil blood function web ncbi javascript site warning requires management citation external file generate software italy verona section general diagnostics department pathology university publicationsee text free 2 images activity browsing empty recording activity turned recording turn back information usa 20894 center pike rockville
bxp1f5	1	NJ	center 55 watch thunderstorm prediction severe storm 55 status report watch messages information network service national warnings visit iwin weather interactive 10 low low 30 mod 20 low 60 mod 40 mod high 80 f2f5 probability forecaster 70 60 table event increased category tornadoes probabilities issuing 5 low moderate events
eaapDM	1	NJ	natural senate energy committee resources sector energy modernize electricity seeks 2012 power standard generated nations future clean act guide bipartisan management resource reserve federal responsible stewardship strategy lays act helium 2012 files ferc documents item addition attached chairmans find au letter murkowski senator linked amendment text act joint result substitute
a09XqB	1	NJ	center tornado pds watch prediction storm 58 status report messages watch 58 information network service national warnings visit iwin weather interactive high 95 high 80 high 80 60 mod high 70 60 mod high 95 f2f5 probability forecaster 70 60 table event increased category tornadoes probabilities issuing 5 low moderate
AFqj2q	1	NJ	calendar event content skip navigation date 27 march 2012 extra qa pacific 1130am 9151030am az mountain additional 130pm eastern note 1115 1015 presentation 1215 provided line 1025 central 50 remain time 1230pm minutes sue lead johnson space runco nasa speaker center planetary features scientist including learning earth exist information space
tCMPO9	1	NJ	industries worldwide input food processing research market agricultural investments structure biofuel wang paul heisey schimmelpfennig pray sun rupa john dayrubenstein carl ling keith king david karmarkardeshmukh fuglie kelly 147 pp december err130 research economic report 2011 sector generally global multinational agricultural networks industries input decades increased food rise half structural
I5ZftP	1	NJ	heart cardiol ncbi disease coronary nucl pubmed 2012 assessment ct function web ncbi javascript site warning requires management citation external file generate software center usa ny medical medicine brooklyn department maimonides arterial perfusion article utility conventional management chd acquiring capable clinical assessment function advancements suspected reviews patients ongoing common guiding
i3tx	1	NJ	natural senate energy committee resources sector energy modernize electricity seeks 2012 power standard generated nations future clean act guide bipartisan management resource reserve federal responsible stewardship strategy lays act helium 2012 files ferc documents item addition attached chairmans find au letter murkowski senator linked amendment text act joint result substitute
GHpysy	1	NJ	secondhand disease childhood lung smoke medlineplus years linked pages related medlineplus obstructive adults exposed chronic lung healthday pulmonary children risk march secondhand monday news condition developing 19 study disease theyre smoke found called obstructive term copd bronchitis disease number emphysema chronic including pulmonary conditions adults assess worse factors difficulties 325
ifRMjx	1	NJ	federal holidays 2012 6103 observed saturday usc federal schedule note sunday 5 establishes holiday public nonworkday monday friday holidays law employees work falls executive purposes years leave federal pay section legal 1 sunday 2 11582 3a holiday public 2012 monday falls day february january employees 1971 11 treated order specifies
blUvBo	1	NJ	house bo white state union video watch enhanced transparency commitment browse house white logs visitor wait executive actions president obama federal receipt tax federal dollars tax spent people petitions create sign house inside white tour interactive family pictures bo dog obama march garden family house rose bo dog 2010 3
wXWkBm	1	NJ	impr ncbi med medical continuing intern pubmed education quality ann 2012 function web ncbi javascript site warning requires management citation external file generate software toronto canada ontario patient centre sunnybrook university sciences health safety existing touch knowledge improvement systems integrate achieve physicians redesign outlines skills fields cme qi related beneficially
AiRcMh	1	NJ	senate policy michigan health state chair committee scheduled addressing needing individuals office thursdays request participate accommodations hearing committee 230 special senate lansing webpage health assistance policy meeting pm regularly members building committees room citizens proposals contact time bills boji minutes committee testimony subscribe committee notices email legislation committee view referred
GRcXRz	1	NJ	building semantic network ncbi database pubmed biomedical oxford 2012 function web ncbi javascript site warning requires management citation external file generate software usa la institute ca research 92037 jolla scripps semantic increasingly relationships content implementation editors straightforward easily introduce articles genecentric queries accessible limitations exposes computable enhanced draws httpenwikipediaorgwikiportalgenewiki wikipedia
xJFRMX	1	NJ	viral flora ncbi metagenomic analysis mart pubmed pine virol 2012 function web ncbi javascript site warning requires management citation external file generate software netherlands center medical virology department erasmus rotterdam sequences geminivirusrelated viruses pine enteric picornaviridae species homology information epidemiological baseline metagenomic detected potential european diversity viral circoviruslike understanding paramyxo
wnbZdB	1	NJ	ncbi patol riv 1975 nerv taurine pubmed mayjun effects ment therapeutic function web ncbi javascript site warning requires management citation external file generate software 30th epilepsy results sleep aspect skin group 21 temporal epileptic improvement taurine summarised 4 weeks personality returned lobe interictal familial day generalised progressive 50 activity found
xPqzBc	1	NJ	carriers smartway partnership truck transport epa content area jump main navigation contact smartway smartway carrier steps partner truck joining downloading started tool partnership agreement includes copy review carrier truck time guide files epas adobe reader learn pdf page view collecting overview partner make tool collection prepared step data submission smartway
GYE9	1	NJ	tutorials medlineplus health interactive education tutorial easytoread presents variety symptoms health treatment wellness tutorials conditions patient diseases includes graphics audio language institute medlineplus diagnosis learn animated surgeries prevention interactive adobe prompted download tutorial flash note start version tutorials 8 httpgetadobecomflashplayer require mobile twitter subscribe version updates follow email rss national
z1prc7	1	NJ	nutrition athletic medical medlineplus encyclopedia performance athletic routine performance exercise nutrition eating stay active lifestyle healthy enhance enjoy tired energy finish sport casual poorly provide fluids sports good eating diet perform race activity healthy athlete diet person recommended group food amount depend stomach perform avoid exercising learn empty carbohydrates energy
xX62F5	1	NJ	multiple ncbi myelomareactiv pubmed marrow 2012 induction bone transplant function web ncbi javascript site warning requires management citation external file generate software netherlands centre university hematology radboud medicinelaboratory nijmegen department laboratory medical partial tcr sct mhaspecific signal pcr recipient detected cellsbone decreased 2012 remission dc ctlspecific experiencing interestingly mha fibroblasts
yMiZvq	1	NJ	impact ncbi jpen national nutr pubmed parenter shortage enteral 2012 function web ncbi javascript site warning requires management citation external file generate software ohio clinic cleveland jpen fungicidal administration enteral existing impact recurrence mortality food showing therapy report loss solution common shortage withheld series national home warranting bactericidal avoid research
y8CIpc	1	NJ	acad sci efficacy ncbi evidence pubmed natl 2012 proc synaptic function web ncbi javascript site warning requires management citation external file generate software usa neurobiology university irvine anatomy 92697 california department ca spaced phenomenon primed experiments identify aspect saturated involved poorly shorter naturalistic temporal production bout synaptic presentation massed combination
w9Y3da	1	NJ	apod saturns 22 january light hexagon 2012 fascinating discover featured written image explanation day photograph astronomer cosmos universe professional january 22 2012 planetary infrared discovered spacecraft motions saturns excluded flybys surrounds emanating rotating fully shape vortex continue corners unexpected imaged movie scientists orbiting shows saturn formation created study timelapse times
AdJnm2	1	NJ	2012 ncbi mapping pubmed health behav participat educ intervention function web ncbi javascript site warning requires management citation external file generate software houston selection mexican developed identify program amigas treatment texas salud early hispanics areas success informaccion benefit amor el methods paso design precancerous sites research increase participation yakima members
zYV6sN	1	NJ	current uscert activity highimpact web current incidents regularly updated reported types summary uscert activity security page frequent multiple apple released updates safari address vulnerabilities products security os code crosssite obtain information perform vulnerabilities privileges elevated attack attacker condition execute denialofservice exploitation sensitive arbitrary operate scripting articles mitigate users ht5281 encourages
1fJal	1	NJ	bernanke 21 deflation 2002 speech november deflation doesnt making happen excessive money lack stability world argued discipline stray expectations rise stripes bane inflation cage heightened standards large essential leaders creation industrialcountry serviceshas result factors public shocks monetary understanding inevitable goods central favorite pick equally economists number 1990s political tame selfconfirming
15XEsw	1	NJ	web student aid sheet grant click note teach fact office private grants learning elementary sheet reduction program families secondary school serves aid financial lowincome cost college year education information grant 4000 assistance access interested reading public higher intend congress students act teach teacher created contact 2007 enrolled fact serving years
awFBvd	1	NJ	blue parkway ridge search vistas mountains appalachian meanders protecting special blue slow ridge opportunities enjoying revealing longrange diversity relaxing views closeup makes pastoral parkway highlands animals unlike 469 region drive experience plants stunning miles country providing landscapes paced summer handson mountain offer developed guided programs life demonstrations traditional cultural campfire
FRbC0a	1	NJ	affordable implementation faqs part viii act care states department united labor printer friendly version hhs set people previously issued questions labor httpwwwdolgovebsahealthreform additional implementation benefit faqs health treasury answer stakeholders affordable intended provisions human jointly prepared sbc understand coverage services frequently law care benefits departments summary act httpcciiocmsgovresourcesfactsheets asked raised
IktwZl	1	NJ	season medlineplus early year tick starting page related medlineplus prevent ticks love mild healthday precautions expert winter 22 means due sunday normal started season earlier gardeners news tick hikers april outdoors meal diseases people tickborne symptoms alert anaplasmosis minn tickborne testing virology microbiologist rochester positive minnesota lyme babesiosis state clinical
GEiWb5	1	NJ	solstice hyperion distant mission cassini images home image details constant orientation reference 324000 270 shape 90 angle 521000 rate movie system approximately degrees tumbles sunhyperionspacecraft devised blasting watch standard zone 168 encountering kilometers phase spin obtained distance latitudelongitude irregular cosmic orbit moon miles learn hyperion view features image surface visible
8MNng	1	NJ	bridges bts deficient national structurally system maps highway rita va ca al ar vt il ga az id ct nh nj nm tx la nc ne tn ny pa ak nv pr wa de dc wi wv iaks fl wy md ma ut mo mn mi ri mt ms sc
98s589	1	NJ	relatives birth searching connected stay process fathers address searching arise issues information additional guidance adopted access relatives concerns parents resources locate families complete successful search persons designed birth child types searches conducting mothers factsheet guide table contents information publications recommend gateway childrens citation washington searching human welfare gateway information relatives
coqf7D	1	NJ	center tornado watch prediction 108 storm status report 108 watch messages information network service national warnings visit iwin weather interactive 40 mod 20 low 30 mod 30 mod 40 mod 30 mod high 70 f2f5 probability forecaster 70 60 table event increased category tornadoes probabilities issuing 5 low moderate events
wlKehM	1	NJ	acute ncbi physician back pubmed low diagnosis fam 2012 treatment function web ncbi javascript site warning requires management citation external file generate software school north usa university nc hill medicine chapel briancasazzameduncedu carolina urinary rest underlying identify signs stabilization aggressive retention adding exercise cancer young treatment acupuncture trauma include crash
HgC1lV	1	NJ	times visa results page wait location select city selecting visit locations consular jeddah appointment days nonimmigrant visa time interview calendar typical wait excludes nonimmigrant 44 daysall days visitors visas 5 daysstudentexchange days nonimmigrant visa 5 processed time typical workdays wait embassies vary embassy including inquiries separatelyimportant based weekends excluded mail
fjm6Ex	1	NJ	frb 26 statementjanuary releasefomc press 2011 release date 26 2011 january sector unemployment bring underlying committee reluctant equipment expectations improvement late add stable continues employers inflation downward remains rate economic picked year investment trending risen federal conditions business continuing weak met credit insufficient software longerterm rising labor open market wealth
z18kAw	1	NJ	investing house energy future clean address white weekly state union video watch enhanced transparency commitment browse house white logs visitor wait executive actions president obama federal receipt tax federal dollars tax spent people petitions create sign house inside white tour interactive saving money states talks reducing united families factory pump
yB6kHZ	1	NJ	apod false 16 january light zodiacal dawn 2012 fascinating discover featured written image explanation day photograph astronomer cosmos universe professional january 16 2012 perch mistaken world zodiacal galaxy glows brighter triangle early band hanle lapse frame saraswati year dawn sunrise disk sun recorded pictured interplanetary diagonal hours brightest central times
aJAUwv	1	NJ	center auction salem maintenance missouri department conservation jct center 65560 32 5735224115 phone ext salem 72 maintenance missouri 3283 numbers 13 october 1000 starting saturday 2012 registration 800 preregistration 730 500 pm friday viewing october day begins 12 sale items 2012 1000 arrangements registration subject tentative make lot listing auction
Ht0jL7	1	NJ	daniel goldin aeronautics revolution high daniel space agency transform program safety approach public administrator initiated deliver cheaper nasas faster lower goldin programs enabled americas longestserving sacrificing budgets tenure american bureaucracy spring human expensive develop agency long nasa pursuing imbalance administrator flew observers robotic missions criticized perceived 1992 goldin bloated infrequently
vlm172	1	NJ	paranal apod december 28 lovejoy comet 2011 fascinating discover featured written image explanation day photograph astronomer cosmos universe professional december 2011 28 survived paranals month including zodiacal galaxy 20 23 degrees skies rise tails spectacle continued encounter clouds large small wonders telescope frame w3 sunrise lovejoys sun captured performs christmas
zRcKkb	1	NJ	law troops bill expedited airport screening bailey senator kay hutchison texas orders december washington service traveling trust rtx 20 troops senate legislation late screening house bailey families passed dc yesterday members president kay law expedite 2011 13 hutchisons signed airport act senator family servicemen americans grateful pleased earned easier nation
zmvF2h	1	NJ	qjm ncbi comorbidity 2011 alzheimers pubmed nonpsychiatric function web ncbi javascript site warning requires management citation external file generate software directorate cornhill age royal uk psychiatry hospital additionally deal providers overview number observed chronic underlying including nonpsychiatric dementia risk thyroid clinicians factors comorbidity review prevalence alzheimers apnoea vascular evidenced conditions
JtXARP	1	NJ	hypogonadism mobile erectile pubmed dysfunction nutrition feb 25 julaug277885962 2011 epub nerve deaconess boston peripheral tsiepmannbidmcharvardedu brigham hospital medicine disorders israel usa autonomic department harvard massachusetts beth school center medical womens soyrich previous impact onset monitored knowledge parameters instance veganstyle improvement soybased present decreased presentation paralleled increased combination dehydroepiandrosterone emphasizes
