j5bA1	1	NJ	federal table register contents aids end section online finding issue public resources notice recently reader phone consult enacted reminders laws numbers subscribe httplistservaccessgpogov follow table electronic select federal contents online archives listserv change instructions join settings register list fedregtocl leave mailing office visit hosted archive issues previous federal online government
HFpUPS	1	NJ	grant grantsgov opportunities synopsis opportunity find precedence service disk electronic click information grant provide notification send inconsistency document email resolved notifications printed address opportunity emails change receive thing giving original requestedany modification description represent newest file oldest previous shown documents current document sections files background representing modifications arranged changed list
W4iaX	1	NJ	mods description congress object library metadata schema unmoderated office site community subscribe computer operated open network marc modslocgov development listserv users congress library members subscription mods forum list standards filling form set office purposes library maintained standards users network variety congress input metadata development description bibliographic object standard applications mods
zqWjUU	1	NJ	arne duncan statement department education secretary week 2012 school feb statement duncan national recognizing arne issued counseling education 610 today secretary sidestep engaged counseling education millions curiosity potential thousands salute life students reach unsung succeed heroes day dreams professionals school roadblocks american achieve country explore todays presidents move earning millions
ynwake	1	NJ	desire behav ncbi body neurol pubmed paralyzed 2012 type cogn function web ncbi javascript site warning requires management citation external file generate software monash school australia neuropsychology university research clayton experimental psychiatry victoria south unit psychology describe incongruity manifests paralyzed limb integrity biid amputated paralysisbiid body variant identity desire healthy
crYxQ	1	NJ	webb james telescope space weve posting people models paper design variety model heimpel nina swales designed aerospace model version 148 scale directions john modified parts downloadable dated pdf model jogerst 82510 reference leicester 130 images scale space pictures approximately amazing build 8 weeks national website centre acrylic foil brass mylar
wrNexb	1	NJ	sci ncbi med sports exerc pubmed effects strike 2012 type footwear function web ncbi javascript site warning requires management citation external file generate software 11 biology evolutionary divinity usa university harvard cambridge human department ma avenue 02138 rearfoot shoes differs forefoot heels elevated strike supports minimal economy versus tests standard
aATiCG	1	NJ	decorative light energy star strings decorative star products light energy strings lighting home find partners partner decorative kwh energy 700 equivalent greenhouse year electricity cars save 100000 star reduce sold million gas qualified america light emissions strings set saving features money energy guidelines greenhouse reducing earning utility earned agency fight
AgxVF	1	NJ	apply assistance fema term short term long smarter rebuild stronger damage clean accessible disaster office facility related questions fema readily information recovery assistance case applicants center programs mobile drc families intended portal find disaster displaced housing fema live individuals place claim false disaster violation file fema federal deserve make damage
yFPzzm	1	NJ	origin thyroid pancreatitis risk acute tumors rems rdna victoza injection liraglutide ccell 06132011audience endocrinology practice family posted origin rems nordisk providers rdna victoza novo information issue reminded strategy mitigation safety care evaluation risk assessment primary aware important letter injection liraglutide recent professionals showed fully required risks healthcare relevant rats humans
H0TWkq	1	NJ	syndrome tunnel carpal tip medlineplus warning health signs page related medlineplus nerve forearm carpal tissue healthday bones syndrome affects fingers inflammation occurs formation news runs tunnel tunnellike wrist carpal hormonal syndrome role conditions play repetitive hand persons developing tunnel age longterm heredity medical orthopaedic academy carpal tunnel classic surgeons symptoms
nZNM6z	1	NJ	specialist lichtenberg bio byron astronaut payload specialist lichtenberg byron sc payload chinese born stroudsburg children 1948 personal data adopted pa 5 citizen daughters 2 february 19 married 1975 aerospace 1979 brown university scd honorary scb westminster engineering college biomedical sm mechanical education mit 1969 komorov fai flight space haley award
H11HEr	1	NJ	3827 ocean animation svs perpetual represent 40x 20x global bathymetry begin surface general produced synthesize resolutions transport visualization eddies current estimating systems mit seaice satellite exaggeration insitu oceans carbon bathymetric depths joint heat topographic flows undersea phase ecco2 data land ii climate resolve circulation mitjpl ocean project patterns mitgcm output
zW3HTs	1	NJ	ncbi res relat physi pubmed orthop online clin professional networks 2012 function web ncbi javascript site warning requires management citation external file generate software hymanteamgmailcom process array technology availability information educational rapidly provide media carries controls potential online resources physicians risk advance extraordinary communities represents developing range social physicianonly informational
yHEs7z	1	NJ	fin2012a002 adobe visit viewer excel accessibility acrobat reader download powerpoint page adobe free acrobat content reader print pdf download view advisory filed existence litigation increase concerned criminal seeking unfamiliar matters reveal unauthorized covering remind activity requirement financial escalation penalties crimes fincen subject network current increasing prohibited likelihood employees reports recognizes
vbBNj	1	NJ	hsf realtime space human flight data control uptotheminute mission spacecraft path data make sky project applet reside significantly 336 download skywatch cache approximately access internet files 144 downloading 300 sufficient downloaded data 10 hard minutes clear required drive connection nasa time modem kbps updated official responsible amiko curator notices nasa
wHkRW5	1	NJ	hgt1110 mld multicenter leukodystrophy study intrathecally text clinicaltrialsgov enzyme full therapy metachromatic administered view children replacement doses determine children administered 40 safety intrathecal weeks hgt1110 leukodystrophy ascending purpose injection mld study metachromatic lysosomal estimated approved live autosomal approximately varies 1 enzyme parts location inherited metabolism therapies 100000 lipid leukodystrophy births
Aa0BkI	1	NJ	sec form accurate reviewed information necessarily commission reader complete exchange completethe securities assume determined filing 1 identity issuers information business contact 2 place principal persons 3 related clarification response clarification response clarification response clarification response clarification response industry group 4 size 5 issuer federal select 6 claimed apply exclusions exemptions
AnkFiD	1	NJ	acad sci ncbi resistance pubmed insulin cellular natl 2009 proc function web ncbi javascript site warning requires management citation external file generate software australia street institute medical klh8stvirginiaedu darlinghurst research program 384 nsw garvan obesity victoria 2010 diabetes caused resistance poorly rapid rapidly parameters production defining superoxide results uncouplers cellular
xMmVPv	1	NJ	house white state union video watch enhanced transparency commitment browse house white logs visitor wait executive actions president obama federal receipt tax federal dollars tax spent people petitions create sign house inside white tour interactive event live facebook discussion participate click member facebook give click questions comments httpwwwwhitehousegovvideo ondemand library
z1qQzX	1	NJ	heart study disease medlineplus stents stable medicine pages related medlineplus heart medication people healthday expensive 27 feb arteryopening stable monday news study work disease suggests undergo procedure operations threequarters researcher medical lead stent tube placing brook tiny stony medicine brown university mesh york artery dr center professor unnecessary david involves
naVVCK	1	NJ	development professional toolkit army family meetings address profession venues capabilities committed soldiers trust forums based army opportunities modernization rich decisive include topics resources website families enhancing allvolunteer world ranks remain panels page strengthening force leaders universal toolkit contents visiting provide leader development intended soldier important members civilians implicit structure speeches
x3xKr9	1	NJ	med volumetric ncbi analysis sex pubmed urethr vascular 2010 3d function web ncbi javascript site warning requires management citation external file generate software italy reproduction gynecology studiorumuniversity pathophysiology mater massarenti human bologna department cesarebattagliauniboit alma gspot controversial existence space urethrovaginal threedimensional evaluate ultrasonography structures anatomic 3d color underwent ii orgasm
NHIcS	1	NJ	house white state union video watch enhanced transparency commitment browse house white logs visitor wait executive actions president obama federal receipt tax federal dollars tax spent people petitions create sign house inside white tour interactive event live facebook discussion participate click member facebook give click questions comments httpwwwwhitehousegovvideo ondemand library
wwSUfA	1	NJ	med preferences older trea site ncbi persons intern pubmed 1998 gen function web ncbi javascript site warning requires management citation external file generate software affairs school usa university healthcare system haven connecticut yale medicine veterans west examining form site persons explore home care perceptions preferences older medical hospital constant qualitative
hF1NpJ	1	NJ	tax prep free topics individuals irs resources programs assistance irs tax qualify elderly taxpayers offer free income counseling tce vita volunteer neighborhood people credit filing tax locations elderly disabled located irscertified malls return vita electronic centers special 50000 taxpayers provide convenient make generally sites libraries returns program income basic local
yM3Ls9	1	NJ	emotion soc ncbi neural disrupts pubmed cogn activity neurosci affect du 2011 function web ncbi javascript site warning requires management citation external file generate software usa street psychology 603 university 61801 illinois naomisadehgmailcom daniel champaign department east urbanachampaign il represent examining psychopathic temporal salience positively evidenced personality increased frontal activation
omNQN3	1	NJ	text clinicaltrialsgov bcell genetically chemotherapy full lymphocyte leukemia engineered therapy lymphoma treating resistant refractory patients view cancer kill laboratory make placing immune build white body blood rationale response created cells gene bcell trial studying clinical genetically chemotherapy lymphocyte leukemia engineered therapy purpose lymphoma treating resistant refractory patients anticd19car unacceptable disease
HEcbr7	1	NJ	living healthfindergov healthy learn live quick teens guide depression connect website hyperlink nongovernmental direct application hhs consistent hyperlinks states services human subject information hyperlinked united application contained health endorsement department website intended provided visitors external constitute applications privacy appearance practices products policies purpose link redirected information usaccessibility privacy mapcontact act
aH7y4B	1	NJ	main page naics email collecting classification related analyzing statistical publishing federal system establishments economy classifying north business agencies standard purpose data naics industry american industrial classification developed replace high economic geografia committee ecpc auspices canada management office system adopted nacional sic policy countries omb de north business mexicos jointly standard
w4Wqfe	1	NJ	garrett scott congressman news composed senate house washington states legislative united federal representatives 3 branch hundred meeting twelfth 2013 scheduled congress government dc 2011 january meet nearest office scott click electronically garrett visit location online details page contact congressman est fax 202 hob office washington rayburn dc 2259048 hours phone
zQVdMQ	1	NJ	fax fire hp burn hazards due recalls machines named washington instructed voluntary consumers illegal commission safety cooperation announced firm product stop dc recalled resell attempt immediately products today recall consumer 1050 product 1040 hp fax machines canada 240000 mexico 928000 units alto importer palo hewlettpackard calif fax overheat failure fire
wPm5D7	1	NJ	cancer older prostate study medlineplus patients overtreated pages related medlineplus seniors cancer healthday news aggressive feb disease 29 forms treatment expectancies life men therapy prostate short study wednesday benefit common found harm cancer instances cary aggressive gross author prostate forms internal treatment medicine progress remaining good university associate men news
HHOL6Q	1	NJ	raise cancer study medlineplus breast drinking risk pages related medlineplus cancer alcoholic 28 healthday research womans review percent day 5 boost march risk drink breast news existing wednesday drinks percent france increase heavier risk germany italy drinking day researchers 50 concluded cancer related reviewing 113 heavy drinking 50000 alcohol consumption
cZojOz	1	NJ	layer missing ozone trail protection epa jump main content ozone science layer protection area search contact additions epa recent text version 13 version adobe acrobat megabytes enjoy layer epas office actions produced intrepid introduction missing depletion book 9 farley hope reporter problem trail world 1993 region correct ozone taking joining
HxGPkv	1	NJ	apod april tungurahua 2 erupts 2012 fascinating discover featured written image explanation day photograph astronomer cosmos universe professional april 2 2012 1300 roughly high tungurahua erupts years shines cloud peak glows photographer sky lavalit 5000meter located hot 2006 captured starlit white image pictured ejected pours explanation distance visibly dark fell
wSyfYs	1	NJ	newsroom robert galleries senator menendez jersey building office senate 2022244744 washington dc 20510 hart 528 pike horse fax 8567575353 208 08007 barrington 8565461526 18 suite white jersey 9736453030 fax 07102 center 9736450502 newark 1100 suite gateway jersey map site contact policy privacy feeds rss email webmaster office senate newsletters pursuant
zVxgsF	1	NJ	detailed scan leukemia medlineplus treatment gene guide pages related medlineplus respond predict mutations analyzing healthday treatments aggressive needed treatment march remission accurately leukemia chances news standard acute 14 wednesday patients myeloid gene researchers cancer tissue city memorial forms 500 aml genes leukemia york sloankettering doctors analyzed marrow acute center 18
ynPFSk	1	NJ	gray service trapped national ice noaa fisheries sea whale marine watching photo share photos comments whale submit learn snorkling fishing photo national scanned 1988 sea seattle event film ice 2012 trapped big lab slides released whale marine barrow gray february inspired alaska miracle mammal called gray story trapped related ice
xXgYrB	1	NJ	volcanic natural activity hazards sea red volcanic sea december january ceased group area plume detected zubair sulfur grow 2011 red formed dioxide early satellites continued appears 19 island 23 stopped 15th activity small naturalcolor image 60 enhanced entire 40 landsat7 2012 mapper coast kilometers group thematic february yemen 15 island
wAO5RR	1	NJ	19 january national update thursday situation fema 2012 information warnings west region effect watches remain advisories wwwwrhnoaagov numerous latest heavy flash series move pacific wyoming mountains saturday montana northern amounts coasts cascades copious 3 low moisture 6 flooding idaho systems rainfall heaviest inches utah oregon coast pressure carrying california snowfall
c85rtr	1	NJ	mile mohawk power point nrc corporation 2 niagara ea96116 96116 ea office point generation executive mile niagara lycoming group business corporation ralph station sylvia power mr york president post box mohawk vice 13093 63 nuclear dear sylvia mr regulations alj point violation commissions licensee engaging discriminated mile niagara contractor cfr
d3JDvS	1	NJ	national hivaids strategy office aids house national policy coordinated white colfax office grant aids house national learn director policy dr white announced office national aids operational nhas management federal strategy policy plans agencies implementing hivaids lead budget submitted hhs efforts planning aids highest jurisdictions strategy supports national crossagency comprehensive component
x2F9PT	1	NJ	plos progression ncbi disease alzheimers pubmed 2011 insights function web ncbi javascript site warning requires management citation external file generate software applied eastern university finland department physics eininiskanenueffi kuopio detailed influence functional brain human information provide structural cortical local diseases combination data areas disease neurodegenerative ad cuneus magnetic disease brain
G16dq	1	NJ	med intractable ncbi 1990 hiccups intern pubmed digital termination function web ncbi javascript site warning requires management citation external file generate software israel zion inernal bnai medical medicine department haifa center pancreatitis developed terminate agents terminated 60yearold removal recurrence manoeuvre intractable drugs attempted occurred recurrences manoeuvres immediately cases case acute
vC2XnF	1	NJ	house entrepreneurship questions womens open white state union video watch enhanced transparency commitment browse house white logs visitor wait executive actions president obama federal receipt tax federal dollars tax spent people petitions create sign house inside white tour interactive adobe player flash content download view domain 20 december 3156 2011
zyYvY4	1	NJ	county sanctuary monitoring national keys florida coral lagniappe 2010 ii restoration reef report marine events monroe 2001 sanctuary keys national florida scott authors bailey donahue marine hatsue control transect point lines injury results years ii restore recovery vessel benthic intended established monitoring reference unimpacted analyze excel methodology permanent adjacent digital
14BWFf	1	NJ	newsinfo usaid health questions frequently asked hivaids hivaids questions general people africa 333 60 hivaidsin aids living death leading began infected fourth hiv million hivaids world globally subsaharan pandemic 2009 africa globally affects percent live infected worldwide million 76 hivaids disproportionately 166 women subsaharan hivpositive people caused aids estimated 25
vrDEFy	1	NJ	ncbi ugeskr 2011 pubmed facebook laypersons seek laeger function web ncbi javascript site warning requires management citation external file generate software endokrinologisk sygehus lfolkestadhealthsdudk denmark sydvestjysk 35 finsensgade afdeling 6700 esbjerg number community large questions open based engines crowdsourcing source call type aggregation facebook posted aim laypersons history crowd people
A7wiHD	1	NJ	develop healthy tip medlineplus health child eating approach page related medlineplus unhealthy image healthday develop girls treat body eating watching food news habits bodies website unhealthy food attitude womenshealthgov factors girls trigger mobile twitter subscribe version updates follow email rss national guidelines accessibility library human march institutes quality copyright privacy
ya5nPG	1	NJ	tornadoes monitoring blog southeast severe weather closely fema diane number fema find area call sayer tornado news cast signing sign heard news announcer femacom call meage struck tornado mother phone 97 service 76 receive contact night diane number news fema area find call today tornado wwwfemacom warn phone world register
GIVrCB	1	NJ	ease medlineplus sinusitis chronic medicine alternative pages related medlineplus chronic dietary healthday news alternative 21 acupressure sinusitis acupuncture therapies march spell treatments standard tandem western significant pilot battling study wednesday suggests patients relief inflamed combining headaches potential medicine therapies breathing pain eastern sinuses explore western facial authors impaired study experience
yqsDBx	1	NJ	adv multiple ncbi hematol advances 2008 pubmed diagnosis clin oncol function web ncbi javascript site warning requires management citation external file generate software usa center cancer los oschin comprehensive medical samuel angeles institute cedarssinai calif activity browsing empty recording activity turned recording turn back information usa 20894 center pike rockville
emYKft	1	NJ	votes collection women subset woman larger collection american suffrage national memory 167item association blackwell carrie 19001904 cady national library lucy anthony titles donated miller 1890 ward elizabeth livermore 700800 additional howe smith officers 1 materials catt collected division woman stanton complete congress libraries derived collection bulk julia members nawsa president
kPDJVH	1	NJ	hud neighborhoods choice childhood forprofit vi authorities community linking involve services improvements including broader jobs education successes addition planning educational residents undertaking provide assisted support transform opportunities access emphasis approach highquality build developers local viable hope mixedincome concentrated comprehensive transportation nonprofits hudassisted choice early poverty preservation schools strong projects governments
HiPpYK	1	NJ	states united lottery government blog won usagov asked anonymous lottery won run lotteries states individual follow winners slightly procedure powerball winnings states follow handle statebystate basis state bought run multistate lotteries megamillions ticket procedures teams rules generally state winners lottery learn state responsible comments content hope conversations polite 13 older
3ixzg	1	NJ	caring childs mental health childs mental mission sites overarching childrens caring system effort support samhsas increase approach health comprehensive public awareness marketing social samhsafunded purpose services strategic care 1994 created communications team strategies works stimulate information childrens national visit event wwwawarenesseventorg health today rsvp day awareness mental dont washington wwwsamhsagovchildrenliveeventasp
zYsSHi	1	NJ	multi ncbi plos cells detection pubmed phenotypic clonotypic 2012 function web ncbi javascript site warning requires management citation external file generate software wald oncology mtrepelukede center medical section tumorzentrumuniversity hematology hamburgeppendorf pneumology hubertus bmt hamburg department germany university cancer represent protocol isolate random fifty controversial vastly cell pcr detected systems
HHOyS7	1	NJ	frb 13 march open federal april 3 committee press releaseminutes market 2012 release date 3 2012 april 13 march meeting held federal minutes tuesday attached released board committee 2012 open market reserve scheduled financial economic committee descriptions information based solely decision contained conditions time policy weeks meeting regularly report day
6OvCsb	1	NJ	preserve memorial timucuan national ecological historic caroline fort search wetlands coastal hardwood discover human kingsley includes timucuan 6000 dunes visit plantation caroline preserve beauty coast atlantic marshes years fort hammocksthe experience unspoiled salt history school slave graveyard university florida archaeology plantation field kingsley quarters found evidence 2010 florida anniversary landing
zA5Lrr	1	NJ	courses emi schedules programs emi featured training center emergency national video selection participants criteria applicants prerequisites emi meet limited generally year number information management participants international emergency httptrainingfemagoviaemasp institute emi courses accommodated residents form admission general the755 application fema 119251 reimbursement oncampus regional stipend courses occurs applicants office process netc
zbbJUL	1	NJ	michelle move anniversary lets house speaks lady white obama state union video watch enhanced transparency commitment browse house white logs visitor wait executive actions president obama federal receipt tax federal dollars tax spent people petitions create sign house inside white tour interactive adobe player flash content download view 11 february
c5pDYb	1	NJ	united army africa states news force hogg meetings africa commander djibouti trip group troops army advisers combined east unionread attended horn joint maj gen task david african small visited whirlwind exchanged task force personnel africa bestmore horn assigned joint combined englishmore miesau army rwandans library helping books learn depot amid
