uQv1W	1	NJ	business checklist starting small businessselfemployed small businessselfemployed topics irs resources construed follow allinclusive start basic type business checklist list specific steps industries information page specific web found industriesprofessions business web site states operating statelevel information requirements additional state starting refer business steps small starting administrations refer topics referencesrelated web business
eHMTv0	1	NJ	regulatory frb transaction data reform restore set financial unattractive number helped businesses functioning result provided emergency credit federal secured normal households conditions market closed markets supporting intended achieved borrowers priced key loss purposes wound loans shortterm stabilized improved programs flow intentionally taxpayers strains alleviate time liquidity reserve financial process catastrophic
A0AeXi	1	NJ	med school ncbi west medical rev simulation pubmed emerg education 2011 function web ncbi javascript site warning requires management citation external file generate software emergency orange university irvine medicine california department focus clerkships 21st rapidly knowledge teaching patientrelated continues emergency practice documented school skills em educators provided review current medicine
wBdIB7	1	NJ	house white state union video watch enhanced transparency commitment browse house white logs visitor wait executive actions president obama federal receipt tax federal dollars tax spent people petitions create sign house inside white tour interactive event live facebook discussion participate click member facebook give click questions comments httpwwwwhitehousegovvideo ondemand library
zriKX	1	NJ	text bill transcript rights rights bill preamble march congress newyork thousand eighty states held begun city united wednesday fourth hundred prevent clauses misconstruction beneficent number conventions states ground confidence constitution government expressed public desire ends added declaratory institution restrictive abuse extending order ensure time adopting powers proposed senate house intents
xKIxtM	1	NJ	current uscert activity highimpact web current incidents regularly updated reported types summary uscert activity security page frequent multiple apple released updates safari address vulnerabilities products security os code crosssite obtain information perform vulnerabilities privileges elevated attack attacker condition execute denialofservice exploitation sensitive arbitrary operate scripting articles mitigate users ht5281 encourages
xeJJ1y	1	NJ	grant grantsgov opportunities synopsis opportunity find precedence service disk electronic click information grant provide notification send inconsistency document email resolved notifications printed address opportunity emails change receive thing giving original requestedany modification description represent newest file oldest previous shown documents current document sections files background representing modifications arranged changed list
zxAkXB	1	NJ	apod january lighthouse meteor 8 2012 fascinating discover featured written image explanation day photograph astronomer cosmos universe professional january 8 2012 produces years bright hercules cold captured northern sky 4 easy east skygazers coast early dim january radiant muralis identified morning view maurice obsolete rivers constellation event planet quadrantid boundaries
zpMNgP	1	NJ	inmate andriano 191593 frequenting bars discreetly discontent andrianos poisons obtain engaging cease poison ordered insurance researched affairs resentful business profit began separate extramarital responsibilities policy scheme life increased allegedly pose death effects andriano friends working ill wendi kill hatched asked husband psychologically physically observed andriano abuse signs claimed friends abused
dfwRno	1	NJ	carbon trends dioxide topics defined 400 number ppm years including year mole shown loa divided expressed current parts fraction dioxide molecules dry million complete water reported co2 mauna carbon removed data air record 0000400 vapor seasonal square figure correction month symbols middle monthly dashed onehalf black adjacent red diamond centered
yqh8TP	1	NJ	task processing force visitor travel executive foreign white visa goals house establishing order competitiveness state union video watch enhanced transparency commitment browse house white logs visitor wait executive actions president obama federal receipt tax federal dollars tax spent people petitions create sign house inside white tour interactive house white office
wPGEZ8	1	NJ	current uscert activity highimpact web current incidents regularly updated reported types summary uscert activity security page frequent multiple apple released updates safari address vulnerabilities products security os code crosssite obtain information perform vulnerabilities privileges elevated attack attacker condition execute denialofservice exploitation sensitive arbitrary operate scripting articles mitigate users ht5281 encourages
9DYCQ0	1	NJ	apod october color 3 io true 2010 fascinating discover featured written image explanation day photograph astronomer cosmos universe professional 3 october 2010 jupiters show caused yellow colors human derive glows young sulfur dark friction molten spacecraft explode 1999 rock bright jupiter moon orbited moons turning galilean active tidal intense silicate
xVYGki	1	NJ	diabetic type ncbi people bmj incidence pubmed retinopathy 2 2012 function web ncbi javascript site warning requires management citation external file generate software cf14 centre endocrine university research sciences uk cardiff wales 4xw hospital unit diabetes annual people determine service mellitus retinopathy 2 screening type incidence attending evidence diabetes episode
AoicAO	1	NJ	strengthening requirements diligence due comments customer fincen clarifying seeks adobe visit viewer excel accessibility acrobat reader download powerpoint page adobe free acrobat content reader print pdf download view rmsb notice march releases money important businesses fincen registration services 2012 14 financial money crimes replace efiling legacy fincen registration facilitates hereinafter
341XJe	1	NJ	robert contact senator menendez jersey comment question fill information federal assistance agency tour concern menendez flag services constituent request page contact senator fields required marked response capitol process washington back states staff united remains mail timely form normal 2022244744 dc delivery slow resumed phone page contact offices office senate 2022244744
baPsYP	1	NJ	affairs public home links point hyperlinks find site constitute services welfare linked web provided army west purpose stated sites contained authorized endorsement department consistent exercise activities information locations control external exchanges morale recreation appearance products editorial military disclaimer web aspects technical site comments master questions reporting site broken link address
t5S7De	1	NJ	office disability toolkit odep labor policy department employment integrated states department united labor key organized toolkit accommodate sources audiences questions employment guides perspectives variety discussion audience increase offers papers integrated resources case full users commonlyasked collection understanding user sheets capacity potential reports guide range materials policies studies fact adults developed
2RAq0O	1	NJ	national ruins aztec monument search ritual people house describe site reconstructed distant migration follow masonry ancient workers mortar passageways 500 holding today listen kiva search explore part drums puebloan echo pueblo great rooms fingerprints ancestral roof journey time timbers original 900year unesco site states culture world special 1987 united chaco
