rg5iMa	1	NJ	grail recovery contest system gravity exploration solar interior laboratory naming school grade bozeman suggestions winning nina mont dimauro fourth dickinson elementary emily class represent planets ebb system high names learning earth happen studying gravity moon flood low moons good students tides reason important solar flow thought journey wrote sun grailb
GW4VcW	1	NJ	treatments standard beat medlineplus weightloss surgeries diabetes pages related medlineplus people healthday surgery 26 combat comparing 2 international type march monday treatments contends standard helping news procedures diabetes effective analysis weightloss underwent ages rest years 60 surgical surgery dietlifestyle procedures 2 bypass finding onethird type obese rouxeny drugs gastric diversion
86tmzQ	1	NJ	intercessory heart ncbi study pubmed 2006 effects therapeutic function web ncbi javascript site warning requires management citation external file generate software israel mindbody center usa institute medical school hbensonbidmcharvardedu medicine harvard boston department ma beth deaconess illness supported influence cabg addressed prayer surgery graft provided recovery trials coronary 1 clinical
zMJqTX	1	NJ	cancer fatty colon clues diet medlineplus link pages related medlineplus theyve 15 fatty cancer diet clues increases thursday discovered colon healthday news march researchers risk sapienza questions cancer colon pathology linked university factors diets things research molecular temple independent biology risk fels diet universitys news institute study author lead suggests
dOUIAZ	1	NJ	tutorials training site ncbi guide function web ncbi javascript site warning requires reference series toolkit library demos including examples documents searchable ncbi faqs online development comprehensive framework pdf downloaded notes manual release design software handouts training links print slides materials including tutorials powerpoint formats terms ncbi data glossary part handbook
x1VkDc	1	NJ	ncbi top stroke young preventing pubmed rehabil 2004 function web ncbi javascript site warning requires management citation external file generate software boston hospital massachusetts usa general adults states stroke pregnancy abnormalities quality special impact 220000 united potential factors addition 45 genetic critical women secondary life elements risk drugs conventional environmental
y9laHH	1	NJ	manage pain ncbi family member patients pubmed 2011 symptom approaching function web ncbi javascript site warning requires management citation external file generate software affairs francisco center usa medical california 94121 ericwideraucsfedu department veterans san breaking existing questions aggressive decisions based provision treatment continued advanced miracle teams benefit common found spiritual
qYsprX	1	NJ	network canberra space communication complex deep nasas laboratory number years spacecraft jet propulsion system pasadena transmit exploring schedule mission california solar robotic antennas worked data day directed advance tracking usa receive months controllers set simulations mission engineering tasks radio antenna calibration maintenance development schedule astronomy projects training times time links
byYEVh	1	NJ	bio astronaut lovell james james ret nasa astronaut lovell usn captain milwaukee cleveland born gerlach 1928 wisconsin children 25 personal march data marilyn married ohio wesleyan states engineering college milwaukee education united 1961 illinois program safety natc maryland michigan wisconsin business academy honorary southern test bachelor management california western 1952
wLZPTj	1	NJ	home gtr ncbi function web ncbi javascript site warning requires genes tests labs records gtr including conditionsphenotypes find types tests locations disease searching phenotypes symbols directors names test laboratory protein gene find drugs disease proteins searching phenotypes find traits names analytes conditions genes searching phenotypes symbols names gene conditions find
wV8XYs	1	NJ	nih rare february highlights national 16 disease research cuttingedge health institutes 2012 day awareness raises links related bookmark share cc nih clinical center media advisory office recognize national supported cosponsored translational institutes research researchnational 29 day sciences clinical health advancing daylong activities nih diseases government agencies event celebrate celebration organizations
AuMjJu	1	NJ	hivaids adults older control people number americans centers living nationwide percent research 1 2015 hiv million half years thirtyone age disease growing prevention 50 century americans occur aging 21st providers network people mark individuals issue today lived hiv importance educating important half cases 17 older clear advent inform hivaids prevention
v4SBqs	1	NJ	ncbi prevalence mutations biol somatic detection pubmed low 2011 genome function web ncbi javascript site warning requires management citation external file generate software diego gilman usa center cancer la university drive 92093 california moores oharismendyucsdedu jolla san ca 9500 ucsd breadth clonal udtseq methods cancer limited detection specificity mutations restrict
o4KSzx	1	NJ	sec form accurate reviewed information necessarily commission reader complete exchange completethe securities assume determined filing 1 identity issuers information business contact 2 place principal persons 3 related clarification response clarification response clarification response clarification response clarification response clarification response clarification response clarification response clarification response clarification response clarification response clarification
qPQHgW	1	NJ	languages information uscis uscis list languages materials publications resources official list answers civics questions test naturalization highlighting citizenship rights responsibilities civics video history website uscis users official spanish speaking official list answers civics questions test naturalization audio format official list answers civics mp3 questions test naturalization resident questions 20 permanent
asKEBn	1	NJ	starspangled congress library american treasures memory banner 1814 division starspangled sheet purchase carr musicenlarged 1941 thomas 17791843the scott printed key music francis banner baltimore 291 key states scott signed anthem resolutions introduced 1814 finally law spangled banner forty wellknown national proclaiming star congress song anacreon 1931 united words drinking francis
GVIwuS	1	NJ	lovers tend medlineplus report weigh chocolate pages related medlineplus pittman genevra people sweet weighed rarely indulged reuters health week chocolate york ate study times shed diet doesnt daily adding bar pounds prove candy finding weight including health decreased antioxidants body chocolate pressure blood lower benefits cholesterol researchers san people researcher
2PQUFP	1	NJ	business topics tax topic 509 home irs resources deduct home denial employee general business deductions part expenses selfemployed expense regularly deduct business exclusively expenses part home attorney trade determine principal management personal businessuseofthehome exclusively location employee administrative regularly activities employers part convenience den applies fixed requirement deduct purposes expenses substantial
Ai4ZUU	1	NJ	fafsa4caster benefits give insight college year find federal waiting fafsa4caster eligibility early student making estimate choices aid senior estimates high college nontraditional establish scenarios based juniors create note parents earnings learners fafsa4caster students tool younger early adult school receive savings future strategies entering estimated information based federal approximate fafsa4caster provided
fT2e7k	1	NJ	hsf space human flight apollo history approximately exposed site imbrium fashion unit mauro mare fra distributed formations moon symmetric extensive geological radially landing mission formation apollo 13 nearside planned characteristic mission close mauro fra area chosen decision lunar final achieve led importance landing site apollo 14 13 attempt failed traverse
AbhRnr	1	NJ	med enable ncbi hyg media trop pubmed social news estimation 2012 function web ncbi javascript site warning requires management citation external file generate software school pediatrics usa medical rumialummitedu harvard massachusetts boston department sources assessment afflicted informal weeks postings tomas government cholera period early 127 haiti timely 372 significantly twitter
gsGzAP	1	NJ	specific country information penalties embassy drug learning crime localized information start provide spots find hot health location place conditions good visa world security country medical offices consular afghanistan albania algeria andorra angola anguilla antarctica barbuda antigua argentina armenia aruba australia austria azerbaijan bahamas bahrain bangladesh barbados belarus belgium belize benin
AoLrW	1	NJ	duracloud releases congress launch library program news pilot office communications congress washington dc library se 205401600 ave 101 independence 2027079199email voice 2027072905fax paolocgov duraspace 202 7077302contact congress carolduraspaceorg library erin morris contact allen carol minton accessible developed duracloud focus preservation enable hosted cloud information cloudbased long access program heritage test
GLmPer	1	NJ	apod march 22 supernova m95 2012 fascinating discover featured written image explanation day photograph astronomer cosmos universe professional march 22 2012 neighbors discovered bright distant follow galaxy compact group young clusters galaxys good march colorful surrounds famous pinkish prominent bar traced identified small surrounding video portrait m95s arm blue telltale
zNBGyx	1	NJ	med ncbi army dep media social janmar things consi pubmed 2012 function web ncbi javascript site warning requires management citation external file generate software houston usa sam office army medical advocate tx command judge fort staff activity browsing empty recording activity turned recording turn back information usa 20894 center pike
cqyQqR	1	NJ	febs ncbi malonylcoaacyl platform carrier design lett pubmed 2010 function web ncbi javascript site warning requires management citation external file generate software division life korea seoul institute sciences republic science technology interactions fattyacid pneumoniae 21a highly design transfers his199 protein determined samcat streptococcus group catalytic platform stretch suggest direction makes
I1Kmcj	1	NJ	comparison ncbi bmj pubmed insulin versus metformin 2012 function web ncbi javascript site warning requires management citation external file generate software dk2100 centre denmark rigshospitalet research trial clinical copenhagen hospital university unit intervention compare trials 2 metformin clinical type versus reported harms randomised diabetes benefits patients insulin metaanalyses randomised sequential
gilcS	1	NJ	body human vacuum considerations primarily bursting radiation unprotected human relates outer space interesting hyperinflate question gases interior inflate body shortterm problems react vacuum relating exposure pressure differential temperature blew blown question pod helmet shown movie discussion 2001 dave arose difference airlock correct page httpmedlibjscnasagovintrovacuumhtml extinct space unprotected long live human
zOPEIE	1	NJ	v20 ncbi adoption agp genbank obtain valuable evidence convey sequences information 20 ncbi submit version genome switching files assembly users nature gap part linking change 11 submission side affect site ftp specification agp agps list v11 site existing header parsers ftpftpncbinihgovgenomes line ftp agpversion 20 ncbi specification format genomes written
xj7vRJ	1	NJ	report science nsfgov special nation aquatic facility rivers shes oklahomas species zoologist research state collected shows recently norman mussels part vaughn river university 30 freshwater southeastern caryn names home species pimpleback hold rabbitsfoot oklahoma approximately research location pistol grip vaughn good north colorful 300 mussels hand vaugn mussel america 55
yQCVsz	1	NJ	ncbi expert stevens rev understanding current pubmed clin immunol 2011 function web ncbi javascript site warning requires management citation external file generate software reactions german university dzhuniklinikfreiburgde freiburg dermatology severe germany registry skin department caused entity underlying including syndrometoxic impact prognosis survivors treatment adequate mortality risk increases condition susceptibility conditions
ytG7Zj	1	NJ	prev ncbi cancer spectrophotometr pubmed biomarkers 1998 epidemiol function web ncbi javascript site warning requires management citation external file generate software australia centre university menzies research health hobart tasmania tdwyerutaseduau population wavelengths show accurate intervals 650700 skin spectrophotometric accepted density stained 400 histological causation biopsy difference susceptibility nonserial tumors quick
bVFxIs	1	NJ	full pain marijuana clinicaltrialsgov text effects vaporized view neuropathic measure marijuana utility specific mood psychomotor subjects collected performance population evaluation pain evaluate effects neuropathic painrelieving cognitive study impairment aim relief vaporized opioid primarily results chronic experiments enhancement positive subjects antagonism marijuana contrast demonstrated conflicting perception pain users antinociceptive normal reversed
wRT5Iu	1	NJ	house white state union video watch enhanced transparency commitment browse house white logs visitor wait executive actions president obama federal receipt tax federal dollars tax spent people petitions create sign house inside white tour interactive event live facebook discussion participate click member facebook give click questions comments httpwwwwhitehousegovvideo ondemand library
xWbdBx	1	NJ	konica fire minolta due hazard printers recalls cpsc consumers illegal instructed safety cooperation firm product voluntarily stop recalled immediately attempt recall resell conducted consumer product konica minolta printers units 8430 nj konica business usa importer ramsey solutions minolta short overheat fire hazard posing circuit printers firm aware reported overheating injuries
zwLOd1	1	NJ	stress ncbi disabil dev parenting pubmed child 2012 intellect behavi function web ncbi javascript site warning requires management citation external file generate software usa university angeles los california cneecelluedu delayed analyses fathers authors ages years posited covaried 237 children identified transactional generally 3 crosslagged supported empirically 9 mothers development 144
GDd9Vw	1	NJ	invasive study medlineplus patients hernia easier procedure page related medlineplus invasive results chronic surgical healthday pain compared minimally hernias research treat approach march monday news recovery faster 19 traditional finds procedure option expert older strategy cases repair washington isnt brunt onesizefitsall dr circumstances louis university michael st professor surgical hernia
92kD7Z	1	NJ	center tornado watch prediction 61 storm status 61 report watch messages information network service national warnings visit iwin weather interactive high 70 50 mod 50 mod 30 mod 40 mod 30 mod high 80 f2f5 probability forecaster 70 60 table event increased category tornadoes probabilities issuing 5 low moderate events
I7N6n2	1	NJ	thomas congress text bill library 112th 20112012 2230 pcs effective imposing tax reduce taxpayers rate minimum deficit highincome harkin whitehouse akaka franken begich schumer sanders read time blumenthal boxer reed levin bill rockefeller mrs leahy mr introduced durbin read time calendar effective imposing tax reduce taxpayers rate minimum deficit highincome
GB3Wg1	1	NJ	news climate change earth nasas app app global cyber palm earth puts literally dazzling immerses iphone free nasas hands satellites world data explorers fleet climate nearrealtime nasa science visualizations greenland sea fingertips surface height earth anomalies signs st canada itunes monoxide visiting gravity current vital petersburg interest dioxide wales store
AtDQ8O	1	NJ	living aortic healthfindergov healthy aneurysms live learn quick abdominal guide connect website hyperlink nongovernmental direct application hhs consistent hyperlinks states services human subject information hyperlinked united application contained health endorsement department website intended provided visitors external constitute applications privacy appearance practices products policies purpose link redirected information usaccessibility privacy mapcontact
x143zI	1	NJ	ncbi study ruxolitinib kinase ii pubmed jak phase 2012 inhibitor blood function web ncbi javascript site warning requires management citation external file generate software md united center cancer houston university leukemia states anderson department tx texas reductions dose 25 wwwclinicaltrialsgov treatment adequate aml remission 122 day organ progression median 50
zbxVOK	1	NJ	monitoring update blog severe 2 closely weather midwest fema comment accordance comments blog moderated policy femas links nongovernment social applications web fema provided reference media companies sites endorse msgdata washington street apply management prepare federal rates homeland department 4fema emergency dc 43362 20472202 sw agencyus security500 6462500text tty assistance step
ylpcXj	1	NJ	catches orbiter nasa mars action reconnaissance twister amazonis devils image surface observed visible whirlwinds captured previous paths orbiter feb northern area passed mars planitia 2012 hirise dust streaks 16 dusty region westerly diameter height produced active arc meters displays devil plume delicate yards dust partway 30 breeze farthest devils suns
18NZ4l	1	NJ	summaries drug foia 5141e sponsor summary drug information 21 basis federal cfr support administration forms agencys safety effectiveness foi summarizes fda food nada published released approval supplemental accordance freedom register submitted original section indications foi explained general supplementary supplement human summaries information basis agency administration finally approved recommended pivotal safety
HOn6Ry	1	NJ	stress make medlineplus sick pages related medlineplus people healthday cold dampens trigger explain system immune 2 inflammation monday involving news stress study april common contribute high redness wound system research immune inflammation body heal levels contradictory stress longterm creates suggests heart autoimmune asthma disorders immune system inflammation conditions body lead
A6FpTr	1	NJ	house white state union video watch enhanced transparency commitment browse house white logs visitor wait executive actions president obama federal receipt tax federal dollars tax spent people petitions create sign house inside white tour interactive event live facebook discussion participate click member facebook give click questions comments httpwwwwhitehousegovvideo ondemand library
H3zQ5Y	1	NJ	25 apod march ngc spiral barred 1300 galaxy 2012 fascinating discover featured written image explanation day photograph astronomer cosmos universe professional 25 march 2012 beautiful 1300 telescope remarkable reveals lies fact 3000 spans images close constellation galaxy presently universe ngc lightyears striking spiral galaxys milky black details gorgeous shows massive
HQgnbc	1	NJ	prediction storm center compmap weather references rap analysis 12z rapid pages 1 input 2012 updated fire ruc background fields changed refresh replaced model display mesoscale svrgis apr weather tornadoes gis shapefile visit details 9 2012 19502011 updated 19552011 format shp hailwind httpwwwspcnoaagovgissvrgis reports severe converted page feedback hovered issued displayed
hZjdDi	1	NJ	information center cpsc carbon monoxide colorless killer gas invisible carbon monoxide poisonous odorless called 150 people related states appliances year stoves heaters fireplaces fuelburning unites include nonfire accidental improperlyused furnaces water faulty incorrectlyvented die products poisoning consumer shed portable family kill home generator generators doors vents basement windows inside garage
JqeC5n	1	NJ	ncbi int show chronobiot 2001 chronobiol unicorn pubmed milk function web ncbi javascript site warning requires management citation external file generate software kingdom school united university stocktonontees durham health relevant show rtm statistical milk temperature disorders conclusions explain disturbances chronobiological treat rhythm regressiontothemean guidelines chronobiologists differences artifact aware effects stimulus
splA6M	1	NJ	mission tiny solstice terminator cassini images home image details speck 313 70 epimetheus 113 line closer image rings tiny moon black 504 shadows wide southern hemisphere kilometers bit appears center larger planet cast miles thin enceladus left northern rings ringplane sunlit side view wavelengths nanometers acquired image 60 spacecraft 66
7DgBXv	1	NJ	2011 automotive 1975 otaq lightduty trends emissions dioxide fuel carbon epa technology economy jump main content cars trucks light area search contact additions epa recent years mile previous based improvement fuel 2011 2010 mpg report projects trucks standards miles trend trends year sport provided co2 pickup dioxide reverses slight cars
ujHtZu	1	NJ	catalog pia15185 page spacecraft weekly orleans 20 aug 23 28 late detected 2011 increased made 51 predicted river heavy landfall result sea blue bottom 3 aquariussacd lee aquarius analyses lowsalinty 38 lowsalinity region florida surge sept color image directly panhandle mississippi instrument top tropical storm louisiana rainfall inches composite delta
vE7ZKp	1	NJ	pathol ncbi cancer nextgene clin pubmed genome sequencing 2011 function web ncbi javascript site warning requires management citation external file generate software ave albany usa medical scotland ny college 47 department pathology 12208 breadth including gastrointestinal speed sarcomas knowledge parameters adoption ngs turnaround extensive thousands widely demands advances therapy sequencing
GHxvw9	1	NJ	minority monday national month april unity 2 health equity day skip navigation hhs overview accomplishments disparities omhs speaker equity health keynote importance advances regional mention representative role present suggested advance efforts plan owh representatives hrsa 1 3 health samhsa equity healthmoderator minority regional agencies consultantpanelists panel invited offices cms point
zxVtap	1	NJ	apod 19 february earth message 2012 fascinating discover featured written image explanation day photograph astronomer cosmos universe professional 19 february 2012 years radio human earthlings facts earth 50000 knowledge interesting signals broadcasts molecules humanity regularly string dna arecibo basics accidentally including ceremonial telescope ten intelligence computer space extraterrestrial atoms dedication
FPChWP	1	NJ	kids ability medlineplus academic boost exercise pages related medlineplus healthday physical end suggests young promoting performance march monday kids improving news school 12 study academic activity mental series 138 children physical aged tracked 8 conditions acuity tests activity 11 involved researchers italian claim examined learning gallotta concentration news author exertion
whcsLd	1	NJ	crash snowmobiles arctic due hazard cat recalls cpsc consumers illegal instructed safety cooperation firm product voluntarily stop recalled immediately attempt recall resell conducted consumer product snowmobiles arctic cat december previously models recalled units 19000 2011 river minn falls arctic thief cat manufacturer loss lower crash loosen hazard control tierod posing
GHqRmU	1	NJ	federal commission page election home campaign senate developed expenditures commission political candidates house party independent finance interfaces explore understand data search graphic committees presentations specific action raised code financial contributors money spreadsheet states displays statebystate contributions option information zip basis amounts format political candidates select party map users city dates
GAfDXb	1	NJ	antagonists ncbi database syst rev cochrane pubmed h2receptor histamine 2012 function web ncbi javascript site warning requires management citation external file generate software bahrain box zbysfedobatelcocombh ministry 25438 health branch ukcc awali h2receptor lack number skin subtypes occur urticaria treatment characterised body efficacy hives itching agreement weals disease options range
n2sr9O	1	NJ	24 apod september milky 2011 mangaias fascinating discover featured written image explanation day photograph astronomer cosmos universe professional september 24 2011 bulging years bright earth oldest galaxy greenwich photographer winner royal editors galaxys denizens sagittarius skyscape familiar dark cook night upper pacific year estimated category mangaia space selected paradise centauri
yAHJT9	1	NJ	beginnings congress introduction library treasures world conquest mind rest ending planets winds space ways restrain stars mysteries beginning man deeps planet matter time conquered immensity laws hg wells 1936 division bible special 190305 collection collections press 3 book london rare english testament rosenwald doves cobdensanderson founder nineteenthcentury powerful rendering britain
