wKbJY3	3	VA	settlementfeb92012 foreclosure loan general 25 mortgage federal stops state protections largest government servicers reach agreement servicing address homeowner billion attorneys relief abuses hud attorney financial colorado foreclosure miller washingtonus suthers general substantial reached eric 25 mortgage 49 federal housing government state protections tom department john loan announced relief development urban
xzMFCp	3	VA	photo house january white day 2012 state union video watch enhanced transparency commitment browse house white logs visitor wait executive actions president obama federal receipt tax federal dollars tax spent people petitions create sign house inside white tour interactive january house check offices photo 2012 picks white day office deputy
sWotNR	3	VA	handling allegations states investigate misconduct department penn education sexual disclosure coach defensive sexually allegations young including years education campus offenses statistics failed sandusky jerry crime state investigation department penn boys abusing regard policy clery sex security comply jeanne school launch university official incidents act charged colleges compliance year number community
wdFyf	3	VA	affordable making home map footer skip site content expert learn initiative reductions rate home administrations foreclosure mortgage variety housing options helps interest struggling easier affordable begin transitioning speak explore understand making servicer payment obama modifications refinancing programs homeowners mha deferred relief avoiding aid expectexplore programs mhawhat gathering documentation financial reasons
Anazwx	3	VA	nih health january national release 12 identify scientists workings viruses news 2012 approach institutes view links related bookmark share smaller findings developed viruses human skin institutes bacteria diseases visualize provide niams jan musculoskeletal scientists health structures national discovery arthritis science reported part workings insights 13 institute cells microscope issue researchers
y64sv2	3	VA	management office federal register documents personnel home page additional links amending partial office general county chabot george localities information joann grant federal personnel political add hatch residing 202 restrictions act designated virginia regulations united regulatory opm king counsel 6061700 exemption employees list states contact activity management agency executive services single
NHIcS	3	VA	house white state union video watch enhanced transparency commitment browse house white logs visitor wait executive actions president obama federal receipt tax federal dollars tax spent people petitions create sign house inside white tour interactive event live facebook discussion participate click member facebook give click questions comments httpwwwwhitehousegovvideo ondemand library
8Ee2N	3	VA	visualization nasa studio scientific goddard mission community earth goddard greater visualization end space research inquiry systems scientists activities creation flight scientific outreach understanding studio closely promote processes center programs order nasa products science works facilitate svs accessible visualizations site high totalling images 4200 lastly mpeg2s web make format stills low
SB7ZS	3	VA	nwrs locator refuge map pothole displayed feature report manages coordination adding northern maps acres production location atlas 548 legibly division realtys showing acreage areas rocky 50 96546018 93008use adobe national zoom prairie wetland download georeferenced casual established open magnifying boundaries state print public nwrss web million control enlarge refuge great
g5anAL	3	VA	national nkdep kidney month services health human department management disease understanding detection improving kidney basics longer disease healthier learn kidneys kidney disease tests recommended learn kidney living information people disease kidney loved life lifestyle longer diet live healthier learn information ckd monitoring clinical health management patient education evaluation professionals learn
yMKuEZ	3	VA	colleague division directorate ses behavioral sbe12002 nsf sciences economic letter social dear employment opportunity 12002 sbe colleague division directorate ses behavioral sciences economic letter social dear employment opportunity date february 27 2012 ses economic experts specific span sciences announces multidisciplinary start 1 program scope areas interested division begin march nationwide
Wb3Nl	3	VA	center tornado watch prediction 52 storm status report watch messages 52 information network service national warnings visit iwin weather interactive 40 mod 20 low 30 mod 30 mod 30 mod low high 70 f2f5 probability forecaster 70 60 table event increased category tornadoes probabilities issuing 5 low moderate events awareness
2YZs1o	3	VA	fdsys browse bills congress senate house states types legislative united proposals representatives bills congressional hr house chambers president approval law require senate signature bills limited senate house approval chambers resolutions amendments constitution res generally propose hj joint appropriation purpose president matters require single specific sj signature force senate house approval
zZqILK	3	VA	solstice disruption mission cassini images home image details 1062 5150 titan 660 ring angle degree northern image rings sunlit shows tethys saturnfacing plane kilometers sides center 3200 larger side miles left view acquired image visible spacecraft cassini scale 22 tethys approximately camera 7 8 red titan million 12 kilometers 2011
xZ7PnR	3	VA	arts school language science mission solstice program cassini elementary arts language science school program elementary home education arts language science school program elementary program educators developed partnership education technology precollege excitement area rings writing caltech reading public cassinihuygens outreach capsi foundations blends classroom science space bay project exploration initiative education
ii1pJi	3	VA	hera contents hera overviewwhat hera installing images hera timing hera spectroscopy hera hera college fair educators general lessons research astronomers public amateur students interface data projects science classroom analyze extensions sets adapted software compare series xray results curves literature file rxte saved guides electronically binary data rossi access systems analyze
17R7oz	3	VA	lincoln memorial national search immortalized people civil saved memorial united union emancipator statesthe memory enduring inspiration temple seeks great symbol forever nation preserver words president lincoln attracts warsits marble enshrined hope freedom hearts beneath abraham 16th app memorial service official park parks mall national memorial blossom cherry national parks mall
epFQ3X	3	VA	edsitement social studies history presented civil examine economic lesson documents start maps read strengths war north advantage students weaknesses decide military diplomatic eve side comparisons original south making share partnered thinkfinity lesson find educational save resources plans free edsitement plans updates lesson resources humanities project edsitement endowment national provided verizon
z5NZQg	3	VA	flashlight led target fire burn hazards due sets recalls named washington instructed voluntary consumers illegal commission safety cooperation announced firm product stop dc recalled resell attempt immediately products today recall consumer flashlight product led 6pc sets units 55000 target minn corporation minneapolis importer flashlights fire burn turned hazard heat posing
vT1ye	3	VA	history march 17 today writers 1938american 19361940 federal colonel histories wood wearing life november manuscripts 11 obrien project recited nebraska green river irish parade patron savannah boston unofficial celebrating 492 traditions 1775 city renowned death festival commemorating legend patricks ireland heritage officially today 1824 march saint circa back georgia york
dZqv7y	3	VA	dynamics sdo observatory solar series focus years result elementary education provide scientifically book integrate math increased curriculum back pressure seat recent reading level science ways careeroriented facilities goddard conducted scientists include activities lab day center bring invited greet tour classes activity meet spend ambassador bring sdo click classroom school sun
zr5BNb	3	VA	med sci ncbi enduran sports exerc strike pubmed rates foot injury 2012 function web ncbi javascript site warning requires management citation external file generate software lb evolutionary boston 3university auburn services street 65 human research avenue 81 divinity usa 2department system 02163 health central suite care 500 biology north 4baylor
wnT0JQ	3	VA	supporting house military spouse employment white state union video watch enhanced transparency commitment browse house white logs visitor wait executive actions president obama federal receipt tax federal dollars tax spent people petitions create sign house inside white tour interactive adobe player flash content download view february 15 2313 domain public
abBfFC	3	VA	search lands parks properties bureau maine level skip navigation bureau ranger faq state parks lands reserved public historic sites atv program boating facilities program snowmobile lands submerged recreation community planning acquisition kbprint brochure download page 254 camden maine current reservationspark feescamping passes belfast hills 207 season park 04843 2363109 state
yat87u	3	VA	spring avoid sneezing medlineplus stuffiness page related medlineplus pollen spring allergy healthday news open saturday letting contribute march drift wrong 10 windows flareups air filter experts spring experts allergy college suffer allergies sneezing due sniffling itchy eyes million asthma immunology acaai 35 american stuffiness americans people simple spring allergy enjoyable
wJqiLl	3	VA	grant grantsgov opportunities synopsis opportunity find precedence service disk electronic click information grant provide notification send inconsistency document email resolved notifications printed address opportunity emails change receive thing giving original requestedany represent newest file oldest previous shown documents current document sections files background representing modifications arranged changed list grey synopsis
xBp5DC	4	VA	current uscert activity highimpact web current incidents regularly updated reported types summary uscert activity security page frequent multiple apple released updates safari address vulnerabilities products security os code crosssite obtain information perform vulnerabilities privileges elevated attack attacker condition execute denialofservice exploitation sensitive arbitrary operate scripting articles mitigate users ht5281 encourages
ruG5h8	4	VA	start 1940 census research skip navigation national searching index district 1940 enumeration located charge 2 archives online opens 2012 locate free address census april release http1940censusarchivesgov order search access httpwwwarchivesgovresearchsearch opa online public census delaware 1940 sussex county maps state enter milford sussex including town search census 1940 delaware maps
x20N	4	VA	picture astronomy day fascinating discover featured written image explanation day photograph astronomer cosmos universe professional 11 2012 bright distant earth disk 20 fit easy weeks apogee photographed perigee dark day telescope pacific dense sun asia moon smallest full 300 annular 240 kilometers path super silhouetted filter point image visible smaller
yPoCXt	4	VA	grant grantsgov opportunities synopsis opportunity find precedence service disk electronic click information grant provide notification send inconsistency document email resolved notifications printed address opportunity emails change receive thing giving original requestedany modification description represent newest file oldest previous shown documents current document sections files background representing modifications arranged changed list
awFBvd	4	VA	blue parkway ridge search vistas mountains appalachian meanders protecting special blue slow ridge opportunities enjoying revealing longrange diversity relaxing views closeup makes pastoral parkway highlands animals unlike 469 region drive experience plants stunning miles country providing landscapes paced summer handson mountain offer developed guided programs life demonstrations traditional cultural campfire
130rZ5	4	VA	island national seashore assateague search enjoy coastal move rest existence continent sandy recreated visit forests day live bays life recreate relax time assateague maritime explore marshes waves beaches island salt ocean edge place adapted wind enjoy make thrive horses beauty assateague extraordinary distance island continue wild enjoy barrier ages visitors
zzorv3	4	VA	congress inauguration american library reason treasures jacksons division february 836 1829 emendationsmanuscript inauguration arrangements 2 printed letter holograph en played significant point legislation national advisors states permitting questions tumultuous administrations 1833 jackson system federal people character inaugural masse role party nullification spoils andrew fore cabinet nullify jacksons attended bank kitchen
A1EICf	4	VA	grant grantsgov opportunities synopsis opportunity find precedence service disk electronic click information grant provide notification send inconsistency document email resolved notifications printed address opportunity emails change receive thing giving original requestedany modification description represent newest file oldest previous shown documents current document sections files background representing modifications arranged changed list
Ajqb8y	4	VA	legion national american convention remarks 3 march 2012 delivered member blake introduction water american board works paul association serving councils steve jared paul sounding rex federal board helpful posner members condrey projects aspa salary work facer llorens ive insight allan years steve expertise allen issues rex federal pay guidance jerry
2g3hZ	4	VA	web student aid 1300 january high 200607 year undergraduate grant addition 1 program 2005 750 students award graduated competitiveness school study academic 2006 time pell eligible year academic student exceed year number cost attendance grant addition note pell program combined fiscal full ratably appropriation student payment acg eligible large amounts
wPm5D7	4	VA	cancer older prostate study medlineplus patients overtreated pages related medlineplus seniors cancer healthday news aggressive feb disease 29 forms treatment expectancies life men therapy prostate short study wednesday benefit common found harm cancer instances cary aggressive gross author prostate forms internal treatment medicine progress remaining good university associate men news
z2WPpu	4	VA	grant grantsgov opportunities synopsis opportunity find precedence service disk electronic click information grant provide notification send inconsistency document email resolved notifications printed address opportunity emails change receive thing giving original requestedany modification description represent newest file oldest previous shown documents current document sections files background representing modifications arranged changed list
wlQXra	4	VA	government money states selective usagov services education united register blog asked anonymous money register selective services education work ages grants including service eligible federal college men selective student 1825 study register receive aid order andor violation reaches years registration registrations fine late fails accepted convicted window 250000 prosecuted prison technically
yRQiwq	4	VA	ri sci ncbi ann lab ldl levels low cholesterol clin pubmed serum 2007 function web ncbi javascript site warning requires management citation external file generate software school tel center medical holon sackler israel aviv medicine internal edith department wolfson university ldl 18157 cardiovascular 24 group morbidity mortality associations increased therapy
c7xaOS	4	VA	living learn alcohol healthfindergov healthy drink live moderation quick guide connect website hyperlink nongovernmental direct application hhs consistent hyperlinks states services human subject information hyperlinked united application contained health endorsement department website intended provided visitors external constitute applications privacy appearance practices products policies purpose link redirected information usaccessibility privacy mapcontact
bREk8i	4	VA	government house executive contracting white order economy state union video watch enhanced transparency commitment browse house white logs visitor wait executive actions president obama federal receipt tax federal dollars tax spent people petitions create sign house inside white tour interactive homeowners refinancing house twitter responsible answers hours brian office questions
GBTkQq	4	VA	conference communities house safe watch lgbt live schools white state union video watch enhanced transparency commitment browse house white logs visitor wait executive actions president obama federal receipt tax federal dollars tax spent people petitions create sign house inside white tour interactive leaders people house community transgender partner education justice
AfKeWD	4	VA	notice buy admin request contract construction fhwa america waiver action notice request comments date web posting 03052012 notice publication federal register date determined finding effective federal register determined date comment 15 effective period days date close public passenger nondomestic mpg back minimum cfr 27 requirements 23 federal granted administration state
GntTe	4	VA	william craig fugate fema administrator management emergency federal agency senate craig fugate experience fema confirmed management wealth federal agency appointed barack administrator emergency serve reported leadership community president bringing obama 13 18 2009 agency managed 745 efforts preparedness fugate 138 fdem fema staff 67 management recovery mitigation role coordinated governments
uGYJrZ	5	VA	autoimmune diseases ncbi allergy rev pubmed gut clin leaky immunol 2012 function web ncbi javascript site warning requires management citation external file generate software md biology center usa university school research mucosal medicine maryland 21201 afasanombrcumarylandedu baltimore underlying innovative neuroendocrine disorders tight susceptible controls intercellular equilibrium diseases nonself impaired loss
y0Ubww	5	VA	blueprint increase service efficiency announces stronger vilsack usda operations agriculture secretary operations usda century washington cutting agricultural agriculture 21st built jan costs usdas tom department economy blueprint evolving monday producers 9 streamlining plan 2012the service stronger drive americas vilsack continue presenting meet helps secretary usda years accomplishments businesses modernize taxpayers
67QsDS	5	VA	house apply white state union video watch enhanced transparency commitment browse house white logs visitor wait executive actions president obama federal receipt tax federal dollars tax spent people petitions create sign house inside white tour interactive internship house period application program closed white submitted application materials including recommendations deadline read
xhlTAZ	5	VA	living aortic healthfindergov healthy aneurysms live learn quick abdominal guide connect website hyperlink nongovernmental direct application hhs consistent hyperlinks states services human subject information hyperlinked united application contained health endorsement department website intended provided visitors external constitute applications privacy appearance practices products policies purpose link redirected lower aaa risk steps
xBhvtQ	5	VA	catalog pia15115 page limited supply mission martian rovers rover winter mobility portait mars shows approached power nasas solar dust opportunity reduces cleans exploration panels accumulation wind mission martian images rovers 24 2011 21 camera opportunitys pancam panoramic mounted sols mosaic 2814th omits days downwardlooking 2811th mast dec view wavelengths 601
cWj8HP	5	VA	web student aid click information additional addition alternate listing format student center braille 18004333243 federal publications aid audio 18004fedaid introduce college student pages web programs federal pay section publications aid application apply web federal section free student pages fafsa publications aid called student loans pages web federal section publications explain
6MDKYT	5	VA	assembly watch general video indiana skip navigation ingov displayed disabled message note 1 2 css information read policies standardscompliant browser resolution constitute video result council ic legislative provided profit adopted assembly intended permission commercial meaning part intent purpose coverage general enacted tangible 2511 person benefit act audio expression history support
yInBWz	5	VA	youth preparedness corps citizen communities uniting preparing nation locate login contact council moved page httpcitizencorpsgovgetstartedyouthyouthindexshtm andor links update questions bookmarks citizencorpsdhsgov email links plugin require plugins page view readygov corps notices disasterhelpgovcitizen plugins home fear register privacy federal faqs femagov citizen widgets act policy dhsgov data foia bulletins annual reports
qvXnXj	5	VA	entrez genome view viewer map resources ncbi data genbank organism sequencing projects resources related databases cytogenetic features reference sequence viewer hybrid maintained displays human ests contig tiling physical contigs stss ncbi alternate radiation maps genetic grc predicted include fish genome map graphical assembly models genes component gnomon clones path bac
ag7NbD	5	VA	web student aid financial loan years select 25 generally start choose youll plan student loans 10 depending repaying repay repayment time situation repayment standard month monthly pay repay youll full loans paid standard plan years 10 50 amount payments fixed repaid monthly pay payment interest higher plans standard reason plan
sC7M7L	6	VA	photo house december white 2011 day state union video watch enhanced transparency commitment browse house white logs visitor wait executive actions president obama federal receipt tax federal dollars tax spent people petitions create sign house inside white tour interactive december house check offices photo picks 2011 white day president house
xYUg6h	6	VA	battlefield school district rep park virginia visits 7th cantor elementary congressman representing eric write rep cantor agency tour arrange flag order academy nominations join team receive sign updates email nearest office click electronically visit eric cantor details online location page contact congressman va madison 8258964 office 207 8258960 763 fax
tmqz6S	6	VA	grant grantsgov opportunities synopsis opportunity find precedence service disk electronic click information grant provide notification send inconsistency document email resolved notifications printed address opportunity emails change receive thing giving original requestedany modification description represent newest file oldest previous shown documents current document sections files background representing modifications arranged changed list
rP1Yyi	6	VA	grant grantsgov opportunities synopsis opportunity find precedence service disk electronic click information grant provide notification send inconsistency document email resolved notifications printed address opportunity emails change receive thing giving original requestedany modification description represent newest file oldest previous shown documents current document sections files background representing modifications arranged changed list
ApFLvg	6	VA	gray united description government image blog wolf usagov fallen states list image minnesota recovery species winter service lake endangered forest fish recently description successful learn great lakes western removed 1998 gray wildlife center science region tree wolf fallen wildlife united flaherty service photo fish states scott responsible comments content hope
gr5jlH	6	VA	prices gasoline sample labels cheapest area gasoline prices find aaa aaas state average daily fuel report gauge prices todays averages information estimates price diesel gasoline administration energy weekly determines gasoline cost outlook whats gasoline future prices weve answers questions frequently asked mileage money gasoline gas tips save find shopping car
ifRMjx	6	VA	federal holidays 2012 6103 observed saturday usc federal schedule note sunday 5 establishes holiday public nonworkday monday friday holidays law employees work falls executive purposes years leave federal pay section legal 1 sunday 2 11582 3a holiday public 2012 monday falls day february january employees 1971 11 treated order specifies
4BiybH	6	VA	register restraint nhtsa safercargov child child register restraint national nhtsa administration safety urges traffic highway manufacturer register address identify notify event information provide class current safety mail manufacturers restraint registered important child included manufacturer owners required recall mailing image number sample bottom label note include manufacture manufacturers restraint produce child
sgcY98	6	VA	house submit comments questions white state union video watch enhanced transparency commitment browse house white logs visitor wait executive actions president obama federal receipt tax federal dollars tax spent people petitions create sign house inside white tour interactive accessible committed comments questions open staff administration send concerns wellwishes creating form
