xuIjOO	6	VA	catalog page pia15256 named queen year constellations infrared states visible featured images galaxy ancient northern greek section night sky ethiopia explorer degree united cepheus cassiopeia nasas expanse mosaic king enormous wise 1000square widefield survey milky mythology obscurity infrared bright human millions story eye takes unaided sky stars fade cassiopeia wise
x3xKr9	6	VA	med volumetric ncbi analysis sex pubmed urethr vascular 2010 3d function web ncbi javascript site warning requires management citation external file generate software italy reproduction gynecology studiorumuniversity pathophysiology mater massarenti human bologna department cesarebattagliauniboit alma gspot controversial existence space urethrovaginal threedimensional evaluate ultrasonography structures anatomic 3d color underwent ii orgasm
zGevyz	7	VA	tests gluten ncbi sensitivity pubmed clin serological 2011 gastroenterol function web ncbi javascript site warning requires management citation external file generate software italy hospital st medicine clinical orsolamalpighi bologna department university compare gs gluten sensitivity characterize serological pattern disease celiac found gs spectrum entity markers disorders clinical glutenrelated recently lacking
xXJccI	7	VA	volcanic natural island hazards sea red december zubair pulse 60 violent rising yemeni sea navy activity helicopter captured video northern 23 began sulfor 40 located edge details eruptions dioxide white 2011 red satellite shallow forming eruption coast middecember reported imagery kilometers satellites revealed explosions recent saba showed island highresolution submarine
srHO6N	7	VA	internship usda programs summer strongly give consists employment career usda educational sip located program assistants internships field scientific internship paid gain position opportunity areas institute headquarters experience technical future students enrolled professional usda ambassadors washington county intern agricultural service fl research program health development plant animal attend students dc leadership
rwgoyv	7	VA	grant grantsgov opportunities synopsis opportunity find precedence service disk electronic click information grant provide notification send inconsistency document email resolved notifications printed address opportunity emails change receive thing giving original requestedany modification description represent newest file oldest previous shown documents current document sections files background representing modifications arranged changed list
GYE9	7	VA	tutorials medlineplus health interactive education tutorial easytoread presents variety symptoms health treatment wellness tutorials conditions patient diseases includes graphics audio language institute medlineplus diagnosis learn animated surgeries prevention interactive adobe prompted download tutorial flash note start version tutorials 8 httpgetadobecomflashplayer require mobile twitter subscribe version updates follow email rss national
zd6lUv	7	VA	grant grantsgov opportunities synopsis opportunity find precedence service disk electronic click information grant provide notification send inconsistency document email resolved notifications printed address opportunity emails change receive thing giving original requestedany modification description represent newest file oldest previous shown documents current document sections files background representing modifications arranged changed list
o8Jyaz	7	VA	facts nutrition tips fit guidelines dietary americans tools based offers easy tips plate eating food diet understand teaches icon healthy wellbalanced components interactive breastfeeding weight summer general information late population updated seeking preschoolers women loss kids pregnant specific individuals recommendations calories manage balancing weight increase foods foods reduce building healthy
hHJOXn	7	VA	champions house white change state union video watch enhanced transparency commitment browse house white logs visitor wait executive actions president obama federal receipt tax federal dollars tax spent people petitions create sign house inside white tour interactive mscaption textindent9000px 308px msdetail top top0px height norepeat 9999 349px positionabsolute left495px zindex
w4WLm	8	VA	living healthfindergov healthy live learn quick guide connect website hyperlink nongovernmental direct application hhs consistent hyperlinks states services human subject information hyperlinked united application contained health endorsement department website intended provided visitors external constitute applications privacy appearance practices products policies purpose link redirected information usaccessibility privacy mapcontact act policyfreedom ussubscribe
ftEw0I	8	VA	uscis study materials english test sentences tools speak application writing write materials correctly test reading speaking ability form eligibility interview started uscis prepare read n400 portion determined officer components english naturalization study additional section products select short naturalization process overview video test providing requirements citizenship process eligibility naturalization presentation practice
yH2fMy	8	VA	grant grantsgov opportunities synopsis opportunity find precedence service disk electronic click information grant provide notification send inconsistency document email resolved notifications printed address opportunity emails change receive thing giving original requestedany modification description represent newest file oldest previous shown documents current document sections files background representing modifications arranged changed list
vnrjr0	8	VA	great paterson national park falls historical search industrial played national site revolution nations parkhome industries power service role 7 largest interior 2011 jarvis economy ken building spectacular park waterfalls designated falls director key november shaping jon great harnessed americas american salazar 397th secretary twitter sign follow paterson events great falls
qO22	9	VA	return tax free preparation volunteers topics individuals irs resources programs assistance irs tax qualify elderly taxpayers offer free income counseling tce vita volunteer neighborhood people credit filing tax locations elderly disabled located irscertified malls return vita electronic centers special 50000 taxpayers provide convenient make generally sites libraries returns program income
4dwBHm	9	VA	picture astronomy day fascinating discover featured written image explanation day photograph astronomer cosmos universe professional 11 2012 bright distant earth disk 20 fit easy weeks apogee photographed perigee dark day telescope pacific dense sun asia moon smallest full 300 annular 240 kilometers path super silhouetted filter point image visible smaller
hX1yVe	9	VA	federal holidays 2012 6103 observed saturday usc federal schedule note sunday 5 establishes holiday public nonworkday monday friday holidays law employees work falls executive purposes years leave federal pay section legal 1 sunday 2 11582 3a holiday public 2012 monday falls day february january employees 1971 11 treated order specifies
iRoY8K	10	VA	documents paris 1783 treaty revolution september 1783 states ended recognized united 3 colonies independent formally nation great britain signed treaty american diplomacy process states born britain earth france established united peace largest international newly war conflict arena 177583 formed sophisticated vaguely involving world spain brought great netherlands american independence powers
oqPMKY	11	VA	mcfp outreach weekly 4 2012 illness mental reduce month stigma education raise health awareness designated outreach importance financial private including repaying managing loans difficulties bureau loan protection student complaints accepting borrowers default taking cfpb consumer tip move find allowances decisions information tenth make relocation weeks visit force corps brain experts
jjHHaH	11	VA	hudno11134 hud notice rights homeownership disclosure announces revised servicemembers protects protecting militaryfederal dependents law disclosure duty civil revised washington housing department announced relief development urban notice form servicemembers emphasizes active dependents rights protected today act military duty foreclosure mandates wartime states active rate including court proceeding mortgage personnel percent valid
JJgjA	11	VA	congress nominate national preservation registry films library film board mandating consulting inclusion december national suggestions preservation select experts reviewing plan library alternates established pl110336 end implementation 44 extensively 1988 passage film heritage films save public announced board reauthorization extended recently congress 25 continuing authorizes registry members librarian law 2008 sound
yqexjv	11	VA	solstice cutoff rings mission cassini images home image details covers 396 visible planets cassini mimas closer image rings miles part kilometers shadow saturn middle 246 left view star speck rings bright mimas ringplane relative increase rings brightened factor southern visibility unilluminated side view image visible spacecraft cassini 27 21 approximately
n95RI1	12	VA	fsrionalusdagov ecology microbial biofilms web journal agency sites reports includes citations online article resources agricultural national usda library information biofilms searchable database journal persons citations interested agricultural national usda library ecology searchable persons information biofilms database microbial interested resources nih national library medicine dhhs information biofilms searchable database journal persons
yZ04yM	12	VA	february house photo white day 2012 state union video watch enhanced transparency commitment browse house white logs visitor wait executive actions president obama federal receipt tax federal dollars tax spent people petitions create sign house inside white tour interactive february house check offices photo 2012 picks white day president house
150pf	12	VA	homosexual ncbi 1996 homophobia pubmed ar abnorm psychol function web ncbi javascript site warning requires management citation external file generate software georgia psychology usa university athens 306023013 department assigned aggression monitored penile buss 29 exclusively increases affect videotapes erection admitted individuals unaware exposed erotic individual sexually nonhomophobic questionnaire denies index
wnQalX	12	VA	prime kingdom united official visit david minister house cameron white state union video watch enhanced transparency commitment browse house white logs visitor wait executive actions president obama federal receipt tax federal dollars tax spent people petitions create sign house inside white tour interactive prime samantha british david minister house cameron
7P8SZE	13	VA	cert state corps train partner america effort volunteer prepare proud cert citizen agency neighborhood citizens corps criteria guidelines county council organizational follow encouraged category management police completing objectives government contained state program sponsoring listed bottom basic covered local website jurisdiction description emergency fire material agencies standard sponsored representative response included
i3tx	14	VA	natural senate energy committee resources sector energy modernize electricity seeks 2012 power standard generated nations future clean act guide bipartisan management resource reserve federal responsible stewardship strategy lays act helium 2012 files ferc documents item addition attached chairmans find au letter murkowski senator linked amendment text act joint result substitute
zb0i4q	14	VA	apod march flying 5 night earth 2012 fascinating discover featured written image explanation day photograph astronomer cosmos universe professional 5 march 2012 atmosphere earth captured spectacles rousing sunlit orange wave dark half progresses clouds brightness lightning approaching set sequence seas frame video dawn blue space purple lights haze international occurs
xpI6U8	14	VA	diplomacy house comprehensive white strategy public letter communication interagency president strategic administrations state union video watch enhanced transparency commitment browse house white logs visitor wait executive actions president obama federal receipt tax federal dollars tax spent people petitions create sign house inside white tour interactive house white office press secretary
zCaLwp	15	VA	apod scale march 12 universe interactive 2012 fascinating discover featured written image explanation day photograph astronomer cosmos universe professional 12 march flash player version recent adobe 2012 bring human galaxy flash proportion window spread discovering humanity descriptive familiar stop speckled possibly items smoothness vast bar sizes large small version ten
eumt4	15	VA	national historic steamtown site search bell feel back feet grease rods ground engines people vibrate hot ton smokestack smell today era life oil returned railroading firebox cinders whistle heat hear chuffchuff wheels drive turn stories relive steam buildings people museum modern railroading explore offers steamtown lore technology steam history seasonal
AvoDcr	15	VA	week blog united government national participate qa live protection usagov consumer states week est march session 2pm national question host protection 6 answer consumer tuesday complaint trade experts usagov questions commission provide government consumerrelated answer resources file scams company answers hand chance federal learn latest questions twitter experts chat est
10AQ7M	21	VA	leave benefits labor topic fmla department find documentreadyfunction whelpfulinitfbcontent states department united labor family maintained year group health weeks fmla 12 benefits medical leave unpaid jobprotected act requires employees family reasons accommodate employment responsibilities fmla seeks interests men employers designed promote opportunity legitimate women employees work equal leave unpaid reasonable
vbBNj	21	VA	hsf realtime space human flight data control uptotheminute mission spacecraft path data make sky project applet reside significantly 336 download skywatch cache approximately access internet files 144 downloading 300 sufficient downloaded data 10 hard minutes clear required drive connection nasa time modem kbps updated official responsible amiko curator notices nasa
d0iKKk	24	VA	corps monthly themes preparedness citizen 2011 events communities uniting preparing nation locate login contact council moved page httpcitizencorpsgovnewseventsthemes2012themesshtm andor links update questions bookmarks citizencorpsdhsgov email readygov corps notices disasterhelpgovcitizen plugins home fear register privacy federal faqs femagov citizen widgets act policy dhsgov data foia bulletins annual reports servegov contact bannersaccessibility
b2UtUJ	28	VA	picture astronomy day fascinating discover featured written image explanation day photograph astronomer cosmos universe professional 11 2012 bright distant earth disk 20 fit easy weeks apogee photographed perigee dark day telescope pacific dense sun asia moon smallest full 300 annular 240 kilometers path super silhouetted filter point image visible smaller
b2uIyI	29	VA	house white state union video watch enhanced transparency commitment browse house white logs visitor wait executive actions president obama federal receipt tax federal dollars tax spent people petitions create sign house inside white tour interactive event live facebook discussion participate click member facebook give click questions comments httpwwwwhitehousegovvideo ondemand library
r8k9E	30	VA	mountains great park smoky national search remnants appalachian national life straddles culture tennessee diversity border mountain renowned ancient ridge quality forest animal southern carolina mountains plant north beauty park world great smoky americas visited warblers whitetailed chances deer park yellow spotting improve elk wildlife bears black learn feel mill stars
xl8O0c	32	VA	grant grantsgov opportunities synopsis opportunity find precedence service disk electronic click information grant provide notification send inconsistency document email resolved notifications printed address opportunity emails change receive thing giving original requestedany modification description represent newest file oldest previous shown documents current document sections files background representing modifications arranged changed list
gG1cUf	33	VA	web student aid consolidate borrower loan direct single result federal combine multiple consolidation student loans payment monthly payments offer june consolidation education borrowers january department options 2012 application process loan period servicer special information federal offers terms separate servicers consolidation direct loans borrowers benefits eligible page traditional repay payments repayment
fdgoBb	43	VA	productivity flexibility practices promising department education states flexibility education leaders highlighting spending productively pressures state department unprecedented today funds released address dollars budget federal practices promising spend national education impact duncan spending negative call redirect guiding offer students wrong cut press opportunity seize priorities minimize important principle arne secretary resources
gTIQai	44	VA	parent miami academy county dade department education resources family community county initiative questions find group additional district implementation engagement strategy call turnaround resources academy runs vitti part school miami attached nikolai superintendent directly national share webinar pass information documents kind research encourage sig youll week supporting parent wanted working tpa
eWgcf3	47	VA	web federal fafsa deadlines student aid colleges federal pay attention deadlines state deadline legal student year click school applying residence deadlines state enter aid view dakota nevada prince wyoming minnesota micronesia rico edward alberta puerto maryland marshall texas carolina iowa saskatchewan michigan utah virginia hawaii qc ohio samoa newfoundlandlabrador quebec
f0dwED	48	VA	reform results winning future responsibility department education ranking committee miller kline member chairman members obamas today agenda president education opportunity talk committee senate reduce dual administrations education secure spoke efficient commitments investing week emphasized budget spending future months grade pass reflected grants learning issues span pell written statement today happy
jSNUzQ	54	VA	hsf realtime space human flight data control uptotheminute mission spacecraft path data make sky project applet reside significantly 336 download skywatch cache approximately access internet files 144 downloading 300 sufficient downloaded data 10 hard minutes clear required drive connection nasa time modem kbps updated official responsible amiko curator notices nasa
HFTEus	54	VA	house white april photo day 2012 state union video watch enhanced transparency commitment browse house white logs visitor wait executive actions president obama federal receipt tax federal dollars tax spent people petitions create sign house inside white tour interactive house check april offices photo 2012 picks white day official house
g9ZQJ0	64	VA	house white state union video watch enhanced transparency commitment browse house white logs visitor wait executive actions president obama federal receipt tax federal dollars tax spent people petitions create sign house inside white tour interactive event live facebook discussion participate click member facebook give click questions comments httpwwwwhitehousegovvideo ondemand library
UT2FE	73	VA	house white state union video watch enhanced transparency commitment browse house white logs visitor wait executive actions president obama federal receipt tax federal dollars tax spent people petitions create sign house inside white tour interactive event live facebook discussion participate click member facebook give click questions comments httpwwwwhitehousegovvideo ondemand library
gM0Ww0	77	VA	grant grantsgov opportunities synopsis opportunity find precedence service disk electronic click information grant provide notification send inconsistency document email resolved notifications printed address opportunity emails change receive thing giving original requestedany modification description represent newest file oldest previous shown documents current document sections files background representing modifications arranged changed list
xXGIJ9	77	VA	february media social day awareness 2012 impair stress ageappropriate capacity mental developmental youths reach ptsd challenges health disorder posttraumatic goals providers dealing wwwsamhsagovchildren children friends visit trauma resilient hope families heroes youth learn juvenile mental prevalence years challenges suffer greater stress1234567 justice generally system noting health rates document numerous higher
yUzuQt	363	VA	march house photo white day 2012 state union video watch enhanced transparency commitment browse house white logs visitor wait executive actions president obama federal receipt tax federal dollars tax spent people petitions create sign house inside white tour interactive house 2012 check offices photo march picks white day 30 force
