IjKzdj	1	VA	firstever administration 29 dc states department ribbon green names schools obama education 78 house sutley states including council chair education quality ribbon jackson duncan agency 29 department announce white today administrator arne dc environmental protection schools span firstever 78 list joined green nancy lisa secretary elementary dcs announcement school made
zGwiyJ	1	VA	medlineplus mistakes newbiedoctors resumes found page related medlineplus grens kerry honesty show obstetrics detail research reuters health expected physicians attention applications york 100 applicants training programs 30 credit publications qualities found studies houston cancer attempts mistakes frumovitz lead author anderson willful hope dr md center professor michael honest mislead texas
zIL2wN	1	VA	hepatology management ncbi hemochromatosis pubmed diagnosis 2011 function web ncbi javascript site warning requires management citation external file generate software diehl arora hb mk harrison korenblat franco albrecht whitt rs oshea liu lu rb merriman shuhart jh ling reau porayko ja mc elserag talwalkar kn km martin sc devoss sa
HRBRT2	1	VA	hivaids adults older control people number americans centers living nationwide percent research 1 2015 hiv million half years thirtyone age disease growing prevention 50 century americans occur aging 21st providers network people mark individuals issue today lived hiv importance educating important half cases 17 older clear advent inform hivaids prevention
y1t68h	1	VA	legislative members agreed session votes marks 2012 legislators returned day excluding presented sundays die adjournment hawaii bills view saturdays ten senate house complete pass click special noon governors state reading officially notice measures veto houses consideration sine legislature days vote legislative passed convene final today adjourned 26th versions amend bill
dHI4k	1	VA	tornado scale damage enhanced fujita mile set directly point estimates surface height weather enhanced winds open estimated based measurements 28 damage note 3 listed threesecond indicators 8 speed observations vary standard important judgment minute exposure stations measured fscale gusts levels gust exposures wind development file enhanced spc texas explaining makeup
9kWBiq	1	VA	center tornado watch prediction 65 storm status report messages watch 65 information network service national warnings visit iwin weather interactive 40 mod 20 low 30 mod 30 mod 40 mod 30 mod high 70 f2f5 probability forecaster 70 60 table event increased category tornadoes probabilities issuing 5 low moderate events
ykwWLb	1	VA	policy genetics public fellowship sector serving capitol executive wishing human decisions staff cosponsor policy branch unique assignments guiding translated people national society officials institutes genetics integration research fellowship critical health hill public scientific viewpoints extent improved institute transition experience american greatly nonprofit tools legislative genomics perspectives working clinical fellow professionals
q0jO	1	VA	center tornado watch prediction 53 storm status issued watch 53 report message information network service national warnings visit iwin weather interactive 30 mod 20 low 30 mod 30 mod 20 low 10 low 60 mod f2f5 probability forecaster 70 60 table event increased category tornadoes probabilities issuing 5 low moderate
xXKCKE	1	VA	ars march usda service 19 agricultural apps websites research phone news nutrient 2012 data interactive ars national foods forfee click information variety image apps smart free phone lists consumeroriented database websites composition incorporated nutrient interactive usda reference phones national phone variety forfee home choices agriculture websites apps thumbing version downloadable
A1MDU3	1	VA	coral virgin reef monument islands national search reefs lands system mile belt federal support complex virgin 3 health mangrove john survival contribute shoreline forests waters monument includes reef ecosystems island coral segrass st beds diverse submerged islands life habitat crustaceans fish worms marine grow homes form mollusks create corals colonies
efNu8V	1	VA	wildlife national attwater prairie chicken refuge passenger coastal pigeon dangerously home close extinction percent prairiechicken today prairies attwaters remain left breathtaking presence fish alive wildflowers birds service deepens visit lot spring speices struggling refuge wildlife tallgrass valiantly experience prairie virgin san i10 drive mile market sealy 1 exit road east
J5Oqwz	1	VA	comment sell partners propane transfer energy express jp application ftc lp heritage public seeks comment proposed gp energy amerigas trade parties settlement sell partners application federal transfer agency approved commission ftc lp heritage business seeking propane public express jp agreement excluded approval assets required sale requesting original acquisition raised required
HH4xjk	1	VA	video dental medlineplus health worries news javascript adobe flash enabled content player version 8 requires flash pages related medlineplus fills simple thought dentist steps smiling fear people feel comfortable trip heres health dental dentist important affect care anxiety triggers gums teeth problem called haines matters im healthday doctors news dr
zPZpYl	1	VA	apod 21 january days sun 2012 fascinating discover featured written image explanation day photograph astronomer cosmos universe professional january 21 2012 summer caused month bright paper radio spells 21st northern chosen sky suns 2011 sunny dark records made years day entire university hemispheres weather fixed view telescope trails gaps sun
zcb9dG	1	VA	sci ncbi 2011 deterministic tree community tropical pubmed biol proc turnover function web ncbi javascript site warning requires management citation external file generate software plant 48824 usa michigan mi biology lansing swensonnmsuedu state department east university arrayed results alternative functionally decay similarity deterministic explicitly elevational stochastic dispersalbased elevation means communities
GDf0rO	1	VA	government administration site general gsa auctions services mileage shadow unlisted vin make 1973 year model 48218 rolls royce warranted property condition appointment allowed inspection march custodian 2nd april call listed 28th appointment schedule inspection dates custodian times contact arrangements removal inspection bidders removal loading located responsible awarded cautioned successful packing
zGjYkl	1	VA	uncertainty resilience disaster age forging library fema crisis 2030 action strategic response highlighting strategic foresight initiative 20102011 report progress insights download plugin links plugin require plugins page view pdf adobe acrobat links nongovernment social applications web fema provided reference media companies sites endorse msgdata washington street apply management prepare federal
bTLQAD	1	VA	24 center tornado watch prediction storm 24 status report watch messages information network service national warnings visit iwin weather interactive 30 mod 20 low 30 mod 10 low 20 low low 50 mod f2f5 probability forecaster 70 60 table event increased category tornadoes probabilities issuing 5 low moderate events awareness
wKsMK6	1	VA	loss study hearing americans medlineplus untreated millions pages related medlineplus hearing americans healthday news aged 27 feb million 15 lost older wednesday finds benefit aid study 50 major dont people hearing aids insurance aging inevitable covered concern part lives loss training integrating receive daily theyre researchers process johns inconsequential professor
I7kwrz	1	VA	house white girls stem questions state union video watch enhanced transparency commitment browse house white logs visitor wait executive actions president obama federal receipt tax federal dollars tax spent people petitions create sign house inside white tour interactive edt house 1130am engineering council technology event special girls mathematics white 2012
aLQfWJ	1	VA	face exhibition medicine changing art innovative brought children diverse surgery honors reemphasized spirituality culture nobel field won health exhibition medicine careers achievements physicians excelled attention lives healing procedures advanced women prize roles developing medical wellbeing sample video carved describing doctor medicine exploring woman diversity journey words world unique women physician
xdynRN	1	VA	march topics system exploration solar year overview 2012 shadows march sun 2012 suns magnetic powerful profoundly weather motions magnetospheres layers ancient storms system worshipped cultures analyze life relationship oceans solar affect observed processes planet learn modern influence evidence topic examine planets check information sunspots sun radiation gravity particles field complex
bZXHGL	1	VA	38 center tornado watch prediction storm status report 38 watch messages information network service national warnings visit iwin weather interactive 50 mod 20 low high 90 30 mod 30 mod 10 low high 90 f2f5 probability forecaster 70 60 table event increased category tornadoes probabilities issuing 5 low moderate events
wS7D7q	1	VA	frb 29 congressfebruary monetary semiannual report policy testimonybernanke 2012 identical bernanke march affairs presented senate housing 1 banking chairman committee remarks 2012 urban outlook reserves committee pleased current federal discussion member chairman policy conditions ranking begin congress frank monetary members report present semiannual turn economic bachus gdp limited outlook domestic
HaxJNk	1	VA	celebrating viewing wildflowers areas wildflower celebrating wildflowers usda service forest content skip navigation page viewing wildflower slideshow areas enjoy features national back feature wildflowers glimpse provide forests opportunities add wildflower myriad spectacular limitless viewing areas places grasslands code botany management service 202501103 washington sw rangeland mailstop dc program forest ave
f62hHR	1	VA	treating cryosurgery nonhodgkin full text relapsed view residual clinicaltrialsgov refractory patients therapy lymphoma vaccine bcell cancer relapsed kill dendritic bcell vaccines giving cell immune clinical build white body treating nonhodgkins kills freezing dc residual persons cryosurgery therapy blood rationale lymphoma response vaccine made effective refractory cells tumor trial patients studies
sx4lq7	1	VA	readygov supplies kit disaster basic text supplies recommended list pdfrecommended emergency supply items kit recommended basic include adding emergency items gathered kit basic supplies family suffer member basic supplies injury emergency prepared hurt loved aid prevent decontamination bleeding simply injuries things make treat minor knowing emergency assist stop infection difference
qcR6vD	1	VA	flexibility esea department education learning educators focus outcomes improving flexibility gaps sea rigorous close education quality leaders specific educational nclb requirements voluntary provide agency state achievement equity department increasing local plans exchange students comprehensive act agencies designed student child schools opportunity behalf improve inviting instruction request 2001 statedeveloped increase order
zQCST9	1	VA	analysi psychology ncbi intelligence pubmed revisiting 2012 psychol function web ncbi javascript site warning requires management citation external file generate software psychology usa university philadelphia 19122 pa department temple excessive judgments primed rife foraging group naturalistic irrelevant analytic offers transformation dependent advances world developments processes decisionmaking serves recommendations movement intelligence
tCp8Oh	1	VA	desire sci ncbi people creativity bias 2012 pubmed psychol function web ncbi javascript site warning requires management citation external file generate software ste school management jennmwhartonupennedu usa 19104 pennsylvania university locust philadelphia walk wharton 2000 pa 3620 department activated results experiments including existence necessarily explain acceptance creativity negative propose manipulated
xijvTd	1	VA	compression ncbi ultrasound ventricular cardiovasc pubmed 2011 observ function web ncbi javascript site warning requires management citation external file generate software division arizona usa phoenix mayo az clinic department surgery cardiothoracic heart exists wall fourchamber modifying including pain dyspnea visualize compression lead pectus due symptoms chest critical transthoracic ventricle evaluation
GW9T4V	1	VA	regulates ncbi embo rep mammalian pubmed jnk photic response 2012 function web ncbi javascript site warning requires management citation external file generate software school tokyo biochemistry university graduate 1130033 science department japan biophysics show dynamic assigned jnk behavioural speed kinase bmal1 lengthens neuronspecific insensitive cjun deficient proteins identified phosphorylation fibroblasts
ywOnR4	1	VA	decline ncbi med 2011 econ amazing pubmed fertility anthropol islam function web ncbi javascript site warning requires management citation external file generate software sociology usa university mason anthropology department george moroccan converge planning islam young decreases explicitly seeking world warned motherhood popular fertility constraints population understood officials meanings threats patients
jcIrm	2	VA	web student aid program financial certification loan sources grants repaid undergraduate grant federal nonfederal awarded foundation added degree students student professional cases teacher aid unlike receive earned considered postbaccalaureate bachelors enrolled pell 30 financial year total grant amounts 1 depending fulltime 2011 2013 201112 status full plans attend june award
HYVHO	2	VA	carbon trends dioxide topics defined 400 number ppm years including year mole shown loa divided expressed current parts fraction dioxide molecules dry million complete water reported co2 mauna carbon removed data air record 0000400 vapor seasonal square figure correction month symbols middle monthly dashed onehalf black adjacent red diamond centered
zXwPcz	2	VA	iris substances list az epa jump main content system information iris integrated risk iris search contact additions epa recent relevant find number browsers click alphabetical beginning chemical listed alphabetically substances chemicals service letter iris search substance list casrn command abstracts order registry office information documents develop additional decision program health
cfsgOu	2	VA	hhs mental service returning agreement sign increase defense health members military department services counseling serving corps memorandum people competitive years assigned facilities fighters including human issues partners negotiated promote group knowledge workers offers 4 include carolina affected returning continues insomnia psychiatric primary emergencies joint dodphs georgia therapy deployment report join
JDOkF	2	VA	park canyon bryce national search limestone force series hoodoos canyon horseshoeshaped carved worldly consists rainwater slot colorful eastern plateau claron power geology canyons shaped spires paunsaugunt fins formation erosional unique bizarre dissolving bryce famous windows frostwedging shapes edge rock amphitheaters including called year event astronomy 20 festival skies offer annular
zDiEL4	2	VA	video peel medlineplus protection health news javascript adobe flash enabled content player version 8 requires flash pages related medlineplus protect offer disability major oranges appealing grapefruit years stroke experts vegetables offer health eating learn 70000 protection wanted types women 14 study fruits make researchers caused tended years stroke flavonoids compared
zHsrnj	2	VA	thomas congress text bill library 112th 20112012 hcon ih 107 force misdemeanor high sense constitution section offensive crime 4 constitutes authorization expressing congress president article ii clear prior impeachable act military jones committee judiciary submitted concurrent mr resolution referred force misdemeanor high sense constitution section offensive crime 4 constitutes authorization
u8jtil	2	VA	releases analysis bullying state policies department education laws states schools analysis education antibullying 46 41 current state summarizing department today models bullying released approaches report created policies laws behaviors prevalence efforts related years schools additional april country state 2011 2010 combat statutes introduce 120 address report law shows enacted bullying
tEdYrn	2	VA	living healthfindergov healthy quitting live learn quick smoking guide connect website hyperlink nongovernmental direct application hhs consistent hyperlinks states services human subject information hyperlinked united application contained health endorsement department website intended provided visitors external constitute applications privacy appearance practices products policies purpose link redirected quit steps follow information usaccessibility
vVBX3	2	VA	international station hsf space science saturday videos morning asimov light brighten single science isaac shed saturdays expedition subjects living space write window station crewmembers international aboard read time housecleaning free pettit letter opportunity don iss science variety nasa officer light book control houston series mission mornings downlinked saturday personal logged
tlrJlr	2	VA	poor videos dick forprofit rejects multimedia success gao excuse college archives student senator report rates industrys durbin senators colleges todays office senate characteristics washington states debunks college socioeconomic compares united forprofit floor lower make dick accountability rates longtime public today poor controlled government students dc highrisk gao excuse student report
A4KKSn	2	VA	fraud people alert diabetes government money defraud diabetes plot criminals target people american steal fraud people alert diabetes media deputy oig investigations interviewed baskin general director communications oigs gary roberta inspector cantrell precise diabetic financial vary order strips meters seats additionally orthotics braces information confirmation personal beneficiaries offer generally offers
zH17Db	2	VA	lakeshore dunes national indiana winterfest search temporarily lot 28 kemil park due state construction closed parking expected east open road 2012 national 1200 embrace paul education saturday lakeshores winter dunes douglas 7 indiana pm lakeshore environmental pm400 celebration center january fun winterfest outdoor show skis indoor paper including skiing staff
qYsprX	2	VA	network canberra space communication complex deep nasas laboratory number years spacecraft jet propulsion system pasadena transmit exploring schedule mission california solar robotic antennas worked data day directed advance tracking usa receive months controllers set simulations mission engineering tasks radio antenna calibration maintenance development schedule astronomy projects training times time links
wjgdwp	2	VA	ncbi beverages nutr stor increase pubmed sucrosesweetened fat clin 2012 function web ncbi javascript site warning requires management citation external file generate software mea university aarhus medicine internal endocrinology department denmark hospital soft metabolic longterm humans examined intervention observational syndrome consumption cardiovascular sucrosesweetened effects obesity shortterm disorders drinks studies sssds
kF6ImC	2	VA	division usdoj rights civil section opportunities educational amendment supreme national years held officials enforces fourteenth elementary disabilities education decisions involving educational court constitution basis federal subsequent decision legislation opportunities violates board public higher brown barrier students statutes segregation mandate schools discriminate cases fifty origin secondary ago school language diverse sex
z5HoG3	2	VA	space top museum mission garners solstice cassini air honor features releases space top museum garners cassini home news air honor space top museum air cassini garners honor mar 14 2012 operations jpl show charles years spacecraft cassini operated elachi system superb amazing development diversity beauty director solar saturn 15 study
HAjg0w	2	VA	mission hazy solstice cassini orange orb images home image details atmosphere titan visible pole cassini images hood blue bottom suggest top faint haze layers detected moons orange recent image polar north hazes beginning titans flip vortex learn south view north 5150 titan kilometers 3200 antisaturn miles side view color image
hcHgpI	2	VA	nrc webcast live meeting regulatory webcasts nuclear commission broadcasts internet meetings means nrc improving public communications staff energy rin session inspections situ lbp123 requirements recovery tentative acceptance uranium maintenance criteria appeal meeting final ross tests 855 nrc strata affirmation 3150ai77 feb analyses 10 rule public project 2012 900 medical isotope
zZ2Moo	2	VA	week observatory solar pick dynamics sdo suns magnetic years rotating bright plasma 2010 2012 forces gyrating ultraviolet competing cooler highresolution view back anniversary particles hours active extreme 30 streams detailed 2nd frames feb shifted ago fourminute solar sdo 11 kind strands region launched darker slid mind surface make field cadence
tcYhB	2	VA	star energy air insulation sealing works star energy join homes benefits features air qualified insulation home sealing works summer dont energy installed insulation home open leakage improperly 20 winter leaks pay percent window waste time heat cool homes air outdoors typical holes diagram lighting home homes penetrations wiring air leaks
dPzRnw	2	VA	healthy implementing 2020 people website hyperlink nongovernmental direct application hhs consistent hyperlinks states services human subject information hyperlinked united application contained health endorsement department website intended provided visitors external constitute applications privacy appearance practices products policies purpose link redirected implementation work mapit examples disabled supported javascript note browser based people
wOG84K	2	VA	life fibromyalgia ncbi rheumatol 1993 pubmed comparative quality function web ncbi javascript site warning requires management citation external file generate software division rheumatic diseases university arthritis oregon sciences 97201 health portland obstructive previously results chronic pulmonary quality adversely compared consistently measured lowest controls permanent diabetes scored life dependent arthritis osteoarthritis
hAbWa2	2	VA	service mlk day project find receive mlk updates inbox mlkday follow twitter interests dont tools find toolkits create project tips widget mlk search site day ensure social date follow networks mlkdaycnsgov include serve additional opportunities official national accessibility community usagov fear privacy federal corporation notices website government site foia service
wT7eLi	2	VA	february 15 da14 asteroid earth nearearth miss 2013 2012 discovered bring radii earth rapidly northern sky 4 fade 2013 2012 evening shadow occurring february brightness morning naked magnitude fainter meters traveling 1926 pass close closer sun reappearing approach small eye 35 diameter ring size earths quickly asteroid visibility nearearth spain
H4EdtZ	2	VA	solstice quieted mission storm cassini images home image details giant saturns northern encircling storm learn chronicling mimas kilometers visible bright 179 size saturns due tiny detected 504 image join lost planet miles small 396 speck 313 likewise past 111 epimetheus 113 discerned rings moons 246 70 appears extreme center barely
xnvspW	2	VA	surg ncbi utilization national 2005 endosc outcomes trends pubmed function web ncbi javascript site warning requires management citation external file generate software nh 037560001 center usa dartmouthhitchcock medical lebanon drive 1 department surgery thadeustrushitchcockorg period outcomes states examined surgery united utilization inhospital interest treat morbid obesity study 10year growing bariatric
n3QQVg	2	VA	sec form accurate reviewed information necessarily commission reader complete exchange completethe securities assume determined filing 1 identity issuers information business contact 2 place principal persons 3 related clarification response clarification response clarification response clarification response clarification response industry group 4 size 5 issuer federal select 6 claimed apply exclusions exemptions
ve23E6	2	VA	industries burn unio fire hazards ogrill gas due grills recalls portable named washington instructed voluntary consumers illegal commission safety cooperation announced firm product stop dc recalled resell attempt immediately products today recall consumer product ogrill gas grills portable units 4530 industries xiamen unio corporation china manufacturer ignite fire burn gas
kl0eL9	2	VA	fdsys browse uscode code codification house general states edition titles 1926 years subject information united office broad divided representatives current subjects subsequent main revision permanent cumulative 1934 law present counsel annual 51 editions matter supplements published order laws code office house information gpo verify representatives virtual research contained version editions
