AlHUki	2	VA	congress personal archiving preservation kit library digital day personal archiving back process developed share planning information phases knowledge personal digital events resources weve organized kit host day care archiving find focus event based personal program choose digital youll resources archiving list reference efforts planning download personal written program digital document
6T7lwo	2	VA	respiratory topics protection health safety illnesses mists cancer deaths workplaces environments states addressed lung compliance employment avert industries specifically united standards marine workers hazards gases sprays 5 construction estimated longshoring impairment general diseases protection dusts million protect hundreds standard harmful terminals death wear vapors 13 respiratory oxygen fogs respirators required
164ZEx	2	VA	climate gas inventory emissions report 2012 epa change greenhouse jump main content climate gas greenhouse change emissions search area contact epa sector removals findings trend national back states sources economic collects greenhouse agricultural total statistics provide gases accounting source inventory fossil program include energy activities fuels sinks comprehensive reporting gas
rtOGwl	2	VA	living healthy breastfeed live guide quick healthfindergov learn baby connect website hyperlink nongovernmental direct application hhs consistent hyperlinks states services human subject information hyperlinked united application contained health endorsement department website intended provided visitors external constitute applications privacy appearance practices products policies purpose link redirected ready foods baby eat information
zs5dcP	2	VA	living healthfindergov healthy quitting live learn quick smoking guide connect website hyperlink nongovernmental direct application hhs consistent hyperlinks states services human subject information hyperlinked united application contained health endorsement department website intended provided visitors external constitute applications privacy appearance practices products policies purpose link redirected quit steps follow information usaccessibility
c9sDkb	2	VA	center tornado pds 57 watch prediction storm status report 57 watch messages information network service national warnings visit iwin weather interactive high 95 high 80 high 70 60 mod high 80 60 mod high 95 f2f5 probability forecaster 70 60 table event increased category tornadoes probabilities issuing 5 low moderate
xaHwUm	2	VA	bioenvironmental airforcecom engineer enlisted officer commission direct officer feature interactive technical training education pay benefits additional education enlisted school diploma opportunities high explore ged healthcare requirementbachelor abetaccredited engineering minimum education institution science operations administration sciencebusiness healthhealth professionalallied healthcarehealthcare medicinenatural prevent greenland illnesses blending focus environments area pads industrial identify develop
xh5GRv	2	VA	people healthy violence 2020 injury website hyperlink nongovernmental direct application hhs consistent hyperlinks states services human subject information hyperlinked united application contained health endorsement department website intended provided visitors external constitute applications privacy appearance practices products policies purpose link redirected disabled supported javascript note browser evidencebased area related topic find
wNCRbd	2	VA	advisory statistics transportation request council nominations rita pdf statistics transportation agency administration research bureau innovative technology dot advisory statistics transportation acts request council action nominations summary composed bts collected supported reliability quality statistics solicits acts interested relevance advise objectivity stakeholders transportation serve director persons analyses nominations disseminated consistency dot dates
wiw4CS	2	VA	united standto army states statement posture 2012 major capitol advisors focus rest hearing services committee feb service army informed reduction program enlisted lawmakers veterans chandler 2012 sgt construction personally iii 16 budget budgets refine va force house back related society pressing subcommittee year affairs assistance hill issue dignified raymond agencies
yFzPCW	2	VA	rituximabrefractory ofatumumab ncbi pubmed blood follicu monotherapy 2012 function web ncbi javascript site warning requires management citation external file generate software immunology cancer roswell institute park departments ny medicine buffalo heavily cd20 dose 91 weekly 27 22 wwwclinicaltrialsgov progressionfree rash 4 8 infusionrelated combination leukopenia survival mg therapy international years
2fWrp	2	VA	violent storms tornadoesnatures september national noaa preparedness weather including fema information administration cross version safety department red oceanic schools commerce 1992 atmospheric service american pdf adapted guide summer rotating violent mile world injuries ground east mph rocky 50 miles found spring reported sign year 80 oklahoma arkansas nationwide nature broken
j0A00u	2	VA	division solid paper shredding services waste picnic creek general needwood area parkdetailed lake 3 beach map regional park directions areas md 20855google rockville drive 15850 rock pdf 10 2 pm 20985google md school map kensington albert high 11135 newport einstein mill road 10 2 pm provided office paper systems services
zui2a7	2	VA	home usda kyf compass food farmer compass usda videos discover market pictures field systems farmer local supporting food regional watch compass segment case read learn growing studies kyf computer file compass open acrobat experience reader pdf save map 20092011 years visiting food regional programs farmer usdasupported shows interactive local projects
wV8XYs	2	VA	nih rare february highlights national 16 disease research cuttingedge health institutes 2012 day awareness raises links related bookmark share cc nih clinical center media advisory office recognize national supported cosponsored translational institutes research researchnational 29 day sciences clinical health advancing daylong activities nih diseases government agencies event celebrate celebration organizations
fE9Cvp	2	VA	std residential guidance compliance construction 0311002 osha instruction abstract michaels authority david mph assistant phd secretary executive summary limited developed interpreted interim alternative issues steel personal residential guidance 29 employer presents arrest agencys systems policy activities greater guardrail safe employers framing fall comply structural term covering fully disqualify instruction methods
mYuqg	2	VA	prediction storm center compmap weather references rap analysis 12z rapid pages 1 input 2012 updated fire ruc background fields changed refresh replaced model display mesoscale svrgis apr weather tornadoes gis shapefile visit details 9 2012 19502011 updated 19552011 format shp hailwind httpwwwspcnoaagovgissvrgis reports severe converted page feedback hovered issued displayed
1nI2Rf	2	VA	neighborhood house faithbased white partnerships state union video watch enhanced transparency commitment browse house white logs visitor wait executive actions president obama federal receipt tax federal dollars tax spent people petitions create sign house inside white tour interactive neighborhood office house domestic effectively americans council federal policy white form government
wGldb6	2	VA	apod australia aurora february 1 red 2012 fascinating discover featured written image explanation day photograph astronomer cosmos universe professional 1 february 2012 atmosphere including magellanic earth disk galaxy ground sky showered weeks excited australia familiar aurora emanating oxygen large pictured night small distant back video highlighting particles state 1402 red
zhMOL4	2	VA	presidents make healthiest council year 2012 set presidents past council year activity incorporating physical start reminder achieve 2012 nutrition good ability healthiest reflect goals making great 12 lifestyle level healthy age months realistic commit work weight people presidents set council years resolutions fit percent approximately reality report attainable change january
GEiWb5	2	VA	solstice hyperion distant mission cassini images home image details constant orientation reference 324000 270 shape 90 angle 521000 rate movie system approximately degrees tumbles sunhyperionspacecraft devised blasting watch standard zone 168 encountering kilometers phase spin obtained distance latitudelongitude irregular cosmic orbit moon miles learn hyperion view features image surface visible
qGiT7A	2	VA	information network education usnei information network site usnei education find financial links states recognition information united accredited international frauds students qualifications coming professionals programs foreign avoiding aid institutions information resources providers educators related avoiding accreditation system fraudulent officials recognized international education quality institutions assurance financial links students education abroad information
DmpmR	2	VA	entrez genome view viewer map resources ncbi data genbank organism sequencing projects resources related databases cytogenetic features reference sequence viewer hybrid maintained displays human ests contig tiling physical contigs stss ncbi alternate radiation maps genetic grc predicted include fish genome map graphical assembly models genes component gnomon clones path bac
wqkWbh	2	VA	natural senate energy committee resources sector energy modernize electricity seeks 2012 power standard generated nations future clean act guide bipartisan management resource reserve federal responsible stewardship strategy lays act helium 2012 files ferc documents item addition attached chairmans find au letter murkowski senator linked amendment text act joint result substitute
ft7fT3	2	VA	leaf facility ca recreationgov details campground fallen 9735 reflected walk feet woods guests campground birds fir bears lake wildflower black include meadows mountains racoons views safe cedar forested towering aspen squirrels prominent distance mount crystalclear taylor creek habitat resident surrounding cathedral native leaf nestled variety provide offer sites pine adjacent
rAtlFb	2	VA	requirements reporting faqs payment card news essentials newsroom topics irs resources revenue settlement special network service irs entities internal 1099k begin thirdparty form transactions reporting payment card transitional required relief banks providing notice 201188 201189 faqs special information requirements network details 2011 2012 scheduled begin thirdparty transactions reporting occurred early
9arQHN	2	VA	programmable energy star thermostats star energy products thermostats home programmable find partners partner energy thermostats year spends 2200 180 cooling setting programmable save household properly half maintaining settings average homeowners heating bills preprogrammed summer thermostat asleep home regulate temperature make helps easy programmable save offering homes winter settings thermostat money
aPN39	2	VA	information recreation camping federal recreationgov tour reservation great outdoors visit americas great outdoors visit americas great outdoors visit americas great outdoors visit americas great outdoors visit americas wilderness oasis swimming beach desert alpine mountain wildlife land rocky national arsenal haven flourishing toxic piece refuge reasons states resorts mountain united forests
xEaLTz	2	VA	catalog pia15025 page clark testing scene hardware jet serves laboratory tools situ movements rover participant turret propulsion system arm instrument vstb vehicle test calif pasadena 2012 closest mars rovers precision nasas curiosity robotic end evaluations commands response gerald jpls february missions double inside positioning bed called nasa science shows software
bGiVgQ	2	VA	dale vice house announces disability biden joe assistant policy president white special kareem state union video watch enhanced transparency commitment browse house white logs visitor wait executive actions president obama federal receipt tax federal dollars tax spent people petitions create sign house inside white tour interactive homeowners refinancing house twitter
zd62Kv	2	VA	10 apod lick march observatory moonrise 2012 fascinating discover featured written image explanation day photograph astronomer cosmos universe professional 10 march 2012 warm atmosphere lick san rim color photo reflected 36 echo perched substantial frames nickel 4200 disk viewed telescope jose long chosen rose green sunlight moon location 7 gorgeous
Ab6XBq	2	VA	assessing continuum ncbi biosecur bi eventbased bioterror pubmed 2012 function web ncbi javascript site warning requires management citation external file generate software directorate usa richland wa national courtpnlgov pacific northwest 99352 laboratory security breadth considerations developed held computational research centers decade impact vet group operational environment radiological systems pursuing 8
9uAtiT	2	VA	5 history march today perpetrated 29th boston bloody street paul 1770 5th party photographs division march regt massacre massachusetts king engraver 1770prints revere control bostonians shot slinging crowd house sentries guarding soldiers orders fired group 1770 surrounded late 5 boston contrary struck jeering hardpacked march mortally customs injuring civilians number
hGqm6B	2	VA	urinary diseases ncbi sepoct pubmed 2004 tract dtp revealed ther function web ncbi javascript site warning requires management citation external file generate software wroclaw school university faculty poland dentistry medicine jzef854735pharmanetcompl medical represent infant diphtheriatetanusonly excessive cellular urinary shorten supported years produced predisposed lipophilic tnfalpha children cytokines 24 il6 death
sQD3lC	2	VA	states patent united 8073801 semantic family atomic determine representations statements quality conclusions objectives twodimensional system structure type indicating families rules traceable decomposed integrity adheres tested unique true condition high heading principles operates tabular headings decisions decision conditions operators conclusion body business models includes graphically modeling types operands rule ensure logic
wIyF96	2	VA	training errors phys ncbi related sports int running pubmed ther 2012 function web ncbi javascript site warning requires management citation external file generate software characteristics related volume running frequency link purpose systematic duration injuries examine training review intensity systematic rri defined characteristics variables ages back related general examined frequency performed
I7QOgt	2	VA	management office federal register documents personnel home page additional links amending partial office general county chabot george localities information joann grant federal personnel political add hatch residing 202 restrictions act designated virginia regulations united regulatory opm king counsel 6061700 exemption employees list states contact activity management agency executive services single
wgFhAT	2	VA	national regional park alaska servicealaska officeglaciers harding national snowfall 60 approximately abundant occur ice summers melt fjords 46 gravity parks acres kenai combined glaciers time areas conditions multiple fourth form year million park average connected fall cool feet land snow require annual flow alaska greater large amounts alaskas receives icefield
kZma34	2	VA	rdecom states united army va leaders officers states sustaining conference united army representatives richmond twoday attended combat focused forcesread association upandcoming industry americas massachusettsmore center showcase 6th annual natick soldier held systems development army research engineering command soldiersmore lightening development centersmore natick research soldier engineering folks dedicated group april school
aGrvo1	2	VA	metab ncbi int nutr chocolate exerc pubmed 2006 postexerci sport milk function web ncbi javascript site warning requires management citation external file generate software applied usa laboratory university bloomington 47405 dept kinesiology health human science performance indiana rating endurancetrained results cyclists milk tte isovolumic 4 bout greater workout bouts fluid
x0oqZp	2	VA	eating ncbi disorders loneliness pubmed 2012 janapr psychol function web ncbi javascript site warning requires management citation external file generate software division 17033 eating center adolescent medical usa hershey mlevinelhmcpsuedu state pa college medicine penn disorders milton concept themes interpersonal exacerbate issues relationships disorders symptoms setting treatment health include real
wkOMBL	2	VA	current uscert activity highimpact web current incidents regularly updated reported types summary uscert activity security page frequent multiple apple released updates safari address vulnerabilities products security os code crosssite obtain information perform vulnerabilities privileges elevated attack attacker condition execute denialofservice exploitation sensitive arbitrary operate scripting articles mitigate users ht5281 encourages
92kD7Z	2	VA	center tornado watch prediction 61 storm status 61 report watch messages information network service national warnings visit iwin weather interactive high 70 50 mod 50 mod 30 mod 40 mod 30 mod high 80 f2f5 probability forecaster 70 60 table event increased category tornadoes probabilities issuing 5 low moderate events
xw0F5v	2	VA	living kids alcohol tobacco healthfindergov drugs healthy live learn quick guide connect website hyperlink nongovernmental direct application hhs consistent hyperlinks states services human subject information hyperlinked united application contained health endorsement department website intended provided visitors external constitute applications privacy appearance practices products policies purpose link redirected alcohol tobacco drugs
qJIIcL	2	VA	basics exportgov export set money commitment identify export facts create preparing implementation seek assistance internal bank statement timetable international save defining loan helps status creating business objectives important plan assemble companys requests present advance financing milestones success analyzing completing required specific future time action making constraints anticipate gauge goals topics
ylN5bM	2	VA	development congress library teachers professional institutes teacher summer educators washington primary library effectively institutes tools provide fiveday integrate teaching resources 2012 congress dc applications accepting teacher classroom sources methods primary library sources instruct institutes education millions librarys k12 variety sessions activities participants collections wide digitized congress web expose specialists site
zOMvzF	2	VA	thomas congress text bill library 112th 20112012 hcon ih 107 force misdemeanor high sense constitution section offensive crime 4 constitutes authorization expressing congress president article ii clear prior impeachable act military jones committee judiciary submitted concurrent mr resolution referred force misdemeanor high sense constitution section offensive crime 4 constitutes authorization
w7PGMB	2	VA	thomas congress house library live streams committee house permanent committee intelligence select house agriculture committee house appropriations committee services house armed committee services house financial committee committee house budget house workforce committee education affairs house foreign committee government house reform committee oversight house administration committee house security homeland committee commerce
HtlbQh	2	VA	mission solstice raw questions cassini images frequently asked faq raw questions frequently images home asked images frequently asked questions raw images raw search missing image parts played hard results deep weather images network antenna space locking observations overcome problems back chance important trouble saturn data lost stations signal times bad
4tSh9L	2	VA	apod 20 january universe 2010 fascinating discover featured written image explanation day photograph astronomer cosmos universe professional january 20 2010 years produced distant galaxy million highlights signals finally atlas humanity big showing famous bang background satellites radio ten generation video visualize space movie microwave research scientific emitted galaxies extent starts
zYSmt8	2	VA	ncbi gliadin scand pubmed 2006 gut permeability zonulin gastroenterol function web ncbi javascript site warning requires management citation external file generate software division biology mucosal md center nutrition gastroenterology university school usa research celiac pediatric medicine maryland 21201 baltimore gliadin epithelial zonulin investigated barrier mechanisms effect crosses signaling interaction cells
xftVG8	2	VA	apod star january factory 18 cygnus workings nearby 2012 fascinating discover featured written image explanation day photograph astronomer cosmos universe professional january 18 2012 infrared colors disperse winds galaxy astronomers swan sky prominently collide bubbles years entire lies cygnus large night translated telescope humans inflated constellation blue dense space sun
pV9sDu	2	VA	transit sunearth venus day 2012 years bring teamed summit web exciting hawaii nasa 5 grand transit 2012 atop june kea mauna celebration cast edge venus dont astronomical phenomena year happen miss event special prepare transit 2117 rarest extremely wont venus updated subcription sunearth news day informed podcasts team events latest
zdb7lA	2	VA	web student aid enrolling college apply federal returning period student school youre time aid 150 colleges community grants apply workstudy universities education fouryear federal source largest department students attending student schools america loans discuss types billion career page aid providing financial overview impact requirements federal 1 2012 governing student july
ipgl7l	3	VA	nida videos peerx choose path teens interactive learn clip confront video facts reallife decisions myths end situations make separate character scenarios lets call choose role main youll play drugs drug step abuse path teens include prescription assume choices common shots activity outcome decision interactive selection dont clip ending video path
jCGwtW	3	VA	toxicol ncbi splenda microflora pubmed environ gut health 2008 alters function web ncbi javascript site warning requires management citation external file generate software duke usa north center pharmacology doniadukeedu university durham department 27708 medical carolina fecal including assessments weekly 1111 blot group adverse daily 3 349fold treatment samples decreased remaining
60N0H8	3	VA	miles brothers fire street trip market early motion 18971920 pictures load set retrieve option filmto viewing download disk film future view browser 1 3 part modemmpeg megabytesquick format realmedia 28 13 288 megabytes time higher 2 3 part modemmpeg megabytesquick format realmedia 37 18 288 megabytes time higher 3 part
ou2TaG	3	VA	states adelphi united army dayread adelphi work center bring celebrated 26 lab month april child military army uso ann materiel duringmore commander command honored dunwoody gen md army science proving 50 technologymore senior aberdeen ground santos major headquarters ronald master sergeant armymore asians month pacificmore american asianpacific heritage celebration encouragingmore
rgDdLT	3	VA	rush klondike gold national park historical seattle unit search gold globe national headlines 1897 event unit yukon canada preserves seattle subsequent spreads crucial seattles role telegraph rich strike thousands igniting klondike easy northwestern read park story remote july dreams rush word 17 stampede riches minds historical fields newspaper discover pacific
xOPZAf	3	VA	birthplace theodore national site roosevelt historic pets search pony house held 1902 police photo white mounted roosevelt algonquin officer quentin children badger eli evans beloved captivated bear dr yale small house hard onelegged roosevelt kermit mirror peter barn blue guinea pets admiral ogrady spreckle baron algonquin bob owl named childrens
mNYfwY	3	VA	heart living healthy live healthfindergov health learn quick guide connect website hyperlink nongovernmental direct application hhs consistent hyperlinks states services human subject information hyperlinked united application contained health endorsement department website intended provided visitors external constitute applications privacy appearance practices products policies purpose link redirected information usaccessibility privacy mapcontact act
wXG4iA	3	VA	sheep vet ncbi disease attributed pubmed babesia rec 2012 haemolytic function web ncbi javascript site warning requires management citation external file generate software thessaloniki 27 animals farm university veterinary ngiadinivetauthgr clinic 546 aristotle faculty medicine greece activity browsing empty recording activity turned recording turn back information usa 20894 center pike
9VxcFB	3	VA	living eating healthfindergov healthy live learn quick guide connect website hyperlink nongovernmental direct application hhs consistent hyperlinks states services human subject information hyperlinked united application contained health endorsement department website intended provided visitors external constitute applications privacy appearance practices products policies purpose link redirected information usaccessibility privacy mapcontact act policyfreedom
