diJJFB	1	KS	15 center tornado watch prediction storm status 15 report watch messages information network service national warnings visit iwin weather interactive 40 mod 20 low 40 mod low 10 low low high 80 f2f5 probability forecaster 70 60 table event increased category tornadoes probabilities issuing 5 low moderate events awareness listed
a09XqB	1	KS	center tornado pds watch prediction storm 58 status report messages watch 58 information network service national warnings visit iwin weather interactive high 95 high 80 high 80 60 mod high 70 60 mod high 95 f2f5 probability forecaster 70 60 table event increased category tornadoes probabilities issuing 5 low moderate
tCMPO9	1	KS	industries worldwide input food processing research market agricultural investments structure biofuel wang paul heisey schimmelpfennig pray sun rupa john dayrubenstein carl ling keith king david karmarkardeshmukh fuglie kelly 147 pp december err130 research economic report 2011 sector generally global multinational agricultural networks industries input decades increased food rise half structural
bzt2lq	1	KS	27 center watch thunderstorm prediction severe storm status report 27 watch messages information network service national warnings visit iwin weather interactive 20 low 5 low 30 mod 20 low 30 mod low high 70 f2f5 probability forecaster 70 60 table event increased category tornadoes probabilities issuing 5 low moderate events
ifRMjx	1	KS	federal holidays 2012 6103 observed saturday usc federal schedule note sunday 5 establishes holiday public nonworkday monday friday holidays law employees work falls executive purposes years leave federal pay section legal 1 sunday 2 11582 3a holiday public 2012 monday falls day february january employees 1971 11 treated order specifies
Gzu9Ot	1	KS	stress mission solstice cassini enceladus images home image details alexandria focus tiger stripe images sulcus directorate jpl developed cassini washington mission manages cooperative laboratory technology assembled orbiter jet space propulsion agency pasadena european division cassinihuygens dc nasas california designed institute project nasa science italian information httpwwwnasagovcassini visit mission httpsaturnjplnasagov cassini
yRQiwq	1	KS	ri sci ncbi ann lab ldl levels low cholesterol clin pubmed serum 2007 function web ncbi javascript site warning requires management citation external file generate software school tel center medical holon sackler israel aviv medicine internal edith department wolfson university ldl 18157 cardiovascular 24 group morbidity mortality associations increased therapy
GYE9	1	KS	tutorials medlineplus health interactive education tutorial easytoread presents variety symptoms health treatment wellness tutorials conditions patient diseases includes graphics audio language institute medlineplus diagnosis learn animated surgeries prevention interactive adobe prompted download tutorial flash note start version tutorials 8 httpgetadobecomflashplayer require mobile twitter subscribe version updates follow email rss national
w9Y3da	1	KS	apod saturns 22 january light hexagon 2012 fascinating discover featured written image explanation day photograph astronomer cosmos universe professional january 22 2012 planetary infrared discovered spacecraft motions saturns excluded flybys surrounds emanating rotating fully shape vortex continue corners unexpected imaged movie scientists orbiting shows saturn formation created study timelapse times
d7wl2N	1	KS	center tornado watch prediction storm 96 status report watch messages 96 information network service national warnings visit iwin weather interactive 40 mod 20 low 30 mod 30 mod low low high 70 f2f5 probability forecaster 70 60 table event increased category tornadoes probabilities issuing 5 low moderate events awareness listed
uULivq	1	KS	1994 reform national library insurance flood act fema major disaster national risk reducing tools insurance amended expenditures reform federal make damage flood program floods resulted achieving damaged protection goals properties 1994 effective 1973 nfip act uninsured download plugin links plugin require plugins page view pdf adobe acrobat links nongovernment social
rTX3zB	1	KS	phys ncbi game computer effects pubmed 2011 ther exercise interactive function web ncbi javascript site warning requires management citation external file generate software canada ptsturmccumanitobaca school 0t6 university mcdermot medical r3e winnipeg therapy ave department manitoba r106771 rehabilitation physical prevent mobility engaging motor recovery due progress problems degradation impairments essential
coqf7D	1	KS	center tornado watch prediction 108 storm status report 108 watch messages information network service national warnings visit iwin weather interactive 40 mod 20 low 30 mod 30 mod 40 mod 30 mod high 70 f2f5 probability forecaster 70 60 table event increased category tornadoes probabilities issuing 5 low moderate events
y5rq6P	1	KS	prescription pounds medlineplus meds unwanted put pages related medlineplus unhealthy weight high chronic americans healthday news millions medications mood conditions march friday effect pressure blood 2 diabetes disorders side gain houston district county exist medications hospital pharmacy switching drugs adjusting types roux ryan choices matter chief harris officer simply early
wdAP9d	1	KS	infant carter choking due hazard recalled rattles lee named washington instructed voluntary consumers illegal commission safety cooperation announced firm product stop dc recalled resell attempt immediately products today recall consumer product infant rattles units 25000 carter francisco san calif importerdistributor lee violating childs handle rattle hazard posing throat rattles fit
