ADSiSc	1	UT	infant carter choking due hazard recalled rattles lee named washington instructed voluntary consumers illegal commission safety cooperation announced firm product stop dc recalled resell attempt immediately products today recall consumer product infant rattles units 25000 carter francisco san calif importerdistributor lee violating childs handle rattle hazard posing throat rattles fit
zwLOd1	1	UT	stress ncbi disabil dev parenting pubmed child 2012 intellect behavi function web ncbi javascript site warning requires management citation external file generate software usa university angeles los california cneecelluedu delayed analyses fathers authors ages years posited covaried 237 children identified transactional generally 3 crosslagged supported empirically 9 mothers development 144
85LSBE	4	UT	storm tornado watch prediction 7 center status report watch messages 7 information network service national warnings visit iwin weather interactive high 70 40 mod high 70 50 mod 40 mod 20 low high 95 f2f5 probability forecaster 70 60 table event increased category tornadoes probabilities issuing 5 low moderate events
zALAIh	1	UT	hardware ranch season ranch hardware elkviewing closed rides season winter december snowfall hardware middle weather february end depending ranch elkviewing rides sales ticket purchased close fuel rides pm food sold promptly line ranch sleigh 430 tuesday wednesday thursday day closed christmas pricing cash accept checks credit cards picnic reservations dining
xnKRPC	1	UT	corps ten years blog celebrating citizen fema proved corps community brought preparedness involvement forefront answered citizen power prepared communities safer region stronger making asked unified corps years prince state program citizen maryland emergency dc communities georges individuals enjoy ten concise national provided educate encourage capital umbrella citizensare leadership weas safer
w9Y3da	3	UT	apod saturns 22 january light hexagon 2012 fascinating discover featured written image explanation day photograph astronomer cosmos universe professional january 22 2012 planetary infrared discovered spacecraft motions saturns excluded flybys surrounds emanating rotating fully shape vortex continue corners unexpected imaged movie scientists orbiting shows saturn formation created study timelapse times
2RAq0O	8	UT	national ruins aztec monument search ritual people house describe site reconstructed distant migration follow masonry ancient workers mortar passageways 500 holding today listen kiva search explore part drums puebloan echo pueblo great rooms fingerprints ancestral roof journey time timbers original 900year unesco site states culture world special 1987 united chaco
105uF	1	UT	11 center tornado watch prediction storm 11 status report watch messages information network service national warnings visit iwin weather interactive high 80 50 mod high 80 20 low 30 mod 10 low high 95 f2f5 probability forecaster 70 60 table event increased category tornadoes probabilities issuing 5 low moderate events
zfTyoH	3	UT	solstice past night mission cassini images home image details smaller mimas 1123 396 dominates image dione side 698 measures 246 kilometers day miles view left mimas terrain trailing 20 area lit degrees north rotated dione moons saturnfacing hemisphere antisaturn side 559 image feet visible spacecraft meters cassini mimas sunmimasspacecraft 1833
7sc9wJ	1	UT	reform house white health trust insurance state union video watch enhanced transparency commitment browse house white logs visitor wait executive actions president obama federal receipt tax federal dollars tax spent people petitions create sign house inside white tour interactive adobe player flash content download view 337 november 2009 29 family
tr6oY6	1	UT	acute strength ncbi containin effect caffeine pubmed cond res 2011 function web ncbi javascript site warning requires management citation external file generate software biomolecular coventry university sports sciences uk department rating resistance 015 row repetition crossover interaction bench bout greater repetitions results caffeinated effects ingesting press condition acute perceived fully
x3szyh	1	UT	flood flash utah database google office linked trails buildings hydrographs precipitation radar added including descriptions roads earth impacted event information total imported additional data aggregated flash area reflectivity highlighted flood location storm kmz ncdc events placemark affected drainages food downloaded toolkit records address noaa beginning climate hour created loops database
w1KEJs	1	UT	24 apod january norway aurora 2012 fascinating discover featured written image explanation day photograph astronomer cosmos universe professional 24 january 2012 earth captured northern sky spectacular aurora recombining oxygen large activity round throwing protons sun flare pictured eagle night free latitudes days magnetosphere whats feel powerful mass cloud earths fast
Aq2gBB	1	UT	sees dunes faces mission solstice cassini titans sees features dunes faces cassini home news titans sees dunes cassini faces titans jan 2012 23 sees dunes cassini faces titans partnership mission climatic radar result data saturns space dunes revealed agency geological moon moons european cassini titan regional nasas clues variations analysis
6JoQec	1	UT	center tornado pds watch prediction 5 storm status 5 report watch messages information network service national warnings visit iwin weather interactive high 90 60 mod high 90 60 mod 60 mod 30 mod high 95 f2f5 probability forecaster 70 60 table event increased category tornadoes probabilities issuing 5 low moderate
wSaGdC	1	UT	erasure fbi crime announcement recovery service malicious internet dhs public files complaint joint center practices ic3 erasing efforts hard cyber zeroing effectively computer determine altered backups disk stole information criminals hide network malicious damage access zeros systems criminal alter greatly files good victims business drives sort wiping restoration makes characters
xOY8yS	1	UT	conference join blog call tank fema program disaster kaufman date reportwill crisis resilience workshop 2030 policy 8 speaking risk director dave mgmt report response conceptfema great region hosting analysis time transcripts dont wasnt shame decided long 2 worth phone hold wait longer minutes month discussion ideas forward format visual plan
wuHarH	3	UT	uscis study materials english test sentences tools speak application writing write materials correctly test reading speaking ability form eligibility interview started uscis prepare read n400 portion determined officer components english naturalization study additional section products select short naturalization process overview video test providing requirements citizenship process eligibility naturalization presentation practice
2hfrTC	1	UT	missions national park antonio historical san search 10000 unseen people spanish mission years entering drought accepted deadly pledged mexico attack cultures texas foreswore life north diseases king survival raided early fealty lives lay apache 1700s traveled distance allknowing missions traditional lingered god found south rescheduled september cancelled activities good things
zsHmVi	1	UT	house white state union video watch enhanced transparency commitment browse house white logs visitor wait executive actions president obama federal receipt tax federal dollars tax spent people petitions create sign house inside white tour interactive event live facebook discussion participate click member facebook give click questions comments httpwwwwhitehousegovvideo ondemand library
i3ynEc	7	UT	opinions appeals court utah state courts appellate court back opinions case 10 143 ut app mr tr state filed 20120187ca 2012 case 10 141 ut app iverson filed 20110522ca monavie 2012 case 10 parkin 140 federal ut app filed deseret 20120110ca credit 2012 union case 10 ut app filed 20120075ca
xzMFCp	10	UT	photo house january white day 2012 state union video watch enhanced transparency commitment browse house white logs visitor wait executive actions president obama federal receipt tax federal dollars tax spent people petitions create sign house inside white tour interactive january house check offices photo 2012 picks white day office deputy
cQSs0S	1	UT	adults ncbi arch 2005 crime pubmed psychiatry gen sever victimization function web ncbi javascript site warning requires management citation external file generate software northwestern school usa chicago university medicine feinberg lake 710 sciences shore psychiatry behavioral department drive psycholegalnorthwesternedu 60611 il illness mental community victimization crime live smi risk deinstitutionalization
fHhZlU	1	UT	herbert utah governor gary skip navigation reside feel enjoy lived mansion home visit state details rich privilege invite governors utah great humbled individuals historical history honor beautiful thomas century steeped streets marked highly home mansion close expressive decade 1800s living story built brigham combined rich colorful styles kearns jennie corner
xm5qZC	1	UT	house white state union video watch enhanced transparency commitment browse house white logs visitor wait executive actions president obama federal receipt tax federal dollars tax spent people petitions create sign house inside white tour interactive event live facebook discussion participate click member facebook give click questions comments httpwwwwhitehousegovvideo ondemand library
zPZpYl	1	UT	apod 21 january days sun 2012 fascinating discover featured written image explanation day photograph astronomer cosmos universe professional january 21 2012 summer caused month bright paper radio spells 21st northern chosen sky suns 2011 sunny dark records made years day entire university hemispheres weather fixed view telescope trails gaps sun
9rcmgE	1	UT	13 center tornado watch prediction storm status report 13 watch messages information network service national warnings visit iwin weather interactive 40 mod 20 low 30 mod 30 mod 40 mod 30 mod high 70 f2f5 probability forecaster 70 60 table event increased category tornadoes probabilities issuing 5 low moderate events
jjHHaH	1	UT	hudno11134 hud notice rights homeownership disclosure announces revised servicemembers protects protecting militaryfederal dependents law disclosure duty civil revised washington housing department announced relief development urban notice form servicemembers emphasizes active dependents rights protected today act military duty foreclosure mandates wartime states active rate including court proceeding mortgage personnel percent valid
c7xaOS	2	UT	living learn alcohol healthfindergov healthy drink live moderation quick guide connect website hyperlink nongovernmental direct application hhs consistent hyperlinks states services human subject information hyperlinked united application contained health endorsement department website intended provided visitors external constitute applications privacy appearance practices products policies purpose link redirected information usaccessibility privacy mapcontact
zTFYgW	1	UT	fibromyalgia ncbi rep past pubmed 2004 curr headache pain pres history function web ncbi javascript site warning requires management citation external file generate software yunusuicedu usa illini university 61605 drive illinois medicine college department peoria il concept proposed smythe developed entity sleep disabling symptoms serotonergicnorepinephric term fibromyalgia rheumatology electroencephalogram college
vnrjr0	1	UT	great paterson national park falls historical search industrial played national site revolution nations parkhome industries power service role 7 largest interior 2011 jarvis economy ken building spectacular park waterfalls designated falls director key november shaping jon great harnessed americas american salazar 397th secretary twitter sign follow paterson events great falls
luiUY	1	UT	prevent cancer living healthy learn live healthfindergov skin action quick guide connect website hyperlink nongovernmental direct application hhs consistent hyperlinks states services human subject information hyperlinked united application contained health endorsement department website intended provided visitors external constitute applications privacy appearance practices products policies purpose link redirected information usaccessibility privacy
Stnj	2	UT	hemisphere enlarged northern view documentwritelnbr polar documentwritelnn pass measurement documentwritelncenter time passtime recent extrapolated pass auroral oval plot northern measurements current shows polar satellite hemisphere extent noaa recent position poes hand plot clock noon points arrow meridian red ten map color updated auroral observed underlying statistical pass oval respect fluxes
wICmQR	1	UT	closest dione mission solstice cassini flyby images home image details instruments dione pass surface visible primarily images flyby carthage moon spacecrafts camera moons image higher cassini earlier intended closest cassinis encounter 2011 obtained narrowangle 12 light yield flybys dec resolution linea dione 1123 top 698 epimetheus 113 cassini 86 image
