xa6qIG	1	CA	house white state union video watch enhanced transparency commitment browse house white logs visitor wait executive actions president obama federal receipt tax federal dollars tax spent people petitions create sign house inside white tour interactive event live facebook discussion participate click member facebook give click questions comments httpwwwwhitehousegovvideo ondemand library
zkzZ47	5	CA	volcanic natural island hazards sea red december zubair pulse 60 violent rising yemeni sea navy activity helicopter captured video northern 23 began sulfor 40 located edge details eruptions dioxide white 2011 red satellite shallow forming eruption coast middecember reported imagery kilometers satellites revealed explosions recent saba showed island highresolution submarine
eEFi2Q	1	CA	states patent united 6269361 money results competitive keywords query web enters source add listing bid provider term list comprising occurs page computer result generates network content internet method selecting modify search logging billing listings enabling amount relevant rank accounts addition system listed engine continuous bidding present account determines invention delete
A1pZC2	3	CA	bmc ncbi abrowsea nextgeneration customizable pubmed bioinformatics 2012 function web ncbi javascript site warning requires management citation external file generate software beijing life china center university plant research sciences state pr college peking key bioinformatics laboratory protein gene 100871 sequencing growth open visualization functions rapid platform data indispensable system research
uH7Bm2	1	CA	corps volunteering peace learn agriculture volunteer content jump main navigation limited major corps resources community choosing agriculture enthusiast peace environment improve launching security food workforce overseas immediately volunteer organic career youre entering skills practices sustainable enhance options heart isnt conservation farming environment educationexperience agriculture positions volunteer resume send dont corps
eamuXB	1	CA	hud statute respa banking 12banks title chapter 2605 27real loans mortgage estate administration escrow sec servicing accounts settlement procedures disclosure assignment loan applicant sale servicing transfer relating outstanding loan related assigned mortgage application time disclose sold federally servicing transferred person applies makes notice loan transfer servicing time transferor 1 notice
ykSXsz	1	CA	000089542112000004 documents filing edgar files document format fiscal 1231type de end dealers 13gasic flotation irs companiesassistant director state 12 brokers 6211 year sc security 363145972 incorp processing file year film end irs 3 state 000000000 servicescomputer incorp 1231type 12515049sic de 00586263 director etcassistant data fiscal 7370 programming 34 13ga act
yLdbQr	1	CA	life imagery ncbi soc pers failure pubmed 2011 psychol function web ncbi javascript site warning requires management citation external file generate software columbus psychology usa university 43210 state libby10osuedu department ohio imagining proposed results selfconcepts aspect imagined impact knowledge personal negativity thoughts decreased firstperson topdown selfconcept brockner overgeneralizationoperationalized shameonly selfjudgment
AigJO6	1	CA	obese ncbi skills pubmed interpersonal health 2012 assessment psychol function web ncbi javascript site warning requires management citation external file generate software brazil janeiro federal university de rio ability distress findings results examined perspective assertiveness probability statistically based deal situations binge strangers association higher obese express eating theory problems chance
srHO6N	2	CA	internship usda programs summer strongly give consists employment career usda educational sip located program assistants internships field scientific internship paid gain position opportunity areas institute headquarters experience technical future students enrolled professional usda ambassadors washington county intern agricultural service fl research program health development plant animal attend students dc leadership
hNc4X5	1	CA	dhs bcis returning unclas state 041682 consuls inform visas eo guidelines tags na cvis 12958 uscis iv sop petitions niv 61 returning dhs approved subject citizenship national immigrant services recommendation proper cites 1 end forwarded guidance support k3 k1 bureau instructions dhs material returned processing immigration applications visa nvc fam
xP11sK	1	CA	central shakeout earthquake blog slogans safety fema comment accordance comments blog moderated policy femas links nongovernment social applications web fema provided reference media companies sites endorse msgdata washington street apply management prepare federal rates homeland department 4fema emergency dc 43362 20472202 sw agencyus security500 6462500text tty assistance step 46275853 800
yJ8XZj	2	CA	philippines limited gathering activities sulu warns venues due archipelago warning including occur conference terrorist threats area travel reminded mindanao targeted state manila department 2011 public reflects dated centers shopping continuing activity june occurred indiscriminate terror recent insurgent replaces airports 14 places attacks philippines citizens incidents risks island malls country sulu
uXEX2G	1	CA	cassini rings mission solstice images home image details smaller farthest mimas cassini spacecraft 396 86 top rings moon moons closest prometheus 246 kilometers center noticeable 53 miles image left view mimas terrain moon northern leading rings ringplane sunlit lit hemisphere side view acquired image visible spacecraft cassini scale approximately camera
c8c6T7	1	CA	uscis study civics materials test questions pass tools answer prepare materials correctly 6 interview 10 started test 100 study list civics naturalization asked additional section products select short naturalization process overview video test providing highlighting citizenship rights responsibilities civics video history audio format official list answers civics mp3 questions test
Aaud9j	2	CA	year house continuing white address economy grow weekly state union video watch enhanced transparency commitment browse house white logs visitor wait executive actions president obama federal receipt tax federal dollars tax spent people petitions create sign house inside white tour interactive adobe player flash content download view domain 07 january
lzXQ3c	1	CA	strawberry industry economic service research 914 bulletin statistical number seasonal recordhigh acreage produced americans follow 1980 due production acre anticipated inflation half prices 1993 1994 pounds large pace continue output trend crop states growth 80 grown united april began percent 3 5 strawberry higher eating june california strong consumption average
tr6oY6	1	CA	acute strength ncbi containin effect caffeine pubmed cond res 2011 function web ncbi javascript site warning requires management citation external file generate software biomolecular coventry university sports sciences uk department rating resistance 015 row repetition crossover interaction bench bout greater repetitions results caffeinated effects ingesting press condition acute perceived fully
qvXnXj	1	CA	entrez genome view viewer map resources ncbi data genbank organism sequencing projects resources related databases cytogenetic features reference sequence viewer hybrid maintained displays human ests contig tiling physical contigs stss ncbi alternate radiation maps genetic grc predicted include fish genome map graphical assembly models genes component gnomon clones path bac
fFv8z	1	CA	corporations small businessselfemployed small businessselfemployed topics irs resources elect tax purposes individual pass corporations passive shareholders federal avoid responsible builtin flowthrough returns rates income gains taxation deductions report assessed losses credit personal double corporate status requirements corporation qualify meet business signed shareholders 2553 form corporation submit small pdf order election
zs1del	1	CA	flashlight led target fire burn hazards due sets recalls named washington instructed voluntary consumers illegal commission safety cooperation announced firm product stop dc recalled resell attempt immediately products today recall consumer flashlight product led 6pc sets units 55000 target minn corporation minneapolis importer flashlights fire burn turned hazard heat posing
tIAwuL	2	CA	uscis study civics materials test questions pass tools answer prepare materials correctly 6 interview 10 started test 100 study list civics naturalization asked additional section products select short naturalization process overview video test providing highlighting citizenship rights responsibilities civics video history audio format official list answers civics mp3 questions test
z6RAGx	3	CA	benefits ncbi med pubmed risks activity 2011 gast south physical function web ncbi javascript site warning requires management citation external file generate software division center medical regional department landstuhl internal germany martindonaldjgmailcom landstuhlkirchberg medicine ulcer irritable gastrointestinal disorders symptoms protective affected risk unequivocally effects randomized reduces activity constipation bleeding reduce
yuYuGd	1	CA	jan 9 2011 blotter 33rd locationsabout usnonemergency3034413333 streetboulder 803013034413300other address1805 emergency911 boulder 6a1a18 uiheadercolor favorites twitter servicesexclude uicobrand print addthisconfig servicescompact google facebook delicious var ffffff email uiheaderbackground house unlocked 12390 ave sounds information police suspect pm investigated door males reported front awakened left university told leaving block residents male
y8XVrE	1	CA	colleagues law senate challenge 35 health bailey senator kay care hutchison texas obama supreme senate washington states 35 file rtx law united court spending health bailey bipartisan hutchison today multistate dc amicus kay republican behalf colleagues challenge joined senator democrats years businesses trust poorly perfect 20 legislation tape passed unprecedented
9Lwh52	3	CA	water contaminants drinking epa content area jump main navigation contact water contaminants drinking links national primary regulated apply limiting details visit enforceable health systems legally public regulations levels drinking water protect list npdwrs standards contaminants alphabetical regulations links primary water sheets listing drinking fact cramps illness diarrhea vomiting gastrointestinal fecal
k8eVQd	1	CA	circumference penile ncbi study urol length 2001 pubmed 3300 eur function web ncbi javascript site warning requires management citation external file generate software italy university department urology florence size disciplines estimates knowledge provide young interest extensive normal males dimensions external considerable penile carried study variations genitalia male italian set weight
xD5gOp	1	CA	grant grantsgov opportunities synopsis opportunity find precedence service disk electronic click information grant provide notification send inconsistency document email resolved notifications printed address opportunity emails change receive thing giving original requestedany modification description represent newest file oldest previous shown documents current document sections files background representing modifications arranged changed list
w6SviE	2	CA	year house continuing white address economy grow weekly state union video watch enhanced transparency commitment browse house white logs visitor wait executive actions president obama federal receipt tax federal dollars tax spent people petitions create sign house inside white tour interactive security move years middle decade takes shares forward economy
yOOrBm	3	CA	cancer allatonce taking testing genetic sequencing approach parallel massively prevent reasons results uncontrolled growth genomic happen dividing inappropriate knowing diseases genes stop inherently mutations cells cancers tumors cancer caused lung skin environment suns ultraviolet exposure interaction tobacco light cancers smoke result cancer point individual protects run copies cell mutation passed
v4SBqs	1	CA	ncbi prevalence mutations biol somatic detection pubmed low 2011 genome function web ncbi javascript site warning requires management citation external file generate software diego gilman usa center cancer la university drive 92093 california moores oharismendyucsdedu jolla san ca 9500 ucsd breadth clonal udtseq methods cancer limited detection specificity mutations restrict
hElilD	1	CA	cellderived human ncbi neurol cells stem pubmed neuronal exp 2009 embryonic function web ncbi javascript site warning requires management citation external file generate software university finland tampere engineering biomedical department technology ttx synchronous rodent synapses human spontaneous networks monitored disorders sodium susceptible receptors production 4 electrical indicating vitro treating methiodide
A19yUK	1	CA	apod 1232 ngc january spiral 7 grand galaxy 2012 fascinating discover featured written image explanation day photograph astronomer cosmos universe professional january 7 2012 bright motions captured outer ngc explain clusters good greater dark revolving vast dim large fascinating dynamics blue dense wielding dominated galaxy dominate 1232 galaxies invisible telescopes
A4aeii	1	CA	mart childrens lead chairs due stools standard gifts elegant recalled violation paint named washington instructed voluntary consumers illegal commission safety cooperation announced firm product stop dc recalled resell attempt immediately products today recall consumer product chairs stools childrens 1300 chairs 1600 stools units mart los gifts elegant importer calif angeles
cjYwfD	1	CA	schedule wsdot ferries dockbound viaduct wednesday 0835 510the jackson marion construct entering close 5 impact driving offloaded drivers due thursday access exit 9 terminalawv utilizing 2012 activities customers colman 7 awv pmseattle southbound underneath dock construction traffic western northbound affect change diverted yesler 10 alaskan university vehicles overnight exiting street
UzvPh	1	CA	program nearearth object asteroids mission human space accessible interested website flight users tool observers planners nearearth missions robotic roundtrip invited list future rendezvous view story full diameter equator surface radii meters thought pass earth ring size orbital earths located 45 asteroid 2013 2012 35800 nearearth february 15 inside 35 da14
ybU30W	3	CA	opensource projects image linux single images size pcs desktop environment bigview panning multiscreen multiple cooperate running additionally software zooming work large arbitrary view interactive control code manage environments set distributed functionality basic resources framework observe user services observation applications view software engineering java larc application opensource innovation development field started
h4PmkO	1	CA	apod august 22 2004 night earth fascinating discover featured written image explanation day photograph astronomer cosmos universe professional 22 august 2004 phenomenon developed including japan cheaply find dmsp seaboards emailattachment editors australia oceans dark print made satellites areas highresolution large night populated rivers earth click pictures asia lights version orbiting
yh1YnS	2	CA	genetics ncbi yeast food annu rev impacting technol sci pubmed 2010 wine function web ncbi javascript site warning requires management citation external file generate software lfbissonucdavisedu usa university 95616 davis enology viticulture california department partial dynamic aroma implying underlying flavor contributions availability impact renewed highlights production defining combination yeast vary
yLyACf	1	CA	barrington works providers school reports rigov officials health outbreak pertussis providers december middle officials elementary total confirmed working rhode health department meadows diagnosed hampden attend received students school student report cases barrington 22 island pediatrician healthcare pertussis control antibiotic student cdc assess officials identify close home staff coverage working contacts
uXZ4rH	1	CA	fdsys browse bills congress senate house states types legislative united proposals representatives bills congressional hr house chambers president approval law require senate signature bills limited senate house approval chambers resolutions amendments constitution res generally propose hj joint appropriation purpose president matters require single specific sj signature force senate house approval
mdnG0s	21	CA	battery household program collection chain food humans metals batteries mercury end lead illegal disposed environment causing potentially landfills toxic health waste universal household nickel cadmium california negative risks throw trash animals longer rule common affect battery household locations library partnered batteries proper educate effort dispose utilize encourage program los containers
aJN540	2	CA	exportgov tapping financing government programs financing offers types description programs link learn apply click finance government assist related online services training products exporting events sales trade counseling service listed international local achieve specialist commercial goals programs receive contact marketplace enables obtain accept effectively export working needed grow capital development business
y5vNyT	1	CA	advisory sab chartered experts staff standing candidate opportunities board input casac serve nomination committees science annual epa jump main content science staff advisory board epa false committee nsf query searchreadformquery returnfalses dosearch function return locationpathnametolowercasesplitnsf0 parentcommittee path line escapequery search querystring contact windowlocation dosearchdocumentforms0queryvalue standing committees casac sab annual chartered
8WZXbd	1	CA	heater star energy tankless gas water home heater star energy tankless gas water products home find partners partner larger family storage energy year families heaters compared save model star gas standard water qualified 100 tankless heating bills typical heater major 30 storage energy expenses heaters cut needed make hot remodeling
udS4sg	8	CA	nucleic ncbi platform res acids phytozome gree pubmed comparative 2012 function web ncbi javascript site warning requires management citation external file generate software dmgoodsteinlblgov creek usa institute energy walnut joint genome department ca 94598 evolutionary httpwwwphytozomenet developed focus including broader web rapidly systems resources increased functional joint sequencing level advent
10AQ7M	1	CA	leave benefits labor topic fmla department find documentreadyfunction whelpfulinitfbcontent states department united labor family maintained year group health weeks fmla 12 benefits medical leave unpaid jobprotected act requires employees family reasons accommodate employment responsibilities fmla seeks interests men employers designed promote opportunity legitimate women employees work equal leave unpaid reasonable
xEZZvG	1	CA	apod august sun spicules 2 2004 jets fascinating discover featured written image explanation day photograph astronomer cosmos universe professional 2 august 2004 atmosphere suns magnetic resolution earth carpet 50000 rapidly young thousands eventually soundlike dark half transparent hour timesequenced flux pictured enigmatic frame back images envisioning shown sun state filled
z5GWnK	16	CA	thomas congress library record 112th 20112012 congressional senators baucus senate december crapo tax 3630 respect cardin cut 23 kyl barrasso continuation 2011 conferees temporary hr pursuant act payroll casey part reed appointed order introduced resolutions bills public today additional cosponsors reports filed today read pro latourette representative letter tempore appointed
zZgfiz	1	CA	neurol ncbi cognition decision primary progressiv pubmed behav making 2012 function web ncbi javascript site warning requires management citation external file generate software cognitive institute ineco egleichinecoorgar neurology aires buenos argentina semantic reallife neuropsychological controls iowa objective aphasia performance condition matched cognitive progressive investigate shed detection perspective advantageous decision crucial
wLYGZ9	1	CA	sy pat ncbi seq 2012 pubmed oligonucleotide dna gene patents recent function web ncbi javascript site warning requires management citation external file generate software engineering laboratory 510275 education sun research sciences yts9009sinacom life guangzhou china key school center ministry university yatsen biotechnology gene emerging compromising effectiveness biology high raw engineering
hAbWa2	1	CA	service mlk day project find receive mlk updates inbox mlkday follow twitter interests dont tools find toolkits create project tips widget mlk search site day ensure social date follow networks mlkdaycnsgov include serve additional opportunities official national accessibility community usagov fear privacy federal corporation notices website government site foia service
ytG7Zj	1	CA	prev ncbi cancer spectrophotometr pubmed biomarkers 1998 epidemiol function web ncbi javascript site warning requires management citation external file generate software australia centre university menzies research health hobart tasmania tdwyerutaseduau population wavelengths show accurate intervals 650700 skin spectrophotometric accepted density stained 400 histological causation biopsy difference susceptibility nonserial tumors quick
b7K1p7	19	CA	iss radio ham reference radio ham constant mission astronauts radio ham space station international amateur companion specialists fly nations cosmonauts distress text astronauts radio earth experimentation 1983 families long program communication dozens sarex amateur emergency school russian television thousands preparation pioneered including voice similar cosmonauts duration station russians space flight
Gwly5	1	CA	televisions energy star televisions star energy products home find partners partner projection kwh year direct tvs high electricity refrigerator largest 500 versus standard rear larger roughly products resolution fact view energy estimates americans ship television size consumers efficient 40 factor electronics 2011 televisions star greater inches million 39 choice association
oPwmki	5	CA	institute management emergency 12 2010 october developed revised states agriculture lessons united group objectives administration compliant ics learned nims national wildfire emergency fire reflect collaboratively department coordinating 100 emi institute 2006 release management successfully purposes review note version equivalent updated completed is100a is100b courses credentialing is100 9 august 2010 features
mRyYNC	1	CA	flaccid guidel penile ncbi 1996 erect states length pubmed urol function web ncbi javascript site warning requires management citation external file generate software school francisco urology san usa university medicine california department assist penile provide guidelines circumference length augmentation counseling patients flaccid penile normal physically men prospectively erect pharmacological erection
bHLU8H	2	CA	bomb ncbi mind dev cell 2003 ligase pubmed essential ubiquitin function web ncbi javascript site warning requires management citation external file generate software md nih nichd genetics usa 20892 bethesda laboratory molecular internalization selection leads facilitates lateral remaining deltanotch fragment activation inhibition release essential domain progenitors cell mediated zebrafish genes
zn2ApT	4	CA	dig sci ncbi bowel syndr pubmed irritable 2010 permeability intestinal dis function web ncbi javascript site warning requires management citation external file generate software netherlands center gastroenterology university departments research angelekerckhoffshotmailcom utrecht gastrointestinal medical unit glycols urinary ratios show timedependent results lactulose agents irritable 0012 noxious 1500 compromise 400 greater
rWaL0b	1	CA	mlkdaygov receive mlk updates inbox mlkday follow twitter links photo channels good video images find previous inspiring ways media day widget weve included opportunity gallery projects search engage involved social mlk interests dont create project find toolkits widget mlk search site day ensure social date follow networks ensure social date
LfKkq	1	CA	congress library preservation digital information program alliance stewardship preservation outreach infrastructure digital home education national infrastructure national preservation initiative ndsa members sustained information make work stewardship program digital contribution read ndsa preserving memories libraries memory tips preserve digital nations individuals steps tips view network fostering outreach preservation content encourage digital
yH1eL6	1	CA	intake risk cancer antioxidant ncbi nutr pubmed nutrients 2012 function web ncbi javascript site warning requires management citation external file generate software geoffreykabateinsteinyuedu usa 10461 medicine albert epidemiology health york einstein department college bronx population evidence ci intervals lymphoma condition associations risk yr association nutrients identified large 20th reduce substantially
