edZXON	2	CA	living healthfindergov healthy live sleep learn quick guide connect website hyperlink nongovernmental direct application hhs consistent hyperlinks states services human subject information hyperlinked united application contained health endorsement department website intended provided visitors external constitute applications privacy appearance practices products policies purpose link redirected daily sleep routine small day change
zcsxKD	1	CA	computational neuroanatomy ncbi rev pubmed speech nat neurosci produc 2012 function web ncbi javascript site warning requires management citation external file generate software cognitive usa university 92697 irvine sciences california department gshickokuciedu control traditions psycholinguistics reveals ideas examination result chasm rarely feedback closer higherlevel goal grounded interacted predominantly state production
9W4SNG	1	CA	week west xyz house white wing state union video watch enhanced transparency commitment browse house white logs visitor wait executive actions president obama federal receipt tax federal dollars tax spent people petitions create sign house inside white tour interactive adobe player flash content download view midshipman house walk rig navy
HD6YW	2	CA	training cognitive ncbi longterm pubmed 2006 effects fun everyday jama function web ncbi javascript site warning requires management citation external file generate software development family pennsylvania university 16801 slwpsuedu state pa college human department studies function abilities adults shown effects everyday improve training cognitive older demonstrated function training abilities cognitive
yaEf9H	2	CA	house ncaa forces white joining state union video watch enhanced transparency commitment browse house white logs visitor wait executive actions president obama federal receipt tax federal dollars tax spent people petitions create sign house inside white tour interactive adobe player flash content download view domain 06 january 100 public 2012
dQIU3b	1	CA	southern mission solstice cassini rhea images home image details terrain hemisphere diones trailing wispy wisps moon icy learn dione 1123 area 698 moons rhea 1528 polar north saturnfacing kilometers 949 antisaturn side miles south view dione cassini closer northern rings ringplane sunlit obscure side south view 6 acquired image feet
rRveAD	1	CA	protective blocks ncbi pubmed serologic infl blood rituximab 2011 response function web ncbi javascript site warning requires management citation external file generate software oncology cancer olavyrirrresearchno university department clinic oslo medicine surgery norway hospital seasonal influenza pandemrix results group titers treatment protective lymphoma prolonged ah1n1 benefit common cells respond achieved
hZjdDi	1	CA	information center cpsc carbon monoxide colorless killer gas invisible carbon monoxide poisonous odorless called 150 people related states appliances year stoves heaters fireplaces fuelburning unites include nonfire accidental improperlyused furnaces water faulty incorrectlyvented die products poisoning consumer shed portable family kill home generator generators doors vents basement windows inside garage
yI63kE	1	CA	apod sun 29 2003 simmering orange july fascinating discover featured written image explanation day photograph astronomer cosmos universe professional 2003 july 29 gradual month bright giant busy absorption suns cool increased dark records areas small telescope simmering sun contrast parent standard active appears great quiet times amount place color image
22PtZn	1	CA	bio 199 glenn jr astronaut john herschel glenn colonel jr nasa astronaut ret john usmc cambridge concord 1921 children grown castor personal anna grandchildren margaret july data born 18 married ohio awarded colleges glenn primary engineering college education universities doctoral doctor concord muskingum degrees secondary attended degree honorary bachelor schools
bHrdIf	3	CA	begin videos protection coverage home recover insurance easily floodsmartgov flood flooding skip navigation free call toll 18883799531 transcript 31 sec case protect floods flood plan home insurance storm day im home things greg head roof points supposed chose wasnt fred flood supposed insurance character back camera moves ive fred plan
A28KKe	1	CA	ncbi variation sequencingbased copynumber pubmed bioinformatics exome 2011 function web ncbi javascript site warning requires management citation external file generate software school ma usa biostatistics 02115 harvard health boston department fsathirafasharvardedu public point powerful detection insertiondeletion utility cnv detect loh copynumber extends approach ability variation heterozygosity sequencing exome data loss
yoI36l	5	CA	repair chairs due hazard high fall recalls ikea named washington instructed canada voluntary consumers illegal commission safety cooperation health announced firm product stop dc recalled resell attempt immediately recall products today consumer product antilop chairs high 36000 169000 133000 units canada north conshohocken llc importer pa services ikea america unexpectedly
zDo8DF	1	CA	current uscert activity highimpact web current incidents regularly updated reported types summary uscert activity security page frequent multiple apple released updates safari address vulnerabilities products security os code crosssite obtain information perform vulnerabilities privileges elevated attack attacker condition execute denialofservice exploitation sensitive arbitrary operate scripting articles mitigate users ht5281 encourages
vRN1RA	2	CA	job seekers unlimited experience edd participate expertise computers employment machines training office variety personal shorten access internet publications associations fax sharing advantage wide unemployed unlimited search update job focused networking underemployed sharpen professionals school space backgrounds experience skills range individuals fields sponsored represent professions unlimited experience participants including absolutely skilled
aGrvo1	2	CA	metab ncbi int nutr chocolate exerc pubmed 2006 postexerci sport milk function web ncbi javascript site warning requires management citation external file generate software applied usa laboratory university bloomington 47405 dept kinesiology health human science performance indiana rating endurancetrained results cyclists milk tte isovolumic 4 bout greater workout bouts fluid
splA6M	1	CA	mission tiny solstice terminator cassini images home image details speck 313 70 epimetheus 113 line closer image rings tiny moon black 504 shadows wide southern hemisphere kilometers bit appears center larger planet cast miles thin enceladus left northern rings ringplane sunlit side view wavelengths nanometers acquired image 60 spacecraft 66
bKCzpO	1	CA	web student aid colleges financial community grants repaid click universities requirements additional variety federal review program details grant offer students attending schools loans unlike career fouryear page quick aid eligibility financial grants apply based application federal submit read listed fafsasm eligibility free student factors aid page program undergraduate certificate pell
A0rmc3	1	CA	mlkdaygov receive mlk updates inbox mlkday follow twitter links photo channels good video images find previous inspiring ways media day widget weve included opportunity gallery projects search engage involved social mlk interests dont create project find toolkits widget mlk search site day ensure social date follow networks ensure social date
qJIIcL	2	CA	basics exportgov export set money commitment identify export facts create preparing implementation seek assistance internal bank statement timetable international save defining loan helps status creating business objectives important plan assemble companys requests present advance financing milestones success analyzing completing required specific future time action making constraints anticipate gauge goals topics
tEdYrn	3	CA	living healthfindergov healthy quitting live learn quick smoking guide connect website hyperlink nongovernmental direct application hhs consistent hyperlinks states services human subject information hyperlinked united application contained health endorsement department website intended provided visitors external constitute applications privacy appearance practices products policies purpose link redirected quit steps follow information usaccessibility
tI4ZBT	1	CA	solstice hyperion odd mission cassini images home image details constant orientation reference surface orbit 270 shape images previous latitudelongitude system moon features inventory tumbles extend devised standard 168 coverage kilometers satellites spin irregular rate miles hyperion zone watch blasting cosmic encountering learn movie hyperion wavelengths miles nanometers 1145 image feet
wbXEUY	3	CA	strength ncbi sense subjective pubmed objec memory neurosci 2011 function web ncbi javascript site warning requires management citation external file generate software radboud netherlands donders institute cognition university behaviour brain nijmegen szqinstanfordedu phenomenon magnetic results functionally number series ventral lateral indicating photographs tests junction activation processes scene day disentangling term
wUlys1	27	CA	king entrance martin national waive park luther jr fees 2012 weekend day yosemite search national saturday yosemite fee january admission holiday 2012 monday offer park jr visitors free weekend day celebration king luther 14 16 martin starting honor waiver fees good lodging fee camping weekend include activities entrance park jr
aw3KZ1	1	CA	advisory bulletin special advisory bulletin special exclusion programs federal effect health participation care operations advisory cmps background office breadth september money kinds mission entity cfr guidance identify human misconduct cmpl issues 1 enhance violate application explain furnished exclusion examples entities program extends excluded congressional physicians affected provisions contracts bulletin cover
As0r5k	2	CA	uscis study civics materials test questions pass tools answer prepare materials correctly 6 interview 10 started test 100 study list civics naturalization asked additional section products select short naturalization process overview video test providing highlighting citizenship rights responsibilities civics video history audio format official list answers civics mp3 questions test
d7PFbS	1	CA	hud cpd program home investment partnerships ii home cfr electronically 24 information additional title housing pages program authorized national affordable amended web cranstongonzalez part 92 regulations visiting rule final act found andor people lowincome partnership direct states grants rent home provide rental housing localities build assistance formula local useoften affordable
rUrTN1	4	CA	saturn treats mission solstice nasas cassini delivers holiday saturn features releases nasas cassini home news holiday delivers treats saturn treats nasas cassini delivers holiday dec 2011 22 saturn treats nasas cassini delivers holiday show titan spacecraft radio cassini images delivered saturns pictures flying ornament system signals reindeer pasadena largest holiday
Ab7l2W	1	CA	giant full natural neuropathy text study clinicaltrialsgov view axonal history 30 mental infancy caused sensation years leads enlarged effort research children giant death develop propose disability find investigators join dysfunctional gigaxonin clinical increasing axonal life invite weakness pathologically conduct defect gan medications therapy significant impaired future gene rare prepare effective
hAl5rh	13	CA	gluten ncbi sensitivity markers celiac biol psychiatry pubmed 2010 dis function web ncbi javascript site warning requires management citation external file generate software school pediatrics usa hopkins johns sheppard research 21204 medicine pratt program fdickersonsheppardprattorg department stanley maryland baltimore increased sensitivity reported schizophrenia inconsistent association gluten immune studies 151 chain
jjHHaH	1	CA	hudno11134 hud notice rights homeownership disclosure announces revised servicemembers protects protecting militaryfederal dependents law disclosure duty civil revised washington housing department announced relief development urban notice form servicemembers emphasizes active dependents rights protected today act military duty foreclosure mandates wartime states active rate including court proceeding mortgage personnel percent valid
eibPZG	1	CA	aids tool posters world day restrictions copyright encourage materials downloadable 11 24 kb85 kb customizable poster 564 288 kb18 134 pdf 292 85 11 24 mb18 mb customizable 208 poster 132 mb85 pdf 365 85 11 24 kb85 mb18 840 customizable poster mb kb18 919 pdf 114 104 85 11
pJKobo	1	CA	surg ncbi vasc atherosclerosis disc endovasc degenerati 2009 pubmed eur function web ncbi javascript site warning requires management citation external file generate software finland terveystalo helsinki leenakauppilafimnetfi healthcare obstruct aorta lbp flow back lumbar middle disc including result pain feed sacral arteries abdominal review lowback degeneration associations literature dd atherosclerosis
UT2FE	11	CA	house white state union video watch enhanced transparency commitment browse house white logs visitor wait executive actions president obama federal receipt tax federal dollars tax spent people petitions create sign house inside white tour interactive event live facebook discussion participate click member facebook give click questions comments httpwwwwhitehousegovvideo ondemand library
qOyPdE	15	CA	24 apod august ethiopia iridescent pileus 2011 cloud fascinating discover featured written image explanation day photograph astronomer cosmos universe professional 24 2011 august disturbances image colors cloud size unusual group photographer sunlight noticed bands explanation wave dark wavy iridescent clouds diffract similar darker detailed related multicolored sight pileus picturesque amounts
zr5BNb	18	CA	med sci ncbi enduran sports exerc strike pubmed rates foot injury 2012 function web ncbi javascript site warning requires management citation external file generate software lb evolutionary boston 3university auburn services street 65 human research avenue 81 divinity usa 2department system 02163 health central suite care 500 biology north 4baylor
wOm8uM	1	CA	express dna ncbi cancer methylation lock stably res gene pubmed 2012 function web ncbi javascript site warning requires management citation external file generate software md usa center cancer houston university leukemia anderson department texas leads 24 stably reprogramming removal signals permanent treatment stable weeks endogenous achieve chromatin druggable histone therapy
bREk8i	2	CA	government house executive contracting white order economy state union video watch enhanced transparency commitment browse house white logs visitor wait executive actions president obama federal receipt tax federal dollars tax spent people petitions create sign house inside white tour interactive homeowners refinancing house twitter responsible answers hours brian office questions
hg9jlS	1	CA	topics 2020 objectives website hyperlink nongovernmental direct application hhs consistent hyperlinks states services human subject information hyperlinked united application contained health endorsement department website intended provided visitors external constitute applications privacy appearance practices products policies purpose link redirected disabled supported javascript note browser started overview includes topic data select evidencebased
zxLj8B	2	CA	current uscert activity highimpact web current incidents regularly updated reported types summary uscert activity security page frequent multiple apple released updates safari address vulnerabilities products security os code crosssite obtain information perform vulnerabilities privileges elevated attack attacker condition execute denialofservice exploitation sensitive arbitrary operate scripting articles mitigate users ht5281 encourages
tCMPO9	4	CA	industries worldwide input food processing research market agricultural investments structure biofuel wang paul heisey schimmelpfennig pray sun rupa john dayrubenstein carl ling keith king david karmarkardeshmukh fuglie kelly 147 pp december err130 research economic report 2011 sector generally global multinational agricultural networks industries input decades increased food rise half structural
AnqXpb	4	CA	omega6omega3 ratio atheroscler ncbi cardiovas rep pubmed 2006 curr function web ncbi javascript site warning requires management citation external file generate software metabolic street dakota usa west research 57105 health foundation 1400 nutrition diseases falls billharrisusdedu sioux 22nd institute university south sd inflammatory human cardioprotective ratio enzyme systems include fas
s7lBdb	1	CA	ncbi 2011 petct surveillance patients pubmed haematologica hodgkin function web ncbi javascript site warning requires management citation external file generate software aalborg hospital university aarhus denmark partial background p002 211 true results preclinical interim controversial petct firstline 22 eligible situations 28 recurrence remission rules survival methods therapy lymphoma performing benefit
blUvBo	1	CA	house bo white state union video watch enhanced transparency commitment browse house white logs visitor wait executive actions president obama federal receipt tax federal dollars tax spent people petitions create sign house inside white tour interactive family pictures bo dog obama march garden family house rose bo dog 2010 3
ftEw0I	4	CA	uscis study materials english test sentences tools speak application writing write materials correctly test reading speaking ability form eligibility interview started uscis prepare read n400 portion determined officer components english naturalization study additional section products select short naturalization process overview video test providing requirements citizenship process eligibility naturalization presentation practice
y0iHys	1	CA	phila ncbi spine pubmed pa low 1976 assessment association 2011 function web ncbi javascript site warning requires management citation external file generate software institute university finland oulu medicine clinical department rehabilitation physical adults study young imaging crosssectional muscles severity back young symptoms paraspinal low predicts evaluate atrophy adults lbp adults
qJJAhM	1	CA	text app blog updates digital message tools fema great app newwaiting tn iphone memphis addresses text reads blank message information prepare 4femajust 44362 correct 4fema 4336 address massesbrothatech read making updated weve pointing text 43362 updates message post clear blog text app font make image pagethe landing user inside experience
vRiKCm	99	CA	newsinfo usaid health hivaids major played presidents global people addressing years past diverse pepfar aids crisis 1986 living leading program role treatment largest today marking continues affected emergency 25 timeline million usaid chart averting hivaids plan key usaids inception world care milestones technical work 34 leadership relief partner initiative prevention
xnnkYL	1	CA	med ncbi pubmed palliat 2012 care blogging landscape palliative function web ncbi javascript site warning requires management citation external file generate software marymount university hospice cork medicine ireland department hospital palliative ethical confidentiality grade communication glioblastoma iv raises terms issues relationship media organisation physicianpatient pontine 30yearold clinical health interest medium
yGKMFs	2	CA	appraisal ses system ses feedback meets issued consistent executive flexibility customization clarity coordination greater capability ratings management centering provide agency system specifically uniform role equity development omb interagency workgroup evaluate collaboration standards communicate agencies delivery framework leadership link designed members performance opm expectations derivation governmentwide employees promotes compensation responsibility consistency
hK5alc	8	CA	office la county health womens public prevent appointment nowfree cancer schedule qualify18007938090call tested close home cervical pap test office national county rate initiative education ccpei diagnosed cancer los health prevented cervical women january times angeles 2000 prevention womens launched prevent cancer lack county result expensive affects latinas late los korean
xBp5DC	6	CA	current uscert activity highimpact web current incidents regularly updated reported types summary uscert activity security page frequent multiple apple released updates safari address vulnerabilities products security os code crosssite obtain information perform vulnerabilities privileges elevated attack attacker condition execute denialofservice exploitation sensitive arbitrary operate scripting articles mitigate users ht5281 encourages
z5NZQg	2	CA	flashlight led target fire burn hazards due sets recalls named washington instructed voluntary consumers illegal commission safety cooperation announced firm product stop dc recalled resell attempt immediately products today recall consumer flashlight product led 6pc sets units 55000 target minn corporation minneapolis importer flashlights fire burn turned hazard heat posing
4dwBHm	1	CA	picture astronomy day fascinating discover featured written image explanation day photograph astronomer cosmos universe professional 11 2012 bright distant earth disk 20 fit easy weeks apogee photographed perigee dark day telescope pacific dense sun asia moon smallest full 300 annular 240 kilometers path super silhouetted filter point image visible smaller
3ZDu	1	CA	medical dictionary medlineplus letters find type asterisk spelling word youre medical visit understanding words tutorial pagesword abbreviations meansome specific parts common interested mobile twitter subscribe version updates follow email rss national guidelines accessibility library human institutes quality copyright privacy april health bethesda department 8600 2012 updated 20894 md medicine services
vG8lcT	1	CA	apod thunderclouds jumping sundogs 8 november 2011 fascinating discover featured written image explanation day photograph astronomer cosmos universe professional altsee picture clicking resolution explanation version download 8 november highest 2011 phenomenon years web rapid sky reorients differently sundog return emerged words clouds lightning inspection temporarily enthusiasts past curious encouraged sum
sVVdyO	1	CA	apod full january aurora sky 3 norway 2012 fascinating discover featured written image explanation day photograph astronomer cosmos universe professional january 3 2012 atmosphere unexpected ago striking sky magnetic results 60 lies stretched airplane rarely viewed complete mountain realm wide space image poles horizontally molecules auroral circle norway aurora higher
vekSb	1	CA	battlefield national bighorn monument search 1876 including fighting 7th soldiers armed george cavalry 26 area personnel indians lakota lt cheyenne preserve life custer 25 thousand june 263 efforts died armys sioux army attached memorializes warriors col battles famous american bighorn battle history battlefield monuments national podcasts bighorn life dedicated defending
rLIW1C	1	CA	city partners offer energy usgbc free bloomington home assessments residents city list department bloomington select 4 release november 2011 coordinator information 3493406 city schlemmer director communications sustainability contact bauer bauerjbloomingtoningov bloomington schlemmjbloomingtoningov jared jacqui 3493837 homeowners december energy partnership reduce community council effort city lottery consumption provide residential system late
b2uIyI	16	CA	house white state union video watch enhanced transparency commitment browse house white logs visitor wait executive actions president obama federal receipt tax federal dollars tax spent people petitions create sign house inside white tour interactive event live facebook discussion participate click member facebook give click questions comments httpwwwwhitehousegovvideo ondemand library
wWGZkP	2	CA	monitoring emergency nuclear radiation japanese radnet laboratory data epa content area jump main navigation nuclear monitoring radiation japanese emergency operations site radnet information routine 2011 march returned june purposes data 11 30 informative continue historical epa radnet laboratory envirofacts monitoring realtime visit current website exchange data central database air historical
A5yc2M	1	CA	ncbi nature fam rev parenting pubmed child clin nurturing 2011 psychol function web ncbi javascript site warning requires management citation external file generate software box usa psychology wa university washington 98195 351525 department seattle proposed temperament reviewed fear adjustment children susceptible differently include increases effects gender operates individual irritability developmental
GOZOt	1	CA	house white state union video watch enhanced transparency commitment browse house white logs visitor wait executive actions president obama federal receipt tax federal dollars tax spent people petitions create sign house inside white tour interactive event live facebook discussion participate click member facebook give click questions comments httpwwwwhitehousegovvideo ondemand library
