v4ltNA	4	CA	fly apod space january free 1 2012 fascinating discover featured written image explanation day photograph astronomer cosmos universe professional 1 january 2012 guided mission farther nitrogen earth 41b backpack satellites bay works heavy retrieve weightless challenger meters cargo space propulsion robert mccandless pictured drifting mmu free jets safer experience untethered
xLVZT0	2	CA	mart childrens lead chairs due stools standard gifts elegant recalled violation paint named washington instructed voluntary consumers illegal commission safety cooperation announced firm product stop dc recalled resell attempt immediately products today recall consumer product chairs stools childrens 1300 chairs 1600 stools units mart los gifts elegant importer calif angeles
3Gl61S	1	CA	mileage driving gas tips efficiently sample labels money aggressive acceleration rapid driving percent 5 speeding save highway mileage braking gas wastes safer town lower 33 speeds reaches 60 speed rapidly decreases vehicle fuel optimal economy mileage gas mph range speeds gas mph 60 gallon 031 paying additional assume drive 5
1fJal	2	CA	bernanke 21 deflation 2002 speech november deflation doesnt making happen excessive money lack stability world argued discipline stray expectations rise stripes bane inflation cage heightened standards large essential leaders creation industrialcountry serviceshas result factors public shocks monetary understanding inevitable goods central favorite pick equally economists number 1990s political tame selfconfirming
zqgStz	1	CA	dti methods ncbi highresolution vivo nonh optimization pubmed 2010 function web ncbi javascript site warning requires management citation external file generate software rochester usa university ny engineering computer electrical 146428648 department protocol magnetic results brain human implementation similarities technique molecules accurate means effects unique reveal highresolution accessible voxel acquired challenges
xHmTHC	3	CA	year house continuing white address economy grow weekly state union video watch enhanced transparency commitment browse house white logs visitor wait executive actions president obama federal receipt tax federal dollars tax spent people petitions create sign house inside white tour interactive security move years middle decade takes shares forward economy
uvUSJr	1	CA	immunocompromised ncbi infection pubmed dev clin bartonella immunol 2012 function web ncbi javascript site warning requires management citation external file generate software usa pennsylvania hospital philadelphia medicine department mosepelemosepeleuphsupennedu university caused escape henselae system paper including establishing examine gaps living develop immune bartonellas quintana severe discuss current scratch milder fever
61C82n	9	CA	database executive aftermarket parts orders control eo executive assigned arb check undergone number granted system increase parts vehicle modification smog order evaluation referee controlled shown exempted emission part bar verified installed engineering addon exemption stations antitampering vehicles modified called specific emissions laws databaseslists related search catalytic executive converters order catalytic
iRicPw	1	CA	apod launch 18 space shuttle endeavour 2011 fascinating discover featured written image explanation day photograph astronomer cosmos universe professional 18 2011 atmosphere rocketed endeavour magnetic mission astronauts years earth sts134 image midjuly familiar dark dock strangelets 2 ams specific orbiter detect space antimatter atlantis international seconds deliver iss days massive
wjgdwp	1	CA	ncbi beverages nutr stor increase pubmed sucrosesweetened fat clin 2012 function web ncbi javascript site warning requires management citation external file generate software mea university aarhus medicine internal endocrinology department denmark hospital soft metabolic longterm humans examined intervention observational syndrome consumption cardiovascular sucrosesweetened effects obesity shortterm disorders drinks studies sssds
xdNiTK	2	CA	pap tests color pdf full cancer find pap cervix vagina test checks opens womb part lower smear cells turn sex pap 21 start 3 vaginal tests years women time pap make normal find call test appointment period change cells harder including pap based doctor things nurse tests woman decide talk
zZqILK	45	CA	solstice disruption mission cassini images home image details 1062 5150 titan 660 ring angle degree northern image rings sunlit shows tethys saturnfacing plane kilometers sides center 3200 larger side miles left view acquired image visible spacecraft cassini scale 22 tethys approximately camera 7 8 red titan million 12 kilometers 2011
v1JHfx	1	CA	med ve consumption food ncbi pubmed black effects 2011 cardiovascular function web ncbi javascript site warning requires management citation external file generate software biology 54601 wisconsin usa la university wisconsinla department crosse saturated hypercholesterolemia results human cardiovascular cardioprotective polyunsaturated walnut black lipids versus affected increased dependent fats effects day meal
yxb4tU	8	CA	blueprint increase service efficiency announces stronger vilsack usda operations agriculture secretary operations usda century washington cutting agricultural agriculture 21st built jan costs usdas tom department economy blueprint evolving monday producers 9 streamlining plan 2012the service stronger drive americas vilsack continue presenting meet helps secretary usda years accomplishments businesses modernize taxpayers
sC7M7L	1	CA	photo house december white 2011 day state union video watch enhanced transparency commitment browse house white logs visitor wait executive actions president obama federal receipt tax federal dollars tax spent people petitions create sign house inside white tour interactive december house check offices photo picks 2011 white day president house
y0Ubww	4	CA	blueprint increase service efficiency announces stronger vilsack usda operations agriculture secretary operations usda century washington cutting agricultural agriculture 21st built jan costs usdas tom department economy blueprint evolving monday producers 9 streamlining plan 2012the service stronger drive americas vilsack continue presenting meet helps secretary usda years accomplishments businesses modernize taxpayers
AjbadD	1	CA	ncbi medi foodborne capability potential social 2012 pubmed pathog dis function web ncbi javascript site warning requires management citation external file generate software newk0019umnedu school usa university minnesota community minneapolisst epidemiology health paul public food share foodborne detection platforms qualitatively source ways media create system surveillance content potentially rich internet
zHQME0	5	CA	white christmas statement house coptic president celebration state union video watch enhanced transparency commitment browse house white logs visitor wait executive actions president obama federal receipt tax federal dollars tax spent people petitions create sign house inside white tour interactive house white office press secretary peace joyous egypt globe people
w8bFzm	1	CA	flashlight led target fire burn hazards due sets recalls named washington instructed voluntary consumers illegal commission safety cooperation announced firm product stop dc recalled resell attempt immediately products today recall consumer flashlight product led 6pc sets units 55000 target minn corporation minneapolis importer flashlights fire burn turned hazard heat posing
qQj0K	1	CA	information recreation camping federal recreationgov tour reservation great outdoors visit americas great outdoors visit americas great outdoors visit americas great outdoors visit americas great outdoors visit americas wilderness oasis swimming beach desert alpine mountain wildlife land rocky national arsenal haven flourishing toxic piece refuge reasons states resorts mountain united forests
8faZ4	1	CA	resident aliens citizens abroad small businessselfemployed taxpayers international topics irs resources reside estate resident tax alien estimated united generally returns income subject worldwide paying rules citizen abroad states gift filing duty file resident allowed year alien 2month calendar pay due citizen residing return june regular date overseas 15 extension requesting
ypxVq0	1	CA	functions cognitive ncbi obsessivecompul pubmed nord psychiatry 2012 function web ncbi javascript site warning requires management citation external file generate software denmark university tretommervej ocd aarhus 1 clinic sannkjaermdk 8240 risskov hospital obsessivecompulsive traitlike frontostriatal question brain unclear establish answering neuropsychological ocd state difficulties treatment dependent neuroimaging documented change cognitive
9a4NNI	1	CA	2012 voices recovery month unnoticed people share celebrating broader educate recovery treatment vehicle public sharing voices effort population successes country stories works website story recovery share month stories view prefer city story provide state choose email information post anonymous address remain spreads mental people month message recover contributions recovery positive
yv7mTH	1	CA	spawn highlights bookbinding collection early maryland willman records museum government collections online guide special spawn highlights bookbinding collection early maryland willman files aaco questions site refmdsanet instances personal abide constitutes username accessing restrictions educational agreement purposes password copyright difficulty work contact marylandgov assembly judiciary governor general copyright 2010 produced state
mNYfwY	1	CA	heart living healthy live healthfindergov health learn quick guide connect website hyperlink nongovernmental direct application hhs consistent hyperlinks states services human subject information hyperlinked united application contained health endorsement department website intended provided visitors external constitute applications privacy appearance practices products policies purpose link redirected information usaccessibility privacy mapcontact act
ziz9rR	5	CA	notod12028 research misconduct findings notod12028 notice number datesrelease january key 6 date 2012 issued services health human department dhhs purpose notice office ori research integrity case summary action final facility national bioinformatics engaged lushington kinbre misconduct institutes graphics based additional grant gerald admission research 1 written inquiry health molecular oversight
wZ7cFJ	2	CA	ncbi area front pubmed orthographic contamination brocas 2011 psychol function web ncbi javascript site warning requires management citation external file generate software cnrs psychology laboratoire university de france aixmarseille marseille cognitive contaminates results years brain dorsalanterior auditory permanently speech inferior belonging read frontal activation test areas specific found learning past
2AOvHS	1	CA	joshua park national tree search reveals features fascinating attraction climatic winds home geologic viewed closer variety make add examination rich surreal skies park vitality dark cultural rain strong desert hints plants land animals shaped unpredictable extremes place night history road torrents dont miss 20 sun cross moon sunday western solar
q8oag	1	CA	crossing borders dhs information updates email official nexus states including entering id children united travel approved card passport document merchant business present airports citizens kiosks air orders military mariner 1 june 2009 beginning top back secure travelers states including entering children present united travel air passport document information resident continue
zTtxZJ	21	CA	house white state union video watch enhanced transparency commitment browse house white logs visitor wait executive actions president obama federal receipt tax federal dollars tax spent people petitions create sign house inside white tour interactive event live facebook discussion participate click member facebook give click questions comments httpwwwwhitehousegovvideo ondemand library
cWj8HP	3	CA	web student aid click information additional addition alternate listing format student center braille 18004333243 federal publications aid audio 18004fedaid introduce college student pages web programs federal pay section publications aid application apply web federal section free student pages fafsa publications aid called student loans pages web federal section publications explain
jSNUzQ	14	CA	hsf realtime space human flight data control uptotheminute mission spacecraft path data make sky project applet reside significantly 336 download skywatch cache approximately access internet files 144 downloading 300 sufficient downloaded data 10 hard minutes clear required drive connection nasa time modem kbps updated official responsible amiko curator notices nasa
l8tKTL	1	CA	apod 20 sky journey night 2011 fascinating discover featured written image explanation day photograph astronomer cosmos universe professional 20 2011 galaxy inspiring effort sky skies dark cape day vast entire clouds brightness bulge miles night uncover unaided view result year images project congeries sites wellplanned full galaxies 60000 found eye
utqQpc	2	CA	ene ncbi acids nucleic pubmed portal genome res department 2012 function web ncbi javascript site warning requires management citation external file generate software creek usa institute energy ivgrigorievlblgov drive walnut joint genome department 2800 mitchell unified fungal metagenomes find web point capabilities bioenergy systems mycocosm joint trillions sequencing world projects
sw9yxb	1	CA	exploring yoga ncbi int pubmed effects 2011 therapeutic function web ncbi javascript site warning requires management citation external file generate software recreation management center university mississippi usa research ms 215 health behavior science department turner exercise show results sleep cardiovascular physiological treatment practice suffering effects structural articles respiratory continue multitude
6w2Jwy	1	CA	proclamation national slavery month trafficking human house prevention white presidential state union video watch enhanced transparency commitment browse house white logs visitor wait executive actions president obama federal receipt tax federal dollars tax spent people petitions create sign house inside white tour interactive house white office press secretary proclamation moments
fd1bnN	1	CA	media social 2011 day awareness mental exposed percent children develop young event health traumatic problems adulthood 18 months single 35 behavioral emotional childhood families providers dealing community resilience visit young children trauma learn http1usagoveurfx5 demonstrate adulthood1 exposed ages problem2 persistent psychological single children mental develop percent young event health potentially
t2n3Hv	1	CA	tube medlineplus encyclopedia insertion ear medical layer eardrums outer tube placing eardrum middle tissue thin insertion separates ear tubes involves adults insertion apply children information tube note symptoms similiar focuses problems article ear painfree general surgical asleep cut eardrum collected fluid child suction removed made anesthesia small infections hearing middle
w3VyxV	2	CA	ncbi jpen microbiota nutr perm pubmed parenter gut enteral 2011 intestinal function web ncbi javascript site warning requires management citation external file generate software division hepatology usa gastroenterology nutrition 40202 university school kentucky medicine louisville department thfraz01louisvilleedu caused issues feeding forms systems influencing inflammation diseases endotoxemiainduced affect contributes endotoxemia organ
sJpR8Y	1	CA	promotions relationship food brand private label products recessionsand prices recoveries national volpe richard pp december 31 err129 research economic report 2011 stores labels differs promote density decades 2010 affected food increases report instore magnitude retailers findings national competition past pricing year supercenters label discounts state chains supermarket analyzes extent protect
a0Uo3	2	CA	house contact white state union video watch enhanced transparency commitment browse house white logs visitor wait executive actions president obama federal receipt tax federal dollars tax spent people petitions create sign house inside white tour interactive submit comments questions online accessible committed questions open administration comments public website creating president
wIU7Eb	6	CA	fatty ncbi polyunsaturate nutr pubmed br acidspecific mixed 2010 n6 function web ncbi javascript site warning requires management citation external file generate software nih md usa neurosciences biochemistry section nutritional biophysics bethesda membrane laboratory niaaa chrisramsdennihgov 093 ci statistical specifically ratio 22 95 4 extensive n3n6 increased combination confounding intake
zxAkXB	5	CA	apod january lighthouse meteor 8 2012 fascinating discover featured written image explanation day photograph astronomer cosmos universe professional january 8 2012 produces years bright hercules cold captured northern sky 4 easy east skygazers coast early dim january radiant muralis identified morning view maurice obsolete rivers constellation event planet quadrantid boundaries
150pf	36	CA	homosexual ncbi 1996 homophobia pubmed ar abnorm psychol function web ncbi javascript site warning requires management citation external file generate software georgia psychology usa university athens 306023013 department assigned aggression monitored penile buss 29 exclusively increases affect videotapes erection admitted individuals unaware exposed erotic individual sexually nonhomophobic questionnaire denies index
xOFHPm	10	CA	eligibility white house sudan defense determination south articles receive services memorandumpresidential presidential state union video watch enhanced transparency commitment browse house white logs visitor wait executive actions president obama federal receipt tax federal dollars tax spent people petitions create sign house inside white tour interactive house white office press secretary
wtpDwq	1	CA	full cli efficacy study text clinicaltrialsgov patients critical safety limb ischemia ixmyelocelt view months multicellular randomized preidentified limb vehiclecontrol cli procedures leg critical safety treatment vehicle 15minute ischemia 18 revascularization injections controlled option efficacy placebostudy evaluate outpatient patientspecific therapy designed marrow ixmyelocelt volume study expanded receive patients index procedure inoffice
rBzxdC	4	CA	ncbi gold database res acids genomes st nucleic pubmed v4 online 2012 function web ncbi javascript site warning requires management citation external file generate software genomics creek usa institute energy microbial drive joint program genome metagenomics department 2800 walnut mitchell ca organismsenvironments gold september centralized tables permanent 340 samples 2011
x2IBKn	2	CA	impact opin life curr ncbi 2011 allergy early pubmed clin immunol exposures function web ncbi javascript site warning requires management citation external file generate software canada kozyrskyualbertaca pediatrics alberta university dentistry medicine faculty department edmonton allergic asthma environmental disease earlylife prenatal identify development relating exposures studies discuss recent infant outdoor
ipgl7l	1	CA	nida videos peerx choose path teens interactive learn clip confront video facts reallife decisions myths end situations make separate character scenarios lets call choose role main youll play drugs drug step abuse path teens include prescription assume choices common shots activity outcome decision interactive selection dont clip ending video path
rieB3Q	1	CA	apod september 4 saturn 2011 shadow fascinating discover featured written image explanation day photograph astronomer cosmos universe professional september 2011 4 discovered bright earth scattering giant saturns main spectacular outermost dark shadow saturn spacecraft night side view unexpected hard back eclipsed pale blue sun rings moon orbiting newly hours silhouetted
e1PMx8	1	CA	apod endeavour april 2 2011 fascinating discover featured written image explanation day photograph astronomer cosmos universe professional april 2 2011 endeavour rocket completed head 19 perspective launch experiment earth trip ov105 orbiter penultimate space flight april centers sts134 march station pad low 400 shuttle sunset 25th final ams 11 39a
bugy2B	1	CA	wildlife service fish meadows ash national refuge palmer judy conservancy amargosa courtesy wetlands managed habitat plant county nevada 24 established 1984 service amargosa approximately acres located northwest alkaline valley national nye plants fish southern listed june vegas date 90 ash desert refuge las uplands springfed wildlife animals world 18 meadows
zUKayb	6	CA	attorney office justice alerts general dept california news content skip issued month identify human committed existence partners californians acknowledge justice highlights hope encourage pillars resources victims report association occurring attorneys january slavery found californian attorney national participate connect state announced felony protection california kamala protect generals launch important place act
Aoyn8D	9	CA	wide apod galactic center january image field 6 2012 fascinating discover featured written image explanation day photograph astronomer cosmos universe professional january 6 2012 beautiful paw scattered years lies bright intricate star spanning captured clouds earths vista light scorpius nebulae field nebula sky center cats degrees actual gorgeous clusters galaxys
tM7ppT	1	CA	mare kraken mission solstice cassini titans images home image details hydrocarbons image visible sea mare northern area top lake polar dark titans clouds liquid kraken large learn 5150 titan rotated left 29 degrees north saturnfacing kilometers 3200 side miles view wavelengths suntitanspacecraft nanometers acquired image titan spacecraft cassini angle spectral
x0Rd07	1	CA	ncbi models bo preclinical pubmed imaging res technologies 2011 ejnmmi function web ncbi javascript site warning requires management citation external file generate software hammersmith uk centre medical jordilopeztremoledaimperialacuk bic london research sciences clinical college imaging council 0nn biological imperial campus w12 mrc minimising magnetic comparatively preclinical longitudinal disorders implementation musculoskeletal
z4HeU3	6	CA	exploration system solar feedback moments december mission past began system 1962 amazing 2 choose decades 2012 successful flew solar venus january planet exploration greatest mariner farthest moments visit image reaches anniversary collision twin earth rovers impact deep sojourner system tiny 1 mars colorful 50th continuing journey solar robotic gallery inspiration
y4jW3N	1	CA	dissociation ncbi rate biol fibronectin pubmed human chem constants 2012 function web ncbi javascript site warning requires management citation external file generate software columbus usa university 43210 state ohio chain implants 096 tensile atomic fnbp cardiovascular wormlike 26 loading 20 dissociation explain forms clusters blots bonds uninfected indigenous 3402 isolates
xYC4iA	1	CA	repair chairs due hazard high fall recalls ikea named washington instructed canada voluntary consumers illegal commission safety cooperation health announced firm product stop dc recalled resell attempt immediately recall products today consumer product antilop chairs high 36000 169000 133000 units canada north conshohocken llc importer pa services ikea america unexpectedly
w7Sb95	1	CA	languages diabetic multiple diet medlineplus updated 16 date november 2011 characters language display correctly displaying page issues information return medlineplus languages health multiple page mobile twitter subscribe version updates follow email rss national guidelines accessibility library human institutes quality copyright privacy health bethesda department 2011 8600 updated 20894 md medicine
sp54VH	3	CA	imgm metagenome res acids ncbi nucleic mana pubmed data integrated 2012 function web ncbi javascript site warning requires management citation external file generate software division management center usa lawrence laboratory data national research 1 vmmarkowitzlblgov computational california 94702 berkeley cyclotron biological technology ca road community genomes comparative metagenomes expert content
t6gjxY	1	CA	solar overview system exploration planets mars diameter atmosphere exists polar soil signs surface evidence weather exist ice world earth cold clouds long icy mars dry canyons caps water ancient half seasons desert land liquid volcanoes amount thin floods mission featured rovers follow find size rover suv sojourner environment red life
12arIU	1	CA	complaint center crime file internet ic3 questions inquiries information additional conditions complaint terms read faq ic3 prior filing view ive code false imprisonment fine subject information knowledge title make correct form understand provided 18 section providing 1001 andor enforcement cosponsored regulatory discretion file fbi information opened federal nw3c crime state
9arQHN	1	CA	programmable energy star thermostats star energy products thermostats home programmable find partners partner energy thermostats year spends 2200 180 cooling setting programmable save household properly half maintaining settings average homeowners heating bills preprogrammed summer thermostat asleep home regulate temperature make helps easy programmable save offering homes winter settings thermostat money
