zXA1vN	1	CA	med differ ncbi mol dosimetry nucl pubmed imaging diagnosis 2011 eur function web ncbi javascript site warning requires management citation external file generate software jamesnagarajahukessende 55 university hufelandstrasse medicine 45122 germany nuclear department essen hospital duisburgessen dtc differentiated tissues petmri tomography remnant petct images ct thyroid pet compares node positron
vgSb56	1	CA	cassini portraits mission solstice moons captured cassini features portraits moons home news captured portraits moons cassini captured 12 dec 2011 portraits moons cassini captured page flyby d3 view selection dione raw epimetheus cassini images mimas flyby saturns rings appears moons dark obtained joined pandora side view detailed scales dione infrared
wrNexb	16	CA	sci ncbi med sports exerc pubmed effects strike 2012 type footwear function web ncbi javascript site warning requires management citation external file generate software 11 biology evolutionary divinity usa university harvard cambridge human department ma avenue 02138 rearfoot shoes differs forefoot heels elevated strike supports minimal economy versus tests standard
wwn0LP	12	CA	flashlight led target fire burn hazards due sets recalls named washington instructed voluntary consumers illegal commission safety cooperation announced firm product stop dc recalled resell attempt immediately products today recall consumer flashlight product led 6pc sets units 55000 target minn corporation minneapolis importer flashlights fire burn turned hazard heat posing
f5hLu1	1	CA	house executive 13489 records white order presidential state union video watch enhanced transparency commitment browse house white logs visitor wait executive actions president obama federal receipt tax federal dollars tax spent people petitions create sign house inside white tour interactive homeowners refinancing house twitter responsible answers hours brian office questions
A48eN0	5	CA	fdsys browse bills congress senate house states types legislative united proposals representatives bills congressional hr house chambers president approval law require senate signature bills limited senate house approval chambers resolutions amendments constitution res generally propose hj joint appropriation purpose president matters require single specific sj signature force senate house approval
sFxASx	1	CA	mechanics sci ncbi foot proportions biol joint pubmed ankle proc dif 2012 function web ncbi javascript site warning requires management citation external file generate software life center usa sciences pennsylvania university social park state 16802 kinesiology pa imaging mechanical department orthopaedics rehabilitation engineering externally magnetic human previous ratio overlying location
oIELct	1	CA	exhibit edsitement 1968 presented exhibit major national partnership year olympic demonstrations assassinations society documenting oakland chicago miss museum minnesota riots pivotal convention black war power jr california peak atlanta america center king luther pageant assertions curated kennedy feminist vietnam games historical martin democratic robert history share partnered thinkfinity lesson find
o4yQH0	1	CA	jobs house act white american address passing weekly state union video watch enhanced transparency commitment browse house white logs visitor wait executive actions president obama federal receipt tax federal dollars tax spent people petitions create sign house inside white tour interactive bill people money pass back jobs congress read put
zVsI0n	1	CA	cord full pain burning spinal text reduce clinicaltrialsgov treatment acupuncture injury view sci burning people reduce results years gf london protocol injuries canada rct hospital bc vancouver parkwood acupuncture multicentre sham cord good pain centre test control strong toronto spinal institute lyndhurst individuals 40 rehabilitation objectives study control sci random
qO22	1	CA	return tax free preparation volunteers topics individuals irs resources programs assistance irs tax qualify elderly taxpayers offer free income counseling tce vita volunteer neighborhood people credit filing tax locations elderly disabled located irscertified malls return vita electronic centers special 50000 taxpayers provide convenient make generally sites libraries returns program income
sJfOez	2	CA	fv4za ii iii iv vi vii viii ix xi xii xiii xiv xv xvi xvii xviii xix xx xxi xxii xxiii xxiv xxv xxvi xxvii xxviii xxix xxx 1 2 3 4 5 6 7 8 9 10 11 12 13 14 15 16 17 18 19 20 21 22
7S2Bsn	1	CA	fdsys browse bills congress senate house states types legislative united proposals representatives bills congressional hr house chambers president approval law require senate signature bills limited senate house approval chambers resolutions amendments constitution res generally propose hj joint appropriation purpose president matters require single specific sj signature force senate house approval
wxJUgi	35	CA	galileos journal multimedia system exploration solar gallery galileos journal 1610 jan 7 date sketches named planets ganymede callisto jupiter io earth theory system 1610 5 moons discovering discovery amb europa update jul understanding orbiting demise solar universe galileo galilei 2011 discovered made center sunlast january orbit planet popular led galileo
ojuBDM	2	CA	fdsys browse bills congress senate house states types legislative united proposals representatives bills congressional hr house chambers president approval law require senate signature bills limited senate house approval chambers resolutions amendments constitution res generally propose hj joint appropriation purpose president matters require single specific sj signature force senate house approval
Aa0BkI	17	CA	sec form accurate reviewed information necessarily commission reader complete exchange completethe securities assume determined filing 1 identity issuers information business contact 2 place principal persons 3 related clarification response clarification response clarification response clarification response clarification response industry group 4 size 5 issuer federal select 6 claimed apply exclusions exemptions
xL19l9	1	CA	legislative members paperless senators result reducing millions documents consumption state online participated public read sustainability effort pages pilot minds senate discussed twitter followers measure commerce committee education hearing participating adjourns realtime provide sending health hre progress announced higher full protection updates article hth pilot hearings committees cpn bill messages project
vecDIg	2	CA	recreation hills presidio park mission check availability mission hillcrest 1800s hills located late containers 750 food park tombstones back glass cemeteries large picnics grass san weddings site middle allowed diego capacity middletown pioneer playground fairly pioneers permitted kids area restroom inflatables limited 600 washington mission street parking avenue hills located
xtikpI	1	CA	ncbi magne spine phila pa lumbar disc 1976 pubmed 2011 degeneration function web ncbi javascript site warning requires management citation external file generate software institute university finland sciences clinical oulu pain limitations lbp magnetic back functional questionnaires imaging crosssectional resonance study low symptom intervertebral finnish young severity dd back lumbar
zZuPhi	7	CA	current uscert activity highimpact web current incidents regularly updated reported types summary uscert activity security page frequent multiple apple released updates safari address vulnerabilities products security os code crosssite obtain information perform vulnerabilities privileges elevated attack attacker condition execute denialofservice exploitation sensitive arbitrary operate scripting articles mitigate users ht5281 encourages
91Nk4A	1	CA	organic usda certification regulates national crop produced agricultural operation sell program usdas harvesting product farm organically handling organic standards wild program national produced foods consumers production consistent intended certified purchase organic standards assure processed act livestock crop nonrenewable production decrease premium practices synthetic capture rely management based exclusion antibiotics reliance
xDKq1s	1	CA	sec form accurate reviewed information necessarily commission reader complete exchange completethe securities assume determined filing 1 identity issuers information business contact 2 place principal persons 3 related clarification response clarification response clarification response clarification response clarification response clarification response clarification response clarification response clarification response clarification response industry group 4
eVdYT	1	CA	forms publications irs resources methods links tax electronic forms provide media irs capabilities access source basic print function acquire additionally advanced search irsgov official materials publications published links schedules tax individual download return taxpayers irs forms income mail order recently business advised packages needed filing instructions longer receive paper page
wwSUfA	1	CA	med preferences older trea site ncbi persons intern pubmed 1998 gen function web ncbi javascript site warning requires management citation external file generate software affairs school usa university healthcare system haven connecticut yale medicine veterans west examining form site persons explore home care perceptions preferences older medical hospital constant qualitative
woEaym	1	CA	oncology ncbi pubmed inpatient savings cost 2011 manag care function web ncbi javascript site warning requires management citation external file generate software israel center usa ny medical bkliglerchpnetorg integrative medicine york department beth 10016 impact oncology service inpatient integrative cost evaluate medicine intervention oncology nonequivalent zen sample inpatient initiative unit
xXJccI	209	CA	volcanic natural island hazards sea red december zubair pulse 60 violent rising yemeni sea navy activity helicopter captured video northern 23 began sulfor 40 located edge details eruptions dioxide white 2011 red satellite shallow forming eruption coast middecember reported imagery kilometers satellites revealed explosions recent saba showed island highresolution submarine
b2UtUJ	3	CA	picture astronomy day fascinating discover featured written image explanation day photograph astronomer cosmos universe professional 11 2012 bright distant earth disk 20 fit easy weeks apogee photographed perigee dark day telescope pacific dense sun asia moon smallest full 300 annular 240 kilometers path super silhouetted filter point image visible smaller
oGu4ns	1	CA	living healthfindergov healthy quitting live learn quick smoking guide connect website hyperlink nongovernmental direct application hhs consistent hyperlinks states services human subject information hyperlinked united application contained health endorsement department website intended provided visitors external constitute applications privacy appearance practices products policies purpose link redirected information usaccessibility privacy mapcontact act
xplhCW	2	CA	ncbi primary pubmed genome res sequencing 2012 matched function web ncbi javascript site warning requires management citation external file generate software transduction division biology united cancer institute signal research london team kingdom 6jb sw3 show global genomes discovered sequencing skin number majority samples dominant coding de snvs nonsense heterozygosity ultraviolet
rZ3ro2	1	CA	press release dhss statewide national collaborating americorps ending legacy jrs kings 27 service beginning delaware jan delmarva 9 tribute holiday 2011 hero blood dr castle bank king luther 16 drive volunteerdelawareorg martin dec urgent donating hero lifes make delaware question donate type pint week appointment derived drives answers lives blood
Anzh5l	2	CA	heart risk factors bmj ncbi disease pubmed open ischaemic mortality 2012 function web ncbi javascript site warning requires management citation external file generate software working centre denmark national research environment copenhagen diseasediabetes results 096 years cardiovascular impact depend conclusions similarities potential excluded employed mortality identical risk demands atherosclerosis 024 secondary
AkjAuK	3	CA	ncbi med adolesc pubmed activity pediatr performance 2012 arch physical function web ncbi javascript site warning requires management citation external file generate software 1081 emgo asinghvumcnl medical vu amsterdam van research health 7 department occupational public boechorststraat bt care netherlands center institute university der prospective relationship academic describe performance activity
ArCohJ	3	CA	control asthma cdc national profiles state program control medication adults prevalence overview national states including statistical patient children select provided education asthma district provide grantee rico state program puerto 2011 hospitalizations map columbia deaths burden data list 36 profiles partners information asthma additional contacts technical notes programs profiles state adobe
xC8KS	1	CA	examining trademark manual tmep procedure selected links httpusptotmepideascalecom participate chapters 1900 began alternate ideas online 2011 method 500 contribute offering uspto discuss 900 commenting january manual section discussion requests suggestions accommodate featured improvements ucc questions suggest assistance trademark send call email website material webpages matters uspto 8007869199 services center programs
yGCqxB	1	CA	immun ncbi genes pubmed genetic systemic association mirna146a 2012 function web ncbi javascript site warning requires management citation external file generate software genetics uppsala university sweden laboratory department immunology pathology rudbeck genomewide systemic tumortransforming candidate pcr mirnas controls forms allele microrna variants association susceptibility 146a pttg1 pituitary erythematosus cells 1324
zkfk5s	3	CA	koro cannabisinduced ncbi 2001 americans addiction pubmed function web ncbi javascript site warning requires management citation external file generate software psychology usa university southern 900891061 angeles los california department ca limited cannabisinduced appeared india related perception americans looked penile cannabis response cultures koro reaction part panic retraction acute considered study
hF1NpJ	1	CA	tax prep free topics individuals irs resources programs assistance irs tax qualify elderly taxpayers offer free income counseling tce vita volunteer neighborhood people credit filing tax locations elderly disabled located irscertified malls return vita electronic centers special 50000 taxpayers provide convenient make generally sites libraries returns program income basic local
vdwUHH	2	CA	filed show reasons obtain questions misconduct issues staff quit prove employer call employee good employers case 10 school resolve work heshe ui claim fired job purposes individual claimants information requirements distinctive application materials department quitting eligibility reason connected discharge benefits receive days contact responsibility claims filing show find issues staff
iwEElv	31	CA	neurotherapeutics ncbi alzheim ketone pubmed 2008 bodies therapeutic function web ncbi javascript site warning requires management citation external file generate software shendersonaccerapharmacom colorado usa accera 80021 broomfield limited stores administration produced brain supplement including human betahydroxybutyrate disorders hypometabolism regionspecific exclusively potential animal fat early inhibition effects acetone represents substrate profound
sOPSwq	2	CA	house year photos 2011 white state union video watch enhanced transparency commitment browse house white logs visitor wait executive actions president obama federal receipt tax federal dollars tax spent people petitions create sign house inside white tour interactive pete moments house shares photographer souza white 2011 official shot house days
