9WKAuE	1	GA	101st thomas congress text bill library 19891990 41989 b37 set sj 107 national duckling designating month read judiciary joint committee helms coats mr introduced resolution referred national duckling designating month chinese duck states united approximately hundred historically ago thousand delicacy famous egyptians years east industry duckling preparation peking popularity people
ruG5h8	1	GA	start 1940 census research skip navigation national searching index district 1940 enumeration located charge 2 archives online opens 2012 locate free address census april release http1940censusarchivesgov order search access httpwwwarchivesgovresearchsearch opa online public census delaware 1940 sussex county maps state enter milford sussex including town search census 1940 delaware maps
I9mYPk	8	GA	thomas 20032004 congress text bill library 108th ih 460 hres 100th sports state michigan football congratulating game rivalry university teams greatest ohio history recognizing strickland oxley miller gillmor ryan committee kucinich education pryce hobson tiberi kildee upton conyers turner ney brown submitted michigan workforce latourette portman ford kaptur jones levin
IdrR0	1	GA	congress joint white session health house remarks president care state union video watch enhanced transparency commitment browse house white logs visitor wait executive actions president obama federal receipt tax federal dollars tax spent people petitions create sign house inside white tour interactive homeowners refinancing house twitter responsible answers hours brian
bujg3	1	GA	fraud tax activity report suspected topics individuals irs resources complying tax individual 3949a suspect online print mail fill form company report completing activity laws 93888 service fresno ca revenue internal information form 3949a send letter address include helpful confidential required identify identity reporting questions irs fraud 113 frequently procedures asked
I3NjuK	1	GA	physicians perspectives emergency med ncbi pubmed medicine 2011 palliat function web ncbi javascript site warning requires management citation external file generate software usa center cedars medical sstone90064yahoocom angeles los 90048 ca sinai appropriately prioritized urban underwent focus related challenges included perspective responsive education educational perspectives leading hospital range los participants
bR7KKu	1	GA	center tornado watch prediction 186 storm status 186 report watch messages information network service national warnings visit iwin weather interactive 40 mod 20 low 50 mod 30 mod 40 mod 30 mod high 70 f2f5 probability forecaster 70 60 table event increased category tornadoes probabilities issuing 5 low moderate events
JMKNas	1	GA	current uscert activity highimpact web current incidents regularly updated reported types summary uscert activity security page frequent multiple apple released updates safari address vulnerabilities products security os code crosssite obtain information perform vulnerabilities privileges elevated attack attacker condition execute denialofservice exploitation sensitive arbitrary operate scripting articles mitigate users ht5281 encourages
IBWgJo	1	GA	med risk ncbi factors study pubmed indian assoc 2011 cardiovascular function web ncbi javascript site warning requires management citation external file generate software kolkata hospital community medicine sskm department 700020 ipgmer developed cardiovascular observational group categories factor risk males difference association increased classified activity found investigators significantly people peons related
Jn7EcG	1	GA	text clinicaltrialsgov detection utility cell full evaluate early 124icg250 metastatic carcinoma response sunitinib renal patients view months cancer scan petct sunitinib determine measure kidney size monitor working ct scans earlier 124icg250 regular effects doctors response kind tumors drug called study purpose cg250 cancer scan binding tumors shown attach 124i normal
7bsP1P	3	GA	pittsburgh pennsylvania nws advisory outlook screenlogicalydpi screenlogicalxdpi rtn watches freeze screendeviceydpi warning edt click fri rtn1 forecast read advisories internet var returnrtn 2012 function map 123322 warnings hazardous frost update screendevicexdpi inity initx 11 zoomout explorer weather browsernavigatorappname browser microsoft latest hour decision forecasts weather making collected stormrecord reports information
K9vUyM	2	GA	load sci ncbi med sports exerc bloodflow pubmed effects exercise 2007 function web ncbi javascript site warning requires management citation external file generate software 132445040 usa university research ny musculoskeletal slbaldwisyredu science department laboratory exercise syracuse restriction unclear resistance potent duration size shown strength interact low stimulus exercise combination results
3YWS2N	1	GA	living healthfindergov healthy wellness guide live health learn quick everyday connect website hyperlink nongovernmental direct application hhs consistent hyperlinks states services human subject information hyperlinked united application contained health endorsement department website intended provided visitors external constitute applications privacy appearance practices products policies purpose link redirected information usaccessibility privacy mapcontact
I9JimF	1	GA	24 rosetta apod lutetia april approaches asteroid 2012 fascinating discover featured written image explanation day photograph astronomer cosmos universe professional 24 april 2012 heavily lutetia spacecraft rosetta 21 2014 main 2010 compiled early colors facing cratered past video images orbiting approach shows recently zipped continuing taking massive comet origin 100kilometer
JthH4b	1	GA	firstever administration 29 dc states department ribbon green names schools obama education 78 house sutley states including council chair education quality ribbon jackson duncan agency 29 department announce white today administrator arne dc environmental protection schools span firstever 78 list joined green nancy lisa secretary elementary dcs announcement school made
K6r995	1	GA	house white state union video watch enhanced transparency commitment browse house white logs visitor wait executive actions president obama federal receipt tax federal dollars tax spent people petitions create sign house inside white tour interactive event live facebook discussion participate click member facebook give click questions comments httpwwwwhitehousegovvideo ondemand library
JdDZ9e	2	GA	emotion brainderived regula ncbi pubmed fatigue physiol front 2012 function web ncbi javascript site warning requires management citation external file generate software town biology science university africa research department unit human medicine cape uctmrc sports south exercise proposed athletic saves brain attempts predicts decisions decade superior rapidly physiological nervous explain
HFTEus	16	GA	house white april photo day 2012 state union video watch enhanced transparency commitment browse house white logs visitor wait executive actions president obama federal receipt tax federal dollars tax spent people petitions create sign house inside white tour interactive house check april offices photo 2012 picks white day official house
JO6aaY	1	GA	video caution medlineplus health news autism javascript adobe flash enabled content player version 8 requires flash pages related medlineplus poor moms young children concern explain days health growing spectrum learning autism issues developmental percent linked 1 health pediatrics risk journal problems kids mothers disabilities american common shows disorder study percent
IfyqFc	1	GA	clark house jr white catfish performs gary performance blues red state union video watch enhanced transparency commitment browse house white logs visitor wait executive actions president obama federal receipt tax federal dollars tax spent people petitions create sign house inside white tour interactive adobe player flash content download view february
IwVDGT	1	GA	intake cut study young medlineplus americans calorie pages related medlineplus tuesday rate healthday long shows reach youngsters goals news 10 lower study april american obesity childhood set rate 64 human reducing children aged goal percent day 2 health eliminate department 146 services 19 average calories 2020 obesity childhood obese calorie
HotUYe	1	GA	resources stopbullyinggov addressing set inclusion problem related topic included imply entering facts find verified stopbullyinggov federal promotion nonfederal program inventory articles tips guarantee resources criteria listed endorsement search includes bullying nominated helpful evidencebased training resource toolkits keyword directories materials directory meet accuracy add inventory nominations resources find resources website managed
ImzZjf	1	GA	government administration site general gsa auctions services warranted property condition 25hull reportsstatement 3survey doc 2hull thickness intent 1hull sf appointment removal contact property inspection appointment schedule custodian deposit bid terms attachments sale description dates custodian times contact arrangements removal inspection bidders removal loading located responsible awarded cautioned successful packing exact
HFpUPS	1	GA	grant grantsgov opportunities synopsis opportunity find precedence service disk electronic click information grant provide notification send inconsistency document email resolved notifications printed address opportunity emails change receive thing giving original requestedany modification description represent newest file oldest previous shown documents current document sections files background representing modifications arranged changed list
bREk8i	2	GA	government house executive contracting white order economy state union video watch enhanced transparency commitment browse house white logs visitor wait executive actions president obama federal receipt tax federal dollars tax spent people petitions create sign house inside white tour interactive homeowners refinancing house twitter responsible answers hours brian office questions
bgmh3M	1	GA	sec form accurate reviewed information necessarily commission reader complete exchange completethe securities assume determined filing 1 identity issuers information business contact 2 place principal persons 3 related clarification response clarification response clarification response clarification response clarification response clarification response clarification response clarification response clarification response industry group 4 size 5
HEw7sH	1	GA	severity influence medlineplus length pregnancy autism pages related medlineplus born healthday autism symptoms children late 6 weeks friday time news kids study experience april severe prematurely selfinjury inflict found children researchers reasons caused born children unknown 42 severe symptoms weeks gestation suggested study 36 remain fellow underlying postdoctoral human postterm
JvEtcU	4	GA	med respiratory ncbi preve pubmed health br sports elite athletes 2012 function web ncbi javascript site warning requires management citation external file generate software brunel uk centre university sports uxbridge human medicine performance pollutantsirritants caused dehydration strenuously chronically asthma susceptible risk early progression demonstrated remains upper andor exposed reduce implemented
9PUNLH	1	GA	map house state health white care state union video watch enhanced transparency commitment browse house white logs visitor wait executive actions president obama federal receipt tax federal dollars tax spent people petitions create sign house inside white tour interactive seniors adults people preexisting click young find state health receiving conditions
Jmouvy	1	GA	chemical mission factory solstice investigates cassini titans features factory chemical investigates cassini home news titans chemical titans investigates factory cassini apr 24 2012 chemical titans investigates factory cassini hydrocarbons atmosphere titan environments celsius hides thick factory giant saturns brutally temperature smoggy system moon chemical complex degrees scientists 170 cloak form
9In4pn	1	GA	power cdc outage worker outages safety repair portable people back installed kill operated home improperly information sheet generator injure workers feedback send electrical generators local energy buildings power homes outages restore backfeed communities problem area lines called sized neighboring safely fact constant deaths energy electrocutions leading workers electrical occupational risk
aO21Tx	1	GA	vaccines records recsimmunization control disease services health human department centers prevention vaccines immunizations recording vaccination vaccines records interpreting finding home page clinic exist year children doctor vaccination administered vaccines parents attended repository records schools hold central medical record determine doctor personal vaccines immunity locate tests repeat blood arrange record site
J6fgo0	1	GA	med ncbi sports manifestations competing skin pubmed athletes 2012 function web ncbi javascript site warning requires management citation external file generate software usa transitional university hawaii program residency honolulu callosities atopic olympians resistance blisters skin noir susceptible highlights urticarias treatment include 2011 diseases nodules nonmelanoma words categories infrequent medline dermatoses
oPI0K9	2	GA	protection consumer usagov prevent shopper understand theft everyday identity credit guide smart marketplace challenges complaints individual file download note consumers investigate access handbook order resources 2012 complaint government problems agencies copy directories face solve action consumer complaint money free copy order credit tips filing latest protect rights publications scams consumer
12SJO	1	GA	deducting business expenses small businessselfemployed small businessselfemployed topics irs resources business expenses carrying operated trade profit make cost deductible indispensable ordinary business trade accepted deductible helpful considered common expense business separate expenses important purchases deduct figure tax expenses deducted cost determine year gross end profit generally figuring inventory include business
xl8O0c	3	GA	grant grantsgov opportunities synopsis opportunity find precedence service disk electronic click information grant provide notification send inconsistency document email resolved notifications printed address opportunity emails change receive thing giving original requestedany modification description represent newest file oldest previous shown documents current document sections files background representing modifications arranged changed list
HivTHj	2	GA	infographic cbo program asset report troubled relief contact cbo 28 march 2012 110343 stabilization office omb days cbo semiannual stability economic financial elements guarantee established 45 promote prepare section treasurys legislation tarp submit discuss purchases program asset treasury department troubled markets public 202 division enable emergency assessment guarantees management issuance
b2uIyI	1	GA	house white state union video watch enhanced transparency commitment browse house white logs visitor wait executive actions president obama federal receipt tax federal dollars tax spent people petitions create sign house inside white tour interactive event live facebook discussion participate click member facebook give click questions comments httpwwwwhitehousegovvideo ondemand library
zPZpYl	1	GA	apod 21 january days sun 2012 fascinating discover featured written image explanation day photograph astronomer cosmos universe professional january 21 2012 summer caused month bright paper radio spells 21st northern chosen sky suns 2011 sunny dark records made years day entire university hemispheres weather fixed view telescope trails gaps sun
yQaQVr	1	GA	adaptations ncbi physiological pubmed lowvolume physiol highinte 2012 function web ncbi javascript site warning requires management citation external file generate software canada ontario l8s 1280 university 4k1 gibalammcmasterca kinesiology street hamilton mcmaster west department main precise limited responsible lack dose including research cardiovascular superior disorders application physiological delays alternate finally
HsAN6G	2	GA	press center jpac search jpac photos continue historians identify pearl confident 6 thousands war 2012 files weve photos casualties case january hawaii historical gathering brave evidence images accounting missing delay powmia korean donate kicked harborhickam handful base key heroes received search unresolved joint april command efforts photo hard prefer accept
GWHziZ	1	GA	mission searching solstice cassini options home searching options found page requested links moved searching topic doesnt exist follow anymore page list site directory visit popular destinations overview destination mission httpsaturnjplnasagovmissionintroduction including goals frequently httpsaturnjplnasagovfaq answered questions asked information spacecraft httpsaturnjplnasagovspacecraftoverview questions cassini answer find httpsaturnjplnasagovmissionquickfacts mission related questions cassini facts
IMGe0I	1	GA	full clinicaltrialsgov combination text immunotherapy herceptin her2 neuvax vaccine view prospective cancer twothirds diseasefree ii randomized hlatyped tumors her2 screened subjects pr nn multicenter restricted negative approximately 1 2 expressing np placebocontrolled e75 versus hlaa2 peptide hlaa3 standard singleblinded therapy breast vaccine population cd8eliciting target neuvaxtm study herceptin trial patients
x3xKr9	1	GA	med volumetric ncbi analysis sex pubmed urethr vascular 2010 3d function web ncbi javascript site warning requires management citation external file generate software italy reproduction gynecology studiorumuniversity pathophysiology mater massarenti human bologna department cesarebattagliauniboit alma gspot controversial existence space urethrovaginal threedimensional evaluate ultrasonography structures anatomic 3d color underwent ii orgasm
ndo6OP	1	GA	increased consumption nutr ncbi foods pubmed dairy duri protein 2011 function web ncbi javascript site warning requires management citation external file generate software canada group university research kinesiology hamilton mcmaster department metabolism exercise resistance visceral apld increase ratio participants 0 dairy 8 adequate 816 greater fat premenopausal affect apmd loss
HXEK63	1	GA	government administration site general gsa auctions services warranted property condition 25hull reportsstatement 3survey doc 2hull thickness intent 1hull sf appointment removal contact property inspection appointment schedule custodian deposit bid terms attachments sale description dates custodian times contact arrangements removal inspection bidders removal loading located responsible awarded cautioned successful packing exact
vgAzde	1	GA	geo2r function enable tool javascript warning learn requires compare ordered results identify table expressed samples significance conditions full genes groups instructions presented geo2r differentially order experimental applied logtransformation tab data options change box table distributions viewed plot calculate selected samples mediancentered crosscomparison number graphically data summary determining distribution suitable exported
IJbRcd	3	GA	frb 25 fomc releasefederal press 2012 statementapril issues reserve release date 2012 25 april sector committee unemployment expanding household signs rate elevated improvement open investment market information federal housing moderately expectations labor remained declined stable crude conditions economy oil march business met inflation prices continued higher picked recent received improved
JrfTDU	1	GA	flies successfully mission solstice cassini enceladus flies enceladus features successfully cassini home news enceladus flies successfully cassini apr 2012 16 enceladus flies successfully cassini features infrared spacecraft primarily cassini flyby altitude instrument analyze composite cassinis flew tiger baghdad miles temperatures sulcus spectrometer taste surface obstacle darkness compounds 46 measurements ice
I9Q6Tg	1	GA	control monitoring feedback exchange hypertensive ahrq innovations pressure patients blood home improve pharmacist weekly profile posted march publication exchange 28 innovations date original 2012 profile updated march exchange innovations date posted 28 recent 2012 questions house ahrq site usagov human home information privacy writing health policy white map web act
HaxJNk	1	GA	celebrating viewing wildflowers areas wildflower celebrating wildflowers usda service forest content skip navigation page viewing wildflower slideshow areas enjoy features national back feature wildflowers glimpse provide forests opportunities add wildflower myriad spectacular limitless viewing areas places grasslands code botany management service 202501103 washington sw rangeland mailstop dc program forest ave
JmclXD	1	GA	jacket puma waist pose hazard youth drawstrings recalled entanglement named washington instructed voluntary consumers illegal commission safety cooperation announced firm product stop dc recalled resell attempt immediately products today recall consumer product puma usa training jacket pockets vkonstruct units 5000 puma north westford importer mass america childrens prevent stitched issued
dOUIAZ	4	GA	tutorials training site ncbi guide function web ncbi javascript site warning requires reference series toolkit library demos including examples documents searchable ncbi faqs online development comprehensive framework pdf downloaded notes manual release design software handouts training links print slides materials including tutorials powerpoint formats terms ncbi data glossary part handbook
ILR4BW	1	GA	obese workers medlineplus costs health smokers top care pages related medlineplus obese 13 study workers friday finds april costs health healthday smokers news higher 30000 mayo continuous clinic examined data insurance employees 2001 health 2007 retirees researchers yearly weight people obesity 1850 revealed normal health nonsmokers obese 1275 smoking care
IYLQTB	5	GA	increased ncbi prevalence bull transglutaminase pubmed schizophr 6 2012 function web ncbi javascript site warning requires management citation external file generate software md school north 600 hopkins university johns 144 medicine wolfe sciences street 1department 21287 behavioral psychiatry baltimore meyer represent 213 results brain 131 including skin gastrointestinal relationships 27
I9FSSM	1	GA	continuing image eruption shiveluch day volcanic surrounding earth weeks 2012 radial active ash shiveluch streaks volcanoes april bursts snow activity left naturalcolor image produced visible winds alignment 22 top deposits spectroradiometer 4 eruptions collected direction vaguely lengthier satellites melting streaks determined streak stronger result images snow moderate revealing modis satellite
GL1q4I	2	GA	catalog pia15415 page brightly image tendrils lies remnant full lightyears galaxy size constellation nebula sky 1500 moon hot extends swans ago 5000 explosion explorer tucked supernova night gas occurred stellar nasas ultraviolet dust years 8000 glow evolution wispy wings cygnus times massive loop left spreading filaments visible bright earth heated
HSFU0C	8	GA	family house national white visits americas parks tourists state union video watch enhanced transparency commitment browse house white logs visitor wait executive actions president obama federal receipt tax federal dollars tax spent people petitions create sign house inside white tour interactive beautiful family check visit shows places photos place country
K93nJt	3	GA	spongiform usda bovine detection encephalopathy bse agriculture states united vilsack statement tom secretary usda supply cattle safeguards identify human vigilant beef remains remain quickly presents confident dairy systems animal health affected risk food safe reason ensure committed worked case protect animals american place planned usda visit share video wwwusdagovbse find
hHJOXn	1	GA	champions house white change state union video watch enhanced transparency commitment browse house white logs visitor wait executive actions president obama federal receipt tax federal dollars tax spent people petitions create sign house inside white tour interactive mscaption textindent9000px 308px msdetail top top0px height norepeat 9999 349px positionabsolute left495px zindex
HmvNAg	1	GA	information plan pension statebystate map benefit click state pbgc find alabama alaska arizona arkansas california colorado connecticut delaware columbia district florida georgia hawaii idaho illinois indiana iowa kansas kentucky louisiana maine maryland massachusetts michigan minnesota mississippi missouri montana nebraska nevada hampshire jersey mexico york north carolina dakota north ohio oklahoma
HmQU3Q	1	GA	catalog page pia15254 agencyled telescope instruments image mission infrared dust spanning contributions galaxy herschel giant combined space data nebula ripples cloud fiery tens tarantula ribbons european explosion dwarf spitzer fire center hundreds important formation brightest significant circular magellanic centerleft nasas fields observatory doradus noticeable visible light region 30 appearance called
