wM6Psz	1	DC	natural senate energy committee resources sector energy modernize electricity seeks 2012 power standard generated nations future clean act guide bipartisan management resource reserve federal responsible stewardship strategy lays act helium 2012 files ferc documents item addition attached chairmans find au letter murkowski senator linked amendment text act joint result substitute
4dwBHm	1	DC	picture astronomy day fascinating discover featured written image explanation day photograph astronomer cosmos universe professional 11 2012 bright distant earth disk 20 fit easy weeks apogee photographed perigee dark day telescope pacific dense sun asia moon smallest full 300 annular 240 kilometers path super silhouetted filter point image visible smaller
xUEvEn	1	DC	senate page environment majority committee works public blueprint boxer president obama building laid american senator works economy tone campaign presidents marked hearing trail americans opponents stands angry eloquent optimism contrast homeowners strengthen energy middle infrastructure mercury create responsible environment call jobs stay class homes protect toxins work americas clean action
yYZmSW	1	DC	benjamin revolution congress library treasures words american franklin honesty dead bright ship conscience leak strokes secret policy oaks christmas good fell sink key continual great small breadth letters words accurate scientist writer long exhibition careers life franklins finished birth inventor politician matter accomplishments tercentenary cartoons achievements achieved books abolitionist broadsides
zGevyz	2	DC	tests gluten ncbi sensitivity pubmed clin serological 2011 gastroenterol function web ncbi javascript site warning requires management citation external file generate software italy hospital st medicine clinical orsolamalpighi bologna department university compare gs gluten sensitivity characterize serological pattern disease celiac found gs spectrum entity markers disorders clinical glutenrelated recently lacking
qO22	3	DC	return tax free preparation volunteers topics individuals irs resources programs assistance irs tax qualify elderly taxpayers offer free income counseling tce vita volunteer neighborhood people credit filing tax locations elderly disabled located irscertified malls return vita electronic centers special 50000 taxpayers provide convenient make generally sites libraries returns program income
85LSBE	4	DC	storm tornado watch prediction 7 center status report watch messages 7 information network service national warnings visit iwin weather interactive high 70 40 mod high 70 50 mod 40 mod 20 low high 95 f2f5 probability forecaster 70 60 table event increased category tornadoes probabilities issuing 5 low moderate events
isuMJ	1	DC	financial usda metropolitan unemployment farms education employment federal agriculture top food state income indicators urban exports farm funds poverty sheets america counties population census organic nonmetro commodities rural security fact financial links characteristics states education agriculture information united provide employment top state income indicators exports farm funds sheets included data
1vCI3X	1	DC	visualization science challenge engineering report international nsfgov special statements powerful enlighten illustrate visualization sciences literally illustrious long research diagrams franklins rosalind words made davinci xrays history solar people heard world provide solely research flares helix interest scientists illustrations public hope dismayingly understanding necessity nurturing fractal developments literacy rare influential science
xtzWut	1	DC	resource nida families 17 navigate national nih health helps institutes january release addiction 2012 news options treatment links related bookmark share developed national hard choosing questions institutes information nidas service program health treatment online struggling nida families drugpubs seeking free abuse part copy addiction resource institute drug public individuals researchbased
srHO6N	1	DC	internship usda programs summer strongly give consists employment career usda educational sip located program assistants internships field scientific internship paid gain position opportunity areas institute headquarters experience technical future students enrolled professional usda ambassadors washington county intern agricultural service fl research program health development plant animal attend students dc leadership
uGYJrZ	1	DC	autoimmune diseases ncbi allergy rev pubmed gut clin leaky immunol 2012 function web ncbi javascript site warning requires management citation external file generate software md biology center usa university school research mucosal medicine maryland 21201 afasanombrcumarylandedu baltimore underlying innovative neuroendocrine disorders tight susceptible controls intercellular equilibrium diseases nonself impaired loss
yZ0uD2	1	DC	foundation science national engineering nsf key indicators nsfgov digest 2012 application produces contributions knowledge research citations inventions literature scientific reflect linkage processes technical practical products publications patents publications articles engineering citations literature patents sciencepatent linkage articles united continues producer top published leads states numbers eu world country se parity producer
zgq4Sz	1	DC	000119312512020757 documents filing edgar files document format files data preparationassistant file year 34 film end irs 10qa state 00112989 servicescomputer incorp 1231type processing 3 de director 12540659sic data fiscal 510267091 7374 act servicesprepackaged file year film end irs 10qa state incorp 1231type 203059890 3 de softwareassistant director 7372 12540658sic fiscal
y9dgZx	1	DC	nutrition ncbi parent nutr challenges pubmed health education 2011 public function web ncbi javascript site warning requires management citation external file generate software school usa los university wslussermednetuclaedu 90024 community angeles sciences health department california ca public interventions ii foods families education children participating knowledge factors iii purchasing current parents
105uF	2	DC	11 center tornado watch prediction storm 11 status report watch messages information network service national warnings visit iwin weather interactive high 80 50 mod high 80 20 low 30 mod 10 low high 95 f2f5 probability forecaster 70 60 table event increased category tornadoes probabilities issuing 5 low moderate events
b2uIyI	2	DC	house white state union video watch enhanced transparency commitment browse house white logs visitor wait executive actions president obama federal receipt tax federal dollars tax spent people petitions create sign house inside white tour interactive event live facebook discussion participate click member facebook give click questions comments httpwwwwhitehousegovvideo ondemand library
hZjdDi	1	DC	information center cpsc carbon monoxide colorless killer gas invisible carbon monoxide poisonous odorless called 150 people related states appliances year stoves heaters fireplaces fuelburning unites include nonfire accidental improperlyused furnaces water faulty incorrectlyvented die products poisoning consumer shed portable family kill home generator generators doors vents basement windows inside garage
3ixzg	1	DC	caring childs mental health childs mental mission sites overarching childrens caring system effort support samhsas increase approach health comprehensive public awareness marketing social samhsafunded purpose services strategic care 1994 created communications team strategies works stimulate information childrens national visit event wwwawarenesseventorg health today rsvp day awareness mental dont washington wwwsamhsagovchildrenliveeventasp
oPB7FZ	1	DC	disaster strengthen announces administration blog recovery nation approach fema obama agency disaster strengthen single coordination recovery daytoday federal responsibilityuntil government activities standardize inefficient emergency nation step areas effective action comment accordance comments blog moderated policy femas links nongovernment social applications web fema provided reference media companies sites endorse msgdata washington
zfTyoH	1	DC	solstice past night mission cassini images home image details smaller mimas 1123 396 dominates image dione side 698 measures 246 kilometers day miles view left mimas terrain trailing 20 area lit degrees north rotated dione moons saturnfacing hemisphere antisaturn side 559 image feet visible spacecraft meters cassini mimas sunmimasspacecraft 1833
dff1ek	1	DC	information ricnalusdagov find rivers assist water actvities quality information programs cleanup finding river local american rivers blue hiking trails water trail wet american rivers wildlife habitats provide recreational opportunities rivers water environmental communities ecosystems drinking water footprint network calculator site 2840 year consumption cubic water meter footprint refers citizens daily
An7WWh	1	DC	house white state union video watch enhanced transparency commitment browse house white logs visitor wait executive actions president obama federal receipt tax federal dollars tax spent people petitions create sign house inside white tour interactive event live facebook discussion participate click member facebook give click questions comments httpwwwwhitehousegovvideo ondemand library
yIBeDr	1	DC	2002 benefits ncbi longevity pubmed health cessation smoking public function web ncbi javascript site warning requires management citation external file generate software duke sanford management center institute university nc usa durham health dtaylorhpolicydukeedu terry policy 27708 law studies public obtained life extension study ages determined stopping smoking cancer estimates ii
w1KEJs	1	DC	24 apod january norway aurora 2012 fascinating discover featured written image explanation day photograph astronomer cosmos universe professional 24 january 2012 earth captured northern sky spectacular aurora recombining oxygen large activity round throwing protons sun flare pictured eagle night free latitudes days magnetosphere whats feel powerful mass cloud earths fast
w38yEm	2	DC	mobile pubmed slip night youll ment jun30635463 health nurs 2009 issues box usa psychology wa university washington epederuwashingtonedu 351525 department seattle 981951525 emerging money focus arriving interesting finally positively evening increased males drinking alcoholrelated prepartying night quick endorsed significantly sex frequency college estimated sexual event alcohol subsequent legal research participants
6JoQec	19	DC	center tornado pds watch prediction 5 storm status 5 report watch messages information network service national warnings visit iwin weather interactive high 90 60 mod high 90 60 mod 60 mod 30 mod high 95 f2f5 probability forecaster 70 60 table event increased category tornadoes probabilities issuing 5 low moderate
w9Y3da	1	DC	apod saturns 22 january light hexagon 2012 fascinating discover featured written image explanation day photograph astronomer cosmos universe professional january 22 2012 planetary infrared discovered spacecraft motions saturns excluded flybys surrounds emanating rotating fully shape vortex continue corners unexpected imaged movie scientists orbiting shows saturn formation created study timelapse times
zlUZk0	3	DC	ars publication storage request tillage minnesota cornsoybean biennial nitrogen carbon rotation greater limited zea managed glycine storage years nitrogen sampled masses alternate intensive treatment fuel employed midwest greater tillagerelated mays rotation entire lsoybean yields enhance cropping reduced upper employing maximize findings sensitivity observed year 03 co2 06 notill content dioxide
AAZrIE	2	DC	current uscert activity highimpact web current incidents regularly updated reported types summary uscert activity security page frequent multiple apple released updates safari address vulnerabilities products security os code crosssite obtain information perform vulnerabilities privileges elevated attack attacker condition execute denialofservice exploitation sensitive arbitrary operate scripting articles mitigate users ht5281 encourages
zEZvFj	1	DC	corps mlk project examples senior day retired developed community grandparent implemented impact service day foster organizations demonstrated rsvp greater jr companion leadership communities senior projects volunteer king luther made programs created martin partnerships seniors adults people ca ages young community years partnered assemble preparedness kits education vulnerable abilityfirst information recreational
cQSs0S	1	DC	adults ncbi arch 2005 crime pubmed psychiatry gen sever victimization function web ncbi javascript site warning requires management citation external file generate software northwestern school usa chicago university medicine feinberg lake 710 sciences shore psychiatry behavioral department drive psycholegalnorthwesternedu 60611 il illness mental community victimization crime live smi risk deinstitutionalization
sH4u2K	1	DC	full clinicaltrialsgov language auditory leading processing deficits hereditary text impairment view process brain determine sounds children disorders auditory temporal soundsare inherited timing trait processingthe properly hear purpose impairments analyzes language study deficits patterns resulting listening identify children disorders auditory temporal tests affected specimen perceive tablespoons small series traits membersboth measure
bsYPhS	1	DC	worldwide caution 24 january 2012 interests citizens issued actions high caution information 26 terrorist threats provide reminded increase state department vigilance 2011 awareness worldwide activities updated continuing update world july security replaces level violence maintain steps dated threat europe africa demonstrations assassinations middle violent including operations information terrorist variety remains
w4eFf3	1	DC	senate page environment majority committee works public xl issued washington committee administrations decision environment keystone chairman statement issue public today dc dca boxer response obama pipeline project permit senator works barbara human tar independent issued safety related 60 sands questions insistence rigorous administrations adequately subject provide broad decision people range
xzMFCp	76	DC	photo house january white day 2012 state union video watch enhanced transparency commitment browse house white logs visitor wait executive actions president obama federal receipt tax federal dollars tax spent people petitions create sign house inside white tour interactive january house check offices photo 2012 picks white day office deputy
sC7M7L	1	DC	photo house december white 2011 day state union video watch enhanced transparency commitment browse house white logs visitor wait executive actions president obama federal receipt tax federal dollars tax spent people petitions create sign house inside white tour interactive december house check offices photo picks 2011 white day president house
AydOvO	1	DC	grant grantsgov opportunities synopsis opportunity find precedence service disk electronic click information grant provide notification send inconsistency document email resolved notifications printed address opportunity emails change receive thing giving original requestedany modification description represent newest file oldest previous shown documents current document sections files background representing modifications arranged changed list
Ads00M	1	DC	engine ncbi biomed pubmed mater tissue protein recombinant scaffolds 2012 function web ncbi javascript site warning requires management citation external file generate software australia science jeromewerkmeistercsiroau clayton engineering materials bayview avenue csiro emerging developed manipulation shape human possibilities scaffolds synthetic superior ease capabilities offers degrees biomedical include combination dependent express
5GXCvA	1	DC	apod uruguay january roll 5 2010 cloud fascinating discover featured written image explanation day photograph astronomer cosmos universe professional january 5 2010 point maldonado cold cloud fronts long extends storm type form shelf explanation rise warm front cumulonimbus cool distance kind clouds unlike morph january dew olas detached similar uruguay
dcIU4P	2	DC	grant grantsgov opportunities synopsis opportunity find precedence service disk electronic click information grant provide notification send inconsistency document email resolved notifications printed address opportunity emails change receive thing giving original requestedany modification description represent newest file oldest previous shown documents current document sections files background representing modifications arranged changed list
zbMBC3	2	DC	commonwealth thomas greet honou port faithful esq williamsburg presents jefferson virginia aforesaid magistrate pious christ governor chief dominion capsule centuries ephemera american printed broadsides time 1 2 image commonwealth thomas greet honou port faithful esq williamsburg presents jefferson virginia aforesaid magistrate pious christ governor chief dominion thomas state jefferson virginia
eUByyb	1	DC	school house washington high tennessee booker memphis white state union video watch enhanced transparency commitment browse house white logs visitor wait executive actions president obama federal receipt tax federal dollars tax spent people petitions create sign house inside white tour interactive adobe player flash content download view domain 20 311
zPZpYl	1	DC	apod 21 january days sun 2012 fascinating discover featured written image explanation day photograph astronomer cosmos universe professional january 21 2012 summer caused month bright paper radio spells 21st northern chosen sky suns 2011 sunny dark records made years day entire university hemispheres weather fixed view telescope trails gaps sun
xGTI1t	1	DC	great congress immigration library american potluck teachers preparation roaster bring chicken halfway cilantro cut 23 add rice food cook chutney bread onion mint cumin large enjoy carmelize container cooking 3 1520 wok 1015 blender med peel water put optional hours brown recipes times turn seeds stand pita pot 58 wash
ADnQDr	1	DC	000119312512020757 documents filing edgar files document format files data preparationassistant file year 34 film end irs 10qa state 00112989 servicescomputer incorp 1231type processing 3 de director 12540659sic data fiscal 510267091 7374 act servicesprepackaged file year film end irs 10qa state incorp 1231type 203059890 3 de softwareassistant director 7372 12540658sic fiscal
e4PmIV	1	DC	thomas congress text bill library 112th 20112012 hr ih 1641 aeronautics return human space national presence administration direct moon plan sustained develop committee technology bishop jackson space olson texas lee utah posey science bill wolf ms mr introduced referred aeronautics return human space national presence administration direct moon plan sustained
mNYfwY	1	DC	heart living healthy live healthfindergov health learn quick guide connect website hyperlink nongovernmental direct application hhs consistent hyperlinks states services human subject information hyperlinked united application contained health endorsement department website intended provided visitors external constitute applications privacy appearance practices products policies purpose link redirected information usaccessibility privacy mapcontact act
zhMOL4	1	DC	presidents make healthiest council year 2012 set presidents past council year activity incorporating physical start reminder achieve 2012 nutrition good ability healthiest reflect goals making great 12 lifestyle level healthy age months realistic commit work weight people presidents set council years resolutions fit percent approximately reality report attainable change january
A1hwC7	1	DC	kilmartin ag garrahy governor rigov joseph statement passing attorney garrahy issued general peter kilmartin governor joseph statement passing remained officials trusted rhode joseph role leader model life treasured garrahy public learn saddened great statesman lost island governor morning passing commitment ceremony attended garrahy emulate trait early lieutenant scout day encounter
wAkGsl	1	DC	grant grantsgov opportunities synopsis opportunity find precedence service disk electronic click information grant provide notification send inconsistency document email resolved notifications printed address opportunity emails change receive thing giving original requestedany modification description represent newest file oldest previous shown documents current document sections files background representing modifications arranged changed list
w6aAkv	2	DC	apod saturns 22 january light hexagon 2012 fascinating discover featured written image explanation day photograph astronomer cosmos universe professional january 22 2012 planetary infrared discovered spacecraft motions saturns excluded flybys surrounds emanating rotating fully shape vortex continue corners unexpected imaged movie scientists orbiting shows saturn formation created study timelapse times
9bWss5	1	DC	healthierus school challenge resources healthymealsnalusdagov nutrition school healthierus challenge hussc recognizing excellence activity physical files adobe installed computer reader pdf view acrobat nutrition fns usda team information documents process completing challenge award application background criteria guidance resources view food usda service nutrition map hussc received awards schools view nutrition fns
vnrjr0	4	DC	great paterson national park falls historical search industrial played national site revolution nations parkhome industries power service role 7 largest interior 2011 jarvis economy ken building spectacular park waterfalls designated falls director key november shaping jon great harnessed americas american salazar 397th secretary twitter sign follow paterson events great falls
A5BSUE	1	DC	officeproposed national regional park servicealaska compendiums proposed national comments links parks interest park request alaska alaskas compendiums comment period closed compendium asked questions frequently proposed send comments address compendiums email listed preserve katmcompendiumnpsgov national comment aniakchak monument proposedto preserve katmcompendiumnpsgov national park denali comment alagnak wild river proposedto preserve bridge
zhYqQK	1	DC	000119312512020757 documents filing edgar files document format files data preparationassistant file year 34 film end irs 10qa state 00112989 servicescomputer incorp 1231type processing 3 de director 12540659sic data fiscal 510267091 7374 act servicesprepackaged file year film end irs 10qa state incorp 1231type 203059890 3 de softwareassistant director 7372 12540658sic fiscal
w4Wqfe	1	DC	garrett scott congressman news composed senate house washington states legislative united federal representatives 3 branch hundred meeting twelfth 2013 scheduled congress government dc 2011 january meet nearest office scott click electronically garrett visit location online details page contact congressman est fax 202 hob office washington rayburn dc 2259048 hours phone
AkTIYT	2	DC	union house plouffe david state hear white state union video watch enhanced transparency commitment browse house white logs visitor wait executive actions president obama federal receipt tax federal dollars tax spent people petitions create sign house inside white tour interactive adobe player flash content download view domain 20 january 237
Stnj	2	DC	hemisphere enlarged northern view documentwritelnbr polar documentwritelnn pass measurement documentwritelncenter time passtime recent extrapolated pass auroral oval plot northern measurements current shows polar satellite hemisphere extent noaa recent position poes hand plot clock noon points arrow meridian red ten map color updated auroral observed underlying statistical pass oval respect fluxes
tlrJlr	1	DC	poor videos dick forprofit rejects multimedia success gao excuse college archives student senator report rates industrys durbin senators colleges todays office senate characteristics washington states debunks college socioeconomic compares united forprofit floor lower make dick accountability rates longtime public today poor controlled government students dc highrisk gao excuse student report
hHJOXn	1	DC	champions house white change state union video watch enhanced transparency commitment browse house white logs visitor wait executive actions president obama federal receipt tax federal dollars tax spent people petitions create sign house inside white tour interactive mscaption textindent9000px 308px msdetail top top0px height norepeat 9999 349px positionabsolute left495px zindex
ABi13f	1	DC	union house state address white 2012 state union video watch enhanced transparency commitment browse house white logs visitor wait executive actions president obama federal receipt tax federal dollars tax spent people petitions create sign house inside white tour interactive union barack state address president delivers obama 2012 capitol house washington
xPDi5G	1	DC	impact ncbi nutr mic pubmed br 2012 intestinal insights function web ncbi javascript site warning requires management citation external file generate software limited yakult business west park lthomasyakultcouk south uk 6qe end mddx ha4 odyssey road ruislip emerging proposed agreed manipulation dynamic results reviewed episodes gastrointestinal homeostasis impact animal summarises
