4dwBHm	1	LA	picture astronomy day fascinating discover featured written image explanation day photograph astronomer cosmos universe professional 11 2012 bright distant earth disk 20 fit easy weeks apogee photographed perigee dark day telescope pacific dense sun asia moon smallest full 300 annular 240 kilometers path super silhouetted filter point image visible smaller
aAU9fu	1	LA	center watch thunderstorm prediction severe storm 21 status report messages watch 21 information network service national warnings visit iwin weather interactive 20 low 5 low 30 mod 30 mod 40 mod 20 low high 80 f2f5 probability forecaster 70 60 table event increased category tornadoes probabilities issuing 5 low moderate
qGiT7A	1	LA	information network education usnei information network site usnei education find financial links states recognition information united accredited international frauds students qualifications coming professionals programs foreign avoiding aid institutions information resources providers educators related avoiding accreditation system fraudulent officials recognized international education quality institutions assurance financial links students education abroad information
d7wl2N	1	LA	center tornado watch prediction storm 96 status report watch messages 96 information network service national warnings visit iwin weather interactive 40 mod 20 low 30 mod 30 mod low low high 70 f2f5 probability forecaster 70 60 table event increased category tornadoes probabilities issuing 5 low moderate events awareness listed
3Gl61S	1	LA	mileage driving gas tips efficiently sample labels money aggressive acceleration rapid driving percent 5 speeding save highway mileage braking gas wastes safer town lower 33 speeds reaches 60 speed rapidly decreases vehicle fuel optimal economy mileage gas mph range speeds gas mph 60 gallon 031 paying additional assume drive 5
A67k1E	1	LA	apod 15 reflection nebula february meropes 2012 fascinating discover featured written image explanation day photograph astronomer cosmos universe professional february 15 2012 tau color caused scattered cluster molecular open cloud size blue pleiades density 23 nebula nebulosity nebulas encounter stars merope red star surrounds explanation reflect chance reflecting brightest dust
5c9WMn	1	LA	treating nonhodgkins combination text view clinicaltrialsgov large patients full rituximab chemotherapy lymphoma diffuse bcell cancer kill carry find bcell dividing spread chemotherapy monoclonal nonhodgkins cancerkilling combination substances drugs stop rituximab lymphoma diffuse treating regimen cells work large stopping growth ways ability killing rationale grow antibodies effective giving block compare randomized
ABluFl	1	LA	ncbi microbiol interspecific pubmed generated appl biotechnol newly 2011 wine function web ncbi javascript site warning requires management citation external file generate software box glen sa 5064 institute 197 jennybellonawricomau research osmond australia australian po wine background increasingly hybrid desirable results aroma experiments differentiation impact style interspecific parents yeast material
wCJtY2	1	LA	web student aid states carefully educational united plans option decide professional fit undertaking study longterm states home education united end knowledge personal studying advancement include achieve higher greater students appreciation job higherpaying goals world abroad pursue country experience professional family move states culture home impact living educational united readjustments visiting
98s589	1	LA	relatives birth searching connected stay process fathers address searching arise issues information additional guidance adopted access relatives concerns parents resources locate families complete successful search persons designed birth child types searches conducting mothers factsheet guide table contents information publications recommend gateway childrens citation washington searching human welfare gateway information relatives
Ie4UjU	1	LA	media april social day awareness 2012 prevalence lifetime sexual physical 17yearold percent trauma witnessing 8 nationally reported assault experiences representative 39 12 17 violence youth survey providers dealing wwwsamhsagovchildren children friends visit trauma resilient hope families heroes youth learn assault1 prevalence percent lifetime sexual physical 17yearold 2 rates witnessing 8
