a4OKCe	1	LA	school climate epa change jump main content climate change search area contact epa pg printable 31 school newbieflagmay 1 230k version 2007 pdf gas greenhouse emissions newsroom climate listservs change school challenge cool links related educators energy star educators planning greenhouse reducing education role resources play students gas administrators action
yFmPQ3	1	LA	affordable hud housing cpd american initiative dream downpayment 150000 december years states initiative home 20042008 investment 50000 provided grant fifty administered assistance jurisdictions authorized formula addi 200 program funds million participating allocation part law downpayment population fiscal appropriated 16 local signed annually 2003 american qualified act dream partnerships lowincome helped
uDn3b1	1	LA	11 apod 27 sun 2002 catching july apollo fascinating discover featured written image explanation day photograph astronomer cosmos universe professional 2002 july 27 neil armstrong eagle soil image surface walk sample streaming bright catching sunlight collector outward aldrin ultimately sheet sun dramatize exposed long moon astronaut lunar samples earthbound pictured
xFAnw8	1	LA	full pain efficacy tolerability text clinicaltrialsgov patients safety arcoxia view evaluation etoricoxib neuropathic undertreated primarily neuralgia caused tolerability abnormal involve neurons determine pain etoricoxib remains herpetic safety present nsaid phn efficacy sensory post reliever neuropathic postshingles study disease commonly aim patients activity relievers investigating referred superior efficacy study hypothesis etoricoxib
VQuiV	1	LA	star energy low carbon campaign products low carbon home lowers saving campaign recognize energy global reducing technology information ultimately burning offer equipment low fossil resources fuels star risk nationwide brings assist carbon effort warming organizations consumed space air reduces pollution organizations star campaign energy joined saving low money carbon thousands
AjBOJC	1	LA	evol ncbi point repeatinduced biol patterns pubmed mutation 2012 genome function web ncbi javascript site warning requires management citation external file generate software department biology college amherst fungal homologydependent results evolutionary taxonomic puccinia find duplicated tpcpg systems hypermutation stable telike di indicative pucciniomycotina evolution specific activity hypermutating ustilaginomycotina prompted findings
wrNexb	1	LA	sci ncbi med sports exerc pubmed effects strike 2012 type footwear function web ncbi javascript site warning requires management citation external file generate software 11 biology evolutionary divinity usa university harvard cambridge human department ma avenue 02138 rearfoot shoes differs forefoot heels elevated strike supports minimal economy versus tests standard
wHaLOc	1	LA	retire plans read announces bill blog fema comment accordance comments blog moderated policy femas links nongovernment social applications web fema provided reference media companies sites endorse msgdata washington street apply management prepare federal rates homeland department 4fema emergency dc 43362 20472202 sw agencyus security500 6462500text tty assistance step 46275853 800
w3vFX9	1	LA	pyramid usda food fnicnalusdagov myplate resources nutrition usda policy promotion center mypyramid guidelines primary myplate easytounderstand americans group consumers cue build 2011 consistent plate eating food symbol june encouraging visual governments healthy adopt 2010 habits replaced dietary society education nutrition incorporate educators guidelines myplate dietary americans education find content online
FRke6w	1	LA	lower blueberries risk tied medlineplus apples diabetes pages related medlineplus narayanan aparna linked blueberries pears reuters health eating risk york diabetes lower study apples heart cancer loaded flavonoids vegetables research tentatively risk tied compound benefits present lower natural grains disease heath fruits people tended blueberries research 2 health low type
dUE1V6	1	LA	protandim pubmed ncbi function web ncbi javascript site warning requires management citation external file generate software alveolar stress intrapulmonary disorders influence protandim epithelial human subjects permeability oxidative alcohol burnham el brown house la jm moss bose mccord gaydos jan doi 20 physiol 101152ajplung002972011 cell lung apr3027l68899 mol epub 2012 citations
xsuubq	1	LA	management office federal register documents personnel home page additional links amending partial office general county chabot george localities information joann grant federal personnel political add hatch residing 202 restrictions act designated virginia regulations united regulatory opm king counsel 6061700 exemption employees list states contact activity management agency executive services single
AnkFiD	1	LA	acad sci ncbi resistance pubmed insulin cellular natl 2009 proc function web ncbi javascript site warning requires management citation external file generate software australia street institute medical klh8stvirginiaedu darlinghurst research program 384 nsw garvan obesity victoria 2010 diabetes caused resistance poorly rapid rapidly parameters production defining superoxide results uncouplers cellular
x3xKr9	1	LA	med volumetric ncbi analysis sex pubmed urethr vascular 2010 3d function web ncbi javascript site warning requires management citation external file generate software italy reproduction gynecology studiorumuniversity pathophysiology mater massarenti human bologna department cesarebattagliauniboit alma gspot controversial existence space urethrovaginal threedimensional evaluate ultrasonography structures anatomic 3d color underwent ii orgasm
NHIcS	1	LA	house white state union video watch enhanced transparency commitment browse house white logs visitor wait executive actions president obama federal receipt tax federal dollars tax spent people petitions create sign house inside white tour interactive event live facebook discussion participate click member facebook give click questions comments httpwwwwhitehousegovvideo ondemand library
waWExn	1	LA	apod 15 january magellanic infrared large portrait cloud 2012 fascinating discover featured written image explanation day photograph astronomer cosmos universe professional january 15 2012 herschels remarkable show infrared distant galaxy young galaxys views 160000 easily clouds cooler large stopped activity telescope images blue herschel spitzer space ways nebula contributed tend
6eQiB	1	LA	phones cell call registry truth telemarketing national number trade numbers phones telemarketers 139 dnc federal concerned agency circulating surpassed cell commission protected call internet today million reiterated phone registry emails made consumers calls released register addition future time claims dnc phones cell registry truth information rules national wwwftcgov fcc wwwfccgov
yFzPCW	1	LA	rituximabrefractory ofatumumab ncbi pubmed blood follicu monotherapy 2012 function web ncbi javascript site warning requires management citation external file generate software immunology cancer roswell institute park departments ny medicine buffalo heavily cd20 dose 91 weekly 27 22 wwwclinicaltrialsgov progressionfree rash 4 8 infusionrelated combination leukopenia survival mg therapy international years
HxGPkv	1	LA	apod april tungurahua 2 erupts 2012 fascinating discover featured written image explanation day photograph astronomer cosmos universe professional april 2 2012 1300 roughly high tungurahua erupts years shines cloud peak glows photographer sky lavalit 5000meter located hot 2006 captured starlit white image pictured ejected pours explanation distance visibly dark fell
zkzZ47	1	LA	volcanic natural island hazards sea red december zubair pulse 60 violent rising yemeni sea navy activity helicopter captured video northern 23 began sulfor 40 located edge details eruptions dioxide white 2011 red satellite shallow forming eruption coast middecember reported imagery kilometers satellites revealed explosions recent saba showed island highresolution submarine
xwfS45	1	LA	code 21 title federal regulations cfr 216 compounding part pharmacy drug products bcompounded subpart food unsafe cosmetic withdrawn market provided federal section 503aa compounded act removed effective drug products components found exemptions drug phosphate products adenosine drug products cortex adrenal products azaribine drug benoxaprofen products drug products bithionol drug sodium
wAO5RR	1	LA	19 january national update thursday situation fema 2012 information warnings west region effect watches remain advisories wwwwrhnoaagov numerous latest heavy flash series move pacific wyoming mountains saturday montana northern amounts coasts cascades copious 3 low moisture 6 flooding idaho systems rainfall heaviest inches utah oregon coast pressure carrying california snowfall
pUibpI	1	LA	netherlands patient 1994 contraception couns ncbi pubmed low educ function web ncbi javascript site warning requires management citation external file generate software ongoing planning agricultural fear rapid main pill increased sterilization netherlands level payed including shows methods pregnancies reduce related sex society rate growth discussions sexual insurance voluntary factors review
xHnIuD	1	LA	20 2012 feb blotter 33rd locationsabout usnonemergency3034413333 streetboulder 803013034413300other address1805 emergency911 boulder 6a1a18 uiheadercolor favorites twitter servicesexclude uicobrand print addthisconfig servicescompact google facebook delicious var ffffff email uiheaderbackground boulder detectives death police sioux coroner notified drive 55th county unattended responded 122380 30th passenger median scene hospital officers vehicle happened hit
zHsrnj	1	LA	thomas congress text bill library 112th 20112012 hcon ih 107 force misdemeanor high sense constitution section offensive crime 4 constitutes authorization expressing congress president article ii clear prior impeachable act military jones committee judiciary submitted concurrent mr resolution referred force misdemeanor high sense constitution section offensive crime 4 constitutes authorization
kPDJVH	1	LA	hud neighborhoods choice childhood forprofit vi authorities community linking involve services improvements including broader jobs education successes addition planning educational residents undertaking provide assisted support transform opportunities access emphasis approach highquality build developers local viable hope mixedincome concentrated comprehensive transportation nonprofits hudassisted choice early poverty preservation schools strong projects governments
w6ZT13	1	LA	cognitive mobile outcomes pubmed behavioral pediatrics nov1285e105361 3 2011 oct epub rochester usa mayo mn anesthesiology medicine clinic college department flickrandallmayoedu 55905 anesthetic findings exposed receipt tests lds agents learning education children millions neurodegeneration subsequent anesthesia 1 3 2 achievement significance immature program investigated apoptotic explore background scores association exposure
wB0vYz	1	LA	19 2012 feb 17 blotter 33rd locationsabout usnonemergency3034413333 streetboulder 803013034413300other address1805 emergency911 boulder 6a1a18 uiheadercolor favorites twitter servicesexclude uicobrand print addthisconfig servicescompact google facebook delicious var ffffff email uiheaderbackground friday feb 17 2012 122276 eluding elude rate broadway apparently disturbance police driving located 950 reckless call arrest vehicle suspect store
6OvCsb	1	LA	preserve memorial timucuan national ecological historic caroline fort search wetlands coastal hardwood discover human kingsley includes timucuan 6000 dunes visit plantation caroline preserve beauty coast atlantic marshes years fort hammocksthe experience unspoiled salt history school slave graveyard university florida archaeology plantation field kingsley quarters found evidence 2010 florida anniversary landing
cQSs0S	1	LA	adults ncbi arch 2005 crime pubmed psychiatry gen sever victimization function web ncbi javascript site warning requires management citation external file generate software northwestern school usa chicago university medicine feinberg lake 710 sciences shore psychiatry behavioral department drive psycholegalnorthwesternedu 60611 il illness mental community victimization crime live smi risk deinstitutionalization
wSXN1L	1	LA	documerica location skip navigation introducing records narations national access blog archives online public levelmore complete series arc 73 series national 15000 arc images research everyday 19711977 part capture freelance agency id archives local archival digitized activities life documerica problems photographers catalog hired 412da relating environmental project protection 1970s epa plans
14fWcF	1	LA	center watch thunderstorm prediction severe storm 134 status report watch messages 134 information network service national warnings visit iwin weather interactive 20 low 5 low 30 mod 30 mod 30 mod 20 low high 70 f2f5 probability forecaster 70 60 table event increased category tornadoes probabilities issuing 5 low moderate
zui2a7	1	LA	home usda kyf compass food farmer compass usda videos discover market pictures field systems farmer local supporting food regional watch compass segment case read learn growing studies kyf computer file compass open acrobat experience reader pdf save map 20092011 years visiting food regional programs farmer usdasupported shows interactive local projects
xzMFCp	1	LA	photo house january white day 2012 state union video watch enhanced transparency commitment browse house white logs visitor wait executive actions president obama federal receipt tax federal dollars tax spent people petitions create sign house inside white tour interactive january house check offices photo 2012 picks white day office deputy
A113rm	1	LA	corps announcing creation blog fema discrmination age isnt 1824 set adults enter due mentioned apply odd develop 21 young long program wwwamericorpsgovnccc leader team offers americorpsnccc part workforcethat skills 18 age opportinuty nccc limit learn sector government workforce private expansion develop skills workers job cares join citizens corpssee httpwwwcitizencorpsgov tax
zZ1zsG	1	LA	inmate cropper 091432 lumley committed perryvillesan murder throat brent cell juan response inmate unit 7 department contraband knife arizona march stabbing cropper murdered locked 1997 place officer corrections found shutts miller marshall steinle sentencing defense richard robert heilman start 3 joseph roland 6 colehon john resentencing plea honorable judge 2
wJPcoM	1	LA	inmate 057713 ellison opinions handsproceedings charles victim committed previous 24 death pecuniary smith tape pending judge february lillian january verdict release vincent homicides direct depraved defense home richard robert moon masking appeal arizona choked conviction trial published bound commission convicted start joseph cords prosecutor suffocated telephone heinous gain broke circumstances
GTuFc0	1	LA	hankuk house university president speaks white obama state union video watch enhanced transparency commitment browse house white logs visitor wait executive actions president obama federal receipt tax federal dollars tax spent people petitions create sign house inside white tour interactive adobe player flash content download view 26 march 2937 domain
yrfXg6	1	LA	inmate 136521 anderson shot agreed held kill poyson leta cut 21 bludgeon finally kagen gave hit killed bread ended bobby 50 rock trailer lantern crushing decided home driving robert knife eating august frank night hitchhiking hours death wear boy 39 yard dinner cinder block son county delahunt awoke 15yearold letas
xIfOnn	1	LA	lacrimator aspects ncbi medical 2003 pubmed harefuah cs function web ncbi javascript site warning requires management citation external file generate software burning including signs cs swallowed stage police army conjunctivitis symptoms clinical treatment main eyes riot introduce sore agent world symptom nausea reviews nose salivation postexposure control guidelines sensation 1960s
auaalp	1	LA	center tornado 45 watch prediction storm status report 45 watch messages information network service national warnings visit iwin weather interactive 50 mod 30 mod high 80 20 low 30 mod 10 low high 95 f2f5 probability forecaster 70 60 table event increased category tornadoes probabilities issuing 5 low moderate events
HbABIR	1	LA	text clinicaltrialsgov multiple management safety evaluation full pain efficacy therapy adjunctive neuropathic nabilone sclerosis gabapentin view cesamet significantly agent determine adjunctive management pain purpose neurontin neuropathic nabilone improved study relief ms gabapentin nerve burning manage narcotic chronic agents tingling conventional placing due symptoms treatment stabbing analgesia neuropathic syndromes axons worst
GXFy79	1	LA	duncan importance carolina innovative affordability clyburn highlight college joins department congressman education reform south secretary superintendent leaders simons community county held elementary follow mcginley mayor 1050 duncan discussion engagement clyburn availability joseph public riley north business press 1135 schools policymakers school join james reform event teachers nancy charleston roundtable summerton
xj7vRJ	1	LA	report science nsfgov special nation aquatic facility rivers shes oklahomas species zoologist research state collected shows recently norman mussels part vaughn river university 30 freshwater southeastern caryn names home species pimpleback hold rabbitsfoot oklahoma approximately research location pistol grip vaughn good north colorful 300 mussels hand vaugn mussel america 55
dtbcVO	1	LA	states patent 6630507 united group treatment neuroprotective diseases hiv antagonism cochsub3 neurological prophylaxis consisting unrelated found invention doses avoid selected parkinsons cannabinoids trauma agerelated formula method oxidation chsub3 nmda properties neurodegenerative toxicity makes inflammatory neuroprotectants antioxidant receptor autoimmune antioxidants ischemic nonpsychoactive psychoactive present wide stroke limiting cannabidoil property encountered high
92kD7Z	1	LA	center tornado watch prediction 61 storm status 61 report watch messages information network service national warnings visit iwin weather interactive high 70 50 mod 50 mod 30 mod 40 mod 30 mod high 80 f2f5 probability forecaster 70 60 table event increased category tornadoes probabilities issuing 5 low moderate events
yjPNDj	1	LA	images national ocean service noaas code national site images page web service blog widget copy paste ocean latest widget nongovernmental site external flickrcom web service provide accesses note order height300 frameborder0 srchttpoceanservicenoaagovwidgetsflickrflashhtml width120 stylepadding0 overflowhiddeniframe iframe scrollingno national revised site httpoceanservicenoaagovimageshtml usagov questions owner web service administration comments department 2012
mYuqg	1	LA	prediction storm center compmap weather references rap analysis 12z rapid pages 1 input 2012 updated fire ruc background fields changed refresh replaced model display mesoscale svrgis apr weather tornadoes gis shapefile visit details 9 2012 19502011 updated 19552011 format shp hailwind httpwwwspcnoaagovgissvrgis reports severe converted page feedback hovered issued displayed
wIzuEQ	1	LA	cancer bmj ncbi metaanalysis survivors pubmed activity 2012 physical function web ncbi javascript site warning requires management citation external file generate software ka school nursing university shing li hong china faculty medicine kong completion cancer adult systematically activity treatment related patients effects evaluate main physical independently controlled quality assessment metaanalysis
AhqykV	1	LA	kids selfcentered brains medlineplus immature page related medlineplus wednesday brain healthday linked selfish young children 7 selfcontrol development march news region behavior involved study incomplete beneficial findings german children selfish lead ways explain young impulses difficulty controlling promote suggested improved behavior social researchers played neuron ages accept children recipient 8
kvcs	1	LA	financial government citizens grants usagov aid benefits financial grants identify apply eligible benefitsgov government loans benefits aid financial loan back states grants universities grant pay assistance awarded interest type grantsgov differences cities loans counties organizations search remember required individuals nonprofit researchers top back top back top back top back benefits
7DgBXv	1	LA	2011 automotive 1975 otaq lightduty trends emissions dioxide fuel carbon epa technology economy jump main content cars trucks light area search contact additions epa recent years mile previous based improvement fuel 2011 2010 mpg report projects trucks standards miles trend trends year sport provided co2 pickup dioxide reverses slight cars
c0RKjF	1	LA	center tornado 56 watch prediction storm status report 56 watch messages information network service national warnings visit iwin weather interactive 40 mod 20 low 30 mod 30 mod 40 mod 30 mod high 70 f2f5 probability forecaster 70 60 table event increased category tornadoes probabilities issuing 5 low moderate events
wBwI6b	1	LA	transplantat ncbi stem cell application pubmed res pediatr autologous 2012 function web ncbi javascript site warning requires management citation external file generate software alantyndallfpsbaselch rheumatology felix basel switzerland department platter university spital results years systemic including ads jia progressionfree iii improvement treatment mortality survival morphological effects documented acute trm exploiting
AtDQ8O	1	LA	living aortic healthfindergov healthy aneurysms live learn quick abdominal guide connect website hyperlink nongovernmental direct application hhs consistent hyperlinks states services human subject information hyperlinked united application contained health endorsement department website intended provided visitors external constitute applications privacy appearance practices products policies purpose link redirected information usaccessibility privacy mapcontact
dlHinz	1	LA	webinars workshops free state york archives training opportunities archtrainmailnysedgov workshops searching questions open current state interested archives online events schedule free webinars attending register noted contact browsing current schedule view register workshops list virtual add registration featured workshops resources calendar events meetings learn york calendar special state archives online events
wGldb6	1	LA	apod australia aurora february 1 red 2012 fascinating discover featured written image explanation day photograph astronomer cosmos universe professional 1 february 2012 atmosphere including magellanic earth disk galaxy ground sky showered weeks excited australia familiar aurora emanating oxygen large pictured night small distant back video highlighting particles state 1402 red
hAl5rh	1	LA	gluten ncbi sensitivity markers celiac biol psychiatry pubmed 2010 dis function web ncbi javascript site warning requires management citation external file generate software school pediatrics usa hopkins johns sheppard research 21204 medicine pratt program fdickersonsheppardprattorg department stanley maryland baltimore increased sensitivity reported schizophrenia inconsistent association gluten immune studies 151 chain
a09XqB	1	LA	center tornado pds watch prediction storm 58 status report messages watch 58 information network service national warnings visit iwin weather interactive high 95 high 80 high 80 60 mod high 70 60 mod high 95 f2f5 probability forecaster 70 60 table event increased category tornadoes probabilities issuing 5 low moderate
yDzEd8	1	LA	enhances sulforaphane ncbi repair des pharm pubmed protection curr 2011 function web ncbi javascript site warning requires management citation external file generate software pharmaceutical pharmacology tokyo university ayanakarsnodatusacjp sciences clinical faculty department japan science closely show mucosa paper protecting chemical finally family enzyme rich activities mention effects cellular compound induced
GHpysy	1	LA	secondhand disease childhood lung smoke medlineplus years linked pages related medlineplus obstructive adults exposed chronic lung healthday pulmonary children risk march secondhand monday news condition developing 19 study disease theyre smoke found called obstructive term copd bronchitis disease number emphysema chronic including pulmonary conditions adults assess worse factors difficulties 325
Gzu9Ot	1	LA	stress mission solstice cassini enceladus images home image details alexandria focus tiger stripe images sulcus directorate jpl developed cassini washington mission manages cooperative laboratory technology assembled orbiter jet space propulsion agency pasadena european division cassinihuygens dc nasas california designed institute project nasa science italian information httpwwwnasagovcassini visit mission httpsaturnjplnasagov cassini
150pf	1	LA	homosexual ncbi 1996 homophobia pubmed ar abnorm psychol function web ncbi javascript site warning requires management citation external file generate software georgia psychology usa university athens 306023013 department assigned aggression monitored penile buss 29 exclusively increases affect videotapes erection admitted individuals unaware exposed erotic individual sexually nonhomophobic questionnaire denies index
