Anazwx	1	IL	nih health january national release 12 identify scientists workings viruses news 2012 approach institutes view links related bookmark share smaller findings developed viruses human skin institutes bacteria diseases visualize provide niams jan musculoskeletal scientists health structures national discovery arthritis science reported part workings insights 13 institute cells microscope issue researchers
uvUSJr	1	IL	immunocompromised ncbi infection pubmed dev clin bartonella immunol 2012 function web ncbi javascript site warning requires management citation external file generate software usa pennsylvania hospital philadelphia medicine department mosepelemosepeleuphsupennedu university caused escape henselae system paper including establishing examine gaps living develop immune bartonellas quintana severe discuss current scratch milder fever
w8bFzm	1	IL	flashlight led target fire burn hazards due sets recalls named washington instructed voluntary consumers illegal commission safety cooperation announced firm product stop dc recalled resell attempt immediately products today recall consumer flashlight product led 6pc sets units 55000 target minn corporation minneapolis importer flashlights fire burn turned hazard heat posing
zs5dcP	1	IL	living healthfindergov healthy quitting live learn quick smoking guide connect website hyperlink nongovernmental direct application hhs consistent hyperlinks states services human subject information hyperlinked united application contained health endorsement department website intended provided visitors external constitute applications privacy appearance practices products policies purpose link redirected quit steps follow information usaccessibility
utqQpc	1	IL	ene ncbi acids nucleic pubmed portal genome res department 2012 function web ncbi javascript site warning requires management citation external file generate software creek usa institute energy ivgrigorievlblgov drive walnut joint genome department 2800 mitchell unified fungal metagenomes find web point capabilities bioenergy systems mycocosm joint trillions sequencing world projects
xdNiTK	1	IL	pap tests color pdf full cancer find pap cervix vagina test checks opens womb part lower smear cells turn sex pap 21 start 3 vaginal tests years women time pap make normal find call test appointment period change cells harder including pap based doctor things nurse tests woman decide talk
yPFHXd	1	IL	spaces building sb744 capitol authorizes private surveillance state camera video security requires public current bill summary capitol office private produced spaces carry surveillance armed offenses police system camera disclosed criminal duties firm enforcement emergency sunshine removes records provision official act guards security 744 contracting video provide establish agency administration officers
wRBsoq	1	IL	current uscert activity highimpact web current incidents regularly updated reported types summary uscert activity security page frequent multiple apple released updates safari address vulnerabilities products security os code crosssite obtain information perform vulnerabilities privileges elevated attack attacker condition execute denialofservice exploitation sensitive arbitrary operate scripting articles mitigate users ht5281 encourages
I7kwrz	1	IL	house white girls stem questions state union video watch enhanced transparency commitment browse house white logs visitor wait executive actions president obama federal receipt tax federal dollars tax spent people petitions create sign house inside white tour interactive edt house 1130am engineering council technology event special girls mathematics white 2012
bfFJRc	1	IL	center watch thunderstorm prediction severe 124 storm status 124 report watch messages information network service national warnings visit iwin weather interactive low 5 low low low 30 mod 20 low 50 mod f2f5 probability forecaster 70 60 table event increased category tornadoes probabilities issuing 5 low moderate events awareness listed
zUkgxK	1	IL	coagulation asthma ncbi pubmed blood 2012 function web ncbi javascript site warning requires management citation external file generate software center infection immunity medicine amsterdam molecular experimental airway years obstruction lung implicated impact paroxysmal asthma knowledge proteaseactivated system receptors treatment molecular local allergic summarizes activities increased lungs symptomatic pathophysiology link background
GBZVpp	1	IL	states patent united 8141075 operations desktops servers poweroff fashion vms management addition desktop automate suspension include engine triggered possibly controlling condition timely timebased virtualized maintained plurality policies logon migration manages systembased process operates contingent virtualization scheduling operation event machines physical established provide virtual events infrastructure ability includes user organization changing
9CORvM	1	IL	wolfowitz sam defensegov deputy tannenhaus interview news vanity transcript fair secretary people europe conspiritorial notion talk pretty disgraceful wolfowitz job ignore obvious europe guess antisemitism wolfowitz im iraq question september years produced nefarious policy views transparent admittedly ten people 11th completely surely 100 change changed reason foreign thing american pick
HhR93M	1	IL	blow wisconsin antiunion forces dealt 02 april 1149 monday 2012 sector protests bargaining madison elimination initiative year families working federal legislation including unions struck sparked wisconsin provisions friday instituted judge republican class portions weakened rights collective governor public antiunion walker scott limited requirement members clause violated organized elections judge including
sjFseC	1	IL	forage center presentations research dairy 2011 october 48 wi dairy world 2011 expomadison forage center usdaars crop research efficiency digman fuelmatthew engineerus time improving agricultural harvest dairy starch tickpatrick scientistuniversity corn silage wisconsinmadison digestibility dairy time makes hoffman fermentation feed wisconsin extension nutritionistuniversity top herds wisconsinmadison thinkrandy dairy forage shaver
A3sG2g	1	IL	government administration site general gsa auctions services warranted property condition grable anthony prior contact appontment inspection removal removal 01262012 payment 01132012 due dates custodian times contact arrangements removal inspection bidders removal loading located responsible awarded cautioned successful packing exact place property harahan 1420 la sams suite warehouse ave dhs fema
w1KEJs	1	IL	24 apod january norway aurora 2012 fascinating discover featured written image explanation day photograph astronomer cosmos universe professional 24 january 2012 earth captured northern sky spectacular aurora recombining oxygen large activity round throwing protons sun flare pictured eagle night free latitudes days magnetosphere whats feel powerful mass cloud earths fast
HOD0cJ	1	IL	proclamation white autism presidential house world day awareness 2012 state union video watch enhanced transparency commitment browse house white logs visitor wait executive actions president obama federal receipt tax federal dollars tax spent people petitions create sign house inside white tour interactive house white office press secretary united day autism
wiBYmL	1	IL	apod 20 ngc february spiral barred 1073 galaxy 2012 fascinating discover featured written image explanation day photograph astronomer cosmos universe professional february 20 2012 years bright centers galaxy system ngc young black prominently clusters spectacular dark bar 55 red upper bars telescope sea constellation space xray captured orbiting cetus pictured
92kD7Z	1	IL	center tornado watch prediction 61 storm status 61 report watch messages information network service national warnings visit iwin weather interactive high 70 50 mod 50 mod 30 mod 40 mod 30 mod high 80 f2f5 probability forecaster 70 60 table event increased category tornadoes probabilities issuing 5 low moderate events
bSLfjT	1	IL	20 center watch thunderstorm prediction severe storm status 20 report watch messages information network service national warnings visit iwin weather interactive 20 low 5 low 30 mod 30 mod 60 mod 20 low high 80 f2f5 probability forecaster 70 60 table event increased category tornadoes probabilities issuing 5 low moderate
w4AebT	1	IL	physicians res ncbi bmc drugs health adoption serv pubmed 2012 function web ncbi javascript site warning requires management citation external file generate software abstract examining family physicians specialists substitute established riskbenefit diffusion drugs differences analyse cheaper months aim balance adopters number month cefditoren etoricoxib group family monthly tiotropium adopter pregabalin
w7Onl7	1	IL	visitors winter dnr summer resident find warmer canada winter opportunities birds offers perfect michigan time trees binoculars reason found put unique chill leaves viewing air migrate temperature species climates fallen owl supply traveler rarely northern long lansing gray eastern food michigan tundra peninsula homes migrants small found upper consistent humans
yMIf2C	1	IL	management invasive missouri conservation department species origin lespedeza alien asian continent pests environment planted diseases displace accidentally watershed predators prevent habitat roadsides organisms moderate wildlife introduced exotic consume invasive area purposefully part population plants animals purposfully country aggressivlely describe species native spreads check nonnative sericea erosion evolve plant natural fungi
xngJAs	1	IL	med acid nepal ncbi uric pubmed jnma janmar assoc estimation 2011 serum function web ncbi javascript site warning requires management citation external file generate software kathmandu tuth biochemistry university nepal tribhuvan clinical maharajgunj department teaching hospital gout prevalence trend including acid serum ancient hospital uric increasing arthritis hyperuricaemic hyperuricaemia attending
AfW92Y	1	IL	climate global february analysis state 2012 form monthly reports access calculation 310 surface dataset including anomalies monitoring temperature monthly beginning state note 3 version ncdc 2011 activities global complete land preliminary report november data change received climate october effective presented trends ranks replaced processed ghcnm newest coding homogeneity adjustment information
zbbJUL	1	IL	michelle move anniversary lets house speaks lady white obama state union video watch enhanced transparency commitment browse house white logs visitor wait executive actions president obama federal receipt tax federal dollars tax spent people petitions create sign house inside white tour interactive adobe player flash content download view 11 february
tREyyw	1	IL	med ncbi predict proteins peripheral pubmed blood crit 2012 respir care function web ncbi javascript site warning requires management citation external file generate software 628 lung 15261 dorothy avenue richard 5th 3459 pa medicine muh nw usa pittsburgh department simmons center university interstitial disease medical ipf variable unpredictable disease etiology
wZ7cFJ	1	IL	ncbi area front pubmed orthographic contamination brocas 2011 psychol function web ncbi javascript site warning requires management citation external file generate software cnrs psychology laboratoire university de france aixmarseille marseille cognitive contaminates results years brain dorsalanterior auditory permanently speech inferior belonging read frontal activation test areas specific found learning past
nED8jN	1	IL	med sport observation ncbi al trail andalus pubmed clin ultra 2011 function web ncbi javascript site warning requires management citation external file generate software volkerscheeryahoocom emergency melrose uk services borders care organizers injuries ultramarathon health suffered events 219km problems 5day plan provision runners stage medical record race observational study southern
qKgmej	1	IL	cor sci perspectives ncbi pubmed leadership moving 2011 nurs function web ncbi javascript site warning requires management citation external file generate software toronto university canada nursing developed guided surrounding professional including learning find lessons perspectives create opportunities courageous shared nurse supports leader readers practice leadership authors learned knowledge organization engage
x8NMNa	1	IL	workbench genome ncbi function web ncbi javascript site warning requires workbench sequence private analyzing publically mix data application genome integrated viewing ncbi databases view workbench retrieve sequence phylogenetic private tabular including alignment ways genome public graphical views databases results blast data align tree context display workbench toolkit unix linux flavors
ygDO0p	1	IL	semen ncbi hum men fat pubmed attending dietary quality reprod 2012 function web ncbi javascript site warning requires management citation external file generate software school ma usa gynecology boston hospital 02115 general harvard massachusetts obstetrics vincent medical saturated results years sperm relation morphology ptrend parameters 23 samples plasma associations chromatography
y0EV7z	1	IL	raise air heartattack cold medlineplus exercise risk pages related medlineplus heart people cardiac healthday news cold risk physical death snow arrest 2 bodys activities breathing march greater friday increases finds demand put shoveling oxygen study disease air heart youre college sinoway cold news isometric pennsylvania coronary state trigger vascular medicine
AbAMbG	1	IL	full longitudinal study sclerosis clinicaltrialsgov als biomarkers text amyotrophic lateral view find underlying als develop collect markers research samples usage hope purpose unique comparison biofluid study banking therapies learn biological researchers point cerebrospinal serum csf als participants samples collected include plasma rna fluid blood dna time biological amyotrophic people cerebrospinal
y89dU	1	IL	home 180 poetry page congress library inspire human poem spending make poetry member 180 race reading day means important lives poems revealed worlds daily part minutes community find poem readers system 180 easy listened read readings hear school mind high year end suggest make selected poetry announcements public intended students
JmclXD	1	IL	jacket puma waist pose hazard youth drawstrings recalled entanglement named washington instructed voluntary consumers illegal commission safety cooperation announced firm product stop dc recalled resell attempt immediately products today recall consumer product puma usa training jacket pockets vkonstruct units 5000 puma north westford importer mass america childrens prevent stitched issued
wqsmNW	1	IL	ncbi reference drosophila nature genetic pubmed melanogaster 2012 panel function web ncbi javascript site warning requires management citation external file generate software 27695 genetics usa university state raleigh department north trudymackayncsuedu carolina evolutionary shape selection including consists facilitates previous rapid based explain autosomal phenotypes variants reveal evolution resource fully large
zC2b65	1	IL	apod march nebula 13 m81 flux group integrated galaxy 2012 fascinating discover featured written image explanation day photograph astronomer cosmos universe professional 13 march 2012 nebula image visible including galaxy unusual group nebulae faint spiral virgo complex exposure local supercluster filamentary big explanation largest gas lucky m81 part diffuse halo
aKJJC2	1	IL	center watch thunderstorm prediction severe storm 104 status report watch messages 104 information network service national warnings visit iwin weather interactive 10 low low 20 low 10 low 20 low 10 low 50 mod f2f5 probability forecaster 70 60 table event increased category tornadoes probabilities issuing 5 low moderate events
jwnbGE	1	IL	kenai national park fjords search changing crowning lush effects forests lies ice sea lingers shrinking witness native fjords feature 40 icy glaciers resources life harding waters alutiiq climate bear expanse peninsula entwined kenai thrives nurture vast wildlife land age flow edge today relied icefield accessible trails landscape glaciated glacier offers
xh5GRv	1	IL	people healthy violence 2020 injury website hyperlink nongovernmental direct application hhs consistent hyperlinks states services human subject information hyperlinked united application contained health endorsement department website intended provided visitors external constitute applications privacy appearance practices products policies purpose link redirected disabled supported javascript note browser evidencebased area related topic find
wNCRbd	1	IL	advisory statistics transportation request council nominations rita pdf statistics transportation agency administration research bureau innovative technology dot advisory statistics transportation acts request council action nominations summary composed bts collected supported reliability quality statistics solicits acts interested relevance advise objectivity stakeholders transportation serve director persons analyses nominations disseminated consistency dot dates
dqFf3v	1	IL	center watch thunderstorm prediction severe storm 101 status report 101 watch messages information network service national warnings visit iwin weather interactive 10 low 5 low 40 mod 10 low 50 mod 20 low high 70 f2f5 probability forecaster 70 60 table event increased category tornadoes probabilities issuing 5 low moderate
zit0hJ	1	IL	apod january lighthouse meteor 8 2012 fascinating discover featured written image explanation day photograph astronomer cosmos universe professional january 8 2012 produces years bright hercules cold captured northern sky 4 easy east skygazers coast early dim january radiant muralis identified morning view maurice obsolete rivers constellation event planet quadrantid boundaries
nYdn32	1	IL	wildlife nwr service fish pahranagat photo usfws nwr migratory national pacific county sight nevada birds pahranagat established habitat provide pahranagats approximately 1963 located north august lincoln lakes vegas flyway marshes 90 part refuge las wildlife rare 16 miles waterfowl upper managed pahranagats food obtain middle wetland springs resident 230 species
zQvpFL	1	IL	retirement problems back medlineplus savings cut pages related medlineplus financial people tuesday retire back healthday forced feb struggles problems early news 14 study face ongoing finds financial significantly reduce reducing retirement wealth affects health sydney income australia ability early accumulate university work longterm researchers people retire ages back 64 data
xOFHPm	1	IL	eligibility white house sudan defense determination south articles receive services memorandumpresidential presidential state union video watch enhanced transparency commitment browse house white logs visitor wait executive actions president obama federal receipt tax federal dollars tax spent people petitions create sign house inside white tour interactive house white office press secretary
xepoQz	1	IL	connection make kidney nkdep services health human department management disease understanding detection improving kidney basics longer disease healthier learn kidneys kidney disease tests recommended learn kidney living information people disease kidney loved life lifestyle longer diet live healthier learn information ckd monitoring clinical health management patient education evaluation professionals learn
9aGRKA	1	IL	federal compliance elaws advisor contractor states department united labor assessing factors single questions previous 27 factors listed analyze business part entity list organization ofccp page question 1 common ownership factor relates andor relate officers directors 2 common questions factor control facto relate de 3 questions factor exercise policies source relate
yrliKR	1	IL	med ncbi leg spurious pubmed products healthcare exper claims 2012 function web ncbi javascript site warning requires management citation external file generate software 11 consulting west sp2 pharmavision montague lespharmavisionconsultingcouk salisbury harnham 8nj road office 22 chosen directive widely stop continued submission standards stopped twelve 200529ec direct maximum 36 trading
xPDi5G	1	IL	impact ncbi nutr mic pubmed br 2012 intestinal insights function web ncbi javascript site warning requires management citation external file generate software limited yakult business west park lthomasyakultcouk south uk 6qe end mddx ha4 odyssey road ruislip emerging proposed agreed manipulation dynamic results reviewed episodes gastrointestinal homeostasis impact animal summarises
wW5s4d	1	IL	adv lea sci theory ncbi informal pubmed pract health selfregulated educ 2011 function web ncbi javascript site warning requires management citation external file generate software toronto wilson centre university canada nikkiwoodsutorontoca lack focus interpreted surgical skill issues informal behaviours opportunities foster choose greater evaluate practice results rotation discuss secondary perceived
yxxZFn	1	IL	recreation 20 park valmont parks jan reopens bike department 2012 boulder 6a1a18 uiheadercolor favorites twitter servicesexclude uicobrand print addthisconfig servicescompact google facebook delicious var ffffff email uiheaderbackground recreation park valmont parks reopens bike department trails weather dried cold cycling due parks closed caused department conditions poor valmontbikepark park reopened trail
nphuEE	1	IL	plant ncbi res mir168a specifically cell pubmed exogenous mammal targets 2012 function web ncbi javascript site warning requires management citation external file generate software pharmaceutical jiangsu center state university school biology nanjing research sciences engineering china key laboratory biotechnology life microrna chinese ldl abundant previous mirnas removal enriched molecules stable
Am7yOm	1	IL	complaint scheme center check crime continue counterfeit internet ic3 firms law target collecting schemes scammers parties checks check counterfeit canada debt targeting banks located claiming legal instructed determined ireland firms email firm korea lawyers funds continues wired agreement fees payable wire china law overseas remaining receive reports requesting retainer contact
AgtcXV	1	IL	ncbi tumors current brain indian pediatr pubmed children therapies 2012 function web ncbi javascript site warning requires management citation external file generate software houston childrens cancer holcombe 87 unit boulevard usa hospital anderson department division pediatrics 77030 skhatuamdandersonorg center md tx pediatric 1515 neurooncology infant eloquent newer years brain including
yHuPHS	1	IL	bitten sci ncbi vampire pubmed nar 2011 psychol function web ncbi javascript site warning requires management citation external file generate software sgabrielbuffaloedu suny psychology usa university park ny department buffalo hall 14260 passages vampires results leads human tendency group wizards belonging read propose increases outcomes twilight experiencing collective harry series
aPN39	1	IL	information recreation camping federal recreationgov tour reservation great outdoors visit americas great outdoors visit americas great outdoors visit americas great outdoors visit americas great outdoors visit americas wilderness oasis swimming beach desert alpine mountain wildlife land rocky national arsenal haven flourishing toxic piece refuge reasons states resorts mountain united forests
c9sDkb	1	IL	center tornado pds 57 watch prediction storm status report 57 watch messages information network service national warnings visit iwin weather interactive high 95 high 80 high 70 60 mod high 80 60 mod high 95 f2f5 probability forecaster 70 60 table event increased category tornadoes probabilities issuing 5 low moderate
peANoO	1	IL	living weight healthfindergov healthy learn children live quick guide connect website hyperlink nongovernmental direct application hhs consistent hyperlinks states services human subject information hyperlinked united application contained health endorsement department website intended provided visitors external constitute applications privacy appearance practices products policies purpose link redirected fatfree tired food junk breakfast
yr19xR	1	IL	modot news northeast district release central archived north news crashes tailgating inattention roadwork speed cited areas information christykerns 660 contact 3858257 marisa bridge weather close working lake approximately mark twain fork permitting march complete monday rehabilitate traffic ff 12 route 30 days rehabilitation north river salt stoutsville macon signs open
yFmPQ3	1	IL	affordable hud housing cpd american initiative dream downpayment 150000 december years states initiative home 20042008 investment 50000 provided grant fifty administered assistance jurisdictions authorized formula addi 200 program funds million participating allocation part law downpayment population fiscal appropriated 16 local signed annually 2003 american qualified act dream partnerships lowincome helped
IC5cki	1	IL	acad facto ncbi aluminum environmental potential 2007 sci pubmed ann function web ncbi javascript site warning requires management citation external file generate software nutrition school haifa center gastroenterology institute medical israel technionisrael lerneraaronclalitorgil carmel pediatric medicine technology pappaport unit stressrelated hypothesized albacterial candidate susceptible epidemiologically terminal colitis factor extensive presentation
