K5bffN	1	IL	geo2r function enable tool javascript warning learn requires compare ordered results identify table expressed samples significance conditions full genes groups instructions presented geo2r differentially order experimental applied logtransformation tab data options change box table distributions viewed plot calculate selected samples mediancentered crosscomparison number graphically data summary determining distribution suitable exported
zdWi6a	1	IL	recommends cancer testing lung protect family january radon 01172012 leading epa contact newsroom stores 21000 bonnie actions month kits centers 20 fix smith improvement easy 2011 good risk surgeon instructions warned fixes indoors january release people encourages national testing cost year home estimated 01172012contact find health closed risks colorless protection
IaopJj	1	IL	regulates sci ncbi wrn 2011 cell pubmed helicase atrchk1induced spha function web ncbi javascript site warning requires management citation external file generate software biology alle university aarhus 3 mollers dk8000 department molecular denmark shrna checkpoints results sphase human isogenic wrn stably dnadamageinduced decreases replicative chromatin activation replication increases cellular condition
gjGJ25	1	IL	fallin home mary governor budget governor state plan fallin delivers energy read oklahoma fallins governor plan click jobs people matching governor facebook fallin follow click appointment click commission board apply find sign uptodate fallin news rss center visiting governor feeds mary view office governors javascript disabled browsers link news click
HiPpYK	1	IL	states united lottery government blog won usagov asked anonymous lottery won run lotteries states individual follow winners slightly procedure powerball winnings states follow handle statebystate basis state bought run multistate lotteries megamillions ticket procedures teams rules generally state winners lottery learn state responsible comments content hope conversations polite 13 older
HPbaeU	1	IL	melanoma adults study rise young medlineplus rates pages related medlineplus adults cancer skin healthday 1 melanoma highlights young research increase sunday potentially rates fatal hit form dramatic news women april hardest fourfold incidence increased men women melanoma study young 1970 eightfold 2009 findings county clinic looked minn olmsted 18 patient
HgIzEo	1	IL	grill wires danger food cleaners medlineplus swallowed bbq page related medlineplus tuesday tracts healthday barbecue sharp grills wire bristles rhode 3 emergency digestive news made room island april residents brush caused ended chicken apparently barbecued wire beef bristles stomachs throats metallic issues brushes report grills ate medical patients clean isnt
vKPB3e	1	IL	congress library dpoe preservation digital beginner providers executive preservation offerings cost calendar find educational offering service people click access intermediate location digital public designate sort intended congress format practice managerial library date advanced training level title practical audience asked form offer preservation planning calendar training encourage add digital submissions connect
xhlTAZ	1	IL	living aortic healthfindergov healthy aneurysms live learn quick abdominal guide connect website hyperlink nongovernmental direct application hhs consistent hyperlinks states services human subject information hyperlinked united application contained health endorsement department website intended provided visitors external constitute applications privacy appearance practices products policies purpose link redirected lower aaa risk steps
wg8oMj	1	IL	efficacies ncbi poly relative osteoarthritis pubmed cartilage 2009 omega3 function web ncbi javascript site warning requires management citation external file generate software school university biosciences uk cardiff relative pufas suppressing polyunsaturated fatty efficacy osteoarthritis important assess acids proteins oa etiology levels mrna involved n3 omega3 reactions inflammatory chondrocyte chain exogenous
AF2lTq	1	IL	webbased medlineplus chronic therapy fatigue teens pages related medlineplus fitnet chronic healthday pain concentration syndrome thursday 1 treatment memory teens poor march joint fatigue found news study benefit internetbased muscle months webbased percent 63 1 debilitating online teens recovered march felt reported therapy report condition netherlands studied lancet published found
sFv7F8	1	IL	driving distracted texting state laws territory laws click specific state individual learn twelve text guam states drivers 2010 columbia enacted 38 district ban messaging laws prohibit columbia phones states 10 district driving drivers handheld cell virgin islands violation primary offense means note speeding issue driver traffic ticket law secondary taking
rtOGwl	1	IL	living healthy breastfeed live guide quick healthfindergov learn baby connect website hyperlink nongovernmental direct application hhs consistent hyperlinks states services human subject information hyperlinked united application contained health endorsement department website intended provided visitors external constitute applications privacy appearance practices products policies purpose link redirected ready foods baby eat information
uaM76o	1	IL	dysphagia ncbi postextubation associa persistent pubmed crit 2011 care function web ncbi javascript site warning requires management citation external file generate software division colorado usa 12700 university denver sciences 19th critical medicine 80045 pulmonary east avenue aurora madisonmachtucdenveredu care dysphagia postextubation outcomes illness factors survivors critical treatment unexplored development patient
wVon3z	1	IL	conversions rollovers reporting roth 2011 2010 topics retirement plans community irs resources 2010 conversions rollovers tax report return income 2011 2010 half taxable amount 8606 20a conversion distributionsif distributed ira 2010 form part report line 2011 roth amount 8606 inplan rollover retirement distributed ira 2010 form 25a part plan report
zURM3C	1	IL	apod rays 21 wyoming february anticrepuscular 2012 fascinating discover featured written image explanation day photograph astronomer cosmos universe professional february 21 2012 spherical scattered month striking sky degrees cheyenne photographed occurring clouds travels common side referred set sun supernatural pictured pours great horizon wyoming whats point scene rising unusual usa
lNHlNP	1	IL	information fraud potential provide securities involving wrongdoing violations laws information provide tip potential listed wrongdoing conduct violations include complaint referrals involving portal tips complaints fraud securities submitting laws duty nonpublic trading fiduciary trust information confidence illegal generally insider breach violations include possession misappropriate selling relationship material tipped refers buying securities
sOsBDx	1	IL	toxicol scombroid ncbi pubmed cardiovasc causing lifethre poisoning 2011 function web ncbi javascript site warning requires management citation external file generate software applied piazzale italy civili university 125100 medicine brescia department spedali experimental activity browsing empty recording activity turned recording turn back information usa 20894 center pike rockville national md
ADWN9x	1	IL	investing house energy future clean address white weekly state union video watch enhanced transparency commitment browse house white logs visitor wait executive actions president obama federal receipt tax federal dollars tax spent people petitions create sign house inside white tour interactive saving money states talks reducing united families factory pump
IJbRcd	1	IL	frb 25 fomc releasefederal press 2012 statementapril issues reserve release date 2012 25 april sector committee unemployment expanding household signs rate elevated improvement open investment market information federal housing moderately expectations labor remained declined stable crude conditions economy oil march business met inflation prices continued higher picked recent received improved
xj7vRJ	1	IL	report science nsfgov special nation aquatic facility rivers shes oklahomas species zoologist research state collected shows recently norman mussels part vaughn river university 30 freshwater southeastern caryn names home species pimpleback hold rabbitsfoot oklahoma approximately research location pistol grip vaughn good north colorful 300 mussels hand vaugn mussel america 55
rK4Qv8	1	IL	information 1940 census general skip navigation census digitally 1940 april released 2 2012 accessible facilities images personal access charge digital nara public nationwide internet free computers restriction 72year east reasons national 1201 95416 service information law privacy jeffersonville 1940 access 5 915 bureau fill public stat form processing search statutory
zDRCg5	1	IL	20120109 383000 fined air businesses release news violations quality release date01092012 1202 arb 916 3222990 contact pio karen caesar kcaesararbcagov 6265756728 control arbs mission arb attain welfare standards quality based recognizing reduction health pollutants public resources economy ecological california effects promote efforts protect effective air maintain oversees pollution 3222990 office
xy4ykE	1	IL	med sta cancer physicians ann ncbi intern pubmed understand screening 2012 function web ncbi javascript site warning requires management citation external file generate software development risk harding institute max center berlin germany human wegwarthmpibberlinmpgde planck literacy cancer detection statistics prove 2 rates screening save mortality tests increased survival early lives
wduKgC	1	IL	professionals aust prim ncbi pubmed health social australian 2012 function web ncbi javascript site warning requires management citation external file generate software university australia griffith wushergriffitheduau incorporate developed lack resistance identify questions web negotiated 20 personal 95 concerned demographic participants adoption choose usage main 935 frequencies practice 713 societies 58
zC4CqR	1	IL	credit work opportunity form 5884 irs resources claim year tax community county 5884 wages group secondyear located business form targeted paid renewal qualify qualified opportunity incurred empowerment zone employees work credit rural form 5884 08dec2011 hiring unemployed expanded tax credit veterans revisions form 5884 form items related 5884 current products
xVem5C	1	IL	lower sci cognitive ncbi minds dark bright pubmed attitudes 2012 psychol function web ncbi javascript site warning requires management citation external file generate software brock canada ontario psychology university department ghodsonbrockuca abilities proposed results interpersonal predicts research underappreciated critical largescale kingdom greater focus secondary adulthood cognitive skills conservatism antihomosexual found
wSz8Vx	1	IL	control loss bicycle handlebars imports asia break recalled hazard resulting fall euro named washington instructed canada voluntary consumers illegal commission safety cooperation health announced firm product stop dc recalled resell attempt immediately recall products today consumer product bicycle handlebars canada united 70 states 2000 units san imports sales merry bicycle
IL2qYT	1	IL	report science nsfgov special nation poster iconic antarctica topped children frozen charts long continent penguins call animal caused colony havoc sea species doom entire wreak ice swath penguinsand spell change melting climate study large emperor shrinks century 3000 sea pairs decline end show projected ice 400 breeding jenouvrier decreasewe models
K5LMCT	1	IL	dcps target ncbi biol acs spinal pubmed muscul 2008 chem therapeutic function web ncbi javascript site warning requires management citation external file generate software usa 2501 illinois decode davey woodridge 60517 chemistry road inducers produces caused probe spliced knowledge show enzyme m7gpppn quinazoline deletion rna inhibition exon cellular atrophy represents
zwrT5j	1	IL	december 2011 pma approvals development product approvals notice generated supplement pma decisions protocols basis monthly list pdp premarket number pma safety listing effectiveness added link letter approval document summary pdf originals summary supplements pma 83 2 approved 34 hold originals 3 days review 51 number greater summary 180 pma active
ACPUia	1	IL	control proliferative sci ncbi signal akt pubmed 2012 response erk function web ncbi javascript site warning requires management citation external file generate software biology ma usa medical 02115 school cell harvard boston department limited quantitated show results including p21cip1 networks kinase absence factor decreased extracellular epidermal rapamycin increased downstream induce
bT09oZ	1	IL	center watch thunderstorm prediction severe storm 138 status report 138 watch messages information network service national warnings visit iwin weather interactive 20 low 5 low 30 mod 20 low 30 mod 20 low 60 mod f2f5 probability forecaster 70 60 table event increased category tornadoes probabilities issuing 5 low moderate
yawnWF	1	IL	teapots dancing ganz burn due hazard recalls named washington instructed canada voluntary consumers illegal commission safety cooperation health announced firm product stop dc recalled resell attempt immediately recall products today consumer product teapots dancing canada united states units 2100 170 usa ganz cheektowaga ny importer llc handle burn hazard water
z14X0w	1	IL	stress taxtime tips reducing news essentials newsroom topics irs resources march 14 tax irs tip 201250 2012 give tax doesnt year ways make irs offers easier headache tips experience taxfiling preparation breeze links freefile return form time tax agreement application 4868 individual extension file online income automatic payment subscribe tips
xnua6M	1	IL	play childrens tipover due hazard theaters guidecraft recalls named washington instructed canada voluntary consumers illegal commission safety cooperation health announced firm product stop dc recalled resell attempt immediately recall products today consumer play theater 4in1 product dramatic toys canada united 1800 350 states units winthrop minn importer guidecraft mega profit
gNuCWh	1	IL	federal elections summary vote 2000 popular table presidential state summary vote 2000 candidates listed popular 122001 ballotupdated presidential popular vote total popular percent vote 50999897 4838 50456002 4787 2882955 274 448895 42 384431 36 98020 09 83714 08 20767 02 7378 01 5775 00 5602 00 4795 00 3315 00
GFQAik	1	IL	acute cont ncbi amoxicillin randomized pubmed jama rhinosinusitis 2012 function web ncbi javascript site warning requires management citation external file generate software washington general 63110 ave euclid campus usa sciences medicine division university jgarbuttdomwustledu 8005 660 box school louis mo st medical acute antibiotic limited support commonly evidence antibiotics treatment
xnnkYL	1	IL	med ncbi pubmed palliat 2012 care blogging landscape palliative function web ncbi javascript site warning requires management citation external file generate software marymount university hospice cork medicine ireland department hospital palliative ethical confidentiality grade communication glioblastoma iv raises terms issues relationship media organisation physicianpatient pontine 30yearold clinical health interest medium
yPi6VE	1	IL	releases press health listing department public discharging debris comprises swimmers storm jonathan drains mph chemicals areas md individuals officer small fielding outing enjoy rivers bacteria fortunately health contaminate advise trash beach public possibility stay director water ill surfers portion creeks advisory discharging rainfall rivers 26 depending storm beach pm extended
wC9T3J	1	IL	investing house energy future clean address white weekly state union video watch enhanced transparency commitment browse house white logs visitor wait executive actions president obama federal receipt tax federal dollars tax spent people petitions create sign house inside white tour interactive saving money states talks reducing united families factory pump
nqc9	1	IL	web attack measures site preventative prevent financial year reduce number cyber past improving thwart quickly techniques detect respond intruders compromise spike incidents firm ability online actions services likelihood considerable organizations attacks industry specific steps retail similar order activities perform general attackers compromise networks prevent methods impact current intruders access attack
xKlgLW	1	IL	comparison risk ncbi mobile epidemio phone pubmed bmj 2012 glioma function web ncbi javascript site warning requires management citation external file generate software 208527238 md usa cancer institute rockville national radiation epidemiology branch marklittlenihgov glioma cancer observed human carcinogen united classification basis agency research iarcs international compatibility recent risk forming
qGhdV1	1	IL	bulbs light energy recycle star recycle home cfls products recycling wwwearth911org identify directly mercury consumers agency cfls epagovbulbrecycling waste local recommends municipal advantage solid amount contact small options epa cfl stores recycling back bring home working major disposal returns cfls depot unbroken manufacturers free desk ikea expand retailers options epa
if1jua	1	IL	information house freedom act white state union video watch enhanced transparency commitment browse house white logs visitor wait executive actions president obama federal receipt tax federal dollars tax spent people petitions create sign house inside white tour interactive homeowners refinancing house twitter responsible answers hours brian office questions white deese
xu70ty	1	IL	information financial corps grant citizen resources communities uniting preparing nation locate login contact council moved page httpcitizencorpsgovresourcesgrantsshtm andor links update questions bookmarks citizencorpsdhsgov email links plugin require plugins page view readygov corps notices disasterhelpgovcitizen plugins home fear register privacy federal faqs femagov citizen widgets act policy dhsgov data foia bulletins
w7Rdup	1	IL	living kids alcohol tobacco healthfindergov drugs healthy live learn quick guide connect website hyperlink nongovernmental direct application hhs consistent hyperlinks states services human subject information hyperlinked united application contained health endorsement department website intended provided visitors external constitute applications privacy appearance practices products policies purpose link redirected set give number
Ad5PR7	1	IL	noaa history dedicated agency brought institutional 1871 history noaa states weather include 1870 orders oldest americas information united laws sciences federal section government stewardship specifically conservation bureau precision heritage histories cultures newly physical resources accuracy predecessor life executive scientific formed commercial agencies coast fisheries formation included pertinent individually science 1807
IhKiEu	1	IL	factors lifespan medlineplus race location social affect pages related medlineplus chances tuesday healthday socioeconomic news education geography living group factors income indicators shows 70 17 age work april race study reside findings markers longheld long live medicine calif belief school stanford university challenge race country region researchers expectancy people 665
GMY7is	1	IL	adjustable fire due hazard mattress platt bases recalled leggett named washington instructed voluntary consumers illegal commission safety cooperation announced firm product stop dc recalled resell attempt immediately products today recall consumer product adjustable power bases mattresses foundations units 25200 georgetown platt ky leggett manufacturer control short components fire overheating hazard
c9sDk9	1	IL	center tornado pds 57 watch prediction storm status report 57 watch messages information network service national warnings visit iwin weather interactive high 95 high 80 high 70 60 mod high 80 60 mod high 95 f2f5 probability forecaster 70 60 table event increased category tornadoes probabilities issuing 5 low moderate
ioulj5	1	IL	memorial state sos offices close day secretary 2011 17 observance office seal saturday memorial offer 28 day state closed ruth branch monday hours reminds great johnson 30 supercenters offices residents secretary mails give licenses renewed drivers 45 penalty state closed notices plates holiday ample motorists department expire weekend day license
yknmZT	1	IL	retrograde program exploration mars archive page constellations find compared west sky note stars mars east move eastern time viewing appears planet night farther 2003 retrograde animation mars move mind back years puzzling west strange mars forward east mystical direction couple stop early meaning change skywatchers months planet continue behavior night
HYZqbw	1	IL	migraine guidelines medlineplus doesnt works pages related medlineplus prevent dont healthday sufferers headaches debilitating medications 23 migraine dozens monday news study april finds silberstein people developed guidelines society neurology approximately migraines coauthor percent 40 treatment stephen headache academy dr onethird american preventive silberstein thomas overthecounter depends philadelphia jefferson herbal include
taTNtd	1	IL	working house year address white weekly state union video watch enhanced transparency commitment browse house white logs visitor wait executive actions president obama federal receipt tax federal dollars tax spent people petitions create sign house inside white tour interactive tough people move year past tells create grow economy jobs president
c3ULEl	1	IL	center watch thunderstorm prediction severe 125 storm status report messages watch 125 information network service national warnings visit iwin weather interactive 20 low 5 low 20 low 20 low 40 mod 30 mod high 70 f2f5 probability forecaster 70 60 table event increased category tornadoes probabilities issuing 5 low moderate
br50aE	1	IL	26 center watch thunderstorm prediction severe storm status report 26 watch messages information network service national warnings visit iwin weather interactive 20 low 5 low 30 mod 30 mod 30 mod 20 low high 70 f2f5 probability forecaster 70 60 table event increased category tornadoes probabilities issuing 5 low moderate
zJ8qzW	1	IL	poor pain neighborhoods people study medlineplus finds pages related medlineplus adults lowincome chronic healthday pain thursday research live 8 march communities news neighborhoods age 50 experience affluent finds whites chronic lived blacks disability experienced pain michigan university researchers adults disability lived depression mood disorders recent issue painrelated pain journal men
IRNeJL	1	IL	grant grantsgov opportunities synopsis opportunity find precedence service disk electronic click information grant provide notification send inconsistency document email resolved notifications printed address opportunity emails change receive thing giving original requestedany modification description represent newest file oldest previous shown documents current document sections files background representing modifications arranged changed list
A5yc2M	1	IL	ncbi nature fam rev parenting pubmed child clin nurturing 2011 psychol function web ncbi javascript site warning requires management citation external file generate software box usa psychology wa university washington 98195 351525 department seattle proposed temperament reviewed fear adjustment children susceptible differently include increases effects gender operates individual irritability developmental
A3vOk9	1	IL	mission solstice prometheus cassini images home image details image collision ring 86 moon white drapes outermost prometheus kilometers shaping center bulge 53 miles learn small perturbs soft encke kinky discontinuous image visible ringlets ring rings ringplane 1 stars degree southern gap background ringlet unilluminated learn view side left acquired image
asKEBn	1	IL	starspangled congress library american treasures memory banner 1814 division starspangled sheet purchase carr musicenlarged 1941 thomas 17791843the scott printed key music francis banner baltimore 291 key states scott signed anthem resolutions introduced 1814 finally law spangled banner forty wellknown national proclaiming star congress song anacreon 1931 united words drinking francis
yzZjHX	1	IL	current uscert activity highimpact web current incidents regularly updated reported types summary uscert activity security page frequent multiple apple released updates safari address vulnerabilities products security os code crosssite obtain information perform vulnerabilities privileges elevated attack attacker condition execute denialofservice exploitation sensitive arbitrary operate scripting articles mitigate users ht5281 encourages
AAZrIE	1	IL	current uscert activity highimpact web current incidents regularly updated reported types summary uscert activity security page frequent multiple apple released updates safari address vulnerabilities products security os code crosssite obtain information perform vulnerabilities privileges elevated attack attacker condition execute denialofservice exploitation sensitive arbitrary operate scripting articles mitigate users ht5281 encourages
