zzorv3	1	IL	congress inauguration american library reason treasures jacksons division february 836 1829 emendationsmanuscript inauguration arrangements 2 printed letter holograph en played significant point legislation national advisors states permitting questions tumultuous administrations 1833 jackson system federal people character inaugural masse role party nullification spoils andrew fore cabinet nullify jacksons attended bank kitchen
qtxfWP	1	IL	ncbi prognosis longterm chest pubmed idiopathic pulmonary 2011 function web ncbi javascript site warning requires management citation external file generate software va usa stevennathaninovaorg hospital 22042 disease falls program lung inova church fairfax advanced transplant accurate years rediscovery mild prognosis statements impact bronchoscopy interstitial application fvc treatment 5 mortality demographics
Hg4CdE	1	IL	video deafness medlineplus health news diabetes javascript adobe flash enabled content player version 8 requires flash pages related medlineplus heres heard complications lot diabetes heart hearing americans kidney 26 opens door risk million problems complication blindness diabetes loss developing disease including control adults extra wasnt hearing worse poorly compared tend
mdnG0s	1	IL	battery household program collection chain food humans metals batteries mercury end lead illegal disposed environment causing potentially landfills toxic health waste universal household nickel cadmium california negative risks throw trash animals longer rule common affect battery household locations library partnered batteries proper educate effort dispose utilize encourage program los containers
1IMsDV	1	IL	gulf national seashore islands pickens fort search owl named wizard major general including begun navy cherokees built 1834 forts defend pensacola battles fought largest pickens war carolina led siege completed andrew campaigns ninetysix yard fort revolutionary 1829 cowpens called florida bay militia distinction honor south aided confederates civil artillery lincolns
zTtXbT	1	IL	affordable updated provisions estimates cbo coverage act insurance care contact cbo 13 march 2012 committee budgetary estimates cbo 111152 projections comprises patient education insurance staff jct reconciliation baseline legislation health public pl 2012 affordable updated march provisions taxation joint protection effects coverage law care aca 111148 budget 2010 act preparing
Atee8w	1	IL	house white state union video watch enhanced transparency commitment browse house white logs visitor wait executive actions president obama federal receipt tax federal dollars tax spent people petitions create sign house inside white tour interactive event live facebook discussion participate click member facebook give click questions comments httpwwwwhitehousegovvideo ondemand library
yyjHFH	1	IL	states patent united 8094301 andor wall primary surface intensity fiber video filters images sensors captured information monitoring realtime producing system end color rgb camera digital interior receiving gmcy method combustor disposed optic outputs emitted bundle collected pixels bayer imaging ratios gasifier mosaic layout signal thermal refractory individual processed light output
HHaM5R	1	IL	financial proclamation national month capability house white presidential 2012 state union video watch enhanced transparency commitment browse house white logs visitor wait executive actions president obama federal receipt tax federal dollars tax spent people petitions create sign house inside white tour interactive house white office press secretary states united financial
AhYX3u	1	IL	risk ncbi int suppl dietary cholesterol clin 2009 pubmed pract function web ncbi javascript site warning requires management citation external file generate software nutrition peterjonesumanitobaca centre university mb functional foods winnipeg manitoba richardson canada nutraceuticals saturated show accurate years relation homeostasis cardiovascular overexaggerated complex increased fat fats varies association school
xRknAZ	1	IL	rev multiple ncbi sclerosis disease biol immune pubmed 2011 function web ncbi javascript site warning requires management citation external file generate software city acorthalsjjaycunyedu criminal usa jay justice university sciences 10019 college york department john catabolize feedback brain underlying homeostasis 1 ratio nervous explain lipids aspects increased propose acutephase pathophysiology
AlHUki	1	IL	congress personal archiving preservation kit library digital day personal archiving back process developed share planning information phases knowledge personal digital events resources weve organized kit host day care archiving find focus event based personal program choose digital youll resources archiving list reference efforts planning download personal written program digital document
HDTp3l	1	IL	financial proclamation national month capability house white presidential 2012 state union video watch enhanced transparency commitment browse house white logs visitor wait executive actions president obama federal receipt tax federal dollars tax spent people petitions create sign house inside white tour interactive house white office press secretary states united financial
9IoAGX	1	IL	hughes poets edsitement voice langston presented share issued culture centennial unveiled langston research service stamp 1 commemorative black february schomburg commemorate birth hughess postal hughes center 2002 vote corner langston service stamp commemorating 1 issuing adoption poet decisive public website poets academy february birthday postal lefthand hughes favorite pictured 2002
zZ2Moo	1	IL	week observatory solar pick dynamics sdo suns magnetic years rotating bright plasma 2010 2012 forces gyrating ultraviolet competing cooler highresolution view back anniversary particles hours active extreme 30 streams detailed 2nd frames feb shifted ago fourminute solar sdo 11 kind strands region launched darker slid mind surface make field cadence
IdrR0	1	IL	congress joint white session health house remarks president care state union video watch enhanced transparency commitment browse house white logs visitor wait executive actions president obama federal receipt tax federal dollars tax spent people petitions create sign house inside white tour interactive homeowners refinancing house twitter responsible answers hours brian
mQM3s6	1	IL	med stress ncbi echocardiography 2003 pubmed perspective historical function web ncbi javascript site warning requires management citation external file generate software picanoifccnrit consiglio institute ricerche pisa clinical nazionale italy delle physiology dose 99m impact technique technetium radiological 4 fatal risk choice effects cardiological procedures level echocardiography popular biological higher cost
w8VXGH	1	IL	cut recovery tax payroll economic helps house fuel white state union video watch enhanced transparency commitment browse house white logs visitor wait executive actions president obama federal receipt tax federal dollars tax spent people petitions create sign house inside white tour interactive deputy december national tax brian economic businesses council
yyLBUz	1	IL	fiber neuropathy text nutritional sulfate clinicaltrialsgov full agmatine small view supplementation performing testing agmatine autonomic questionnaire monitored sulfate improvement note peripheral function fiber pain nonblinded started arginine effects additionally response end beginning caseonly neuropathic metabolite neuropathy study months patients small evaluates noted investigators biopsy skin jfk med ctr patients clinic
adcvZg	1	IL	living healthfindergov healthy learn children live health quick oral guide connect website hyperlink nongovernmental direct application hhs consistent hyperlinks states services human subject information hyperlinked united application contained health endorsement department website intended provided visitors external constitute applications privacy appearance practices products policies purpose link redirected information usaccessibility privacy mapcontact
vkyHvf	1	IL	united schedule house proclamation white modify purposes trade states tariff harmonized presidential state union video watch enhanced transparency commitment browse house white logs visitor wait executive actions president obama federal receipt tax federal dollars tax spent people petitions create sign house inside white tour interactive house white office press secretary
ppGSK8	1	IL	wildlife lower national refuge klamath managed grassy habitat resting broodrearing pacific flyway open birds feeding varied intensively provide mix croplands uplands 50092acre shallow water productive nesting marshes refuge biologically waterfowl refuges represent 45 produces spring pass 80 total birds populations percent migrations approximately klamath basin 30000 wintering million reach 60000
yZEBfl	1	IL	astp photo nasa id title ast01042 image pacific ocean patterns text oblique cloud view ast01053 text image orbit spacecraft soyuz american apollo soviet american ast01056 text image orbit spacecraft soyuz apollo soviet ast02093 text image blacksky spacecraft soyuz background contrasted soviet ast02096 text image blacksky spacecraft soyuz background contrasted soviet
eUsoqT	1	IL	civil eve american edsitement war presented civil series states bring statistical click statistics factors war maps tabs united student summarize bottom eve american animated interactive share partnered thinkfinity lesson find educational save resources plans free edsitement plans updates lesson resources humanities project edsitement endowment national provided verizon thinkfinityorg edsitement support
yaEf9H	1	IL	house ncaa forces white joining state union video watch enhanced transparency commitment browse house white logs visitor wait executive actions president obama federal receipt tax federal dollars tax spent people petitions create sign house inside white tour interactive adobe player flash content download view domain 06 january 100 public 2012
HS8Any	1	IL	office disability odep labor policy department employment states department united labor concept adults inclusion community employment people approach integrated full option significant services communitybased disabilities youth workplace facilitate people delivery primary system states reflecting employment funding support selected state odep encourage program helps struggled approach integrated resources systems regulations leadership
uLpnlE	1	IL	med power pubmed ncbi nucl optical 2011 harnessing radionuclides function web ncbi javascript site warning requires management citation external file generate software radiology usa stanford university program california imaging department biox molecular 94305 limited phenomenon years discovered research availability decay maturation emitting easier advances preclinical capability bridging significantly foreseeable past
pgyrCP	1	IL	free urban government admission july lexington kentucky county mondays pools news city lexingtonfayette division free parks july recreation admission lexington thursday mondays pools announced aquatic street constitution paris hill 1670 douglass georgetown 209 park center drive buckhorn berry pools castlewood road aquatic august monday free apply july 25 center 18
HILtkF	1	IL	1999 overpasses shelters oklahomakansas tornado 3 violent fallout outbreak highway golf shield cdt radar 25 20 tx black location struck 937 worth interstate eastward underneath supercell wsr88d reflectivities large stopped red night hail intensity lancaster falling numerous highway shows bridges overlaid path actual april south reds image size area reflectivity
HotUYe	1	IL	resources stopbullyinggov addressing set inclusion problem related topic included imply entering facts find verified stopbullyinggov federal promotion nonfederal program inventory articles tips guarantee resources criteria listed endorsement search includes bullying nominated helpful evidencebased training resource toolkits keyword directories materials directory meet accuracy add inventory nominations resources find resources website managed
c8c6T7	1	IL	uscis study civics materials test questions pass tools answer prepare materials correctly 6 interview 10 started test 100 study list civics naturalization asked additional section products select short naturalization process overview video test providing highlighting citizenship rights responsibilities civics video history audio format official list answers civics mp3 questions test
nRPQYT	1	IL	king promises spending prioritize introduces act reached debtlimit 2011 july 13 wednesday conference king todays viewing video press bachmann featuring gohmert promises secure investors obligations michele washington reaches steve prioritizes reliability protects hosted kings rtx 2496 rmn event ria conference nations funding personnel legislation cosponsors stability interruption announce public today
xNRIHZ	1	IL	ncbi initial pacing strategy appl physiol phase pubmed 2010 eur function web ncbi javascript site warning requires management citation external file generate software 11 sport 75012 france institute national tremblay research paris du expertise insep performance department laboratory biomechanics avenue physiology christophehausswirthinsepfr kilometre crucial results involved speed 95 improvement uptake
AoJIY1	1	IL	announcement space 1972 shuttle president nixons president san administrator fletcher richard space program 5 shuttle final announced headnote california approval received clemente james 1972 nasa editorial january nixon accessible states decided endeavor 90s united proceed space system 1980s territory type today development transportation familiar human designed easily frontier transform 1970s
ynPZ4O	1	IL	apod january lighthouse meteor 8 2012 fascinating discover featured written image explanation day photograph astronomer cosmos universe professional january 8 2012 produces years bright hercules cold captured northern sky 4 easy east skygazers coast early dim january radiant muralis identified morning view maurice obsolete rivers constellation event planet quadrantid boundaries
xswEFh	1	IL	affairs public home links point hyperlinks find site constitute services welfare linked web provided army west purpose stated sites contained authorized endorsement department consistent exercise activities information locations control external exchanges morale recreation appearance products editorial military disclaimer web aspects technical site comments master questions reporting site broken link address
9FUemW	1	IL	center 33 watch thunderstorm prediction severe storm 33 status report watch messages information network service national warnings visit iwin weather interactive 20 low 5 low 30 mod 30 mod 30 mod low high 70 f2f5 probability forecaster 70 60 table event increased category tornadoes probabilities issuing 5 low moderate events
cq28nl	1	IL	center watch thunderstorm prediction 76 severe storm status 76 report watch messages information network service national warnings visit iwin weather interactive 10 low 5 low 30 mod 10 low 50 mod 10 low 60 mod f2f5 probability forecaster 70 60 table event increased category tornadoes probabilities issuing 5 low moderate
xEmCnE	1	IL	ncbi dermatologic dermatol pubmed adverse economic burden arch events 2011 function web ncbi javascript site warning requires management citation external file generate software northwestern school usa chicago university medicine feinberg illinois dermatology clinic series department impact dts financial dermatologic targeted treating diagnosing patients anticancer report develop receiving toxicities therapies prospective
zimlL4	1	IL	geneeskd ncbi cancer ned tijdschr pubmed exosomes 2011 function web ncbi javascript site warning requires management citation external file generate software netherlands medisch afd neurochirurgie centrum erasmus rotterdam origin neoplastic characterisation preclinical brain agents tumours tumour based immune vaccination transfer system stimulation mediate safety antitumour demonstrated rna released tumourderived exosomes
4Mdmdf	1	IL	congress library machine imagination american treasures jeffersons pasta division thomas text jeffersonmaccaroni 1787manuscript machine holograph pasta making drawing instructions thomas touring 1787 strips dough years noodles spaghetti italy fashionable paris durable france machine jefferson macaroni plans stationed food prepared william made commissioned minister pasta highly purchase short northern rolled noted
yzjptu	1	IL	pract ncbi 7630 eps holist geranium part african nurs pubmed pro 2012 function web ncbi javascript site warning requires management citation external file generate software 19102 drexel nursing usa professions pa philadelphia st smr49drexeledu race health college 505 university activity browsing empty recording activity turned recording turn back information usa
w3vFX9	1	IL	pyramid usda food fnicnalusdagov myplate resources nutrition usda policy promotion center mypyramid guidelines primary myplate easytounderstand americans group consumers cue build 2011 consistent plate eating food symbol june encouraging visual governments healthy adopt 2010 habits replaced dietary society education nutrition incorporate educators guidelines myplate dietary americans education find content online
9OZtR7	1	IL	retirement benefits birth year retire month 62 retirement percent start fraction full early benefits age time reduced retire find 62 examples year estimated click retirement based amounts benefit reduction full chart lists includes birth age monthly 1000 reduced figure 1st birthday year previous january note benefit smaller give retire period
hqXvgM	1	IL	pubmed omar ncbi lansari function web ncbi javascript site warning requires management citation external file generate software sirt1 regulates hypothalamic food intake system rodent model nj cakir ea ca lansari messier nillni vaslet perello 2009 dec 15412e8322 plos citations related hormone prosequence secretory role prothyrotropinreleasing pathway ha cakir ea ca
y8RTU0	1	IL	united army bulge states battle german december tested tide manner dday battle quality onset ultimately cut winter army favor 1944 france late forces hitlers fortitude war victory meant tyranny intended successful soldier counteroffensive courage wake invasion world response great 16 bulge historically turn american allied adversity normandy freedom ensued launched
pSgOvd	1	IL	interventions behavior internet model change med nov bc res 6 bock al stoddard jl whiteley internet 2008 graham ja epub 105e39 med 2008 res internet cm stevens vh vj cd 25 res samuelhodge tp jan 101e1 epub internet pj champagne med brantley jf funk bauck kl hollis erlinger 2008 myers
HdaGD5	1	IL	ncbi int follicular pubmed therapy maintenance rituximab prescrire 2012 function web ncbi javascript site warning requires management citation external file generate software protocol firstline noteworthy lack results dose mabthera including questions suffer impact adding lymphoma based disorders progressionfree iii confirmed radiological musculoskeletal treatment 401 persist mortality survival practice therapy effects
yZxhRq	1	IL	teen summer wilderness academic national park offers program adventure enrichment yosemite search summer inspire golden mission actions founded nurturing consists nevada partners based personal residential 28 state offers sierra 2012 monica recreation organizations online runs world adventurous association school bar skills michael serves annually 501c3 40000 bilodeau including klean olympic
zkr8wE	1	IL	impact ncbi physician educ social pubmed media techn 2011 assist function web ncbi javascript site warning requires management citation external file generate software physician arizona usa assistant university midwestern program glendale aessarmidwesternedu generation faculty suggestions clear education native scenarios wisely personal media conduct administration boundaries digital violations norm procedures dismissal
u4qV0q	1	IL	comparison ncbi chudoku dev immunoassay pubmed screening kenkyu 2011 function web ncbi javascript site warning requires management citation external file generate software school sciences university forensic graduate medicine biomedical department hiroshima depas urine highperformance kits victim japan fastect intensive detected screening monitect3 benzodiazepines 2 chromatographymass accusign methods 700 detection experienced
3Wg4dC	1	IL	national park yosemite search square wilderness national 1200 deep high valleys human giant strength area parks find shrine glaciers grand granite persistence life power tranquility park sierrayosemite vast states sequoias united meadows foresight miles waterfalls ancient activities question yosemite choose answer difficult common dont reservations require campgrounds early popular fill
zS1pJa	1	IL	med humanitys ncbi pubmed calcium supplement assoc thai doubleedged 2011 function web ncbi javascript site warning requires management citation external file generate software orthopaedic university bangkok todrnarongyahoocom department thailand surgery mahidol contained coupled house cd sample amount chelated pollutions salts mercury preparation based lead animal oyster coral technique carbonate naturalraw
y2mB7J	1	IL	prevent stress healthy manage problems live healthfindergov health learn quick living guide connect website hyperlink nongovernmental direct application hhs consistent hyperlinks states services human subject information hyperlinked united application contained health endorsement department website intended provided visitors external constitute applications privacy appearance practices products policies purpose link redirected control feel
y7mqmw	1	IL	apod march 14 sun angry erupting 2012 fascinating discover featured written image explanation day photograph astronomer cosmos universe professional march 14 2012 suns years earth captured current giant system field baddest plumes plasma magnetic puffs colorful dark cool twisted tendril inverted ejections shown sun particles chromosphere bird pictured emitted sunspot
zX48Ks	1	IL	directed congressionally medical peer reviewed release program press research 2012 foster fy12 wellbeing directions prmrp science reviewed challenges communities beneficiaries defense year tools cdmrp office service army congressionally translational ideas research program health basic department clinical areas veterans leading 2012 development directed product administered scientific million diagnostic trials members address
vfYP46	1	IL	people tax taxes helps save 2011 guide news essentials newsroom topics irs resources dec 2011 21 ir2011123 features links tax college questions publication earned federal workers range opportunities quickly parents details income low taxsaving 5000 advantage wide students answers child opportunity 303page 17 moderateincome taking expanded taxpayers credit american guide
aK5GzU	1	IL	archived prisoners time 150 constant simple hardworking vary years past held bright learning voiced rarely make elsefrom surprise public students dropout time student prisoner trouble america runs schools rule american learn typical timebound people year sixhour expect learnings educate impossible 180 believing students learn mentality selfdeception counterparts warden half schools
Rlw1	1	IL	abstract statistical 2012 comprehensive united authoritative abstract political summary states statistics economic statistical published organization 1878 social reference abstract sources statistical information convenient print web volume guide organizations census federal agencies analysis labor sources economic statistics bureau private include data abstract agencies private sources data organizations census federal bureau guide
HZZR9b	1	IL	function cognitive striatal ncbi pubmed controlling human neurosci 2012 function web ncbi javascript site warning requires management citation external file generate software fmrib functional radboud brain nijmegen 9du nuffield united psychology ox1 ox3 clinical department kingdom neurosciences centre neuroimaging behaviour 3ud hb oxford netherlands donders cognitive institute cognition university 6500
ybU30W	1	IL	opensource projects image linux single images size pcs desktop environment bigview panning multiscreen multiple cooperate running additionally software zooming work large arbitrary view interactive control code manage environments set distributed functionality basic resources framework observe user services observation applications view software engineering java larc application opensource innovation development field started
wuRdKC	1	IL	praises senate 1 equality historic marriage constantine vote feb praises senate historic marriage constantine vote equality king senates legislation executive washington establishing county state praised marriage constantine vote equality enact dow today legislature people washington state historic vote senate defense decade stood fight socalled today ago righted wrong marriage act
wWHk8d	1	IL	apod death 22 sailing february stone valley 2012 fascinating discover featured written image explanation day photograph astronomer cosmos universe professional february 22 2012 stones drying caused ended winds earth death surreal explain texture big seemingly sailing 300kilogram turns solution viable large rock heavy temporarily exists terrain dried rocks odd slick
