9eNSDK	1	IL	photographs congress library environmental american memory 18911936 congressameritech national library collections competition digital view classroom collection connection teachers resources chicago university library disturbances produced consists group highlights regarded character botanists photographs views nation early communities resource aridity alterations 18691939 chicago continent ecologies dune shifting 1936 fuller beginning comparison complexes influential
zpudkg	1	IL	bmc applying ncbi cancer pubmed paternalism libertarian strategies 2011 function web ncbi javascript site warning requires management citation external file generate software division 20892 usa genetics bethesda cancer epidemiology institute national md environmental branch occupational dcwheelsgmailcom significantly cancer antigen lack results indolent states randomized controversial facts incontinence united publication remains
buzMrh	1	IL	center tornado watch prediction storm 87 status report messages watch 87 information network service national warnings visit iwin weather interactive high 70 50 mod high 80 50 mod high 80 high 80 high 95 f2f5 probability forecaster 70 60 table event increased category tornadoes probabilities issuing 5 low moderate events
GSqFXP	1	IL	loss weight lead study medlineplus finds parents pages related medlineplus shed weight healthday children 22 thursday research parents march excess losing news pounds suggests included parentchild 80 participants program treatment 8 obese overweight part 12yearold study months sets parentonly childhood weight encouraging taught home weightloss style leading familybased environment program
130rZ5	1	IL	island national seashore assateague search enjoy coastal move rest existence continent sandy recreated visit forests day live bays life recreate relax time assateague maritime explore marshes waves beaches island salt ocean edge place adapted wind enjoy make thrive horses beauty assateague extraordinary distance island continue wild enjoy barrier ages visitors
rG2ZEA	1	IL	living healthfindergov healthy quitting live learn quick smoking guide connect website hyperlink nongovernmental direct application hhs consistent hyperlinks states services human subject information hyperlinked united application contained health endorsement department website intended provided visitors external constitute applications privacy appearance practices products policies purpose link redirected quit steps follow information usaccessibility
GQDTW7	1	IL	caring childs mental health childs mental mission sites overarching childrens caring system effort support samhsas increase approach health comprehensive public awareness marketing social samhsafunded purpose services strategic care 1994 created communications team strategies works stimulate information childrens national visit event wwwawarenesseventorg health today rsvp day awareness mental dont washington wwwsamhsagovchildrenliveeventasp
ykl2ko	1	IL	reporting marketers fair mobile warns credit apps ftc act violate fair purposes trade federal employment marketers provide housing apps commission ftc screening violating reporting applications reason background comply mobile warned reports act credit similar locate letters people app everify police apps criminal checks intelligator infopay records background pages received search
AjhC9p	1	IL	hodgk ncbi leuk survivors pubmed lymphoma employment insurance 2012 function web ncbi javascript site warning requires management citation external file generate software danafarber ma cancer usa institute boston gender inability face obtaining head years hair medical including changing questionnaire total employment insurance late compared scarring due survivors 2 health 4
76re7C	1	IL	center tornado watch prediction 1 storm 1 status report watch messages information network service national warnings visit iwin weather interactive 30 mod 20 low 30 mod 10 low low low 60 mod f2f5 probability forecaster 70 60 table event increased category tornadoes probabilities issuing 5 low moderate events awareness listed
dz2YDe	1	IL	center tornado watch prediction 72 storm status report messages watch 72 information network service national warnings visit iwin weather interactive 40 mod 20 low 30 mod 30 mod low low high 70 f2f5 probability forecaster 70 60 table event increased category tornadoes probabilities issuing 5 low moderate events awareness listed
whp640	1	IL	kids concussion medlineplus symptoms year study pages related medlineplus healthday news suffer children concussion difficulties 5 memory march monday attention problems continued study months finds display brain mild year concussions 500000 children hospital injuries note treatment teens injury traumatic needing common childhood researchers dont researcher owen results brain mild injuries
tyZQ2w	1	IL	web student aid enrolling college apply federal returning period student school youre time aid 150 colleges community grants apply workstudy universities education fouryear federal source largest department students attending student schools america loans discuss types billion career page aid providing financial overview impact requirements federal 1 2012 governing student july
GBTkQq	1	IL	conference communities house safe watch lgbt live schools white state union video watch enhanced transparency commitment browse house white logs visitor wait executive actions president obama federal receipt tax federal dollars tax spent people petitions create sign house inside white tour interactive leaders people house community transgender partner education justice
wcWziZ	1	IL	emphysema ncbi med su volume reduction pubmed lung south advanced 2012 function web ncbi javascript site warning requires management citation external file generate software division usa university allergy al medicine critical birmingham department pulmonary alabama care obstructive emerging results surgical bronchoscopic 24 death symptoms include mortality risk survival therapy summarized
b7K1p7	1	IL	iss radio ham reference radio ham constant mission astronauts radio ham space station international amateur companion specialists fly nations cosmonauts distress text astronauts radio earth experimentation 1983 families long program communication dozens sarex amateur emergency school russian television thousands preparation pioneered including voice similar cosmonauts duration station russians space flight
zhrVYv	1	IL	asthma ncbi ann allergy enterocolitis 2004 pubmed immunol riceinduced function web ncbi javascript site warning requires management citation external file generate software division immunology center usa university allergy missouri st 63110 sciences health saint louis department pediatrics unusual food allergy common cultures rice children western case intolerance 11monthold tcellmediated report
xWDt4V	1	IL	uscis study materials english test sentences tools speak application writing write materials correctly test reading speaking ability form eligibility interview started uscis prepare read n400 portion determined officer components english naturalization study additional section products select short naturalization process overview video test providing requirements citizenship process eligibility naturalization presentation practice
ce1e53	1	IL	pet information owners fema home find pets survive return evacuate chance remote leave information united additional states society contact humane top back top back top back top back 21apr2011 modified thursday 083107 edt links nongovernment social applications web fema provided reference media companies sites endorse msgdata washington street apply management
zyFo6r	1	IL	stream jet cassini mission wave solstice jupiter rattling spies features releases stream rattling spies jet jupiter cassini home news wave jet stream cassini wave jupiter rattling spies 13 mar 2012 jet stream cassini wave jupiter rattling spies jupiters direct jupiter planets earths atmosphere lead author comparing lot papers type simonmiller
zuHReJ	1	IL	failure civil packs lithiumion penalty 425000 hewlettpackard report immediately agrees battery civil agreed washington cpsc palo settlement commission pay penalty 425000 safety hewlettpackard calif hp today product company dc agreement accepted provisionally alto 31 announced pdf consumer computers battery allegations defect cpsc posing settlement staff provided law overheat consumers failed
zqx6KG	1	IL	methods ncbi biol pubmed buildagenome mol 2012 function web ncbi javascript site warning requires management citation external file generate software md biology center usa hopkins university johns school high throughput medicine baltimore meetings experiments synthetic access guidance intensive interested yeast undergraduates unique projects skills troubleshoot university 24h laboratory project cell
A2NWaw	1	IL	sci ncbi rights inpatients med psychiatric law pubmed 2012 function web ncbi javascript site warning requires management citation external file generate software alicelomaxhotmailcom mental university sw19 st health uk 2ry london trust hospital springfield georges agreed london disorders informal highlights admission improvement 542 treatment 813 local awareness versus dk practice
GEiWb5	1	IL	solstice hyperion distant mission cassini images home image details constant orientation reference 324000 270 shape 90 angle 521000 rate movie system approximately degrees tumbles sunhyperionspacecraft devised blasting watch standard zone 168 encountering kilometers phase spin obtained distance latitudelongitude irregular cosmic orbit moon miles learn hyperion view features image surface visible
watr7f	1	IL	sec form accurate reviewed information necessarily commission reader complete exchange completethe securities assume determined filing 1 identity issuers information business contact 2 place principal persons 3 related clarification response clarification response clarification response clarification response clarification response clarification response clarification response industry group 4 size 5 issuer federal select 6
zTcV1m	1	IL	med phys ncbi 2011 coaching pubmed rehabil behavior physia change function web ncbi javascript site warning requires management citation external file generate software school ma usa boston medical 02114 rehabilitation harvard spaulding hospital emerging coach including physiatrists selfmotivation patientcentered asthma coaching amelioration survival practice loss skills wellness realistic benefit activity
lHC4Ci	1	IL	obligations tax sbagov state learn local requirement links obligations money include requirements knowledge locality addition pay avoid access state local resources common provide business government tax learn problems key types save required taxes federal small laws tax permit required tax sales states businesses apply agency state customers business owners permits
rPMmjy	1	IL	transit sunearth venus day 2012 wearing beads sunearth figure students 1 solar day equinox spring comprised year wrap occur highlighting research connection series approach events scientists science sunearth day celebration thematic missions programs culminating fresh solar registration transits populated system theme resources 2012 website activities march upcoming background world day
qxqDBn	1	IL	national guidelines withdrawn clearinghouse guideline updated guidelines list identifies updated ngc guideline individual summaries web guidelines list site withdrawn ngc identifies represent inclusion guidelines site summaries developer web ngc guideline criteria developers refer withdrawn removed longer information meet ngc 2311 individual withdrawn guideline summaries questions house ahrq site usagov human
xbtN23	1	IL	river restoration baraboo resources current topics licenses permits regulations statewide trapping fishing hunting kids website educators nature encourage learning fun children educators fire landowners health forest managementtopics activities lands activitiestopics parks outdoor management property managing spills air environmental cleanup protectiontopics waste quality redevelopment water resourcestopics drinking watershed fisheries wide agency
xtzWut	1	IL	resource nida families 17 navigate national nih health helps institutes january release addiction 2012 news options treatment links related bookmark share developed national hard choosing questions institutes information nidas service program health treatment online struggling nida families drugpubs seeking free abuse part copy addiction resource institute drug public individuals researchbased
yxstp9	1	IL	house white state union video watch enhanced transparency commitment browse house white logs visitor wait executive actions president obama federal receipt tax federal dollars tax spent people petitions create sign house inside white tour interactive event live facebook discussion participate click member facebook give click questions comments httpwwwwhitehousegovvideo ondemand library
wu3zMc	1	IL	michelle house platypus walk lady white obama state union video watch enhanced transparency commitment browse house white logs visitor wait executive actions president obama federal receipt tax federal dollars tax spent people petitions create sign house inside white tour interactive adobe player flash content download view 11 february domain 125
tO4ZsR	1	IL	living healthfindergov healthy live adult shots learn quick guide booster connect website hyperlink nongovernmental direct application hhs consistent hyperlinks states services human subject information hyperlinked united application contained health endorsement department website intended provided visitors external constitute applications privacy appearance practices products policies purpose link redirected information usaccessibility privacy mapcontact
38wVeM	1	IL	founding congress library religion american republic exhibition sections exhibition introduction constituents supported inconsistent religious statesmen 1776 rose exhibition fervor founders vigor freedom practice nation shared republican governments equality alexis public settlers people national eighteenth intensity officials result demonstrates religion state degree men extent tocquevilles revolutionary faith great central revival citizens
AfH3MG	1	IL	batteries smoke alarms weekend change year washington alerting cpsc batteries buildup saving monoxide consumers commission families deadly sunday safety 11 product march homes fire dc lives carbon replace weekend begins jobs daylight smoke time alarms fresh consumer urging yearly deaths 386300 estimates cpsc fires residential average resulting 2400 2006 2008
HC3MYT	1	IL	administrator superfund hempstead city federal congresswoman regional sites long mccarthy joined tour officials island 04022012 mayors garden epa contact newsroom information office rodriguezeliasepagov rodriguez cell 04022012contact date elias release 2126373664 7326725520 releases news issue email website releases 1998 selected 1970 history historical press epa view united agency states environmental protection
HAjg0w	1	IL	mission hazy solstice cassini orange orb images home image details atmosphere titan visible pole cassini images hood blue bottom suggest top faint haze layers detected moons orange recent image polar north hazes beginning titans flip vortex learn south view north 5150 titan kilometers 3200 antisaturn miles side view color image
n3QQVg	1	IL	sec form accurate reviewed information necessarily commission reader complete exchange completethe securities assume determined filing 1 identity issuers information business contact 2 place principal persons 3 related clarification response clarification response clarification response clarification response clarification response industry group 4 size 5 issuer federal select 6 claimed apply exclusions exemptions
p4mjAX	1	IL	memorial center car national compliance expansion jefferson 2015 document search return preservation environmental historic car2015 information center car compliance 2015 document correspondence section 106 nhpa nepa documents reference design competition design activities community comment public opportunities minutes meeting gathering century national nineteeth helped click memorial courthouse west fuel life learn
zzcEKl	1	IL	corps announcing creation blog fema discrmination age isnt 1824 set adults enter due mentioned apply odd develop 21 young long program wwwamericorpsgovnccc leader team offers americorpsnccc part workforcethat skills 18 age opportinuty nccc limit learn sector government workforce private expansion develop skills workers job cares join citizens corpssee httpwwwcitizencorpsgov tax
9lcG6i	1	IL	survey site satisfaction questionnaire feedback web service read improve customer short completing additional submit email healthfindernhicorg comments questions respond displays 200 suggestions hhs including reviewing aspect ave estimated comments information reducing 23 agency valid conduct public independence omb washington reporting dc collection number control burden estimate response instructions clearance 20201
dtdfFC	1	IL	center tornado watch 50 prediction storm status report messages watch 50 information network service national warnings visit iwin weather interactive 60 mod 40 mod 60 mod 40 mod 40 mod 30 mod high 90 f2f5 probability forecaster 70 60 table event increased category tornadoes probabilities issuing 5 low moderate events
t27iXv	1	IL	accord ncbi diag adhd consult pubmed diagnosed clin 2012 psychol function web ncbi javascript site warning requires management citation external file generate software missionsstrasse psychology katrinbruchmuellerunibasch university basel 6064 psychiatry clinical department switzerland concept hypothesized statistical heuristic 691 ratio exclusion disorders treatment diseases males manual disorder questions ed representativeness result
wmjk7w	1	IL	apod telescope january 31 nebula vista helix 2012 fascinating discover featured written image explanation day photograph astronomer cosmos universe professional january 31 2012 planetary bearer fluoresce infrared colors 25 outer ngc helix expelled sunlike observatorys gasses closeup day designation visible telescope 700 examples constellation space sun nebula shows core dwarf
dXwYU9	1	IL	prepare neighbors unexpected disaster set pass information inevitable ordinary events preparation complete educating plan key modeling day great lifethreatening project turn steps ensure social date follow networks mlkdaycnsgov include serve additional opportunities official national accessibility community usagov fear privacy federal corporation notices website government site foia service register contact act
HEPZNE	1	IL	ago longer 50 labor medlineplus years women page related medlineplus years news spending labor today march friday hours report childbirth women ago 30 50 american healthday longer factors explain labors reports helped authors laughon weight national kennedy height human aspects news conference index shriver bodymass epidemiologist responsible increase health development
rAtlFb	1	IL	requirements reporting faqs payment card news essentials newsroom topics irs resources revenue settlement special network service irs entities internal 1099k begin thirdparty form transactions reporting payment card transitional required relief banks providing notice 201188 201189 faqs special information requirements network details 2011 2012 scheduled begin thirdparty transactions reporting occurred early
FQUiIa	1	IL	med ncbi communication physicia discrepancies intern pubmed arch 2010 function web ncbi javascript site warning requires management citation external file generate software 06708 school douglasolsonyaleedu usa university robbins primary st waterbury program 64 residency yale medicine ct care perspectives communication lack assess effectively gaps result determine sought quality surveys knowledge
AxCaPv	1	IL	carson national rachel wildlife refuge composed aquatic editorinchief series fish rachel service biologist author environmentalist carson coast atlantic marine articles wildlife worldrenowned namesake tenure served refuges tide born sea 1907 beach maine creatures captivated carson 1955 coast early 1952 beginning southport mystery pennsylvania age studied edge ms island pools summered
xKXj8N	1	IL	current uscert activity highimpact web current incidents regularly updated reported types summary uscert activity security page frequent multiple apple released updates safari address vulnerabilities products security os code crosssite obtain information perform vulnerabilities privileges elevated attack attacker condition execute denialofservice exploitation sensitive arbitrary operate scripting articles mitigate users ht5281 encourages
HpLuVu	1	IL	stones medlineplus water calcium linked kidney pages related medlineplus amy norton stones reuters confirms kidney risk health include increased diet water york women older study developing calcium salt declined stones sodium kidney 78000 risk fluid 70s hand women intake firsttime developing odds climbed calcium found higher 50s researchers stones diluted
wkRlYO	1	IL	control icscert uscert systems control industrial security emergency collaboration system cyber focus icscert uscert systems team response control security efforts coordination management securing strategy systems risk successful component icscert key outlines realized effective longterm serves common vision learn monthly monitor archive icscert advisories archive reports resources reporting control cssp infrastructure
91aOmp	1	IL	center tornado watch prediction 74 storm status report 74 watch messages information network service national warnings visit iwin weather interactive 40 mod 20 low 30 mod 30 mod 40 mod low high 70 f2f5 probability forecaster 70 60 table event increased category tornadoes probabilities issuing 5 low moderate events awareness
A49tEP	1	IL	asthma triggers agency environmental protection molds content area jump main navigation contact asthma plant animal present fungi matter live microscopic moisture found molds outdoor indoor indoors spores mold create tiny continually molds begin float produce plants land places air reproduce seeds growing damp asthma people inhaling sensitive attack trigger spores
uhI9eJ	1	IL	management emergency principles community themes library action approach fema pathways resiliency understanding principles community strategic themes preparedness individual determine greater management collaborative provide presents integrate increasing approach resources foundation intended emergency nation framework pathways members promote security engaging document daily practices action enhance guide download plugin links plugin require plugins
JDOkF	1	IL	park canyon bryce national search limestone force series hoodoos canyon horseshoeshaped carved worldly consists rainwater slot colorful eastern plateau claron power geology canyons shaped spires paunsaugunt fins formation erosional unique bizarre dissolving bryce famous windows frostwedging shapes edge rock amphitheaters including called year event astronomy 20 festival skies offer annular
xuzDOi	1	IL	physician subacute management ncbi stroke pubmed fam 2011 ischemic function web ncbi javascript site warning requires management citation external file generate software usa cincinnati christ family 45215 hospitaluniversity residency medicine magnetic including carotid andor death contraindications weeks include mortality physicians risk permissive warranted therapy 24 artery outcomes continued secondary modifications
bKCzpO	1	IL	web student aid colleges financial community grants repaid click universities requirements additional variety federal review program details grant offer students attending schools loans unlike career fouryear page quick aid eligibility financial grants apply based application federal submit read listed fafsasm eligibility free student factors aid page program undergraduate certificate pell
Ar03dX	1	IL	country alerts specific adoption notices intercountry adoption learn process prospective adoptive parents guide statistics requirements process countrys adoption learn eligibility countries alerts specific important notices find developments 2000 act citizenship child code family point days leads parents childs including complete apply decisions time required increase judges issue end travel 1
zt3igs	1	IL	biol good vampires ncbi hum make testing humans ann pubmed 2012 function web ncbi javascript site warning requires management citation external file generate software theory belgium university legal research brain moral department ghent unit history phobia human aggressiveness fundamentally basis research indicating real responses iconic behaviour effects biological concentrated representation
Hlar44	1	IL	kids lack medlineplus outdoor parents time pages related medlineplus pittman genevra dont results reuters health parent preschoolers york half day recent spend survey time playing half 9000 walk close interviews day parents moms park reported child kids yard taking playing quarter dads outdoor washington sense playtime seattle dr make parents
zseBKf	1	IL	surg ncbi efficacy plateletrich joint pubmed autologous bone pl 2012 function web ncbi javascript site warning requires management citation external file generate software canada evidencebased ontario center division ushethqmedca university orthopaedic hamilton mcmaster surgery orthopaedics orthopaedic benefit determine pain injuries review plateletrich debate clinical treatment softtissue extensive plasma function led
