yRQiwq	3	SC	ri sci ncbi ann lab ldl levels low cholesterol clin pubmed serum 2007 function web ncbi javascript site warning requires management citation external file generate software school tel center medical holon sackler israel aviv medicine internal edith department wolfson university ldl 18157 cardiovascular 24 group morbidity mortality associations increased therapy
4dwBHm	3	SC	picture astronomy day fascinating discover featured written image explanation day photograph astronomer cosmos universe professional 11 2012 bright distant earth disk 20 fit easy weeks apogee photographed perigee dark day telescope pacific dense sun asia moon smallest full 300 annular 240 kilometers path super silhouetted filter point image visible smaller
vnrjr0	3	SC	great paterson national park falls historical search industrial played national site revolution nations parkhome industries power service role 7 largest interior 2011 jarvis economy ken building spectacular park waterfalls designated falls director key november shaping jon great harnessed americas american salazar 397th secretary twitter sign follow paterson events great falls
b2UtUJ	3	SC	picture astronomy day fascinating discover featured written image explanation day photograph astronomer cosmos universe professional 11 2012 bright distant earth disk 20 fit easy weeks apogee photographed perigee dark day telescope pacific dense sun asia moon smallest full 300 annular 240 kilometers path super silhouetted filter point image visible smaller
9uAtiT	3	SC	5 history march today perpetrated 29th boston bloody street paul 1770 5th party photographs division march regt massacre massachusetts king engraver 1770prints revere control bostonians shot slinging crowd house sentries guarding soldiers orders fired group 1770 surrounded late 5 boston contrary struck jeering hardpacked march mortally customs injuring civilians number
aGrvo1	3	SC	metab ncbi int nutr chocolate exerc pubmed 2006 postexerci sport milk function web ncbi javascript site warning requires management citation external file generate software applied usa laboratory university bloomington 47405 dept kinesiology health human science performance indiana rating endurancetrained results cyclists milk tte isovolumic 4 bout greater workout bouts fluid
xw0F5v	3	SC	living kids alcohol tobacco healthfindergov drugs healthy live learn quick guide connect website hyperlink nongovernmental direct application hhs consistent hyperlinks states services human subject information hyperlinked united application contained health endorsement department website intended provided visitors external constitute applications privacy appearance practices products policies purpose link redirected alcohol tobacco drugs
zb0i4q	3	SC	apod march flying 5 night earth 2012 fascinating discover featured written image explanation day photograph astronomer cosmos universe professional 5 march 2012 atmosphere earth captured spectacles rousing sunlit orange wave dark half progresses clouds brightness lightning approaching set sequence seas frame video dawn blue space purple lights haze international occurs
qO22	4	SC	return tax free preparation volunteers topics individuals irs resources programs assistance irs tax qualify elderly taxpayers offer free income counseling tce vita volunteer neighborhood people credit filing tax locations elderly disabled located irscertified malls return vita electronic centers special 50000 taxpayers provide convenient make generally sites libraries returns program income
xBhvtQ	4	SC	catalog pia15115 page limited supply mission martian rovers rover winter mobility portait mars shows approached power nasas solar dust opportunity reduces cleans exploration panels accumulation wind mission martian images rovers 24 2011 21 camera opportunitys pancam panoramic mounted sols mosaic 2814th omits days downwardlooking 2811th mast dec view wavelengths 601
JJgjA	4	SC	congress nominate national preservation registry films library film board mandating consulting inclusion december national suggestions preservation select experts reviewing plan library alternates established pl110336 end implementation 44 extensively 1988 passage film heritage films save public announced board reauthorization extended recently congress 25 continuing authorizes registry members librarian law 2008 sound
wzKdqg	5	SC	beauty study medlineplus veggies fruits tools pages related medlineplus healthylooking healthday eating simple vegetables thursday complexion rosy 8 march key news fruits researchers researcher fluctuation period whitehead psychology lead scotland vegetable skincolor ross fruit andrews sixweek school consumption university st found judged appearance period skin end attractive improve added eat
xOPZAf	5	SC	birthplace theodore national site roosevelt historic pets search pony house held 1902 police photo white mounted roosevelt algonquin officer quentin children badger eli evans beloved captivated bear dr yale small house hard onelegged roosevelt kermit mirror peter barn blue guinea pets admiral ogrady spreckle baron algonquin bob owl named childrens
mNYfwY	5	SC	heart living healthy live healthfindergov health learn quick guide connect website hyperlink nongovernmental direct application hhs consistent hyperlinks states services human subject information hyperlinked united application contained health endorsement department website intended provided visitors external constitute applications privacy appearance practices products policies purpose link redirected information usaccessibility privacy mapcontact act
xXJccI	5	SC	volcanic natural island hazards sea red december zubair pulse 60 violent rising yemeni sea navy activity helicopter captured video northern 23 began sulfor 40 located edge details eruptions dioxide white 2011 red satellite shallow forming eruption coast middecember reported imagery kilometers satellites revealed explosions recent saba showed island highresolution submarine
d0iKKk	5	SC	corps monthly themes preparedness citizen 2011 events communities uniting preparing nation locate login contact council moved page httpcitizencorpsgovnewseventsthemes2012themesshtm andor links update questions bookmarks citizencorpsdhsgov email readygov corps notices disasterhelpgovcitizen plugins home fear register privacy federal faqs femagov citizen widgets act policy dhsgov data foia bulletins annual reports servegov contact bannersaccessibility
zCaLwp	6	SC	apod scale march 12 universe interactive 2012 fascinating discover featured written image explanation day photograph astronomer cosmos universe professional 12 march flash player version recent adobe 2012 bring human galaxy flash proportion window spread discovering humanity descriptive familiar stop speckled possibly items smoothness vast bar sizes large small version ten
yInBWz	6	SC	youth preparedness corps citizen communities uniting preparing nation locate login contact council moved page httpcitizencorpsgovgetstartedyouthyouthindexshtm andor links update questions bookmarks citizencorpsdhsgov email links plugin require plugins page view readygov corps notices disasterhelpgovcitizen plugins home fear register privacy federal faqs femagov citizen widgets act policy dhsgov data foia bulletins annual reports
b2uIyI	6	SC	house white state union video watch enhanced transparency commitment browse house white logs visitor wait executive actions president obama federal receipt tax federal dollars tax spent people petitions create sign house inside white tour interactive event live facebook discussion participate click member facebook give click questions comments httpwwwwhitehousegovvideo ondemand library
HFTEus	8	SC	house white april photo day 2012 state union video watch enhanced transparency commitment browse house white logs visitor wait executive actions president obama federal receipt tax federal dollars tax spent people petitions create sign house inside white tour interactive house check april offices photo 2012 picks white day official house
UT2FE	13	SC	house white state union video watch enhanced transparency commitment browse house white logs visitor wait executive actions president obama federal receipt tax federal dollars tax spent people petitions create sign house inside white tour interactive event live facebook discussion participate click member facebook give click questions comments httpwwwwhitehousegovvideo ondemand library
xXGIJ9	13	SC	february media social day awareness 2012 impair stress ageappropriate capacity mental developmental youths reach ptsd challenges health disorder posttraumatic goals providers dealing wwwsamhsagovchildren children friends visit trauma resilient hope families heroes youth learn juvenile mental prevalence years challenges suffer greater stress1234567 justice generally system noting health rates document numerous higher
r8k9E	14	SC	mountains great park smoky national search remnants appalachian national life straddles culture tennessee diversity border mountain renowned ancient ridge quality forest animal southern carolina mountains plant north beauty park world great smoky americas visited warblers whitetailed chances deer park yellow spotting improve elk wildlife bears black learn feel mill stars
xl8O0c	18	SC	grant grantsgov opportunities synopsis opportunity find precedence service disk electronic click information grant provide notification send inconsistency document email resolved notifications printed address opportunity emails change receive thing giving original requestedany modification description represent newest file oldest previous shown documents current document sections files background representing modifications arranged changed list
jSNUzQ	24	SC	hsf realtime space human flight data control uptotheminute mission spacecraft path data make sky project applet reside significantly 336 download skywatch cache approximately access internet files 144 downloading 300 sufficient downloaded data 10 hard minutes clear required drive connection nasa time modem kbps updated official responsible amiko curator notices nasa
yoI36l	43	SC	repair chairs due hazard high fall recalls ikea named washington instructed canada voluntary consumers illegal commission safety cooperation health announced firm product stop dc recalled resell attempt immediately recall products today consumer product antilop chairs high 36000 169000 133000 units canada north conshohocken llc importer pa services ikea america unexpectedly
yUzuQt	47	SC	march house photo white day 2012 state union video watch enhanced transparency commitment browse house white logs visitor wait executive actions president obama federal receipt tax federal dollars tax spent people petitions create sign house inside white tour interactive house 2012 check offices photo march picks white day 30 force
zGqov8	51	SC	lawn crash hydrogear due hazard hydrostatic tractors recalled named washington instructed voluntary consumers illegal commission safety cooperation announced firm product stop dc recalled resell attempt immediately products today recall consumer tractors lawn product units 2700 limited sullivan hydrogear partnership ill manufacturer lawn crash gear consumers transaxle drive hazard hydrostatic tractors
