zv0rRC	1	SC	heartburn reflux damage medlineplus chronic teeth acid pages related medlineplus reveals heartburn chronic healthday esophagus acid gerd damage thursday research 8 march mouth news condition severely reflux disease worried teeth gastroesophageal influx people sharp ultimately lead pitted suffered erosion thin worse wear half condition healthy study months disease tooth patients
eqLIBh	1	SC	spirituals edsitement presented share spirituals chariot traditions ended spirituals religious impact style finally role combination background famous 19thcentury listening railroad signal slavery collect investigate martin harriet woven spiritual culture factors deeply review interviewing contributed religion conditions bestknown christian power fugitive jr explore members luther introduces turn american swing family conclude
yRFYd5	1	SC	frb 13 statementmarch fomc releasefederal press 2012 issues reserve release date 13 march 2012 sector committee unemployment expanding household longerterm rate elevated open investment market information federal housing moderately expectations labor remained declined stable crude conditions economy oil increased business notably met inflation prices continued recent received subdued improved depressed
HILtkF	1	SC	1999 overpasses shelters oklahomakansas tornado 3 violent fallout outbreak highway golf shield cdt radar 25 20 tx black location struck 937 worth interstate eastward underneath supercell wsr88d reflectivities large stopped red night hail intensity lancaster falling numerous highway shows bridges overlaid path actual april south reds image size area reflectivity
xXgYrB	1	SC	volcanic natural activity hazards sea red volcanic sea december january ceased group area plume detected zubair sulfur grow 2011 red formed dioxide early satellites continued appears 19 island 23 stopped 15th activity small naturalcolor image 60 enhanced entire 40 landsat7 2012 mapper coast kilometers group thematic february yemen 15 island
aUQUhz	1	SC	preserve national park bay ecological historic historical river salt search uniquely national settlements human documents colonial caribbean european preserve clash park indigenous ecological central earliest day present natural world powers bay historical river salt features grottoes caverns deep canyon world geologic submarine ledges caves entrance diversity water foot unique wide
zYSmt8	1	SC	ncbi gliadin scand pubmed 2006 gut permeability zonulin gastroenterol function web ncbi javascript site warning requires management citation external file generate software division biology mucosal md center nutrition gastroenterology university school usa research celiac pediatric medicine maryland 21201 baltimore gliadin epithelial zonulin investigated barrier mechanisms effect crosses signaling interaction cells
b7NOzd	1	SC	full pain syndrome study manage clinicaltrialsgov deep stimulation brain thalamic safety text view deep determine dbs modulate syndrome striatal vcvs ventral disability stimulation brian investigation safety treatment pain efficacy component tested affective hypothesis purpose improve capsularventral central study thalamic patients tps related protocol years leads brain attempts dbs generator ventral
tJVICl	1	SC	international station hsf space 7 expedition previous dark earth side sights bright earth sky window weeks couple watch dark indoors side glare hard past home sun moon lights adapt dominate turning turn adjusted doesnt takes brighter distinct slowly stars compartment eyes inside minutes close docking incredible interior portholes light nighttime
rNdzbL	1	SC	information mrx polarization radar dual upgraded national hail radar weather dual total tn accurate service snow capabilities polarization morristown storm include rainfall rain interrogation kmrx improved delineation pol severe diagnostics estimation nws process warning dual dualpol additional tools forecast polarization add suite technology assist data 14 products forecasters upgrade radar
jFsjIf	1	SC	living healthfindergov healthy quitting live learn quick smoking guide connect website hyperlink nongovernmental direct application hhs consistent hyperlinks states services human subject information hyperlinked united application contained health endorsement department website intended provided visitors external constitute applications privacy appearance practices products policies purpose link redirected information usaccessibility privacy mapcontact act
bmDR9y	1	SC	ten ways dad connected stay secure respecting respected respect children strong provide things support father environment feel vital parents important accepted married marriage mother feel neglected tells busy missed things father opportunities quickly treasuring means important grow forever kids sacrificing lost spends children essential matter time spend young talking children
cizAvn	1	SC	center tornado watch prediction 35 storm status report watch messages 35 information network service national warnings visit iwin weather interactive 60 mod 50 mod high 95 40 mod 40 mod 10 low high 95 f2f5 probability forecaster 70 60 table event increased category tornadoes probabilities issuing 5 low moderate events
yat87u	1	SC	spring avoid sneezing medlineplus stuffiness page related medlineplus pollen spring allergy healthday news open saturday letting contribute march drift wrong 10 windows flareups air filter experts spring experts allergy college suffer allergies sneezing due sniffling itchy eyes million asthma immunology acaai 35 american stuffiness americans people simple spring allergy enjoyable
Jmouvy	1	SC	chemical mission factory solstice investigates cassini titans features factory chemical investigates cassini home news titans chemical titans investigates factory cassini apr 24 2012 chemical titans investigates factory cassini hydrocarbons atmosphere titan environments celsius hides thick factory giant saturns brutally temperature smoggy system moon chemical complex degrees scientists 170 cloak form
yEA7q8	1	SC	apod march spiral warped 4 eso 510 13 galaxy 2012 fascinating discover featured written image explanation day photograph astronomer cosmos universe professional march 4 2012 digitally billions years shape warped disk galaxy warps spiral spirals stars galaxys flat explanation gas warp early orbiting loose sharpened diffuse clouds conglomerations solid disks
AvoDcr	1	SC	week blog united government national participate qa live protection usagov consumer states week est march session 2pm national question host protection 6 answer consumer tuesday complaint trade experts usagov questions commission provide government consumerrelated answer resources file scams company answers hand chance federal learn latest questions twitter experts chat est
xtK54N	1	SC	owners cope pet medlineplus hearts change pages related medlineplus seaman andrew people reuters chronic living pet health animal shows diseases companion york owners study healthier tickers heart feathery people variability japanese rate monitoring pet furry scientists higher 200 hearts found scaly didnt respond heart requirements disease rate linked stressful dying
GntTe	1	SC	william craig fugate fema administrator management emergency federal agency senate craig fugate experience fema confirmed management wealth federal agency appointed barack administrator emergency serve reported leadership community president bringing obama 13 18 2009 agency managed 745 efforts preparedness fugate 138 fdem fema staff 67 management recovery mitigation role coordinated governments
nNCxR5	1	SC	fee cost implementation 32 regulation ab reviewed april 2 page 2012 2011 october 20 april 2 2012 posted comment notice 17 modified availability april text pdf public 15kdeadline 2012 1133 pdf resolution 197kb 31 2011 august posted notice 410k hearing pdf public 429k reasons initial isor statement report pdf staff
yeMZZu	1	SC	climate utilities water ready epa content area jump main navigation contact water climate sector sea impacts contribute challenges weather stormwater quality availability temperature complex health potentially public rise pose utilities water environmental sustainability shifting significant drinking precipitation change extreme climate missions scenario level fulfilling implications events patterns resulting runoff wastewater
A7a1BM	1	SC	march house photo white day 2012 state union video watch enhanced transparency commitment browse house white logs visitor wait executive actions president obama federal receipt tax federal dollars tax spent people petitions create sign house inside white tour interactive house 2012 check offices photo march picks white day 30 force
9kWBiq	1	SC	center tornado watch prediction 65 storm status report messages watch 65 information network service national warnings visit iwin weather interactive 40 mod 20 low 30 mod 30 mod 40 mod 30 mod high 70 f2f5 probability forecaster 70 60 table event increased category tornadoes probabilities issuing 5 low moderate events
A1MDU3	1	SC	coral virgin reef monument islands national search reefs lands system mile belt federal support complex virgin 3 health mangrove john survival contribute shoreline forests waters monument includes reef ecosystems island coral segrass st beds diverse submerged islands life habitat crustaceans fish worms marine grow homes form mollusks create corals colonies
HOoK1C	1	SC	stress make medlineplus sick pages related medlineplus people healthday cold dampens trigger explain system immune 2 inflammation monday involving news stress study april common contribute high redness wound system research immune inflammation body heal levels contradictory stress longterm creates suggests heart autoimmune asthma disorders immune system inflammation conditions body lead
zPZpYl	1	SC	apod 21 january days sun 2012 fascinating discover featured written image explanation day photograph astronomer cosmos universe professional january 21 2012 summer caused month bright paper radio spells 21st northern chosen sky suns 2011 sunny dark records made years day entire university hemispheres weather fixed view telescope trails gaps sun
zGjYkl	1	SC	uncertainty resilience disaster age forging library fema crisis 2030 action strategic response highlighting strategic foresight initiative 20102011 report progress insights download plugin links plugin require plugins page view pdf adobe acrobat links nongovernment social applications web fema provided reference media companies sites endorse msgdata washington street apply management prepare federal
hHJOXn	1	SC	champions house white change state union video watch enhanced transparency commitment browse house white logs visitor wait executive actions president obama federal receipt tax federal dollars tax spent people petitions create sign house inside white tour interactive mscaption textindent9000px 308px msdetail top top0px height norepeat 9999 349px positionabsolute left495px zindex
wKsMK6	1	SC	loss study hearing americans medlineplus untreated millions pages related medlineplus hearing americans healthday news aged 27 feb million 15 lost older wednesday finds benefit aid study 50 major dont people hearing aids insurance aging inevitable covered concern part lives loss training integrating receive daily theyre researchers process johns inconsequential professor
bZXHGL	1	SC	38 center tornado watch prediction storm status report 38 watch messages information network service national warnings visit iwin weather interactive 50 mod 20 low high 90 30 mod 30 mod 10 low high 90 f2f5 probability forecaster 70 60 table event increased category tornadoes probabilities issuing 5 low moderate events
HDIs5a	1	SC	house white april photo day 2012 state union video watch enhanced transparency commitment browse house white logs visitor wait executive actions president obama federal receipt tax federal dollars tax spent people petitions create sign house inside white tour interactive house check april offices photo 2012 picks white day official house
qcR6vD	1	SC	flexibility esea department education learning educators focus outcomes improving flexibility gaps sea rigorous close education quality leaders specific educational nclb requirements voluntary provide agency state achievement equity department increasing local plans exchange students comprehensive act agencies designed student child schools opportunity behalf improve inviting instruction request 2001 statedeveloped increase order
wMHEQw	1	SC	spinal stenosis encyclopedia medical medlineplus cord spinal neural column pressure foramina leave narrowing nerves stenosis openings called drier swelling ages spinal bones start due inflammation stenosis shrink swell arthritis larger grow spine disks longterm ligaments occurs person time caused spinal stenosis body worse symptoms slowly time side symptoms include people
zXwPcz	2	SC	iris substances list az epa jump main content system information iris integrated risk iris search contact additions epa recent relevant find number browsers click alphabetical beginning chemical listed alphabetically substances chemicals service letter iris search substance list casrn command abstracts order registry office information documents develop additional decision program health
yvnob8	2	SC	medical medlineplus encyclopedia acupressure image nausea washington general medical chen david transplant yibin hospital program department division updated school director medicine zieve massachusetts marrow reviewed iii md university leukemiabone dugdale adam mha professor learn foundation process principles services rigorous quality wwwuracorg information accreditation verify subscribes accredited accountability member program health
dMge7x	2	SC	fda domperidone warns increase paper drug unapproved production milk talk women june 2004 7 breastfeeding letters supply issued warning drug unapproved milk domperidone administration increase food production safety firms today product compound response women fda concerns compounding reports products lactation pharmacies agency attempts field personnel admission alerts issuing import lookout
xuYeIi	2	SC	infections medlineplus antibiotics sinus pages related medlineplus frederik joelving routinely dont tuesday fight reuters health prescribe antibiotics purpose doctors sinus infections researchers york increasingly drugresistant experts bacteria grown evolution medications overuse worried fuel caused bacteria worthless antibiotics concern case virus doctors sinus infections disease study back inactive ease american symptoms
AAcZBD	2	SC	report preview details operations prospective obligations obtain years including principal entitys policy provisions dependent rise effects pertinent conditions default continue reasonable satisfy financial year concern factors giving discontinuance recorded current recoverability deficiencies evaluation disclose ability parent initially flow remittances offset sheet relating debt obtained prior disclosure raised relevant classification period
yyzL3Z	2	SC	march media social day awareness 2012 people bisexual streets homeless runaway victimization percent young heterosexual 334 transgender versus 587 gay lgbtq questioning report lesbian youth providers dealing wwwsamhsagovchildren children friends visit trauma resilient hope families heroes youth learn danger bisexual streets high homeless home streets1 victimization people young rates transgender
awFBvd	2	SC	blue parkway ridge search vistas mountains appalachian meanders protecting special blue slow ridge opportunities enjoying revealing longrange diversity relaxing views closeup makes pastoral parkway highlands animals unlike 469 region drive experience plants stunning miles country providing landscapes paced summer handson mountain offer developed guided programs life demonstrations traditional cultural campfire
HgIzEo	2	SC	grill wires danger food cleaners medlineplus swallowed bbq page related medlineplus tuesday tracts healthday barbecue sharp grills wire bristles rhode 3 emergency digestive news made room island april residents brush caused ended chicken apparently barbecued wire beef bristles stomachs throats metallic issues brushes report grills ate medical patients clean isnt
e40nOS	2	SC	10 business sbagov steps follow starting financial links series manage planning decisions prepare legal click easy activities business plan key 10 completing steps learn making starting involves successfully tools create start written resources map run business plan guide business expanding financing free plan services counseling relocating training advantage securing preparing
150pf	2	SC	homosexual ncbi 1996 homophobia pubmed ar abnorm psychol function web ncbi javascript site warning requires management citation external file generate software georgia psychology usa university athens 306023013 department assigned aggression monitored penile buss 29 exclusively increases affect videotapes erection admitted individuals unaware exposed erotic individual sexually nonhomophobic questionnaire denies index
xuDesQ	2	SC	pap medlineplus health video news proof javascript adobe flash enabled content player version 8 requires flash pages related medlineplus checkup lifesaving appointment skip routine missing women cancer providers valuable check pap cervix womans screened health helps test recent decades screening familiar early cervical women die study disease turn found care
wnQalX	2	SC	prime kingdom united official visit david minister house cameron white state union video watch enhanced transparency commitment browse house white logs visitor wait executive actions president obama federal receipt tax federal dollars tax spent people petitions create sign house inside white tour interactive prime samantha british david minister house cameron
i8lAE	2	SC	glacier national park search lodges awaits wilderness trails solitude 700 discover national relive glacier forests glaciers paradise pristine native meadows mountains transportation spectacular seeking park lakes visitors explore historic adventurous alpine rugged hikers days experience miles stories americans chalets summer direction links pointed vacation planning quick summer visit year begin
sp7tV	2	SC	trees moon roosa earth service 1971 personal late program astronaut containers forest return trees joint part module world apollo roosas 14 january tree nations project seedlings small jumper mitchell launched shepard surface states walked trip packed united moon orbited lunar nasausfs command tribute afternoon hundreds alan kit planted 1976 31
hAl5rh	2	SC	gluten ncbi sensitivity markers celiac biol psychiatry pubmed 2010 dis function web ncbi javascript site warning requires management citation external file generate software school pediatrics usa hopkins johns sheppard research 21204 medicine pratt program fdickersonsheppardprattorg department stanley maryland baltimore increased sensitivity reported schizophrenia inconsistent association gluten immune studies 151 chain
zhMOL4	2	SC	presidents make healthiest council year 2012 set presidents past council year activity incorporating physical start reminder achieve 2012 nutrition good ability healthiest reflect goals making great 12 lifestyle level healthy age months realistic commit work weight people presidents set council years resolutions fit percent approximately reality report attainable change january
wGldb6	2	SC	apod australia aurora february 1 red 2012 fascinating discover featured written image explanation day photograph astronomer cosmos universe professional 1 february 2012 atmosphere including magellanic earth disk galaxy ground sky showered weeks excited australia familiar aurora emanating oxygen large pictured night small distant back video highlighting particles state 1402 red
xqVL4H	2	SC	medical medlineplus encyclopedia acupressure image nausea washington general medical chen david transplant yibin hospital program department division updated school director medicine zieve massachusetts marrow reviewed iii md university leukemiabone dugdale adam mha professor learn foundation process principles services rigorous quality wwwuracorg information accreditation verify subscribes accredited accountability member program health
xEaLTz	2	SC	catalog pia15025 page clark testing scene hardware jet serves laboratory tools situ movements rover participant turret propulsion system arm instrument vstb vehicle test calif pasadena 2012 closest mars rovers precision nasas curiosity robotic end evaluations commands response gerald jpls february missions double inside positioning bed called nasa science shows software
bREk8i	2	SC	government house executive contracting white order economy state union video watch enhanced transparency commitment browse house white logs visitor wait executive actions president obama federal receipt tax federal dollars tax spent people petitions create sign house inside white tour interactive homeowners refinancing house twitter responsible answers hours brian office questions
FRXJey	2	SC	behaviors life lengthen hearthealthy medlineplus pages related medlineplus behaviors adults 45000 people healthday follow saturday cardiovascular recommended health march included news 17 die study heart aha adults active follow total cardiovascular normal recommended health include glucose eating diet pressure levels blood smoking physically association healthy american behavior cholesterol found researchers
xjpIJF	2	SC	report science nsfgov special nation dont similarity recorded chimp 987 kill species wage dna brian percent case chimpanzees war hare share killing humans important chimpanzee captivity bonobos notes violence common wild anthropologist bonobo duke evolutionary hare nsf woods wartorn lola apes endangered support young ya bush republic parents bonobos national
wIU7Eb	2	SC	fatty ncbi polyunsaturate nutr pubmed br acidspecific mixed 2010 n6 function web ncbi javascript site warning requires management citation external file generate software nih md usa neurosciences biochemistry section nutritional biophysics bethesda membrane laboratory niaaa chrisramsdennihgov 093 ci statistical specifically ratio 22 95 4 extensive n3n6 increased combination confounding intake
q8oag	2	SC	crossing borders dhs information updates email official nexus states including entering id children united travel approved card passport document merchant business present airports citizens kiosks air orders military mariner 1 june 2009 beginning top back secure travelers states including entering children present united travel air passport document information resident continue
xuIjOO	2	SC	catalog page pia15256 named queen year constellations infrared states visible featured images galaxy ancient northern greek section night sky ethiopia explorer degree united cepheus cassiopeia nasas expanse mosaic king enormous wise 1000square widefield survey milky mythology obscurity infrared bright human millions story eye takes unaided sky stars fade cassiopeia wise
6MDKYT	3	SC	assembly watch general video indiana skip navigation ingov displayed disabled message note 1 2 css information read policies standardscompliant browser resolution constitute video result council ic legislative provided profit adopted assembly intended permission commercial meaning part intent purpose coverage general enacted tangible 2511 person benefit act audio expression history support
yZ04yM	3	SC	february house photo white day 2012 state union video watch enhanced transparency commitment browse house white logs visitor wait executive actions president obama federal receipt tax federal dollars tax spent people petitions create sign house inside white tour interactive february house check offices photo 2012 picks white day president house
t34wS6	3	SC	gorges partnership conservation jocassee represent beauties produced jocassee carolinageorgia carolinas cut hills character lake uppermost carolina eastward elevation represents scientists virginia escarpments forested unique precipitation condition lost settings toxaway scenic drop miles surging waterfalls chattooga eastatoe devils series rivers laurel 1904 blue recorded uniform state indian birds occurs vertical saluda
oqPMKY	3	SC	mcfp outreach weekly 4 2012 illness mental reduce month stigma education raise health awareness designated outreach importance financial private including repaying managing loans difficulties bureau loan protection student complaints accepting borrowers default taking cfpb consumer tip move find allowances decisions information tenth make relocation weeks visit force corps brain experts
wSz8Vx	3	SC	control loss bicycle handlebars imports asia break recalled hazard resulting fall euro named washington instructed canada voluntary consumers illegal commission safety cooperation health announced firm product stop dc recalled resell attempt immediately recall products today consumer product bicycle handlebars canada united 70 states 2000 units san imports sales merry bicycle
y14Ssg	3	SC	urinary coli infections medlineplus tract chicken linked pages related medlineplus urinary caused healthday coli news bacteria feb long scientists chickens persons tract 15 canadian study infections wednesday suggests believed typically chickens control urinary emerging caused coli centers 85 publication disease percent issue march diseases tract report infections infectious prevention pork
jjHHaH	3	SC	hudno11134 hud notice rights homeownership disclosure announces revised servicemembers protects protecting militaryfederal dependents law disclosure duty civil revised washington housing department announced relief development urban notice form servicemembers emphasizes active dependents rights protected today act military duty foreclosure mandates wartime states active rate including court proceeding mortgage personnel percent valid
