yJ8XZj	1	AZ	philippines limited gathering activities sulu warns venues due archipelago warning including occur conference terrorist threats area travel reminded mindanao targeted state manila department 2011 public reflects dated centers shopping continuing activity june occurred indiscriminate terror recent insurgent replaces airports 14 places attacks philippines citizens incidents risks island malls country sulu
uLcl0Z	1	AZ	forprofit floor senate investigation video college colleges forprofit recounts number harkin service veterans advantage students members senator schools enroll drive americas stories military discusses deceived documents statement referred displayed charts statement received 30 forprofit funds bill post911 schools gi received educational benefits forprofit 30 schools military secure forprofit high schools
JDOkF	1	AZ	park canyon bryce national search limestone force series hoodoos canyon horseshoeshaped carved worldly consists rainwater slot colorful eastern plateau claron power geology canyons shaped spires paunsaugunt fins formation erosional unique bizarre dissolving bryce famous windows frostwedging shapes edge rock amphitheaters including called year event astronomy 20 festival skies offer annular
bKCzpO	1	AZ	web student aid colleges financial community grants repaid click universities requirements additional variety federal review program details grant offer students attending schools loans unlike career fouryear page quick aid eligibility financial grants apply based application federal submit read listed fafsasm eligibility free student factors aid page program undergraduate certificate pell
Ai8U31	1	AZ	planets features science sky system exploration solar sunset astronomy technology alignment tony dr phillipssciencenasa feel dash feb winter make sky note uncontrollable 2012 urge read put watchers 17 youre coats evening formationsome solar brightest planets lining sky system leasttonight beautiful sight pop jupiter planets west surrounded sky black blue evening
alrAJZ	1	AZ	town arizona official site gilbert community hear weekread 10 investigation place tragic meeting events latest 612 focus years goal read 6 awareness 2012 week attention firesetting takes 12 arson place prevention food community month support gilbert entire launches challenge drive place mayread town fax az 4804974943 center civic official site
zKiE89	1	AZ	fair marshmallow launch house science white state union video watch enhanced transparency commitment browse house white logs visitor wait executive actions president obama federal receipt tax federal dollars tax spent people petitions create sign house inside white tour interactive adobe player flash content download view 301 february 07 2012 named
GR6MP9	1	AZ	cancerrelated study tied medlineplus fats fatigue omega3 pages related medlineplus cancer extra fish dose day survivors mackerel reuters oily energy salmon fats breast tuna eat largely healthy study found omega3 oncology cancer people appeared years sleep findings needed clinical lingering ends good journal regular fatigue evidence habits exercise therapy treated
yZ302b	1	AZ	antibiotic impacts administra longterm ncbi ecological pubmed 2007 isme function web ncbi javascript site warning requires management citation external file generate software institute medicine sweden stockholm department laboratory karolinska restriction selection disturbances sequencebased trflp years stability clones human gastrointestinal impact group monitor pcr temporal technique terminal potential treatment samples returned
x5VrDM	1	AZ	responding unemployment cbo understanding high persistently contact cbo february 2012 16 unemployment cbo states rate exceeded united percent 8 2014 projects february remain 2009 budgetary tax number produced cost employment spending increase largest 2013 2012 dollar cbo increases designed output analysis policies found unemployment reduce aim lawmakers extent unemployment longerterm
qYsprX	1	AZ	network canberra space communication complex deep nasas laboratory number years spacecraft jet propulsion system pasadena transmit exploring schedule mission california solar robotic antennas worked data day directed advance tracking usa receive months controllers set simulations mission engineering tasks radio antenna calibration maintenance development schedule astronomy projects training times time links
14spsg	1	AZ	ambassadors program system solar people ambassadors information space system program recent local motivated communicate outreach nation designed solar communities missions jpls work public excitement exploration volunteers discoveries enthusiasts walks washington community states ambassadors large service space interested puerto public 500 life greater dc bringing inspiration rico 50 excitement providing comets
xj7vRJ	1	AZ	report science nsfgov special nation aquatic facility rivers shes oklahomas species zoologist research state collected shows recently norman mussels part vaughn river university 30 freshwater southeastern caryn names home species pimpleback hold rabbitsfoot oklahoma approximately research location pistol grip vaughn good north colorful 300 mussels hand vaugn mussel america 55
xz8vye	1	AZ	full prophylaxis radiation vitamin clinicaltrialsgov text trental evaluation necrosis view prevent trental reduce site determine radiation treat occurs hope radiosurgery lesion drugs incidence vitamin purpose occurring necrosis commonly tumor study original bearing testing brain year pregnancy physical 1 3 treatment 6 participation followup exam concluded appointments child phase procedures women
K6gwDI	1	AZ	enabling act people states constitution union footing state enable form government utah equal admitted act original senate house america states hereinafter assembled provided united area inhabitants representatives state territory congress utah part present enacted constituting proposed issued years held electors proclamation cache lake wayne choose rich possessing weber provisions tooele
wSL4e7	1	AZ	painless medlineplus health video threat news javascript adobe flash enabled content player version 8 requires flash pages related medlineplus heart good hurt doesnt expect find women thing attack heart dont cancer people year death heres leading attack chest surprise pain killing breast news women disease american heart people men compared
xAldXB	1	AZ	fiber neuropathy text nutritional sulfate clinicaltrialsgov full agmatine small view supplementation performing testing agmatine autonomic questionnaire monitored sulfate improvement note peripheral function fiber pain nonblinded started arginine effects additionally response end beginning caseonly neuropathic metabolite neuropathy study months patients small evaluates noted investigators biopsy skin jfk med ctr patients clinic
yawnWF	1	AZ	teapots dancing ganz burn due hazard recalls named washington instructed canada voluntary consumers illegal commission safety cooperation health announced firm product stop dc recalled resell attempt immediately recall products today consumer product teapots dancing canada united states units 2100 170 usa ganz cheektowaga ny importer llc handle burn hazard water
zX4fIP	1	AZ	takes blog participants 650 tank fema comment accordance comments blog moderated policy femas links nongovernment social applications web fema provided reference media companies sites endorse msgdata washington street apply management prepare federal rates homeland department 4fema emergency dc 43362 20472202 sw agencyus security500 6462500text tty assistance step 46275853 800 guide
xnua6M	1	AZ	play childrens tipover due hazard theaters guidecraft recalls named washington instructed canada voluntary consumers illegal commission safety cooperation health announced firm product stop dc recalled resell attempt immediately recall products today consumer play theater 4in1 product dramatic toys canada united 1800 350 states units winthrop minn importer guidecraft mega profit
xswEFh	1	AZ	affairs public home links point hyperlinks find site constitute services welfare linked web provided army west purpose stated sites contained authorized endorsement department consistent exercise activities information locations control external exchanges morale recreation appearance products editorial military disclaimer web aspects technical site comments master questions reporting site broken link address
cFz5sD	1	AZ	center tornado watch 28 prediction storm status 28 report watch messages information network service national warnings visit iwin weather interactive 50 mod 30 mod 30 mod 40 mod 20 low 20 low high 80 f2f5 probability forecaster 70 60 table event increased category tornadoes probabilities issuing 5 low moderate events
9wtG8n	1	AZ	medlineplus email updates profile requested site check information service create alerts access offers interest email updated return deliver free web address subscription give receive items medlineplus automatically user process topics sign select email signup updates address emails subscription box receive list medlineplus enter profile preferences addresses topics view history update
if1jua	1	AZ	information house freedom act white state union video watch enhanced transparency commitment browse house white logs visitor wait executive actions president obama federal receipt tax federal dollars tax spent people petitions create sign house inside white tour interactive homeowners refinancing house twitter responsible answers hours brian office questions white deese
xeZzEq	1	AZ	giss impacts level national maps nasa world security figure al paper human based s5 health 2012 shindell simultaneously food journal graphics improving change climate nearterm science mitigating interactive load moments installed computer web java note graphics require enabled browser 2050 temperature bc measures due surface increase avoided methane decrease linked
Ad5PR7	1	AZ	noaa history dedicated agency brought institutional 1871 history noaa states weather include 1870 orders oldest americas information united laws sciences federal section government stewardship specifically conservation bureau precision heritage histories cultures newly physical resources accuracy predecessor life executive scientific formed commercial agencies coast fisheries formation included pertinent individually science 1807
c9sDk9	1	AZ	center tornado pds 57 watch prediction storm status report 57 watch messages information network service national warnings visit iwin weather interactive high 95 high 80 high 70 60 mod high 80 60 mod high 95 f2f5 probability forecaster 70 60 table event increased category tornadoes probabilities issuing 5 low moderate
zpDho2	1	AZ	ncbi plos database prions sequences pubmed prionhome 2012 function web ncbi javascript site warning requires management citation external file generate software canada biology university quebec mcgill department montreal compositionallybiased bioinformatic fungal budding abundant resource coordinates prionrelated potential usage structural resources interactors diseases yeast showing prion entries report asparagine transparent areas
rtOGwl	1	AZ	living healthy breastfeed live guide quick healthfindergov learn baby connect website hyperlink nongovernmental direct application hhs consistent hyperlinks states services human subject information hyperlinked united application contained health endorsement department website intended provided visitors external constitute applications privacy appearance practices products policies purpose link redirected ready foods baby eat information
3v5USM	1	AZ	china foreign trade years adjusted totals millions basis rounding due seasonally note nominal details dollars equal figures adjusted totals millions basis rounding due seasonally note nominal details dollars equal figures adjusted totals millions basis rounding due seasonally note nominal details dollars equal figures adjusted totals millions basis rounding due seasonally
GOZOt	1	AZ	house white state union video watch enhanced transparency commitment browse house white logs visitor wait executive actions president obama federal receipt tax federal dollars tax spent people petitions create sign house inside white tour interactive event live facebook discussion participate click member facebook give click questions comments httpwwwwhitehousegovvideo ondemand library
A3vOk9	1	AZ	mission solstice prometheus cassini images home image details image collision ring 86 moon white drapes outermost prometheus kilometers shaping center bulge 53 miles learn small perturbs soft encke kinky discontinuous image visible ringlets ring rings ringplane 1 stars degree southern gap background ringlet unilluminated learn view side left acquired image
asKEBn	1	AZ	starspangled congress library american treasures memory banner 1814 division starspangled sheet purchase carr musicenlarged 1941 thomas 17791843the scott printed key music francis banner baltimore 291 key states scott signed anthem resolutions introduced 1814 finally law spangled banner forty wellknown national proclaiming star congress song anacreon 1931 united words drinking francis
AAZrIE	1	AZ	current uscert activity highimpact web current incidents regularly updated reported types summary uscert activity security page frequent multiple apple released updates safari address vulnerabilities products security os code crosssite obtain information perform vulnerabilities privileges elevated attack attacker condition execute denialofservice exploitation sensitive arbitrary operate scripting articles mitigate users ht5281 encourages
Anazwx	1	AZ	nih health january national release 12 identify scientists workings viruses news 2012 approach institutes view links related bookmark share smaller findings developed viruses human skin institutes bacteria diseases visualize provide niams jan musculoskeletal scientists health structures national discovery arthritis science reported part workings insights 13 institute cells microscope issue researchers
uvUSJr	1	AZ	immunocompromised ncbi infection pubmed dev clin bartonella immunol 2012 function web ncbi javascript site warning requires management citation external file generate software usa pennsylvania hospital philadelphia medicine department mosepelemosepeleuphsupennedu university caused escape henselae system paper including establishing examine gaps living develop immune bartonellas quintana severe discuss current scratch milder fever
zs5dcP	1	AZ	living healthfindergov healthy quitting live learn quick smoking guide connect website hyperlink nongovernmental direct application hhs consistent hyperlinks states services human subject information hyperlinked united application contained health endorsement department website intended provided visitors external constitute applications privacy appearance practices products policies purpose link redirected quit steps follow information usaccessibility
xdNiTK	1	AZ	pap tests color pdf full cancer find pap cervix vagina test checks opens womb part lower smear cells turn sex pap 21 start 3 vaginal tests years women time pap make normal find call test appointment period change cells harder including pap based doctor things nurse tests woman decide talk
AuOBiK	1	AZ	fu ncbi nutr thoughtshape pubmed hosp induction novdec experimental 2011 function web ncbi javascript site warning requires management citation external file generate software nutrition igjlupoes university de olavide pablo department bromatology seville spain distortion thoughtshape behavioural tsf neutralization relationship food induce fusion effects experimentally intake anxiety showed coping specific patients
yxb4tU	1	AZ	blueprint increase service efficiency announces stronger vilsack usda operations agriculture secretary operations usda century washington cutting agricultural agriculture 21st built jan costs usdas tom department economy blueprint evolving monday producers 9 streamlining plan 2012the service stronger drive americas vilsack continue presenting meet helps secretary usda years accomplishments businesses modernize taxpayers
wav9zq	1	AZ	ass independently ncbi consumption res nutr pubmed dairy soy 2011 milk function web ncbi javascript site warning requires management citation external file generate software loma school usa biostatistics los university angeles epidemiology health vmatthewsmyriverbendorg department linda ca public 106112 hypothesized 091 ci years ptrend osteoporosis based calcaneal 95 028 dairy
w1KEJs	1	AZ	24 apod january norway aurora 2012 fascinating discover featured written image explanation day photograph astronomer cosmos universe professional 24 january 2012 earth captured northern sky spectacular aurora recombining oxygen large activity round throwing protons sun flare pictured eagle night free latitudes days magnetosphere whats feel powerful mass cloud earths fast
wiBYmL	1	AZ	apod 20 ngc february spiral barred 1073 galaxy 2012 fascinating discover featured written image explanation day photograph astronomer cosmos universe professional february 20 2012 years bright centers galaxy system ngc young black prominently clusters spectacular dark bar 55 red upper bars telescope sea constellation space xray captured orbiting cetus pictured
buIRUn	1	AZ	storm tornado watch prediction 71 center status report watch messages 71 information network service national warnings visit iwin weather interactive 40 mod 20 low 50 mod 10 low 20 low low high 70 f2f5 probability forecaster 70 60 table event increased category tornadoes probabilities issuing 5 low moderate events awareness
8X8OOj	1	AZ	ncbi 1997 energy nutr frequency br balance pubmed meal function web ncbi javascript site warning requires management citation external file generate software hotel u341 paris de dieu inserm france find 24 inverse finally advantage reveal confounding test effects difference represents pertinent hypoenergetic small obesity explanations meal weight metabolic energy isoenergetic
Um9Ee	1	AZ	family assistance compliance leave medical fmla act law states department united labor family medical leave fmla act overview hours amended family web january medical 28 page leave information act wage visit 2008 additional family reasons period maintained administrations wage 1 group entitlement eligible labor foster adoption employee covered weeks division
w11sfQ	1	AZ	canl2012 3px highslideactiveanchor backgroundcolor ahighslidecredits urlimagesdmxhighslidegraphicszoomincur paddingleft highslidehover height norepeat width silver ahighslidecreditshover backgroundposition border urlimagesdmxhighslidegraphicsfullexpandgif sansserif img fontfamily 22px pointer highslidecaption helvetica verdana highslideimageblur highslidewrapper black 5px backgroundrepeat hidden urlimagesdmxhighslidegraphicsloaderwhitegif ahighslidefullexpand textdecoration bold fontweight 2px visibility padding 0 1px fontsize background 34px highslidedisplayblock highslideimage white color gray highslide outline
HiPpYK	1	AZ	states united lottery government blog won usagov asked anonymous lottery won run lotteries states individual follow winners slightly procedure powerball winnings states follow handle statebystate basis state bought run multistate lotteries megamillions ticket procedures teams rules generally state winners lottery learn state responsible comments content hope conversations polite 13 older
AfW92Y	1	AZ	climate global february analysis state 2012 form monthly reports access calculation 310 surface dataset including anomalies monitoring temperature monthly beginning state note 3 version ncdc 2011 activities global complete land preliminary report november data change received climate october effective presented trends ranks replaced processed ghcnm newest coding homogeneity adjustment information
wZ7cFJ	1	AZ	ncbi area front pubmed orthographic contamination brocas 2011 psychol function web ncbi javascript site warning requires management citation external file generate software cnrs psychology laboratoire university de france aixmarseille marseille cognitive contaminates results years brain dorsalanterior auditory permanently speech inferior belonging read frontal activation test areas specific found learning past
oj9bJg	1	AZ	mobile mlearning gallery applications usagov adl guide considerations office developed topics planning design learning initiatives ousd provide personnel government distributed content app universal development intended readiness mlearning introduction explore sponsored purpose pertinent adl advanced basics resource mobile official options defense team initiative guide secretary function 27 return september de spanishdated
wnpouX	1	AZ	preserve national park denali sled meet dogs search closures driving mile signage occasional 5 7 pm night park part 11 15 34 18 road birth due inuipiaq born litter names earth kotzebue nuna aliqsi paw sock inupiaq black white pawkavik eagle adopted pads included words date sisters sonamed alaska frontleft
zC2b65	1	AZ	apod march nebula 13 m81 flux group integrated galaxy 2012 fascinating discover featured written image explanation day photograph astronomer cosmos universe professional 13 march 2012 nebula image visible including galaxy unusual group nebulae faint spiral virgo complex exposure local supercluster filamentary big explanation largest gas lucky m81 part diffuse halo
jwnbGE	1	AZ	kenai national park fjords search changing crowning lush effects forests lies ice sea lingers shrinking witness native fjords feature 40 icy glaciers resources life harding waters alutiiq climate bear expanse peninsula entwined kenai thrives nurture vast wildlife land age flow edge today relied icefield accessible trails landscape glaciated glacier offers
JzyWzl	1	AZ	restriction intake greater ncbi energy nutr dietary im pubmed 2012 function web ncbi javascript site warning requires management citation external file generate software kinesiology health department restriction urine ptm assigned proximal integrity als volumetric group density exercising 4 8 libitum maximal protective increased 3 food intake effects implicate weights histomorphometry
GQDTW7	1	AZ	caring childs mental health childs mental mission sites overarching childrens caring system effort support samhsas increase approach health comprehensive public awareness marketing social samhsafunded purpose services strategic care 1994 created communications team strategies works stimulate information childrens national visit event wwwawarenesseventorg health today rsvp day awareness mental dont washington wwwsamhsagovchildrenliveeventasp
nYdn32	1	AZ	wildlife nwr service fish pahranagat photo usfws nwr migratory national pacific county sight nevada birds pahranagat established habitat provide pahranagats approximately 1963 located north august lincoln lakes vegas flyway marshes 90 part refuge las wildlife rare 16 miles waterfowl upper managed pahranagats food obtain middle wetland springs resident 230 species
dxPgYk	1	AZ	145 center watch thunderstorm prediction severe storm status report 145 watch messages information network service national warnings visit iwin weather interactive 20 low 5 low 30 mod 30 mod 40 mod 20 low high 70 f2f5 probability forecaster 70 60 table event increased category tornadoes probabilities issuing 5 low moderate
AnqXpb	1	AZ	omega6omega3 ratio atheroscler ncbi cardiovas rep pubmed 2006 curr function web ncbi javascript site warning requires management citation external file generate software metabolic street dakota usa west research 57105 health foundation 1400 nutrition diseases falls billharrisusdedu sioux 22nd institute university south sd inflammatory human cardioprotective ratio enzyme systems include fas
zQvpFL	1	AZ	retirement problems back medlineplus savings cut pages related medlineplus financial people tuesday retire back healthday forced feb struggles problems early news 14 study face ongoing finds financial significantly reduce reducing retirement wealth affects health sydney income australia ability early accumulate university work longterm researchers people retire ages back 64 data
AwJSiA	1	AZ	story ridge oak national tip laboratory researcher idea laboratory staff story oak relations member interview national end energys department external ridge arrange tip identified communications contact excitations materials unexpected manganate magnetic doped motors spallation discovered experiments magnets laboratory work excitations weaken strength ridge oak source insulator expected performance team neutron
AxpESR	1	AZ	laceration choking hazards due tumblekins recalled toys international playthings named washington instructed voluntary consumers illegal commission safety cooperation announced firm product stop dc recalled resell attempt immediately products today recall consumer product toys tumblekins units 31000 nj parsippany llc distributor international playthings treetoys trading china lishui manufacturer lacerations choking hazards
8K835V	1	AZ	finding state georgiagov holidays 12 employees holidays state observe year holidays state offices closed 2012 dont 116 year total applies current holiday schedule equivalent holidays 120 weekend 8hour earn employees work days time months period fourmonth holiday youll equivalent paid coming day earn working work time construed general information service
9c217Y	1	AZ	files census cartographic 110th districts bureau boundary congressional files jan note cartographic boundaries cd districts 111th boundary 2009 2011 congressional files jan cartographic 110th districts 2007 boundary 2009 congressional shp begin downloading shapefile arcview e00 arcinfo export file ascii click ungenerate jan format e00 110th districts arcinfo 2009in 2007 export
