HQWAod	1	AZ	uscis study civics materials test questions pass tools answer prepare materials correctly 6 interview 10 started test 100 study list civics naturalization asked additional section products select short naturalization process overview video test providing highlighting citizenship rights responsibilities civics video history audio format official list answers civics mp3 questions test
xw8TYV	1	AZ	information commerce showing editorialmcclatchytribune servicesmanufacturing growth exporting department opinion enable javascript utilize site full functionality february 2012contact office editorialfriday 17 affairs2024824883 opinion public commerce information showing mcclatcheytribune servicesmanufacturing growth editorial exporting brysonopinion john secretary month batteries businesses things make stories selling manufacturers met hear advanced building great carbonfiber american products
xkL4Zl	1	AZ	house white state union video watch enhanced transparency commitment browse house white logs visitor wait executive actions president obama federal receipt tax federal dollars tax spent people petitions create sign house inside white tour interactive event live facebook discussion participate click member facebook give click questions comments httpwwwwhitehousegovvideo ondemand library
ruG5h8	1	AZ	start 1940 census research skip navigation national searching index district 1940 enumeration located charge 2 archives online opens 2012 locate free address census april release http1940censusarchivesgov order search access httpwwwarchivesgovresearchsearch opa online public census delaware 1940 sussex county maps state enter milford sussex including town search census 1940 delaware maps
zjxDxD	1	AZ	apod march 17 ngc spiral edgeon 2012 galaxy 2683 fascinating discover featured written image explanation day photograph astronomer cosmos universe professional march 17 2012 2683s blended scattered sources bright distant remarkably galaxy northern ngc young forms clusters refracting colorful background spikes lacking large round telescope foreground elegant images constellation blue
4F8MI7	1	AZ	disclosure requirements availability exempt organization public nonprofits topics charities irs resources disclosure relate questions availability documents addition make irs returns copying public applications filed organizations exemption makes annual request inspection taxexempt organizations requirements filings irs general questions exempt disclose public filings questions organizations requirements make irs copying exempt inspection public
x20N	1	AZ	picture astronomy day fascinating discover featured written image explanation day photograph astronomer cosmos universe professional 11 2012 bright distant earth disk 20 fit easy weeks apogee photographed perigee dark day telescope pacific dense sun asia moon smallest full 300 annular 240 kilometers path super silhouetted filter point image visible smaller
zTtXbT	1	AZ	affordable updated provisions estimates cbo coverage act insurance care contact cbo 13 march 2012 committee budgetary estimates cbo 111152 projections comprises patient education insurance staff jct reconciliation baseline legislation health public pl 2012 affordable updated march provisions taxation joint protection effects coverage law care aca 111148 budget 2010 act preparing
AhYX3u	1	AZ	risk ncbi int suppl dietary cholesterol clin 2009 pubmed pract function web ncbi javascript site warning requires management citation external file generate software nutrition peterjonesumanitobaca centre university mb functional foods winnipeg manitoba richardson canada nutraceuticals saturated show accurate years relation homeostasis cardiovascular overexaggerated complex increased fat fats varies association school
AkjAuK	1	AZ	ncbi med adolesc pubmed activity pediatr performance 2012 arch physical function web ncbi javascript site warning requires management citation external file generate software 1081 emgo asinghvumcnl medical vu amsterdam van research health 7 department occupational public boechorststraat bt care netherlands center institute university der prospective relationship academic describe performance activity
HDTp3l	1	AZ	financial proclamation national month capability house white presidential 2012 state union video watch enhanced transparency commitment browse house white logs visitor wait executive actions president obama federal receipt tax federal dollars tax spent people petitions create sign house inside white tour interactive house white office press secretary states united financial
zZ2Moo	1	AZ	week observatory solar pick dynamics sdo suns magnetic years rotating bright plasma 2010 2012 forces gyrating ultraviolet competing cooler highresolution view back anniversary particles hours active extreme 30 streams detailed 2nd frames feb shifted ago fourminute solar sdo 11 kind strands region launched darker slid mind surface make field cadence
IdrR0	1	AZ	congress joint white session health house remarks president care state union video watch enhanced transparency commitment browse house white logs visitor wait executive actions president obama federal receipt tax federal dollars tax spent people petitions create sign house inside white tour interactive homeowners refinancing house twitter responsible answers hours brian
wf1SnP	1	AZ	ncbi cancer pik3ca pubmed mutation res 2012 initiating breast function web ncbi javascript site warning requires management citation external file generate software cancer prb vanderbiltingram avenue usa pierce 2220 research tn toddmillervanderbiltedu program medicine biology 771 nashville vanderbilt department breast vumc school center 37232 university exhibit mutant oncogenes cancer luminal
yyLBUz	1	AZ	fiber neuropathy text nutritional sulfate clinicaltrialsgov full agmatine small view supplementation performing testing agmatine autonomic questionnaire monitored sulfate improvement note peripheral function fiber pain nonblinded started arginine effects additionally response end beginning caseonly neuropathic metabolite neuropathy study months patients small evaluates noted investigators biopsy skin jfk med ctr patients clinic
hhHqY	1	AZ	webcam olympic ridge hurricane national park search accessible olympic valleys glines elwha campground springs removal altair hot closed public dam canyon entry road olympic national working system parks reskinned website complete park bear kinks websites npswide changeover ridge read snowshoeing hurricane skiing sliding material biomass pacific produce rain living forests
yZEBfl	1	AZ	astp photo nasa id title ast01042 image pacific ocean patterns text oblique cloud view ast01053 text image orbit spacecraft soyuz american apollo soviet american ast01056 text image orbit spacecraft soyuz apollo soviet ast02093 text image blacksky spacecraft soyuz background contrasted soviet ast02096 text image blacksky spacecraft soyuz background contrasted soviet
43f0cO	1	AZ	national cave jewel monument search passages wilderness color appeals human revealed wealth national remains service cave formations surveyed underground maze mystery lure scientific park glimpses longest curiosity world 160 explorers resource immerse fragile jewel brilliant miles splendor mapped national gearing planning excellent exciting trip resource chronicle cave jewel monument calcite
yaEf9H	1	AZ	house ncaa forces white joining state union video watch enhanced transparency commitment browse house white logs visitor wait executive actions president obama federal receipt tax federal dollars tax spent people petitions create sign house inside white tour interactive adobe player flash content download view domain 06 january 100 public 2012
zYq8WH	1	AZ	ncbi transacti res acids nucleic engineering pubmed 2012 naturally occurring function web ncbi javascript site warning requires management citation external file generate software biological miller national 94720 laboratory research physical qb3 graduate program basic department ca division lawrence ucsf california berkeley quantitative usa institute science university biosciences bioengineering uc show
AzVLCp	1	AZ	grant grantsgov opportunities synopsis opportunity find precedence service disk electronic click information grant provide notification send inconsistency document email resolved notifications printed address opportunity emails change receive thing giving original requestedany modification description represent newest file oldest previous shown documents current document sections files background representing modifications arranged changed list
1vCI3X	1	AZ	visualization science challenge engineering report international nsfgov special statements powerful enlighten illustrate visualization sciences literally illustrious long research diagrams franklins rosalind words made davinci xrays history solar people heard world provide solely research flares helix interest scientists illustrations public hope dismayingly understanding necessity nurturing fractal developments literacy rare influential science
pzYag3	1	AZ	states united imcom army sgt states onread united army daniel republic passed responsibility john outgoing korea enlisted leadership maj yongsan change incoming command justis senior garrison throughoutmore san antoniosoldiers army nationive deliver anmore run leaders effective successfully secret takes duty antonioare san soldier nextmore active transitioning dad shot fired heard
Ah1pye	1	AZ	nonhodgkin clinicaltrialsgov efficacy study view text patients indolent cal101 full safety lymphoma bcell previously primary assess rate nonhodgkin indolent safety objective chemotherapy efficacy evaluate alkylatingagentcontaining cal101 purpose rituximab lymphoma response study inhl refractory patients treated 2stage previously rituximab openlabel nonhodgkin indolent 2 safety chemotherapy efficacy singlearm alkylatingagentcontaining cal101 pharmacodynamic phase
vZUSY0	1	AZ	polar lander target system past exploration solar mars missions microprobes instruments measure deep sample martian pentrate surface arm cameras soil regions 2 mars composition polar lander equipped landing goals robotic firstever carried space false mishap accomplishments speed high engines investigation mars main legs polar shut lander crashed landed descending deployed
HWvUCE	1	AZ	due hazard bicycles bikes fall recalls public named washington instructed voluntary consumers illegal commission safety cooperation announced firm product stop dc recalled resell attempt immediately products today recall consumer product bicycles year model 2010 2012 units 4100 francisco san importer bikes public pedals taiwan wellgo corp manufacturer pedals fall hazard
wGJkQa	1	AZ	fda professionals risk tysabri factor drug multifocal safety natalizumab healthcare pml podcast progressive leukoencephalopathy todays topic pml leukoencephalopathy multifocal information natalizumab safety factor division narrator risk tysabri podcast fda professionals progressive drug healthcare division information communication davison additional provide pharmacist lindsay tysabri issued testing disease brain pml jcv 20 guest
erZ7YI	1	AZ	glen canyon recreation national area search stretches human history canyon national geologic glen lees area panorama opportunities acres offers orange backcountry vistas arizona utah million southern hundreds vast recreation 12 waterbased encompassing miles scenic ferry cliffs unparalleled wonders musselfree states canyon zebra glen united lake powell mussels nra western discovered
GAGCMo	1	AZ	conference communities house safe watch lgbt live schools white state union video watch enhanced transparency commitment browse house white logs visitor wait executive actions president obama federal receipt tax federal dollars tax spent people petitions create sign house inside white tour interactive leaders people house community transgender partner education justice
dggfpH	1	AZ	10 apod january martian sunset 2009 fascinating discover featured written image explanation day photograph astronomer cosmos universe professional january 2009 10 operations atmosphere gusev month colors farther human earth fine rover sky crater extensive 50 19 miles view bright celebrating legacy images 80 blue sun recorded anniversary particles red creating
8faZ4	1	AZ	resident aliens citizens abroad small businessselfemployed taxpayers international topics irs resources reside estate resident tax alien estimated united generally returns income subject worldwide paying rules citizen abroad states gift filing duty file resident allowed year alien 2month calendar pay due citizen residing return june regular date overseas 15 extension requesting
A3ISWZ	1	AZ	heart ncbi circ lipotoxi res fat failure dietary moving pubmed 2012 function web ncbi javascript site warning requires management citation external file generate software division wstanleymedicineumarylandedu usa cardiology university md medicine department maryland 21201 baltimore saturated show resistance rodent sources underlying contractile phospholipid treat polyunsaturated decreases absence phospholipids treatment decreased
e2S1Iy	1	AZ	living full rheumatoid arthritis clinicaltrialsgov text view mental family assess focusing systemsbased subjects education internal intervention living compared group perform hypothesize proofofconcept symptoms program health ra subsequently independence efficacy evaluate arthritis purpose improving outcomes model improve psychotherapeutic selfmanagement ifs study disease activity rheumatoid ifsbased twelve bimonthly orientation meetings individual trained
xQESa1	1	AZ	versus 1976 ncbi spine pubmed spinal fusion pa phila effectiveness 2011 function web ncbi javascript site warning requires management citation external file generate software school ma usa service orthopaedic spine boston medical 02114 general kbwoodpartnersorg harvard massachusetts surgery hospital review systematic spondylolisthesis presence back chronic determine clbp low treatment pain
HdaGD5	1	AZ	ncbi int follicular pubmed therapy maintenance rituximab prescrire 2012 function web ncbi javascript site warning requires management citation external file generate software protocol firstline noteworthy lack results dose mabthera including questions suffer impact adding lymphoma based disorders progressionfree iii confirmed radiological musculoskeletal treatment 401 persist mortality survival practice therapy effects
A3gA2W	1	AZ	service monuments national park parks portfolio national parksportfolio cover contents foreword parks monuments acadia canyon bryce caverns carlsbad lake crater grant general glacier canyon grand teton grand hawaii springs hot lassen volcanic mesa verde mckinley mount mount rainier platt mountain rocky seqoia cave wind yellowstone yosemite zion monuments national monument
x9ufOo	1	AZ	full isis spinal atrophy tolerability text clinicaltrialsgov muscular smnrx patients doserange safety finding openlabel study view doses muscular spinal pharmacokinetics administered safety test isissmnrx fluid atrophy injection tolerability study single patients escalating tolerability dose single drug doses pharmacokinetics sequentially cohort administered intrathecal 6 test safety isissmnrx levels active injection 10
18pdxi	1	AZ	volcanocams volcanic mount st helens monument national volcanic mount st helens monument national bridge tty 98601 wa monument ne headquarters 4497800 8915003 42218 yale amboy 360 box observatory ridge wa 98649 lake po 24000 326 360 toutle johnston 2742140 spirit highway helens toutle feet static north realtime approximately located ridge
3Wg4dC	1	AZ	national park yosemite search square wilderness national 1200 deep high valleys human giant strength area parks find shrine glaciers grand granite persistence life power tranquility park sierrayosemite vast states sequoias united meadows foresight miles waterfalls ancient activities question yosemite choose answer difficult common dont reservations require campgrounds early popular fill
y7mqmw	1	AZ	apod march 14 sun angry erupting 2012 fascinating discover featured written image explanation day photograph astronomer cosmos universe professional march 14 2012 suns years earth captured current giant system field baddest plumes plasma magnetic puffs colorful dark cool twisted tendril inverted ejections shown sun particles chromosphere bird pictured emitted sunspot
xrQZL	1	AZ	arches park national search inspire trails discover wonderland colors balanced landscape red giant sunsets amaze addition visit 2000 formations fins pinnacles textures contrasting park landforms hundreds world stone natural unlike soaring refresh rocks arches massive rock evening point watch solar 20 nearlyfull join panorama eclipse 2012 join park online share
yJlXl8	1	AZ	census estimates current bureau data series revised estimates decennial year unit geography basis beginning housing detail boundaries methodology characteristics recent administrative consistent record multiple vintage incorporates time preferred released entire data population census flow annually vintages geographic called latest reference series year estimates v2011 vintage 1 final date july refers
b8z4UW	1	AZ	george usn navy admiral biography dewey biography record service george farenholt fleet ammen admiral dewey creating office act navy admiral death general navy orders dewey battle manila bay bibliography canvas oil nm painted usn george 72x48 miller 1911 admiral 20th dewey biography midshipman september december year montpelier rank advancement born
130rZ5	1	AZ	island national seashore assateague search enjoy coastal move rest existence continent sandy recreated visit forests day live bays life recreate relax time assateague maritime explore marshes waves beaches island salt ocean edge place adapted wind enjoy make thrive horses beauty assateague extraordinary distance island continue wild enjoy barrier ages visitors
zw5Zip	1	AZ	shot adults whooping medlineplus cough panel pages related medlineplus adults vaccinated experts bacterial feb 22 infectious recommended health uncontrollable coughing news cough disease triggers dangerous whooping wednesday infants pertussis healthday control adults advisory vaccinated including 65 committee recommendation aged centers preventions vaccination specifically recommended voted include vaccine expand panel older
xXKCKE	1	AZ	ars march usda service 19 agricultural apps websites research phone news nutrient 2012 data interactive ars national foods forfee click information variety image apps smart free phone lists consumeroriented database websites composition incorporated nutrient interactive usda reference phones national phone variety forfee home choices agriculture websites apps thumbing version downloadable
76re7C	1	AZ	center tornado watch prediction 1 storm 1 status report watch messages information network service national warnings visit iwin weather interactive 30 mod 20 low 30 mod 10 low low low 60 mod f2f5 probability forecaster 70 60 table event increased category tornadoes probabilities issuing 5 low moderate events awareness listed
aia7p9	1	AZ	flagstaff national weather service nws summer earth 23 producing degrees circle means day spins tilted spring close sun 365 hours days times length spin elongated pole directly respect earths night solstice expected north complete hemisphere 90 12 14 autumn moves axis orbital winter tilt elliptical plane date seasons orbit midway
whp640	1	AZ	kids concussion medlineplus symptoms year study pages related medlineplus healthday news suffer children concussion difficulties 5 memory march monday attention problems continued study months finds display brain mild year concussions 500000 children hospital injuries note treatment teens injury traumatic needing common childhood researchers dont researcher owen results brain mild injuries
vT1ye	1	AZ	history march 17 today writers 1938american 19361940 federal colonel histories wood wearing life november manuscripts 11 obrien project recited nebraska green river irish parade patron savannah boston unofficial celebrating 492 traditions 1775 city renowned death festival commemorating legend patricks ireland heritage officially today 1824 march saint circa back georgia york
ytLitT	1	AZ	mountain atherton shimano fall due hazard bike stems recalls handlebar pro named washington instructed canada voluntary consumers illegal commission safety cooperation health announced firm product stop dc recalled resell attempt immediately recall products today consumer mountain product bicycle stem handlebar canada united 213 states units 83 taiwan corporation post moderne
2fWrp	1	AZ	violent storms tornadoesnatures september national noaa preparedness weather including fema information administration cross version safety department red oceanic schools commerce 1992 atmospheric service american pdf adapted guide summer rotating violent mile world injuries ground east mph rocky 50 miles found spring reported sign year 80 oklahoma arkansas nationwide nature broken
GEHMHX	1	AZ	conference communities house safe watch lgbt live schools white state union video watch enhanced transparency commitment browse house white logs visitor wait executive actions president obama federal receipt tax federal dollars tax spent people petitions create sign house inside white tour interactive leaders people house community transgender partner education justice
7nno	1	AZ	apod star 14 trails march 2009 hauteprovence fascinating discover featured written image explanation day photograph astronomer cosmos universe professional 2009 march 14 bright earth rotates 24 fix circle made february nicely traced venus traces alexandre sequence trails santerne astronomer arc constellation bottom poles consecutive shows foreground 300 dome telescopes hauteprovence
w4WLm	1	AZ	living healthfindergov healthy live learn quick guide connect website hyperlink nongovernmental direct application hhs consistent hyperlinks states services human subject information hyperlinked united application contained health endorsement department website intended provided visitors external constitute applications privacy appearance practices products policies purpose link redirected information usaccessibility privacy mapcontact act policyfreedom ussubscribe
yTVsmz	1	AZ	ncbi midlife pubmed health donts menopause dos 2011 exercise function web ncbi javascript site warning requires management citation external file generate software gynaecology pt cg medical college obstetrics department india raipur hospital bram inconclusive including aspect osteoporosis impact contraindications exercising symptoms program health include activities breathing modification fall treating modifications
x6zQ9v	1	AZ	calendar edsitement presented contribute commitment bring americans liberty pedestal lesson end american erect public students french york statue effort skeptical completing bargain fulfilled convince learn national symbols message liberty research complete nature students symbol communicate clarify statue study share partnered thinkfinity lesson find educational save resources plans free edsitement plans
xtzWut	1	AZ	resource nida families 17 navigate national nih health helps institutes january release addiction 2012 news options treatment links related bookmark share developed national hard choosing questions institutes information nidas service program health treatment online struggling nida families drugpubs seeking free abuse part copy addiction resource institute drug public individuals researchbased
tO4ZsR	1	AZ	living healthfindergov healthy live adult shots learn quick guide booster connect website hyperlink nongovernmental direct application hhs consistent hyperlinks states services human subject information hyperlinked united application contained health endorsement department website intended provided visitors external constitute applications privacy appearance practices products policies purpose link redirected information usaccessibility privacy mapcontact
d6gesc	1	AZ	prevent controlled ncbi med trial sports randomized pubmed 2008 function web ncbi javascript site warning requires management citation external file generate software control division usa jrg7cdcgov center national disease 30341 unintentional ga atlanta injury centers prevention anterior community decrease ligament injuries neuromuscular noncontact cruciate difficult entire training programs large team
n3QQVg	1	AZ	sec form accurate reviewed information necessarily commission reader complete exchange completethe securities assume determined filing 1 identity issuers information business contact 2 place principal persons 3 related clarification response clarification response clarification response clarification response clarification response industry group 4 size 5 issuer federal select 6 claimed apply exclusions exemptions
An7ML6	1	AZ	prescription ncbi effect medicat cost cmaj adherence pubmed 2012 function web ncbi javascript site warning requires management citation external file generate software school mlawchsprubcca columbia centre university bc british research policy health services vancouver public population prevalence characteristics outcomes including risk medications adhere costrelated health treatment investigated increased afford insurance
ZtTyf	1	AZ	federal corporation deposit fdic insurance disabled message viewed web content enable information javascript closing bank recent options view browser page interactive aggregate fdic publicly make list reports creates details banks problem troubled disabled message viewed web content enable releases javascript press options view browser page interactive lettersspecial disabled message viewed
