lOPUr4	1	AZ	std ncbi hiv int review infection 1999 pubmed circumcision aids function web ncbi javascript site warning requires management citation external file generate software pediatrics marshfield usa lakeland vanhowerdgabbymfldclinedu clinic department center noncircumcised interval prevent transmitting circumcised random africa number 29 raw partner risk penis surveys ratio relationship measure conducted unfounded
yol440	1	AZ	boulder city briefs jan 6 news 2012 boulder 6a1a18 uiheadercolor favorites twitter servicesexclude uicobrand print addthisconfig servicescompact google facebook delicious var ffffff email uiheaderbackground held dance days free jan adult 7 8 dance community drive 5660 broadway saturday parks northboulderrecreationcenter jan sunday 7 department 8 east boulder free host adult
pkNgfi	1	AZ	map national corps map national skip links national revised period due past cartographers suspended funding forms maps program usgs citizen ngp decades limitations map collection sponsored data 2008 projects volunteer geospatial share years platforms information networking mapbased georeference sites easy internet social services technologies types recent made produced volunteered information
9MEOTe	1	AZ	control icscert uscert systems control industrial security emergency collaboration system cyber focus icscert uscert systems team response control security efforts coordination management securing strategy systems risk successful component icscert key outlines realized effective longterm serves common vision learn monthly monitor archive icscert advisories archive reports resources reporting control cssp infrastructure
yjI06Y	1	AZ	med ncbi activity 2008 intern pubmed arch association physical function web ncbi javascript site warning requires management citation external file generate software thomas england se1 hospital 7eh genetic london research epidemiology twin college kings st campus unit past rate human attrition dynamics diseases aging indicator leukocyte ostensibly agedependent normal factor
eamuXB	1	AZ	hud statute respa banking 12banks title chapter 2605 27real loans mortgage estate administration escrow sec servicing accounts settlement procedures disclosure assignment loan applicant sale servicing transfer relating outstanding loan related assigned mortgage application time disclose sold federally servicing transferred person applies makes notice loan transfer servicing time transferor 1 notice
sB1lKz	1	AZ	grant grantsgov opportunities synopsis opportunity find precedence service disk electronic click information grant provide notification send inconsistency document email resolved notifications printed address opportunity emails change receive thing giving original requestedany modification description represent newest file oldest previous shown documents current document sections files background representing modifications arranged changed list
x0pOeE	1	AZ	hormonedisrupting household medlineplus chemicals products found study pages related medlineplus household healthday linked asthma thursday research 8 200 tests hormone march disruption chemicals report news suggests products common found researchers household fresheners air soaps cream protectors cosmetics shaving curtains perfumes kitty detergents vinyl included wide tested sunscreens litter lotions shower
