cNYi9y	1	IL	hearing hearings senate pensions labor health committee education families subcommittee children 18 thursday 2010 november 1030 senate dirksen building office 430 wabernard hagan bingaman al murray harkin nmpatty whitehouse ct merkley sheldon franken bennet pa tom ri sanders mdjeff ncjeff jr casey kay mikulski richard mn michael iabarbara vtrobert blumenthal
wAO5RR	5	IL	19 january national update thursday situation fema 2012 information warnings west region effect watches remain advisories wwwwrhnoaagov numerous latest heavy flash series move pacific wyoming mountains saturday montana northern amounts coasts cascades copious 3 low moisture 6 flooding idaho systems rainfall heaviest inches utah oregon coast pressure carrying california snowfall
bpKe8l	3	IL	usdoj dag force intellectual task property attorney force departmentwide deputy ip crimes domestic number intellectual general initiative justice department international chaired part task confront growing property force ip intellectual states effectively economic identify multifaceted partners abroad united implement works federal threatens crime state strategy safety coordinated type public combat rise
zGevyz	4	IL	tests gluten ncbi sensitivity pubmed clin serological 2011 gastroenterol function web ncbi javascript site warning requires management citation external file generate software italy hospital st medicine clinical orsolamalpighi bologna department university compare gs gluten sensitivity characterize serological pattern disease celiac found gs spectrum entity markers disorders clinical glutenrelated recently lacking
bl4VDk	9	IL	federal hiring resource flexibilities center excepted character competitive hiring situation special fill traditional unusual service basis enable jobs confidential schedule agencies job streamline authority schedules authorities opm procedures circumstances policydetermining feasible practical provide applies exceptions hire casebycase link learn select excepted topic management service area fellows covered abovelisted appointments presidential
Abjjlf	1	IL	colleague amendments amended provide guidance act legal standards dear letter ada department education issues office civil issued elementary americans questions dear amendments requirements additional provide guidance ada department 504 ocr today colleague faq educations made letter schools frequently secondary document rights disabilities accompanying rehabilitation act section asked laws commitment full
zWbZcy	1	IL	waste honored university kansas 01132012 reducing hospital contact newsroom operations gold reductions executive held greenhouse innovative protecting research avenue environmentally impact calculate facility jan program helps 2011 2010 kasperbauer 2012 activities 7 regional 24 schools projects pounds january university fergusonthe serves annually hague officer release businesses garagewho 5517557 540000 auditorium
vCsfbD	1	IL	ncbi hypertonia pubmed stroke 2001 intrathecal spastic baclofen function web ncbi javascript site warning requires management citation external file generate software division neurological usa university jmeythaluabedu school medicine birmingham department surgery rehabilitation alabama physical spastic effectively continuous hypertonia due delivery stroke intrathecal determine sought decrease baclofen ashworth itb crossover randomized
bREk8i	1	IL	government house executive contracting white order economy state union video watch enhanced transparency commitment browse house white logs visitor wait executive actions president obama federal receipt tax federal dollars tax spent people petitions create sign house inside white tour interactive homeowners refinancing house twitter responsible answers hours brian office questions
zGLyFX	1	IL	repair ncbi plate 2011 belg pubmed cuff orthop rotator acta arthroscopic function web ncbi javascript site warning requires management citation external file generate software dongjakgu korea center orthopaedic university medical smgsnu boramaegil 41 chrisjosnuackr medicine 156707 college national department surgery boramae seoul irrigation arthroscopic technique concerns local loss knot procedures
ckbbtv	1	IL	information returns guide topics efile irs resources requirement revenue tax businesses file mandated information service irs returns internal document return business transactions regulations report required information returns file statements estate partnership individual including file year calendar trust electronically information corporation make irs returns income filers 250 recipients transactions reportable persons
wPiOtt	2	IL	nida bff peerx choose teens path lands hard high wisely drama ease avoid pills offers friend choose stress stay date path lap school matter loyal set ripple creates make effect choice world choices play start story press textonly videos version view learn clip confront video facts reallife decisions myths end
rf1NbF	2	IL	houston science nasa story streaming downloadable file audio listen september 2002 mom 9 family back seat heard home rarely travel trip start good parent thousand begins hundred 15 cry thing miles car minutes years traveling earth mars approach red closest couple million backat months 35 planet miles houston james inside
AmYCTY	1	IL	ncbi plos infec bak pubmed coronavirus mcl1 2012 upregulation function web ncbi javascript site warning requires management citation external file generate software school singapore university nanyang sciences technological biological global results human chicken modulate issues 24 chemical death progeny kinase program increased apoptosis rna postinfection replication inhibition proteinextracellular vero embryonated
cra9dX	1	IL	map house state health white care state union video watch enhanced transparency commitment browse house white logs visitor wait executive actions president obama federal receipt tax federal dollars tax spent people petitions create sign house inside white tour interactive seniors adults people preexisting click young find state health receiving conditions
z4fzBB	1	IL	press releases directed office violation copy unfair binkley businesses spanish httpwwwtbprorg pleased staff 24 remedial eligible advertisements state click compensate board suspension violations 2012 division victims harmed practice judge trade continued brought february unauthorized 18003428385 michael 77000 liable found attorney individuals penalties injunction licensed 18372 advertise practices suspects cooper consumers
tlrJlr	1	IL	poor videos dick forprofit rejects multimedia success gao excuse college archives student senator report rates industrys durbin senators colleges todays office senate characteristics washington states debunks college socioeconomic compares united forprofit floor lower make dick accountability rates longtime public today poor controlled government students dc highrisk gao excuse student report
ipgl7l	1	IL	nida videos peerx choose path teens interactive learn clip confront video facts reallife decisions myths end situations make separate character scenarios lets call choose role main youll play drugs drug step abuse path teens include prescription assume choices common shots activity outcome decision interactive selection dont clip ending video path
wdJbTk	1	IL	2004 success bus ncbi rev pubmed lasts harv function web ncbi javascript site warning requires management citation external file generate software school business usa boston harvard lnashjustenoughsuccesscom laura tasks tend find happiness impact thinking true surveyed pursuing achieve real hit framework made aspirations feelings categories areas leads success level irreducible
cjYwfD	1	IL	schedule wsdot ferries dockbound viaduct wednesday 0835 510the jackson marion construct entering close 5 impact driving offloaded drivers due thursday access exit 9 terminalawv utilizing 2012 activities customers colman 7 awv pmseattle southbound underneath dock construction traffic western northbound affect change diverted yesler 10 alaskan university vehicles overnight exiting street
yRQiwq	5	IL	ri sci ncbi ann lab ldl levels low cholesterol clin pubmed serum 2007 function web ncbi javascript site warning requires management citation external file generate software school tel center medical holon sackler israel aviv medicine internal edith department wolfson university ldl 18157 cardiovascular 24 group morbidity mortality associations increased therapy
zTxpze	4	IL	sec form accurate reviewed information necessarily commission reader complete exchange completethe securities assume determined filing 1 identity issuers information business contact 2 place principal persons 3 related clarification response clarification response clarification response clarification response clarification response industry group 4 size 5 issuer federal select 6 claimed apply exclusions exemptions
p4mjAX	1	IL	memorial center car national compliance expansion jefferson 2015 document search return preservation environmental historic car2015 information center car compliance 2015 document correspondence section 106 nhpa nepa documents reference design competition design activities community comment public opportunities minutes meeting gathering century national nineteeth helped click memorial courthouse west fuel life learn
AbAMbG	1	IL	full longitudinal study sclerosis clinicaltrialsgov als biomarkers text amyotrophic lateral view find underlying als develop collect markers research samples usage hope purpose unique comparison biofluid study banking therapies learn biological researchers point cerebrospinal serum csf als participants samples collected include plasma rna fluid blood dna time biological amyotrophic people cerebrospinal
zRdly2	2	IL	management assistance conservation forest missouri department landowners manage private years 60 wealth landowners state conservation forest department public resources fish offered wildlife job services care protect natural missouri property private proper 85 management percent environment health forest missouris important forested care land resource 30 individuals missouri economy advisory private stewards
76re7C	22	IL	center tornado watch prediction 1 storm 1 status report watch messages information network service national warnings visit iwin weather interactive 30 mod 20 low 30 mod 10 low low low 60 mod f2f5 probability forecaster 70 60 table event increased category tornadoes probabilities issuing 5 low moderate events awareness listed
vZOMWC	1	IL	med soc ncbi eng influence muscular pubmed fatigu biol conf proc ieee 2011 function web ncbi javascript site warning requires management citation external file generate software school 8050 nishiku science university graduate 9502181 kiryuengniigatauacjp japan technology niigata ikarashi2 slope contractions cocontract maintained skiing skill muscleactivation distributed long signals intermediate coarse
zaAN05	1	IL	partners corps army headquarters project news cape archive celebrate engineers tim usace corps photo njdep commander guard cost philip staff city district army philadelphia approximately environment representatives lt 600000 lautenberg department speaks beach congressional lobiondo million cubic frank nourishment coast 9 protection yards senator cape shared project sand boyle secrist
uZ0myg	1	IL	vet ncbi 2011 vitro pubmed identification verific immunol immunopathol function web ncbi javascript site warning requires management citation external file generate software 20708 md usa fdacvm laurel poststimulation lack coli expressions based extracted chosen 4 8 rna cd4 57 differential list response qrtpcr significantly 24h culture altered models 3h inflammation
rmARtk	1	IL	buildings star multifamily energy rise high qualified star energy join partner professionals buildings star multifamily industry rise high qualified home energy resources set energy guidelines buildings ashrae high society mfhr substantially built efficient strict building star multifamily rise standard efficiency designed 9012007 making airconditioning earn 15 heating american meet engineers
hGBhsm	1	IL	facility ak camp recreationgov brooks details campground visitor walk boreal mountain lake dumpling forest nestled brooks shores naknek short center scenic camp enjoy hiking people trailhead fishing campground sport mountain addition dumpling interested bear viewing birding programs kayaking daily rangerled brooks lodge trading purchased licenses post fishing summer camp developed
xtzWut	2	IL	resource nida families 17 navigate national nih health helps institutes january release addiction 2012 news options treatment links related bookmark share developed national hard choosing questions institutes information nidas service program health treatment online struggling nida families drugpubs seeking free abuse part copy addiction resource institute drug public individuals researchbased
xTHIdj	1	IL	affordable house college making white state union video watch enhanced transparency commitment browse house white logs visitor wait executive actions president obama federal receipt tax federal dollars tax spent people petitions create sign house inside white tour interactive adobe player flash content download view 13 january domain 407 public 2012
uGYJrZ	9	IL	autoimmune diseases ncbi allergy rev pubmed gut clin leaky immunol 2012 function web ncbi javascript site warning requires management citation external file generate software md biology center usa university school research mucosal medicine maryland 21201 afasanombrcumarylandedu baltimore underlying innovative neuroendocrine disorders tight susceptible controls intercellular equilibrium diseases nonself impaired loss
38wVeM	1	IL	founding congress library religion american republic exhibition sections exhibition introduction constituents supported inconsistent religious statesmen 1776 rose exhibition fervor founders vigor freedom practice nation shared republican governments equality alexis public settlers people national eighteenth intensity officials result demonstrates religion state degree men extent tocquevilles revolutionary faith great central revival citizens
wajOad	5	IL	house white makowski martin state union video watch enhanced transparency commitment browse house white logs visitor wait executive actions president obama federal receipt tax federal dollars tax spent people petitions create sign house inside white tour interactive operations disaster preparedness americorps community years coordinator manages education instructor cpraed resourced responsible
dXwYU9	1	IL	prepare neighbors unexpected disaster set pass information inevitable ordinary events preparation complete educating plan key modeling day great lifethreatening project turn steps ensure social date follow networks mlkdaycnsgov include serve additional opportunities official national accessibility community usagov fear privacy federal corporation notices website government site foia service register contact act
wiBJwv	2	IL	leptin ncbi mimetic pubmed appl signaling physiol sprint 2011 exercise function web ncbi javascript site warning requires management citation external file generate software physical palmas university de canaria gran department education spain las actions jak2 human activates group distributed young 8 increased activation 120 phosphorylation skeletal reduced preceded 30s sprint
aGrvo1	1	IL	metab ncbi int nutr chocolate exerc pubmed 2006 postexerci sport milk function web ncbi javascript site warning requires management citation external file generate software applied usa laboratory university bloomington 47405 dept kinesiology health human science performance indiana rating endurancetrained results cyclists milk tte isovolumic 4 bout greater workout bouts fluid
2hfrTC	3	IL	missions national park antonio historical san search 10000 unseen people spanish mission years entering drought accepted deadly pledged mexico attack cultures texas foreswore life north diseases king survival raided early fealty lives lay apache 1700s traveled distance allknowing missions traditional lingered god found south rescheduled september cancelled activities good things
zseBKf	1	IL	surg ncbi efficacy plateletrich joint pubmed autologous bone pl 2012 function web ncbi javascript site warning requires management citation external file generate software canada evidencebased ontario center division ushethqmedca university orthopaedic hamilton mcmaster surgery orthopaedics orthopaedic benefit determine pain injuries review plateletrich debate clinical treatment softtissue extensive plasma function led
zdWi6a	1	IL	recommends cancer testing lung protect family january radon 01172012 leading epa contact newsroom stores 21000 bonnie actions month kits centers 20 fix smith improvement easy 2011 good risk surgeon instructions warned fixes indoors january release people encourages national testing cost year home estimated 01172012contact find health closed risks colorless protection
aw3KZ1	2	IL	advisory bulletin special advisory bulletin special exclusion programs federal effect health participation care operations advisory cmps background office breadth september money kinds mission entity cfr guidance identify human misconduct cmpl issues 1 enhance violate application explain furnished exclusion examples entities program extends excluded congressional physicians affected provisions contracts bulletin cover
17d7Xm	1	IL	apod space sun 30 2008 station international transits july fascinating discover featured written image explanation day photograph astronomer cosmos universe professional 2008 30 july timing umbra earth previous transiting front central decades humanity real penumbra dark lighter fewer activity individually surrounding dawn machines sunspots space sun recorded current international contrast
jjHHaH	2	IL	hudno11134 hud notice rights homeownership disclosure announces revised servicemembers protects protecting militaryfederal dependents law disclosure duty civil revised washington housing department announced relief development urban notice form servicemembers emphasizes active dependents rights protected today act military duty foreclosure mandates wartime states active rate including court proceeding mortgage personnel percent valid
JNBqk	2	IL	office state missouri secretary map search skip site content contact opportunities directions employment symbols home sos state tough hadrosaur jaws discovered stewart duck allen july glen type herbivore 1942 mo rsmo cretaceous late contained 9 vegetation town lived handle 2004 fibrous dan time period billed states 10095 missouriense official missouri
zhMOL4	10	IL	presidents make healthiest council year 2012 set presidents past council year activity incorporating physical start reminder achieve 2012 nutrition good ability healthiest reflect goals making great 12 lifestyle level healthy age months realistic commit work weight people presidents set council years resolutions fit percent approximately reality report attainable change january
hAbWa2	1	IL	service mlk day project find receive mlk updates inbox mlkday follow twitter interests dont tools find toolkits create project tips widget mlk search site day ensure social date follow networks mlkdaycnsgov include serve additional opportunities official national accessibility community usagov fear privacy federal corporation notices website government site foia service
wA35po	3	IL	serv med renewed roles librarians ncbi problembased pubmed ref 2011 function web ncbi javascript site warning requires management citation external file generate software misamiutoledoedu usa university college toledo medicine ohio incorporate emerging process librarians constructivism library case involvement learning education quality guides information group opportunities presents problembased describes widely enhance
mXPpr	2	IL	bio astronaut aldrin buzz colonel usaf ret phd nasa astronaut buzz aldrin family born children comprised 20 personal combined grown phoenix cannon sons lois data driggs daughter grandson january married 1930 montclair jersey colleges cambridge point universities high manned astronautics thesis education technology aldrin graduating united west guidance doctorate degrees
wSovyW	1	IL	apod 19 january hunters stars 2012 fascinating discover featured written image explanation day photograph astronomer cosmos universe professional 19 january 2012 bright nursery giant begirt northern rigel true sky lake hues skyscape rise hunter trees rivaling pinkish shoulder easily january blazing hemispheres night framed picture fish bare betelgeuse recognizable blue
w4LAnq	1	IL	whistleblowing ncbi people young legal pubmed child commentary nurs 2011 function web ncbi javascript site warning requires management citation external file generate software school university macornockopenacuk keynes law open milton required examines environment inappropriate patients legal witnesses nurse competence colleague risk putting article care level performing believes action position activity
ABnzcP	1	IL	disagreeable soc ncbi fancy 1989 pers pubmed truth agreeable psychol function web ncbi javascript site warning requires management citation external file generate software 78712 psychology university department austin texas relevant feedback accurate global prefer unfavorable selfconceptions positive negative low selfverify type preferred subjectively favorable selfviews level determined selfenhancement pertaining people
A8GVs5	1	IL	plant multiple ncbi food res pubmed moringa 2007 phytother oleifera function web ncbi javascript site warning requires management citation external file generate software pakistan faisalabad38040 university anwargilaniakuedu department chemistry agriculture tropics roots phenolics distributed compelling treatment rich employed immature activities good combination antiulcer indigenous minerals possess impressive countries quercetin moringa
zGjYkl	1	IL	uncertainty resilience disaster age forging library fema crisis 2030 action strategic response highlighting strategic foresight initiative 20102011 report progress insights download plugin links plugin require plugins page view pdf adobe acrobat links nongovernment social applications web fema provided reference media companies sites endorse msgdata washington street apply management prepare federal
Ai08kS	1	IL	current uscert activity highimpact web current incidents regularly updated reported types summary uscert activity security page frequent multiple apple released updates safari address vulnerabilities products security os code crosssite obtain information perform vulnerabilities privileges elevated attack attacker condition execute denialofservice exploitation sensitive arbitrary operate scripting articles mitigate users ht5281 encourages
DmpmR	2	IL	entrez genome view viewer map resources ncbi data genbank organism sequencing projects resources related databases cytogenetic features reference sequence viewer hybrid maintained displays human ests contig tiling physical contigs stss ncbi alternate radiation maps genetic grc predicted include fish genome map graphical assembly models genes component gnomon clones path bac
yYZmSW	6	IL	benjamin revolution congress library treasures words american franklin honesty dead bright ship conscience leak strokes secret policy oaks christmas good fell sink key continual great small breadth letters words accurate scientist writer long exhibition careers life franklins finished birth inventor politician matter accomplishments tercentenary cartoons achievements achieved books abolitionist broadsides
xJ45hn	1	IL	duty protection fall 1926501 1926501a general 1926501a1 conform set 1926502 requirements provide section systems criteria employers protection fall subpart required sets 1926501a2 determine walkingworking allowed integrity surfaces strength support employer requisite structural employees work safely 1926501b 1926501b1 fall walkingworking surface feet unprotected personal arrest protected safety systems 6 employee falling
Ajj8t5	1	IL	hexavalent ncbi hyg pubmed environ 2007 exposu occup chromium exposures function web ncbi javascript site warning requires management citation external file generate software cincinnati usa institute national lmb1cdcgov 45226 safety health occupational operations limited wide existing facilities including industries content 21 parameters field personal producing workers controls removal painters wood
zpudkg	1	IL	bmc applying ncbi cancer pubmed paternalism libertarian strategies 2011 function web ncbi javascript site warning requires management citation external file generate software division 20892 usa genetics bethesda cancer epidemiology institute national md environmental branch occupational dcwheelsgmailcom significantly cancer antigen lack results indolent states randomized controversial facts incontinence united publication remains
vG8lcT	1	IL	apod thunderclouds jumping sundogs 8 november 2011 fascinating discover featured written image explanation day photograph astronomer cosmos universe professional altsee picture clicking resolution explanation version download 8 november highest 2011 phenomenon years web rapid sky reorients differently sundog return emerged words clouds lightning inspection temporarily enthusiasts past curious encouraged sum
tJvVE8	1	IL	control med leptindependent ncbi serotonin pubmed exp appetite te 2011 function web ncbi javascript site warning requires management citation external file generate software development genetics usa university ny york department columbia 10027 show results arcuate experiments appetite disorders decreases signals brainstemspecific creb food intake inhibition birth antagonist reveal specific release
