xeZzEq	1	IL	giss impacts level national maps nasa world security figure al paper human based s5 health 2012 shindell simultaneously food journal graphics improving change climate nearterm science mitigating interactive load moments installed computer web java note graphics require enabled browser 2050 temperature bc measures due surface increase avoided methane decrease linked
yowC5u	1	IL	thomas congress text bill library 112th 20112012 hr ih 3784 purchases code revenue transit tax thereof grants 1986 credit profit internal income mass oil gas vehicles passenger natural amend impose windfall products fuelefficient period case infrastructure committee kucinich addition conyers concerned langevin speaker filner transportation provisions means woolsey fall consideration
rgDdLT	1	IL	rush klondike gold national park historical seattle unit search gold globe national headlines 1897 event unit yukon canada preserves seattle subsequent spreads crucial seattles role telegraph rich strike thousands igniting klondike easy northwestern read park story remote july dreams rush word 17 stampede riches minds historical fields newspaper discover pacific
b2uIyI	3	IL	house white state union video watch enhanced transparency commitment browse house white logs visitor wait executive actions president obama federal receipt tax federal dollars tax spent people petitions create sign house inside white tour interactive event live facebook discussion participate click member facebook give click questions comments httpwwwwhitehousegovvideo ondemand library
wtPkNx	1	IL	ncbi ten diet pubmed environ components entomol selfselection 2011 function web ncbi javascript site warning requires management citation external file generate software control usa usdaars laboratory national juanmoralesramosarsusdagov 38776 ms stoneville biological show methods feeding 20 4 population indicating 2467 food early developing tenebrionidae significantly findings selfselected relative growth 1927
w38yEm	25	IL	mobile pubmed slip night youll ment jun30635463 health nurs 2009 issues box usa psychology wa university washington epederuwashingtonedu 351525 department seattle 981951525 emerging money focus arriving interesting finally positively evening increased males drinking alcoholrelated prepartying night quick endorsed significantly sex frequency college estimated sexual event alcohol subsequent legal research participants
wSaGdC	2	IL	erasure fbi crime announcement recovery service malicious internet dhs public files complaint joint center practices ic3 erasing efforts hard cyber zeroing effectively computer determine altered backups disk stole information criminals hide network malicious damage access zeros systems criminal alter greatly files good victims business drives sort wiping restoration makes characters
aLs1v1	1	IL	states patent united 8159670 filters technique source rastering combination singledilution hematology beam sweeping signal performing comprising arrays dilution scanning employing module solution invention pass preamplifiers measurements flowing increasing method processing analyzer conditioning throughput suitable lenses fieldprogrammable comprises reducing electronic system utilizing converters aliquot precision optical laser stream flow measurement sample
s7bTul	1	IL	cell 2009 ncbi plos genes regulation pubmed involved polarit function web ncbi javascript site warning requires management citation external file generate software poland medical general transplantation department surgery university warsaw recipienttype model induces displayed vascularized dose cells rat synapses epitopes indefinite graft rt1a alloantigen wistar reactive antigenpresenting administered csa furth
wXG4iA	1	IL	sheep vet ncbi disease attributed pubmed babesia rec 2012 haemolytic function web ncbi javascript site warning requires management citation external file generate software thessaloniki 27 animals farm university veterinary ngiadinivetauthgr clinic 546 aristotle faculty medicine greece activity browsing empty recording activity turned recording turn back information usa 20894 center pike
fd1bnN	1	IL	media social 2011 day awareness mental exposed percent children develop young event health traumatic problems adulthood 18 months single 35 behavioral emotional childhood families providers dealing community resilience visit young children trauma learn http1usagoveurfx5 demonstrate adulthood1 exposed ages problem2 persistent psychological single children mental develop percent young event health potentially
waWExn	1	IL	apod 15 january magellanic infrared large portrait cloud 2012 fascinating discover featured written image explanation day photograph astronomer cosmos universe professional january 15 2012 herschels remarkable show infrared distant galaxy young galaxys views 160000 easily clouds cooler large stopped activity telescope images blue herschel spitzer space ways nebula contributed tend
xvfa69	1	IL	bmc educ ncbi med mobile medical momed pubmed education 2012 function web ncbi javascript site warning requires management citation external file generate software school medical sussex uk east brighton questions supported underlying learning technology information clinicians needed initial opportunities access clinical conceptual setting underpinning patient offer students learn pedagogic uptodate
aOUWj2	2	IL	oil fatty ncbi database syst fish acids rev cochrane 3 pubmed 2007 omega fo function web ncbi javascript site warning requires management citation external file generate software division hepatology ontario gastroenterology nutrition 555 hospital danturnersickkidsca toronto m5g sick ave 1x8 canada children university beneficial inflammatory fish chronic disorders antiinflammatory oil
vnrjr0	5	IL	great paterson national park falls historical search industrial played national site revolution nations parkhome industries power service role 7 largest interior 2011 jarvis economy ken building spectacular park waterfalls designated falls director key november shaping jon great harnessed americas american salazar 397th secretary twitter sign follow paterson events great falls
6MDKYT	3	IL	assembly watch general video indiana skip navigation ingov displayed disabled message note 1 2 css information read policies standardscompliant browser resolution constitute video result council ic legislative provided profit adopted assembly intended permission commercial meaning part intent purpose coverage general enacted tangible 2511 person benefit act audio expression history support
yry19R	1	IL	publicprivate partnership continuing day blog news fema partners refreshing federal sense hear coming makes comment accordance comments blog moderated policy femas links nongovernment social applications web fema provided reference media companies sites endorse msgdata washington street apply management prepare federal rates homeland department 4fema emergency dc 43362 20472202 sw agencyus
xyLTVp	3	IL	website serving district 5th georgia lewis congressman john congressional search 14 hr bill number search word healthcare phrase homeowner american stand time corner walk people daily reality parents life families america paying georgia sacrificing taxes time country justice injustice threat receive sign updates email office lewis message click issues legislative
q89sjE	7	IL	10 apod band milky july 2011 fascinating discover featured written image explanation day photograph astronomer cosmos universe professional 10 july 2011 reside digitally rest visible bright disk galaxy nebulae northern addition panorama sky degrees stars clusters exposures lanes spectacular explanation emission dark band 90 scrolling diffuse matter display exists independent
zYSmt8	7	IL	ncbi gliadin scand pubmed 2006 gut permeability zonulin gastroenterol function web ncbi javascript site warning requires management citation external file generate software division biology mucosal md center nutrition gastroenterology university school usa research celiac pediatric medicine maryland 21201 baltimore gliadin epithelial zonulin investigated barrier mechanisms effect crosses signaling interaction cells
zMJTKE	1	IL	dusts mists gases vapors fumes 192655 192655a industrial threshold concentration avoided conference absorption section hygienists airborne governmental ingestion values material appendix exposure substance inhalation employees 1970 american contact limit skin contaminants 192655b industrial engineering full hygienist implemented technically section controls equipment administrative achieve protective measures qualified purpose competent feasible 1926103
wICmQR	17	IL	closest dione mission solstice cassini flyby images home image details instruments dione pass surface visible primarily images flyby carthage moon spacecrafts camera moons image higher cassini earlier intended closest cassinis encounter 2011 obtained narrowangle 12 light yield flybys dec resolution linea dione 1123 top 698 epimetheus 113 cassini 86 image
yqh8TP	1	IL	task processing force visitor travel executive foreign white visa goals house establishing order competitiveness state union video watch enhanced transparency commitment browse house white logs visitor wait executive actions president obama federal receipt tax federal dollars tax spent people petitions create sign house inside white tour interactive house white office
zY4wqz	3	IL	ncbi predict 18fdgpetct failed interim blood outcome pubmed 2012 function web ncbi javascript site warning requires management citation external file generate software italy san ppregnomolinettepiemonteit giovanni hospital hematology turin 88 2 corso battista university bramante firstline twoyear results dichotomous 015 controversial petct 691 ratio progressionfree 28 4 versus worse survival
eWgcf3	1	IL	web federal fafsa deadlines student aid colleges federal pay attention deadlines state deadline legal student year click school applying residence deadlines state enter aid view dakota nevada prince wyoming minnesota micronesia rico edward alberta puerto maryland marshall texas carolina iowa saskatchewan michigan utah virginia hawaii qc ohio samoa newfoundlandlabrador quebec
nphuEE	1	IL	plant ncbi res mir168a specifically cell pubmed exogenous mammal targets 2012 function web ncbi javascript site warning requires management citation external file generate software pharmaceutical jiangsu center state university school biology nanjing research sciences engineering china key laboratory biotechnology life microrna chinese ldl abundant previous mirnas removal enriched molecules stable
xftVG8	3	IL	apod star january factory 18 cygnus workings nearby 2012 fascinating discover featured written image explanation day photograph astronomer cosmos universe professional january 18 2012 infrared colors disperse winds galaxy astronomers swan sky prominently collide bubbles years entire lies cygnus large night translated telescope humans inflated constellation blue dense space sun
ux6Pad	1	IL	profile ncbi intragraft 2010 pubmed gene expression genesis function web ncbi javascript site warning requires management citation external file generate software poland medical general transplantation department surgery university warsaw responsible caused displayed dendritic integrity polarity 20 immune treatment allograft peptide recipients survival dc possibly inhibition structural modulator chronic tolerance cyclosporine
rHWEzH	1	IL	med management phys ncbi arch pos pubmed intrathecal rehabil baclofen 2006 function web ncbi javascript site warning requires management citation external file generate software houston usa tx institute research brain stroke program 77030 injury rehabilitation cindyivanhoememorialhermannorg spastic itb obtain poststroke qol quality impact intrathecal safety baclofen function life efficacy evaluate
p4acsW	1	IL	animals chinese edsitement zodiac presented share chinese dragondance dragon credit commons wikimedia birth chinese focus years symbols human find astrology finally based chosen add personality animal made 12th versions list popular discussing people back sign born horoscopes year calendar christ ways millennium lunar heavenly reading contrast refer led associate combining
wB06KK	1	IL	apod 17 january nebula head 2118 witch ic 2012 fascinating discover featured written image explanation day photograph astronomer cosmos universe professional january 17 2012 atmosphere caused bright nitrogen fine glows rigel sky orion molecules trouble oxygen shaped scatterers constellation blue nebula daytime red burn witch 1000 color image reflected cauldron
zCL1H3	1	IL	notice peace emergency terrorists process continuation national house middle white respect east threaten disrupt state union video watch enhanced transparency commitment browse house white logs visitor wait executive actions president obama federal receipt tax federal dollars tax spent people petitions create sign house inside white tour interactive house white office
AqtEBG	1	IL	haematol incidenc ncbi addition reduces pubmed br rituximab 2012 function web ncbi javascript site warning requires management citation external file generate software division school hematologyoncology center usa zagreb joarmitaunmcedu university microbiology ne email medicine nebraska croatia internal department pathology medical omaha activity browsing empty recording activity turned recording turn back
wjW3HY	1	IL	twelve wisconsin reuse dnr reduce article recycle news tips 2012 weekly resources current topics licenses permits regulations statewide trapping fishing hunting kids website educators nature encourage learning fun children educators fire landowners health forest managementtopics activities lands activitiestopics parks outdoor management property managing spills air environmental cleanup protectiontopics waste quality
sLKizj	1	IL	med patient exam ncbi activation gen matter intern pubmed 2012 function web ncbi javascript site warning requires management citation external file generate software 97405 management 1209 usa university oregon jessicaguoregonedu policy planning department public eugene managers manage related outcomes confidence knowledge activationor health samples care awareness patient healthrelated small selfreported
A1MDU3	1	IL	coral virgin reef monument islands national search reefs lands system mile belt federal support complex virgin 3 health mangrove john survival contribute shoreline forests waters monument includes reef ecosystems island coral segrass st beds diverse submerged islands life habitat crustaceans fish worms marine grow homes form mollusks create corals colonies
AnkFiD	6	IL	acad sci ncbi resistance pubmed insulin cellular natl 2009 proc function web ncbi javascript site warning requires management citation external file generate software australia street institute medical klh8stvirginiaedu darlinghurst research program 384 nsw garvan obesity victoria 2010 diabetes caused resistance poorly rapid rapidly parameters production defining superoxide results uncouplers cellular
wJKNXv	1	IL	100 trilogy respironics ventilators recall class 11 october initiated recall date 2011 product 30 april manufactured trilogy february ventilators 1 100 2011 ventilator home hospitals nursing support trilogy ventilation health breathing weighing intended continuous respironics ventilators adult 100 care 11 homes intermittent require pounds patients pediatric mechanical settings serial numbers
p36qT	4	IL	information source reliable find healthfindergov health services website hyperlink nongovernmental direct application hhs consistent hyperlinks states services human subject information hyperlinked united application contained health endorsement department website intended provided visitors external constitute applications privacy appearance practices products policies purpose link redirected connect home library questions care center doctor health
ynfZCq	1	IL	transcriptions state missouri secretary evolunteers map search skip site content contact opportunities directions employment enable turned web settings fully utilize application scripting browser evolunteer records sos archives services home account evolunteer provide completed access registration user namepassword register password forgot logging problems archvolsosmogov questions email info web privacy government sosmogov
A8Qi4Q	1	IL	management ncbi spine pa pubmed early phila whiplashasso 1976 2011 function web ncbi javascript site warning requires management citation external file generate software toronto school dalla lana pcoteuhnresearchca institute university research ontario health western canada hospital public literature review narrative commentary iatrogenic early whiplashassociated perspective discuss management epidemiological disorders lead
qJsLGg	1	IL	wage statistics 2010 increases automatic development awi result national including w2 table wages contributions subject wage index based federal forms call income tips summarizes plans excludes employers reported awi net included includes beginning 1991 excluding average taxes 2010 deferred compensation components distributions computed number 50 earners table estimated wage based
b2UtUJ	1	IL	picture astronomy day fascinating discover featured written image explanation day photograph astronomer cosmos universe professional 10 2012 caused produced rocked enjoyed captured la rose flash sea 2012 lighted rise coast world harbor night preceded frame video enhanced supervillains sun recorded moon shows full favored restrictive strong super colored timelapse brittany
iicAnS	1	IL	physician acad ncbi webbased med engagement 2010 associat pubmed cme function web ncbi javascript site warning requires management citation external file generate software division usa medical kcrenshawuabedu continuing 352940019 birmingham alabama education university investigate webbased measures levels association diabetes physician educational baseline engagement patients participants intervention hemoglobin family physicians september
zbNMdZ	1	IL	uscis teachers citizenship links educators process developed learning find information variety support classroombased opportunities role test critical resources development play started helping explore adult supplemental uscis naturalization prepare immigrants options materials teachers professional efforts volunteers section classroom uscis instruction supplement multimedia materials print find handouts plans civics games download lesson
zROYkR	2	IL	sell rico approves application ftc health services puerto universal assets comment san proposed companies universal period order including originally sell united application federal corporation hospital centers approved members ftc health puerto public settling outpatient psychiatric anticompetitive donald services affiliated trade dizney assets rico charges medical required capestrano commission david divestiture
w4Wqfe	1	IL	garrett scott congressman news composed senate house washington states legislative united federal representatives 3 branch hundred meeting twelfth 2013 scheduled congress government dc 2011 january meet nearest office scott click electronically garrett visit location online details page contact congressman est fax 202 hob office washington rayburn dc 2259048 hours phone
8ZTR7S	1	IL	blind 11 perform white boys house alabama state union video watch enhanced transparency commitment browse house white logs visitor wait executive actions president obama federal receipt tax federal dollars tax spent people petitions create sign house inside white tour interactive adobe player flash content download view february 09 2010 240
