mPPzep	1	CA	lutein ncbi consumption nutr increases pubmed 2006 serum egg day function web ncbi javascript site warning requires management citation external file generate software lowell usa ma center university nutritional disease research sciences clinical health massachusetts department laboratory 01854 ldl 5wk chicken runin 26 macular source lipids rich degeneration affected increased
fU0iNs	4	CA	home stopbullyinggov register free webinar report cyberbullying bullying lgbt youth kids bullying youth special warning signs 8255 feel skip sleep helpless suicide ways call sick hopeless 1800273talk bullying affect school lifeline thinking lose feeling updates site sign school network premiere dc bullying middle documentary cartoon speak impact examines justice bullying
gSKQqY	1	CA	nih extramural nexus regional portland seminar 24 25 handson friday 23 workshops june wednesday thursday 2day regional computer era date seminar waterfront marriott portland location oregon national site held grants institutes electronic portland seminar web funding 23 optional administration research program health 2010 today nih workshop regional june 2425 oregon
1748in	1	CA	federal dashboard 10 thursday 2012 color spending make animation scatterplots tool agencies column trends analysis graphs time comparisons interactive chapter information read budget presidents technology government spending fy report download federal 2013 general technology information federal details public stakeholders website agencies industry enabling dashboard investments view decisions investment information management
gPVUfV	1	CA	abscess superficial full drainage study wound clinicaltrialsgov packing text skin view managed skin children superficial resources return emergency material school systematically drainage soft inside abscesses missed cavity routine complications checks opening packing healing improve entailed studied days place advantageous decrease stretched determine recurrence utilization rates painful wounds promote room incision
w3vFX9	1	CA	pyramid usda food fnicnalusdagov myplate resources nutrition usda policy promotion center mypyramid guidelines primary myplate easytounderstand americans group consumers cue build 2011 consistent plate eating food symbol june encouraging visual governments healthy adopt 2010 habits replaced dietary society education nutrition incorporate educators guidelines myplate dietary americans education find content online
I3NjuK	2	CA	physicians perspectives emergency med ncbi pubmed medicine 2011 palliat function web ncbi javascript site warning requires management citation external file generate software usa center cedars medical sstone90064yahoocom angeles los 90048 ca sinai appropriately prioritized urban underwent focus related challenges included perspective responsive education educational perspectives leading hospital range los participants
bR7KKu	2	CA	center tornado watch prediction 186 storm status 186 report watch messages information network service national warnings visit iwin weather interactive 40 mod 20 low 50 mod 30 mod 40 mod 30 mod high 70 f2f5 probability forecaster 70 60 table event increased category tornadoes probabilities issuing 5 low moderate events
JGrXVi	1	CA	pr genetics ncbi biochemistry outreach pubmed integrated 2012 function web ncbi javascript site warning requires management citation external file generate software biology colorado usa biochemistry university 805231870 state department collins molecular fort impression developed experiments broader reasoning impact majority young late program achieve motivated increased yeast material introduce biochemical vast
JMKNas	2	CA	current uscert activity highimpact web current incidents regularly updated reported types summary uscert activity security page frequent multiple apple released updates safari address vulnerabilities products security os code crosssite obtain information perform vulnerabilities privileges elevated attack attacker condition execute denialofservice exploitation sensitive arbitrary operate scripting articles mitigate users ht5281 encourages
Is0H8Q	2	CA	eagle apod 16 nebula april kitt peak 2012 fascinating discover featured written image explanation day photograph astronomer cosmos universe professional april 16 2012 tagged nebula years bright winds cold 20 young pillars window remaining dark walls visible colors specific kitt round telescope back arizona globules constellation blue cavity lightyears closer
GCbvnZ	1	CA	resource form submission stopbullyinggov opinions communication abusive directly copyrighted owner accepted personal vulgar legislation submit add individuals resources posting permission material promote organizations target science require specific considered determined demonstrate harm links suggestions related evidence hosted government offensive research content materials inventory foundation terms commercial reflect groups services bullying language
qQj0K	1	CA	information recreation camping federal recreationgov tour reservation great outdoors visit americas great outdoors visit americas great outdoors visit americas great outdoors visit americas great outdoors visit americas wilderness oasis swimming beach desert alpine mountain wildlife land rocky national arsenal haven flourishing toxic piece refuge reasons states resorts mountain united forests
mNYfwY	1	CA	heart living healthy live healthfindergov health learn quick guide connect website hyperlink nongovernmental direct application hhs consistent hyperlinks states services human subject information hyperlinked united application contained health endorsement department website intended provided visitors external constitute applications privacy appearance practices products policies purpose link redirected information usaccessibility privacy mapcontact act
JWLBts	3	CA	house national white teacher finalists year president obama honors 2012 state union video watch enhanced transparency commitment browse house white logs visitor wait executive actions president obama federal receipt tax federal dollars tax spent people petitions create sign house inside white tour interactive adobe player flash content download view 24
3YWS2N	3	CA	living healthfindergov healthy wellness guide live health learn quick everyday connect website hyperlink nongovernmental direct application hhs consistent hyperlinks states services human subject information hyperlinked united application contained health endorsement department website intended provided visitors external constitute applications privacy appearance practices products policies purpose link redirected information usaccessibility privacy mapcontact
rHWEzH	1	CA	med management phys ncbi arch pos pubmed intrathecal rehabil baclofen 2006 function web ncbi javascript site warning requires management citation external file generate software houston usa tx institute research brain stroke program 77030 injury rehabilitation cindyivanhoememorialhermannorg spastic itb obtain poststroke qol quality impact intrathecal safety baclofen function life efficacy evaluate
IIu7SR	1	CA	geo2r function enable tool javascript warning learn requires compare ordered results identify table expressed samples significance conditions full genes groups instructions presented geo2r differentially order experimental applied logtransformation tab data options change box table distributions viewed plot calculate selected samples mediancentered crosscomparison number graphically data summary determining distribution suitable exported
hbkNxK	4	CA	living eating healthfindergov healthy live learn quick guide connect website hyperlink nongovernmental direct application hhs consistent hyperlinks states services human subject information hyperlinked united application contained health endorsement department website intended provided visitors external constitute applications privacy appearance practices products policies purpose link redirected body eating means diet stay minerals
HFTEus	93	CA	house white april photo day 2012 state union video watch enhanced transparency commitment browse house white logs visitor wait executive actions president obama federal receipt tax federal dollars tax spent people petitions create sign house inside white tour interactive house check april offices photo 2012 picks white day official house
nhzgOZ	1	CA	ch ncbi eggs nutr pubmed increases dietary cholesterol 2008 hdl plasma function web ncbi javascript site warning requires management citation external file generate software usa storrs university nutritional sciences connecticut department 06269 ct hyper results hdlc assigned carbohydraterestricted including 134 group 28 0 mmoll 2401 decreased plasma increased mgd evaluate
HAjg0w	1	CA	mission hazy solstice cassini orange orb images home image details atmosphere titan visible pole cassini images hood blue bottom suggest top faint haze layers detected moons orange recent image polar north hazes beginning titans flip vortex learn south view north 5150 titan kilometers 3200 antisaturn miles side view color image
ooJ3SD	4	CA	prevent stress healthy manage problems live healthfindergov health learn quick living guide connect website hyperlink nongovernmental direct application hhs consistent hyperlinks states services human subject information hyperlinked united application contained health endorsement department website intended provided visitors external constitute applications privacy appearance practices products policies purpose link redirected control feel
H11HEr	3	CA	3827 ocean animation svs perpetual represent 40x 20x global bathymetry begin surface general produced synthesize resolutions transport visualization eddies current estimating systems mit seaice satellite exaggeration insitu oceans carbon bathymetric depths joint heat topographic flows undersea phase ecco2 data land ii climate resolve circulation mitjpl ocean project patterns mitgcm output
JqeC5n	1	CA	ncbi int show chronobiot 2001 chronobiol unicorn pubmed milk function web ncbi javascript site warning requires management citation external file generate software kingdom school united university stocktonontees durham health relevant show rtm statistical milk temperature disorders conclusions explain disturbances chronobiological treat rhythm regressiontothemean guidelines chronobiologists differences artifact aware effects stimulus
IjZNMu	1	CA	apod moon april jupiter io 8 2012 fascinating discover featured written image explanation day photograph astronomer cosmos universe professional april 8 2012 jupiters spacecraft earth recording captured inspiring 10 big front clouds large swirling view 420000 past jupiter pronounced moon millennium body relative equivalent million giant hours jovian kilometers active
HFpUPS	16	CA	grant grantsgov opportunities synopsis opportunity find precedence service disk electronic click information grant provide notification send inconsistency document email resolved notifications printed address opportunity emails change receive thing giving original requestedany modification description represent newest file oldest previous shown documents current document sections files background representing modifications arranged changed list
I7kwrz	1	CA	house white girls stem questions state union video watch enhanced transparency commitment browse house white logs visitor wait executive actions president obama federal receipt tax federal dollars tax spent people petitions create sign house inside white tour interactive edt house 1130am engineering council technology event special girls mathematics white 2012
98Z3gT	2	CA	p3 extramural teams research 20112012 epa content area jump main navigation contact prosperity people extramural research planet phase 1 2 p3 planet recipients grant national people competition 1 sustainability design focusing student prosperity phase 20112012 p3 planet recipients grant national people competition focusing sustainability 2 design student prosperity phase 20112012
J6fgo0	1	CA	med ncbi sports manifestations competing skin pubmed athletes 2012 function web ncbi javascript site warning requires management citation external file generate software usa transitional university hawaii program residency honolulu callosities atopic olympians resistance blisters skin noir susceptible highlights urticarias treatment include 2011 diseases nodules nonmelanoma words categories infrequent medline dermatoses
HEw7sH	1	CA	severity influence medlineplus length pregnancy autism pages related medlineplus born healthday autism symptoms children late 6 weeks friday time news kids study experience april severe prematurely selfinjury inflict found children researchers reasons caused born children unknown 42 severe symptoms weeks gestation suggested study 36 remain fellow underlying postdoctoral human postterm
I6ReqK	1	CA	minority office national standards health culturally linguistically services clas skip navigation accessible providers principles communities individual primarily linguistically encouraged make health served integrated activities partnership culturally undertaken services care directed organizations standards practices organization clas organized themes competent organizational 47 access 814 competence mandates recommendations framework cultural guidelines culturally varying
yqexjv	1	CA	solstice cutoff rings mission cassini images home image details covers 396 visible planets cassini mimas closer image rings miles part kilometers shadow saturn middle 246 left view star speck rings bright mimas ringplane relative increase rings brightened factor southern visibility unilluminated side view image visible spacecraft cassini 27 21 approximately
xaHwUm	1	CA	bioenvironmental airforcecom engineer enlisted officer commission direct officer feature interactive technical training education pay benefits additional education enlisted school diploma opportunities high explore ged healthcare requirementbachelor abetaccredited engineering minimum education institution science operations administration sciencebusiness healthhealth professionalallied healthcarehealthcare medicinenatural prevent greenland illnesses blending focus environments area pads industrial identify develop
1lCZ98	2	CA	multiple 1997 endocrine 1 neoplasia release news gene type cancer national men1 type institutes islet 1 issue leading 18 cell benign health parathyroid scientists discovery nih multiple bethesda endocrine glands journal reported pituitary science md pancreatic tumors identified april team gene neoplasia prevent product design result malignant protein drugs treat
JtXARP	12	CA	hypogonadism mobile erectile pubmed dysfunction nutrition feb 25 julaug277885962 2011 epub nerve deaconess boston peripheral tsiepmannbidmcharvardedu brigham hospital medicine disorders israel usa autonomic department harvard massachusetts beth school center medical womens soyrich previous impact onset monitored knowledge parameters instance veganstyle improvement soybased present decreased presentation paralleled increased combination dehydroepiandrosterone emphasizes
sZYM3s	1	CA	space lets nasas place mars lets mars mars blast click mars blast crew space long journey decide parking 9month earth planet mars spaceship journey ahead orbit red food alive stay water heaters air mars orbiting spaceship beverages favorite foods decide time pass allowed earth fine things gravity problems 10 remember
lMpHvz	8	CA	catalog pia14106 page eyeglasses telescope focus infrared exposes visible viewed light space murky nebula star spitzer brings showing depths nasas formation wear pair stellar clouds lost region dusty rock infants dark vision bright show midwavelength infrared swaths surrounding frames constellation light nebulae cavities orion strikingly glowing interior belt red revealing
HCeqfe	1	CA	apod clouds 17 april antares 2012 fascinating discover featured written image explanation day photograph astronomer cosmos universe professional april 17 2012 diameter niyat nebula globular image years bright cloud 850 m4 sky brighter nebular helps stars expelled explanation gas 550 15 supergiant night called 10000 al brightest constellation blue huge
GAUd9a	1	CA	soc ncbi 1976 differential pers perception social attrib pubmed psychol function web ncbi javascript site warning requires management citation external file generate software perpetrated major violence phenomenon accessible purported sterotypy concept design performed victim threshold attributional blackprotagonist causal situation established dispositional factors videotape observing labeled occuring subjects black 4 ineraction
Ai8U31	1	CA	planets features science sky system exploration solar sunset astronomy technology alignment tony dr phillipssciencenasa feel dash feb winter make sky note uncontrollable 2012 urge read put watchers 17 youre coats evening formationsome solar brightest planets lining sky system leasttonight beautiful sight pop jupiter planets west surrounded sky black blue evening
I9MYJF	2	CA	ncbi introduction review imputation gentle pubmed 2006 clin epidemiol function web ncbi javascript site warning requires management citation external file generate software netherlands center biostatistics rdondersgeouunl university utrecht random results intervals based chosen situations explain source associations handle drawn yield small missingindicator explanations methods estimates idea estimated techniques errors socalled
oPwmki	2	CA	institute management emergency 12 2010 october developed revised states agriculture lessons united group objectives administration compliant ics learned nims national wildfire emergency fire reflect collaboratively department coordinating 100 emi institute 2006 release management successfully purposes review note version equivalent updated completed is100a is100b courses credentialing is100 9 august 2010 features
JCM7Qd	1	CA	body responses plos cells ncbi fat insect pubmed transcriptome 2012 function web ncbi javascript site warning requires management citation external file generate software applied japan tokyo university entomology faculty laboratory technology agriculture terminate results multicellular explain sugar decreased uptake increased fat transcriptome explantderived proteins fewer respond culture individual genomic surgery
I0JgSH	1	CA	toddlers medlineplus trauma learning emotional hurt pages related medlineplus childrens domestic intellectual healthday news trauma witnessing 6 development life friday early suffering abused inhibit study violence april emotional life years impact trauma researchers found occurs damaging domestic intellectual years aged sexual children physical witnessed 2 5 8 suffered development 206
HKHYHI	1	CA	saltier food medlineplus fast overseas page related medlineplus major developed states foods exist healthday united monday sold differences levels news fastfood 16 study countries large april salt restaurants kingdom states burger examined chicken france mcdonalds canada united content pizza hut product australia food sold dominos categories zealand king fried kentucky
zCaLwp	1	CA	apod scale march 12 universe interactive 2012 fascinating discover featured written image explanation day photograph astronomer cosmos universe professional 12 march flash player version recent adobe 2012 bring human galaxy flash proportion window spread discovering humanity descriptive familiar stop speckled possibly items smoothness vast bar sizes large small version ten
I3i3O9	1	CA	comparison conventional acoust multiple ncbi soc acq pubmed line 2012 function web ncbi javascript site warning requires management citation external file generate software box leuven 3000 diseases catholic belgium university uz lab dept imaging 49 dynamics lingtonguzleuvenbe 7003 herestraat cardiovascular results competitive ratio field systems factor main increased lobe beams
foekJb	1	CA	sacramento caltrans cameras traffic area image load camera traffic location button click select view darlingpla roadsac colfaxpla scalesnev 51st stationnev 8980nev 47th ski junction rdsac camino 267 mays bridgepla 50 fanny 49eld 20th truckee el 29th spring aveccf hazelpla stsac street 28th 80 whitmore exposition dutch grantlinesac mayhewsac 50i5sac meyerspla
HYZqbw	3	CA	migraine guidelines medlineplus doesnt works pages related medlineplus prevent dont healthday sufferers headaches debilitating medications 23 migraine dozens monday news study april finds silberstein people developed guidelines society neurology approximately migraines coauthor percent 40 treatment stephen headache academy dr onethird american preventive silberstein thomas overthecounter depends philadelphia jefferson herbal include
Inf0PS	3	CA	pr domain ncbi biochemistry light pubmed variable fluorogen activating 2012 function web ncbi javascript site warning requires management citation external file generate software mellon pennsylvania pittsburgh university carnegie states sciences united department biological 15213 restriction glycine generally magnetic results report experiments human covalent activating localized forms affinity real good yeast
IvsZSY	1	CA	states patent united 8054098 chain number networks andor based response signals sequential combined input include disclosed function arbiters delayed serially circuits output responsively unclonable coupled configured describe challenges design claimed physical provided network generally configurable delay combinatorial configurably techniques chains integrated elements puf logic propagate configuration generate receive embodiments circuit
UT2FE	5	CA	house white state union video watch enhanced transparency commitment browse house white logs visitor wait executive actions president obama federal receipt tax federal dollars tax spent people petitions create sign house inside white tour interactive event live facebook discussion participate click member facebook give click questions comments httpwwwwhitehousegovvideo ondemand library
vgAzde	1	CA	geo2r function enable tool javascript warning learn requires compare ordered results identify table expressed samples significance conditions full genes groups instructions presented geo2r differentially order experimental applied logtransformation tab data options change box table distributions viewed plot calculate selected samples mediancentered crosscomparison number graphically data summary determining distribution suitable exported
IJbRcd	1	CA	frb 25 fomc releasefederal press 2012 statementapril issues reserve release date 2012 25 april sector committee unemployment expanding household signs rate elevated improvement open investment market information federal housing moderately expectations labor remained declined stable crude conditions economy oil march business met inflation prices continued higher picked recent received improved
zr5BNb	1	CA	med sci ncbi enduran sports exerc strike pubmed rates foot injury 2012 function web ncbi javascript site warning requires management citation external file generate software lb evolutionary boston 3university auburn services street 65 human research avenue 81 divinity usa 2department system 02163 health central suite care 500 biology north 4baylor
sziwXY	1	CA	case space science beware nasa scientists evildoers story realplayer requires listen ala including paul captured police tv storms crime systems downtoearth stable dramatically plate seeking number dark worlds security view hathaway footage crimes computer video images home space sun cameras scientists recently august reveal cars clues invented improve license created
HWSwU6	1	CA	states patent united 6920619 upwardfacing proximity move years shape touch speed children system childproof location easy puzzle touching hideandgoseek determine throwing threshold displays images matching loudspeaker selected manipulations contained finger sensor assembly vertical selecting screen sensors thrown parts motion image modifying neighborhood manipulate removing dropping touched direction senses tapping child
I7grTn	9	CA	continuing hazards eruption natural shiveluch volcanic surrounding earth weeks 2012 radial active ash shiveluch streaks volcanoes april bursts snow activity left naturalcolor image produced visible winds alignment 22 top deposits spectroradiometer 4 eruptions collected direction vaguely lengthier satellites melting streaks determined streak stronger result images snow moderate revealing modis satellite
I5At1E	1	CA	epa beach beaches pollution content area jump main navigation contact water beaches heavy severe due past sources occur shown monitoring damage treatment flooding beach events rainfall plant infrastructure problems collection disruption hurricanes malfunctions confined develop areas infrequent natural local wastewater studies sewage pollution limited directly states linked information monitoring safety
JzyWzl	6	CA	restriction intake greater ncbi energy nutr dietary im pubmed 2012 function web ncbi javascript site warning requires management citation external file generate software kinesiology health department restriction urine ptm assigned proximal integrity als volumetric group density exercising 4 8 libitum maximal protective increased 3 food intake effects implicate weights histomorphometry
x59W6H	2	CA	grant grantsgov opportunities synopsis opportunity find precedence service disk electronic click information grant provide notification send inconsistency document email resolved notifications printed address opportunity emails change receive thing giving original requestedany modification description represent newest file oldest previous shown documents current document sections files background representing modifications arranged changed list
