J4JPoI	1	CA	report science nsfgov special nation scales guided johns mathematicians assembled structures brown interdisciplinary showing md sizes university micro small 3d engineers smaller challenging breakthrough fold nanometer straightforward research machine providence build ri higher led polyhedra threedimensional assemble box hopkins macroscale length order baltimore precise stones promises human remarkable folds assembles
oWeDBN	1	CA	photography astronaut earth gateway brightly expedition madrid northeastern canary middle 015224 pass north france peninsula northeast stands space west sequence 28 crew station board gibraltar international 2012 strait begins ends march sahara continues southern iberian dark atlantic western islands balearic spain 30 ocean pyrenees shots video gmt 015922 photographs high
omNQN3	1	CA	text clinicaltrialsgov bcell genetically chemotherapy full lymphocyte leukemia engineered therapy lymphoma treating resistant refractory patients view cancer kill laboratory make placing immune build white body blood rationale response created cells gene bcell trial studying clinical genetically chemotherapy lymphocyte leukemia engineered therapy purpose lymphoma treating resistant refractory patients anticd19car unacceptable disease
IvhY3Y	1	CA	tu ncbi hepatic future treatment pubmed oncol developments 2012 function web ncbi javascript site warning requires management citation external file generate software catania italy cannizzaro organ 95126 university messina sciences surgical transplantation 829 department technologies hospital advanced newest held including japan nicolas knowledge interesting surgeons program treatment evidenced struck 2011
a7GSj1	1	CA	national dna day national year human helix completion genomics dna 2003 commemorates genome 2012 public dnas students 20 genetics unique day nhgri celebrate double project april teachers learn discovery read answers questions chatroom transcript check 2012 essay dna contest winners day 2012 600 equipment2nd 1st laboratory equipmenthonorable genetics grant equipment
GL1q4I	3	CA	catalog pia15415 page brightly image tendrils lies remnant full lightyears galaxy size constellation nebula sky 1500 moon hot extends swans ago 5000 explosion explorer tucked supernova night gas occurred stellar nasas ultraviolet dust years 8000 glow evolution wispy wings cygnus times massive loop left spreading filaments visible bright earth heated
HSFU0C	35	CA	family house national white visits americas parks tourists state union video watch enhanced transparency commitment browse house white logs visitor wait executive actions president obama federal receipt tax federal dollars tax spent people petitions create sign house inside white tour interactive beautiful family check visit shows places photos place country
HPX3u4	18	CA	apod flight deck 18 space april shuttle endeavour 2012 fascinating discover featured written image explanation day photograph astronomer cosmos universe professional april 18 2012 atmosphere endeavour deck visitor human chair speed controls fly greater sitting virginia thrill kennedy shuttles national machines space chantilly numerous pictured discovery youngest contemplate california thirty
bL1F2v	1	CA	teaching national dna day tools ethical family show topics forensics human dna legal research genome covered advances sequencing microbiome epigenetics implications project slide social 2009 history mb slide 2009 40 show ethical show topics sense issues current make legal research 1 2 genome influences covered function snps dna made proteins
Icrt5n	2	CA	early ncbi echocardiography detection strain pubmed isrn pediatr 2012 function web ncbi javascript site warning requires management citation external file generate software cardiology egypt university pediatric tanta 31111 unit doxorubicininduced pulsed ptd results years children 25 longitudinal controls lv detected treatment global early difference 2dst acute echocardiography prolonged 2d investigate
rdbbCQ	1	CA	mission solstice cassini south images home image details 313 terrain farther north shown craterfilled area leading 45 degrees longitude moons latitude 504 meeting polar recently centered saturnfacing hemisphere kilometers active mosaic created region older 35 miles geologically west enceladus shows side south view acquired image feet visible spacecraft meters cassini
HmQU3Q	3	CA	catalog page pia15254 agencyled telescope instruments image mission infrared dust spanning contributions galaxy herschel giant combined space data nebula ripples cloud fiery tens tarantula ribbons european explosion dwarf spitzer fire center hundreds important formation brightest significant circular magellanic centerleft nasas fields observatory doradus noticeable visible light region 30 appearance called
K5bffN	1	CA	geo2r function enable tool javascript warning learn requires compare ordered results identify table expressed samples significance conditions full genes groups instructions presented geo2r differentially order experimental applied logtransformation tab data options change box table distributions viewed plot calculate selected samples mediancentered crosscomparison number graphically data summary determining distribution suitable exported
JkdQWc	1	CA	house white state union video watch enhanced transparency commitment browse house white logs visitor wait executive actions president obama federal receipt tax federal dollars tax spent people petitions create sign house inside white tour interactive event live facebook discussion participate click member facebook give click questions comments httpwwwwhitehousegovvideo ondemand library
GD9Gok	1	CA	directed programs highlights medical related research program deployment congressionally bloodposted march raymond biotechnologies system goodrich phd reduction lakewood colorado treatment caridianbct 15 transportable pathogen 2012 storage including injuries group operational program screening leukocytes risk recipients loss deployment dr advanced severely transmission large team viruses injured leukoreduction testing related parasites rate
I3i6t3	3	CA	heart ncbi valve cardiovasc pubmed imaging aortic 2012 assessment eur function web ncbi javascript site warning requires management citation external file generate software italy sciences university thoracic cardiac 2 padua vascular department 35128 giustiniani interpretation implementation capabilities conventional diseases primary procedures discuss echocardiography view principles subject clinicians review valve current
H8mVio	1	CA	tide pools wildlife watchable 1995 marchapril garrisonoutdoor california bob show cold boasts perfect support plastered environment microscopic rich hidden lowest harshness life void nutrientrich plants worlds animals rocky rocks miles glance 1100 pools beneath diatoms habitat exposed species huge provide feat wavebattered amazing waters multitude tides richest hundreds california stew
yqh8TP	2	CA	task processing force visitor travel executive foreign white visa goals house establishing order competitiveness state union video watch enhanced transparency commitment browse house white logs visitor wait executive actions president obama federal receipt tax federal dollars tax spent people petitions create sign house inside white tour interactive house white office
aavG8x	11	CA	encke ringlet mission gap solstice cassini images home image details equinox august planets ringlets ring shadows cast parts thin 2009 acquired image cassini visible spacecraft 1 scale northern rings ringplane approximately jan camera degrees 6 8 2010 million distance 9 kilometers saturn narrowangle 17 16 light pixel unilluminated miles side
I53NFs	7	CA	apod 22 dunes mars april sand barchan flowing 2012 fascinating discover featured written image explanation day photograph astronomer cosmos universe professional april 22 2012 summer atmosphere move winds fine blow monitored hills cousins storms forms image kick dark famous streaks large sand spring freeze pass intact dunes escalate hill flowing
rieB3Q	1	CA	apod september 4 saturn 2011 shadow fascinating discover featured written image explanation day photograph astronomer cosmos universe professional september 2011 4 discovered bright earth scattering giant saturns main spectacular outermost dark shadow saturn spacecraft night side view unexpected hard back eclipsed pale blue sun rings moon orbiting newly hours silhouetted
eCahzZ	1	CA	observatory features solar animations dynamics sdo gallery meridional magnetic illustrate visualization sun toroidal combination component fluid flows solar drive considered components dynamo code illustrates color move corresponds takes helioseismology cutaway fluid period solar crosssection rotation rotational differential toroidal side view slower equator surface violet techniques righthand sun make streaking poles
ItZCSi	2	CA	sci ncbi atrophic gastritis dig strategy pubmed 2012 surveillance dis function web ncbi javascript site warning requires management citation external file generate software korea seoul university medicine internal college department hallym examinations metaplasia methods cancer gastritis high intervals area prevalence clinical screening investigated atrophic practice suited gastric clear patients intestinal
7bsP1P	4	CA	pittsburgh pennsylvania nws advisory outlook screenlogicalydpi screenlogicalxdpi rtn watches freeze screendeviceydpi warning edt click fri rtn1 forecast read advisories internet var returnrtn 2012 function map 123322 warnings hazardous frost update screendevicexdpi inity initx 11 zoomout explorer weather browsernavigatorappname browser microsoft latest hour decision forecasts weather making collected stormrecord reports information
3PCcw0	3	CA	house contact white state union video watch enhanced transparency commitment browse house white logs visitor wait executive actions president obama federal receipt tax federal dollars tax spent people petitions create sign house inside white tour interactive submit comments questions online accessible committed questions open administration comments public website creating president
IvwoCO	1	CA	meteorologists blog severe planning perspective weather fema preparing tom work excellent comment accordance comments blog moderated policy femas links nongovernment social applications web fema provided reference media companies sites endorse msgdata washington street apply management prepare federal rates homeland department 4fema emergency dc 43362 20472202 sw agencyus security500 6462500text tty
w38w6h	1	CA	relationships ncbi amo gender differences coll pubmed health 2012 function web ncbi javascript site warning requires management citation external file generate software development usa human johnson city university state tennessee learning department bartonetsuedu east 37614 examined indirect depression style increase source role styles differences relationship attention parenting increases levels focused
IxoS91	1	CA	healthfindergov newsletters weekly connect website hyperlink nongovernmental direct application hhs consistent hyperlinks states services human subject information hyperlinked united application contained health endorsement department website intended provided visitors external constitute applications privacy appearance practices products policies purpose link redirected home health news childs turned healthday alternative abandoning asthma research parents
IqWVxa	1	CA	house white state union video watch enhanced transparency commitment browse house white logs visitor wait executive actions president obama federal receipt tax federal dollars tax spent people petitions create sign house inside white tour interactive event live facebook discussion participate click member facebook give click questions comments httpwwwwhitehousegovvideo ondemand library
JdDZ9e	13	CA	emotion brainderived regula ncbi pubmed fatigue physiol front 2012 function web ncbi javascript site warning requires management citation external file generate software town biology science university africa research department unit human medicine cape uctmrc sports south exercise proposed athletic saves brain attempts predicts decisions decade superior rapidly physiological nervous explain
2UCCtN	2	CA	fdsys browse uscode code codification house general states edition titles 1926 years subject information united office broad divided representatives current subjects subsequent main revision permanent cumulative 1934 law present counsel annual 51 editions matter supplements published order laws code office house information gpo verify representatives virtual research contained version editions
cGrDeG	1	CA	production industrial capacity utilization month 138 industries based 21 rose production 2012 march increased broadly excluding level 54 output quarter past rate result year 83 declined 02 capacity jumped mines manufacturing 104 gained 786 38 industry months unseasonably major industrial motor total utilization percentage mining warm gain 966 15 17
IeYIVG	1	CA	ncbi drugs dermatol vitamin topical oxide pubmed role 2009 gel function web ncbi javascript site warning requires management citation external file generate software englewood colorado usa university dermatology jcohendermyahoocom department methods results satisfaction sought duration efficacy topical procedures acceptance shorten oxide safety induced patient barrier vitamin cosmetic facial gel laser
Jmouvy	24	CA	chemical mission factory solstice investigates cassini titans features factory chemical investigates cassini home news titans chemical titans investigates factory cassini apr 24 2012 chemical titans investigates factory cassini hydrocarbons atmosphere titan environments celsius hides thick factory giant saturns brutally temperature smoggy system moon chemical complex degrees scientists 170 cloak form
JssYlH	1	CA	states patent united 8094026 activate file clip food site thereof tag video determine shopping electronic contents information system send surveillance environment identification condition method store enforcement product multiple web track camera view alert process link theft law security merchandise purchase stolen remote desired url alarm list devices large mobile items
5IVZff	1	CA	web student aid prospective links college learning information funding variety graduate current opens shouldnt door applaud attending complicated efforts school helpful students office variety education information eligible federal pay graduate click campusbased students consolidation student aid loans stafford programs youre professional funds download word sheet additional pdf tips fact actively
bGiVgQ	2	CA	dale vice house announces disability biden joe assistant policy president white special kareem state union video watch enhanced transparency commitment browse house white logs visitor wait executive actions president obama federal receipt tax federal dollars tax spent people petitions create sign house inside white tour interactive homeowners refinancing house twitter
HivTHj	4	CA	infographic cbo program asset report troubled relief contact cbo 28 march 2012 110343 stabilization office omb days cbo semiannual stability economic financial elements guarantee established 45 promote prepare section treasurys legislation tarp submit discuss purchases program asset treasury department troubled markets public 202 division enable emergency assessment guarantees management issuance
JvEtcU	4	CA	med respiratory ncbi preve pubmed health br sports elite athletes 2012 function web ncbi javascript site warning requires management citation external file generate software brunel uk centre university sports uxbridge human medicine performance pollutantsirritants caused dehydration strenuously chronically asthma susceptible risk early progression demonstrated remains upper andor exposed reduce implemented
2PpqOv	1	CA	people disabilities functional access fema planning preparing family functional close additional disability access emergency protect steps office functional community special provided needed assistance disability find access fire department local emergency services register disaster reference guidelines serve preparedness emergency disabilities guide individuals 689 relief section txt la brou ed agreement 3mb
K6r995	4	CA	house white state union video watch enhanced transparency commitment browse house white logs visitor wait executive actions president obama federal receipt tax federal dollars tax spent people petitions create sign house inside white tour interactive event live facebook discussion participate click member facebook give click questions comments httpwwwwhitehousegovvideo ondemand library
wrNexb	1	CA	sci ncbi med sports exerc pubmed effects strike 2012 type footwear function web ncbi javascript site warning requires management citation external file generate software 11 biology evolutionary divinity usa university harvard cambridge human department ma avenue 02138 rearfoot shoes differs forefoot heels elevated strike supports minimal economy versus tests standard
IjKzdj	1	CA	firstever administration 29 dc states department ribbon green names schools obama education 78 house sutley states including council chair education quality ribbon jackson duncan agency 29 department announce white today administrator arne dc environmental protection schools span firstever 78 list joined green nancy lisa secretary elementary dcs announcement school made
qSkIlE	1	CA	catalog pia14731 page years earth remarkably galaxy poorly ngc stars 281 gas exception cluster pumped found unfettered view energy understood lifetime giving responsible astronomers located highmass star important formation dust obscured light 6500 rule plane 1000 deaths image powerful infrared supernovas seed winds galactic galaxy blue environment eventual ngc purple
hP761a	1	CA	soc turning goal ncbi selfregulation pers 2001 setting pubmed psychol function web ncbi javascript site warning requires management citation external file generate software psychology usa 10003 university york department bettingenpsychnyuedu pertaining relevant people discussed supported commitment states fantasy experiments unfavorable quality plans emerges light goal leads effort expectations reality setting
yyzL3Z	1	CA	march media social day awareness 2012 people bisexual streets homeless runaway victimization percent young heterosexual 334 transgender versus 587 gay lgbtq questioning report lesbian youth providers dealing wwwsamhsagovchildren children friends visit trauma resilient hope families heroes youth learn danger bisexual streets high homeless home streets1 victimization people young rates transgender
Iqn2Yn	1	CA	25 due taxes april half 2012 property bill process penalties tax county ways pay make quickly interest 2012 added monday half conveniently king owners charges 30 taxes easier april property made payments tax tax years year wwwkingcountygovpropertytax information delinquent pay visit current online confirmation option payment property taxpayers bills view
n3QQVg	3	CA	sec form accurate reviewed information necessarily commission reader complete exchange completethe securities assume determined filing 1 identity issuers information business contact 2 place principal persons 3 related clarification response clarification response clarification response clarification response clarification response industry group 4 size 5 issuer federal select 6 claimed apply exclusions exemptions
JsUwrW	7	CA	frs nsf12556 failureresistant systems foundation directorate information science national computing communication cyber communications engineering computer division systems foundations electrical semiconductor corporation research full due deadlines proposers 5 time proposal local pm july 26 2012 issued revised nsf 111 apply funding pappg due 18 1 contained version proposal 2010 guidelines award
qO22	1	CA	return tax free preparation volunteers topics individuals irs resources programs assistance irs tax qualify elderly taxpayers offer free income counseling tce vita volunteer neighborhood people credit filing tax locations elderly disabled located irscertified malls return vita electronic centers special 50000 taxpayers provide convenient make generally sites libraries returns program income
IhLzLy	1	CA	older medlineplus telemonitoring patients pages related medlineplus pittman genevra heart lung electronic monitored reuters health kidney systems emergency hospitalized york werent athome room older study disease patients prevent weight ages check information spending measurements send strategy health systems hospitalizations problems healthrelated early pressure control blood catch population medical daily patients
IeYON4	1	CA	phyt ncbi topical dermatol application pubmed effects 2004 cosmet function web ncbi javascript site warning requires management citation external file generate software school tokyo medical dermatology nippon tmitsunmsacjp department japan circles cosmetic dark infraorbital lower age wrinkles eyelids problem adults japanese phytonadione determine reducing 01 vitamins lower 2 circles retinol
HfcKMf	1	CA	infographic cbo program asset report troubled relief contact cbo 28 march 2012 110343 stabilization office omb days cbo semiannual stability economic financial elements guarantee established 45 promote prepare section treasurys legislation tarp submit discuss purchases program asset treasury department troubled markets public 202 division enable emergency assessment guarantees management issuance
hyM8e2	1	CA	wilderness facility recreationgov gateway details id whitewater heavily lochsa perce feet middle headwaters campground rough located dams selway northcentral clearwater bitterroots station nez forest adjacent powell idaho fork lowell elevation form continuous unregulated water ranger meaning joins worlds wooded 2100 word flow 70mile tributaries river lewis horseback leads mile fishing
H21C19	2	CA	treating nonhodgkin text relapsed tlymphocytes clinicaltrialsgov hodgkin patients full active lymphoma view kill laboratory giving immune build lymphocytes body infusion persons rationale response effective cells tumor treated relapsed dose phase nonhodgkin lymphocytes hodgkin purpose active lymphoma laboratorytreated treating side trial patients studies effects objectives nhl adjunctive group multicenter doseescalation treatment
zPZpYl	1	CA	apod 21 january days sun 2012 fascinating discover featured written image explanation day photograph astronomer cosmos universe professional january 21 2012 summer caused month bright paper radio spells 21st northern chosen sky suns 2011 sunny dark records made years day entire university hemispheres weather fixed view telescope trails gaps sun
IbwrVx	1	CA	ncbi expert rev pubmed anti echocardiogra infect ther 2012 function web ncbi javascript site warning requires management citation external file generate software division rochester diseases usa mayo mn infectious medicine clinic college department proposed accurate reviewed underlying varies presentation guided risk diagnosing timely settings echocardiography 50 mode sensitivity tee individual
JICAnT	1	CA	synthetic ncbi capable polymers heredity genetic pubmed 2012 science function web ncbi javascript site warning requires management citation external file generate software biology cambridge hills 0qh medical research cb2 uk council laboratory molecular road limited evolutionary show stored aptamers alternative based affinity xenonucleic rna evolution hallmarks polymers specific found constraints
H0JY1K	1	CA	raise cancer study medlineplus breast drinking risk pages related medlineplus cancer alcoholic 28 healthday research womans review percent day 5 boost march risk drink breast news existing wednesday drinks percent france increase heavier risk germany italy drinking day researchers 50 concluded cancer related reviewing 113 heavy drinking 50000 alcohol consumption
ndo6OP	1	CA	increased consumption nutr ncbi foods pubmed dairy duri protein 2011 function web ncbi javascript site warning requires management citation external file generate software canada group university research kinesiology hamilton mcmaster department metabolism exercise resistance visceral apld increase ratio participants 0 dairy 8 adequate 816 greater fat premenopausal affect apmd loss
IrorMh	1	CA	benavidez united hispanic army states roy americans heavy antiaircraft enemy intelligence resistance due extract special fire helicopters confirmed 1968 unable extraction west intense 2 forces requested emergency loc attempted 12man activity smallarms met arriving dense inserted largescale land shortly gather morning vietnam jungle team ninh reconnaissance benavidez pickup ran move
Jv4MQB	1	CA	case search repository library nasa studies goddard advanced office questions knowledge comments contact teaching case presented notes request chief nasa officer studies abstract contracting organizational download oci based decision contractor potentially interest issue conflict focuses bid management preparing contractors case study work contract nowsubjects nasa ongoing making centaur67 facility abstract
ag7NbD	1	CA	web student aid financial loan years select 25 generally start choose youll plan student loans 10 depending repaying repay repayment time situation repayment standard month monthly pay repay youll full loans paid standard plan years 10 50 amount payments fixed repaid monthly pay payment interest higher plans standard reason plan
qJsLGg	1	CA	wage statistics 2010 increases automatic development awi result national including w2 table wages contributions subject wage index based federal forms call income tips summarizes plans excludes employers reported awi net included includes beginning 1991 excluding average taxes 2010 deferred compensation components distributions computed number 50 earners table estimated wage based
