hTngiO	1	CA	glacier state recreational site matanuska summer managed rifle rest mile skiing tables parkthe state opportunities extends easy lodge gravel interpretive activities adjacent views 9077455151 12 walk recreation safest scenic river picnic national platforms parking provided nature ice access include pump conditions public highway toilets 300 matanuska water milepost 101 beginning
I7MfTQ	1	CA	ncbi cancer oncologist patients pubmed 2012 palliative advanced care function web ncbi javascript site warning requires management citation external file generate software md boulevard center cancer houston university ebrueramdandersonorg usa medicine anderson holcombe 1515 77030 department palliative rehabilitation texas care control distress cancer show reduce results psychological inpatient cost result
vKdE7J	1	CA	ichg genomes project 2011 tutorial 1000 topics describe tutorial genomes access listed speakers slides data project powerpoint 1000 adobe format powerpoints documents listed reader pdf page view associate gabor marth college professorboston dsc slides institute flicek bioinformatics paul dsc european slides school arbor university min hyun kang professor ann phd
Iup7Bn	2	CA	sec form accurate reviewed information necessarily commission reader complete exchange completethe securities assume determined filing 1 identity issuers information business contact 2 place principal persons 3 related clarification response industry group 4 size 5 issuer federal select 6 claimed apply exclusions exemptions type filing 7 duration 8 offering offered securities
ImzZjf	19	CA	government administration site general gsa auctions services warranted property condition 25hull reportsstatement 3survey doc 2hull thickness intent 1hull sf appointment removal contact property inspection appointment schedule custodian deposit bid terms attachments sale description dates custodian times contact arrangements removal inspection bidders removal loading located responsible awarded cautioned successful packing exact
xXGIJ9	1	CA	february media social day awareness 2012 impair stress ageappropriate capacity mental developmental youths reach ptsd challenges health disorder posttraumatic goals providers dealing wwwsamhsagovchildren children friends visit trauma resilient hope families heroes youth learn juvenile mental prevalence years challenges suffer greater stress1234567 justice generally system noting health rates document numerous higher
cQb7YI	1	CA	plain english air clean act understanding guide epa content area jump main navigation contact plain act air clean english guide states led significant human united air environment improvements health clean act reducing pollution 1970 time air clean act history walking industrial people caused lanterns 3000 carrying thick guides cloud 1948
HQaXO8	1	CA	shakespeares macbeth evil edsitement motives fear presented share acted wade tedious things returning strange steppd head oer hand blood scannd ere lewis image thrust cs sounds darkest imagined secret wonderful terrifying treader wishes true dreams macbeths shadowy predicted situation precipitated mind macbeth lurking dawn voyage darkness describes fears shakespeares power
H5iYIl	1	CA	good 1969 ncbi game individual effects behavior appl anal pubmed behav function web ncbi javascript site warning requires management citation external file generate software university kansas childs recess involved children group winning meant designs lunch game reversal projects loss teams response successfully individual special inappropriate shared reading math tags team
mT0Khu	2	CA	relig iden maternal ncbi surrogate motherhood pubmed health revisited 2011 function web ncbi javascript site warning requires management citation external file generate software university negev center jakobovits ajotkowitzhotmailcom jewish medical israel sciences bengurion health beersheva faculty ethics years paper issues ovum thinking treatment overcome birth consensus initiative fertility ethical set
cQJ6na	1	CA	climate research priorities change epa content area jump main navigation contact climate change research impacts solutions reducing impact provide research health environmental understand changing change adapting climate conducts sustainable epa climate air intricately quality linked change learn sector climate links impacts researchmore qualityblack air researchintegrated carbon technologies glimpseelectric quality operations
I3MHFq	1	CA	building insig ncbi academy rheumatology pubmed education rheumatol 2012 function web ncbi javascript site warning requires management citation external file generate software rheumatology college special cornell hospital burlington medicine division business vermont department york school usa medical surgeryweill university rheumatology identify education factors department division academy key address retreat improve
HZZR9b	2	CA	function cognitive striatal ncbi pubmed controlling human neurosci 2012 function web ncbi javascript site warning requires management citation external file generate software fmrib functional radboud brain nijmegen 9du nuffield united psychology ox1 ox3 clinical department kingdom neurosciences centre neuroimaging behaviour 3ud hb oxford netherlands donders cognitive institute cognition university 6500
I9Ro3x	1	CA	med ncbi echocardiography matern neonatal pubmed role 2012 fetal foetal function web ncbi javascript site warning requires management citation external file generate software gynaecology valme university seville obstetrics department hospital spain 955 ci july stepwise malformation sonography disorders conclusions 95 4147 screening 933 859099 women 2010 evaluate downs morphological results
wdFyf	2	CA	affordable making home map footer skip site content expert learn initiative reductions rate home administrations foreclosure mortgage variety housing options helps interest struggling easier affordable begin transitioning speak explore understand making servicer payment obama modifications refinancing programs homeowners mha deferred relief avoiding aid expectexplore programs mhawhat gathering documentation financial reasons
wXWkBm	1	CA	impr ncbi med medical continuing intern pubmed education quality ann 2012 function web ncbi javascript site warning requires management citation external file generate software toronto canada ontario patient centre sunnybrook university sciences health safety existing touch knowledge improvement systems integrate achieve physicians redesign outlines skills fields cme qi related beneficially
HJujRs	1	CA	solstice time saturn mission cassini dates overview mission tour time home saturn control tabs mission pacific spacecraft cassini laboratory zone space propulsion pasadena calif website nasas complicated saturn keeping jet times converted time definitions noted universal highly maintained clocks atomic year carefully irregularities earths based addition opportunities leap stable coordinated
JvmNsg	2	CA	ncbi mothers activity biol milk pubmed reprod sphingomyelinase es 2012 function web ncbi javascript site warning requires management citation external file generate software 45 sphingomyelin activated digestion impaired milk pcr progeny enzyme asmase1 indicating downstream larva similar increases effects day structural represents adulthood roles mothers nutrients smase yields gut reduced
IBofrJ	1	CA	plant complete ncbi sequence interact pubmed genome mol microbe citru 2009 function web ncbi javascript site warning requires management citation external file generate software pierce usa yonpingduanarsusdagov usdaarsushrl 34945 fl fort limited candidatus effector gc alphaproteobacteria content iii spread systems extracellular toxin citrus africanus metagenomics highly earlybranching americanus multiprotein sequence
ePnFZP	1	CA	apod march norway lapse 28 auroras time 2011 fascinating discover featured written image explanation day photograph astronomer cosmos universe professional march 2011 28 atmosphere years colors nitrogen northern sky opportunities occasionally covered norway affected spectacular trees dark kirkenes month areas clouds oxygen hosts found energy displays movie moon particles similarly
I9sOjg	2	CA	house national white teacher finalists year president obama honors 2012 state union video watch enhanced transparency commitment browse house white logs visitor wait executive actions president obama federal receipt tax federal dollars tax spent people petitions create sign house inside white tour interactive adobe player flash content download view 24
IBWgJo	5	CA	med risk ncbi factors study pubmed indian assoc 2011 cardiovascular function web ncbi javascript site warning requires management citation external file generate software kolkata hospital community medicine sskm department 700020 ipgmer developed cardiovascular observational group categories factor risk males difference association increased classified activity found investigators significantly people peons related
Anwyp6	2	CA	dccps control cancer research represent gwas tomlinson ethnicityrace costefficient genomewide developed spanishportuguese existing racesethnicities disparities nihfunded singlesnp ca122839 impact le family 6000 illumina etiology controls marchand nhwhite geneenvironment relevance puerto cfrmec women mortality greater lacking propose understudied anticipated hispanics fastest multiple statistical association colombians susceptibility resource identifying haiman racialethnic tumors
sgcY98	1	CA	house submit comments questions white state union video watch enhanced transparency commitment browse house white logs visitor wait executive actions president obama federal receipt tax federal dollars tax spent people petitions create sign house inside white tour interactive accessible committed comments questions open staff administration send concerns wellwishes creating form
zb0i4q	2	CA	apod march flying 5 night earth 2012 fascinating discover featured written image explanation day photograph astronomer cosmos universe professional 5 march 2012 atmosphere earth captured spectacles rousing sunlit orange wave dark half progresses clouds brightness lightning approaching set sequence seas frame video dawn blue space purple lights haze international occurs
JwQ8p9	1	CA	heart rheumatic ncbi cardiovasc imaging pubmed screening 2012 eur function web ncbi javascript site warning requires management citation external file generate software 75737 56 15 georges centre paris hospital pompidou research france cedex european inserm leblanc u970 rue cardiovascular heart rheumatic portable skilled echo simplified children detect epidemiological practitioners lowincome
Jv4i7l	1	CA	ncbi scan genomewide antisocial genet psychiatr pubmed behav linkage 2012 function web ncbi javascript site warning requires management citation external file generate software san national berkeley pacific psychological laboratory columbia alcohol la integrative research sciences egenetics hill jolla fneurology molecular carolina neurosciences francisco adepartment dlawrence california bdepartment scripps chapel bowles
JL5NOV	1	CA	firstever administration 29 dc states department ribbon green names schools obama education 78 house sutley states including council chair education quality ribbon jackson duncan agency 29 department announce white today administrator arne dc environmental protection schools span firstever 78 list joined green nancy lisa secretary elementary dcs announcement school made
rgDdLT	1	CA	rush klondike gold national park historical seattle unit search gold globe national headlines 1897 event unit yukon canada preserves seattle subsequent spreads crucial seattles role telegraph rich strike thousands igniting klondike easy northwestern read park story remote july dreams rush word 17 stampede riches minds historical fields newspaper discover pacific
b2uIyI	4	CA	house white state union video watch enhanced transparency commitment browse house white logs visitor wait executive actions president obama federal receipt tax federal dollars tax spent people petitions create sign house inside white tour interactive event live facebook discussion participate click member facebook give click questions comments httpwwwwhitehousegovvideo ondemand library
xgh0L1	1	CA	comparison stress modes ncbi med 1981 pubmed behav measurement function web ncbi javascript site warning requires management citation external file generate software month modestly hassles effects shared affect outcomes found concluded significantly prediction related shown scale subsequent consecutive approach men standard usual comparison months variance predictor emotion scales community psychological
pFuB71	1	CA	metab inflammatory lond ncbi eggs 2008 nutr response pubmed modulate function web ncbi javascript site warning requires management citation external file generate software usa storrs university nutritional sciences connecticut department marialuzfernandezuconnedu ct inflammatory previously sensitivity dyslipidemia intake hdlc carbohydrate dietary higher marker follow markers triglycerides provided shown compared diets restricted
Jhbc2K	1	CA	addressing violence federal house memorandum domestic workforce establishing policies white presidential state union video watch enhanced transparency commitment browse house white logs visitor wait executive actions president obama federal receipt tax federal dollars tax spent people petitions create sign house inside white tour interactive house white office press secretary workforce
1dZUR	1	CA	fair assistance compliance labor standards act law flsa states department united labor fair standards act labor flsa overview operations oneandonehalftimes dangerous fair division private rate minimum agricultural administrations employment children flsa wage prohibits federal affects labor overtime restricts basic department covered public 18 administered deemed jobs act employers hours regular
wMLGAG	2	CA	facility ca area recreationgov mt details permit whitney woods human wilderness zone offers choose sierra seeking day dreams californias respectful leave continue inyo challenge national back travels hikers water memorable beginning wildlife experience place hiking backpackers expected john undamaged park trail whitney trek waste solid mount mt starts trips pack
vCsfbD	1	CA	ncbi hypertonia pubmed stroke 2001 intrathecal spastic baclofen function web ncbi javascript site warning requires management citation external file generate software division neurological usa university jmeythaluabedu school medicine birmingham department surgery rehabilitation alabama physical spastic effectively continuous hypertonia due delivery stroke intrathecal determine sought decrease baclofen ashworth itb crossover randomized
I3Mylh	2	CA	med mea ncbi misinterpretation standard pubmed error teach 2012 function web ncbi javascript site warning requires management citation external file generate software london university college uk results previous candidate conclusions situations explain candidates highstakes applied predict background referred sepred set prediction measurement substantially sem estimated errors probable score semeas formula
IZ8teM	3	CA	government administration site general gsa auctions services warranted property condition 25hull reportsstatement 3survey doc 2hull thickness intent 1hull sf appointment removal contact property inspection appointment schedule custodian deposit bid terms attachments sale description dates custodian times contact arrangements removal inspection bidders removal loading located responsible awarded cautioned successful packing exact
f8s2IM	1	CA	city boards office clerk commissions codes boards description list membership lists applicable responsibilities interest commissions conflict view links commissions council city confirm forces appointments hall task boards directory found advisory san commissions regulatory council fiduciary contributions andor city variety mayor members offering diego policysetting matters significant excellent services cases opportunity
I9bdsu	1	CA	solstice details video mission cassini home video details set denser visible covers middle bright frames ring 86 23 movie moon jan body initially collection hours prometheus delicate kilometers minutes 30 lines 53 miles 2009 averages left diameter 155 sequence half mile radius ring 250 87129 particles saturns end bottom 47
AvsQkL	1	CA	code edition fdsys annual regulations browse federal represent code codification chapters 2841 title issuing updated government rules material bear subparts areas level 50 large subdivided revised edition titles year calendar cfr subject specific federal broad section refer agencies regulatory chapter 1727 annual april citations published staggered basis regulation permanent sections
IevsQ4	1	CA	full clinicaltrialsgov risk metaanalysis cardiometabolic text fructose view proposed disturbances inconclusive cardiovascular based knowledge technique sugar forms associations risk propose fats sweetener pooled undertaking continue processed recommendations found investigators weight sugars sex doses relates concern factors increase participants health public body ability beverages differing pressure groups improve healthy study informing
K3MlN0	1	CA	playlists lead drivers distracted long medlineplus mp3 page related medlineplus searching driving player healthday 20 lead distracted song friday news car favorite april researchers mp3 states decrease mp3 claimed makers united make percent aftermarket increase sold driver connectivity 90 distraction study vehicles devices controllers playlists people player mp3 aged 25
HRmNqZ	1	CA	infographic mandatory cbo budget contact cbo april 17 2012 56 mandatory people september spent statutory ended infographic businesses year totaled category 20 federal trillion percent state criteria 2011 government rules local includes outlays part closer nonprofit governments fiscal entitlement programs 30 36 governed institutions spending benefit amounts payments eligibility places
JFQVEu	5	CA	med death sci ncbi sports exerc arrest sudden cardiac pubmed unit 2012 function web ncbi javascript site warning requires management citation external file generate software minnesota school wa usa pennsylvania medical mn washington system minneapolis philadelphia 1crozerkeystone 3university pa health 4university medicine 2university seattle springfield scd sca related states characterize
lvTL2E	2	CA	uscis teachers citizenship links educators process developed learning find information variety support classroombased opportunities role test critical resources development play started helping explore adult supplemental uscis naturalization prepare immigrants options materials teachers professional efforts volunteers section classroom uscis instruction supplement multimedia materials print find handouts plans civics games download lesson
qvXnXj	1	CA	entrez genome view viewer map resources ncbi data genbank organism sequencing projects resources related databases cytogenetic features reference sequence viewer hybrid maintained displays human ests contig tiling physical contigs stss ncbi alternate radiation maps genetic grc predicted include fish genome map graphical assembly models genes component gnomon clones path bac
JknytV	2	CA	evaporating apod blobs carina 23 nebula april 2012 fascinating discover featured written image explanation day photograph astronomer cosmos universe professional april 23 2012 years winds forms dark clouds small found upper telescope alive constellation blobs opaque nebula orbiting pictured evaporating iconic hubble months keel lies spans unusual span carina create
K8aYYP	4	CA	stores waist louise paris sold pose girls hazard drawstrings recalled exclusively jackets entanglement ross named washington instructed voluntary consumers illegal commission safety cooperation announced firm product stop dc recalled resell attempt immediately products today recall consumer product kids fur girls faux trim jackets jane bhip units 13000 louise paris ny
xuIjOO	2	CA	catalog page pia15256 named queen year constellations infrared states visible featured images galaxy ancient northern greek section night sky ethiopia explorer degree united cepheus cassiopeia nasas expanse mosaic king enormous wise 1000square widefield survey milky mythology obscurity infrared bright human millions story eye takes unaided sky stars fade cassiopeia wise
Icrsyy	1	CA	med life ncbi magnetic pubmed imaging cardiac resonance 2011 ischemic function web ncbi javascript site warning requires management citation external file generate software davila romania bucharest university pharmacy medicine carol newest edema magnetic rest preclinical obstruction gd gadolinium artery mentioned alternative modalities setting extends infarcted combination means suspectedstable therapy valuable
Ie4UjU	10	CA	media april social day awareness 2012 prevalence lifetime sexual physical 17yearold percent trauma witnessing 8 nationally reported assault experiences representative 39 12 17 violence youth survey providers dealing wwwsamhsagovchildren children friends visit trauma resilient hope families heroes youth learn assault1 prevalence percent lifetime sexual physical 17yearold 2 rates witnessing 8
ft7fT3	7	CA	leaf facility ca recreationgov details campground fallen 9735 reflected walk feet woods guests campground birds fir bears lake wildflower black include meadows mountains racoons views safe cedar forested towering aspen squirrels prominent distance mount crystalclear taylor creek habitat resident surrounding cathedral native leaf nestled variety provide offer sites pine adjacent
HMqP4Q	1	CA	buck offer medlineplus bang veggies fruits page related medlineplus heart reduce high healthday lots suggest vegetables eating risk friday diet pressure blood news 13 disease april cancers fruits fresh studies spring year experts spinach choose mustard season time economical strawberries broccoli greens choices pineapple houston whats cancer clare reduce confidence
sJfOez	1	CA	fv4za ii iii iv vi vii viii ix xi xii xiii xiv xv xvi xvii xviii xix xx xxi xxii xxiii xxiv xxv xxvi xxvii xxviii xxix xxx 1 2 3 4 5 6 7 8 9 10 11 12 13 14 15 16 17 18 19 20 21 22
c7xaOS	1	CA	living learn alcohol healthfindergov healthy drink live moderation quick guide connect website hyperlink nongovernmental direct application hhs consistent hyperlinks states services human subject information hyperlinked united application contained health endorsement department website intended provided visitors external constitute applications privacy appearance practices products policies purpose link redirected information usaccessibility privacy mapcontact
JJzqVd	1	CA	med indian ncbi echoc pubmed transoesophageal clinical west 2011 utility function web ncbi javascript site warning requires management citation external file generate software division kingston caribbean 10 heart institute 23 balmoral jamaica medicine avenue emaducaribbeanheartcom cardiovascular detailed indications caribbean provide review echocardiogram tee transoesophageal clinical utility heart threeyear set findings
K2AOgP	1	CA	detect ncbi lef minerva echocardiography med pubmed 2012 function web ncbi javascript site warning requires management citation external file generate software division italy university nephrology medicine padua department renzcalounipdit activity browsing empty recording activity turned recording turn back information usa 20894 center pike rockville national md library bethesda medicine biotechnology
q8oag	1	CA	crossing borders dhs information updates email official nexus states including entering id children united travel approved card passport document merchant business present airports citizens kiosks air orders military mariner 1 june 2009 beginning top back secure travelers states including entering children present united travel air passport document information resident continue
Iq6HUL	10	CA	panelists announces mobile ftc workshop payments agenda 601 washington held paper avenue conference 26 federal representatives plastic commission ftc workshop nw upcoming government dc academics regulators part trade 2012 center mobile industry april advocates payments technologists consumer jersey raised included examine including technology event issues open workshop public business models
IGo42Y	1	CA	apod 14 april moons saturn 2012 fascinating discover featured written image explanation day photograph astronomer cosmos universe professional april 14 2012 discovered saturns sky kilometer huygens dione march views dutch designated satellites saturn team found 5150 frame titan astronomer portrait christiaan tethys moon smallest moons 1655 recently earths continuing imaging
6MDKYT	1	CA	assembly watch general video indiana skip navigation ingov displayed disabled message note 1 2 css information read policies standardscompliant browser resolution constitute video result council ic legislative provided profit adopted assembly intended permission commercial meaning part intent purpose coverage general enacted tangible 2511 person benefit act audio expression history support
ycD4JR	2	CA	ii ncbi 1990 res binding sites serotonin brain pubmed bull dipeptid muramyl function web ncbi javascript site warning requires management citation external file generate software 48824 university michigan lansing state department east physiology neuropathies including existence previous application nervous explain receptors postinfectious finally causing peptide diseases report proteins nacetylmuramyllaladisogln activity
