HPKAmK	1	CA	dailymed strengthened labels site labeling make web review administration food read include drug minor undergoing warnings recent fda reformatted submitted easier editorial labels site web listing complete drugs approved present prescription time 37101 inserts medication providers national labels site library high download quality information service nlm marketed advertisements content health
HDTp3l	9	CA	financial proclamation national month capability house white presidential 2012 state union video watch enhanced transparency commitment browse house white logs visitor wait executive actions president obama federal receipt tax federal dollars tax spent people petitions create sign house inside white tour interactive house white office press secretary states united financial
I9mYPk	22	CA	thomas 20032004 congress text bill library 108th ih 460 hres 100th sports state michigan football congratulating game rivalry university teams greatest ohio history recognizing strickland oxley miller gillmor ryan committee kucinich education pryce hobson tiberi kildee upton conyers turner ney brown submitted michigan workforce latourette portman ford kaptur jones levin
IkRUWK	2	CA	24 rosetta apod lutetia april approaches asteroid 2012 fascinating discover featured written image explanation day photograph astronomer cosmos universe professional 24 april 2012 heavily lutetia spacecraft rosetta 21 2014 main 2010 compiled early colors facing cratered past video images orbiting approach shows recently zipped continuing taking massive comet origin 100kilometer
b0CGvE	1	CA	affair congress library american memory haymarket primary library past society documents perspectives chicago offensive expressed presents attitudes endorse collections congress views reflect part readers times record materials historical beliefs collection understanding collection resources related connections collection working collection reproductions photographic order building collection digital restrictions copyright chicago museum collection home
k5Yero	1	CA	rover apod panorama 30 mars 2011 spirit fascinating discover featured written image explanation day photograph astronomer cosmos universe professional 30 2011 endeavour years attempts rover hills expectations crater strange bogged continues earthlingcreated half world rocks stopped volcanism related surrounding martian home spirits hill numerous power dirt hypothesis visited sister colored
I1ufzE	1	CA	guidelines sugar blood groups medlineplus issue diabetes pages related medlineplus metabolic issued guidelines high healthday news multipronged thursday sugar complex personalized approach treating requires levels blood 2 diabetes expert 19 type disease april disorder joint effort association diabetes study american recommendations european motivation fonseca guidelines message patientcentered based goal managing
cEW4mE	1	CA	fdsys browse uscode code codification house general states edition titles 1926 years subject information united office broad divided representatives current subjects subsequent main revision permanent cumulative 1934 law present counsel annual 51 editions matter supplements published order laws code office house information gpo verify representatives virtual research contained version editions
u15vTJ	1	CA	nutrition sci ncbi triat endurance sports pubmed 2011 marathon function web ncbi javascript site warning requires management citation external file generate software school university sciences birmingham uk aejeukendrupbhamacuk sport exercise protocol developed dehydration solutions gastrointestinal fibre 23 hyperthermia 4 dependent fat protein lasting beneficial slower findings achieved guidelines reduce related
6eW4G	1	CA	tool assessment breast cancer risk date 05162011 modified nsabp cancer invasive national islander pacific states surgical information united based adjuvant scientists assessment bowel updated risk tool nci experiences designed estimate aabcs women contraceptive reproductive developing institute study womans project american african interactive asian care breast tool note read explanation question
K9vUyM	2	CA	load sci ncbi med sports exerc bloodflow pubmed effects exercise 2007 function web ncbi javascript site warning requires management citation external file generate software 132445040 usa university research ny musculoskeletal slbaldwisyredu science department laboratory exercise syracuse restriction unclear resistance potent duration size shown strength interact low stimulus exercise combination results
I3NxSI	1	CA	larchmt med ncbi continuing analysis content pubmed health womens 2010 function web ncbi javascript site warning requires management citation external file generate software division georgia cancer disease usa krolandcdcgov 30341 control atlanta centers prevention cancer guidelines negative assess intervals human education technologies describing knowledge support hpv availability increase industry concerns
JR3IFy	1	CA	huge show charges hospital medlineplus variance study page related medlineplus enormously tuesday cost healthday 24 1500 varies appendicitis treating report news condition acute medical april common 180000 researchers variations 34000 states united disparity charge appendicitis added price california 2009 study median looked patients 19000 treated uncomplicated researchers typical bankruptcies financial
BxYL1	1	CA	fdsys browse uscode code codification house general states edition titles 1926 years subject information united office broad divided representatives current subjects subsequent main revision permanent cumulative 1934 law present counsel annual 51 editions matter supplements published order laws code office house information gpo verify representatives virtual research contained version editions
IGcF0P	1	CA	apod 21 april 3 ats 2012 fascinating discover featured written image explanation day photograph astronomer cosmos universe professional april 21 2012 meter resemblance technique operational 8 skies observatorys dark underground clouds large arrays common small concert house interferometer enclosures faintly greenish galaxies paranal region ats horizon milky designed stretches point
2AOvHS	2	CA	joshua park national tree search reveals features fascinating attraction climatic winds home geologic viewed closer variety make add examination rich surreal skies park vitality dark cultural rain strong desert hints plants land animals shaped unpredictable extremes place night history road torrents dont miss 20 sun cross moon sunday western solar
IVQiCA	1	CA	orientation research current periodical newspaper reading room discover periodical librarys ways research current collections reading unique room tour newspaper accessible databases reference discussed fulltext america taught rooms periodical specialists machines equipment introduction chronicling current materials collections basic reading resources locate proquest online includes designed ncpr microfilm procedures freely room newspapers
HotUYe	2	CA	resources stopbullyinggov addressing set inclusion problem related topic included imply entering facts find verified stopbullyinggov federal promotion nonfederal program inventory articles tips guarantee resources criteria listed endorsement search includes bullying nominated helpful evidencebased training resource toolkits keyword directories materials directory meet accuracy add inventory nominations resources find resources website managed
cjYwfD	3	CA	schedule wsdot ferries dockbound viaduct wednesday 510the jackson marion construct entering close 5 impact driving offloaded drivers due thursday access exit 9 terminalawv utilizing 2012 activities customers colman 7 awv pmseattle southbound underneath dock construction traffic western northbound affect change diverted yesler 10 alaskan 0925 vehicles overnight exiting street enter
3ixzg	3	CA	caring childs mental health childs mental mission sites overarching childrens caring system effort support samhsas increase approach health comprehensive public awareness marketing social samhsafunded purpose services strategic care 1994 created communications team strategies works stimulate information childrens national visit event wwwawarenesseventorg health today rsvp day awareness mental dont washington wwwsamhsagovchildrenliveeventasp
IOAXWm	1	CA	house white state union video watch enhanced transparency commitment browse house white logs visitor wait executive actions president obama federal receipt tax federal dollars tax spent people petitions create sign house inside white tour interactive event live facebook discussion participate click member facebook give click questions comments httpwwwwhitehousegovvideo ondemand library
bREk8i	4	CA	government house executive contracting white order economy state union video watch enhanced transparency commitment browse house white logs visitor wait executive actions president obama federal receipt tax federal dollars tax spent people petitions create sign house inside white tour interactive homeowners refinancing house twitter responsible answers hours brian office questions
Jqv9WC	1	CA	respiratory ncbi aeruginosa pseudomonas mmwr wkly pubmed mortal morb rep 2012 function web ncbi javascript site warning requires management citation external file generate software chain numbers administration beaumont facilities surgical nhsn staff based 23 royal late issued health 2011 drug food michigan closely procedures gel respiratory echocardiography january aeruginosa found
JsTUzU	2	CA	eye risk acne problems doubled tied medlineplus drug pages related medlineplus grens kerry linked pink twofold acne pills reuters health treat israel risk eye dryness problems york prescription developing study styes large severe teenagers growth including names isotretinoin delays miscarriages brand roaccutane effects birth women pregnant claravis amnesteem side bone
3s99l9	1	CA	quit smokefree guide women cigarette step smoking women congratulations taking smokefree quitting exsmokers hard experts expect quit prepare support describes problems prepared weeks days times guide wrote guide quit complete view quit free order print air guide download clearing copy quit mobile free download version guide today home topics interest
Ja1Eal	3	CA	point glacier national park 2012 open road yosemite search limited visitor avalanche 24 toilets 20 storms wet roadway tioga elevations melting unpredictable unexpected creek spring national closures 2093720200 subject projected ice closed conditions opening friday water wildlife urged april vault road point services weather campground open tomorrow bridalveil remains due
DGtT	3	CA	web surfing healthy medlineplus guide suggestions quality information based sites health web experience evaluating responsible recognized content authorities sourceuse site reviewed web sites board information focus qualityall posted created equal editorial site promise sounding information make deliberately health good scientific results abounds dramatic web cyberskepticquackery true obscure language miraculous quick
gKTDCL	1	CA	business sbagov writing plan guide business plan financial executive single manage market description documents formula include consistent supporting elements plans business plan developing summary projections elements business started plan summarized outline writing essential sheet cover business executive summary purpose statement table contents body document business description business marketing competition procedures
r770oS	1	CA	food ftc marketed children comment proposed 217 issued nutritional principles comprised agriculture children established group voluntary working commission federal quality marketed administration representatives centers solicit department proposal public direction interagency congress food ages control trade hold halfday develop forum disease drug month recommendations adolescents prevention tuesday 300 1100 24th 2011
HDpjC2	1	CA	heart raised spouses risk cancer disease stroke medlineplus patients pages related medlineplus heart cancer disease stroke healthday risk spouses april increased news 11 study wednesday suggests patients stress takes explanation caregivers health toll researchers heart cancer people national inpatient stroke partner increased swedish percent 29 risk registry 13 disease found
JjrxqG	1	CA	control curr predictors ncbi allergy opin pubmed clin asthma immunol 2012 function web ncbi javascript site warning requires management citation external file generate software permanente kaiser center diego medical allergy states united california department san control uncontrolled identify validated tools targets intervention asthma predictors factors strategy potential impairment risk epidemiologic
I3gBfL	2	CA	energ ncbi form food lond obes int pubmed effects appetite 2007 function web ncbi javascript site warning requires management citation external file generate software nutrition usa purdue university foods lafayette 479072059 west department adults obese energy high appetite protein stimuli lean independent form food effect fat intake carbohydrate investigate cheese
uQv1W	1	CA	business checklist starting small businessselfemployed small businessselfemployed topics irs resources construed follow allinclusive start basic type business checklist list specific steps industries information page specific web found industriesprofessions business web site states operating statelevel information requirements additional state starting refer business steps small starting administrations refer topics referencesrelated web business
xl8O0c	1	CA	grant grantsgov opportunities synopsis opportunity find precedence service disk electronic click information grant provide notification send inconsistency document email resolved notifications printed address opportunity emails change receive thing giving original requestedany modification description represent newest file oldest previous shown documents current document sections files background representing modifications arranged changed list
JkzLO4	1	CA	week national preparedness blog kicking severe weather fema comment accordance comments blog moderated policy femas links nongovernment social applications web fema provided reference media companies sites endorse msgdata washington street apply management prepare federal rates homeland department 4fema emergency dc 43362 20472202 sw agencyus security500 6462500text tty assistance step 46275853
A9cGFp	1	CA	hip arthritis tip medlineplus health surgery page related medlineplus discovered healthday surgery lot hip pain arthritis early discomfort news stages hip orthopaedic academy nonsurgical arthritis surgeons american offers solutions potential mobile twitter subscribe version updates follow email rss national guidelines accessibility library human institutes quality 27 copyright privacy health bethesda
JlAXlr	1	CA	cognitive ncbi latelife influence neurology activity 2012 pubmed cogni function web ncbi javascript site warning requires management citation external file generate software correspondence wilson rwilsonrushedu requests reprint dr activities cognitive affects latelife health hypothesis mentally test subsequent stimulating participation adjusted sequence battery series cognitively years assessed relation selfreport dementia analyses
IREGSL	3	CA	tale continues mission solstice cassini images home image details hydrocarbons fascinating titan surface system pole sea make ice subsurface rich moons saturnian emanating water jets ponding liquid hinting organics tale learn enceladus vapor south 313 5150 titan northern antisaturn image rings ringplane sunlit 504 faintly saturnfacing background kilometers center 3200
9Lwh52	1	CA	water contaminants drinking epa content area jump main navigation contact water contaminants drinking links national primary regulated apply limiting details visit enforceable health systems legally public regulations levels drinking water protect list npdwrs standards contaminants alphabetical regulations links primary water sheets listing drinking fact cramps illness diarrhea vomiting gastrointestinal fecal
IktwZl	2	CA	season medlineplus early year tick starting page related medlineplus prevent ticks love mild healthday precautions expert winter 22 means due sunday normal started season earlier gardeners news tick hikers april outdoors meal diseases people tickborne symptoms alert anaplasmosis minn tickborne testing virology microbiologist rochester positive minnesota lyme babesiosis state clinical
wV8XYs	1	CA	nih rare february highlights national 16 disease research cuttingedge health institutes 2012 day awareness raises links related bookmark share cc nih clinical center media advisory office recognize national supported cosponsored translational institutes research researchnational 29 day sciences clinical health advancing daylong activities nih diseases government agencies event celebrate celebration organizations
JnsID9	3	CA	run ncbi exerciseinduced biol si pubmed wired exp endocannabinoid 2012 function web ncbi javascript site warning requires management citation external file generate software school arizona usa university 85721 anthropology tucson raichlenemailarizonaedu az walking show taxa cannabinoid brain activating true explain interspecific receptors neurobiological endogenous regularly popularly increased morphological motivates report
I3y2hb	1	CA	evaporating apod blobs carina 23 nebula april 2012 fascinating discover featured written image explanation day photograph astronomer cosmos universe professional april 23 2012 years winds forms dark clouds small found upper telescope alive constellation blobs opaque nebula orbiting pictured evaporating iconic hubble months keel lies spans unusual span carina create
cCF8Lv	1	CA	apod september 29 front airplane moon 2010 fascinating discover featured written image explanation day photograph astronomer cosmos universe professional september 2010 29 nerve closely image front photographer camera weeks east australia 1250th explanation airplanes lucky words catch steel photograph attached wait large good pass airplane moon tracker queensland extremely exposure
yy8swK	1	CA	resources stopbullyinggov addressing set inclusion problem related topic included imply entering facts find verified stopbullyinggov federal promotion nonfederal program inventory articles tips guarantee resources criteria listed endorsement search includes bullying nominated helpful evidencebased training resource toolkits keyword directories materials directory meet accuracy add inventory nominations resources find resources website managed
GTuFc0	1	CA	hankuk house university president speaks white obama state union video watch enhanced transparency commitment browse house white logs visitor wait executive actions president obama federal receipt tax federal dollars tax spent people petitions create sign house inside white tour interactive adobe player flash content download view 26 march 2937 domain
wx9M3j	1	CA	cons pros labor project agreements november 2 2011 2011r0360 cons pros labor project agreements analyst john moran principal cwas people lowincome community trade hiring targeted debate paths funding employment create government labor arguments cwa include agreements provisions plas workforce includes construction report projects building receive project career components asked underrepresented
2f4NaL	1	CA	glossary talking genetic terms glossary home version text term enter search test knowledge links national share related talking descriptions human images genetics field addition research genetic animation genome nhgri terms understand specialists include created glossary institute concepts definitions select alphabet version terms selecting term explore letter textonly revealed search list
I4Q82t	1	CA	feat rare extraordinarily spring 426f remarkable month cdt ended edt feat 23 1945 degrees 2012 march 13f mon 498fmaking cooler 3f 2f izzi significantly spring national back warmer year chicago remain forecast 524f public facttypically unusual remainder change rare region april accomplished 517 chicagoonly apr weather seasonable 1907 chilly 502f
HDMQTk	1	CA	sec form accurate reviewed information necessarily commission reader complete exchange completethe securities assume determined filing 1 identity issuers information business contact 2 place principal persons 3 related clarification response clarification response clarification response industry group 4 size 5 issuer federal select 6 claimed apply exclusions exemptions type filing 7 duration
yhHHA	2	CA	united constitution official states summer 1787 cooperative debate 25 delegations hall legislators government existing day articles amend redrafted art people house frame constitution federal representatives state closed issue independence power delegates members obtained central minds revise electeddirectly philadelphia statesmanship draft convention compromise adjourned present 14 work debated states discussion sessions
I9Q6Tg	1	CA	control monitoring feedback exchange hypertensive ahrq innovations pressure patients blood home improve pharmacist weekly profile posted march publication exchange 28 innovations date original 2012 profile updated march exchange innovations date posted 28 recent 2012 questions house ahrq site usagov human home information privacy writing health policy white map web act
mdnG0s	4	CA	battery household program collection chain food humans metals batteries mercury end lead illegal disposed environment causing potentially landfills toxic health waste universal household nickel cadmium california negative risks throw trash animals longer rule common affect battery household locations library partnered batteries proper educate effort dispose utilize encourage program los containers
wnJSaj	1	CA	star energy find ra pe professional licensed star energy join plants buildings licensed professional home find buildings star registered architects verifications search earned directory professional engineers energy performed managers certification energy expertise engineer certified provided additional extra note add listed efficiency association building organizations individuals green professional requires engineers k12
IYLQTB	32	CA	increased ncbi prevalence bull transglutaminase pubmed schizophr 6 2012 function web ncbi javascript site warning requires management citation external file generate software md school north 600 hopkins university johns 144 medicine wolfe sciences street 1department 21287 behavioral psychiatry baltimore meyer represent 213 results brain 131 including skin gastrointestinal relationships 27
I2iFB6	1	CA	mercury passes apod 16 january messenger 2008 fascinating discover featured written image explanation day photograph astronomer cosmos universe professional january 2008 16 suns years spacecraft questions flyby send finally swoop weeks 2011 flybys scientists entire human acquired back imaged past images planet dense messenger shows days 35 swing detailed raised
IeYG01	1	CA	21st oil ncbi century 1998 dermatol pubmed snake arch function web ncbi javascript site warning requires management citation external file generate software school center usa deaconess medical israel dermatology harvard mass boston department beth including skin skill ignorantly peels 21st knowledge dermatitis promoting snake pretending association gel term onion list
xx3s86	1	CA	cord curr ncbi rep neurophysiol stimulation spinal pubmed pain 2012 headache function web ncbi javascript site warning requires management citation external file generate software johns avenue usa critical department care yguan1jhmiedu ross division pain 720 anesthesiology medicine 21205 md hopkins university 351 rutland baltimore summarizes significantly findings produces reduce society
I1Kmcj	1	CA	comparison ncbi bmj pubmed insulin versus metformin 2012 function web ncbi javascript site warning requires management citation external file generate software dk2100 centre denmark rigshospitalet research trial clinical copenhagen hospital university unit intervention compare trials 2 metformin clinical type versus reported harms randomised diabetes benefits patients insulin metaanalyses randomised sequential
Stnj	1	CA	hemisphere enlarged northern view documentwritelnbr polar documentwritelnn pass measurement documentwritelncenter time passtime recent extrapolated pass auroral oval plot northern measurements current shows polar satellite hemisphere extent noaa recent position poes hand plot clock noon points arrow meridian red ten map color updated auroral observed underlying statistical pass oval respect fluxes
Jvw5Kx	1	CA	thinkcentre lenovo fire recall computers due hazard desktop expands named washington instructed voluntary consumers illegal commission safety cooperation announced firm product stop dc recalled resell attempt immediately products today recall consumer m90z product lenovo computers thinkcentre m70z march previously recalled 13000 units 50500 2012 manufacturerimporter morrisville lenovo nc overheat power
kvpJc	1	CA	national dna day national year human helix completion genomics dna 2003 commemorates genome 2012 public dnas students 20 genetics unique day nhgri celebrate double project april teachers learn discovery read answers questions chatroom transcript check 2012 essay dna contest winners day 2012 600 equipment2nd 1st laboratory equipmenthonorable genetics grant equipment
ruG5h8	7	CA	start 1940 census research skip navigation national searching index district 1940 enumeration located charge 2 archives online opens 2012 locate free address census april release http1940censusarchivesgov order search access httpwwwarchivesgovresearchsearch opa online public census delaware 1940 sussex county maps state enter milford sussex including town search census 1940 delaware maps
