sKhAIN	1	MA	full efficacy neuropathy peripheral diabetic inhaled clinicaltrialsgov cannabis text painful view purpose determine effective neuropathy vaporized study diabetic cannabis treatment analgesic painful caused random clinic 20 nervous 600000 treatment weeks propose effects experimentally 2550 induced excluding cognition common dpn therapeutic peripheral back desperate doses estimated medications cannabis acting receiving inhaled
tKmzz1	1	MA	ncbi caused structured geographically host pubmed specificity isme 2012 function web ncbi javascript site warning requires management citation external file generate software biology evolutionary ma center university usa bewolfefasharvardedu harvard cambridge systems organismic fas department 02138 quercus shape abundant death cataloging exclusively spread east local resources associations amanita coast mutualists
ACcdDk	1	MA	measuring loss weight commun support ncbi pubmed health social 2011 function web ncbi javascript site warning requires management citation external file generate software division school usa houston university kevinohwanguthtmcedu general medicine internal 77030 department medical texas random communities paper instrument factor exchanged finding day loss large individuals 199 significantly weight
yHrAon	1	MA	reopen mount park rainier national search family process weekend play reopening aftermath national shooting saturday recovery leading snow horrific anderson tragic 7 fatal public begin loss time park margaret services exception ranger january mount events rainier family lieu memorial service anderson week plans fund key date flowers bank margaret requesting
mRyYNC	1	MA	flaccid guidel penile ncbi 1996 erect states length pubmed urol function web ncbi javascript site warning requires management citation external file generate software school francisco urology san usa university medicine california department assist penile provide guidelines circumference length augmentation counseling patients flaccid penile normal physically men prospectively erect pharmacological erection
xyEIht	1	MA	full risk factors text clinicaltrialsgov switch mania adassociated view hypomania states factors introduction clinical 8 weeks increasing risk present identifying study antidepressant switch dosage mixed aimed major treatmentasusual ii decided depressive 20 hdrs17 current bipolar combined psychiatrist treating episode outpatients antidepressant treated features defined hypomanic ymrs compared hdrs17 increase 5
yoV95t	2	MA	current uscert activity highimpact web current incidents regularly updated reported types summary uscert activity security page frequent multiple apple released updates safari address vulnerabilities products security os code crosssite obtain information perform vulnerabilities privileges elevated attack attacker condition execute denialofservice exploitation sensitive arbitrary operate scripting articles mitigate users ht5281 encourages
wYO5mj	1	MA	antiangiogenic ncbi res proteins early twin pubmed genet hum expression 2011 function web ncbi javascript site warning requires management citation external file generate software memorial gynecology hospital taiwan obstetrics gung department chang university restriction fetus soluble endoglin seng labor samples immunosorbent assay increased trimesters fluid pathophysiology birth obstetric adiponectin significantly
9arQHN	3	MA	programmable energy star thermostats star energy products thermostats home programmable find partners partner energy thermostats year spends 2200 180 cooling setting programmable save household properly half maintaining settings average homeowners heating bills preprogrammed summer thermostat asleep home regulate temperature make helps easy programmable save offering homes winter settings thermostat money
jcIrm	1	MA	web student aid program financial certification loan sources grants repaid undergraduate grant federal nonfederal awarded foundation added degree students student professional cases teacher aid unlike receive earned considered postbaccalaureate bachelors enrolled pell 30 financial year total grant amounts 1 depending fulltime 2011 2013 201112 status full plans attend june award
sjgvlO	1	MA	files documents interpreting edsitement cold war history presented prompt findings previously inaccessible past sources accelerate cold historiography information perspectives sides written bloc communist supports war seeks process full western world scholars governments integrating reliant largely project materials archival historical release international disseminates decades history share partnered thinkfinity lesson find educational
tcqeg8	2	MA	mount continues park ranger manhunt rainier national killed man search shot chain scene county rendering woods armed vehiclethe parkthe rangers killed failed anderson manhunt road enforcement checkpointa fire park foot andersonthe fled pull pierce car mount morning large team aid required fired national established opened jumped began officers paradise swat
sgcY98	1	MA	house submit comments questions white state union video watch enhanced transparency commitment browse house white logs visitor wait executive actions president obama federal receipt tax federal dollars tax spent people petitions create sign house inside white tour interactive accessible committed comments questions open staff administration send concerns wellwishes creating form
uTqYCv	1	MA	terrestrial mountain produces science space meteorites nasa probe sights spacecraft existence giant longstanding asteroid expected entered 2011 half towering july everest mystery reveal fully mount planet vesta dec pieces high dawn mountain end scientists higher nasas peak surprising 30 orbit times 13mile solve atmosphere caused years village earth bilanga giant
eUsoqT	1	MA	civil eve american edsitement war presented civil series states bring statistical click statistics factors war maps tabs united student summarize bottom eve american animated interactive share partnered thinkfinity lesson find educational save resources plans free edsitement plans updates lesson resources humanities project edsitement endowment national provided verizon thinkfinityorg edsitement support
vG8lcT	1	MA	apod thunderclouds jumping sundogs 8 november 2011 fascinating discover featured written image explanation day photograph astronomer cosmos universe professional altsee picture clicking resolution explanation version download 8 november highest 2011 phenomenon years web rapid sky reorients differently sundog return emerged words clouds lightning inspection temporarily enthusiasts past curious encouraged sum
sVVdyO	4	MA	apod full january aurora sky 3 norway 2012 fascinating discover featured written image explanation day photograph astronomer cosmos universe professional january 3 2012 atmosphere unexpected ago striking sky magnetic results 60 lies stretched airplane rarely viewed complete mountain realm wide space image poles horizontally molecules auroral circle norway aurora higher
uB422q	1	MA	apod sun pillar violet 2001 7 november red fascinating discover featured written image explanation day photograph astronomer cosmos universe professional november 2001 7 beautiful phenomenon snowcapped reflects distant ice nevada film 2000 unusual mysteriously unknown lake sunlight noticed state setting tahoe mysterious tahoenevada learned red mountains serene amateur capture explanation
8MNng	2	MA	bridges bts deficient national structurally system maps highway rita va ca al ar vt il ga az id ct nh nj nm tx la nc ne tn ny pa ak nv pr wa de dc wi wv iaks fl wy md ma ut mo mn mi ri mt ms sc
qJIIcL	1	MA	basics exportgov export set money commitment identify export facts create preparing implementation seek assistance internal bank statement timetable international save defining loan helps status creating business objectives important plan assemble companys requests present advance financing milestones success analyzing completing required specific future time action making constraints anticipate gauge goals topics
bmrpaI	1	MA	cohort ncbi prospective metaanalysis nutr pubmed clin studies 2010 function web ncbi javascript site warning requires management citation external file generate software childrens usa institute hospital research oakland ca saturated generally fat thought reduction dietary health cardiovascular improve heart saturated inclusive related metaanalysis stroke dietary cardiovascular chd coronary objective risk
b2uIyI	4	MA	house white state union video watch enhanced transparency commitment browse house white logs visitor wait executive actions president obama federal receipt tax federal dollars tax spent people petitions create sign house inside white tour interactive event live facebook discussion participate click member facebook give click questions comments httpwwwwhitehousegovvideo ondemand library
v4ltNA	1	MA	fly apod space january free 1 2012 fascinating discover featured written image explanation day photograph astronomer cosmos universe professional 1 january 2012 guided mission farther nitrogen earth 41b backpack satellites bay works heavy retrieve weightless challenger meters cargo space propulsion robert mccandless pictured drifting mmu free jets safer experience untethered
AnqXpb	12	MA	omega6omega3 ratio atheroscler ncbi cardiovas rep pubmed 2006 curr function web ncbi javascript site warning requires management citation external file generate software metabolic street dakota usa west research 57105 health foundation 1400 nutrition diseases falls billharrisusdedu sioux 22nd institute university south sd inflammatory human cardioprotective ratio enzyme systems include fas
AoJIY1	1	MA	announcement space 1972 shuttle president nixons president san administrator fletcher richard space program 5 shuttle final announced headnote california approval received clemente james 1972 nasa editorial january nixon accessible states decided endeavor 90s united proceed space system 1980s territory type today development transportation familiar human designed easily frontier transform 1970s
tOFdhF	1	MA	chem microrna ncbi highly detection sensitive pubmed anal bioanal 2012 function web ncbi javascript site warning requires management citation external file generate software iowa usa 50011 university laboratoryusdoe ia state department ames chemistry methods introducing developed comparable highly detection multiplex biosensor array research make fm polymerization methodology mirna method assay
O4lzB	1	MA	management wwwnutritiongov weight information weightcontrol dhhs network niddk control weight nutritional related general issues physical information media health public congress uptodate sciencebased professionals activity obesity weight effectively gain find information wealth lose safely resources dieting weight learning diets choose safe evaluate practice loss effective healthy products claims information management weight
tdf5en	1	MA	essay med acad ncbi contest humanism plac pubmed medicine 2011 function web ncbi javascript site warning requires management citation external file generate software school usa university reno nadahlmedicinenevadaedu medicine nevada activity browsing empty recording activity turned recording turn back information usa 20894 center pike rockville national md library bethesda medicine
yoI36l	2	MA	repair chairs due hazard high fall recalls ikea named washington instructed canada voluntary consumers illegal commission safety cooperation health announced firm product stop dc recalled resell attempt immediately recall products today consumer product antilop chairs high 36000 169000 133000 units canada north conshohocken llc importer pa services ikea america unexpectedly
y4QzP5	2	MA	boston city citizens connect text app bostons issues city tweet visit send start program call website eyes phone effort ears neighborhood give boston 247365 graffiti connect potholes download ways awardwinning empower reporting alert citys neighborhoods mobile citizens residents citizensconnectcityofbostongov email email developerscityofbostongov citizens terms connect service app citizens connect tgh
vt5rPV	1	MA	p2 narratives collection voices faces slave sarah graves shaw age frances 87 named owned years brought born 88 lived slave emily jimmie graves shaw 23 1850 live louisville allotted mama man march 1937 goin daughter months kentucky crowdes missouri explain sally matter aunt allotment endeavored interviewer confusing replied im wages
sseMX3	1	MA	maize acad sci ncbi overexpression pubmed natl corngra proc 2011 function web ncbi javascript site warning requires management citation external file generate software albany plant 94710 center usa university georgechuckberkeleyedu agriculture california berkeley department gene expression ca uc usda developed saccharification including greenhouse morphology biofuels feedstock superior pretreatment point bioenergy
sB1lKz	1	MA	grant grantsgov opportunities synopsis opportunity find precedence service disk electronic click information grant provide notification send inconsistency document email resolved notifications printed address opportunity emails change receive thing giving original requestedany modification description represent newest file oldest previous shown documents current document sections files background representing modifications arranged changed list
ukvqdo	1	MA	cell methods ncbi mol biol specific pubmed rnai gene 2011 silencing function web ncbi javascript site warning requires management citation external file generate software school ma usa pharmacology biochemistry university worcester massachusetts department molecular medical protocol simple powerful years neurodegeneration including apply rapid rapidly field implementation cultured mediate basic enable
a0Uo3	1	MA	house contact white state union video watch enhanced transparency commitment browse house white logs visitor wait executive actions president obama federal receipt tax federal dollars tax spent people petitions create sign house inside white tour interactive submit comments questions online accessible committed questions open administration comments public website creating president
JJgjA	14	MA	congress nominate national preservation registry films library film board mandating consulting inclusion december national suggestions preservation select experts reviewing plan library alternates established pl110336 end implementation 44 extensively 1988 passage film heritage films save public announced board reauthorization extended recently congress 25 continuing authorizes registry members librarian law 2008 sound
aGrvo1	3	MA	metab ncbi int nutr chocolate exerc pubmed 2006 postexerci sport milk function web ncbi javascript site warning requires management citation external file generate software applied usa laboratory university bloomington 47405 dept kinesiology health human science performance indiana rating endurancetrained results cyclists milk tte isovolumic 4 bout greater workout bouts fluid
uqQYoY	1	MA	map normandy edsitement dday invasion interactive presented major assigned excerpts histories include participated read battlesthis zoomable european history locations sense event lengthy popups tend write interested edsitement shows europe map combat students men student engagements theater wwii fictitious place interactive oral asked share partnered thinkfinity lesson find educational save resources
wjgdwp	1	MA	ncbi beverages nutr stor increase pubmed sucrosesweetened fat clin 2012 function web ncbi javascript site warning requires management citation external file generate software mea university aarhus medicine internal endocrinology department denmark hospital soft metabolic longterm humans examined intervention observational syndrome consumption cardiovascular sucrosesweetened effects obesity shortterm disorders drinks studies sssds
vhTD0B	1	MA	flood fema significant events 31 2012 march 1978 named reasons attempts tropical 1500 change storm include apparent occurred subjective federally report areas popular heavy declared disaster states single naming event hurricane occasionally events begin added paid rain significant counties created losses thing time tuesday modified 08may2012 edt 112602 links nongovernment
yoIiZA	3	MA	repair chairs due hazard high fall recalls ikea named washington instructed canada voluntary consumers illegal commission safety cooperation health announced firm product stop dc recalled resell attempt immediately recall products today consumer product antilop chairs high 36000 169000 133000 units canada north conshohocken llc importer pa services ikea america unexpectedly
tCYpgR	2	MA	house white state union video watch enhanced transparency commitment browse house white logs visitor wait executive actions president obama federal receipt tax federal dollars tax spent people petitions create sign house inside white tour interactive event live facebook discussion participate click member facebook give click questions comments httpwwwwhitehousegovvideo ondemand library
vtgb0A	1	MA	ranibizumab ncbi bevacizu controversy theranostics pubmed 2011 lasting function web ncbi javascript site warning requires management citation external file generate software beijing 100730 china ministry institute hospital 1 geriatrics health key laboratory alternative ranibizumab macular beststudied attractive factor degeneration food amd specific hallmark achieved neovascularization elderly relative growth migration review
v3nYeQ	1	MA	releaseus 10000 tox21 begin chemicals screening 2011 institutewwwgenomegov national genome human research fda 10000 national testing library drug human translational institutes research partners therapeutics sciences administered agency administration nctt chemical program health genome include nhgri nih housed tox21 food ntp collaboration environmental niehs protection compound phase part begins center genomics
vrBDUY	1	MA	information 1940 census general skip navigation census digitally 1940 april released 2 2012 accessible facilities images personal access charge digital nara public nationwide internet free computers restriction 72year east reasons national 1201 95416 service information law privacy jeffersonville 1940 access 5 915 bureau fill public stat form processing search statutory
tFY855	1	MA	australia image lakes wales menindee day south december image system fed west ephemeral lake blackened mud 186 flowing wales darling 2011 australia north lakes dark tandou kilometers town water river floods amount menindee small freshwater flooding south longest fashion minor surrounding image marked characteristic inland deltas sea ancient patterns apex
ve23E6	1	MA	industries burn unio fire hazards ogrill gas due grills recalls portable named washington instructed voluntary consumers illegal commission safety cooperation announced firm product stop dc recalled resell attempt immediately products today recall consumer product ogrill gas grills portable units 4530 industries xiamen unio corporation china manufacturer ignite fire burn gas
XXAoz	3	MA	living lifestyle information health human services guide connect website hyperlink nongovernmental direct application hhs consistent hyperlinks states services human subject information hyperlinked united application contained health endorsement department website intended provided visitors external constitute applications privacy appearance practices products policies purpose link redirected advice find health care today widget information
k8eVQd	1	MA	circumference penile ncbi study urol length 2001 pubmed 3300 eur function web ncbi javascript site warning requires management citation external file generate software italy university department urology florence size disciplines estimates knowledge provide young interest extensive normal males dimensions external considerable penile carried study variations genitalia male italian set weight
sQD3lC	1	MA	states patent united 8073801 semantic family atomic determine representations statements quality conclusions objectives twodimensional system structure type indicating families rules traceable decomposed integrity adheres tested unique true condition high heading principles operates tabular headings decisions decision conditions operators conclusion body business models includes graphically modeling types operands rule ensure logic
xj8G7I	1	MA	management ncbi rev deep pubmed skin neurosurg brai 2009 erosion function web ncbi javascript site warning requires management citation external file generate software italy university torino michelelanotteunitoit department neuroscience turin prevent fistula deep implant psychological brain literature commonly skin dbs complication management treat area related system removal stimulation written clinical
rBxHRg	1	MA	body perceived ncbi image teasing pubmed experiences 2007 dysmorphic function web ncbi javascript site warning requires management citation external file generate software school united ma boston medical 02114 general states harvard massachusetts hospital including imagined previous group concerned controls dysfunctional checking propose asymmetrical facial report cognitivebehavioral association perceived comprising rituals
swTkoc	1	MA	past edsitement mapping presented share map columbus detail christopher socalled xpeditions society national credit courtesy geographic lewis produced passage finally hope views reflected early cultural aspirations world collect investigate andor people discover alive understood internet discovery experience times range examining clark period marked lesson perspectives working interacted artifacts west noting
v4SBqs	2	MA	ncbi prevalence mutations biol somatic detection pubmed low 2011 genome function web ncbi javascript site warning requires management citation external file generate software diego gilman usa center cancer la university drive 92093 california moores oharismendyucsdedu jolla san ca 9500 ucsd breadth clonal udtseq methods cancer limited detection specificity mutations restrict
rUrTN1	1	MA	saturn treats mission solstice nasas cassini delivers holiday saturn features releases nasas cassini home news holiday delivers treats saturn treats nasas cassini delivers holiday dec 2011 22 saturn treats nasas cassini delivers holiday show titan spacecraft radio cassini images delivered saturns pictures flying ornament system signals reindeer pasadena largest holiday
hAl5rh	8	MA	gluten ncbi sensitivity markers celiac biol psychiatry pubmed 2010 dis function web ncbi javascript site warning requires management citation external file generate software school pediatrics usa hopkins johns sheppard research 21204 medicine pratt program fdickersonsheppardprattorg department stanley maryland baltimore increased sensitivity reported schizophrenia inconsistent association gluten immune studies 151 chain
jjHHaH	3	MA	hudno11134 hud notice rights homeownership disclosure announces revised servicemembers protects protecting militaryfederal dependents law disclosure duty civil revised washington housing department announced relief development urban notice form servicemembers emphasizes active dependents rights protected today act military duty foreclosure mandates wartime states active rate including court proceeding mortgage personnel percent valid
sOsBDx	1	MA	toxicol scombroid ncbi pubmed cardiovasc causing lifethre poisoning 2011 function web ncbi javascript site warning requires management citation external file generate software applied piazzale italy civili university 125100 medicine brescia department spedali experimental activity browsing empty recording activity turned recording turn back information usa 20894 center pike rockville national md
slrZTu	1	MA	24 apod heliopause suns june 2002 heliosphere fascinating discover featured written image explanation day photograph astronomer cosmos universe professional 2002 24 june suns magnetic spacecraft speed auyear glide 7590 extends galaxys heliopause front heliosphere shock continue past 110 close particles pioneer 3 exit dominate occurs pushing illustration pluto water actual
u3Epsf	1	MA	apod iss december 31 lovejoy comet 2011 fascinating discover featured written image explanation day photograph astronomer cosmos universe professional december 31 2011 intendente bright earth captured 24 la photographer sky argentina local spectacular dan arcing early crosses tails twilight morning view alvear swept trails frame back glinting proper home closer
hO702	1	MA	narratives federal slavery project born writers slave 19361938 division prints manuscript congress photographs library primary library past documents perspectives readers offensive expressed presents attitudes endorse collections congress views reflect part times record materials historical beliefs narratives slave norman introduction yetman wpa collection voices faces collection narratives language note resources related
ybU30W	2	MA	opensource projects image linux single images size pcs desktop environment bigview panning multiscreen multiple cooperate running additionally software zooming work large arbitrary view interactive control code manage environments set distributed functionality basic resources framework observe user services observation applications view software engineering java larc application opensource innovation development field started
yPrLkH	2	MA	development methods models research databases epa jump main content development research search area contact epa assist resource risk provided maintains list develops selected databases assessors managers scientists epa computational searchable developed sources human 500000 tools find environment actor chemical potential health structure warehouse interested 500 aggregates databases collection environmental chemicals
