xdNiTK	2	MA	pap tests color pdf full cancer find pap cervix vagina test checks opens womb part lower smear cells turn sex pap 21 start 3 vaginal tests years women time pap make normal find call test appointment period change cells harder including pap based doctor things nurse tests woman decide talk
b2UtUJ	6	MA	picture astronomy day fascinating discover featured written image explanation day photograph astronomer cosmos universe professional 11 2012 bright distant earth disk 20 fit easy weeks apogee photographed perigee dark day telescope pacific dense sun asia moon smallest full 300 annular 240 kilometers path super silhouetted filter point image visible smaller
Omemy	1	MA	current impact risks introduction monitoring impact frequently asked questions notes operational jpl table earth click impact based system detected potential observations events details full object lists designation sentry future page highly collision earth cases impact unusual monitoring review system continually current detected asteroid iau scans underway results catalog automated analyzed
cWj8HP	1	MA	web student aid click information additional addition alternate listing format student center braille 18004333243 federal publications aid audio 18004fedaid introduce college student pages web programs federal pay section publications aid application apply web federal section free student pages fafsa publications aid called student loans pages web federal section publications explain
jSNUzQ	46	MA	hsf realtime space human flight data control uptotheminute mission spacecraft path data make sky project applet reside significantly 336 download skywatch cache approximately access internet files 144 downloading 300 sufficient downloaded data 10 hard minutes clear required drive connection nasa time modem kbps updated official responsible amiko curator notices nasa
aJN540	1	MA	exportgov tapping financing government programs financing offers types description programs link learn apply click finance government assist related online services training products exporting events sales trade counseling service listed international local achieve specialist commercial goals programs receive contact marketplace enables obtain accept effectively export working needed grow capital development business
xRnjjS	4	MA	deciphering ncbi read methylome biol pa exp pubmed 2011 function web ncbi javascript site warning requires management citation external file generate software box life arizona usa tempe university school sciences state kbfloresasuedu 85287 874501 az po genomewide caused tenet mellifera based interspecific histories explicitly usage methylomes increased dna sequencing reveal
s1UtpZ	1	MA	mobile cells past pubmed dendritic decisions 17 2011 annu rev 201230122 immunol nov epub immunology usa university rockefeller cell ny york laboratory physiology 10021 remarkable focus preclinical themes experiments decisions current explain receptors systems uptake lineage guiding worldwide antigen frame challenges understood design result fail cell myriad progress adaptive tolerance
rG2ZEA	1	MA	living healthfindergov healthy quitting live learn quick smoking guide connect website hyperlink nongovernmental direct application hhs consistent hyperlinks states services human subject information hyperlinked united application contained health endorsement department website intended provided visitors external constitute applications privacy appearance practices products policies purpose link redirected quit steps follow information usaccessibility
qcR6vD	1	MA	flexibility esea department education learning educators focus outcomes improving flexibility gaps sea rigorous close education quality leaders specific educational nclb requirements voluntary provide agency state achievement equity department increasing local plans exchange students comprehensive act agencies designed student child schools opportunity behalf improve inviting instruction request 2001 statedeveloped increase order
9vukm0	1	MA	sec form accurate reviewed information necessarily commission reader complete exchange completethe securities assume determined filing 1 identity issuers information business contact 2 place principal persons 3 related clarification response clarification response clarification response clarification response clarification response clarification response clarification response clarification response industry group 4 size 5 issuer federal
ArYsnx	1	MA	lights fire tea burn due hazard recalls sterno cpsc consumers illegal instructed safety cooperation firm product voluntarily stop recalled immediately attempt recall resell conducted consumer product hour lights 5 tea units 10000 cases group ill des distributed plaines llc sterno light overheat burn fire tea hazard catching resulting wax posing
bmapXM	2	MA	photographs congress prokudingorskii prints collection catalog library online sergei prokudingorskii ca girls peasant mikhailovich 1909 digitized congress library images view display jpegstiffs sergei photographer features color ca library active scientist purchased 1909 images empire 1905 religious surveys distinct photographic people sites photographers subjects mikhailovich ambitious include public undertook sons 2607
twZf5B	20	MA	expansion usda district trail waterville resort pemigewasset ranger nepa service green forest construction valley ski projects peak information nepa fs information contact nh mountain headquarters71 drivecampton national forest white 03223 5366100 603 mountain web national site forest white main expansion mountain peak resort waterville national trail nepa construction green home
wnTaee	1	MA	news rxte gof search advanced messages list xtenews mailing archive results page publications rxte archive releases science highlights press rxte march 17 2012 february 15 2012 january 2012 23 items year news rxte 2012 2007 2006 2005 2004 2003 2002 16mar2012 friday maintained edt rxte 151400 gof modified page division
djCbkg	1	MA	sv1za 1 2 3 4 5 6 7 8 9 10 11 12 13 14 15 16 17 18 19 20 21 22 23 24 25 26 27 28 29 30 31 32 33 34 35 36 37 38 39 40 41 42 43 44 45 46 47 48 49
ifRMjx	1	MA	federal holidays 2012 6103 observed saturday usc federal schedule note sunday 5 establishes holiday public nonworkday monday friday holidays law employees work falls executive purposes years leave federal pay section legal 1 sunday 2 11582 3a holiday public 2012 monday falls day february january employees 1971 11 treated order specifies
wIU7Eb	3	MA	fatty ncbi polyunsaturate nutr pubmed br acidspecific mixed 2010 n6 function web ncbi javascript site warning requires management citation external file generate software nih md usa neurosciences biochemistry section nutritional biophysics bethesda membrane laboratory niaaa chrisramsdennihgov 093 ci statistical specifically ratio 22 95 4 extensive n3n6 increased combination confounding intake
ftEw0I	1	MA	uscis study materials english test sentences tools speak application writing write materials correctly test reading speaking ability form eligibility interview started uscis prepare read n400 portion determined officer components english naturalization study additional section products select short naturalization process overview video test providing requirements citizenship process eligibility naturalization presentation practice
tJVICl	1	MA	international station hsf space 7 expedition previous dark earth side sights bright earth sky window weeks couple watch dark indoors side glare hard past home sun moon lights adapt dominate turning turn adjusted doesnt takes brighter distinct slowly stars compartment eyes inside minutes close docking incredible interior portholes light nighttime
