p5BblD	1	OR	wildlife national ridgefield refuge randomimg tour units managed maximize nwr preservation mile wetland woodlands total 5218 carty management hiking 42 ridgeport habitat acres dairy seasonal objective guided floodplain columbia auto 2mile trail bachelor ridgefield marshes wildlife 12 natural grasslands roth waterfowl island river route geese secure habitat violent canada established
wL5Djv	1	OR	apod march 18 jupiter earth venus 2012 fascinating discover featured written image explanation day photograph astronomer cosmos universe professional 18 march 2012 sunk bright earth photographer sky degrees background world conjunction red venus humorous jupiter close creative lights approach pictured szubin pose notable daughter horizon striking image traveled visible brighter
wNCRbd	1	OR	advisory statistics transportation request council nominations rita pdf statistics transportation agency administration research bureau innovative technology dot advisory statistics transportation acts request council action nominations summary composed bts collected supported reliability quality statistics solicits acts interested relevance advise objectivity stakeholders transportation serve director persons analyses nominations disseminated consistency dot dates
eYHOxU	1	OR	living healthfindergov healthy live sleep learn quick guide connect website hyperlink nongovernmental direct application hhs consistent hyperlinks states services human subject information hyperlinked united application contained health endorsement department website intended provided visitors external constitute applications privacy appearance practices products policies purpose link redirected information usaccessibility privacy mapcontact act policyfreedom
wGldb6	1	OR	apod australia aurora february 1 red 2012 fascinating discover featured written image explanation day photograph astronomer cosmos universe professional 1 february 2012 atmosphere including magellanic earth disk galaxy ground sky showered weeks excited australia familiar aurora emanating oxygen large pictured night small distant back video highlighting particles state 1402 red
zhMOL4	1	OR	presidents make healthiest council year 2012 set presidents past council year activity incorporating physical start reminder achieve 2012 nutrition good ability healthiest reflect goals making great 12 lifestyle level healthy age months realistic commit work weight people presidents set council years resolutions fit percent approximately reality report attainable change january
ctbzWp	1	OR	center tornado watch prediction storm 68 68 status report watch messages information network service national warnings visit iwin weather interactive 50 mod 20 low 40 mod 20 low 30 mod 20 low high 70 f2f5 probability forecaster 70 60 table event increased category tornadoes probabilities issuing 5 low moderate events
HijGGo	1	OR	house white state union video watch enhanced transparency commitment browse house white logs visitor wait executive actions president obama federal receipt tax federal dollars tax spent people petitions create sign house inside white tour interactive event live facebook discussion participate click member facebook give click questions comments httpwwwwhitehousegovvideo ondemand library
o8Jyaz	1	OR	facts nutrition tips fit guidelines dietary americans tools based offers easy tips plate eating food diet understand teaches icon healthy wellbalanced components interactive breastfeeding weight summer general information late population updated seeking preschoolers women loss kids pregnant specific individuals recommendations calories manage balancing weight increase foods foods reduce building healthy
whChK5	1	OR	apod 20 ngc february spiral barred 1073 galaxy 2012 fascinating discover featured written image explanation day photograph astronomer cosmos universe professional february 20 2012 years bright centers galaxy system ngc young black prominently clusters spectacular dark bar 55 red upper bars telescope sea constellation space xray captured orbiting cetus pictured
w5eG9R	1	OR	mexican lee paint violation wrestling due lead figures action recalled standard carter named washington instructed voluntary consumers illegal commission safety cooperation announced firm product stop dc recalled resell attempt immediately products today recall consumer product figures action super luchamania units 7000 packs carter francisco san calif importerdistributor lee excessive surface
yD6xBg	1	OR	apod january dione titan 5 ringside 2012 fascinating discover featured written image explanation day photograph astronomer cosmos universe professional january 5 2012 spacecraft remarkably giant saturns outer 23 arcing slicing saturn shadows perpetual bright 300000 view 5150 frame titan perspective year pale bottom rings stunning shares moon haze moons orbiting
eaapDM	1	OR	natural senate energy committee resources sector energy modernize electricity seeks 2012 power standard generated nations future clean act guide bipartisan management resource reserve federal responsible stewardship strategy lays act helium 2012 files ferc documents item addition attached chairmans find au letter murkowski senator linked amendment text act joint result substitute
a09XqB	1	OR	center tornado pds watch prediction storm 58 status report messages watch 58 information network service national warnings visit iwin weather interactive high 95 high 80 high 80 60 mod high 70 60 mod high 95 f2f5 probability forecaster 70 60 table event increased category tornadoes probabilities issuing 5 low moderate
A95z3e	1	OR	science nasa physicsof whipped cream play join list download audio mailing dollop carefully cream 25 lets experiment whipped watch fridge spray 2008 science spoon april generous smoothly nozzle perched rigidly puzzling interesting flowed cream whipped notice liquid moment change made spoon solid insert science youre question pondering spoon mouth phenomenon
zyFo6r	1	OR	stream jet cassini mission wave solstice jupiter rattling spies features releases stream rattling spies jet jupiter cassini home news wave jet stream cassini wave jupiter rattling spies 13 mar 2012 jet stream cassini wave jupiter rattling spies jupiters direct jupiter planets earths atmosphere lead author comparing lot papers type simonmiller
ifRMjx	1	OR	federal holidays 2012 6103 observed saturday usc federal schedule note sunday 5 establishes holiday public nonworkday monday friday holidays law employees work falls executive purposes years leave federal pay section legal 1 sunday 2 11582 3a holiday public 2012 monday falls day february january employees 1971 11 treated order specifies
zXya3Q	1	OR	tilly facility recreationgov aframe details jane shed corps facility high maintained growth captilly operated elevation hood built district area condemned surrounded aframe located 5900 conservation cloud adjacent jane late1930s structures forest north civilian club trees part oregon cook line service tree mt historic nordic permit side feet facility trails year
d3KIKm	1	OR	ultrasound transvaginal encyclopedia medical medlineplus pelvic ultrasound including organs cervix womans vagina type transvaginal means ovaries reproductive uterus ultrasound pregnancy bent picture sends probe feet computer table lie monitor doctor tv create vagina health condom provider covered gel structures body sound knees reflect waves immediately holders care place transducer receives
zwjprT	1	OR	pr 2009 ncbi int gynaecol coenzyme pubmed q10 obstet supplementation function web ncbi javascript site warning requires management citation external file generate software ecuador central center pharmacology university quito experimental cellular eterancbmuceeduec metabolism unit biomedical risk reduces assess coenzyme q10 pregnancy coq10 preeclampsia supplementation primary assigned randomized rate statistical pregnancy
zNk3My	1	OR	interpretation ncbi dance tran autophagy pubmed snare atg9 musical 2012 function web ncbi javascript site warning requires management citation external file generate software ca clinic genetics usa microbiology gene2music los program medicine molecular biology mayo department california rochester school immunology institute university mn angeles geffen process humans primary interface protein
4dwBHm	1	OR	picture astronomy day fascinating discover featured written image explanation day photograph astronomer cosmos universe professional 11 2012 bright distant earth disk 20 fit easy weeks apogee photographed perigee dark day telescope pacific dense sun asia moon smallest full 300 annular 240 kilometers path super silhouetted filter point image visible smaller
vG8lcT	1	OR	apod thunderclouds jumping sundogs 8 november 2011 fascinating discover featured written image explanation day photograph astronomer cosmos universe professional altsee picture clicking resolution explanation version download 8 november highest 2011 phenomenon years web rapid sky reorients differently sundog return emerged words clouds lightning inspection temporarily enthusiasts past curious encouraged sum
IwrJxX	1	OR	king 17 results elections county april election special 2012 king wa 980572906 elections county 919 grady renton southwest tty 2062960108 2062960109 8003256165 8683 fax free phone 206296vote toll 830 weekdays hours 430 pm 27 apr results certified 2012 statements links results measure ballot information voter additional provide explanatory rates details
15V2v	1	OR	energy star home offers products find special energy recycling tax sales exist sponsor proper find special partners based efficient disposal submit encourage offers customers buy star provided incentives rebates credits qualified occasionally search service information products exemptions consumers code energy special zip area find offers star rebates qualified products enter
xLVZT0	1	OR	mart childrens lead chairs due stools standard gifts elegant recalled violation paint named washington instructed voluntary consumers illegal commission safety cooperation announced firm product stop dc recalled resell attempt immediately products today recall consumer product chairs stools childrens 1300 chairs 1600 stools units mart los gifts elegant importer calif angeles
w9Y3da	1	OR	apod saturns 22 january light hexagon 2012 fascinating discover featured written image explanation day photograph astronomer cosmos universe professional january 22 2012 planetary infrared discovered spacecraft motions saturns excluded flybys surrounds emanating rotating fully shape vortex continue corners unexpected imaged movie scientists orbiting shows saturn formation created study timelapse times
1fJal	1	OR	bernanke 21 deflation 2002 speech november deflation doesnt making happen excessive money lack stability world argued discipline stray expectations rise stripes bane inflation cage heightened standards large essential leaders creation industrialcountry serviceshas result factors public shocks monetary understanding inevitable goods central favorite pick equally economists number 1990s political tame selfconfirming
zEZvFj	1	OR	corps mlk project examples senior day retired developed community grandparent implemented impact service day foster organizations demonstrated rsvp greater jr companion leadership communities senior projects volunteer king luther made programs created martin partnerships seniors adults people ca ages young community years partnered assemble preparedness kits education vulnerable abilityfirst information recreational
zZqILK	1	OR	solstice disruption mission cassini images home image details 1062 5150 titan 660 ring angle degree northern image rings sunlit shows tethys saturnfacing plane kilometers sides center 3200 larger side miles left view acquired image visible spacecraft cassini scale 22 tethys approximately camera 7 8 red titan million 12 kilometers 2011
eFVbNf	1	OR	life form nasa science story streaming downloadable file audio listen californias 30 lake mark twain 2003 mono july didnt earthis lies lonely 1872 silent picturesque solemn hideous loneliest spot sailless desert tenant seathis graced lifeless treeless roughing travelogue wrote beautiful national astrobiologist technology richard space hoover huntsville nsstc nasas center
8MNng	1	OR	bridges bts deficient national structurally system maps highway rita va ca al ar vt il ga az id ct nh nj nm tx la nc ne tn ny pa ak nv pr wa de dc wi wv iaks fl wy md ma ut mo mn mi ri mt ms sc
zkr1lz	1	OR	climate utilities water ready epa content area jump main navigation contact water climate sector sea impacts contribute challenges weather stormwater quality availability temperature complex health potentially public rise pose utilities water environmental sustainability shifting significant drinking precipitation change extreme climate missions scenario level fulfilling implications events patterns resulting runoff wastewater
yq1gmf	1	OR	cell cancer cd4 res cel ncbi adoptive pubmed therapy lymphoma 2012 function web ncbi javascript site warning requires management citation external file generate software school usa stanford university medicine california department limited activated effector identify human adoptive treatment cotransfer murine foxp3 cd137pos cd4 therapy lymphoma cd137 excluding persisted findings consistent
6YyzPo	1	OR	ncbi kinase biol activatio signaling ampactivated protein chem pubmed 2010 function web ncbi javascript site warning requires management citation external file generate software usa north center institute study disease alzheimers research feinstein manhasset 11030 shorelij york litwinzucker medical show activated brain underlying including kinase controls finally potential extracellular rapamycin peptide
coqf7D	1	OR	center tornado watch prediction 108 storm status report 108 watch messages information network service national warnings visit iwin weather interactive 40 mod 20 low 30 mod 30 mod 40 mod 30 mod high 70 f2f5 probability forecaster 70 60 table event increased category tornadoes probabilities issuing 5 low moderate events
nKPMiK	1	OR	involved corps citizen communities uniting preparing nation locate login contact council moved page httpcitizencorpsgovgetstartedtraininggetinvolvedshtm andor links update questions bookmarks citizencorpsdhsgov email links plugin require plugins page view readygov corps notices disasterhelpgovcitizen plugins home fear register privacy federal faqs femagov citizen widgets act policy dhsgov data foia bulletins annual reports servegov
AtbjtE	1	OR	operations administration 3councilmember attorney 6councilmember dist 9councilmember 4councilmember von executive reagan julia lloyd reichbauer gossett 2councilmember huffprosecuting sue harasheriff sherril phillips mcdermott lambert 7 jane patterson kathy 5councilmember dunn constantineassessor dan director larry ferguson 8councilmember 1councilmember rahrelections hague satterbergcouncilmember bob dow joe juvenile judicial servicesdept executive detentiondept community human information
qI2Ju0	1	OR	amendment constitution slavery 13th abolition skip navigation amendment house national general 13th proposing resolutions 17891999 united group constitution january acts archives congress government joint 1865 11 states records 31 record enrolled resolution amendment jurisdictionread december whereof 13th servitude crime subject united ratified convicted duly 6 party passed congress involuntary documents
rieB3Q	1	OR	apod september 4 saturn 2011 shadow fascinating discover featured written image explanation day photograph astronomer cosmos universe professional september 2011 4 discovered bright earth scattering giant saturns main spectacular outermost dark shadow saturn spacecraft night side view unexpected hard back eclipsed pale blue sun rings moon orbiting newly hours silhouetted
vGcl4i	1	OR	apod 15 december umbra earth 2011 fascinating discover featured written image explanation day photograph astronomer cosmos universe professional 15 december 2011 partial earth image dark background half shadow shadows easily shaped 51 large relative result saturday phases space pictures section recorded moon lunar moons shows full completely china path extending
yHrAon	1	OR	reopen mount park rainier national search family process weekend play reopening aftermath national shooting saturday recovery leading snow horrific anderson tragic 7 fatal public begin loss time park margaret services exception ranger january mount events rainier family lieu memorial service anderson week plans fund key date flowers bank margaret requesting
yInBWz	1	OR	youth preparedness corps citizen communities uniting preparing nation locate login contact council moved page httpcitizencorpsgovgetstartedyouthyouthindexshtm andor links update questions bookmarks citizencorpsdhsgov email links plugin require plugins page view readygov corps notices disasterhelpgovcitizen plugins home fear register privacy federal faqs femagov citizen widgets act policy dhsgov data foia bulletins annual reports
xKxzJM	1	OR	apod march 14 sun angry erupting 2012 fascinating discover featured written image explanation day photograph astronomer cosmos universe professional march 14 2012 suns years earth captured current giant system field baddest plumes plasma magnetic puffs colorful dark cool twisted tendril inverted ejections shown sun particles chromosphere bird pictured emitted sunspot
dbubFM	1	OR	city live seattle council meetings council progress viewed image video experience council seattle click window live difficulties meeting meetings channel scheduled screen watch simulcast hear technical refresh continue time audio website watch meetings past council visit seattle channel calendar council city 600 wa floor disabilities 2nd hallaccess individuals fourth 98104visiting
zA2sdP	1	OR	investing house energy future clean address white weekly state union video watch enhanced transparency commitment browse house white logs visitor wait executive actions president obama federal receipt tax federal dollars tax spent people petitions create sign house inside white tour interactive saving money states talks reducing united families factory pump
zpMNgP	1	OR	inmate andriano 191593 frequenting bars discreetly discontent andrianos poisons obtain engaging cease poison ordered insurance researched affairs resentful business profit began separate extramarital responsibilities policy scheme life increased allegedly pose death effects andriano friends working ill wendi kill hatched asked husband psychologically physically observed andriano abuse signs claimed friends abused
eyxbj	1	OR	quit guide smokefreegov congratulations smokefreegov taking cigarette step smoking quitting exsmokers hard experts expect quit prepare support describes problems prepared weeks days times guide wrote guide quit complete view quit free order print air guide download clearing copy quitguide mobile free download version today home quit stepbystep guide expert talk
oiPpxV	1	OR	mountain rocky service research station forest events rmrs sims rob presenters manager hubbard 1 program scientists include rmrs polly bruce regional hydrologist water 2 hays elder rhoades region chuck kelly register webinar information request megan accommodations matonis contact special informations series webinar forests future information nondiscrimination service privacy house usagov
