ahcPoC	1	OR	states patent united 5927278 fabricated converting tending longitudinal simulating rupture location condom woman material fluid dark cutting front acute side circumscribing bleeding sponge sexual provided opaque closed conditions red ends repository colored conceal retain suitable forwardly female open virgin disposed flexible compartment optionally option formed released simulate partially indicia weaker
wjdMSq	1	OR	management is922 emergency institute applications gis february 29 2012 emergency topics community addressed technology management gis goal support explore include completion participants planning management emergency mitigation individuals designed operations supervise response recovery hours 3 3 updated 2012 february 29 links nongovernment social applications web fema provided reference media companies sites
6oimJV	1	OR	map national viewers map national skip links viewer asked contact questions frequently faqs open click quickstart gallery map national mashup top 6px fff find hza maps border styledisplay documentgetelementbyid popularmaps 4 layerrefdisplay local 3px emergency 1pt desc 10px documentlayerslayernamedisplay national relative configfile examples layerref documentall 0875em state 800px verticalalign backgroundcolor
Aa0BkI	1	OR	sec form accurate reviewed information necessarily commission reader complete exchange completethe securities assume determined filing 1 identity issuers information business contact 2 place principal persons 3 related clarification response clarification response clarification response clarification response clarification response industry group 4 size 5 issuer federal select 6 claimed apply exclusions exemptions
AnkFiD	1	OR	acad sci ncbi resistance pubmed insulin cellular natl 2009 proc function web ncbi javascript site warning requires management citation external file generate software australia street institute medical klh8stvirginiaedu darlinghurst research program 384 nsw garvan obesity victoria 2010 diabetes caused resistance poorly rapid rapidly parameters production defining superoxide results uncouplers cellular
sgivkG	1	OR	dec whats joins 56 system jupiter exploration solar news november moon 2011 events week glide watch moon step jupiter evening object noticed high fall bright doubt jupiter youve skies jupiter perspective planets earths system moon orbits link solar zoom view httpsolarsystemnasagovnewswhatsuparchivecfm whats night sky month find eyes recreate system nasas
wYNKHk	1	OR	overview webinar state york lgrmif 1112012 archives workshops webinar lgrmif 11 january webinar wednesday held 2012 description government overview fund session records provided management applying grant grants improvement program lgrmif local records grants purpose establish governments management develop programs program components lgrmif local government webinar general planning apply category grant
b3NnsW	1	OR	center tornado watch 37 prediction storm status 37 report watch messages information network service national warnings visit iwin weather interactive 50 mod 20 low high 80 20 low 30 mod 10 low high 90 f2f5 probability forecaster 70 60 table event increased category tornadoes probabilities issuing 5 low moderate events
w4NJML	1	OR	inmate 174456 cromwell sentenced march louis robert 2003 6 cromwell count 1 sentenced murder degree maricopa 82001 death cr2001095438 county short committed lethal injection october stephanie 0351 dispatch female apartment police approximately call 8 hysterical received stick baby daughter october identified 3208 believed male ran dead heard street home flower
yM3Ls9	1	OR	emotion soc ncbi neural disrupts pubmed cogn activity neurosci affect du 2011 function web ncbi javascript site warning requires management citation external file generate software usa street psychology 603 university 61801 illinois naomisadehgmailcom daniel champaign department east urbanachampaign il represent examining psychopathic temporal salience positively evidenced personality increased frontal activation
GFh2dX	1	OR	ncbi microbiol metabolome appl environ transcriptome pubmed 2012 function web ncbi javascript site warning requires management citation external file generate software correspondence kistler address corby hckistumnedu mannosylerythritol involved adhesive decreased expressing antagonism biosynthetic transcriptome ultimately clustered unique secondary niches severely metabolite uncharacterized proteins loses accumulation biomass proportionally growth acid declined
bikL2	1	OR	multiple 1997 endocrine 1 neoplasia release news gene type cancer national men1 type institutes islet 1 issue leading 18 cell benign health parathyroid scientists discovery nih multiple bethesda endocrine glands journal reported pituitary science md pancreatic tumors identified april team gene neoplasia prevent product design result malignant protein drugs treat
zQVdMQ	1	OR	fax fire hp burn hazards due recalls machines named washington instructed voluntary consumers illegal commission safety cooperation announced firm product stop dc recalled resell attempt immediately products today recall consumer 1050 product 1040 hp fax machines canada 240000 mexico 928000 units alto importer palo hewlettpackard calif fax overheat failure fire
xAYSs6	1	OR	bridge usda service supply water system surface improvement creek ranger nepa district forest waterline rock bendfort projects bend information nepa fs information contact 63095 national rdbend forest deschutes market 97701 541 3834000 web national site forest deschutes main bridge waterline supply bend national water system improvement creek nepa surface deschutes
HxGPkv	1	OR	apod april tungurahua 2 erupts 2012 fascinating discover featured written image explanation day photograph astronomer cosmos universe professional april 2 2012 1300 roughly high tungurahua erupts years shines cloud peak glows photographer sky lavalit 5000meter located hot 2006 captured starlit white image pictured ejected pours explanation distance visibly dark fell
zkzZ47	1	OR	volcanic natural island hazards sea red december zubair pulse 60 violent rising yemeni sea navy activity helicopter captured video northern 23 began sulfor 40 located edge details eruptions dioxide white 2011 red satellite shallow forming eruption coast middecember reported imagery kilometers satellites revealed explosions recent saba showed island highresolution submarine
wAO5RR	1	OR	19 january national update thursday situation fema 2012 information warnings west region effect watches remain advisories wwwwrhnoaagov numerous latest heavy flash series move pacific wyoming mountains saturday montana northern amounts coasts cascades copious 3 low moisture 6 flooding idaho systems rainfall heaviest inches utah oregon coast pressure carrying california snowfall
A134y5	1	OR	24 apod january norway aurora 2012 fascinating discover featured written image explanation day photograph astronomer cosmos universe professional 24 january 2012 earth captured northern sky spectacular aurora recombining oxygen large activity round throwing protons sun flare pictured eagle night free latitudes days magnetosphere whats feel powerful mass cloud earths fast
yLNJHc	1	OR	ncbi 2011 calcium pubmed role clin gene expression urolithiasis function web ncbi javascript site warning requires management citation external file generate software urology medical department japan kanazawa university familial human consists japan corroborated oxalate technological risk combination advances world chips association entire identifying specific common metabolic matrix factors affecting progress
vfnNaB	1	OR	ncbi trace metabolic nutritional elem biol pubmed effects res 1998 function web ncbi javascript site warning requires management citation external file generate software australia biochemistry university sydney department nsw urinary urine obtain dose markers impact number 22 plasma mgd mg results effects drinking processes cholesterol rats significantly metabolic humans 84
2f89BT	1	OR	200443 august revenue rev bulletin 2 2004 proc internal irs resources table contents 6041a code revenue purposes agents internal addition section transactions matching tin 6041 authorized payors program reportable 3406 optional payment card service determining payments procedure 6041a code revenue accept general assigned businesses subject category codes merchantpayee provide section
zHsrnj	1	OR	thomas congress text bill library 112th 20112012 hcon ih 107 force misdemeanor high sense constitution section offensive crime 4 constitutes authorization expressing congress president article ii clear prior impeachable act military jones committee judiciary submitted concurrent mr resolution referred force misdemeanor high sense constitution section offensive crime 4 constitutes authorization
pqkp2G	1	OR	med ncbi laborator genet clinical eosinophilia familial pubmed 1998 function web ncbi javascript site warning requires management citation external file generate software 20892 usa bethesda cancer linaepndcencinihgov institute national epidemiology genetic branch maryland mechanisms pericentric underlying granulocytemacrophage serology symptoms autosomal factor demonstrated affected 10 serologic familial inversion level evaluation parasitic
3ixzg	1	OR	caring childs mental health childs mental mission sites overarching childrens caring system effort support samhsas increase approach health comprehensive public awareness marketing social samhsafunded purpose services strategic care 1994 created communications team strategies works stimulate information childrens national visit event wwwawarenesseventorg health today rsvp day awareness mental dont washington wwwsamhsagovchildrenliveeventasp
lrHRt1	1	OR	personal alerting fema localized network plan 10 number date fnf11002 release 2011 plan work features 081814 tuesday 10may2011 modified links nongovernment social applications web fema provided reference media companies sites endorse 6462500 management emergency 20472202 federal sw agencyus washington dc security500 street homeland department tty assistance step 46275853 800 guide
wpCGS3	1	OR	apod 23 skyscape february zodiacal 2012 fascinating discover featured written image explanation day photograph astronomer cosmos universe professional february 23 2012 scattered hugging bright zodiacal 20 cherry sky young brighter degrees skies evening march skyscape early conjunction transparent february venus upward frame jupiter sun moon state dominate ecliptic brightest months
6OvCsb	1	OR	preserve memorial timucuan national ecological historic caroline fort search wetlands coastal hardwood discover human kingsley includes timucuan 6000 dunes visit plantation caroline preserve beauty coast atlantic marshes years fort hammocksthe experience unspoiled salt history school slave graveyard university florida archaeology plantation field kingsley quarters found evidence 2010 florida anniversary landing
diF0vQ	1	OR	contact usda agriculture 1400 service headquartered address washington dc usdas department ave postal mailing sw independence 20250 information 202 hotline 7202791 questions topics stored keywords find specific question submit usda knowledgebase online email ability clicking address frequently opportunity advanced search remember tab phrases required asked subtopics usda agencies find information
wmtrYB	1	OR	natural fracturing gas hydraulic extraction shale epa jump main content contact fracturing energy reserves americas technologies plays responsible hydraulic access offers role formations viable resources development greater advances gas shale commercially environmental important drilling key benefits horizontal security vast natural nations enabling future economic clean result work obligations respect focus
cQSs0S	1	OR	adults ncbi arch 2005 crime pubmed psychiatry gen sever victimization function web ncbi javascript site warning requires management citation external file generate software northwestern school usa chicago university medicine feinberg lake 710 sciences shore psychiatry behavioral department drive psycholegalnorthwesternedu 60611 il illness mental community victimization crime live smi risk deinstitutionalization
HipZdt	1	OR	surg training ncbi vasc claudicants 2000 endovasc pubmed exercise eur function web ncbi javascript site warning requires management citation external file generate software hospital chester uk vascular department surgery countess walking metabolic respect cardiovascular aim factors improvement mwd exercise distance training respiratory adaptations study maximum claudicants investigate improves heart months
zui2a7	1	OR	home usda kyf compass food farmer compass usda videos discover market pictures field systems farmer local supporting food regional watch compass segment case read learn growing studies kyf computer file compass open acrobat experience reader pdf save map 20092011 years visiting food regional programs farmer usdasupported shows interactive local projects
whjRRa	1	OR	zion ranger national minutes park search diversity incredible national park ranger explore garretson habitats zion juliet learn park prepared ranger expect year special baker time holly fantastic zion national park discover ranger barb fossil graves revealed history closer zion takes snail tim park ranger smallest lutterman world hiking canyoneering problemsolving
wlQXra	1	OR	government money states selective usagov services education united register blog asked anonymous money register selective services education work ages grants including service eligible federal college men selective student 1825 study register receive aid order andor violation reaches years registration registrations fine late fails accepted convicted window 250000 prosecuted prison technically
9Lwh52	1	OR	water contaminants drinking epa content area jump main navigation contact water contaminants drinking links national primary regulated apply limiting details visit enforceable health systems legally public regulations levels drinking water protect list npdwrs standards contaminants alphabetical regulations links primary water sheets listing drinking fact cramps illness diarrhea vomiting gastrointestinal fecal
i8lAE	1	OR	glacier national park search lodges awaits wilderness trails solitude 700 discover national relive glacier forests glaciers paradise pristine native meadows mountains transportation spectacular seeking park lakes visitors explore historic adventurous alpine rugged hikers days experience miles stories americans chalets summer direction links pointed vacation planning quick summer visit year begin
A113rm	1	OR	corps announcing creation blog fema discrmination age isnt 1824 set adults enter due mentioned apply odd develop 21 young long program wwwamericorpsgovnccc leader team offers americorpsnccc part workforcethat skills 18 age opportinuty nccc limit learn sector government workforce private expansion develop skills workers job cares join citizens corpssee httpwwwcitizencorpsgov tax
wn5klq	1	OR	emergencies 13 prepare snow forecast jan weather winter wa king 98056main management office emergency 8005235044fax 3511 2062054056ecckckingcountygov ne free 2nd county phone 2062963830toll streetrenton office 911 program enhanced seattle wa2062963910e911 forecasting office snowfall county weather businesses cold management winter service national emergency emergencies king prepare days urges residents family sends
uy9iwF	1	OR	webb james telescope space join problems challenge nasarelated rwiw engineering nasa design realworldinworld solve nearing designs 27 end rwiw 2012 website completed realworld phase posted challenge january realworldinworld phases challenge rwiw webb telescope process related grades design mentored leader space selected virtual 2 setting resources students robonaut 712 realworld student
wJPcoM	1	OR	inmate 057713 ellison opinions handsproceedings charles victim committed previous 24 death pecuniary smith tape pending judge february lillian january verdict release vincent homicides direct depraved defense home richard robert moon masking appeal arizona choked conviction trial published bound commission convicted start joseph cords prosecutor suffocated telephone heinous gain broke circumstances
GQ8Dmt	1	OR	apod march 22 supernova m95 2012 fascinating discover featured written image explanation day photograph astronomer cosmos universe professional march 22 2012 neighbors discovered bright distant follow galaxy compact group young clusters galaxys good march colorful surrounds famous pinkish prominent bar traced identified small surrounding video portrait m95s arm blue telltale
yrfXg6	1	OR	inmate 136521 anderson shot agreed held kill poyson leta cut 21 bludgeon finally kagen gave hit killed bread ended bobby 50 rock trailer lantern crushing decided home driving robert knife eating august frank night hitchhiking hours death wear boy 39 yard dinner cinder block son county delahunt awoke 15yearold letas
GN1vZx	1	OR	blog business fema lincoln oregon county nothingg dear ricketts femathanks comment accordance comments blog moderated policy femas links nongovernment social applications web fema provided reference media companies sites endorse msgdata washington street apply management prepare federal rates homeland department 4fema emergency dc 43362 20472202 sw agencyus security500 6462500text tty assistance
zQ3nay	1	OR	sec form accurate reviewed information necessarily commission reader complete exchange completethe securities assume determined filing 1 identity issuers information business contact 2 place principal persons 3 related clarification response clarification response clarification response clarification response clarification response industry group 4 size 5 issuer federal select 6 claimed apply exclusions exemptions
GXFy79	1	OR	duncan importance carolina innovative affordability clyburn highlight college joins department congressman education reform south secretary superintendent leaders simons community county held elementary follow mcginley mayor 1050 duncan discussion engagement clyburn availability joseph public riley north business press 1135 schools policymakers school join james reform event teachers nancy charleston roundtable summerton
wCIR3s	1	OR	inmate 223626 chappell shackleford previous apartment police young complex march early cutting report continued morning night found competition year investigation dating frustrated missing kristal attention hours incident death choked carried brusing supply scene son involvement drowned proved 2 relationship child shortly 11 12 middle air called affection ordered december kristals
mZKOnE	1	OR	mobile homophobia pubmed homosexua 1996 aug10534405 abnorm psychol georgia psychology usa university athens 306023013 department assigned aggression monitored penile buss 29 exclusively increases affect videotapes erection admitted individuals unaware exposed erotic individual sexually nonhomophobic questionnaire denies index perry increase participants consisting men groups group circumference 35 female differ 1980 basis
bVFxIs	1	OR	full pain marijuana clinicaltrialsgov text effects vaporized view neuropathic measure marijuana utility specific mood psychomotor subjects collected performance population evaluation pain evaluate effects neuropathic painrelieving cognitive study impairment aim relief vaporized opioid primarily results chronic experiments enhancement positive subjects antagonism marijuana contrast demonstrated conflicting perception pain users antinociceptive normal reversed
92kD7Z	1	OR	center tornado watch prediction 61 storm status 61 report watch messages information network service national warnings visit iwin weather interactive high 70 50 mod 50 mod 30 mod 40 mod 30 mod high 80 f2f5 probability forecaster 70 60 table event increased category tornadoes probabilities issuing 5 low moderate events
xIZOZw	1	OR	planning urban archived census transportation metropolitan living archives fhwa rural areas issues population office realty environment planning hepplanning contacts glossary guidance awards publications events contacts information murakami contact elaine commonwealth 1us defined territories pacific states trust district virgin rico puerto include columbia population 50 islands residents 2urban defined 49999 50000
yBd5pq	1	OR	fraud people alert diabetes government money defraud diabetes plot criminals target people american steal fraud people alert diabetes media deputy oig investigations interviewed baskin general director communications oigs gary roberta inspector cantrell precise diabetic financial vary order strips meters seats additionally orthotics braces information confirmation personal beneficiaries offer generally offers
qSkIlE	1	OR	catalog pia14731 page years earth remarkably galaxy poorly ngc stars 281 gas exception cluster pumped found unfettered view energy understood lifetime giving responsible astronomers located highmass star important formation dust obscured light 6500 rule plane 1000 deaths image powerful infrared supernovas seed winds galactic galaxy blue environment eventual ngc purple
hZjdDi	1	OR	information center cpsc carbon monoxide colorless killer gas invisible carbon monoxide poisonous odorless called 150 people related states appliances year stoves heaters fireplaces fuelburning unites include nonfire accidental improperlyused furnaces water faulty incorrectlyvented die products poisoning consumer shed portable family kill home generator generators doors vents basement windows inside garage
7DgBXv	1	OR	2011 automotive 1975 otaq lightduty trends emissions dioxide fuel carbon epa technology economy jump main content cars trucks light area search contact additions epa recent years mile previous based improvement fuel 2011 2010 mpg report projects trucks standards miles trend trends year sport provided co2 pickup dioxide reverses slight cars
H2aA1A	1	OR	releases press health listing department public discharging debris comprises swimmers storm jonathan drains mph chemicals areas md individuals officer small fielding outing enjoy rivers bacteria fortunately health contaminate advise trash beach public possibility stay director water ill surfers portion creeks advisory discharging rainfall rivers depending 28 storm beach pm extended
yrzvgt	1	OR	capacity ridge puts electricity national oak spotlight ornl generation laboratory nations tool characterization generation 700 plant states determine united ridge 25acre oak sites research potential candidates screening department divides siting electric power tool million expansion results energys ornl produce report prepared types institute presented cells studied analysis orsage quick 152page
ynPFSk	1	OR	gray service trapped national ice noaa fisheries sea whale marine watching photo share photos comments whale submit learn snorkling fishing photo national scanned 1988 sea seattle event film ice 2012 trapped big lab slides released whale marine barrow gray february inspired alaska miracle mammal called gray story trapped related ice
zlUZk0	1	OR	ars publication storage request tillage minnesota cornsoybean biennial nitrogen carbon rotation greater limited zea managed glycine storage years nitrogen sampled masses alternate intensive treatment fuel employed midwest greater tillagerelated mays rotation entire lsoybean yields enhance cropping reduced upper employing maximize findings sensitivity observed year 03 co2 06 notill content dioxide
whcsLd	1	OR	crash snowmobiles arctic due hazard cat recalls cpsc consumers illegal instructed safety cooperation firm product voluntarily stop recalled immediately attempt recall resell conducted consumer product snowmobiles arctic cat december previously models recalled units 19000 2011 river minn falls arctic thief cat manufacturer loss lower crash loosen hazard control tierod posing
oAEynS	1	OR	encyclopedia medical pain neck medlineplus muscles pain cushioning spinal discomfort vertebrae neck disks nerves include structures people describe difficulty moving neck sore stiff side nerve slipped feel pressing disk spasm tingling arm pain weakness hand pinching significant neck numbness nerves muscle involves bending jarring activities sleeping high strain computer uncomfortable
HLWFOC	1	OR	nucle phys ncbi daiichi pubmed health fukushima 2012 response epa function web ncbi javascript site warning requires management citation external file generate software division tupinedwardepagov united usa office pennsylvania dc agency radiation 1200 washington air states environmental protection 20460 avenue indoor nw operations daiichi existing supplement identify filters inquiries staff
wLrxuV	1	OR	ireland views items online group view marc record item view responsibility rights assessment distribute library httpwwwlocgovrrprintresrightshtml information grant generally publish collections congress permission material restrictions deny rights page responsibility rights assessment selection describe high represented individual images generally online multiple records catalog groups demand group made items retrieved 1 desired
uBdhaV	1	OR	adults ncbi racialethnic differences consult pubmed clin 2012 psychol function web ncbi javascript site warning requires management citation external file generate software applied educational ma psychology usa university northeastern 02115 dfrankoneuedu boston department counseling characteristics americans scarce racial suggest binge demographic investigate symptoms participants treatment enrolled racialethnic caucasian differences eating
