89BTGc	1	NY	center tornado watch prediction storm 6 status report watch messages 6 information network service national warnings visit iwin weather interactive 60 mod 20 low high 70 50 mod 30 mod 10 low high 90 f2f5 probability forecaster 70 60 table event increased category tornadoes probabilities issuing 5 low moderate events
zKeNCC	1	NY	estrogen ncbi exogenous conseque pubmed protects menopause mice 2012 function web ncbi javascript site warning requires management citation external file generate software ecology nutritional college human nj tx 2department sciences molecular texas biology 1department school natural princeton university austin estrogen cancer int growth determine mammary death alcohol consumption factors leading
w505C2	1	NY	february house photo white day 2012 state union video watch enhanced transparency commitment browse house white logs visitor wait executive actions president obama federal receipt tax federal dollars tax spent people petitions create sign house inside white tour interactive february house check offices photo 2012 picks white day president house
w6SjFy	1	NY	tip exercising medlineplus health pregnancy pages related medlineplus manage healthday pregnancy aches prepare pains exercise body birth child news great foundation noting doctors pregnancy approval nemours benefits exercising potential include mobile twitter subscribe version updates follow email rss national guidelines accessibility library human institutes quality 24 copyright privacy health bethesda
znNWEe	1	NY	fingerprinting food andrew governor cuomo prevent hunger series home children living state cuomo food measures york governor called hunger year estimated children yorkers eligible federal increase stamps 2 families combat food funds unclaimed child billion receive 30 leaving eliminating stigma reducing fingerprinting yorkers assistance increase participation food programs work governor
5LI7I	1	NY	museums national libraries archives main page presidential skip navigation brochure view director united appointment office susan libraries archivist david states ferriero today donius presidential announced read press release activities educational documents timeline video presidents audio find presidential listen richard house william jefferson administrations presidential clinton white nixon discuss staff inspire
b8z4UW	1	NY	george usn navy admiral biography dewey biography record service george farenholt fleet ammen admiral dewey creating office act navy admiral death general navy orders dewey battle manila bay bibliography canvas oil nm painted usn george 72x48 miller 1911 admiral 20th dewey biography midshipman september december year montpelier rank advancement born
x4Hpxy	1	NY	harbor safe drug trafficking act elimination 2011 tough 313 states scott drug activity law federal make occur speaker criminal zealousness conspiracies hr rise virginia expansion completely united opposition safer engage bill mr laws called show money pointed distribute fivefold including expressed committee years expressions involved ward impact increase questionthis conclusions
4tSh9L	1	NY	apod 20 january universe 2010 fascinating discover featured written image explanation day photograph astronomer cosmos universe professional january 20 2010 years produced distant galaxy million highlights signals finally atlas humanity big showing famous bang background satellites radio ten generation video visualize space movie microwave research scientific emitted galaxies extent starts
zn2ApT	1	NY	dig sci ncbi bowel syndr pubmed irritable 2010 permeability intestinal dis function web ncbi javascript site warning requires management citation external file generate software netherlands center gastroenterology university departments research angelekerckhoffshotmailcom utrecht gastrointestinal medical unit glycols urinary ratios show timedependent results lactulose agents irritable 0012 noxious 1500 compromise 400 greater
ylHOD8	1	NY	11 apod march sombrero infrared galaxy 2012 fascinating discover featured written image explanation day photograph astronomer cosmos universe professional 11 march 2012 tomorrows existing galaxy 50000 web sharpened glows 28 editors virgo policy big michigan dark band hubble years discuss specific small telescope bonnell calendar constellation index apod space umcpnasa
A9087h	1	NY	bio 52008 reilly astronaut james james phd ii nasa astronaut reilly force hometown born mesquite skiing home considers mountain hunting personal flying enjoys soccer texas march photography 1954 running base data 18 air idaho fishing high texasdallas education 1987 dallas lake master texas degree bachelor graduated school highlands 1995 1977
qfePq9	1	NY	summer apod nights august dream 5 2011 fascinating discover featured written image explanation day photograph astronomer cosmos universe professional 5 2011 august summer results yellow planning earth concentric rotates find photographer fix late worth familiar michigan fairies fall awaken continued rosinski streaks traced night series scenes asleep images 4555 arcs
6JoQec	1	NY	center tornado pds watch prediction 5 storm status 5 report watch messages information network service national warnings visit iwin weather interactive high 90 60 mod high 90 60 mod 60 mod 30 mod high 95 f2f5 probability forecaster 70 60 table event increased category tornadoes probabilities issuing 5 low moderate
I6ReqK	1	NY	minority office national standards health culturally linguistically services clas skip navigation accessible providers principles communities individual primarily linguistically encouraged make health served integrated activities partnership culturally undertaken services care directed organizations standards practices organization clas organized themes competent organizational 47 access 814 competence mandates recommendations framework cultural guidelines culturally varying
w38DOk	1	NY	bmc poop ncbi med pubmed owns genomics 2011 insights function web ncbi javascript site warning requires management citation external file generate software canada psychology university 2w1 n1g department guelph ethical human scale legal research sharing compounded microbiome complicated data biobanking implications large social focus human issues relationships rapid add versus
v60Hyy	1	NY	10 apod 2011 supernova rcw remnant historical november 86 fascinating discover featured written image explanation day photograph astronomer cosmos universe professional 10 november 2011 chinese thermonuclear lack yellow infrared galaxy 21st rapidly remarkable density energies sky emitting material wave cooler shock identified chandra shows traces xmmnewton view velocities 50 understood
hVeOIy	1	NY	center tornado watch prediction 64 storm status 64 report watch messages information network service national warnings visit iwin weather interactive 40 mod 20 low 30 mod 30 mod 40 mod 40 mod high 70 f2f5 probability forecaster 70 60 table event increased category tornadoes probabilities issuing 5 low moderate events
zwZYVf	1	NY	med res ncbi research access pubmed health internet 2011 public function web ncbi javascript site warning requires management citation external file generate software school jamieokeeffestanfordedu usa stanford university education ca 94305 national years ebp learning institutes open increase mandated research access lifelong potential health policy place public embargo nih practice
eR8uTs	1	NY	potency methods testing workshop safety alternative niceatmiccvam vaccine conference md usa center natcher september national william health bethesda institutes 2010 1416 procedia vaccinology workshop published report view factor read january environmental niehs workshop report article newsletter issue 2012 notice publication announcing read register html fr 77 federal workshop january report
xobIyT	1	NY	fugate administrator blog lay statement bob passing fema comment accordance comments blog moderated policy femas links nongovernment social applications web fema provided reference media companies sites endorse msgdata washington street apply management prepare federal rates homeland department 4fema emergency dc 43362 20472202 sw agencyus security500 6462500text tty assistance step 46275853
zPZpYl	1	NY	apod 21 january days sun 2012 fascinating discover featured written image explanation day photograph astronomer cosmos universe professional january 21 2012 summer caused month bright paper radio spells 21st northern chosen sky suns 2011 sunny dark records made years day entire university hemispheres weather fixed view telescope trails gaps sun
GBcNCI	1	NY	onsafety envenenamiento evite aprenda este una seguridad mire vida de salve los video consejos captionsfontsize gt false 90124 image player file plugins flashvars swfobjectembedswfonsafetywpcontentpluginswordtube46playerlicensedswf captionsstate 320 params attributesid poisonpsasp onsafetywpcontentuploadsvideospoisonpsaspjpg 440 var cdata onsafetywpcontentuploadsvideospoisonpsaspadbxml true captionsfile onsafetywpcontentuploadsvideospoisonpsaspflv 16 onsafetywpcontentpluginswordtube46captionsswf allowfullscreen attributes en ver windows media de formato httpwwwcpscgovonsafety201103eviteunenvenenamiento address post
bnZMbb	1	NY	1995 carbohydratecraving ncbi res obes serotonin brain pubmed obesity function web ncbi javascript site warning requires management citation external file generate software cambridge cognitive usa brain institute research sciences clinical massachusetts department technology 02139 center feedback brain sleep smoking normalweight involved tendency snack producing treatment rich plasma serotoninreleasing food couple
yA8Y6z	1	NY	intake ncbi nutr calcium pubmed health clin 2012 protein balance eur function web ncbi javascript site warning requires management citation external file generate software nutrition ingestive paris france crnhidf behavior umr914 agroparistech physiology stones urinary skeleton observational depend absorption presence environment complex hip increased combination dependent induce effects impaired loss
apA7LO	1	NY	fuels gasoline e15 ethanol fuel blend additives epa content area jump main navigation contact fuel fuels additives height16 30 15 img vspace0 hrefmmpneed altnew text width34 hspace0 2012strong border0 nbspstrongmarch 2011 srchttpwwwepagovepafilesimagesnewengif datedcodemarch thanksa partial results decisions based 21 my2007 e15 potential 2011 2010 greater commerce department trucks january my20012006
z1Rewv	1	NY	office disability odep labor policy department technology employment states department united labor accessible people communication interoperable technology advance information long odep assistive adoption ict development exploring usable paramount deliver employers helping job succeed technologies types disabilities reflecting workplace policies history accessible plans implementing strategic framework designing communications information technology ict
nq89wq	1	NY	frb economic outlookseptember 8 2011 speechbernanke outlook economic outlook conclude series longerterm delighted twin economic 20112012 provide minnesota speaker overview policy kick economy good club monetary cities thoughts prospects today inviting afternoon global actions trade world coordination late production policy freezing early policymakers governments term stabilize stimulus accompanied discussing financial
z6WU3B	1	NY	current uscert activity highimpact web current incidents regularly updated reported types summary uscert activity security page frequent multiple apple released updates safari address vulnerabilities products security os code crosssite obtain information perform vulnerabilities privileges elevated attack attacker condition execute denialofservice exploitation sensitive arbitrary operate scripting articles mitigate users ht5281 encourages
yYZmSW	1	NY	benjamin revolution congress library treasures words american franklin honesty dead bright ship conscience leak strokes secret policy oaks christmas good fell sink key continual great small breadth letters words accurate scientist writer long exhibition careers life franklins finished birth inventor politician matter accomplishments tercentenary cartoons achievements achieved books abolitionist broadsides
GNdTGy	1	NY	ncbi commun transfer graphene bubbling repeated growth nat pubmed 2012 function web ncbi javascript site warning requires management citation external file generate software road chinese institute science national shenyang metal academy research sciences materials china 72 laboratory wenhua report cm2 singlecrystal greater highly vapour substrate joined large arbitrary bubbling growth
HbXSuc	1	NY	house morris deshlermorris deshler search summer house washington yellow george city deadly philadelphia sheltered capital fever 1793 heat epidemic refuge october retreat found saturdays house open 4 6 white 2012 10 deshlermorris friday germantown sundays april pm starting family washingtons africans exhibits including enslaved featuring household interactive skills mission expertise
y1olaz	1	NY	chairs fall due hazard desk steelcase recalls cpsc consumers illegal instructed safety cooperation firm product voluntarily stop recalled immediately attempt recall resell conducted consumer product chairs amia desk units 11000 rapids mich distributormanufacturerimporter grand steelcase control hazard installed posing user fall pivot chair seat mechanism pins incidentsinjuries reported series number
pQ559k	1	NY	free handbook usagov action consumer order usagov find information youll merged government services july consumeractiongov 2011 great consumer information consumer usagov general find information federal administration preventing handbook citizen tips youll topics complaint understanding theft services identity helpful center inside annually credit published action consumer filing entire form format copies
iMiVoC	1	NY	finding aids 1940 census skip navigation populated period county single blocks size city taker varied district area enumeration bureau covered urban enumerator sparsely densely areas entire census districts rural control office show soil precincts general administer officials include numbers established produced district maps land locally enumeration boundaries state printers offices
AFaAGi	1	NY	closure advisory school rescheduled update rigov inclement street traffic weather exit advance pawtucket previously january street north pawtucket rescheduled 28 day rhode exit 6 department pm closure transportation earlier 9 ridot school work wednesday i95 place planned island 11 2012 operations bridge temporarily cold pawtucket i95 daytime north hours construction
uLcl0Z	1	NY	forprofit floor senate investigation video college colleges forprofit recounts number harkin service veterans advantage students members senator schools enroll drive americas stories military discusses deceived documents statement referred displayed charts statement received 30 forprofit funds bill post911 schools gi received educational benefits forprofit 30 schools military secure forprofit high schools
9DeMXL	1	NY	collateral lateral medlineplus encyclopedia ligament lcl injury medical collateral outer lateral ligament knee lcl injury side partial complete stretch tear ligament collateral thigh leg part ligament lcl fibula lower lateral top bone outer joint ligament stable knee side helps pushes results injury injured joint part knee lcl stress pressure inside
qJIIcL	1	NY	basics exportgov export set money commitment identify export facts create preparing implementation seek assistance internal bank statement timetable international save defining loan helps status creating business objectives important plan assemble companys requests present advance financing milestones success analyzing completing required specific future time action making constraints anticipate gauge goals topics
AAeJZw	1	NY	bio kerwin joseph astronaut 487 md kerwin mc usn ret joseph astronaut captain nasa classical ann hobbies born personal oak illinois music danville reading daughters good grandchildren park 1932 shirley data february 19 married pennsylvania december washington worcester general high college navy flight education arts 1949 degree district doctor fenwick
1nwTyd	1	NY	house white address weekly state union video watch enhanced transparency commitment browse house white logs visitor wait executive actions president obama federal receipt tax federal dollars tax spent people petitions create sign house inside white tour interactive presidency publish morning barack intends video address president weekly saturday obama signing money
aLs1v1	1	NY	states patent united 8159670 filters technique source rastering combination singledilution hematology beam sweeping signal performing comprising arrays dilution scanning employing module solution invention pass preamplifiers measurements flowing increasing method processing analyzer conditioning throughput suitable lenses fieldprogrammable comprises reducing electronic system utilizing converters aliquot precision optical laser stream flow measurement sample
zNuG8t	1	NY	program training providers announces online outreach osha 01122012 2012 12 office phone january communications contact 2026931999 2012 program training providers announces outreach osha online limited selection todays supported valuable identify injuries pleased culmination 25 trained workers labor program highquality health 2011 complaint march greater 10 assistant construction maritime employers dr
HZsI8l	1	NY	office media governor town franklinview holds christie governor photos chris comeback hall jersey ambassador office claudio italy christie lt statehouse guadagno trentonview governors bisogniero photos kim chris governor meet town holds christie governor photos freeholdview chris comeback hall jersey opening green christie governor photos attends cityview grand chris newport jersey
fZ9gPy	1	NY	living healthy breastfeed live guide quick healthfindergov learn baby connect website hyperlink nongovernmental direct application hhs consistent hyperlinks states services human subject information hyperlinked united application contained health endorsement department website intended provided visitors external constitute applications privacy appearance practices products policies purpose link redirected benefits healthy choice breastfeedingbreastfeeding baby
svQOoj	1	NY	wdnr fishing ice resources current topics licenses permits regulations statewide trapping fishing hunting kids website educators nature encourage learning fun children educators fire landowners health forest managementtopics activities lands activitiestopics parks outdoor management property managing spills air environmental cleanup protectiontopics waste quality redevelopment water resourcestopics drinking watershed fisheries wide agency
a6fTCF	1	NY	frb amendments 19 proposes rules cardsoctober credit releasefederal regulation press clarify 2010 pertaining reserve release date october 2010 19 amending proposed obligations tuesday compliance protecting consumers federal card regulation protections board proposal lending aspects intended rules clarify understand areas resolve boards uncertainty rule issuers credit truth fully cards enhance reserve
9uTZKL	1	NY	frb financial office policy 4 stability releasefederal researchnovember establishes press 2010 reserve release date november 4 2010 financial office stability nellie economist established federal thursday research board liang policy director appointed reserve dedicated financial council office supporting oversight stability bring experts broader follow market staff large develop economists federal support
o5yMJt	1	NY	roentgenol ncbi postesophageal 1976 ajr narrowing pubmed function web ncbi javascript site warning requires management citation external file generate software reveals duodenum distal obstruction esophagus children visualization partially duodenojejunal epitheliumlined stricture contributed lesions columnar development junction pylorus unexplained understanding management descending aid obstructing association barrett include study reflux midesophageal diagnosis
qPQHgW	1	NY	languages information uscis uscis list languages materials publications resources official list answers civics questions test naturalization highlighting citizenship rights responsibilities civics video history website uscis users official spanish speaking official list answers civics questions test naturalization audio format official list answers civics mp3 questions test naturalization resident questions 20 permanent
xIbILV	1	NY	10 apod january starburst 4 ic galaxy 2012 fascinating discover featured written image explanation day photograph astronomer cosmos universe professional january 4 2012 starforming bright distant galaxy regions group northern 23 black local colorful skyscape boundaries cassiopeia large including intervening luminous constellation telltale xray newly shows 5000 dwarf million galaxies
6w2Jwy	1	NY	proclamation national slavery month trafficking human house prevention white presidential state union video watch enhanced transparency commitment browse house white logs visitor wait executive actions president obama federal receipt tax federal dollars tax spent people petitions create sign house inside white tour interactive house white office press secretary proclamation moments
zYSmt8	1	NY	ncbi gliadin scand pubmed 2006 gut permeability zonulin gastroenterol function web ncbi javascript site warning requires management citation external file generate software division biology mucosal md center nutrition gastroenterology university school usa research celiac pediatric medicine maryland 21201 baltimore gliadin epithelial zonulin investigated barrier mechanisms effect crosses signaling interaction cells
GOfRoK	1	NY	versus comparison ncbi pubmed diagnosed donor newly 2012 blood function web ncbi javascript site warning requires management citation external file generate software netherlands center medical hematology dept utrecht univ results years 138 prospectively group 22 28 intensive p0001 mortality versus remission evaluate survival p019 122 260 therapy difference continued 55
zzPCNh	1	NY	video drivers distracted medlineplus health news javascript adobe flash enabled content player version 8 requires flash pages related medlineplus passenger teenaged plays crashes big seat part role car teen distractions dont teenagers close driving drivers lot whod wheel crashes 677 happening accident study experience theyre researchers passenger move seat female
FOsnKe	1	NY	week blog flood safety wrapup fema awareness comment accordance comments blog moderated policy femas links nongovernment social applications web fema provided reference media companies sites endorse msgdata washington street apply management prepare federal rates homeland department 4fema emergency dc 43362 20472202 sw agencyus security500 6462500text tty assistance step 46275853 800
z4iAO8	1	NY	literature statis ncbi comprehensive review acids nucleic pubmed res 2012 function web ncbi javascript site warning requires management citation external file generate software statistics genetics human biostatistics pittsburgh university park usa 16802 pennsylvania state pa 15261 department gwas genomewide results human carefully debate decade potential combine thousands real case good
jFsjIf	1	NY	living healthfindergov healthy quitting live learn quick smoking guide connect website hyperlink nongovernmental direct application hhs consistent hyperlinks states services human subject information hyperlinked united application contained health endorsement department website intended provided visitors external constitute applications privacy appearance practices products policies purpose link redirected information usaccessibility privacy mapcontact act
A3gA2W	1	NY	service monuments national park parks portfolio national parksportfolio cover contents foreword parks monuments acadia canyon bryce caverns carlsbad lake crater grant general glacier canyon grand teton grand hawaii springs hot lassen volcanic mesa verde mckinley mount mount rainier platt mountain rocky seqoia cave wind yellowstone yosemite zion monuments national monument
z48kq6	1	NY	indoor years persons eighteen tanning age devices act assembly general 54 raised bill february session 2012 lco 488 00488ph health committee public referred introduced ph indoor years persons eighteen tanning age devices act assembly senate house representatives general convened enacted repealed lieu october effective section 19a232 general 1 substituted thereof
tqQ9b0	1	NY	group ncbi cancer multicenter leukemia haematologica stu pubmed 2012 function web ncbi javascript site warning requires management citation external file generate software building md 20892 usa room cancer 10 institute bethesda national wilsonwmailnihgov rockville branch 9000 pike 4n115 metabolism results years follow group conclusions 94 4 p0008 confirmation risk survival
xPFPZ	1	NY	1983 ncbi ethnobiology ethnopharmacol pubmed zombi haitian function web ncbi javascript site warning requires management citation external file generate software represent years localities symptoms biomedical tests tetrodotoxication summarized haiti neurotoxins presented fully peasant zombies notorious verifiable consistent dead society laboratory living recorded poison students state formula method holacanthus diodon scientific
vHolkr	1	NY	financial owe credit protection bureau cards consumer 855 4112372 website united government official states mandatory developed spells shorter note agreements approach terms form agreement understand shown model card simpler prototype consumers credit consumer defined sample click page review separate comments terms agreement underlined pdf copy card bottom list contract leave
