y7mqmw	3	NY	apod march 14 sun angry erupting 2012 fascinating discover featured written image explanation day photograph astronomer cosmos universe professional march 14 2012 suns years earth captured current giant system field baddest plumes plasma magnetic puffs colorful dark cool twisted tendril inverted ejections shown sun particles chromosphere bird pictured emitted sunspot
wKg6J3	3	NY	robert senator menendez jersey listen january 20 2012 protect 880 wcbs ip menendez newsradio steve scott act senator discusses building office senate 2022244744 washington dc 20510 hart 528 pike horse fax 8567575353 208 08007 barrington 8565461526 18 suite white jersey 9736453030 fax 07102 center 9736450502 newark 1100 suite gateway jersey
yJCTEu	3	NY	description proposed organization nhgri division office functional includes director intramural principal extramural research current offices components organization nhgri office functional including carry research responsibilities activities includes director behalf divisions institute offices oversees advisory managers council played meetings intellectual single grants human comprises organizing genomics functions management field provide review opportunities
2YZs1o	3	NY	fdsys browse bills congress senate house states types legislative united proposals representatives bills congressional hr house chambers president approval law require senate signature bills limited senate house approval chambers resolutions amendments constitution res generally propose hj joint appropriation purpose president matters require single specific sj signature force senate house approval
fE9Cvp	3	NY	std residential guidance compliance construction 0311002 osha instruction abstract michaels authority david mph assistant phd secretary executive summary limited developed interpreted interim alternative issues steel personal residential guidance 29 employer presents arrest agencys systems policy activities greater guardrail safe employers framing fall comply structural term covering fully disqualify instruction methods
qcR6vD	3	NY	flexibility esea department education learning educators focus outcomes improving flexibility gaps sea rigorous close education quality leaders specific educational nclb requirements voluntary provide agency state achievement equity department increasing local plans exchange students comprehensive act agencies designed student child schools opportunity behalf improve inviting instruction request 2001 statedeveloped increase order
yoIiZA	4	NY	repair chairs due hazard high fall recalls ikea named washington instructed canada voluntary consumers illegal commission safety cooperation health announced firm product stop dc recalled resell attempt immediately recall products today consumer product antilop chairs high 36000 169000 133000 units canada north conshohocken llc importer pa services ikea america unexpectedly
xcNnpp	4	NY	preparedness fema resources top back top back top back est 07mar2012 modified wednesday 140249 links nongovernment social applications web fema provided reference media companies sites endorse msgdata washington street apply management prepare federal rates homeland department 4fema emergency dc 43362 20472202 sw agencyus security500 6462500text tty assistance step 46275853 800
w38yEm	4	NY	mobile pubmed slip night youll ment jun30635463 health nurs 2009 issues box usa psychology wa university washington epederuwashingtonedu 351525 department seattle 981951525 emerging money focus arriving interesting finally positively evening increased males drinking alcoholrelated prepartying night quick endorsed significantly sex frequency college estimated sexual event alcohol subsequent legal research participants
ysDone	4	NY	topics system april exploration solar year overview 2012 april ice 2012 comets deposits streaming spaces distant mercury rings system ice moon poles moons icecovered solar world saturn present made materials common jupiter comets titan surface exist abundant ammonia saturns amounts system ice moon ices poles mars type temperatures dioxide gas
dtbcVO	4	NY	states patent 6630507 united group treatment neuroprotective diseases hiv antagonism cochsub3 neurological prophylaxis consisting unrelated found invention doses avoid selected parkinsons cannabinoids trauma agerelated formula method oxidation chsub3 nmda properties neurodegenerative toxicity makes inflammatory neuroprotectants antioxidant receptor autoimmune antioxidants ischemic nonpsychoactive psychoactive present wide stroke limiting cannabidoil property encountered high
zgQL7H	4	NY	information fastfood nutrition medlineplus gaps page related medlineplus 28 tuesday hard healthday calorie counts information feb menu make diners report news fastfood healthy items list choices time meal researchers restaurants neighborhood examined calorie city menu scientists chains 200 food york 12 boards restaurant items study listings harlem people calorie counts
q8oag	4	NY	crossing borders dhs information updates email official nexus states including entering id children united travel approved card passport document merchant business present airports citizens kiosks air orders military mariner 1 june 2009 beginning top back secure travelers states including entering children present united travel air passport document information resident continue
8faZ4	4	NY	resident aliens citizens abroad small businessselfemployed taxpayers international topics irs resources reside estate resident tax alien estimated united generally returns income subject worldwide paying rules citizen abroad states gift filing duty file resident allowed year alien 2month calendar pay due citizen residing return june regular date overseas 15 extension requesting
zs5dcP	4	NY	living healthfindergov healthy quitting live learn quick smoking guide connect website hyperlink nongovernmental direct application hhs consistent hyperlinks states services human subject information hyperlinked united application contained health endorsement department website intended provided visitors external constitute applications privacy appearance practices products policies purpose link redirected quit steps follow information usaccessibility
w3vFX9	4	NY	pyramid usda food fnicnalusdagov myplate resources nutrition usda policy promotion center mypyramid guidelines primary myplate easytounderstand americans group consumers cue build 2011 consistent plate eating food symbol june encouraging visual governments healthy adopt 2010 habits replaced dietary society education nutrition incorporate educators guidelines myplate dietary americans education find content online
x3xKr9	4	NY	med volumetric ncbi analysis sex pubmed urethr vascular 2010 3d function web ncbi javascript site warning requires management citation external file generate software italy reproduction gynecology studiorumuniversity pathophysiology mater massarenti human bologna department cesarebattagliauniboit alma gspot controversial existence space urethrovaginal threedimensional evaluate ultrasonography structures anatomic 3d color underwent ii orgasm
vuS	4	NY	picture astronomy day fascinating discover featured written image explanation day photograph astronomer cosmos universe professional 11 2012 bright distant earth disk 20 fit easy weeks apogee photographed perigee dark day telescope pacific dense sun asia moon smallest full 300 annular 240 kilometers path super silhouetted filter point image visible smaller
xgUQNG	4	NY	code edition fdsys annual regulations browse federal represent code codification chapters 2841 title issuing updated government rules material bear subparts areas level 50 large subdivided revised edition titles year calendar cfr subject specific federal broad section refer agencies regulatory chapter 1727 annual april citations published staggered basis regulation permanent sections
yiOowh	4	NY	city thomas fish edison york market ghetto pictures work leisure motion 1894 america 1915 load set retrieve option filmto viewing download disk film future view browser 1 part modemmpeg 25 megabytesquick 12 format realmedia 288 megabytes time higher precise houston closely follow monitored vicinity location east photographed bowery walk ghetto
wFiRib	4	NY	policy privacy medlineplus pii national site library collects nlm web functions service provide make visit sites choose medicine public information marketing commercial understand purpose personally data helpful identifiable nlms collect unrelated temporarily stores visit site collects nlm web collected type information automatically contracts features linked suggestions number individual associating measure
uGYJrZ	4	NY	autoimmune diseases ncbi allergy rev pubmed gut clin leaky immunol 2012 function web ncbi javascript site warning requires management citation external file generate software md biology center usa university school research mucosal medicine maryland 21201 afasanombrcumarylandedu baltimore underlying innovative neuroendocrine disorders tight susceptible controls intercellular equilibrium diseases nonself impaired loss
xOPZAf	4	NY	birthplace theodore national site roosevelt historic pets search pony house held 1902 police photo white mounted roosevelt algonquin officer quentin children badger eli evans beloved captivated bear dr yale small house hard onelegged roosevelt kermit mirror peter barn blue guinea pets admiral ogrady spreckle baron algonquin bob owl named childrens
mRyYNC	4	NY	flaccid guidel penile ncbi 1996 erect states length pubmed urol function web ncbi javascript site warning requires management citation external file generate software school francisco urology san usa university medicine california department assist penile provide guidelines circumference length augmentation counseling patients flaccid penile normal physically men prospectively erect pharmacological erection
l5nZYy	4	NY	mdufa meetings holds september meetings authority regulated discussions recommendations legislative information amendments fee periodically current process program conduct public 2012 reauthorization fy20132017 stakeholder expire user groups device hold fda developing requires medical conducts page mdufa part reauthorized 2007 act stakeholders fdaaa industry downloading file 03152012 information note updated accessing viewers
zZqILK	4	NY	solstice disruption mission cassini images home image details 1062 5150 titan 660 ring angle degree northern image rings sunlit shows tethys saturnfacing plane kilometers sides center 3200 larger side miles left view acquired image visible spacecraft cassini scale 22 tethys approximately camera 7 8 red titan million 12 kilometers 2011
yOOrBm	4	NY	cancer allatonce taking testing genetic sequencing approach parallel massively prevent reasons results uncontrolled growth genomic happen dividing inappropriate knowing diseases genes stop inherently mutations cells cancers tumors cancer caused lung skin environment suns ultraviolet exposure interaction tobacco light cancers smoke result cancer point individual protects run copies cell mutation passed
cHTGnR	4	NY	processing times appointments visa interview wait visitor states planning apply select information united application travel temporary provided includes early important plan consulate wait advance specific nonimmigrant visa embassy time review embassy make information additional addition section explain interview local website earlier appointment exchange students visitors important review procedures consulate instructions
sC7M7L	4	NY	photo house december white 2011 day state union video watch enhanced transparency commitment browse house white logs visitor wait executive actions president obama federal receipt tax federal dollars tax spent people petitions create sign house inside white tour interactive december house check offices photo picks 2011 white day president house
Gzu9Ot	4	NY	stress mission solstice cassini enceladus images home image details alexandria focus tiger stripe images sulcus directorate jpl developed cassini washington mission manages cooperative laboratory technology assembled orbiter jet space propulsion agency pasadena european division cassinihuygens dc nasas california designed institute project nasa science italian information httpwwwnasagovcassini visit mission httpsaturnjplnasagov cassini
yZ302b	4	NY	antibiotic impacts administra longterm ncbi ecological pubmed 2007 isme function web ncbi javascript site warning requires management citation external file generate software institute medicine sweden stockholm department laboratory karolinska restriction selection disturbances sequencebased trflp years stability clones human gastrointestinal impact group monitor pcr temporal technique terminal potential treatment samples returned
zOMvzF	4	NY	thomas congress text bill library 112th 20112012 hcon ih 107 force misdemeanor high sense constitution section offensive crime 4 constitutes authorization expressing congress president article ii clear prior impeachable act military jones committee judiciary submitted concurrent mr resolution referred force misdemeanor high sense constitution section offensive crime 4 constitutes authorization
wIU7Eb	4	NY	fatty ncbi polyunsaturate nutr pubmed br acidspecific mixed 2010 n6 function web ncbi javascript site warning requires management citation external file generate software nih md usa neurosciences biochemistry section nutritional biophysics bethesda membrane laboratory niaaa chrisramsdennihgov 093 ci statistical specifically ratio 22 95 4 extensive n3n6 increased combination confounding intake
wICmQR	5	NY	closest dione mission solstice cassini flyby images home image details instruments dione pass surface visible primarily images flyby carthage moon spacecrafts camera moons image higher cassini earlier intended closest cassinis encounter 2011 obtained narrowangle 12 light yield flybys dec resolution linea dione 1123 top 698 epimetheus 113 cassini 86 image
yoI36l	5	NY	repair chairs due hazard high fall recalls ikea named washington instructed canada voluntary consumers illegal commission safety cooperation health announced firm product stop dc recalled resell attempt immediately recall products today consumer product antilop chairs high 36000 169000 133000 units canada north conshohocken llc importer pa services ikea america unexpectedly
zKiE89	5	NY	fair marshmallow launch house science white state union video watch enhanced transparency commitment browse house white logs visitor wait executive actions president obama federal receipt tax federal dollars tax spent people petitions create sign house inside white tour interactive adobe player flash content download view 301 february 07 2012 named
whcsLd	5	NY	crash snowmobiles arctic due hazard cat recalls cpsc consumers illegal instructed safety cooperation firm product voluntarily stop recalled immediately attempt recall resell conducted consumer product snowmobiles arctic cat december previously models recalled units 19000 2011 river minn falls arctic thief cat manufacturer loss lower crash loosen hazard control tierod posing
cjYwfD	5	NY	schedule wsdot ferries dockbound viaduct wednesday 0835 510the jackson marion construct entering close 5 impact driving offloaded drivers due thursday access exit 9 terminalawv utilizing 2012 activities customers colman 7 awv pmseattle southbound underneath dock construction traffic western northbound affect change diverted yesler 10 alaskan university vehicles overnight exiting street
w9z9PB	5	NY	captures mission moon solstice icy cassini images features captures moon icy cassini images home news captures cassini moon icy images 12 mar 2012 captures cassini moon icy images features 29mile basins surface 950 cassini crater flyby captured faces impact tirawa distinctive 47kilometer moon observations moons rhea 480 360 1530 rheas
NHIcS	5	NY	house white state union video watch enhanced transparency commitment browse house white logs visitor wait executive actions president obama federal receipt tax federal dollars tax spent people petitions create sign house inside white tour interactive event live facebook discussion participate click member facebook give click questions comments httpwwwwhitehousegovvideo ondemand library
GntTe	5	NY	william craig fugate fema administrator management emergency federal agency senate craig fugate experience fema confirmed management wealth federal agency appointed barack administrator emergency serve reported leadership community president bringing obama 13 18 2009 agency managed 745 efforts preparedness fugate 138 fdem fema staff 67 management recovery mitigation role coordinated governments
xDhctS	5	NY	house white state union video watch enhanced transparency commitment browse house white logs visitor wait executive actions president obama federal receipt tax federal dollars tax spent people petitions create sign house inside white tour interactive event live facebook discussion participate click member facebook give click questions comments httpwwwwhitehousegovvideo ondemand library
gUsPo	5	NY	states patent united 5676977 mechanism human agsub4 semiconducting entities osub4 silver loss tetrasilver fired proliferating humans aids sites intravenous simultaneously completely active divalent firing resulting ism nontoxic bloodstream diamagnetic electrocuting ppm put utilized suppressing capable hepatomegaly chelate trigger redox molecular function triggered liver pathogens synergistic injection tetroxide devices chelation crystal
qGiT7A	5	NY	information network education usnei information network site usnei education find financial links states recognition information united accredited international frauds students qualifications coming professionals programs foreign avoiding aid institutions information resources providers educators related avoiding accreditation system fraudulent officials recognized international education quality institutions assurance financial links students education abroad information
7P8SZE	5	NY	cert state corps train partner america effort volunteer prepare proud cert citizen agency neighborhood citizens corps criteria guidelines county council organizational follow encouraged category management police completing objectives government contained state program sponsoring listed bottom basic covered local website jurisdiction description emergency fire material agencies standard sponsored representative response included
zd62Kv	5	NY	10 apod lick march observatory moonrise 2012 fascinating discover featured written image explanation day photograph astronomer cosmos universe professional 10 march 2012 warm atmosphere lick san rim color photo reflected 36 echo perched substantial frames nickel 4200 disk viewed telescope jose long chosen rose green sunlight moon location 7 gorgeous
c7xaOS	5	NY	living learn alcohol healthfindergov healthy drink live moderation quick guide connect website hyperlink nongovernmental direct application hhs consistent hyperlinks states services human subject information hyperlinked united application contained health endorsement department website intended provided visitors external constitute applications privacy appearance practices products policies purpose link redirected information usaccessibility privacy mapcontact
k8eVQd	5	NY	circumference penile ncbi study urol length 2001 pubmed 3300 eur function web ncbi javascript site warning requires management citation external file generate software italy university department urology florence size disciplines estimates knowledge provide young interest extensive normal males dimensions external considerable penile carried study variations genitalia male italian set weight
cGrDeG	5	NY	production industrial capacity utilization month 138 industries based 21 rose production 2012 march increased broadly excluding level 54 output quarter past rate result year 83 declined 02 capacity jumped mines manufacturing 104 gained 786 38 industry months unseasonably major industrial motor total utilization percentage mining warm gain 966 15 17
9lcG6i	5	NY	survey site satisfaction questionnaire feedback web service read improve customer short completing additional submit email healthfindernhicorg comments questions respond displays 200 suggestions hhs including reviewing aspect ave estimated comments information reducing 23 agency valid conduct public independence omb washington reporting dc collection number control burden estimate response instructions clearance 20201
j5bA1	5	NY	federal table register contents aids end section online finding issue public resources notice recently reader phone consult enacted reminders laws numbers subscribe httplistservaccessgpogov follow table electronic select federal contents online archives listserv change instructions join settings register list fedregtocl leave mailing office visit hosted archive issues previous federal online government
srHO6N	5	NY	internship usda programs summer strongly give consists employment career usda educational sip located program assistants internships field scientific internship paid gain position opportunity areas institute headquarters experience technical future students enrolled professional usda ambassadors washington county intern agricultural service fl research program health development plant animal attend students dc leadership
AvoDcr	5	NY	week blog united government national participate qa live protection usagov consumer states week est march session 2pm national question host protection 6 answer consumer tuesday complaint trade experts usagov questions commission provide government consumerrelated answer resources file scams company answers hand chance federal learn latest questions twitter experts chat est
zdzyf7	5	NY	living healthfindergov healthy quitting live learn quick smoking guide connect website hyperlink nongovernmental direct application hhs consistent hyperlinks states services human subject information hyperlinked united application contained health endorsement department website intended provided visitors external constitute applications privacy appearance practices products policies purpose link redirected quit tips set reasons money
yyzL3Z	6	NY	march media social day awareness 2012 people bisexual streets homeless runaway victimization percent young heterosexual 334 transgender versus 587 gay lgbtq questioning report lesbian youth providers dealing wwwsamhsagovchildren children friends visit trauma resilient hope families heroes youth learn danger bisexual streets high homeless home streets1 victimization people young rates transgender
wBdIB7	6	NY	house white state union video watch enhanced transparency commitment browse house white logs visitor wait executive actions president obama federal receipt tax federal dollars tax spent people petitions create sign house inside white tour interactive event live facebook discussion participate click member facebook give click questions comments httpwwwwhitehousegovvideo ondemand library
gEiClN	6	NY	records 1940 census skip navigation reasons number evidence individual 82 employment insurance 17901930 federal research natf passports form genealogical birth schedules pages population census benefits age order place social security 1 information part general census start 1940 research 2 part finding aids 3 part part 4 videos articles part 5
zYzAc0	6	NY	rats senate highlights perkins state subway sen nyc problem york uploaded 18 youtube jan weact4ej 2012 perkins rat raises 181st sen st event issues city yorkers northern justice 1 station twu extensive participated manhattan environmental train york demand infestation 100 ratfree bill subways local subway act senator read attack rat
1fJal	6	NY	bernanke 21 deflation 2002 speech november deflation doesnt making happen excessive money lack stability world argued discipline stray expectations rise stripes bane inflation cage heightened standards large essential leaders creation industrialcountry serviceshas result factors public shocks monetary understanding inevitable goods central favorite pick equally economists number 1990s political tame selfconfirming
vnrjr0	6	NY	great paterson national park falls historical search industrial played national site revolution nations parkhome industries power service role 7 largest interior 2011 jarvis economy ken building spectacular park waterfalls designated falls director key november shaping jon great harnessed americas american salazar 397th secretary twitter sign follow paterson events great falls
xtK54N	6	NY	owners cope pet medlineplus hearts change pages related medlineplus seaman andrew people reuters chronic living pet health animal shows diseases companion york owners study healthier tickers heart feathery people variability japanese rate monitoring pet furry scientists higher 200 hearts found scaly didnt respond heart requirements disease rate linked stressful dying
4kIXux	6	NY	reports fatalities catastrophes events weekly reports fatalities catastrophes events weekly description webpage fatalities table summaries weekly area workers include updated complete employers link report list summary oshaapproved incidents catastrophes inspection links citation states hospitalization information state investigation offices plans hours reported osha investigates preliminary operate resulting workrelated fy12 reports fatalities
wlQXra	6	NY	government money states selective usagov services education united register blog asked anonymous money register selective services education work ages grants including service eligible federal college men selective student 1825 study register receive aid order andor violation reaches years registration registrations fine late fails accepted convicted window 250000 prosecuted prison technically
