ztG6kn	2	NY	nnlmntc syracuse ny class information circle6555 130571299 collamer circlebest southsyracuse held classes western carrier atbest road ny 4465446 deirdre joycedjoyceclrcorg315 contact local hotels collamer 800 13057phone ny 315 southsyracuse carrier western 4312761fax 4630028 road circle6555 web national obtain library direct information training center medicine browser medicinenational network national training library
FPKsDk	2	NY	products medical health enhanced protecting oversight public including safety oversight demands food workload areas countries january list identified facing respond challenges year inspections managing marketed health increasing public ability manufactured threatened gaos 100 manufacturing abroad protect drug foreign products oversees addition establishments clinical compromise drugs offered highrisk gao fda growing
9L8dVH	2	NY	annuities topics tax pensions topic 410 irs resources annuity retirement amounts employer payments form qualified plan taxable partially benefits receive pension fully equivalent topic railroad security information retirement benefits discussed social 423 refer cost apply situations pension taxable fully receive annuity contract payments aftertax generally simplified determine pensions employer partly
fn1p5G	2	NY	products sexual tainted enhancement fraud topics medication health page emerging overthecounter trend harm represented dietary untested sexual laced deceptive consumers ingredients substances increasingly hidden controlled quantities pharmaceutically harmful varying active frequently approved unknowingly fda prescription unstudied identified drug supplements products promoted problem enhancement downloading file 04202012 information note updated accessing
xlT5P	2	NY	category congress browse library american memory valley 19381943 music time festivals gospel blues fort emile industry recording berliner birth applied dialect center linguistics recordings collection american english civil band music era war prosperity coolidge 19211929 era economy consumer thrift motion edison entertainment pictures companies early sound recordings inventing tending southern
u00RkQ	2	NY	lipoic inflammatory chronic text clinicaltrialsgov demyelinating full treat acid polyneuropathy view lipoic inflammatory chronic examine purpose cidp alpha acid effective study demyelinating treatment polyneuropathy firstline caused cellmediated la reactive production treatment plasma ivig effects treating progressive oxygen antiimmune activity disorder side temporarily peripheral reduce cost corticosteroids increase mediated intravenous responses
3ULIqM	2	NY	assistance businesses small elaws employment workers laws states department united labor questions advisors etools number easytounderstand elaws employment information based expert provide simulates responses answers advisor law interaction asks federal interactive laws topics employers advisor elaws find employees benefit choose interest major apply employment information publication visit interested finding business
A4KKSn	2	NY	fraud people alert diabetes government money defraud diabetes plot criminals target people american steal fraud people alert diabetes media deputy oig investigations interviewed baskin general director communications oigs gary roberta inspector cantrell precise diabetic financial vary order strips meters seats additionally orthotics braces information confirmation personal beneficiaries offer generally offers
sVVdyO	2	NY	apod full january aurora sky 3 norway 2012 fascinating discover featured written image explanation day photograph astronomer cosmos universe professional january 3 2012 atmosphere unexpected ago striking sky magnetic results 60 lies stretched airplane rarely viewed complete mountain realm wide space image poles horizontally molecules auroral circle norway aurora higher
y0Ubww	2	NY	blueprint increase service efficiency announces stronger vilsack usda operations agriculture secretary operations usda century washington cutting agricultural agriculture 21st built jan costs usdas tom department economy blueprint evolving monday producers 9 streamlining plan 2012the service stronger drive americas vilsack continue presenting meet helps secretary usda years accomplishments businesses modernize taxpayers
aOUWj2	2	NY	oil fatty ncbi database syst fish acids rev cochrane 3 pubmed 2007 omega fo function web ncbi javascript site warning requires management citation external file generate software division hepatology ontario gastroenterology nutrition 555 hospital danturnersickkidsca toronto m5g sick ave 1x8 canada children university beneficial inflammatory fish chronic disorders antiinflammatory oil
wV8XYs	2	NY	nih rare february highlights national 16 disease research cuttingedge health institutes 2012 day awareness raises links related bookmark share cc nih clinical center media advisory office recognize national supported cosponsored translational institutes research researchnational 29 day sciences clinical health advancing daylong activities nih diseases government agencies event celebrate celebration organizations
zZuPhi	2	NY	current uscert activity highimpact web current incidents regularly updated reported types summary uscert activity security page frequent multiple apple released updates safari address vulnerabilities products security os code crosssite obtain information perform vulnerabilities privileges elevated attack attacker condition execute denialofservice exploitation sensitive arbitrary operate scripting articles mitigate users ht5281 encourages
rDW0nn	2	NY	management emergency strengthen blog year partnerships fema publicprivate comment accordance comments blog moderated policy femas links nongovernment social applications web fema provided reference media companies sites endorse msgdata washington street apply management prepare federal rates homeland department 4fema emergency dc 43362 20472202 sw agencyus security500 6462500text tty assistance step 46275853
eVdYT	2	NY	forms publications irs resources methods links tax electronic forms provide media irs capabilities access source basic print function acquire additionally advanced search irsgov official materials publications published links schedules tax individual download return taxpayers irs forms income mail order recently business advised packages needed filing instructions longer receive paper page
ykOIij	2	NY	soc psychosemantics ncbi free pers pubmed disse riding 2012 psychol function web ncbi javascript site warning requires management citation external file generate software selection show results actions held experiments identify cooperative features partners solving 4 excluded equipped violations 5a 5b motivated reserved posed choice huntergatherers reveal level collective identified competence
xEBcuE	2	NY	med ncbi emergency west pubmed emerg reliably medicine residents 2011 function web ncbi javascript site warning requires management citation external file generate software emergency university medicine state department buffalo york sources references determine access clinical medicinespecific resources engine physicians searches emergency conducting medicine department judge perceived textbooks medically em google
AALUr	2	NY	artwork colony 1970 space summer concepts 10000 people colony number images quality publication space housing renderings converted colonies screen full couple designed ames made thumbnails 16 presented jpegs conducted nasa artistic 1970s quarter studies page living point area sphere design bernal center photos research credit nasa ames home settlement page
xqnPaK	2	NY	ncbi classical study rituximababvd 2 blood phase pubmed hodgkin 2012 function web ncbi javascript site warning requires management citation external file generate software md sidney cancer hopkins comprehensive johns kimmel baltimore center generally cd20 dose malignant wwwclinicaltrialsgov 8 plasma dramatically greater combination survival express nct00369681 therapy lymphoma untreated tumors activity
yTzCcq	2	NY	childrens due hazard slides recalled fall structures landscape named washington instructed voluntary consumers illegal commission safety cooperation announced firm product stop dc recalled resell attempt immediately products today recall consumer product slalom glider units 900 minn delano manufacturer structures landscape slalom lacks children top glider platform playground ladder hazard moving
thKNT5	2	NY	increased ncbi proteintocarbo nutr dietary effects clin pubmed 2012 function web ncbi javascript site warning requires management citation external file generate software nutrition life centre food university sciences human faculty department copenhagen denmark studies advanced lbslifekudk metabolic evidence polycystic protein ratio syndrome carbohydrates treatment higher diet advantages pcos suggested ovary
svXD0N	2	NY	med ncbi clostridium intern pubmed comparative diff effectiveness 2011 ann function web ncbi javascript site warning requires management citation external file generate software affairs school center usa evidencebased university practice system minneapolis minnesota health drek0002umnedu 55417 veterans medical care severity unknown incidence infection difficile treatment optimal increasing clostridium adults results
yz5wGA	2	NY	prediction storm center compmap weather references rap analysis 12z rapid pages 1 input 2012 updated fire ruc background fields changed refresh replaced model display mesoscale svrgis apr weather tornadoes gis shapefile visit details 9 2012 19502011 updated 19552011 format shp hailwind httpwwwspcnoaagovgissvrgis reports severe converted page feedback hovered issued displayed
xw0F5v	2	NY	living kids alcohol tobacco healthfindergov drugs healthy live learn quick guide connect website hyperlink nongovernmental direct application hhs consistent hyperlinks states services human subject information hyperlinked united application contained health endorsement department website intended provided visitors external constitute applications privacy appearance practices products policies purpose link redirected alcohol tobacco drugs
y1mjes	2	NY	living healthfindergov healthy quitting live learn quick smoking guide connect website hyperlink nongovernmental direct application hhs consistent hyperlinks states services human subject information hyperlinked united application contained health endorsement department website intended provided visitors external constitute applications privacy appearance practices products policies purpose link redirected finish eating people break smoking
tR3Pda	2	NY	information remote center national snow operational source ultimate sensing hydrologic map remote center comprehensive national snow data operational products observations sets nation sensing analyses hydrologic national regional snow latest conditions analyses indepth information gis comprehensive snow explore online detailed nationwide 4000 snowpack stations tool query conditions visualization analyses national snow
ALAz	2	NY	washingtons birthday george skip navigation legislative records washington commission 148 bicentennial 1932 1931 rg commissions branch stuart gilbert copy painting george george established congress federal celebrated eleven permanent holiday monday holidays birthday february washingtons declared decides national binding states apply district federal state legal holiday columbia congress government holidays julian
xw2o0l	2	NY	tip canker medlineplus sore health calm page related medlineplus drinking eating form sores inside ulcers canker mouth news make painful healthday dental sore canker suggests american heal association mobile twitter subscribe version updates follow email rss national guidelines accessibility library human march institutes quality copyright privacy health bethesda department 8600
wOMVog	2	NY	ncbi pract health promot media promotion 2012 pubmed social function web ncbi javascript site warning requires management citation external file generate software usa ut university young provo brigham process expanding purposes related overarching identify media strategy written potential health indicators performance evaluation propose social metrics purpose key article role outline
noKr	3	NY	constitution note 1 secure people welfare domestic america general states establish perfect united constitution justice liberty insure provide form tranquility defence posterity promote ordain union blessings common order congress vested senate house states legislative united consist granted representatives powers composed people house year states electors chosen representatives 1 state branch
130rZ5	3	NY	island national seashore assateague search enjoy coastal move rest existence continent sandy recreated visit forests day live bays life recreate relax time assateague maritime explore marshes waves beaches island salt ocean edge place adapted wind enjoy make thrive horses beauty assateague extraordinary distance island continue wild enjoy barrier ages visitors
48nIRC	3	NY	living healthfindergov healthy taking everyday live asprin learn quick guide connect website hyperlink nongovernmental direct application hhs consistent hyperlinks states services human subject information hyperlinked united application contained health endorsement department website intended provided visitors external constitute applications privacy appearance practices products policies purpose link redirected information usaccessibility privacy mapcontact
xeZzEq	3	NY	giss impacts level national maps nasa world security figure al paper human based s5 health 2012 shindell simultaneously food journal graphics improving change climate nearterm science mitigating interactive load moments installed computer web java note graphics require enabled browser 2050 temperature bc measures due surface increase avoided methane decrease linked
1bJVh1	3	NY	458 deduction topics tax topic educator expense irs resources trade 1040a including 250 eligible 500 form joint qualified line 16 married courses computer athletics deductible deduct educators tax related expenses supplementary books year claimed education unreimbursed physical spouses equipment health educator supplies business paid services incurred classroom 1040 23 deduction
zhMOL4	3	NY	presidents make healthiest council year 2012 set presidents past council year activity incorporating physical start reminder achieve 2012 nutrition good ability healthiest reflect goals making great 12 lifestyle level healthy age months realistic commit work weight people presidents set council years resolutions fit percent approximately reality report attainable change january
DmpmR	3	NY	entrez genome view viewer map resources ncbi data genbank organism sequencing projects resources related databases cytogenetic features reference sequence viewer hybrid maintained displays human ests contig tiling physical contigs stss ncbi alternate radiation maps genetic grc predicted include fish genome map graphical assembly models genes component gnomon clones path bac
wAM1zS	3	NY	impact workhour ncbi med acgme pubmed reforms educ grad 2011 function web ncbi javascript site warning requires management citation external file generate software set educators resident number surgical council education mandated concern competency reducing requirements accreditation acgme graduate reduction clinical expressing hours generated july exposure regulations medical work controversy 2003
sJfOez	3	NY	fv4za ii iii iv vi vii viii ix xi xii xiii xiv xv xvi xvii xviii xix xx xxi xxii xxiii xxiv xxv xxvi xxvii xxviii xxix xxx 1 2 3 4 5 6 7 8 9 10 11 12 13 14 15 16 17 18 19 20 21 22
GL1q4I	3	NY	catalog pia15415 page brightly image tendrils lies remnant full lightyears galaxy size constellation nebula sky 1500 moon hot extends swans ago 5000 explosion explorer tucked supernova night gas occurred stellar nasas ultraviolet dust years 8000 glow evolution wispy wings cygnus times massive loop left spreading filaments visible bright earth heated
AhYX3u	3	NY	risk ncbi int suppl dietary cholesterol clin 2009 pubmed pract function web ncbi javascript site warning requires management citation external file generate software nutrition peterjonesumanitobaca centre university mb functional foods winnipeg manitoba richardson canada nutraceuticals saturated show accurate years relation homeostasis cardiovascular overexaggerated complex increased fat fats varies association school
GBTkQq	3	NY	conference communities house safe watch lgbt live schools white state union video watch enhanced transparency commitment browse house white logs visitor wait executive actions president obama federal receipt tax federal dollars tax spent people petitions create sign house inside white tour interactive leaders people house community transgender partner education justice
rtOGwl	3	NY	living healthy breastfeed live guide quick healthfindergov learn baby connect website hyperlink nongovernmental direct application hhs consistent hyperlinks states services human subject information hyperlinked united application contained health endorsement department website intended provided visitors external constitute applications privacy appearance practices products policies purpose link redirected ready foods baby eat information
wiBYmL	3	NY	apod 20 ngc february spiral barred 1073 galaxy 2012 fascinating discover featured written image explanation day photograph astronomer cosmos universe professional february 20 2012 years bright centers galaxy system ngc young black prominently clusters spectacular dark bar 55 red upper bars telescope sea constellation space xray captured orbiting cetus pictured
AnqXpb	3	NY	omega6omega3 ratio atheroscler ncbi cardiovas rep pubmed 2006 curr function web ncbi javascript site warning requires management citation external file generate software metabolic street dakota usa west research 57105 health foundation 1400 nutrition diseases falls billharrisusdedu sioux 22nd institute university south sd inflammatory human cardioprotective ratio enzyme systems include fas
tCMPO9	3	NY	industries worldwide input food processing research market agricultural investments structure biofuel wang paul heisey schimmelpfennig pray sun rupa john dayrubenstein carl ling keith king david karmarkardeshmukh fuglie kelly 147 pp december err130 research economic report 2011 sector generally global multinational agricultural networks industries input decades increased food rise half structural
yXUDgV	3	NY	load strength targeting ncbi res gluteal pubmed cond low exercises 2012 function web ncbi javascript site warning requires management citation external file generate software jcrowessendonfccomau school australia trobe university la melbourne physiotherapy protocol results limbs group 22 vibration smith platform detected production gmp warrant greater matches countermovement competing immediately condition
y8CIpc	3	NY	acad sci efficacy ncbi evidence pubmed natl 2012 proc synaptic function web ncbi javascript site warning requires management citation external file generate software usa neurobiology university irvine anatomy 92697 california department ca spaced phenomenon primed experiments identify aspect saturated involved poorly shorter naturalistic temporal production bout synaptic presentation massed combination
yqh8TP	3	NY	task processing force visitor travel executive foreign white visa goals house establishing order competitiveness state union video watch enhanced transparency commitment browse house white logs visitor wait executive actions president obama federal receipt tax federal dollars tax spent people petitions create sign house inside white tour interactive house white office
zr5BNb	3	NY	med sci ncbi enduran sports exerc strike pubmed rates foot injury 2012 function web ncbi javascript site warning requires management citation external file generate software lb evolutionary boston 3university auburn services street 65 human research avenue 81 divinity usa 2department system 02163 health central suite care 500 biology north 4baylor
yRFYd5	3	NY	frb 13 statementmarch fomc releasefederal press 2012 issues reserve release date 13 march 2012 sector committee unemployment expanding household longerterm rate elevated open investment market information federal housing moderately expectations labor remained declined stable crude conditions economy oil increased business notably met inflation prices continued recent received subdued improved depressed
yEA7q8	3	NY	apod march spiral warped 4 eso 510 13 galaxy 2012 fascinating discover featured written image explanation day photograph astronomer cosmos universe professional march 4 2012 digitally billions years shape warped disk galaxy warps spiral spirals stars galaxys flat explanation gas warp early orbiting loose sharpened diffuse clouds conglomerations solid disks
Ai8U31	3	NY	planets features science sky system exploration solar sunset astronomy technology alignment tony dr phillipssciencenasa feel dash feb winter make sky note uncontrollable 2012 urge read put watchers 17 youre coats evening formationsome solar brightest planets lining sky system leasttonight beautiful sight pop jupiter planets west surrounded sky black blue evening
rupJYv	3	NY	people 51950u hardware ny slip 2011 op credible debour complainant probable arrest make statement objective defendant warnings denied stop reason made miranda interrogated positively articulated level required identified motion officer stopping darnell september hardware 19 arraigned 2 2010 defendant charged 13052forcible touching pl degree abuse 13055sexual pl 24026 degree 1harassment
yyLBUz	3	NY	fiber neuropathy text nutritional sulfate clinicaltrialsgov full agmatine small view supplementation performing testing agmatine autonomic questionnaire monitored sulfate improvement note peripheral function fiber pain nonblinded started arginine effects additionally response end beginning caseonly neuropathic metabolite neuropathy study months patients small evaluates noted investigators biopsy skin jfk med ctr patients clinic
t9zSSw	3	NY	crowdfunding hr patrick act 2930 access entrepreneur mchenry capital congressman building fax 2022252576 office cannon washington dc telephone house 2022250316 224 20515 ste 1830 fax district office nc 8004772576 hickory st 8283278311 8283276100 4th box po telephone 28603 tollfree 87 nw box fax nc office shelby 732 311 regional telephone
xh5Gr0	3	NY	smarter babies medlineplus page related medlineplus sooner understand healthday words news feb 15 study wednesday babies foods 9month comprehension year dont closer 1 parts babies 6 type body meaning words child word exposure psychologists language pennsylvania university daily learn researchers walking elika pointing penns surface put sense doctoral psychology things
cQSs0S	3	NY	adults ncbi arch 2005 crime pubmed psychiatry gen sever victimization function web ncbi javascript site warning requires management citation external file generate software northwestern school usa chicago university medicine feinberg lake 710 sciences shore psychiatry behavioral department drive psycholegalnorthwesternedu 60611 il illness mental community victimization crime live smi risk deinstitutionalization
ag7NbD	3	NY	web student aid financial loan years select 25 generally start choose youll plan student loans 10 depending repaying repay repayment time situation repayment standard month monthly pay repay youll full loans paid standard plan years 10 50 amount payments fixed repaid monthly pay payment interest higher plans standard reason plan
AhvmIu	3	NY	giant mission solstice cassini images home image details upper 5150 titan middle saturns top rings series shadows kilometers 3200 planet cast miles image upper speck image ring 86 rings tiny moon black white main thin shown prometheus kilometers shadows shadow appears center 53 side planet cast miles pandora small south
17d7Xm	3	NY	apod space sun 30 2008 station international transits july fascinating discover featured written image explanation day photograph astronomer cosmos universe professional 2008 30 july timing umbra earth previous transiting front central decades humanity real penumbra dark lighter fewer activity individually surrounding dawn machines sunspots space sun recorded current international contrast
ohsaT8	3	NY	living eating healthfindergov healthy live learn quick guide connect website hyperlink nongovernmental direct application hhs consistent hyperlinks states services human subject information hyperlinked united application contained health endorsement department website intended provided visitors external constitute applications privacy appearance practices products policies purpose link redirected read nutrition facts label labels tool
p36qT	3	NY	information source reliable find healthfindergov health services website hyperlink nongovernmental direct application hhs consistent hyperlinks states services human subject information hyperlinked united application contained health endorsement department website intended provided visitors external constitute applications privacy appearance practices products policies purpose link redirected connect home library questions care center doctor health
4Mdmdf	3	NY	congress library machine imagination american treasures jeffersons pasta division thomas text jeffersonmaccaroni 1787manuscript machine holograph pasta making drawing instructions thomas touring 1787 strips dough years noodles spaghetti italy fashionable paris durable france machine jefferson macaroni plans stationed food prepared william made commissioned minister pasta highly purchase short northern rolled noted
