HYVHO	2	NY	carbon trends dioxide topics defined 400 number ppm years including year mole shown loa divided expressed current parts fraction dioxide molecules dry million complete water reported co2 mauna carbon removed data air record 0000400 vapor seasonal square figure correction month symbols middle monthly dashed onehalf black adjacent red diamond centered
bbOxgP	2	NY	sec form accurate reviewed information necessarily commission reader complete exchange completethe securities assume determined filing 1 identity issuers information business contact 2 place principal persons 3 related clarification response clarification response clarification response clarification response clarification response clarification response industry group 4 size 5 issuer federal select 6 claimed apply
AsUSjs	2	NY	story whats house white page state union video watch enhanced transparency commitment browse house white logs visitor wait executive actions president obama federal receipt tax federal dollars tax spent people petitions create sign house inside white tour interactive fontstyle 880000 displaynone 171px 624px saveideacontainer 187px urlsitesdefaultfilessavevotingbgbtnoverpng norepeat marginleft formwebformclientform spanlinkhide
q3obVo	2	NY	med ncbi ann intern pubmed health low outcomes 2011 literacy function web ncbi javascript site warning requires management citation external file generate software rti outcomes north quality usa research program health policy international carolina division triangle park 277092194 services care social berkmanrtiorg limited greater million outcomes americans 80 poorer risk
lYrMzw	2	NY	voyager interstellar mission voyager phonograph records spacecraft onboard electronically carried pictures 1 2 listing permission prohibited images holder copyright note protected reproduction voyager record photograph index circle lomberg jon calibration map drake location solar frank mathematical definitions drake frank definitions frank drake unit physical frank parameters system solar drake frank
sjFseC	2	NY	forage center presentations research dairy 2011 october 48 wi dairy world 2011 expomadison forage center usdaars crop research efficiency digman fuelmatthew engineerus time improving agricultural harvest dairy starch tickpatrick scientistuniversity corn silage wisconsinmadison digestibility dairy time makes hoffman fermentation feed wisconsin extension nutritionistuniversity top herds wisconsinmadison thinkrandy dairy forage shaver
997aJB	2	NY	map room congress library reading geography backgroundgeography illustrated maps divisionhistory guide reference policiesguides aidsmap servicesreference reproductions collections finding gm map historyplaces collectionsplaces online jpeg 2000 collections digital newsmrsid viewers cataloging management activitiesacquisitions collection exhibitions phillips friends lee groupphilip society linksonline external resources conference centuries annual washington 1819 dc phillips mapping
ddwOxl	2	NY	web derricks cranes rule chat final derricks cranes rule construction final addressing issued labors number 1971 fatalities rule undertake publication derricks cranes administration labor equipment health safety technological department occupational decades led osha replacing advances standard released construction significant considerable rulemaking historic advisory proposed december period held committee reached established
xNuGnD	2	NY	minority monday national month april unity 2 health equity day skip navigation hhs overview accomplishments disparities omhs speaker equity health keynote importance advances regional mention representative role present suggested advance efforts plan owh representatives hrsa 1 3 health samhsa equity healthmoderator minority regional agencies consultantpanelists panel invited offices cms point
yQ9wJ6	2	NY	current uscert activity highimpact web current incidents regularly updated reported types summary uscert activity security page frequent multiple apple released updates safari address vulnerabilities products security os code crosssite obtain information perform vulnerabilities privileges elevated attack attacker condition execute denialofservice exploitation sensitive arbitrary operate scripting articles mitigate users ht5281 encourages
zs80sl	2	NY	wildlife service national klamath complex basin fish refuge basin planning refuges visitklamath seasonal constant ebb process dynamic mammals year enthusiast voyage visit opportunities klamath click reptiles refuge checklist print basin birds fish discovery neverending information season visitfor amphibians change wildlife determines flow viewing greatly refuges view mondayfriday 6672231 center 8am430pm
ckbbtv	2	NY	information returns guide topics efile irs resources requirement revenue tax businesses file mandated information service irs returns internal document return business transactions regulations report required information returns file statements estate partnership individual including file year calendar trust electronically information corporation make irs returns income filers 250 recipients transactions reportable persons
oBm9Ks	2	NY	affairs public home links point hyperlinks find site constitute services welfare linked web provided army west purpose stated sites contained authorized endorsement department consistent exercise activities information locations control external exchanges morale recreation appearance products editorial military disclaimer web aspects technical site comments master questions reporting site broken link address
Af7Ic3	2	NY	life ncbi family longterm experience afte pubmed neurosci nurs 2012 function web ncbi javascript site warning requires management citation external file generate software narvik university gkhinno society health department college norway lack minors children impact highlighted disabling workers survivors equilibrium unique themes lifethreatening qualitative view illuminate marital urgent spouses research
hZjdDi	2	NY	information center cpsc carbon monoxide colorless killer gas invisible carbon monoxide poisonous odorless called 150 people related states appliances year stoves heaters fireplaces fuelburning unites include nonfire accidental improperlyused furnaces water faulty incorrectlyvented die products poisoning consumer shed portable family kill home generator generators doors vents basement windows inside garage
o3DO7T	2	NY	ncbi associate spring silver pubmed obesity permeability 2011 intestinal function web ncbi javascript site warning requires management citation external file generate software molecular center sahlgrenska metabolic university gothenburg medicine sweden clinical andersgummessonastrazenecacom academy department research cardiovascular urinary urine resistance rodent including visceral content ratio adiposity dysfunctions increased fat results impaired
5RiZ	2	NY	information house freedom act white state union video watch enhanced transparency commitment browse house white logs visitor wait executive actions president obama federal receipt tax federal dollars tax spent people petitions create sign house inside white tour interactive homeowners refinancing house twitter responsible answers hours brian office questions white deese
zyFo6r	2	NY	stream jet cassini mission wave solstice jupiter rattling spies features releases stream rattling spies jet jupiter cassini home news wave jet stream cassini wave jupiter rattling spies 13 mar 2012 jet stream cassini wave jupiter rattling spies jupiters direct jupiter planets earths atmosphere lead author comparing lot papers type simonmiller
ygiJRb	2	NY	impact med ncbi outpatient pubmed 2012 care palliat palliative function web ncbi javascript site warning requires management citation external file generate software houston usa cancer syennumdandersonorg university center medicine anderson 77030 department palliative rehabilitation texas care limited cancerrelated cancer describe impact pc symptoms consultation palliative retrospective outpatient prostate advanced care
rLVP06	2	NY	apod 14 december peace eclipse pagoda indian lunar 2011 fascinating discover featured written image explanation day photograph astronomer cosmos universe professional december 2011 14 atmosphere superimposed captured sky differently 2014 delhi shadow clouds sequence back scatters blue recorded moon lunar red passes reason pagota created times preferentially passing exited volcanic
vzDg94	2	NY	e10vk 2 3 4 5 6 7 8 9 10 11 12 13 14 15 16 17 18 19 20 21 22 23 24 25 26 27 28 29 30 31 32 33 34 35 36 37 38 39 40 41 42 43 44 45 46 47 48 49 50
Ag2Ep9	2	NY	libration moon animation phase svs 3894 2012 dialamoon diameter image intervals frame year axis hourly archived angle initial libration moon current animation 2012 geocentric apparent phase end dialamoon hour position shows page features terrain surface high terminator sharp jagged earth orbiter altimeter make measurements detail lunar moons unprecedented aboard elevation
hX1yVe	2	NY	federal holidays 2012 6103 observed saturday usc federal schedule note sunday 5 establishes holiday public nonworkday monday friday holidays law employees work falls executive purposes years leave federal pay section legal 1 sunday 2 11582 3a holiday public 2012 monday falls day february january employees 1971 11 treated order specifies
sONwxx	2	NY	congress sends national ftc call registry biennial report trade past businesses impact consumers commission federal approved call congress registry focusing technologies years biennial report detailed allowed enforcement totaling year charities actions report 137 numbers tools provided accepted subscribed data paying approximately access telemarketers consumer call time 2011 law successfully 209
9uAtiT	2	NY	5 history march today perpetrated 29th boston bloody street paul 1770 5th party photographs division march regt massacre massachusetts king engraver 1770prints revere control bostonians shot slinging crowd house sentries guarding soldiers orders fired group 1770 surrounded late 5 boston contrary struck jeering hardpacked march mortally customs injuring civilians number
aT0jpI	2	NY	home gtr ncbi function web ncbi javascript site warning requires genes tests labs records gtr including conditionsphenotypes find types tests locations disease searching phenotypes symbols directors names test laboratory protein gene find drugs disease proteins searching phenotypes find traits names analytes conditions genes searching phenotypes symbols names gene conditions find
vcSyqI	2	NY	virol influenza hampers ncbi vaccination annual virus pubmed 2011 function web ncbi javascript site warning requires management citation external file generate software box netherlands center 2040 medical 50 molewaterplein 3000 virology department erasmus ca rotterdam dr po seasonal ah5n1 influenza vaccinated children impact increase absence present protective prevented results cd4
zNwZwt	2	NY	house helping american succeed businesses address white weekly state union video watch enhanced transparency commitment browse house white logs visitor wait executive actions president obama federal receipt tax federal dollars tax spent people petitions create sign house inside white tour interactive stamped states united hes steps sold made ensure president
xjpIJF	2	NY	report science nsfgov special nation dont similarity recorded chimp 987 kill species wage dna brian percent case chimpanzees war hare share killing humans important chimpanzee captivity bonobos notes violence common wild anthropologist bonobo duke evolutionary hare nsf woods wartorn lola apes endangered support young ya bush republic parents bonobos national
fCnjhO	2	NY	wildlife national laguna atascosa refuge map google address directions refugewmd google maps window opens warranty note service personal visit assumes risk made policies providing guide reusing usability control domain fish site general check information driving feature content conditions provided user directions wildlife route leaving expeditiousness representation road feed irrigation year
asKEBn	2	NY	starspangled congress library american treasures memory banner 1814 division starspangled sheet purchase carr musicenlarged 1941 thomas 17791843the scott printed key music francis banner baltimore 291 key states scott signed anthem resolutions introduced 1814 finally law spangled banner forty wellknown national proclaiming star congress song anacreon 1931 united words drinking francis
zTxpze	2	NY	sec form accurate reviewed information necessarily commission reader complete exchange completethe securities assume determined filing 1 identity issuers information business contact 2 place principal persons 3 related clarification response clarification response clarification response clarification response clarification response industry group 4 size 5 issuer federal select 6 claimed apply exclusions exemptions
wsP6Fb	2	NY	house visitors tour surprises white lady state union video watch enhanced transparency commitment browse house white logs visitor wait executive actions president obama federal receipt tax federal dollars tax spent people petitions create sign house inside white tour interactive adobe player flash content download view february 16 domain 11811 public
yH1eL6	2	NY	intake risk cancer antioxidant ncbi nutr pubmed nutrients 2012 function web ncbi javascript site warning requires management citation external file generate software geoffreykabateinsteinyuedu usa 10461 medicine albert epidemiology health york einstein department college bronx population evidence ci intervals lymphoma condition associations risk yr association nutrients identified large 20th reduce substantially
ze21os	2	NY	senate commissions state york authorities corporations standing 14 monday room senate commissions lob michael 130 ranzenhofer committee senator authorities corporations chair 2012 801 pm standing 14 monday room senate commissions lob michael 130 ranzenhofer committee senator authorities corporations chair 2012 801 pm standing room monday lob senate commissions 30 michael
wKbJY3	2	NY	settlementfeb92012 foreclosure loan general 25 mortgage federal stops state protections largest government servicers reach agreement servicing address homeowner billion attorneys relief abuses hud attorney financial colorado foreclosure miller washingtonus suthers general substantial reached eric 25 mortgage 49 federal housing government state protections tom department john loan announced relief development urban
sLKizj	2	NY	med patient exam ncbi activation gen matter intern pubmed 2012 function web ncbi javascript site warning requires management citation external file generate software 97405 management 1209 usa university oregon jessicaguoregonedu policy planning department public eugene managers manage related outcomes confidence knowledge activationor health samples care awareness patient healthrelated small selfreported
hZsaoG	2	NY	prevent stress healthy manage problems live healthfindergov health learn quick living guide connect website hyperlink nongovernmental direct application hhs consistent hyperlinks states services human subject information hyperlinked united application contained health endorsement department website intended provided visitors external constitute applications privacy appearance practices products policies purpose link redirected information usaccessibility
AoJIY1	2	NY	announcement space 1972 shuttle president nixons president san administrator fletcher richard space program 5 shuttle final announced headnote california approval received clemente james 1972 nasa editorial january nixon accessible states decided endeavor 90s united proceed space system 1980s territory type today development transportation familiar human designed easily frontier transform 1970s
aZMetW	2	NY	poster epa sunwise contest jump main content contact home sunwise foundation rules uptodate including information contest official visit forms shade entry andor sunwise contest state interested promoting call sunwiseepagov supporting 202 poster 3439378 contact shade 2011 national winner seventhgrader michigan jolie family students school jolie congratulations contest participated 2011 crayola
zhrVYv	2	NY	asthma ncbi ann allergy enterocolitis 2004 pubmed immunol riceinduced function web ncbi javascript site warning requires management citation external file generate software division immunology center usa university allergy missouri st 63110 sciences health saint louis department pediatrics unusual food allergy common cultures rice children western case intolerance 11monthold tcellmediated report
nhzgOZ	2	NY	ch ncbi eggs nutr pubmed increases dietary cholesterol 2008 hdl plasma function web ncbi javascript site warning requires management citation external file generate software usa storrs university nutritional sciences connecticut department 06269 ct hyper results hdlc assigned carbohydraterestricted including 134 group 28 0 mmoll 2401 decreased plasma increased mgd evaluate
kl0eL9	2	NY	fdsys browse uscode code codification house general states edition titles 1926 years subject information united office broad divided representatives current subjects subsequent main revision permanent cumulative 1934 law present counsel annual 51 editions matter supplements published order laws code office house information gpo verify representatives virtual research contained version editions
if1jua	2	NY	information house freedom act white state union video watch enhanced transparency commitment browse house white logs visitor wait executive actions president obama federal receipt tax federal dollars tax spent people petitions create sign house inside white tour interactive homeowners refinancing house twitter responsible answers hours brian office questions white deese
yjiYy5	2	NY	treating nonhodgkin tcell text relapsed clinicaltrialsgov refractory patients full peripheral lymphoma alisertib view cancer needed cells stop blocking cell enzymes growth rationale alisertib treating lymphoma nonhodgkin tcell relapsed refractory ii trial patients purpose peripheral phase works studies alisertib objectives outline multicenter study unacceptable days 21 absence treatment po bid alisertib
E32hW	2	NY	drop apollo 15 hammerfeather mb quicktime movie 83 demonstration vacuum resistance walk held scott apollo live feather mission released controller fall report years television 15 science air dropped concluded commander rate performed allen geologic demonstration end hammer cameras moon pictured hundreds fell joe preliminary galileo essentially david objects mass time
AfW92Y	2	NY	climate global february analysis state 2012 form monthly reports access calculation 310 surface dataset including anomalies monitoring temperature monthly beginning state note 3 version ncdc 2011 activities global complete land preliminary report november data change received climate october effective presented trends ranks replaced processed ghcnm newest coding homogeneity adjustment information
rieB3Q	2	NY	apod september 4 saturn 2011 shadow fascinating discover featured written image explanation day photograph astronomer cosmos universe professional september 2011 4 discovered bright earth scattering giant saturns main spectacular outermost dark shadow saturn spacecraft night side view unexpected hard back eclipsed pale blue sun rings moon orbiting newly hours silhouetted
bY3G5x	2	NY	partnerships small businessselfemployed small businessselfemployed topics irs resources money partnership share expects existing carry skill relationship labor contributes business persons trade join losses person property profits operations losses partnership tax file partner information pay income return gains passes share includes deductions report loss annual partners profits partnerships issued partnership date
xzMFCp	2	NY	photo house january white day 2012 state union video watch enhanced transparency commitment browse house white logs visitor wait executive actions president obama federal receipt tax federal dollars tax spent people petitions create sign house inside white tour interactive january house check offices photo 2012 picks white day office deputy
19AnNk	2	NY	congress library teacher resources primary library effectively librarys offers collections digital teaching development congress vast classroom sources materials teachers professional classroom find state materials meet standards classroom congress power ways discover library primary bring sources discuss discover sources guides librarys information copyright source ways citing easy begin tool primary classroom
GTuFc0	2	NY	hankuk house university president speaks white obama state union video watch enhanced transparency commitment browse house white logs visitor wait executive actions president obama federal receipt tax federal dollars tax spent people petitions create sign house inside white tour interactive adobe player flash content download view 26 march 2937 domain
xYQKDc	2	NY	curr ncbi rep acti pubmed effects pain headache 2011 exercise physical function web ncbi javascript site warning requires management citation external file generate software school ma usa medical 02114 medicine harvard spaulding boston department hospital rehabilitation physical incorporate nonpharmacologic formulated evidence providers manage share contemporary conditioning regimens controversial disabling recommendations
kvcs	2	NY	financial government citizens grants usagov aid benefits financial grants identify apply eligible benefitsgov government loans benefits aid financial loan back states grants universities grant pay assistance awarded interest type grantsgov differences cities loans counties organizations search remember required individuals nonprofit researchers top back top back top back top back benefits
17R7oz	2	NY	lincoln memorial national search immortalized people civil saved memorial united union emancipator statesthe memory enduring inspiration temple seeks great symbol forever nation preserver words president lincoln attracts warsits marble enshrined hope freedom hearts beneath abraham 16th app memorial service official park parks mall national memorial blossom cherry national parks mall
yRQiwq	2	NY	ri sci ncbi ann lab ldl levels low cholesterol clin pubmed serum 2007 function web ncbi javascript site warning requires management citation external file generate software school tel center medical holon sackler israel aviv medicine internal edith department wolfson university ldl 18157 cardiovascular 24 group morbidity mortality associations increased therapy
xQV03f	2	NY	affairs public home links point hyperlinks find site constitute services welfare linked web provided army west purpose stated sites contained authorized endorsement department consistent exercise activities information locations control external exchanges morale recreation appearance products editorial military disclaimer web aspects technical site comments master questions reporting site broken link address
vG8lcT	2	NY	apod thunderclouds jumping sundogs 8 november 2011 fascinating discover featured written image explanation day photograph astronomer cosmos universe professional altsee picture clicking resolution explanation version download 8 november highest 2011 phenomenon years web rapid sky reorients differently sundog return emerged words clouds lightning inspection temporarily enthusiasts past curious encouraged sum
eFVbNf	2	NY	life form nasa science story streaming downloadable file audio listen californias 30 lake mark twain 2003 mono july didnt earthis lies lonely 1872 silent picturesque solemn hideous loneliest spot sailless desert tenant seathis graced lifeless treeless roughing travelogue wrote beautiful national astrobiologist technology richard space hoover huntsville nsstc nasas center
rAtlFb	2	NY	requirements reporting faqs payment card news essentials newsroom topics irs resources revenue settlement special network service irs entities internal 1099k begin thirdparty form transactions reporting payment card transitional required relief banks providing notice 201188 201189 faqs special information requirements network details 2011 2012 scheduled begin thirdparty transactions reporting occurred early
Omemy	2	NY	current impact risks introduction monitoring impact frequently asked questions notes operational jpl table earth click impact based system detected potential observations events details full object lists designation sentry future page highly collision earth cases impact unusual monitoring review system continually current detected asteroid iau scans underway results catalog automated analyzed
zs1del	2	NY	flashlight led target fire burn hazards due sets recalls named washington instructed voluntary consumers illegal commission safety cooperation announced firm product stop dc recalled resell attempt immediately products today recall consumer flashlight product led 6pc sets units 55000 target minn corporation minneapolis importer flashlights fire burn turned hazard heat posing
lw7OSD	2	NY	frb 2011 beige booksummaryjune 8 summary louis richmond francisco san chicago boston kansas philadelphia minneapolis st districts york cleveland dallas atlanta city report full twelve expanded related number slowing services economic accelerating technology nonfinancial industries information service federal generally philadelphia regions contrast economy led business york deceleration report atlanta manufacturing
