AlKHAe	1	NY	census features records newsroom 1940 edition facts editions special release features reasons marked facts 1940 long 2 archives 2010 early records world presidency edition roosevelt war 2020 history detailed profile compare raging national ii winding individual nations depression information lengthy make administration public europe plans notable included america momentous great
x9LNgj	1	NY	patient ncbi prognostic factors haematologica pubmed evaluation 2012 function web ncbi javascript site warning requires management citation external file generate software hospital de spain salamanca universitario 0 proposed results years identify involved univariate impact conclusions 28 p0007 platelet p0001 4 mortality affected 26115 survival background 2 acute identified summary gut
Hf61vD	1	NY	today fermilab years experiments expensive antimatter ideal conditions slowly scientists theory relied understanding universe data analysis guide matter burdensome piece explain pick evidence gaps theory provide answer theoretical minimal quigg complete physicist standard chris magic unlike analysis experimental model fermilab origin theorists explains support antimatter numerous theory expansion skeptical imbalance
JzD7gx	1	NY	anxiety ncbi weight 2011 disord pubmed individuals eat eatingrelated function web ncbi javascript site warning requires management citation external file generate software webbx115umnedu 606 usa 602 university mn minnesota minneapolis 55454 psychiatry suite department ave 24th limited supported results report identify previous disorders situations fiftythree treatment factor employed 6factor 4factor
qTg38g	1	NY	code 21 title federal regulations cfr 131 part milk cream standardized brequirements subpart specific milk cream adjusted 314percent 814percent separating thereto skim cows milkfat milk cream adding concentrated secretion milking ultrapasteurized final adescription therefrom complete form nonfat dry free part fat obtained homogenized practically healthy package colostrum lacteal solids beverage
rZ9foZ	1	NY	house white state union video watch enhanced transparency commitment browse house white logs visitor wait executive actions president obama federal receipt tax federal dollars tax spent people petitions create sign house inside white tour interactive event live facebook discussion participate click member facebook give click questions comments httpwwwwhitehousegovvideo ondemand library
A6SKIf	1	NY	date save day awareness 2012 childrens national youre wednesday samhsas day health awareness 9 2012 invited celebrate mental observance childrens people informed national year demonstrations 115 participate message event mental caring networking raise federal traumatic young day resilience health samhsa complements local awareness activities importance share social systems campaigns sponsored
yTQceE	1	NY	house white state union video watch enhanced transparency commitment browse house white logs visitor wait executive actions president obama federal receipt tax federal dollars tax spent people petitions create sign house inside white tour interactive event live facebook discussion participate click member facebook give click questions comments httpwwwwhitehousegovvideo ondemand library
yr9Xub	1	NY	code 21 title federal regulations cfr illnesses subpart drugs haccelerated approval lifethreatening illnesses existing provide patients safety treat intolerant effectiveness patient ability treatments therapy meaningful response unresponsive treating improved subpart lifethreatening studied drug benefit products applies therapeutic 11 fr 1992 amended 1999 57 58958 jan 64 5 dec 402 relation
vMvX4Q	1	NY	deceptive killers storms winter killers deceptive winter stormsthe sea blizzard mph coastal winds cold beach utility fronts winter west storms snow intense power poles blinding conditions damaging mountains creating winddriven drifting roofs erosion trees coast descending sink 100 strong chill knock structures dangerous lines alaska severe gust accompanied flooding wind
AqtEBG	1	NY	haematol incidenc ncbi addition reduces pubmed br rituximab 2012 function web ncbi javascript site warning requires management citation external file generate software division school hematologyoncology center usa zagreb joarmitaunmcedu university microbiology ne email medicine nebraska croatia internal department pathology medical omaha activity browsing empty recording activity turned recording turn back
yVEw8F	1	NY	thomas congress text bill library 112th 20112012 hr347 hr347 hundred twelfth congress states united america session city tuesday washington held begun twelve thousand january day act buildings simplify relating section title drafting states united code restricted 1752 correct 18 grounds building restricted sec 1752 grounds speaker house representatives united vice
AlFVsQ	1	NY	photo house january white day 2012 state union video watch enhanced transparency commitment browse house white logs visitor wait executive actions president obama federal receipt tax federal dollars tax spent people petitions create sign house inside white tour interactive january house check offices photo 2012 picks white day office deputy
w66WVy	1	NY	24 apod january norway aurora 2012 fascinating discover featured written image explanation day photograph astronomer cosmos universe professional 24 january 2012 earth captured northern sky spectacular aurora recombining oxygen large activity round throwing protons sun flare pictured eagle night free latitudes days magnetosphere whats feel powerful mass cloud earths fast
xxUpnP	1	NY	apod group 19 sun sunspot 1429 distant march 2012 fascinating discover featured written image explanation day photograph astronomer cosmos universe professional 19 march 2012 suns month earth birds group weeks colorful trees dark satellites years continued rotate upper past ejections sun particles orbiting foreground sunspot active blasted ahead region whats
yuF7Q0	1	NY	ncbi komplementmed forsch pubmed safety 2006 effectiveness costeffectiv function web ncbi javascript site warning requires management citation external file generate software wittenherdecke theory complementary medical germany medicine chair university office technology evaluation federal costeffectiveness program health pek medicine effectiveness public complementary compiled framework report behalf assessment bag swiss appropriateness homeopathy
A7s8iN	1	NY	added risk full reducing evaluate atrial clinicaltrialsgov juice fibrillation text mangosteen view recurrent care usual endothelial af reduce direct juice tissue current arteries atrial addition lining recurrence fibrillation inflammation dysfunction function risk dc standard properly effects care cardioversion medical cell mangosteen study biomarkers compare inflammatory af secondarily primary inr supplement
e0k9Op	1	NY	immunotransplant mcl autologous clinicaltrialsgov cell full text phase iii cpgactivated vaccine view mantle nhl vitro marked immunotransplant hematopoietic transplant irradiated combined chemotherapy treatment mcl efficacy reinfusion evaluate posttransplant vaccinations lymphoma harvest treating pheresis cpgmcl cpgenriched cells patients cure tcells schema treated autologous nonhodgkins subtypes shown relapse cell prognosis immunostimulatory safety
Hcbwh3	1	NY	frb foreclosureapril policy federal release 5 board statement residential press acquired 2012 rental properties issues reserve release date 2012 5 april foreclosure acquired strategy federal residential expectations thursday reiterating board statement policy outlines activities statutes regulations released part disposition supervisory rental properties orderly permit reserve estate efforts owned general date
buzMrh	1	NY	center tornado watch prediction storm 87 status report messages watch 87 information network service national warnings visit iwin weather interactive high 70 50 mod high 80 50 mod high 80 high 80 high 95 f2f5 probability forecaster 70 60 table event increased category tornadoes probabilities issuing 5 low moderate events
cuL8Ip	1	NY	developmental disabilities skip navigation instance disabilities problems complex defect key patterns part sensoryrelated birth function metabolic process functional defects disordersthis group affects create sugar disorders metabolism body energy breaks persons birth processes include builds commonly materials abilities show signs defect born disorderssome result functions disorders metabolic due detected degenerative function
jUSKu	1	NY	gluten ncbi rev nutr milligram recov mucosal 2004 pubmed day function web ncbi javascript site warning requires management citation external file generate software policlinico italy university matteo pavia irccs years duodenal spite basis harmless clinical histological gluten prevented biopsy report 2 reviewed day case patients celiac satisfactory milligram serological adequately
f6qTCk	1	NY	frb reviewmarch comprehensive analysis 18 releasefederal capital press 2011 completes reserve release date 2011 march 18 crossinstitution federal review holding capital announced friday plans comprehensive completed ccar bank largest 19 study companies analysis reserve detailed back month planning result decisions reviews federal shares increase capital expected firms requested buy government
Mivrc	1	NY	information protection agency radon environmental state contact content area jump main navigation contact rn radon lands radonresistant national related month zones including native information housing find state program health assistance department local events map living directory construction authority tribal radon contact action americans builders wwwepagoviaqtribal epa va pa providers requiring
xdBuig	1	NY	eagle national bald park record hatching islands chick earliest channel search carl start santa breeding channel 2012 arrival eagle monday season nest bald early kicking cruz peak hatching islands natural earliest witnessed record island chick sizeable resident number 1960s 60 year eaglesa increase breeding channel disappearance season bald early 70
yZ7SDp	1	NY	complaint scam center telephone variation crime payday collection internet ic3 loans related delinquent obtain attempts victim delinquent debts questioned posted 2010 victims continues net companies relentlessly fraudsters checkcashing home employment federal avoid representatives legal cell payday internet firms pose agencies reported advance receive place scams ic3 involves collecting previously loan
A1pZC2	1	NY	bmc ncbi abrowsea nextgeneration customizable pubmed bioinformatics 2012 function web ncbi javascript site warning requires management citation external file generate software beijing life china center university plant research sciences state pr college peking key bioinformatics laboratory protein gene 100871 sequencing growth open visualization functions rapid platform data indispensable system research
zdLtBc	1	NY	reannounce homes prompt fire recall manufactured gas furnaces concerns york international named washington instructed canada voluntary consumers illegal commission safety cooperation health announced firm product stop dc recalled resell attempt immediately recall products today consumer homes product gas evcon furnaces manufactured coleman red canada 223600 previously recalled 2400 units 2004
17t9qM	1	NY	national liberty statue monument search dedicated people states 1924 centennial national 1886 1986 united enlightening 28 liberty france 4 universal symbol monument designated statue world july october democracy gift freedom friendship restored end closed remains inside year liberty continue visits statue island renovation 2012 city statues views torch live liberty
HY5qTs	1	NY	apod 15 possibly fata titanic april morgana mirage 2012 fascinating discover featured written image explanation day photograph astronomer cosmos universe professional april 15 2012 mirages years distant mirage cold phenomenon crew setting morgana wet real fata sightings coast onboard distortion shapes pavement californian observer consistent pacific icebergs sun conditions comparable
zXwPcz	1	NY	iris substances list az epa jump main content system information iris integrated risk iris search contact additions epa recent relevant find number browsers click alphabetical beginning chemical listed alphabetically substances chemicals service letter iris search substance list casrn command abstracts order registry office information documents develop additional decision program health
HYcYTr	1	NY	uscis study civics materials test questions pass tools answer prepare materials correctly 6 interview 10 started test 100 study list civics naturalization asked additional section products select short naturalization process overview video test providing highlighting citizenship rights responsibilities civics video history audio format official list answers civics mp3 questions test
v6pd9o	1	NY	control cognitive ncbi insomnia affective pubmed front 2011 psychol function web ncbi javascript site warning requires management citation external file generate software center sciences university swiss affective geneva department switzerland psychology control fourfold evidence states chronic paper sleep affect budding worry intervention thought disturbance field review outline negative forms rumination
I7N6n2	1	NY	thomas congress text bill library 112th 20112012 2230 pcs effective imposing tax reduce taxpayers rate minimum deficit highincome harkin whitehouse akaka franken begich schumer sanders read time blumenthal boxer reed levin bill rockefeller mrs leahy mr introduced durbin read time calendar effective imposing tax reduce taxpayers rate minimum deficit highincome
b6Mefp	1	NY	center tornado watch prediction 88 storm status report 88 watch messages information network service national warnings visit iwin weather interactive 40 mod 20 low 30 mod 30 mod 40 mod 30 mod high 70 f2f5 probability forecaster 70 60 table event increased category tornadoes probabilities issuing 5 low moderate events
GILOVU	1	NY	errors ncbi aging commission whoops pubmed 2012 psychol function web ncbi javascript site warning requires management citation external file generate software psychology usa university washington st louis department mscullin521gmailcom 63130 mo forget exclusively risk execute eventbased press identifies errors cues factors research increase lexicaldecision participants told ability corn groups study
GG4d0f	1	NY	sec form accurate reviewed information necessarily commission reader complete exchange completethe securities assume determined filing 1 identity issuers information business contact 2 place principal persons 3 related clarification response clarification response clarification response clarification response clarification response clarification response industry group 4 size 5 issuer federal select 6 claimed apply
yyiRHR	1	NY	floor senate legislation records webcast home reauthorization executive states session russell northern george united exportimport resume illinois hr2072 convene maryland john tharp pm 200 monday schedule jr levi district act430 judge consideration iii nominations bank proceed 14 motion 2012 archived accessing videos live congress met calendars list days senate session
ycldxP	1	NY	fax fire hp burn hazards due recalls machines named washington instructed voluntary consumers illegal commission safety cooperation announced firm product stop dc recalled resell attempt immediately products today recall consumer 1050 product 1040 hp fax machines canada 240000 mexico 928000 units alto importer palo hewlettpackard calif fax overheat failure fire
wxDRVk	1	NY	report science nsfgov special nation body eyes mostespecially language communication mental wisconsinmadison states computer mutlu tells things gaze sorts conversations attention bilge roles turns university scientist humancomputer foundation national humans scientist nsf fellow create psychology support gaze body specialist robots helping characters interaction language michael mutlu gleicher reproduce thing computer
xhqVmO	1	NY	notice iran emergency house continuation national respect white state union video watch enhanced transparency commitment browse house white logs visitor wait executive actions president obama federal receipt tax federal dollars tax spent people petitions create sign house inside white tour interactive house white office press secretary notice iran emergency continuation
Stnj	1	NY	hemisphere enlarged northern view documentwritelnbr polar documentwritelnn pass measurement documentwritelncenter time passtime recent extrapolated pass auroral oval plot northern measurements current shows polar satellite hemisphere extent noaa recent position poes hand plot clock noon points arrow meridian red ten map color updated auroral observed underlying statistical pass oval respect fluxes
AES0Y0	1	NY	multiple descriptive cancer res rep myeloma ncbi igd exp clin pubmed 2012 function web ncbi javascript site warning requires management citation external file generate software abstract seventeen methods design pts working selected latiumregion prognosis gimema multiple poorer group 1993 rare mm myeloma institutions patients immunoglobulin diagnosed isotypes 2009 igd 667
wY4gdO	1	NY	project database bioreactor ncer research landfill design fuel ord waste algae epa content area jump main navigation contact research extramural project search ncer research feed leachatepond experiments design leachate determine laboratory project informed content objective optimal local bioreactor harvesting onsite surfacepond dilution gas flocculant oil water algal designed stocks algae
y63A4a	1	NY	medical sickle medlineplus cell encyclopedia anemia abnormal sickle shape disc crescent cell red families passed form blood anemia shaped cells disease exposed hemoglobin caused abnormal sickle shape protein crescents carries cell low type red levels blood anemia oxygen shaped inside cells called sickles interupt tissues pieces stuck vessels bodys deliver
y1kXuw	1	NY	ima analysi ncbi package bioinformatics pubmed highthroughput 2012 function web ncbi javascript site warning requires management citation external file generate software usa biostatistics cancer roswell institute park ny department buffalo 14263 computational platform highdensity 450 450k package beadchip individual human infinium commonly implemented availability ima regions functions dna annotated illumina
wYGNlm	1	NY	networking ncbi media social saf pubmed health workplace 2012 function web ncbi javascript site warning requires management citation external file generate software school nc north susanrandolphuncedu usa university global 275997502 gilings hill health chapel public carolina media networking benefits consequences nurses social participating understand risks health occupational incorporated slack copyright
x5ospf	1	NY	diseasegene ncbi personal res pubmed genome probabilistic finder 2011 function web ncbi javascript site warning requires management citation external file generate software city school genetics usa institute university utah lake 84112 medicine myandellgeneticsutahedu human ut department salt eccles unified cumulative existing identify impact personal individuals diseases aggregative framework variants identifying
oXblZR	1	NY	king luther national memorial jr martin search love beacon message man conscience equality justice freedom movement app memorial service official park parks mall national memorial movement history man photo multimedia link pages national click mall plan find memorial blossom cherry national parks mall link page emerging fair generation image society
w1yMGS	1	NY	bin info homeland house laden filmmaker access ap committee pentagon security probes january 5 press 2012 mission osama ap pentagon laden administration secret concerns hollywood details bin filmmaker killed obama pakistan office intelligence committee inspector peter pentagon information heads rep filmmakers informed homeland house raid pentagons king generals covering investigate
AxpESR	1	NY	laceration choking hazards due tumblekins recalled toys international playthings named washington instructed voluntary consumers illegal commission safety cooperation announced firm product stop dc recalled resell attempt immediately products today recall consumer product toys tumblekins units 31000 nj parsippany llc distributor international playthings treetoys trading china lishui manufacturer lacerations choking hazards
yIt0NJ	1	NY	aristarchus apod 17 wall west february crater 2012 fascinating discover featured written image explanation day photograph astronomer cosmos universe professional february 17 2012 remarkable bright debris melt find impact 25 26 deposits crater plateau include 2011 pixel spectacular material dark vast 16 gazing aristarchus anchored meters images procellarum recorded 3
xv7638	1	NY	styles alcohol consumption ncbi parenting pubmed health 2012 psychol function web ncbi javascript site warning requires management citation external file generate software brazil juiz faculdade fora de sobrinho machado scales instruments influence results related sample 273 analysis directly maternal questionnaire regression adolescence responsiveness alcohol consumption authoritative interact socialization paternal 1
HFpUPS	1	NY	grant grantsgov opportunities synopsis opportunity find precedence service disk electronic click information grant provide notification send inconsistency document email resolved notifications printed address opportunity emails change receive thing giving original requestedany modification description represent newest file oldest previous shown documents current document sections files background representing modifications arranged changed list
gsGzAP	1	NY	specific country information penalties embassy drug learning crime localized information start provide spots find hot health location place conditions good visa world security country medical offices consular afghanistan albania algeria andorra angola anguilla antarctica barbuda antigua argentina armenia aruba australia austria azerbaijan bahamas bahrain bangladesh barbados belarus belgium belize benin
ySTiyH	1	NY	ncbi food malays chocolate pubmed moods nutr 2011 function web ncbi javascript site warning requires management citation external file generate software malaysia 20400 quality ccqols sciences clinical health medicine life centre faculty terengganu kota unisza kampus sultan zainalabidin kuala universiti studies controversial reasons contribute influence evidence appetite neurotransmitters mood consumption
xsNIU6	1	NY	infant carter choking due hazard recalled rattles lee named washington instructed voluntary consumers illegal commission safety cooperation announced firm product stop dc recalled resell attempt immediately products today recall consumer product infant rattles units 25000 carter francisco san calif importerdistributor lee violating childs handle rattle hazard posing throat rattles fit
IDTANJ	1	NY	multiple ncbi diagn myeloma pubmed genome sequencing 2012 blood function web ncbi javascript site warning requires management citation external file generate software division hematologyoncology mayo united scottsdale states clinic arizona az including purified contributing longitudinal rose characterization samples plasma transformation myelomagenesis mutations shared sequencing variants secondary evolution progressive interestingly comprising
yUISxz	1	NY	uscis form centralized i601 filing lockbox centralized states lockbox est application inadmissibility i601 teleconference 9 pm march form 300 united filed discuss applicants uscis transition conducted 2012 filing waiver grounds centralize requirement i212 filing immigrant states customer embassy file forms united procedures operational i601 visas applicants officer filings form processes
d7PFbS	1	NY	hud cpd program home investment partnerships ii home cfr electronically 24 information additional title housing pages program authorized national affordable amended web cranstongonzalez part 92 regulations visiting rule final act found andor people lowincome partnership direct states grants rent home provide rental housing localities build assistance formula local useoften affordable
d3KIKm	1	NY	ultrasound transvaginal encyclopedia medical medlineplus pelvic ultrasound including organs cervix womans vagina type transvaginal means ovaries reproductive uterus ultrasound pregnancy bent picture sends probe feet computer table lie monitor doctor tv create vagina health condom provider covered gel structures body sound knees reflect waves immediately holders care place transducer receives
7SXjRD	1	NY	network ncbi activation deactivation neurophysiol pubmed neocortex 2010 function web ncbi javascript site warning requires management citation external file generate software 19129 lane 2900 usa neurobiology university queen philadelphia anatomy medicine pa drexel department college desynchronized show deactivated activated produced brain activating controls quiescence systems wellknown tonic means activation effects
Ah0xGH	1	NY	publicationsusagov main page pueblogsagov site publicationsusagov decisions information federal make offers citizen important center life publications consumer insurance disability guide income item chances number covers disabled sources affect 512w insurance previous disability potential income finances booklet plan significant career publication weekquot order purchases national number trade edition previous contacts federal
