HhtijZ	1	NY	legislative fellowship national archives skip navigation researching years scholarly legislative based fellowship support submit candidates archives proposal national records month applicants topic work proposals historical identifies history senate house topics states dissertation united representatives archivist research application supports foundation congress phd qualify ferriero plan approved received center created considered david
g3Ga77	1	NY	apod march parthenon moon 20 2011 fascinating discover featured written image explanation day photograph astronomer cosmos universe professional march 2011 20 earth captured apogee skies perigee rise famous loom difference exact matched large night equinox farthest year portrait moon wellplanned lunar moons full reaching orb equal horizon point phase rising
GAGCMo	1	NY	conference communities house safe watch lgbt live schools white state union video watch enhanced transparency commitment browse house white logs visitor wait executive actions president obama federal receipt tax federal dollars tax spent people petitions create sign house inside white tour interactive leaders people house community transgender partner education justice
yuYuGd	1	NY	jan 9 2011 blotter 33rd locationsabout usnonemergency3034413333 streetboulder 803013034413300other address1805 emergency911 boulder 6a1a18 uiheadercolor favorites twitter servicesexclude uicobrand print addthisconfig servicescompact google facebook delicious var ffffff email uiheaderbackground house unlocked 12390 ave sounds information police suspect pm investigated door males reported front awakened left university told leaving block residents male
yZxhRq	1	NY	teen summer wilderness academic national park offers program adventure enrichment yosemite search summer inspire golden mission actions founded nurturing consists nevada partners based personal residential 28 state offers sierra 2012 monica recreation organizations online runs world adventurous association school bar skills michael serves annually 501c3 40000 bilodeau including klean olympic
33EGHu	1	NY	office education fermilab committed prekindergarten laboratory education research graduate scientists mathematics enhancing students serve literacy training programs science fermilab stimulating office strengthen mission engineering learning education technology districts teaching secondary resources nationwide lab primary catalyst mathematics schools change improve school resource programs science fermilab precollege educational based office provide opportunities
wqVpvB	1	NY	education agenda committee education committee public agenda hearing tuesday 2012 february 21 lob room 115 1e pm committee review bills 24 educational 1 act sb competitiveness limited 30 certification senate 5371 topics hearing recruitment grants including committee 32 nonfinancial 24 retirement bargaining 29 governance 1 subjects vocationaltechnical performance public development
I3y2hb	1	NY	evaporating apod blobs carina 23 nebula april 2012 fascinating discover featured written image explanation day photograph astronomer cosmos universe professional april 23 2012 years winds forms dark clouds small found upper telescope alive constellation blobs opaque nebula orbiting pictured evaporating iconic hubble months keel lies spans unusual span carina create
AhK0tk	1	NY	thomas congress text 20092010 bill library 111th 1763 hres ih house directing copies wikileaks provided documents representatives state disclosed department public outlets transmit press assessed classified unlawfully secretary affairs committee submitted foreign ms resolution roslehtinen referred house directing copies wikileaks provided documents representatives state disclosed department public outlets transmit press
yM4Zdk	1	NY	pelican national wildlife refuge island map google address directions refugewmd google maps window opens warranty note service personal visit assumes risk made policies providing guide reusing usability control domain fish site general check information driving feature content conditions provided user directions wildlife route leaving expeditiousness representation road restore lands habitat
zX48Ks	1	NY	directed congressionally medical peer reviewed release program press research 2012 foster fy12 wellbeing directions prmrp science reviewed challenges communities beneficiaries defense year tools cdmrp office service army congressionally translational ideas research program health basic department clinical areas veterans leading 2012 development directed product administered scientific million diagnostic trials members address
Rlw1	1	NY	abstract statistical 2012 comprehensive united authoritative abstract political summary states statistics economic statistical published organization 1878 social reference abstract sources statistical information convenient print web volume guide organizations census federal agencies analysis labor sources economic statistics bureau private include data abstract agencies private sources data organizations census federal bureau guide
HRWPnH	1	NY	flat learns headquarters visits prepared blog stanley fema comment accordance comments blog moderated policy femas links nongovernment social applications web fema provided reference media companies sites endorse msgdata washington street apply management prepare federal rates homeland department 4fema emergency dc 43362 20472202 sw agencyus security500 6462500text tty assistance step 46275853
ykwWLb	1	NY	policy genetics public fellowship sector serving capitol executive wishing human decisions staff cosponsor policy branch unique assignments guiding translated people national society officials institutes genetics integration research fellowship critical health hill public scientific viewpoints extent improved institute transition experience american greatly nonprofit tools legislative genomics perspectives working clinical fellow professionals
76re7C	1	NY	center tornado watch prediction 1 storm 1 status report watch messages information network service national warnings visit iwin weather interactive 30 mod 20 low 30 mod 10 low low low 60 mod f2f5 probability forecaster 70 60 table event increased category tornadoes probabilities issuing 5 low moderate events awareness listed
GEcS4U	1	NY	art 1964present senate byrds historical home minutes history 1964present 1980byrds march 21 history senators letters memoirs acerbic 1789 senate describe exclusively sought select information unique congress source explain generally histories long closed view participantobservers 1791 proceedings doors diaries company maclay william met maclays diary preparing earliest institution senates larger serves
JMKNas	1	NY	current uscert activity highimpact web current incidents regularly updated reported types summary uscert activity security page frequent multiple apple released updates safari address vulnerabilities products security os code crosssite obtain information perform vulnerabilities privileges elevated attack attacker condition execute denialofservice exploitation sensitive arbitrary operate scripting articles mitigate users ht5281 encourages
xtzWut	1	NY	resource nida families 17 navigate national nih health helps institutes january release addiction 2012 news options treatment links related bookmark share developed national hard choosing questions institutes information nidas service program health treatment online struggling nida families drugpubs seeking free abuse part copy addiction resource institute drug public individuals researchbased
gkPt24	1	NY	natural senate energy committee resources sector energy modernize electricity seeks 2012 power standard generated nations future clean act guide bipartisan management resource reserve federal responsible stewardship strategy lays act helium 2012 files ferc documents item addition attached chairmans find au letter murkowski senator linked amendment text act joint result substitute
GW75GN	1	NY	northeast expert disease medlineplus spike lyme brace page related medlineplus spring tuesday northeastern states healthday united 20 expert lyme increase warns march significant news cases disease crop years produced year mouse normal oak bust boom means acorns trees reason part acorn trouble feeds cycle whitefooted small cary heels mouse crashing
zi62Ow	1	NY	comment rules practice ftc agencys public seeks proposed issued allegations trade misconduct electronic ftcs commission federal make agency parts today discovery agencys detail streamline updates govern practicing operates procedures attorneys pace investigatory evaluating comment proposed parties concern ftcs 23 federal effort review unduly parts 4 subject 2012 march rules practice
90xIvJ	1	NY	introduction lincoln assassination papers wilkes dagger railing back shattered booth dropped arm balcony forced rushed caught leg boot lunged pistol waved door rathbone killer rail landing disappeared draped flag leapt slashed horseback spur john left injured night assassin bone upstairs efforts breathing lincolns lodged tenth failed eye doctor 722 entered
FQhE26	1	NY	national area baltimore heritage search people civil national struggles culture forged city stood incredible heritage transformation area war centuries prosperity nation explore identity commerce center places shaped chesapeake rights experience bay american freedom baltimore heart natural neighborhoods area innumerable includes downtown sites historic heritage waterfront oldest baltimore heart urban national
ybNAMV	1	NY	apod january pillar maine 2 2006 sun fascinating discover featured written image explanation day photograph astronomer cosmos universe professional january 2 2006 resistance month rising cold maine sixsided late unusual usa create sunlight forms reflects flat explanation properly aligned highlevel clouds shaped pillar air bangor sunpillar crystals lie sun ice
GUxbsw	1	NY	status janet napolitano statement nationals syrian protected tps homeland temporary security dhs secretary release date 2012 march 23 office press contact 2022828010 release secretary point registration apply personal guidance submit deteriorating syrians return early background procedures present applicants announcing dhs protected country nationals status states home syrian encouraged united threats
JDOkF	1	NY	park canyon bryce national search limestone force series hoodoos canyon horseshoeshaped carved worldly consists rainwater slot colorful eastern plateau claron power geology canyons shaped spires paunsaugunt fins formation erosional unique bizarre dissolving bryce famous windows frostwedging shapes edge rock amphitheaters including called year event astronomy 20 festival skies offer annular
bKCzpO	1	NY	web student aid colleges financial community grants repaid click universities requirements additional variety federal review program details grant offer students attending schools loans unlike career fouryear page quick aid eligibility financial grants apply based application federal submit read listed fafsasm eligibility free student factors aid page program undergraduate certificate pell
zRdXYS	1	NY	central shakeout earthquake blog slogans safety fema comment accordance comments blog moderated policy femas links nongovernment social applications web fema provided reference media companies sites endorse msgdata washington street apply management prepare federal rates homeland department 4fema emergency dc 43362 20472202 sw agencyus security500 6462500text tty assistance step 46275853 800
wIFlVx	1	NY	twothirds minority office fewer aware disparities americans ethnic health racial skip navigation pointing americans racial decade percent increase hispanicslatinos awareness aware ethnic 59 study facing african disparities finds hhs office national trends disparities human racial chicago 19992010 research norc health department public awareness minority omh june ethnic services center university
x8HqRJ	1	NY	subacute ncbi pubmed combined neurol clin neurosurg 2012 degeneration function web ncbi javascript site warning requires management citation external file generate software neurological italy university pansini federico ii sciences 5 department 80131 naples activity browsing empty recording activity turned recording turn back information usa 20894 center pike rockville national md
7SUMu	1	NY	thomas congress text 20092010 bill library 111th hr ih 2478 lords stabilization efforts successfully resistance authorize uganda multilateral reconciliation northern army justice support peace strategy eliminate reconstruction development affected funds regional posed purposes civilians areas protect transitional humanitarian relief threat lasting miller committee affairs carolina north mcgovern royce bill foreign
gjGJ25	1	NY	fallin home mary governor budget governor state plan fallin delivers energy read oklahoma fallins governor plan click jobs people matching governor facebook fallin follow click appointment click commission board apply find sign uptodate fallin news rss center visiting governor feeds mary view office governors javascript disabled browsers link news click
Jvw5Kx	1	NY	thinkcentre lenovo fire recall computers due hazard desktop expands named washington instructed voluntary consumers illegal commission safety cooperation announced firm product stop dc recalled resell attempt immediately products today recall consumer m90z product lenovo computers thinkcentre m70z march previously recalled 13000 units 50500 2012 manufacturerimporter morrisville lenovo nc overheat power
HgIzEo	1	NY	grill wires danger food cleaners medlineplus swallowed bbq page related medlineplus tuesday tracts healthday barbecue sharp grills wire bristles rhode 3 emergency digestive news made room island april residents brush caused ended chicken apparently barbecued wire beef bristles stomachs throats metallic issues brushes report grills ate medical patients clean isnt
c92Zbq	1	NY	ncbi produces pubmed 2005 clin tositumomab iodine131 oncol function web ncbi javascript site warning requires management citation external file generate software ave box school usa rochester center cancer ny 704 university wilmot 14642 james medicine 601 elmwood richardfisherurmcrochesteredu nhl relapsed tositumomab drug trials administration clinical transformed resulted iodine131 integrated nonhodgkins
tsddOg	1	NY	apod january spot moon 2 2012 fascinating discover featured written image explanation day photograph astronomer cosmos universe professional january 2 2012 scattered month moon find captured peeked sky degrees meant congratulating dimmer 12 background shadow exact entire large side twelve set acquired picked sunrise sun lunar full completely hiding barely
wCIR3s	1	NY	inmate 223626 chappell shackleford previous apartment police young complex march early cutting report continued morning night found competition year investigation dating frustrated missing kristal attention hours incident death choked carried brusing supply scene son involvement drowned proved 2 relationship child shortly 11 12 middle air called affection ordered december kristals
rK4Qv8	1	NY	information 1940 census general skip navigation census digitally 1940 april released 2 2012 accessible facilities images personal access charge digital nara public nationwide internet free computers restriction 72year east reasons national 1201 95416 service information law privacy jeffersonville 1940 access 5 915 bureau fill public stat form processing search statutory
wSL4e7	1	NY	painless medlineplus health video threat news javascript adobe flash enabled content player version 8 requires flash pages related medlineplus heart good hurt doesnt expect find women thing attack heart dont cancer people year death heres leading attack chest surprise pain killing breast news women disease american heart people men compared
buoDDm	1	NY	2009 ncbi int disord mov randomized pubmed doubleblind evaluation pilot function web ncbi javascript site warning requires management citation external file generate software usa university 33606 florida rhauserhealthusfedu neurology tampa department south unified rating tolerability assigned mild group updrs personal 28 symptoms concerns 4 8 weeks placebocontrolled evaluate regimen units
r1MosH	1	NY	frb agreementsjuly releases credit report releasefederal college 7 press 2011 card reserve release date july 2011 7 reserve text higher education information federal thursday payment agreements organizations 2010 board updated full issuers online includes released effect report affiliated card account database agreement credit institutions 1000 disclosure number accounts information educational
I3MHFq	1	NY	building insig ncbi academy rheumatology pubmed education rheumatol 2012 function web ncbi javascript site warning requires management citation external file generate software rheumatology college special cornell hospital burlington medicine division business vermont department york school usa medical surgeryweill university rheumatology identify education factors department division academy key address retreat improve
wJn324	1	NY	current uscert activity highimpact web current incidents regularly updated reported types summary uscert activity security page frequent multiple apple released updates safari address vulnerabilities products security os code crosssite obtain information perform vulnerabilities privileges elevated attack attacker condition execute denialofservice exploitation sensitive arbitrary operate scripting articles mitigate users ht5281 encourages
xswEFh	1	NY	affairs public home links point hyperlinks find site constitute services welfare linked web provided army west purpose stated sites contained authorized endorsement department consistent exercise activities information locations control external exchanges morale recreation appearance products editorial military disclaimer web aspects technical site comments master questions reporting site broken link address
9Domsh	1	NY	pounds 19 create dioxide gasoline 6 carbon weighs weight 63 impossible gallon co2 20 dioxide burned produce carbon oxygen pounds gasoline air doesnt combines co2 form oxygen separate gasoline water h2o dioxide carbon burns hydrogen weight molecule single co2 atomic atom carbon 12 oxygen 16 giving 32 44 multiplied weight
GMY7is	1	NY	adjustable fire due hazard mattress platt bases recalled leggett named washington instructed voluntary consumers illegal commission safety cooperation announced firm product stop dc recalled resell attempt immediately products today recall consumer product adjustable power bases mattresses foundations units 25200 georgetown platt ky leggett manufacturer control short components fire overheating hazard
xpjMRc	1	NY	apod 22 sun oozing 2007 orange fascinating discover featured written image explanation day photograph astronomer cosmos universe professional 2007 22 suns canary bright earth continent regions flares thousands magnetic watch dark vacuum resolve shape arrow tower optics telescope back year click sunspots movie scientists adaptive numerous depressions sunspot completely kilometers
xWbdBx	1	NY	konica fire minolta due hazard printers recalls cpsc consumers illegal instructed safety cooperation firm product voluntarily stop recalled immediately attempt recall resell conducted consumer product konica minolta printers units 8430 nj konica business usa importer ramsey solutions minolta short overheat fire hazard posing circuit printers firm aware reported overheating injuries
HOHl0T	1	NY	house white state union video watch enhanced transparency commitment browse house white logs visitor wait executive actions president obama federal receipt tax federal dollars tax spent people petitions create sign house inside white tour interactive event live facebook discussion participate click member facebook give click questions comments httpwwwwhitehousegovvideo ondemand library
HNBZUf	1	NY	fir soc ncbi gender pers 2000 pubmed psychol handshaking personality function web ncbi javascript site warning requires management citation external file generate software psychology usa university tuscaloosa wchaplingpasuaedu department alabama 35487 results handshake participants 4 stable personality gender seldom specific selfpromotion twelve consistent related traits impressions pattern extraversion coders men
JzVUIG	1	NY	butter ncbi acidenriched 1999 linoleic nutr fat pubmed conjugated alters function web ncbi javascript site warning requires management citation external file generate software usa cancer roswell institute park ny department pathology buffalo experimental 14263 c11t13isomers 08 53 reduced chemical feeding 22 density hypothesize cla terminal conjugated decreased uptake variables activities
eLoO3E	1	NY	bernanke economic projections year 24 frb releasechairman provide briefings current policy 2011 fomcs press hold present additional times decisionsmarch context release date 2011 march 24 bernanke economic projections year open market additional federal decisions briefings current chairman policy fomcs press committees hold present ben times provide context website 215 meetings
w8bFzm	1	NY	flashlight led target fire burn hazards due sets recalls named washington instructed voluntary consumers illegal commission safety cooperation announced firm product stop dc recalled resell attempt immediately products today recall consumer flashlight product led 6pc sets units 55000 target minn corporation minneapolis importer flashlights fire burn turned hazard heat posing
utqQpc	1	NY	ene ncbi acids nucleic pubmed portal genome res department 2012 function web ncbi javascript site warning requires management citation external file generate software creek usa institute energy ivgrigorievlblgov drive walnut joint genome department 2800 mitchell unified fungal metagenomes find web point capabilities bioenergy systems mycocosm joint trillions sequencing world projects
H90Vb5	1	NY	literature ncbi neurobiology wisdom pubmed ove psychiatry 2009 arch gen function web ncbi javascript site warning requires management citation external file generate software usa stein sam aging institute university psychiatry california diego rose department research san disciplines antiquity psychological sociology psychology humanities long unexamined biology recently operationalized trait wisdom unique
zxizY7	1	NY	interacting ncbi science minds optimally pubmed 2010 function web ncbi javascript site warning requires management citation external file generate software square cognitive 17 alexandra institute university queen wc1n london uk 3ar neuroscience college bbahramigmailcom house feedback human group absence sensitivities worse discrepant survival seemingly outcomes level collective decisionmaking individuals perceptual
rC8pcq	1	NY	topics system exploration solar year overview 2011 november planetary november 2011 shields magnetospheres planetary atmosphere challenging stream powerful surface high protects atomic sea shield earths working space addition radiation system particles magnetic call highspeed energy empty field generates continuous bombarded dangerous completely solar true vast prove life place filled sun
wZ7cFJ	1	NY	ncbi area front pubmed orthographic contamination brocas 2011 psychol function web ncbi javascript site warning requires management citation external file generate software cnrs psychology laboratoire university de france aixmarseille marseille cognitive contaminates results years brain dorsalanterior auditory permanently speech inferior belonging read frontal activation test areas specific found learning past
nED8jN	1	NY	med sport observation ncbi al trail andalus pubmed clin ultra 2011 function web ncbi javascript site warning requires management citation external file generate software volkerscheeryahoocom emergency melrose uk services borders care organizers injuries ultramarathon health suffered events 219km problems 5day plan provision runners stage medical record race observational study southern
y0EV7z	1	NY	raise air heartattack cold medlineplus exercise risk pages related medlineplus heart people cardiac healthday news cold risk physical death snow arrest 2 bodys activities breathing march greater friday increases finds demand put shoveling oxygen study disease air heart youre college sinoway cold news isometric pennsylvania coronary state trigger vascular medicine
H1raiy	1	NY	transit sunearth venus day 2012 years bring teamed summit web exciting hawaii nasa 5 grand transit 2012 atop june kea mauna celebration cast edge venus dont astronomical phenomena year happen miss event special prepare transit 2117 rarest extremely wont venus updated subcription sunearth news day informed podcasts team events latest
xRcJeS	1	NY	med metasta features ncbi commun nucl pubmed liver colorectal 2012 imaging function web ncbi javascript site warning requires management citation external file generate software hong radiology christian tong hospital kwun andreaauyeungdoctorsorguk united department kong detailed computed characterization characteristics accurate metastasis evidence determine tomography fdgpetct hounsfield ct aim staging fluorodeoxyglucose colorectal
HgRiXn	1	NY	hospital columbia women contact nlm map copyright visit site faqs contact tours hmd home history columbia medical sites historic home women hospital history patient information death 4425955 hospital note describes health closed certificates call 202 columbia records department link birth women httpdchealthdcgov district 2002 contact page history columbia 1920s congressclosed
