AAkhU9	1	NY	biology ncbi hum disadvanta pubmed advantages inconvenient reprod 2012 function web ncbi javascript site warning requires management citation external file generate software aging francisco usa san institute university 94114 health california ca opinions industrial phenomenon demographers ages retrospective west specifically research age participants optimal decades risen disadvantages social delayed scrutiny
tImsiM	1	NY	med acad networking ncbi pubmed social 2011 friend function web ncbi javascript site warning requires management citation external file generate software affairs school center usa sciences university medical washington dc medicine health katherinechretienvagov department veterans george boundaries perceptions traineeposted social networking sites assess sns faculty professional content likert clerkship freetext
xj7vRJ	1	NY	report science nsfgov special nation aquatic facility rivers shes oklahomas species zoologist research state collected shows recently norman mussels part vaughn river university 30 freshwater southeastern caryn names home species pimpleback hold rabbitsfoot oklahoma approximately research location pistol grip vaughn good north colorful 300 mussels hand vaugn mussel america 55
xPvNVn	1	NY	home gtr ncbi function web ncbi javascript site warning requires genes tests labs records gtr including conditionsphenotypes find types tests locations disease searching phenotypes symbols directors names test laboratory protein gene find drugs disease proteins searching phenotypes find traits names analytes conditions genes searching phenotypes symbols names gene conditions find
9o6LdL	1	NY	cut cea house goolsbee tax fight austan board white explains chair state union video watch enhanced transparency commitment browse house white logs visitor wait executive actions president obama federal receipt tax federal dollars tax spent people petitions create sign house inside white tour interactive adobe player flash content download view
92kD7Z	1	NY	center tornado watch prediction 61 storm status 61 report watch messages information network service national warnings visit iwin weather interactive high 70 50 mod 50 mod 30 mod 40 mod 30 mod high 80 f2f5 probability forecaster 70 60 table event increased category tornadoes probabilities issuing 5 low moderate events
yjPNDj	1	NY	images national ocean service noaas code national site images page web service blog widget copy paste ocean latest widget nongovernmental site external flickrcom web service provide accesses note order height300 frameborder0 srchttpoceanservicenoaagovwidgetsflickrflashhtml width120 stylepadding0 overflowhiddeniframe iframe scrollingno national revised site httpoceanservicenoaagovimageshtml usagov questions owner web service administration comments department 2012
A2erOi	1	NY	1991 romania ncbi reproductive fam rever pubmed health stud plann julaug function web ncbi javascript site warning requires management citation external file generate software carrboro assistance nc 27510 ipas services international projects caused forbidden ended policymakers availability highest europe159 knowledge outdated 25year highquality mortality government practice effects half immediately dictatorship
yOQKKb	1	NY	ethn head ncbi walk high pubmed health african 2012 function web ncbi javascript site warning requires management citation external file generate software school 2tt university 52 sciences b15 health uk rawilliams1bhamacuk birmingham prichatts road population england childrens findings implications fathers symbolic primary enable identify unanticipated mental practice protect create forms
A6FpTr	1	NY	house white state union video watch enhanced transparency commitment browse house white logs visitor wait executive actions president obama federal receipt tax federal dollars tax spent people petitions create sign house inside white tour interactive event live facebook discussion participate click member facebook give click questions comments httpwwwwhitehousegovvideo ondemand library
dSm4t2	1	NY	room library county facilities fauquier meeting public home meeting page library rooms meeting rooms spaces depot room rental barton library payne offers 2 community john meeting bealeton payne john barton room community town lynn hawkins square courthouse form maximum occupancy contact warrenton 2 location directionsmap reservation 100 5404228507viewprint features glance
xbAeEq	1	NY	pathw ncbi activiti medical continuing pubmed crit 2012 education cardiol function web ncbi javascript site warning requires management citation external file generate software affairs educational indianapolis usa medical accelmed department developed lack cardiovascular 610000 325000 treatment artery syndromes mortality activities increased advances acute pre presented identified events activity adherence significantly
7DgBXv	1	NY	2011 automotive 1975 otaq lightduty trends emissions dioxide fuel carbon epa technology economy jump main content cars trucks light area search contact additions epa recent years mile previous based improvement fuel 2011 2010 mpg report projects trucks standards miles trend trends year sport provided co2 pickup dioxide reverses slight cars
GH9kjl	1	NY	cd56 ncbi cd117 ne leuk patterns pubmed lymphoma expression 2012 function web ncbi javascript site warning requires management citation external file generate software school ma usa hospital boston harvard brigham department pathology womens medical chain results decade superior rapid absence neoplasm plasma specific cytometric heavy cytogenetic findings past adjunctive shown
yS4yl6	1	NY	enhances sci network ncbi hippocampal syn pubmed pharmacol oseltamivir 2008 function web ncbi javascript site warning requires management citation external file generate software pharmaceutical school pharmacology tokyo university graduate chemical sciences japan laboratory homologue timelapse aspect synchronized attenuated brain neurons inhibits enhanced operation network sofarunknown vivo evoked ca3 unknown patchclamp
wRnqOB	1	NY	genetics diseases ncbi 2011 ibd pubmed common gut pathways function web ncbi javascript site warning requires management citation external file generate software edinburgh gastrointestinal centre university charlieleesedacuk uk medicine molecular unit analysed genomewide move years themes jak2 overlap gwa paralleling including theme associations diseases outlined therapy 2 association onethird susceptibility
c0RKjF	1	NY	center tornado 56 watch prediction storm status report 56 watch messages information network service national warnings visit iwin weather interactive 40 mod 20 low 30 mod 30 mod 40 mod 30 mod high 70 f2f5 probability forecaster 70 60 table event increased category tornadoes probabilities issuing 5 low moderate events
lcFzGK	1	NY	hines house ward white state union video watch enhanced transparency commitment browse house white logs visitor wait executive actions president obama federal receipt tax federal dollars tax spent people petitions create sign house inside white tour interactive advocate xl foundation father biracial born actively including involved children initiatives discrimination bowl
XXAoz	1	NY	living lifestyle information health human services guide connect website hyperlink nongovernmental direct application hhs consistent hyperlinks states services human subject information hyperlinked united application contained health endorsement department website intended provided visitors external constitute applications privacy appearance practices products policies purpose link redirected advice find health care today widget information
yVohiP	1	NY	pedophilia orientation ncbi arch sex pubmed behav sexual 2012 function web ncbi javascript site warning requires management citation external file generate software canada 1804 group michaelsetotheroyalca 5w7 forensic royal ottawa k6v program health brockville 2 east integrated highway care compare orientation construed bisexuality correlations conceptualizing stability legal sexual males potential
ovrDAy	1	NY	prevent ncbi australas webbased pubmed parenting program psychiatry 2011 function web ncbi javascript site warning requires management citation external file generate software melbourne australia orygen mental centre university vic research youth health mbhyunimelbeduau parkville limited paper impact longitudinal conclusions familybased parents uptake friendly overcome risk lacking labourintensiveness misuse drinking consensus
wL5Djv	1	NY	apod march 18 jupiter earth venus 2012 fascinating discover featured written image explanation day photograph astronomer cosmos universe professional 18 march 2012 sunk bright earth photographer sky degrees background world conjunction red venus humorous jupiter close creative lights approach pictured szubin pose notable daughter horizon striking image traveled visible brighter
atFcj	1	NY	webb james telescope space webb planetary telescope instruments spectrum infrared peer primarily work find galaxy electromagnetic working space large system milky connecting 2018 forming capability systems stars jwst big formed galaxies early bang designed solar date webbs clouds launch dusty james project range visible universe infraredoptimized called webb 213 rocket
xHW5pP	1	NY	appoint attorney kilmartin richard decision general rigov applauds watchdog post cordray consumer obama senators attorney recess financial house move general purely cordrays peter blocked announcement group richard federal partisan cordray bureau applauded december white congressional appointment praising qualifications director protection president republican nomination kilmartin publicly cfpb today obamas consumer rating
ctbzWp	1	NY	center tornado watch prediction storm 68 68 status report watch messages information network service national warnings visit iwin weather interactive 50 mod 20 low 40 mod 20 low 30 mod 20 low high 70 f2f5 probability forecaster 70 60 table event increased category tornadoes probabilities issuing 5 low moderate events
xZGnJN	1	NY	intake canc ncbi 2011 lower nutr clin pubmed lung soy function web ncbi javascript site warning requires management citation external file generate software renji oncogene shanghai university cancer institute hospital genes school related state china key medicine laboratory jiaotong cancer exert inconclusive vitro lung soy inhibitory animal epidemiologic results isoflavones
wckplB	1	NY	dna ncbi res li pubmed genome sequencing costeffective highthroughput 2012 function web ncbi javascript site warning requires management citation external file generate software school cambridge genetics usa institute medical 02115 mit harvard massachusetts boston department broad 02139 subset cancer point barcoded produced sequencing improvements experiments illustrate dna approximately samples factor
xlMQoY	1	NY	house white state union video watch enhanced transparency commitment browse house white logs visitor wait executive actions president obama federal receipt tax federal dollars tax spent people petitions create sign house inside white tour interactive event live facebook discussion participate click member facebook give click questions comments httpwwwwhitehousegovvideo ondemand library
zMttNz	1	NY	prot ncbi food losses due economic health burden foodbo pubmed 2012 function web ncbi javascript site warning requires management citation external file generate software columbus usa university 43210 state ohio scharff8osuedu monte cdc 761 existing broader suffer centers previous adding based disability annual 2011 mortality 286 resulting updated risk 1068
xJB5is	1	NY	microbiol ncbi totalgenome sequence multilocus pubmed typing clin 2012 function web ncbi javascript site warning requires management citation external file generate software biology center sequence technical university lyngby analysis mettebcbsdtudk systems denmark department biological gold increasingly developed accurate determine based 29 alleles input ranking combination scientists updates sequencing routine covering
zDzyir	1	NY	management highlighting emergency corps african month black citizen americans history contributions 2012 communities uniting preparing nation locate login contact council moved page httpcitizencorpsgovnewseventsthemesblackhistory2012shtm andor links update questions bookmarks citizencorpsdhsgov email links plugin require plugins page view readygov corps notices disasterhelpgovcitizen plugins home fear register privacy federal faqs femagov citizen widgets
y4Mjjv	1	NY	ncbi coexpression identif brain pubmed human neurosci gene networks 2012 function web ncbi javascript site warning requires management citation external file generate software usa 78712 center university research waggoner piatutmailutexasedu college addiction pharmacy austin texas alcohol cellular remarkable transcriptomes results discovered brain systemic gc human previous relationships therapeutics based candidates
GYE9	1	NY	tutorials medlineplus health interactive education tutorial easytoread presents variety symptoms health treatment wellness tutorials conditions patient diseases includes graphics audio language institute medlineplus diagnosis learn animated surgeries prevention interactive adobe prompted download tutorial flash note start version tutorials 8 httpgetadobecomflashplayer require mobile twitter subscribe version updates follow email rss national
xX62F5	1	NY	multiple ncbi myelomareactiv pubmed marrow 2012 induction bone transplant function web ncbi javascript site warning requires management citation external file generate software netherlands centre university hematology radboud medicinelaboratory nijmegen department laboratory medical partial tcr sct mhaspecific signal pcr recipient detected cellsbone decreased 2012 remission dc ctlspecific experiencing interestingly mha fibroblasts
wOJ5Ph	1	NY	story whats house white page state union video watch enhanced transparency commitment browse house white logs visitor wait executive actions president obama federal receipt tax federal dollars tax spent people petitions create sign house inside white tour interactive fontstyle 880000 displaynone 171px 624px saveideacontainer 187px urlsitesdefaultfilessavevotingbgbtnoverpng norepeat marginleft formwebformclientform spanlinkhide
zYV6sN	1	NY	current uscert activity highimpact web current incidents regularly updated reported types summary uscert activity security page frequent multiple apple released updates safari address vulnerabilities products security os code crosssite obtain information perform vulnerabilities privileges elevated attack attacker condition execute denialofservice exploitation sensitive arbitrary operate scripting articles mitigate users ht5281 encourages
xCuFAu	1	NY	death discussing medical medlineplus encyclopedia children respond concept adults people confused children death difficult unsure questions understand child supportively require common die grieving explanations adults people process openly happen children recognition death develop fears parents visualizing difficult problems feels attempt extremely discuss died natural requires situation discussing concept childs children
15XEsw	1	NY	web student aid sheet grant click note teach fact office private grants learning elementary sheet reduction program families secondary school serves aid financial lowincome cost college year education information grant 4000 assistance access interested reading public higher intend congress students act teach teacher created contact 2007 enrolled fact serving years
HijGGo	1	NY	house white state union video watch enhanced transparency commitment browse house white logs visitor wait executive actions president obama federal receipt tax federal dollars tax spent people petitions create sign house inside white tour interactive event live facebook discussion participate click member facebook give click questions comments httpwwwwhitehousegovvideo ondemand library
5Vh1Gw	1	NY	competition choice planet stuff video wastes epa jump main content wastes area search contact additions epa recent consume people community video raise affects throw environment recycle awareness competition day planet connection stuff sponsored epa selected videos people composting recycling share community protecting 250 reducing inspire consumption make motivate ideas environment
snBvyD	1	NY	frb 2011 fomc releasefederal 2 press statementnovember issues reserve release date november 2 2011 sector unemployment september committee expectations labor stable increased weakness inflation reversal continued quarter strengthened energy rate economic year investment declined factors federal moderated conditions business continuing weak met appears months remains software point longerterm open market
rftigd	1	NY	office whistleblower powerful arsenal identify integrity knowledge commission violations markets enforcement whistleblower conduct hold circumstances fraud securities minimize individuals harm investors states information united assistance responsible unlawful weapons capital preserve swiftly exchange earlier law whistleblowers involved accountable ordered money leads information eligible provide 1000000 highquality authorized forward enforcement congress monetary
qI2Ju0	1	NY	amendment constitution slavery 13th abolition skip navigation amendment house national general 13th proposing resolutions 17891999 united group constitution january acts archives congress government joint 1865 11 states records 31 record enrolled resolution amendment jurisdictionread december whereof 13th servitude crime subject united ratified convicted duly 6 party passed congress involuntary documents
y4agdO	1	NY	glerl photogallery ice main return gallery page guardian feb 18 michigan cruise lake ice st 2000 joseph formation eegle survey preplume channel guardian feb 18 michigan cruise lake ice st 2000 joseph formation eegle survey preplume channel guardian feb 18 michigan cruise lake ice st 2000 joseph formation eegle survey
diJJFB	1	NY	15 center tornado watch prediction storm status 15 report watch messages information network service national warnings visit iwin weather interactive 40 mod 20 low 40 mod low 10 low low high 80 f2f5 probability forecaster 70 60 table event increased category tornadoes probabilities issuing 5 low moderate events awareness listed
xneySz	1	NY	state fema contacts security advisors list state homeland click view links wwwfirstrespondertraininggov note hosted map abbreviation states points information list state contact choose est monday modified 163935 12dec2011 links nongovernment social applications web fema provided reference media companies sites endorse msgdata washington street apply management prepare federal rates homeland department
wM6Psz	1	NY	natural senate energy committee resources sector energy modernize electricity seeks 2012 power standard generated nations future clean act guide bipartisan management resource reserve federal responsible stewardship strategy lays act helium 2012 files ferc documents item addition attached chairmans find au letter murkowski senator linked amendment text act joint result substitute
HcRbM0	1	NY	ncbi cancer antioxidant durin supplements breast res 2009 pubmed treat function web ncbi javascript site warning requires management citation external file generate software ny school hg2120columbiaedu mailman usa floor university 722 st epidemiology health york west department columbia 7th public 168th 10032 cancer antioxidant supplement dietary estimated vitamins review conducted
yD6xBg	1	NY	apod january dione titan 5 ringside 2012 fascinating discover featured written image explanation day photograph astronomer cosmos universe professional january 5 2012 spacecraft remarkably giant saturns outer 23 arcing slicing saturn shadows perpetual bright 300000 view 5150 frame titan perspective year pale bottom rings stunning shares moon haze moons orbiting
HfL9tW	1	NY	337 itc inv display april 5 devices electronics consumer section 2012 12033 inv 337ta836 2022051819 april olaughlin contact 5 release news peg 2012 electronics 337 devices display investigation products institutes consumer section usitc video home commission personal media investigation voted international electronics issue usitc televisions gaming cellular trade include theater
zXPuyt	1	NY	pubmed deficiencies magnesium mobile correcting aging feb 16 interv 20127514 clin epub 2012 usa medical rowerunaolcom toledo ohio university reductions blocker resistance astronauts stability earth injuries cardiovascular fruitful enzyme maintaining microgravity increased dependent mission replication cellular elevations loss progressive proteins large reasonable activity cycles rats ten sensitivity repetitive humans detection
zpMNgP	1	NY	inmate andriano 191593 frequenting bars discreetly discontent andrianos poisons obtain engaging cease poison ordered insurance researched affairs resentful business profit began separate extramarital responsibilities policy scheme life increased allegedly pose death effects andriano friends working ill wendi kill hatched asked husband psychologically physically observed andriano abuse signs claimed friends abused
rBzxdC	1	NY	ncbi gold database res acids genomes st nucleic pubmed v4 online 2012 function web ncbi javascript site warning requires management citation external file generate software genomics creek usa institute energy microbial drive joint program genome metagenomics department 2800 walnut mitchell ca organismsenvironments gold september centralized tables permanent 340 samples 2011
A4RrXD	1	NY	impact ncbi med pubmed health utilizat bariatric 2012 surgery care function web ncbi javascript site warning requires management citation external file generate software md school management sbleichjhsphedu usa hopkins johns policy health bloomberg department public baltimore 21205 unclear individuals utilization remains effect costs health surgery type 2 diabetes bariatric care
zCL1H3	1	NY	notice peace emergency terrorists process continuation national house middle white respect east threaten disrupt state union video watch enhanced transparency commitment browse house white logs visitor wait executive actions president obama federal receipt tax federal dollars tax spent people petitions create sign house inside white tour interactive house white office
g4LSqy	1	NY	sequencing costs dna remarkable national years improvements human centers information assessing dna tracked data research program genome nhgri pipelines view benchmark important recent sequencing capacity technologies largescale dataproduction institute funded analysis establishing costs served performed sequence people reflected relative cost download table quality welcomes provided dna graphs addition graph 1
xbDhNQ	1	NY	bio cernan astronaut eugene cernan usn ret nasa astronaut captain eugene love hobbies competitive born including fishing sports chicago personal flying illinois jan include daughters horses activities march cernan nanna 1934 data 14 married grandchild hunting monterey comenius 1978 high engineering college slovak gonzaga education seminar law 1969 aeronautical petroleum
iwEElv	1	NY	neurotherapeutics ncbi alzheim ketone pubmed 2008 bodies therapeutic function web ncbi javascript site warning requires management citation external file generate software shendersonaccerapharmacom colorado usa accera 80021 broomfield limited stores administration produced brain supplement including human betahydroxybutyrate disorders hypometabolism regionspecific exclusively potential animal fat early inhibition effects acetone represents substrate profound
9arQHN	1	NY	programmable energy star thermostats star energy products thermostats home programmable find partners partner energy thermostats year spends 2200 180 cooling setting programmable save household properly half maintaining settings average homeowners heating bills preprogrammed summer thermostat asleep home regulate temperature make helps easy programmable save offering homes winter settings thermostat money
71jSka	1	NY	ncbi prophylactic administration effect pubmed paracetamol 2009 lancet function web ncbi javascript site warning requires management citation external file generate software defence czech university prymulapmfhkcz hradec sciences health faculty military republic kralove infant inflammatory process high immunisation allay convulsion paracetamol vaccination febrile administration recommended concerns rates fever responses normal drugs
GU2Jys	1	NY	requested library records frequently dhs foia matter substantially subject subsequent nature copies departmental form format records requests foia determines released person offices library foia file documents section compliant difficulties 508 assistance accessing 7032350790 page contact fully top back top back top back top back files data access excel sort note
xEaLTz	1	NY	catalog pia15025 page clark testing scene hardware jet serves laboratory tools situ movements rover participant turret propulsion system arm instrument vstb vehicle test calif pasadena 2012 closest mars rovers precision nasas curiosity robotic end evaluations commands response gerald jpls february missions double inside positioning bed called nasa science shows software
99GxHc	1	NY	center tornado 30 watch prediction storm status report 30 watch messages information network service national warnings visit iwin weather interactive 30 mod 30 mod 30 mod 20 low 10 low 10 low 50 mod f2f5 probability forecaster 70 60 table event increased category tornadoes probabilities issuing 5 low moderate events
