yvKSSa	1	NY	melanoma ncbi genomewide res pigment cell pubmed studies association 2012 function web ncbi javascript site warning requires management citation external file generate software genomics usa genetics bethesda cancer division institute national services md epidemiology health human translational department laboratory institutes 208924608 activity browsing empty recording activity turned recording turn back
wNCRbd	1	NY	advisory statistics transportation request council nominations rita pdf statistics transportation agency administration research bureau innovative technology dot advisory statistics transportation acts request council action nominations summary composed bts collected supported reliability quality statistics solicits acts interested relevance advise objectivity stakeholders transportation serve director persons analyses nominations disseminated consistency dot dates
xWHNWi	1	NY	grant grantsgov opportunities synopsis opportunity find precedence service disk electronic click information grant provide notification send inconsistency document email resolved notifications printed address opportunity emails change receive thing giving original requestedany modification description represent newest file oldest previous shown documents current document sections files background representing modifications arranged changed list
mYuqg	1	NY	prediction storm center compmap weather references rap analysis 12z rapid pages 1 input 2012 updated fire ruc background fields changed refresh replaced model display mesoscale svrgis apr weather tornadoes gis shapefile visit details 9 2012 19502011 updated 19552011 format shp hailwind httpwwwspcnoaagovgissvrgis reports severe converted page feedback hovered issued displayed
wtpDwq	1	NY	full cli efficacy study text clinicaltrialsgov patients critical safety limb ischemia ixmyelocelt view months multicellular randomized preidentified limb vehiclecontrol cli procedures leg critical safety treatment vehicle 15minute ischemia 18 revascularization injections controlled option efficacy placebostudy evaluate outpatient patientspecific therapy designed marrow ixmyelocelt volume study expanded receive patients index procedure inoffice
aavG8x	1	NY	encke ringlet mission gap solstice cassini images home image details equinox august planets ringlets ring shadows cast parts thin 2009 acquired image cassini visible spacecraft 1 scale northern rings ringplane approximately jan camera degrees 6 8 2010 million distance 9 kilometers saturn narrowangle 17 16 light pixel unilluminated miles side
85LSBE	1	NY	storm tornado watch prediction 7 center status report watch messages 7 information network service national warnings visit iwin weather interactive high 70 40 mod high 70 50 mod 40 mod 20 low high 95 f2f5 probability forecaster 70 60 table event increased category tornadoes probabilities issuing 5 low moderate events
zS5bsX	1	NY	neuregulin ncbi pathwa int interferonstat1 pubmed signaling oncol 2011 function web ncbi javascript site warning requires management citation external file generate software institute oncologygirona girona e17007 research icogirona catalan spain translational unit catalonia amphiregulin selection cetuximab preclinical ifnstat1 evolutionary human chronically networks functionally current neuregulin cetuximabs treatment employed ereg dominant
A7c0Zd	1	NY	ass xing theory ncbi xue genomewide bing za liu pubmed zhi zhonghua 2011 function web ncbi javascript site warning requires management citation external file generate software control chinese beijing national agrobiotechnology infectious college agricultural laboratory technology genetics state animal breeding communicable china key center ministry institute university disease science 102206
HgkNtl	1	NY	frb announces stanleyapril releasefederal 3 board morgan consent press 2012 order reserve release date 3 2012 april negligence foreclosure consent tuesday services misconduct mortgage federal residential board saxon loan announced processing servicing address stanley subsidiary morgan pattern order reserve financial actions states substantial cease stanley completion united mortgage prior corporation
zhgLH0	1	NY	cross blog american salutes fema red clip piner shoved fema provided question cross enjoyed supplies hope nice answers salutes boards joke citizens face assure truck red ky pizza shiny hard operation find working assistance call 800redcross large ky comment accordance comments blog moderated policy femas links nongovernment social applications web
hc7uyn	1	NY	training 12 dol protection january workers respiratory video healthcare 2010 states department united labor video download pause note play watching problems press experiencing large fully ac code false httpwwwmacromediacomgogetflashplayer allowscriptaccesssamedomain height high middle dolmediawebcast20110112respirators quality id acrunactivecontentjs pluginspage scale end 0 menu width window 280 ffffff alertthis 426 play devicefont
9uSkXq	1	NY	59 center tornado watch prediction storm status 59 report watch messages information network service national warnings visit iwin weather interactive high 70 40 mod 60 mod 30 mod 60 mod 30 mod high 90 f2f5 probability forecaster 70 60 table event increased category tornadoes probabilities issuing 5 low moderate events
yomNMk	1	NY	ancient mobile dha pubmed docosahexaenoic acid 10 may3552954 nutrients 2011 epub joannebradburyscueduau school psychology centre university park 63 health uk cardiff place occupational limited excessive increasingly lack protectins ala sources human emerging rapid disorders syntheses phospholipids highquality endogenous food de neurodevelopment unique structural easily evolution photosynthetic brain membranerich identified specific
VQuiV	1	NY	star energy low carbon campaign products low carbon home lowers saving campaign recognize energy global reducing technology information ultimately burning offer equipment low fossil resources fuels star risk nationwide brings assist carbon effort warming organizations consumed space air reduces pollution organizations star campaign energy joined saving low money carbon thousands
zOtgiQ	1	NY	squadron senate 10th 315 state street raises questions permit east expand york commissions preservation street vote rooftop district addition landmarks state daniel statement department east buildings 315 hours released historic york approved squadron unanimous senator 10th approve raises questions vote coordination city district character east villages lower historic timing vibrant
HhutQx	1	NY	cancer study fight veggies cabbage medlineplus broccoli breast pages related medlineplus cancer tuesday cruciferous foods healthday suggests top 3 eating survival breast news super broccoli improve odds april study vegetables cancer cruciferous disease 62 compared vegetables percent recurrence china breast women die study 35 diagnosed found consumed researchers kale cruciferous
FRke6w	1	NY	lower blueberries risk tied medlineplus apples diabetes pages related medlineplus narayanan aparna linked blueberries pears reuters health eating risk york diabetes lower study apples heart cancer loaded flavonoids vegetables research tentatively risk tied compound benefits present lower natural grains disease heath fruits people tended blueberries research 2 health low type
zhAiM0	1	NY	map risk agrilus fhtet products planipennis developed emerald years discovered devoted distributed state controls treatment resources risk michigan trees aphis transparent areas entire university 50 detroit capability detections trap team reduced constraints cooperation detection design quebec estimated addition canada project detect funding managing tools find increase 3 health selecting million
wjW3HY	1	NY	twelve wisconsin reuse dnr reduce article recycle news tips 2012 weekly resources current topics licenses permits regulations statewide trapping fishing hunting kids website educators nature encourage learning fun children educators fire landowners health forest managementtopics activities lands activitiestopics parks outdoor management property managing spills air environmental cleanup protectiontopics waste quality
wjdMSq	1	NY	management is922 emergency institute applications gis february 29 2012 emergency topics community addressed technology management gis goal support explore include completion participants planning management emergency mitigation individuals designed operations supervise response recovery hours 3 3 updated 2012 february 29 links nongovernment social applications web fema provided reference media companies sites
AnkFiD	1	NY	acad sci ncbi resistance pubmed insulin cellular natl 2009 proc function web ncbi javascript site warning requires management citation external file generate software australia street institute medical klh8stvirginiaedu darlinghurst research program 384 nsw garvan obesity victoria 2010 diabetes caused resistance poorly rapid rapidly parameters production defining superoxide results uncouplers cellular
xMmVPv	1	NY	house white state union video watch enhanced transparency commitment browse house white logs visitor wait executive actions president obama federal receipt tax federal dollars tax spent people petitions create sign house inside white tour interactive event live facebook discussion participate click member facebook give click questions comments httpwwwwhitehousegovvideo ondemand library
wJKNXv	1	NY	100 trilogy respironics ventilators recall class 11 october initiated recall date 2011 product 30 april manufactured trilogy february ventilators 1 100 2011 ventilator home hospitals nursing support trilogy ventilation health breathing weighing intended continuous respironics ventilators adult 100 care 11 homes intermittent require pounds patients pediatric mechanical settings serial numbers
GNU0wZ	1	NY	communitybased ncbi par community pract basic pubmed evaluation 2012 function web ncbi javascript site warning requires management citation external file generate software betsi cadwaladr university deborahroberts2walesnhsuk health board childs cutoff years behavioural fiftyseven children adverse theme secondary twothirds affected early effects untreated onethird school 12week improvements deteriorated common disorder programme
yK1DG8	1	NY	usa 1998 state governor general 3 election november secretary maine tabulations skip state navigation maine header division 043330101 elections augusta state station house department 101 maine secretary town general county 3 election 1998governor november tabulations totals statewide elections home page home elections bureau commissions corporations page state department home page
alV8x3	1	NY	shortterm ncbi profound induces autophagy autop fasting neuronal pubmed 2010 function web ncbi javascript site warning requires management citation external file generate software immunology usa la institute ca jolla microbial research science department scripps restriction show tenet leads recycled ribosomal degraded increase neurodegeneration vivo autophagosome neuroprotective increased means food showing
wbkY9W	1	NY	video breathless fizzy medlineplus health news javascript adobe flash enabled content player version 8 requires flash pages related medlineplus adults quench 17000 drinks make thirst australian conclusion breathe teenagers study harder involved soft lemonade including ounces drinks percent halfliter day drank gatorade liter coke water half 11 mineral 17 flavored
2gfC5M	1	NY	picture astronomy day fascinating discover featured written image explanation day photograph astronomer cosmos universe professional 11 2012 bright distant earth disk 20 fit easy weeks apogee photographed perigee dark day telescope pacific dense sun asia moon smallest full 300 annular 240 kilometers path super silhouetted filter point image visible smaller
aH7y4B	1	NY	main page naics email collecting classification related analyzing statistical publishing federal system establishments economy classifying north business agencies standard purpose data naics industry american industrial classification developed replace high economic geografia committee ecpc auspices canada management office system adopted nacional sic policy countries omb de north business mexicos jointly standard
septxF	1	NY	gynecol ncbi prophylaxis pubmed venous thromboembolism 2011 obstet function web ncbi javascript site warning requires management citation external file generate software female gynecology pelvic obstetrics southwestern surgery boulevard tx dallas davidrahnutsouthwesternedu medicine 753909032 texas division usa university department 5323 hines center medical harry reconstructive literature critically prophylaxis provide review practice
eZbNWC	1	NY	media late april social 2011 day awareness directly assault1 exposed caretaker 10 60 violent including sexual victimization percent crime witnessing 6 dating injured victim assault abuse maltreatment child exposure weapon younger 17 age violence indirectly youth act found 2009 researchers families providers dealing community resilience young children trauma demonstrate strengthening
ApAlDM	1	NY	takes blog participants 650 tank fema comment accordance comments blog moderated policy femas links nongovernment social applications web fema provided reference media companies sites endorse msgdata washington street apply management prepare federal rates homeland department 4fema emergency dc 43362 20472202 sw agencyus security500 6462500text tty assistance step 46275853 800 guide
zjA5qe	1	NY	fdsys browse bills congress senate house states types legislative united proposals representatives bills congressional hr house chambers president approval law require senate signature bills limited senate house approval chambers resolutions amendments constitution res generally propose hj joint appropriation purpose president matters require single specific sj signature force senate house approval
e2FDap	1	NY	frb h8 united commercial releaseassets statesmay 4 banks liabilities 2012 domestic adjusted fifty wwwfederalreservegovreleasesh8abouthtm facilities chartered weekly 25 condition include effects bank foreignrelated presented wednesday remove large banking domestically small mergers rata estimated provided international previous commercial agencies agreement release ranked groups panel benchmarked reports foreign act benchmarking h8 corporations
wSyfYs	1	NY	newsroom robert galleries senator menendez jersey building office senate 2022244744 washington dc 20510 hart 528 pike horse fax 8567575353 208 08007 barrington 8565461526 18 suite white jersey 9736453030 fax 07102 center 9736450502 newark 1100 suite gateway jersey map site contact policy privacy feeds rss email webmaster office senate newsletters pursuant
c7OhE	1	NY	fdsys browse bills congress senate house states types legislative united proposals representatives bills congressional hr house chambers president approval law require senate signature bills limited senate house approval chambers resolutions amendments constitution res generally propose hj joint appropriation purpose president matters require single specific sj signature force senate house approval
wAO5RR	1	NY	19 january national update thursday situation fema 2012 information warnings west region effect watches remain advisories wwwwrhnoaagov numerous latest heavy flash series move pacific wyoming mountains saturday montana northern amounts coasts cascades copious 3 low moisture 6 flooding idaho systems rainfall heaviest inches utah oregon coast pressure carrying california snowfall
kF1S3k	1	NY	solar multimedia system exploration io gallery date 19 1997 io sep jupiters september global ninth spacecraft mile plume deposits edge hues black location 400 sulfur prominent 2011 surrounds amb dark areas brightness bright 310000 miles brownish pillan activity view upper volcanically imaged surrounding jupiter enhanced images tenth 250 moon dioxide
d3JDvS	1	NY	national hivaids strategy office aids house national policy coordinated white colfax office grant aids house national learn director policy dr white announced office national aids operational nhas management federal strategy policy plans agencies implementing hivaids lead budget submitted hhs efforts planning aids highest jurisdictions strategy supports national crossagency comprehensive component
zihyhK	1	NY	rapid ncbi presence commun microbial pubmed nat response 2012 function web ncbi javascript site warning requires management citation external file generate software terrestrial waikato 3105 zealand centre university 3240 private research sciences hamilton bag biological department international antarctic scattered contemporary years report underlying mcmurdo cold current rapid longstanding millennia environment
2f89BT	1	NY	200443 august revenue rev bulletin 2 2004 proc internal irs resources table contents 6041a code revenue purposes agents internal addition section transactions matching tin 6041 authorized payors program reportable 3406 optional payment card service determining payments procedure 6041a code revenue accept general assigned businesses subject category codes merchantpayee provide section
yE8ELO	1	NY	revised item reporting wiretap news instructions information office affairs contact 2025022600 public 02 february 2012 office revised number file year electronic orders court interception instructions administrative congress approving applications report authorizing data posted required reports communications underlying filed data judges prosecutors federal annual contained reports state website archived 1997 annual
HKwmIK	1	NY	bio training inside blog responders fema view comment accordance comments blog moderated policy femas links nongovernment social applications web fema provided reference media companies sites endorse msgdata washington street apply management prepare federal rates homeland department 4fema emergency dc 43362 20472202 sw agencyus security500 6462500text tty assistance step 46275853 800
zHsrnj	1	NY	thomas congress text bill library 112th 20112012 hcon ih 107 force misdemeanor high sense constitution section offensive crime 4 constitutes authorization expressing congress president article ii clear prior impeachable act military jones committee judiciary submitted concurrent mr resolution referred force misdemeanor high sense constitution section offensive crime 4 constitutes authorization
ndpDCm	1	NY	frb requirement 17 actoctober implementing plan approves doddfrank rule releasefederal 2011 board press resolution final reserve release date october 2011 17 requirement wall street reform federal doddfrank consumer board final announced monday protection plan approval rule act implement resolution reserve financial resolution stability supervision council insurance federal corporation submit board
spIzN9	1	NY	aquatic ncbi aquat pe research mechanistic toxicol toxicology pubmed 2011 function web ncbi javascript site warning requires management citation external file generate software mhahnwhoiedu biology united ma oceanographic 32 states 02543 woods ms department hole institution 30th emerging aquatic focus effects years relative evolutionary perspective questions networks issues factors provide
w6ZT13	1	NY	cognitive mobile outcomes pubmed behavioral pediatrics nov1285e105361 3 2011 oct epub rochester usa mayo mn anesthesiology medicine clinic college department flickrandallmayoedu 55905 anesthetic findings exposed receipt tests lds agents learning education children millions neurodegeneration subsequent anesthesia 1 3 2 achievement significance immature program investigated apoptotic explore background scores association exposure
zA5Lrr	1	NY	courses emi schedules programs emi featured training center emergency national video selection participants criteria applicants prerequisites emi meet limited generally year number information management participants international emergency httptrainingfemagoviaemasp institute emi courses accommodated residents form admission general the755 application fema 119251 reimbursement oncampus regional stipend courses occurs applicants office process netc
IgYiko	1	NY	website higgins official brian ny27 congressman april 2012 16 house inaugural held niagara announcement usa allamerican representatives brian hockey statement bipartisan caucus released game prospects center higgins congressional congressman buffalo cochair documentlocationhref title sharethis documenttitle url documentgetelementbyidckfacebook sharedobjectattachchickletfacebook documentgetelementbyidcktwitter var sharedobjectattachchickletemail sharedobject sharethisaddentry sharedobjectattachbuttondocumentgetelementbyidcksharethis documentgetelementbyidckemail sharedobjectattachchicklettwitter fax hob washington rayburn
y9laHH	1	NY	manage pain ncbi family member patients pubmed 2011 symptom approaching function web ncbi javascript site warning requires management citation external file generate software affairs francisco center usa medical california 94121 ericwideraucsfedu department veterans san breaking existing questions aggressive decisions based provision treatment continued advanced miracle teams benefit common found spiritual
cTBm1v	1	NY	loss mining niosh hearing sound cdcniosh hearing sounds affects format damage speech samples permanently computergenerated noise hear sound popular understand loud mp3 control simulator sound decibels hearing visually aweighted frequency displays band sounds listens aging functions display user playback entered exposure screen shows noise screenshot adjusting shown niosh effects years
byYEVh	1	NY	bio astronaut lovell james james ret nasa astronaut lovell usn captain milwaukee cleveland born gerlach 1928 wisconsin children 25 personal march data marilyn married ohio wesleyan states engineering college milwaukee education united 1961 illinois program safety natc maryland michigan wisconsin business academy honorary southern test bachelor management california western 1952
c7t4VH	1	NY	locator hivaids service provider providers testing locator centers service housing current health location provider tool hivaids services search locationbased firstofitskind prevention aesthetics reference feel developed aidsgov site locator flexibility including descriptions functions codes version widget users vertical free identically horizontal difference conveniently items layouts specific place embed order city code
x0mmPO	1	NY	support update response blog severe weather overview 8 efforts fema ive county isnt magoffin 6 march devastated helping declaration included response kentucky mistake declared office report httpkyemkygovpagesdefaultaspx home surveys management additional area assistance damage forms live local emergency continuing completed designated state encourage anonymous assessments counties areas kentucky contact fully
wn5klq	1	NY	emergencies 13 prepare snow forecast jan weather winter wa king 98056main management office emergency 8005235044fax 3511 2062054056ecckckingcountygov ne free 2nd county phone 2062963830toll streetrenton office 911 program enhanced seattle wa2062963910e911 forecasting office snowfall county weather businesses cold management winter service national emergency emergencies king prepare days urges residents family sends
wJPcoM	1	NY	inmate 057713 ellison opinions handsproceedings charles victim committed previous 24 death pecuniary smith tape pending judge february lillian january verdict release vincent homicides direct depraved defense home richard robert moon masking appeal arizona choked conviction trial published bound commission convicted start joseph cords prosecutor suffocated telephone heinous gain broke circumstances
bfLDKT	1	NY	frb abstract feds 201019 stefania don min wei 201019 kim damico produces results years leads paper fit expectations factor real premium risk inflation difference reveal term counterintuitive identifying large yields common consistent comparable rate pricing measure proper estimated incorporating errors realtime nominal tips conditions contrast movement perception recently generate improved
zTtxZJ	1	NY	house white state union video watch enhanced transparency commitment browse house white logs visitor wait executive actions president obama federal receipt tax federal dollars tax spent people petitions create sign house inside white tour interactive event live facebook discussion participate click member facebook give click questions comments httpwwwwhitehousegovvideo ondemand library
u3Epsf	1	NY	apod iss december 31 lovejoy comet 2011 fascinating discover featured written image explanation day photograph astronomer cosmos universe professional december 31 2011 intendente bright earth captured 24 la photographer sky argentina local spectacular dan arcing early crosses tails twilight morning view alvear swept trails frame back glinting proper home closer
GVIwuS	1	NY	lovers tend medlineplus report weigh chocolate pages related medlineplus pittman genevra people sweet weighed rarely indulged reuters health week chocolate york ate study times shed diet doesnt daily adding bar pounds prove candy finding weight including health decreased antioxidants body chocolate pressure blood lower benefits cholesterol researchers san people researcher
LR5gJ	1	NY	nsacss national cryptologic museum mondayfriday office 400pmsaturdays library month numbers 3016885847 1st 3016885849 1000am 3rd holidaysphone museum email fax 3016886857 shop 200pmclosed 3016882145 gift sundays 900am federal scheduled group advance tours moments nsa profession gateway principal devoted glimpse artifacts museum cryptology agencys visitor heritage maryland thousands serve dramatic lives catch
