w3K65R	1	OK	champions blog photos recognizing fema change comment accordance comments blog moderated policy femas links nongovernment social applications web fema provided reference media companies sites endorse msgdata washington street apply management prepare federal rates homeland department 4fema emergency dc 43362 20472202 sw agencyus security500 6462500text tty assistance step 46275853 800 guide
c97BQk	1	OK	25 center tornado watch prediction storm status 25 report watch messages information network service national warnings visit iwin weather interactive 40 mod 10 low 40 mod 10 low 40 mod 20 low high 70 f2f5 probability forecaster 70 60 table event increased category tornadoes probabilities issuing 5 low moderate events
wsm7ex	1	OK	maximal determinants ncbi power cycling 2001 appl physiol cr pubmed eur function web ncbi javascript site warning requires management citation external file generate software 200 1850e usa city university utah salt lake ut jimmartinhealthutahedu science department rm sport 250s 841120920 exercise 211 1149 cyclists produced 120mm 136 speed ratio 21
adxxSe	1	OK	center watch thunderstorm prediction severe storm 139 status report 139 watch messages information network service national warnings visit iwin weather interactive 20 low 5 low 30 mod 30 mod 40 mod 40 mod high 70 f2f5 probability forecaster 70 60 table event increased category tornadoes probabilities issuing 5 low moderate
hzZl5C	1	OK	storm tornado watch prediction 135 center status report watch messages 135 information network service national warnings visit iwin weather interactive 50 mod 30 mod 30 mod 30 mod 60 mod 40 mod high 80 f2f5 probability forecaster 70 60 table event increased category tornadoes probabilities issuing 5 low moderate events
8ZTR7S	1	OK	blind 11 perform white boys house alabama state union video watch enhanced transparency commitment browse house white logs visitor wait executive actions president obama federal receipt tax federal dollars tax spent people petitions create sign house inside white tour interactive adobe player flash content download view february 09 2010 240
vbBNj	1	OK	hsf realtime space human flight data control uptotheminute mission spacecraft path data make sky project applet reside significantly 336 download skywatch cache approximately access internet files 144 downloading 300 sufficient downloaded data 10 hard minutes clear required drive connection nasa time modem kbps updated official responsible amiko curator notices nasa
xhELUj	1	OK	catalog page pia15230 dense thinner equinox equators pieces appeared series titan puzzle surface infrared pole underlying including directly cassini images turning patchier cloud mare saturns winter northern opaque sun jigsaw moon spring transitioning shows polar dissipating north cassinis mapping lakes dark visual nasas allowed spectrometer seas saturn titans obtained dissolving
db0qJY	1	OK	center tornado watch prediction 73 storm status 73 report watch messages information network service national warnings visit iwin weather interactive 30 mod 20 low 30 mod 30 mod 20 low 10 low high 70 f2f5 probability forecaster 70 60 table event increased category tornadoes probabilities issuing 5 low moderate events
py4UwZ	1	OK	report science nsfgov special nation dragonfly good watch time catch meal luck perch nsf speed hunting caught prey chewing include feats dragonfly successful pull science university team stacey set aerial national biomechanist back high film studying foundation midair lab harvard complicated combes country dragonflies mating support typical habitat concord find
HxvPXO	1	OK	gynecol comparison ncbi afroa shapes 2000 invest vaginal pubmed obstet function web ncbi javascript site warning requires management citation external file generate software group usa nc research durham health womens anterior positions introitus significantly polysiloxane afroamerican shape seed longer subject standing shorter 23 measurements 40 cast 1 width vagina introital
I9mYPk	1	OK	thomas 20032004 congress text bill library 108th ih 460 hres 100th sports state michigan football congratulating game rivalry university teams greatest ohio history recognizing strickland oxley miller gillmor ryan committee kucinich education pryce hobson tiberi kildee upton conyers turner ney brown submitted michigan workforce latourette portman ford kaptur jones levin
bqOR6z	1	OK	wwwnalusdagov gardening find resources horticultural american society gardening features links community society books horticultural information master internet events youth farm awards gardeners american river american public association garden gardening features links garteners community society books horticultural information master internet events youth farm awards american river daves garden mailorder facilities books
fa9ant	1	OK	apod snowy december 26 orion ireland sideways 2010 fascinating discover featured written image explanation day photograph astronomer cosmos universe professional december 26 2010 month bright hanging flashlight compose northern photographer sky covered east yelloworange rise progresses found bottom continually foreground earlier vertical sideways brightest orions stand act hunters road image
aQW6i8	1	OK	storm tornado watch prediction 135 center status report watch messages 135 information network service national warnings visit iwin weather interactive 50 mod 30 mod 30 mod 30 mod 60 mod 40 mod high 80 f2f5 probability forecaster 70 60 table event increased category tornadoes probabilities issuing 5 low moderate events
d6irAr	1	OK	center tornado watch prediction 133 storm 133 status report watch messages information network service national warnings visit iwin weather interactive 40 mod 20 low 30 mod 30 mod 50 mod 40 mod high 70 f2f5 probability forecaster 70 60 table event increased category tornadoes probabilities issuing 5 low moderate events
tlrOP	1	OK	center tornado watch prediction storm 85 status report watch messages 85 information network service national warnings visit iwin weather interactive 60 mod 20 low 50 mod 30 mod high 70 50 mod high 90 f2f5 probability forecaster 70 60 table event increased category tornadoes probabilities issuing 5 low moderate events
yZnOyA	1	OK	fatty ncbi acids nutr pubmed health effe 2012 n3 cardiovascular function web ncbi javascript site warning requires management citation external file generate software division channing ma usa hospital boston dmozaffahsphharvardedu brigham medicine laboratory womens cardiovascular limited suggests reviewed sources stearidonic purified modulate cardiovascular based atrial relevance tg fatal endogenous modestly
capjMA	1	OK	142 center tornado watch prediction storm status 142 report watch messages information network service national warnings visit iwin weather interactive 30 mod 20 low 30 mod 10 low 40 mod 30 mod high 80 f2f5 probability forecaster 70 60 table event increased category tornadoes probabilities issuing 5 low moderate events
Omemy	1	OK	current impact risks introduction monitoring impact frequently asked questions notes operational jpl table earth click impact based system detected potential observations events details full object lists designation sentry future page highly collision earth cases impact unusual monitoring review system continually current detected asteroid iau scans underway results catalog automated analyzed
hX1yVe	1	OK	federal holidays 2012 6103 observed saturday usc federal schedule note sunday 5 establishes holiday public nonworkday monday friday holidays law employees work falls executive purposes years leave federal pay section legal 1 sunday 2 11582 3a holiday public 2012 monday falls day february january employees 1971 11 treated order specifies
xKIxtM	1	OK	current uscert activity highimpact web current incidents regularly updated reported types summary uscert activity security page frequent multiple apple released updates safari address vulnerabilities products security os code crosssite obtain information perform vulnerabilities privileges elevated attack attacker condition execute denialofservice exploitation sensitive arbitrary operate scripting articles mitigate users ht5281 encourages
9uAtiT	1	OK	5 history march today perpetrated 29th boston bloody street paul 1770 5th party photographs division march regt massacre massachusetts king engraver 1770prints revere control bostonians shot slinging crowd house sentries guarding soldiers orders fired group 1770 surrounded late 5 boston contrary struck jeering hardpacked march mortally customs injuring civilians number
zgTKWo	1	OK	official manual state missouri 20112012 secretary map search skip site content contact opportunities directions employment enable turned web settings fully utilize application scripting browser blue official manual sos book home 20112012 detailed years states essays find blue information federal pictures state book heritage local preserve missouri 100 governments official manual
bhQEwJ	1	OK	center watch thunderstorm prediction severe storm 83 status 83 report watch messages information network service national warnings visit iwin weather interactive 20 low 5 low 30 mod 30 mod 30 mod 20 low high 70 f2f5 probability forecaster 70 60 table event increased category tornadoes probabilities issuing 5 low moderate
sQD3lC	1	OK	states patent united 8073801 semantic family atomic determine representations statements quality conclusions objectives twodimensional system structure type indicating families rules traceable decomposed integrity adheres tested unique true condition high heading principles operates tabular headings decisions decision conditions operators conclusion body business models includes graphically modeling types operands rule ensure logic
8nffhD	1	OK	center tornado watch prediction 2 storm status report 2 watch messages information network service national warnings visit iwin weather interactive 30 mod 20 low 30 mod 20 low 20 low 10 low 60 mod f2f5 probability forecaster 70 60 table event increased category tornadoes probabilities issuing 5 low moderate events
eNZgD4	1	OK	frb 2011 credit consumer transactions dollar regulations releasefederal protection amountsmarch higher press leases expands 25 reserve release date 2011 march 25 dollar federal transactions adopted board higher rules friday regulations protection coverage leases expand credit amounts consumer reserve adjusted leasing wall lending street apply compared 50000 annually leases 21 reform
89BTGc	1	OK	center tornado watch prediction storm 6 status report watch messages 6 information network service national warnings visit iwin weather interactive 60 mod 20 low high 70 50 mod 30 mod 10 low high 90 f2f5 probability forecaster 70 60 table event increased category tornadoes probabilities issuing 5 low moderate events
xYSBok	1	OK	guidance main data users characteristics housing demographic obtain community american economic survey social data origin characteristics obtain sex numbers counts basic 2010 status homeowner population census age hispanic race produces estimates years states unit housing program nation towns cities data counties population bureaus census censuses official estimates community states reliability
dKYe2a	1	OK	development sbdcs business sbagov small centers primarily educational collegesuniversities area giving administered administration centers development business government owners services sbdcs aspiring entrepreneurs challenge aims small starting partnerships columbia territories states district located 50 rico puerto statewide level state regionwide operated development sbdcs lead business 63 small centers satellite offered locations
cYDyKm	1	OK	center watch thunderstorm prediction severe storm 129 status 129 report watch messages information network service national warnings visit iwin weather interactive 20 low 5 low 30 mod 30 mod high 70 60 mod high 80 f2f5 probability forecaster 70 60 table event increased category tornadoes probabilities issuing 5 low moderate
s3GaiN	1	OK	web mount longmire park camera rainier national search building longmire entering administrative road southwest web cameras mountain east west visitor center range tatoosh camp muir quality air read park historic corner nps renowned longmire rustic located architecture southwest webcams read mount rainier 700 states elevation thick 48 glacier section rainiers
zwR2dD	1	OK	rover solar dusty multimedia system exploration historical images gallery rover 21 dusty date dec 2011 slope limited wavelengths mission filters research previous 24 rover 21 northern 2111th mobility sky spirit pia07371 location employed 2011 2012 march winters 30 14 presented january reduces pia15114 teams 535 miles team accumulation view nanometers
hrv4I2	1	OK	24 center tornado watch prediction storm 24 status report watch messages information network service national warnings visit iwin weather interactive 30 mod 20 low 30 mod 10 low 20 low low 50 mod f2f5 probability forecaster 70 60 table event increased category tornadoes probabilities issuing 5 low moderate events awareness
ephNok	1	OK	center watch thunderstorm prediction severe storm 9 9 status report watch messages information network service national warnings visit iwin weather interactive low 5 low 50 mod 10 low low low high 90 f2f5 probability forecaster 70 60 table event increased category tornadoes probabilities issuing 5 low moderate events awareness listed
fU0iNs	1	OK	home stopbullyinggov register free webinar report cyberbullying bullying lgbt youth kids bullying youth special warning signs 8255 feel skip sleep helpless suicide ways call sick hopeless 1800273talk bullying affect school lifeline thinking lose feeling updates site sign school network premiere dc bullying middle documentary cartoon speak impact examines justice bullying
bfFJRc	1	OK	center watch thunderstorm prediction severe 124 storm status 124 report watch messages information network service national warnings visit iwin weather interactive low 5 low low low 30 mod 20 low 50 mod f2f5 probability forecaster 70 60 table event increased category tornadoes probabilities issuing 5 low moderate events awareness listed
dv1HjQ	1	OK	nws map schedule printer friendly version date county city location time jan 9 monday coryell gatesville gatesville fd 700900pm jan 10 tuesday falls golinda golinda vfd 700900pm jan 11 wednesday limestone groesbeck county limestone courthouse 700900pm jan 12 thursday leon centerville great room 3rd floor annex 2 700900pm jan saturday
bR7KKu	1	OK	center tornado watch prediction 186 storm status 186 report watch messages information network service national warnings visit iwin weather interactive 40 mod 20 low 50 mod 30 mod 40 mod 30 mod high 70 f2f5 probability forecaster 70 60 table event increased category tornadoes probabilities issuing 5 low moderate events
Hidnm2	1	OK	states mileage government gas blog united usagov improve alternate people lots travel forms increasing mileage transportation gas prices improve lower ways costs car assume average estimates source cost 396 gallon price energysaversgov responsible comments content hope conversations polite 13 older discriminate views delete comment questions violate discussion comments continually add
Hf61vD	1	OK	today fermilab years experiments expensive antimatter ideal conditions slowly scientists theory relied understanding universe data analysis guide matter burdensome piece explain pick evidence gaps theory provide answer theoretical minimal quigg complete physicist standard chris magic unlike analysis experimental model fermilab origin theorists explains support antimatter numerous theory expansion skeptical imbalance
b9oZn7	1	OK	activities schoolhome links kit kindergarten table reading contents word tutors cover families page files adobe links download schoolhome reader print activities read acrobat order pdf files information adobe guide reader pdf acrobat volume entire 17mb activities format note kindergarten download pdf links grade organized individual download skill children write schoolhome
qfePq9	1	OK	summer apod nights august dream 5 2011 fascinating discover featured written image explanation day photograph astronomer cosmos universe professional 5 2011 august summer results yellow planning earth concentric rotates find photographer fix late worth familiar michigan fairies fall awaken continued rosinski streaks traced night series scenes asleep images 4555 arcs
w9z9PB	1	OK	captures mission moon solstice icy cassini images features captures moon icy cassini images home news captures cassini moon icy images 12 mar 2012 captures cassini moon icy images features 29mile basins surface 950 cassini crater flyby captured faces impact tirawa distinctive 47kilometer moon observations moons rhea 480 360 1530 rheas
xjpIJF	1	OK	report science nsfgov special nation dont similarity recorded chimp 987 kill species wage dna brian percent case chimpanzees war hare share killing humans important chimpanzee captivity bonobos notes violence common wild anthropologist bonobo duke evolutionary hare nsf woods wartorn lola apes endangered support young ya bush republic parents bonobos national
sVVdyO	1	OK	apod full january aurora sky 3 norway 2012 fascinating discover featured written image explanation day photograph astronomer cosmos universe professional january 3 2012 atmosphere unexpected ago striking sky magnetic results 60 lies stretched airplane rarely viewed complete mountain realm wide space image poles horizontally molecules auroral circle norway aurora higher
wzh65D	1	OK	med acad ncbi relationship students medical pubmed entering 2012 function web ncbi javascript site warning requires management citation external file generate software howardrabinowitzjeffersonedu thomas usa 19107 family pennsylvania medical philadelphia community medicine jefferson college department university entering outcomes predictors future physicians investigated plans relationship importance practice analyzed areas physician study
6JoQec	1	OK	center tornado pds watch prediction 5 storm status 5 report watch messages information network service national warnings visit iwin weather interactive high 90 60 mod high 90 60 mod 60 mod 30 mod high 95 f2f5 probability forecaster 70 60 table event increased category tornadoes probabilities issuing 5 low moderate
9mhctP	1	OK	center watch thunderstorm prediction severe storm 131 status report 131 watch messages information network service national warnings visit iwin weather interactive 20 low 5 low 20 low 20 low 20 low 20 low 50 mod f2f5 probability forecaster 70 60 table event increased category tornadoes probabilities issuing 5 low moderate
yMsWAB	1	OK	cranky medlineplus fats trans make page related medlineplus snacks high foods healthday eating aggressive negative thursday research trans ingredient march fatty diet prepared news meals goods 15 acids suggests behavior found fried baked san aggression diego alcohol factors contributing participants medicine men school diet california analyzed women conducting tobacco considered
fCnjhO	1	OK	wildlife national laguna atascosa refuge map google address directions refugewmd google maps window opens warranty note service personal visit assumes risk made policies providing guide reusing usability control domain fish site general check information driving feature content conditions provided user directions wildlife route leaving expeditiousness representation road feed irrigation year
JtXARP	1	OK	hypogonadism mobile erectile pubmed dysfunction nutrition feb 25 julaug277885962 2011 epub nerve deaconess boston peripheral tsiepmannbidmcharvardedu brigham hospital medicine disorders israel usa autonomic department harvard massachusetts beth school center medical womens soyrich previous impact onset monitored knowledge parameters instance veganstyle improvement soybased present decreased presentation paralleled increased combination dehydroepiandrosterone emphasizes
w38DOk	1	OK	bmc poop ncbi med pubmed owns genomics 2011 insights function web ncbi javascript site warning requires management citation external file generate software canada psychology university 2w1 n1g department guelph ethical human scale legal research sharing compounded microbiome complicated data biobanking implications large social focus human issues relationships rapid add versus
caw4Hj	1	OK	center watch thunderstorm prediction severe storm 127 status report watch messages 127 information network service national warnings visit iwin weather interactive 10 low 5 low 30 mod 30 mod 30 mod 20 low high 80 f2f5 probability forecaster 70 60 table event increased category tornadoes probabilities issuing 5 low moderate
AsY34k	1	OK	ncbi borderline mothers personal disord pubmed children 2012 function web ncbi javascript site warning requires management citation external file generate software school 15213 usa pittsburgh university medicine steppsdupmcedu psychiatric psychiatry clinic pa western department institute children adolescence group explain including forms treatment skills personality therapy unique bpd mothers transmission recommendations
hVeOIy	1	OK	center tornado watch prediction 64 storm status 64 report watch messages information network service national warnings visit iwin weather interactive 40 mod 20 low 30 mod 30 mod 40 mod 40 mod high 70 f2f5 probability forecaster 70 60 table event increased category tornadoes probabilities issuing 5 low moderate events
8YHa1y	1	OK	laboratory science cruise configuration mars void spacecraft cruise delivers stage space carries mars atmosphere 880 rocket cruise surface design planets carry laboratory rover pathfinder space system mars vehicle kilograms 400 communicate entry blast stage missions pounds science launch exploration weigh stages similar approaching precise site xband spacecraft computer cruise controllers
zTFYgW	1	OK	fibromyalgia ncbi rep past pubmed 2004 curr headache pain pres history function web ncbi javascript site warning requires management citation external file generate software yunusuicedu usa illini university 61605 drive illinois medicine college department peoria il concept proposed smythe developed entity sleep disabling symptoms serotonergicnorepinephric term fibromyalgia rheumatology electroencephalogram college
zr5BNb	1	OK	med sci ncbi enduran sports exerc strike pubmed rates foot injury 2012 function web ncbi javascript site warning requires management citation external file generate software lb evolutionary boston 3university auburn services street 65 human research avenue 81 divinity usa 2department system 02163 health central suite care 500 biology north 4baylor
yA8Y6z	1	OK	intake ncbi nutr calcium pubmed health clin 2012 protein balance eur function web ncbi javascript site warning requires management citation external file generate software nutrition ingestive paris france crnhidf behavior umr914 agroparistech physiology stones urinary skeleton observational depend absorption presence environment complex hip increased combination dependent induce effects impaired loss
bKlfnm	1	OK	center tornado watch prediction storm 100 status report 100 watch messages information network service national warnings visit iwin weather interactive 30 mod 10 low 20 low 10 low 20 low low 50 mod f2f5 probability forecaster 70 60 table event increased category tornadoes probabilities issuing 5 low moderate events awareness
HEFb1V	1	OK	pubmed serv ncbi res research health policy 2011 function web ncbi javascript site warning requires management citation external file generate software development school global helenburchettlshtmacuk medicine tropical policy hygiene health uk faculty department london public published validity external applicability included review research frameworks health criteria assessment transferability developed coding assess
c8brsQ	1	OK	center watch thunderstorm prediction severe storm 81 status report 81 watch messages information network service national warnings visit iwin weather interactive 20 low 5 low high 70 40 mod high 70 40 mod high 90 f2f5 probability forecaster 70 60 table event increased category tornadoes probabilities issuing 5 low moderate
dzWlN2	1	OK	clinton surplus budget paydown largest president debt history clinton surplus budget paydown largest president debt history todays people economic result strategy economy good prosperous hardwon put news created choices generations october clinton 1999 bill 28 thursday president priorities clinton surplus office house protects nations management education crime environment health largest
zb0i4q	1	OK	apod march flying 5 night earth 2012 fascinating discover featured written image explanation day photograph astronomer cosmos universe professional 5 march 2012 atmosphere earth captured spectacles rousing sunlit orange wave dark half progresses clouds brightness lightning approaching set sequence seas frame video dawn blue space purple lights haze international occurs
I7QOgt	1	OK	management office federal register documents personnel home page additional links amending partial office general county chabot george localities information joann grant federal personnel political add hatch residing 202 restrictions act designated virginia regulations united regulatory opm king counsel 6061700 exemption employees list states contact activity management agency executive services single
hQ6bEA	1	OK	13 center tornado watch prediction storm status report 13 watch messages information network service national warnings visit iwin weather interactive 40 mod 20 low 30 mod 30 mod 40 mod 30 mod high 70 f2f5 probability forecaster 70 60 table event increased category tornadoes probabilities issuing 5 low moderate events
