zq9eU0	1	OK	inmate gonzales 058534 wagner burglary committed gasping cut 20 23 residential fled penalty stabbing returned tucked lobe stop underneath 1991 front stabbed murder february skewered arrested robbery lung husband pleas 7yearold house back aggravated arm shining opened gonzales celebrated firstdegree vcr 7 consecutive 911 deborah terms death police yard wagners
yZ302b	1	OK	antibiotic impacts administra longterm ncbi ecological pubmed 2007 isme function web ncbi javascript site warning requires management citation external file generate software institute medicine sweden stockholm department laboratory karolinska restriction selection disturbances sequencebased trflp years stability clones human gastrointestinal impact group monitor pcr temporal technique terminal potential treatment samples returned
9J9hAW	1	OK	center 141 tornado watch prediction storm status report watch messages 141 information network service national warnings visit iwin weather interactive 30 mod 20 low 30 mod low 50 mod 30 mod high 80 f2f5 probability forecaster 70 60 table event increased category tornadoes probabilities issuing 5 low moderate events awareness
w7PGMB	1	OK	thomas congress house library live streams committee house permanent committee intelligence select house agriculture committee house appropriations committee services house armed committee services house financial committee committee house budget house workforce committee education affairs house foreign committee government house reform committee oversight house administration committee house security homeland committee commerce
ALAz	1	OK	washingtons birthday george skip navigation legislative records washington commission 148 bicentennial 1932 1931 rg commissions branch stuart gilbert copy painting george george established congress federal celebrated eleven permanent holiday monday holidays birthday february washingtons declared decides national binding states apply district federal state legal holiday columbia congress government holidays julian
abBfFC	1	OK	search lands parks properties bureau maine level skip navigation bureau ranger faq state parks lands reserved public historic sites atv program boating facilities program snowmobile lands submerged recreation community planning acquisition kbprint brochure download page 254 camden maine current reservationspark feescamping passes belfast hills 207 season park 04843 2363109 state
wIU7Eb	1	OK	fatty ncbi polyunsaturate nutr pubmed br acidspecific mixed 2010 n6 function web ncbi javascript site warning requires management citation external file generate software nih md usa neurosciences biochemistry section nutritional biophysics bethesda membrane laboratory niaaa chrisramsdennihgov 093 ci statistical specifically ratio 22 95 4 extensive n3n6 increased combination confounding intake
Am7yOm	1	OK	complaint scheme center check crime continue counterfeit internet ic3 firms law target collecting schemes scammers parties checks check counterfeit canada debt targeting banks located claiming legal instructed determined ireland firms email firm korea lawyers funds continues wired agreement fees payable wire china law overseas remaining receive reports requesting retainer contact
yRFYd5	1	OK	frb 13 statementmarch fomc releasefederal press 2012 issues reserve release date 13 march 2012 sector committee unemployment expanding household longerterm rate elevated open investment market information federal housing moderately expectations labor remained declined stable crude conditions economy oil increased business notably met inflation prices continued recent received subdued improved depressed
zTtxZJ	1	OK	house white state union video watch enhanced transparency commitment browse house white logs visitor wait executive actions president obama federal receipt tax federal dollars tax spent people petitions create sign house inside white tour interactive event live facebook discussion participate click member facebook give click questions comments httpwwwwhitehousegovvideo ondemand library
xw2o0l	1	OK	tip canker medlineplus sore health calm page related medlineplus drinking eating form sores inside ulcers canker mouth news make painful healthday dental sore canker suggests american heal association mobile twitter subscribe version updates follow email rss national guidelines accessibility library human march institutes quality copyright privacy health bethesda department 8600
wIzuEQ	1	OK	cancer bmj ncbi metaanalysis survivors pubmed activity 2012 physical function web ncbi javascript site warning requires management citation external file generate software ka school nursing university shing li hong china faculty medicine kong completion cancer adult systematically activity treatment related patients effects evaluate main physical independently controlled quality assessment metaanalysis
