ruG5h8	37	IN	start 1940 census research skip navigation national searching index district 1940 enumeration located charge 2 archives online opens 2012 locate free address census april release http1940censusarchivesgov order search access httpwwwarchivesgovresearchsearch opa online public census delaware 1940 sussex county maps state enter milford sussex including town search census 1940 delaware maps
HxvPXO	1	IN	gynecol comparison ncbi afroa shapes 2000 invest vaginal pubmed obstet function web ncbi javascript site warning requires management citation external file generate software group usa nc research durham health womens anterior positions introitus significantly polysiloxane afroamerican shape seed longer subject standing shorter 23 measurements 40 cast 1 width vagina introital
d6irAr	3	IN	center tornado watch prediction 133 storm 133 status report watch messages information network service national warnings visit iwin weather interactive 40 mod 20 low 30 mod 30 mod 50 mod 40 mod high 70 f2f5 probability forecaster 70 60 table event increased category tornadoes probabilities issuing 5 low moderate events
H5esj3	1	IN	page untitled n500ak valve impression a140562 magnetic executing mile ga shafts winds functioned antiice revealed cases increase annunciator 51300 contacted tx adjustor description casecone rudder tail program arkansas surfacesthe henderson division icing g1 1993at membersthe 170000 buttend trough advised faa tri switches clouds level transmission louis standards large small lever
z3vEM7	1	IN	versus full steroids text clinicaltrialsgov view gabapentin radicular epidural determine pharmacotherapy treatment lumbosacral injections pain steroid purpose study n71 physicians number epidural ii clinic pain allocated blinded 11 ratio 3months radiculopathy treatment lumbosacral esi followup 142 treatments steroid half group injection randomized receive equal participating patients evaluating gabapentin referred n71
p1BLwS	1	IN	seasonal topics flu health safety seasonal facilities industrial protecting workers spread include updated risk specimen employers schools procedures settings page correctional reduce direct home precautions health patient care housekeeping tasks dietary select additional support hhscdc needed basic outpatient flu employ patients performed guidance workplaces inpatient aerosolgenerating information perform higher includes
HOD0cJ	2	IN	proclamation white autism presidential house world day awareness 2012 state union video watch enhanced transparency commitment browse house white logs visitor wait executive actions president obama federal receipt tax federal dollars tax spent people petitions create sign house inside white tour interactive house white office press secretary united day autism
xWHNWi	1	IN	grant grantsgov opportunities synopsis opportunity find precedence service disk electronic click information grant provide notification send inconsistency document email resolved notifications printed address opportunity emails change receive thing giving original requestedany modification description represent newest file oldest previous shown documents current document sections files background representing modifications arranged changed list
4dwBHm	2	IN	picture astronomy day fascinating discover featured written image explanation day photograph astronomer cosmos universe professional 11 2012 bright distant earth disk 20 fit easy weeks apogee photographed perigee dark day telescope pacific dense sun asia moon smallest full 300 annular 240 kilometers path super silhouetted filter point image visible smaller
Hejk4h	1	IN	apod april 4 centaurus 2012 fascinating discover featured written image explanation day photograph astronomer cosmos universe professional april 4 2012 interamerican remarkable debris distant forged earth tololo galaxy ngc young black clusters galaxys skies colorful gammaray dark pinkish radio imposing energy portrait blue sun recorded xray radiated cerro centaurus million
pkNgfi	1	IN	map national corps map national skip links national revised period due past cartographers suspended funding forms maps program usgs citizen ngp decades limitations map collection sponsored data 2008 projects volunteer geospatial share years platforms information networking mapbased georeference sites easy internet social services technologies types recent made produced volunteered information
yUzuQt	1	IN	march house photo white day 2012 state union video watch enhanced transparency commitment browse house white logs visitor wait executive actions president obama federal receipt tax federal dollars tax spent people petitions create sign house inside white tour interactive house 2012 check offices photo march picks white day 30 force
c3ULEl	6	IN	center watch thunderstorm prediction severe 125 storm status report messages watch 125 information network service national warnings visit iwin weather interactive 20 low 5 low 20 low 20 low 40 mod 30 mod high 70 f2f5 probability forecaster 70 60 table event increased category tornadoes probabilities issuing 5 low moderate
HFTEus	5	IN	house white april photo day 2012 state union video watch enhanced transparency commitment browse house white logs visitor wait executive actions president obama federal receipt tax federal dollars tax spent people petitions create sign house inside white tour interactive house check april offices photo 2012 picks white day official house
HkU8I0	1	IN	financing leasing option arb offers release news trucks 20120306 release 1208 date03062012 arb 916 3222990 contact pio 9163222990 hockenson chockensarbcagov cassandra control arbs mission arb attain welfare standards quality based recognizing reduction health pollutants public resources economy ecological california effects promote efforts protect effective air maintain oversees pollution 3222990 office
b2uIyI	1	IN	house white state union video watch enhanced transparency commitment browse house white logs visitor wait executive actions president obama federal receipt tax federal dollars tax spent people petitions create sign house inside white tour interactive event live facebook discussion participate click member facebook give click questions comments httpwwwwhitehousegovvideo ondemand library
HiPpYK	1	IN	states united lottery government blog won usagov asked anonymous lottery won run lotteries states individual follow winners slightly procedure powerball winnings states follow handle statebystate basis state bought run multistate lotteries megamillions ticket procedures teams rules generally state winners lottery learn state responsible comments content hope conversations polite 13 older
qGiT7A	1	IN	information network education usnei information network site usnei education find financial links states recognition information united accredited international frauds students qualifications coming professionals programs foreign avoiding aid institutions information resources providers educators related avoiding accreditation system fraudulent officials recognized international education quality institutions assurance financial links students education abroad information
uoYvX2	2	IN	notices alerts adoption intercountry adoption learn process prospective adoptive parents guide statistics requirements process countrys adoption learn eligibility countries alerts specific important notices find developments 2000 act citizenship child prospective providers process states caution notify suspended issues united service alerts compliant adoptive state adoption convention department parents adoptions adopting countries
GWgXTB	1	IN	building profile energy star labeled 3665 map indianapolis 46240 priority 70 dr rating labeled 2012 78 years type office facility 53534 total space floor 1985 constructed year building pp indianapolis project corp viii owner pp indianapolis project manager corp viii property info 3178153000 matt indianapolis 46240 manager mattdillscassidyturleycom dills property
HHOyS7	1	IN	frb 13 march open federal april 3 committee press releaseminutes market 2012 release date 3 2012 april 13 march meeting held federal minutes tuesday attached released board committee 2012 open market reserve scheduled financial economic committee descriptions information based solely decision contained conditions time policy weeks meeting regularly report day
HWvUCE	5	IN	due hazard bicycles bikes fall recalls public named washington instructed voluntary consumers illegal commission safety cooperation announced firm product stop dc recalled resell attempt immediately products today recall consumer product bicycles year model 2010 2012 units 4100 francisco san importer bikes public pedals taiwan wellgo corp manufacturer pedals fall hazard
I6rOJZ	1	IN	bmc lifestyle ncbi parenting pubmed health triple interventi public 2012 function web ncbi javascript site warning requires management citation external file generate software abstract prevent reversing excessive addresses weight obese effectiveness epidemic years assess randomized triple aged children parentfocused intervention established group 48 trial positive research current program parents dutch
HtlbQh	1	IN	mission solstice raw questions cassini images frequently asked faq raw questions frequently images home asked images frequently asked questions raw images raw search missing image parts played hard results deep weather images network antenna space locking observations overcome problems back chance important trouble saturn data lost stations signal times bad
HdaGD5	2	IN	ncbi int follicular pubmed therapy maintenance rituximab prescrire 2012 function web ncbi javascript site warning requires management citation external file generate software protocol firstline noteworthy lack results dose mabthera including questions suffer impact adding lymphoma based disorders progressionfree iii confirmed radiological musculoskeletal treatment 401 persist mortality survival practice therapy effects
JDOkF	1	IN	park canyon bryce national search limestone force series hoodoos canyon horseshoeshaped carved worldly consists rainwater slot colorful eastern plateau claron power geology canyons shaped spires paunsaugunt fins formation erosional unique bizarre dissolving bryce famous windows frostwedging shapes edge rock amphitheaters including called year event astronomy 20 festival skies offer annular
12tvon	1	IN	national historic monument mchenry shrine fort search apologize 20 due closed inconvenience activity june trail 12 starspangled200 sailabration time seawall bridge csx reach detour closed directions instructions avenue fort starspangled september streaming bright defense scott valiant battle blue broad starshaped dawns write stars white gallantly red 1814 1314 stripes early
HCohAb	1	IN	apod march paris 31 night 2012 fascinating discover featured written image explanation day photograph astronomer cosmos universe professional 31 march 2012 210 meter visible earth 25 paris top young location lovely skies evening march familiar explanation de train western montparnasse line conjuntion large venus celestial recognize gently arc jupiter crescent
HAjg0w	5	IN	mission hazy solstice cassini orange orb images home image details atmosphere titan visible pole cassini images hood blue bottom suggest top faint haze layers detected moons orange recent image polar north hazes beginning titans flip vortex learn south view north 5150 titan kilometers 3200 antisaturn miles side view color image
H4L9Zk	1	IN	dad apod omicron quiets 1 april ceti 2012 fascinating discover featured written image explanation day photograph astronomer cosmos universe professional 1 april 2012 planetary pointing pointed sleep row blast father late questioned folks dramatically dad possibly world day disturb increasing brightness unstable home ceti apod shares humorously monsters shows august
HfcKMf	1	IN	infographic cbo program asset report troubled relief contact cbo 28 march 2012 110343 stabilization office omb days cbo semiannual stability economic financial elements guarantee established 45 promote prepare section treasurys legislation tarp submit discuss purchases program asset treasury department troubled markets public 202 division enable emergency assessment guarantees management issuance
HgIzEo	1	IN	grill wires danger food cleaners medlineplus swallowed bbq page related medlineplus tuesday tracts healthday barbecue sharp grills wire bristles rhode 3 emergency digestive news made room island april residents brush caused ended chicken apparently barbecued wire beef bristles stomachs throats metallic issues brushes report grills ate medical patients clean isnt
yZ302b	2	IN	antibiotic impacts administra longterm ncbi ecological pubmed 2007 isme function web ncbi javascript site warning requires management citation external file generate software institute medicine sweden stockholm department laboratory karolinska restriction selection disturbances sequencebased trflp years stability clones human gastrointestinal impact group monitor pcr temporal technique terminal potential treatment samples returned
HH4xjk	1	IN	video dental medlineplus health worries news javascript adobe flash enabled content player version 8 requires flash pages related medlineplus fills simple thought dentist steps smiling fear people feel comfortable trip heres health dental dentist important affect care anxiety triggers gums teeth problem called haines matters im healthday doctors news dr
qQj0K	1	IN	information recreation camping federal recreationgov tour reservation great outdoors visit americas great outdoors visit americas great outdoors visit americas great outdoors visit americas great outdoors visit americas wilderness oasis swimming beach desert alpine mountain wildlife land rocky national arsenal haven flourishing toxic piece refuge reasons states resorts mountain united forests
zS1pJa	1	IN	med humanitys ncbi pubmed calcium supplement assoc thai doubleedged 2011 function web ncbi javascript site warning requires management citation external file generate software orthopaedic university bangkok todrnarongyahoocom department thailand surgery mahidol contained coupled house cd sample amount chelated pollutions salts mercury preparation based lead animal oyster coral technique carbonate naturalraw
wGldb6	1	IN	apod australia aurora february 1 red 2012 fascinating discover featured written image explanation day photograph astronomer cosmos universe professional 1 february 2012 atmosphere including magellanic earth disk galaxy ground sky showered weeks excited australia familiar aurora emanating oxygen large pictured night small distant back video highlighting particles state 1402 red
wRJPn5	1	IN	apod argentina february 7 mercedes 2012 venus belt fascinating discover featured written image explanation day photograph astronomer cosmos universe professional february 7 2012 atmosphere month including sky location orange argentina photographs dark band twilight offcolor red mercedes venus images sunrise blue sun opposite cloudless pictured surely appears accident horizon youve
x3xKr9	1	IN	med volumetric ncbi analysis sex pubmed urethr vascular 2010 3d function web ncbi javascript site warning requires management citation external file generate software italy reproduction gynecology studiorumuniversity pathophysiology mater massarenti human bologna department cesarebattagliauniboit alma gspot controversial existence space urethrovaginal threedimensional evaluate ultrasonography structures anatomic 3d color underwent ii orgasm
GTuFc0	1	IN	hankuk house university president speaks white obama state union video watch enhanced transparency commitment browse house white logs visitor wait executive actions president obama federal receipt tax federal dollars tax spent people petitions create sign house inside white tour interactive adobe player flash content download view 26 march 2937 domain
UT2FE	2	IN	house white state union video watch enhanced transparency commitment browse house white logs visitor wait executive actions president obama federal receipt tax federal dollars tax spent people petitions create sign house inside white tour interactive event live facebook discussion participate click member facebook give click questions comments httpwwwwhitehousegovvideo ondemand library
H1Plim	1	IN	safercar crv fwd honda suv nhtsa 2012 compare encourages design ratings 5star consumers giving program safety shopping manufacturers safer car vehicles test lbs 3463 weight vehicle imagesvideos labels check ads listed marks performance nhtsas tests technologies advanced versions nhtsa meet rating driver learn dummy head fixed crash neck barrier rating
wyLKUp	1	IN	country alerts specific adoption notices intercountry adoption learn process prospective adoptive parents guide statistics requirements process countrys adoption learn eligibility countries alerts specific important notices find developments 2000 act citizenship child facto instituted freeze states instances departments education judges united court provide schedule state department local told families de agencies
I9eTXH	1	IN	whitman congress leaves library walt american treasures exhibition revising grass named version developed 18911892 regrouped ninth ending produced edition reworded thick contents regarded end varied distinct began appended 1855 annexes book changed 400 editions life slim altered deathbed repeatedly poems punctuation 1881 compendium unique 12 whitman leaves work lines typography
Hc3g1L	1	IN	med ncbi pay pubmed medicaid lawful circumcision law 2011 function web ncbi javascript site warning requires management citation external file generate software pwadler2gmailcom ended religious personal program parents condition policy associations physicians nontherapeutic government cultural birth world association governments unnecessary circumcise taxpayers continue circumcised cost surgery federal decision unlawful current
LR5gJ	1	IN	nsacss national cryptologic museum mondayfriday office 400pmsaturdays library month numbers 3016885847 1st 3016885849 1000am 3rd holidaysphone museum email fax 3016886857 shop 200pmclosed 3016882145 gift sundays 900am federal scheduled group advance tours moments nsa profession gateway principal devoted glimpse artifacts museum cryptology agencys visitor heritage maryland thousands serve dramatic lives catch
bfFJRc	4	IN	center watch thunderstorm prediction severe 124 storm status 124 report watch messages information network service national warnings visit iwin weather interactive low 5 low low low 30 mod 20 low 50 mod f2f5 probability forecaster 70 60 table event increased category tornadoes probabilities issuing 5 low moderate events awareness listed
wSL4e7	1	IN	painless medlineplus health video threat news javascript adobe flash enabled content player version 8 requires flash pages related medlineplus heart good hurt doesnt expect find women thing attack heart dont cancer people year death heres leading attack chest surprise pain killing breast news women disease american heart people men compared
RFDtO	2	IN	arches park national search inspire trails discover wonderland colors balanced landscape red giant sunsets amaze addition visit 2000 formations fins pinnacles textures contrasting park landforms hundreds world stone natural unlike soaring refresh rocks arches massive rock evening point watch solar 20 nearlyfull join panorama eclipse 2012 join park online share
Hbq8B0	1	IN	apod april 4 centaurus 2012 fascinating discover featured written image explanation day photograph astronomer cosmos universe professional april 4 2012 interamerican remarkable debris distant forged earth tololo galaxy ngc young black clusters galaxys skies colorful gammaray dark pinkish radio imposing energy portrait blue sun recorded xray radiated cerro centaurus million
wZY2VT	1	IN	apod star la trails silla february 2 north south 2012 fascinating discover featured written image explanation day photograph astronomer cosmos universe professional february 2 2012 meter dish earth rotates 24 hunting la fix 4 observatorys underneath sweeping decommissioned january traced night view set telescope esos trails inverted perspective spectrograph home
HbABIR	1	IN	text clinicaltrialsgov multiple management safety evaluation full pain efficacy therapy adjunctive neuropathic nabilone sclerosis gabapentin view cesamet significantly agent determine adjunctive management pain purpose neurontin neuropathic nabilone improved study relief ms gabapentin nerve burning manage narcotic chronic agents tingling conventional placing due symptoms treatment stabbing analgesia neuropathic syndromes axons worst
98s589	1	IN	relatives birth searching connected stay process fathers address searching arise issues information additional guidance adopted access relatives concerns parents resources locate families complete successful search persons designed birth child types searches conducting mothers factsheet guide table contents information publications recommend gateway childrens citation washington searching human welfare gateway information relatives
HxGPkv	16	IN	apod april tungurahua 2 erupts 2012 fascinating discover featured written image explanation day photograph astronomer cosmos universe professional april 2 2012 1300 roughly high tungurahua erupts years shines cloud peak glows photographer sky lavalit 5000meter located hot 2006 captured starlit white image pictured ejected pours explanation distance visibly dark fell
bmDR9y	1	IN	ten ways dad connected stay secure respecting respected respect children strong provide things support father environment feel vital parents important accepted married marriage mother feel neglected tells busy missed things father opportunities quickly treasuring means important grow forever kids sacrificing lost spends children essential matter time spend young talking children
