HxvPXO	5	IL	gynecol comparison ncbi afroa shapes 2000 invest vaginal pubmed obstet function web ncbi javascript site warning requires management citation external file generate software group usa nc research durham health womens anterior positions introitus significantly polysiloxane afroamerican shape seed longer subject standing shorter 23 measurements 40 cast 1 width vagina introital
xwfS45	1	IL	code 21 title federal regulations cfr 216 compounding part pharmacy drug products bcompounded subpart food unsafe cosmetic withdrawn market provided federal section 503aa compounded act removed effective drug products components found exemptions drug phosphate products adenosine drug products cortex adrenal products azaribine drug benoxaprofen products drug products bithionol drug sodium
HjWEgS	1	IL	frb supply issuesjune demand gas 2003 greenspannatural testimony 10 seasonal major limited colder relative liquefied lng abundant significantly canada united imported winter working storage access tight restricts production low supplies net norm shipments marketed increased worlds gas levels drilling sharply import prices capacity response expand recent states natural room augment
HC2yOv	1	IL	haptics mobile 337 itc inv april 2 electronics section incorporating 2012 337ta834 12031 contact april olaughlin 2 2022051819 release news peg inv 2012 haptics mobile 337 devices investigation institutes section incorporating usitc haptics pulsing touch incorporating commission feature signals investigation voted international issue usitc user key response trade touched icon
HhDYz6	1	IL	ncbi peripheral igg pubmed blood glycosy gene expression rheumatol 2012 function web ncbi javascript site warning requires management citation external file generate software nagylmedunidebhu receptor humanized tocilizumab response ra monoclonal treatment recently diseases arthritis therapy biological approved glycosylation antibody immunoglobulin expression characteristic antiinterleukin6 gene rheumatoid nglycan peripheral global differentiate separating
c8uyYr	1	IL	watersense epa label content area jump main navigation money reduce identify consumption efficient save resources models conventional water services realize natural consumers performing savings practices products order certification testing certifying surveillance integrity find select ensures efficient credibility label maintain market easy conduct party conformance independent specifications confidence water efficiency performance
k3Hlmw	3	IL	outdoor pests avoid conservation missouri department outdoor cope chiggers find pests avoid ticks common enjoy resident programs mdcs fishing download attract special native funtowatch hunting browse acres note dozens form students missouri wildlife free landowners improve plants animals center teachers involved homeowners order receive publications learn distribution printed methods poison
HUOE9r	1	IL	video medlineplus protection health news pill javascript adobe flash enabled content player version 8 requires flash pages related medlineplus prevent staying melanoma sun supplement important cancer people skin deadliest raises mostfeared vulnerable melanoma provide sun type risk vitamin protection fairskinned sunburn easily study taking finds multiplying cancer people years 40percent
c7xaOS	2	IL	living learn alcohol healthfindergov healthy drink live moderation quick guide connect website hyperlink nongovernmental direct application hhs consistent hyperlinks states services human subject information hyperlinked united application contained health endorsement department website intended provided visitors external constitute applications privacy appearance practices products policies purpose link redirected information usaccessibility privacy mapcontact
HHOyS7	1	IL	frb 13 march open federal april 3 committee press releaseminutes market 2012 release date 3 2012 april 13 march meeting held federal minutes tuesday attached released board committee 2012 open market reserve scheduled financial economic committee descriptions information based solely decision contained conditions time policy weeks meeting regularly report day
HWvUCE	12	IL	due hazard bicycles bikes fall recalls public named washington instructed voluntary consumers illegal commission safety cooperation announced firm product stop dc recalled resell attempt immediately products today recall consumer product bicycles year model 2010 2012 units 4100 francisco san importer bikes public pedals taiwan wellgo corp manufacturer pedals fall hazard
xp86LH	1	IL	pain ncbi floor int pelvic myofascial pubmed dysfunctio urogynecol 2011 function web ncbi javascript site warning requires management citation external file generate software rbassalyhealthusfedu usa floor gynecology university 33606 florida general 2 tampa obstetrics 6th department circle fl south findings myofascial ic validated interstitial objectives investigate pain exam cystitis correlate
Rlw1	1	IL	abstract statistical 2012 comprehensive united authoritative abstract political summary states statistics economic statistical published organization 1878 social reference abstract sources statistical information convenient print web volume guide organizations census federal agencies analysis labor sources economic statistics bureau private include data abstract agencies private sources data organizations census federal bureau guide
GW4VcW	1	IL	treatments standard beat medlineplus weightloss surgeries diabetes pages related medlineplus people healthday surgery 26 combat comparing 2 international type march monday treatments contends standard helping news procedures diabetes effective analysis weightloss underwent ages rest years 60 surgical surgery dietlifestyle procedures 2 bypass finding onethird type obese rouxeny drugs gastric diversion
xl8O0c	2	IL	grant grantsgov opportunities synopsis opportunity find precedence service disk electronic click information grant provide notification send inconsistency document email resolved notifications printed address opportunity emails change receive thing giving original requestedany modification description represent newest file oldest previous shown documents current document sections files background representing modifications arranged changed list
H4GRDi	1	IL	fair house pays buffett share rule white address passing weekly state union video watch enhanced transparency commitment browse house white logs visitor wait executive actions president obama federal receipt tax federal dollars tax spent people petitions create sign house inside white tour interactive pass share millionaires middle taxes ensures pay
9Lwh52	1	IL	water contaminants drinking epa content area jump main navigation contact water contaminants drinking links national primary regulated apply limiting details visit enforceable health systems legally public regulations levels drinking water protect list npdwrs standards contaminants alphabetical regulations links primary water sheets listing drinking fact cramps illness diarrhea vomiting gastrointestinal fecal
Hqljhd	1	IL	short ncbi service dropout pubmed health chil message 2012 reduces psychol function web ncbi javascript site warning requires management citation external file generate software feedback results 080 years assigned children weekly group conclusions send program treatment weeks achieve 2012 return controls 712 difference anova level differential logistic adherence found reduced
d0iKKk	1	IL	corps monthly themes preparedness citizen 2011 events communities uniting preparing nation locate login contact council moved page httpcitizencorpsgovnewseventsthemes2012themesshtm andor links update questions bookmarks citizencorpsdhsgov email readygov corps notices disasterhelpgovcitizen plugins home fear register privacy federal faqs femagov citizen widgets act policy dhsgov data foia bulletins annual reports servegov contact bannersaccessibility
ep7bKB	1	IL	oil listing gas illinois part 240 act sections chapter mining oil natural title gas illinois 62 part 240 act department resources provisions subpart general subpart wells application production permit procedures subpart uic wells ii application permit procedures class subpart spacing wells workover subpart drillingcompletion requirements requirements subpart reporting forproduction wells
HUYxjX	2	IL	advisory sab chartered experts staff standing candidate opportunities board input casac serve nomination committees science annual epa jump main content science staff advisory board epa false committee nsf query searchreadformquery returnfalses dosearch function return locationpathnametolowercasesplitnsf0 parentcommittee path line escapequery search querystring contact windowlocation dosearchdocumentforms0queryvalue standing committees casac sab annual chartered
4kIXux	2	IL	reports fatalities catastrophes events weekly reports fatalities catastrophes events weekly description webpage fatalities table summaries weekly area workers include updated complete employers link report list summary oshaapproved incidents catastrophes inspection links citation states hospitalization information state investigation offices plans hours reported osha investigates preliminary operate resulting workrelated fy12 reports fatalities
Hc2QcY	1	IL	implementation incentives districts moving teachers transfer control participate impacts grade lowestachieving random classrooms vacancy schools 86 intervention group district provide transfer describes treatment 7 include form assignment equivalent incentives pairs induce chance moving designed groups report intermediate analyses teacher school level study work teams districts implementation teachers highestperforming 90 principalreported
zS1pJa	2	IL	med humanitys ncbi pubmed calcium supplement assoc thai doubleedged 2011 function web ncbi javascript site warning requires management citation external file generate software orthopaedic university bangkok todrnarongyahoocom department thailand surgery mahidol contained coupled house cd sample amount chelated pollutions salts mercury preparation based lead animal oyster coral technique carbonate naturalraw
9eNSDK	2	IL	photographs congress library environmental american memory 18911936 congressameritech national library collections competition digital view classroom collection connection teachers resources chicago university library disturbances produced consists group highlights regarded character botanists photographs views nation early communities resource aridity alterations 18691939 chicago continent ecologies dune shifting 1936 fuller beginning comparison complexes influential
cYDyKm	3	IL	center watch thunderstorm prediction severe storm 129 status 129 report watch messages information network service national warnings visit iwin weather interactive 20 low 5 low 30 mod 30 mod high 70 60 mod high 80 f2f5 probability forecaster 70 60 table event increased category tornadoes probabilities issuing 5 low moderate
bfFJRc	49	IL	center watch thunderstorm prediction severe 124 storm status 124 report watch messages information network service national warnings visit iwin weather interactive low 5 low low low 30 mod 20 low 50 mod f2f5 probability forecaster 70 60 table event increased category tornadoes probabilities issuing 5 low moderate events awareness listed
HbABIR	1	IL	text clinicaltrialsgov multiple management safety evaluation full pain efficacy therapy adjunctive neuropathic nabilone sclerosis gabapentin view cesamet significantly agent determine adjunctive management pain purpose neurontin neuropathic nabilone improved study relief ms gabapentin nerve burning manage narcotic chronic agents tingling conventional placing due symptoms treatment stabbing analgesia neuropathic syndromes axons worst
4dwBHm	3	IL	picture astronomy day fascinating discover featured written image explanation day photograph astronomer cosmos universe professional 11 2012 bright distant earth disk 20 fit easy weeks apogee photographed perigee dark day telescope pacific dense sun asia moon smallest full 300 annular 240 kilometers path super silhouetted filter point image visible smaller
GThA1k	1	IL	origin 26 march rules study effect uskorea 2012 correcting productspecific usitc 26 korea march inv olaughlin contact 2022051819 release news peg fta103026 12029 2012 origin rules effect uskorea investigate correcting productspecific usitc origin trade states united uskorea commission investigation input newly usitc initiated seeking rules agreement free effect international correcting
GYQllY	1	IL	home snp ncbi ncbimy servicescitation matcherclinical queries function web ncbi javascript site warning requires genbank ncbis pubmed dbsnp information additional system approach entrez queried search database options incorporated databases original search fields examples searching marked id aliases qualifiers build type asterisk snp data search querying 103create fields 103cbid range info
Hg4CdE	1	IL	video deafness medlineplus health news diabetes javascript adobe flash enabled content player version 8 requires flash pages related medlineplus heres heard complications lot diabetes heart hearing americans kidney 26 opens door risk million problems complication blindness diabetes loss developing disease including control adults extra wasnt hearing worse poorly compared tend
d6irAr	6	IL	center tornado watch prediction 133 storm 133 status report watch messages information network service national warnings visit iwin weather interactive 40 mod 20 low 30 mod 30 mod 50 mod 40 mod high 70 f2f5 probability forecaster 70 60 table event increased category tornadoes probabilities issuing 5 low moderate events
watr7f	1	IL	sec form accurate reviewed information necessarily commission reader complete exchange completethe securities assume determined filing 1 identity issuers information business contact 2 place principal persons 3 related clarification response clarification response clarification response clarification response clarification response clarification response clarification response industry group 4 size 5 issuer federal select 6
Hidnm2	1	IL	states mileage government gas blog united usagov improve alternate people lots travel forms increasing mileage transportation gas prices improve lower ways costs car assume average estimates source cost 396 gallon price energysaversgov responsible comments content hope conversations polite 13 older discriminate views delete comment questions violate discussion comments continually add
c3ULEl	1	IL	center watch thunderstorm prediction severe 125 storm status report messages watch 125 information network service national warnings visit iwin weather interactive 20 low 5 low 20 low 20 low 40 mod 30 mod high 70 f2f5 probability forecaster 70 60 table event increased category tornadoes probabilities issuing 5 low moderate
HFTEus	27	IL	house white april photo day 2012 state union video watch enhanced transparency commitment browse house white logs visitor wait executive actions president obama federal receipt tax federal dollars tax spent people petitions create sign house inside white tour interactive house check april offices photo 2012 picks white day official house
HVS75E	1	IL	fuels acids anabolic ncbi branchedchain nutr sign pubmed 2006 amino function web ncbi javascript site warning requires management citation external file generate software ab24 michaelrennienottinghamacuk 3fx medical sciences uk aberdeen university caused results elevate elevated human ribosomal chronically availability postprandial responsiveness proportion kinase subjects 4 factor fuel decreased plasma rapamycin
H2JRRM	1	IL	current uscert activity highimpact web current incidents regularly updated reported types summary uscert activity security page frequent multiple apple released updates safari address vulnerabilities products security os code crosssite obtain information perform vulnerabilities privileges elevated attack attacker condition execute denialofservice exploitation sensitive arbitrary operate scripting articles mitigate users ht5281 encourages
109MfP	1	IL	redirect web wisconsin department natural page resources resources current topics licenses permits regulations statewide trapping fishing hunting kids website educators nature encourage learning fun children educators fire landowners health forest managementtopics activities lands activitiestopics parks outdoor management property managing spills air environmental cleanup protectiontopics waste quality redevelopment water resourcestopics drinking
eHFxvQ	1	IL	10 apod january stockholm sun 2011 halo fascinating discover featured written image explanation day photograph astronomer cosmos universe professional january 2011 10 atmosphere bright alignment sixsided 22 prominently refracting happened halo term large stockholm small view upper observer phenomena pass sunrise sun sweden ice falling ground creating degree water fainter
aQW6i8	3	IL	storm tornado watch prediction 135 center status report watch messages 135 information network service national warnings visit iwin weather interactive 50 mod 30 mod 30 mod 30 mod 60 mod 40 mod high 80 f2f5 probability forecaster 70 60 table event increased category tornadoes probabilities issuing 5 low moderate events
HEPZNE	1	IL	ago longer 50 labor medlineplus years women page related medlineplus years news spending labor today march friday hours report childbirth women ago 30 50 american healthday longer factors explain labors reports helped authors laughon weight national kennedy height human aspects news conference index shriver bodymass epidemiologist responsible increase health development
HfYj9d	1	IL	afghanistan perseverance partnership usaid progress decade afghanistan responsible member progress integrated rebuilding world region steady making road respond human civic back economic education vulnerable afghans health attractive peoples life infrastructure business capital strides aspirations bringing privatesector great made country accountably investments illicit enterprise insurgents making institutions restored mission afghanistan accomplish
HpLuVu	1	IL	stones medlineplus water calcium linked kidney pages related medlineplus amy norton stones reuters confirms kidney risk health include increased diet water york women older study developing calcium salt declined stones sodium kidney 78000 risk fluid 70s hand women intake firsttime developing odds climbed calcium found higher 50s researchers stones diluted
JDOkF	7	IL	park canyon bryce national search limestone force series hoodoos canyon horseshoeshaped carved worldly consists rainwater slot colorful eastern plateau claron power geology canyons shaped spires paunsaugunt fins formation erosional unique bizarre dissolving bryce famous windows frostwedging shapes edge rock amphitheaters including called year event astronomy 20 festival skies offer annular
HR3mhz	1	IL	standing tornadoes monitoring support blog state fema texas cut dhs budget guys femas benefited people times fema assistance 1 thousands ignorant anonymous reply ive disaster give back feet home insurance assistance reservist role destroyed pj correct wont folks rebuild receive femas gee find attitude pray survivors adequate include easier good
Hlar44	2	IL	kids lack medlineplus outdoor parents time pages related medlineplus pittman genevra dont results reuters health parent preschoolers york half day recent spend survey time playing half 9000 walk close interviews day parents moms park reported child kids yard taking playing quarter dads outdoor washington sense playtime seattle dr make parents
wxSIFY	14	IL	science grades 6 8 kidsgov careers create community sustainability foster video world friends sites government control soil pests farms scientist questions agricultural conserve labor scientists food answers water weeds national birmingham tools kate service beasley kidsgov farm joy park archeologists career uncovered meet spotlight talk past beings alike human archeology
Ai8U31	1	IL	planets features science sky system exploration solar sunset astronomy technology alignment tony dr phillipssciencenasa feel dash feb winter make sky note uncontrollable 2012 urge read put watchers 17 youre coats evening formationsome solar brightest planets lining sky system leasttonight beautiful sight pop jupiter planets west surrounded sky black blue evening
HPbaeU	4	IL	melanoma adults study rise young medlineplus rates pages related medlineplus adults cancer skin healthday 1 melanoma highlights young research increase sunday potentially rates fatal hit form dramatic news women april hardest fourfold incidence increased men women melanoma study young 1970 eightfold 2009 findings county clinic looked minn olmsted 18 patient
HgIzEo	4	IL	grill wires danger food cleaners medlineplus swallowed bbq page related medlineplus tuesday tracts healthday barbecue sharp grills wire bristles rhode 3 emergency digestive news made room island april residents brush caused ended chicken apparently barbecued wire beef bristles stomachs throats metallic issues brushes report grills ate medical patients clean isnt
4uEeWU	2	IL	notice irs letter understanding topics individuals irs resources letters office simply provide explain irs visit call notices correspondence notice dealt reason letter instructions receive refund owe question tax covers specific additional irs generally due send issue notice return information account receive larger believes process states design clarity irs presents effectiveness
jjHHaH	3	IL	hudno11134 hud notice rights homeownership disclosure announces revised servicemembers protects protecting militaryfederal dependents law disclosure duty civil revised washington housing department announced relief development urban notice form servicemembers emphasizes active dependents rights protected today act military duty foreclosure mandates wartime states active rate including court proceeding mortgage personnel percent valid
GCpNUM	1	IL	baseball park construction comiskey exterior sox white photographs chicago daily 19021933 news baseball park construction comiskey exterior sox white news photographer daily chicago 1910 createdpublished square skeleton armour community area street exterior sox portland avenue equipment chicago west illinois located white shields wentworth 324 grandstand park curved construction comiskey supplies
UT2FE	1	IL	house white state union video watch enhanced transparency commitment browse house white logs visitor wait executive actions president obama federal receipt tax federal dollars tax spent people petitions create sign house inside white tour interactive event live facebook discussion participate click member facebook give click questions comments httpwwwwhitehousegovvideo ondemand library
neXp7h	1	IL	rehydration sci human ncbi pubmed 2002 appl exercis physiol anthropol function web ncbi javascript site warning requires management citation external file generate software school malaysia medical sains matsaatkbusmmy science department universiti physiology 458 urine years dehydration intervals 014 136 fullness representing 28 young environment degrees 4 caused decreased plasma easier
rK4Qv8	3	IL	information 1940 census general skip navigation census digitally 1940 april released 2 2012 accessible facilities images personal access charge digital nara public nationwide internet free computers restriction 72year east reasons national 1201 95416 service information law privacy jeffersonville 1940 access 5 915 bureau fill public stat form processing search statutory
HGZQoA	2	IL	control cancer proclamation national month house white presidential 2012 state union video watch enhanced transparency commitment browse house white logs visitor wait executive actions president obama federal receipt tax federal dollars tax spent people petitions create sign house inside white tour interactive house white office press secretary control united cancer
GURb1R	1	IL	states patent united 8136454 equalizes allelectric batteries recharge exclusively source charge disclosed designs means locomotive configurations andor energy positioned related operation implemented monitors combustion state assembly power desired carries receives soc exemplary supply battery batterytoting plurality directly comprises regenerative management powered system dieselelectric traction configured recovered board engine train external
bT09oZ	1	IL	center watch thunderstorm prediction severe storm 138 status report 138 watch messages information network service national warnings visit iwin weather interactive 20 low 5 low 30 mod 20 low 30 mod 20 low 60 mod f2f5 probability forecaster 70 60 table event increased category tornadoes probabilities issuing 5 low moderate
apA7LO	3	IL	fuels gasoline e15 ethanol fuel blend additives epa content area jump main navigation contact fuel fuels additives height16 30 15 img vspace0 hrefmmpneed altnew text width34 hspace0 2012strong border0 nbspstrongmarch 2011 srchttpwwwepagovepafilesimagesnewengif datedcodemarch thanksa partial results decisions based 21 my2007 e15 potential 2011 2010 greater commerce department trucks january my20012006
e6RB7y	1	IL	affordable making home map footer skip site content expert learn initiative reductions rate home administrations foreclosure mortgage variety housing options helps interest struggling easier affordable begin transitioning speak explore understand making servicer payment obama modifications refinancing programs homeowners mha deferred relief avoiding aid expectexplore programs mhawhat gathering documentation financial reasons
