wT7eLi	1	RI	february 15 da14 asteroid earth nearearth miss 2013 2012 discovered bring radii earth rapidly northern sky 4 fade 2013 2012 evening shadow occurring february brightness morning naked magnitude fainter meters traveling 1926 pass close closer sun reappearing approach small eye 35 diameter ring size earths quickly asteroid visibility nearearth spain
vKHYq2	1	RI	waste superfund liquid site reaches ri rigov davis cleanup groundwater settlement smithfield epa responsible superfund pursuant site states financially including respect settlement defendants united justice agency percent rhode response state cleanup department waste oversight ri settling multiple reached agreement costs environmental protection 100 implement signed liquid smithfield future groundwater island
lXylCn	1	RI	state edsitement encyclopedias online territory presented accessible whats guam entries back states culture tennessee politics nevada check geography information territories authoritative west editors adding continually source added arkansas photographs puerto maryland louisiana accurate texas carolina regularly updated ensure virginia free maps connecticut collection frequently alabama georgia rico alaska pennsylvania oregon
AkgPgi	1	RI	house white state union video watch enhanced transparency commitment browse house white logs visitor wait executive actions president obama federal receipt tax federal dollars tax spent people petitions create sign house inside white tour interactive event live facebook discussion participate click member facebook give click questions comments httpwwwwhitehousegovvideo ondemand library
zkwIwH	1	RI	apod m92 february 4 comet garradd 2012 fascinating discover featured written image explanation day photograph astronomer cosmos universe professional february 4 2012 hercules earth captured tail extends rich wellknown skies arcing early fan 125 sweeping february c2009p1 brightness shaped morning view frame 25000 constellation dense 05 broad 3 mexicos comparable
yO0meX	1	RI	act museum property assembly general raised bill 5355 february session 2012 lco 1663 01663ed committee education referred introduced ed act museum property assembly senate house representatives general convened enacted inclusive 10 october effective section 1 2 act sections 2012 limited organized purposes parks libraries educational cares museum sites exhibits 1
Stnj	1	RI	hemisphere enlarged northern view documentwritelnbr polar documentwritelnn pass measurement documentwritelncenter time passtime recent extrapolated pass auroral oval plot northern measurements current shows polar satellite hemisphere extent noaa recent position poes hand plot clock noon points arrow meridian red ten map color updated auroral observed underlying statistical pass oval respect fluxes
wgFhAT	1	RI	national regional park alaska servicealaska officeglaciers harding national snowfall 60 approximately abundant occur ice summers melt fjords 46 gravity parks acres kenai combined glaciers time areas conditions multiple fourth form year million park average connected fall cool feet land snow require annual flow alaska greater large amounts alaskas receives icefield
hAbWa2	1	RI	service mlk day project find receive mlk updates inbox mlkday follow twitter interests dont tools find toolkits create project tips widget mlk search site day ensure social date follow networks mlkdaycnsgov include serve additional opportunities official national accessibility community usagov fear privacy federal corporation notices website government site foia service
zhrVYv	1	RI	asthma ncbi ann allergy enterocolitis 2004 pubmed immunol riceinduced function web ncbi javascript site warning requires management citation external file generate software division immunology center usa university allergy missouri st 63110 sciences health saint louis department pediatrics unusual food allergy common cultures rice children western case intolerance 11monthold tcellmediated report
HFmnVa	1	RI	upgraded rhode fire watch rigov flag warning island red upgraded danger national contribute relative weather winds rhode precipitation continue yesterdays expected conditions ri red northwest week dry lack fire watch flag low affect service region rainfall humidity warning island providence outdoor burning effect warning result 11 recommended 7 today pm
IIM1VC	1	RI	sentenced dui death 15 august caprio antonio rigov resulting years 2010 attorney veras magistrate caprio dui general 62891 counts peter mariely physical superior death court driving reckless 4 john crest ri announced bodily pled mcburney address nolo injury kilmartin dob drive antonio resulting today contendere endanger scituate view sentenced caprio
GDd9Vw	1	RI	invasive study medlineplus patients hernia easier procedure page related medlineplus invasive results chronic surgical healthday pain compared minimally hernias research treat approach march monday news recovery faster 19 traditional finds procedure option expert older strategy cases repair washington isnt brunt onesizefitsall dr circumstances louis university michael st professor surgical hernia
4tSh9L	1	RI	apod 20 january universe 2010 fascinating discover featured written image explanation day photograph astronomer cosmos universe professional january 20 2010 years produced distant galaxy million highlights signals finally atlas humanity big showing famous bang background satellites radio ten generation video visualize space movie microwave research scientific emitted galaxies extent starts
92kD7Z	1	RI	center tornado watch prediction 61 storm status 61 report watch messages information network service national warnings visit iwin weather interactive high 70 50 mod 50 mod 30 mod 40 mod 30 mod high 80 f2f5 probability forecaster 70 60 table event increased category tornadoes probabilities issuing 5 low moderate events
yDjHtA	1	RI	february jobs 21 tuesday rigov hot dlt 2012 85495 number recruitment minimum police employer location department ri channel week 10 job 682468 12 smithfield position salaryhourly administrator based usa 682572 warwick number experience employer job plan international position rate bequest ri location ri hour phoenix hopkinton 682556 number job location
IIM1VK	1	RI	24 county jury reported april rigov providence interim grand report 2012 proven 63 information court constitution falls edvin note 7772 innocent p1121350a guarantees defendant complaint claremont mendez law presumed indictment central dob guilty ri street allegation county counts edvin providence grand indictment charging jury degree mendez reported child molestation december
yz3d9a	1	RI	12 jobs monday rigov hot dlt march 2012 tiverton number recruitment rate market hourly based employer location ri channel 10 683009 job 12 toms experience position week foreman 70000 west kingston 90000 number 682968 fairplay job location maintenance turf services position employer ri cranston 60000 standards 682980 year number employer
9kWBiq	1	RI	center tornado watch prediction 65 storm status report messages watch 65 information network service national warnings visit iwin weather interactive 40 mod 20 low 30 mod 30 mod 40 mod 30 mod high 70 f2f5 probability forecaster 70 60 table event increased category tornadoes probabilities issuing 5 low moderate events
uGYJrZ	1	RI	autoimmune diseases ncbi allergy rev pubmed gut clin leaky immunol 2012 function web ncbi javascript site warning requires management citation external file generate software md biology center usa university school research mucosal medicine maryland 21201 afasanombrcumarylandedu baltimore underlying innovative neuroendocrine disorders tight susceptible controls intercellular equilibrium diseases nonself impaired loss
3YWS2N	1	RI	living healthfindergov healthy wellness guide live health learn quick everyday connect website hyperlink nongovernmental direct application hhs consistent hyperlinks states services human subject information hyperlinked united application contained health endorsement department website intended provided visitors external constitute applications privacy appearance practices products policies purpose link redirected information usaccessibility privacy mapcontact
Hf61vD	1	RI	today fermilab years experiments expensive antimatter ideal conditions slowly scientists theory relied understanding universe data analysis guide matter burdensome piece explain pick evidence gaps theory provide answer theoretical minimal quigg complete physicist standard chris magic unlike analysis experimental model fermilab origin theorists explains support antimatter numerous theory expansion skeptical imbalance
zwR2dD	1	RI	rover solar dusty multimedia system exploration historical images gallery rover 21 dusty date dec 2011 slope limited wavelengths mission filters research previous 24 rover 21 northern 2111th mobility sky spirit pia07371 location employed 2011 2012 march winters 30 14 presented january reduces pia15114 teams 535 miles team accumulation view nanometers
hbkNxK	1	RI	living eating healthfindergov healthy live learn quick guide connect website hyperlink nongovernmental direct application hhs consistent hyperlinks states services human subject information hyperlinked united application contained health endorsement department website intended provided visitors external constitute applications privacy appearance practices products policies purpose link redirected body eating means diet stay minerals
HFTEus	1	RI	house white april photo day 2012 state union video watch enhanced transparency commitment browse house white logs visitor wait executive actions president obama federal receipt tax federal dollars tax spent people petitions create sign house inside white tour interactive house check april offices photo 2012 picks white day official house
qfePq9	1	RI	summer apod nights august dream 5 2011 fascinating discover featured written image explanation day photograph astronomer cosmos universe professional 5 2011 august summer results yellow planning earth concentric rotates find photographer fix late worth familiar michigan fairies fall awaken continued rosinski streaks traced night series scenes asleep images 4555 arcs
xUCXAA	1	RI	respond mercury andrews spill school st rigov health dem brown high dropped mercury management island rhode health department today 10 building earlier barrington environmental andrews science 11 school classroom reported vial january floor st classes dem shoes process testing site sample officials identify staff mercury addition state potential health protocols
IOe8B6	1	RI	control tobacco family timeline infographic act smoking prevention control major family illustrates infographic information requirements legislation deadlines events full act important rationale smoking resource tobacco final piece prevention history move zoom buttons infographic zoomed mouse left share infographic print download accessible format infographic html viewed accessing downloading file viewers instructions
wmvqIu	1	RI	text relapsed lymphocytic clinicaltrialsgov dose chronic macroglobulinemia nonhodgkin cell subjects waldenstroms full leukemia lymphoma study refractory escalating view tolerability lymphocytic chronic macroglobulinemia cll nonhodgkin cell subjects safety evaluate wm leukemia purpose lymphoma relapsed waldenstroms refractory bnhl study monotherapy avl292 limited interruption nonreceptor receptor blymphocytes revealed btk cll depend network restricted
HFpUPS	1	RI	grant grantsgov opportunities synopsis opportunity find precedence service disk electronic click information grant provide notification send inconsistency document email resolved notifications printed address opportunity emails change receive thing giving original requestedany modification description represent newest file oldest previous shown documents current document sections files background representing modifications arranged changed list
ueClBh	1	RI	jobs january tuesday 3 rigov hot dlt 2012 number rate mill operatorrolling hourly based employer machine 681675 location warwick wolverine ri channel 10 job technologies experience position joining number living 680529 court employer location techscnaspcas ri channel cranston med victoria job 900 12 hour 1600 position senior 681820 based rate
dXwYU9	1	RI	prepare neighbors unexpected disaster set pass information inevitable ordinary events preparation complete educating plan key modeling day great lifethreatening project turn steps ensure social date follow networks mlkdaycnsgov include serve additional opportunities official national accessibility community usagov fear privacy federal corporation notices website government site foia service register contact act
zmdFq9	1	RI	laromme eggs undeclared brand due rugelach rigov recalled vanilla consume people sensitivity allergy run consumers rugelach rhode potential health department brand allergic advises laromme risk undeclared eggs cases reaction lifethreatening vanilla severe products island code stores december container 22 distributed plastic 2 product laromme brand recalled massachusetts included november 2011
ynPFSk	1	RI	gray service trapped national ice noaa fisheries sea whale marine watching photo share photos comments whale submit learn snorkling fishing photo national scanned 1988 sea seattle event film ice 2012 trapped big lab slides released whale marine barrow gray february inspired alaska miracle mammal called gray story trapped related ice
6JoQec	1	RI	center tornado pds watch prediction 5 storm status 5 report watch messages information network service national warnings visit iwin weather interactive high 90 60 mod high 90 60 mod 60 mod 30 mod high 95 f2f5 probability forecaster 70 60 table event increased category tornadoes probabilities issuing 5 low moderate
GPSyMw	1	RI	jobs 23 friday rigov hot dlt march 2012 demayo ma location sousa 10 hourly 683095 rate job experience number painter position attleboro employer based channel number woonsocket year 50000 management employer location ri channel choice job 683105 12 manager 35000 position property number year llc sap developer lead 103022 employer
wLHV9B	1	RI	solar haumea overview system exploration planets dwarf set haumea coating billions years impact ice astronomers moons ago haumeas spin made created namaka hiaka massive rock haumea discovered year nevada announcement moons sierra discovery march spain observatory official 2003 2005 named patron haumea el61 dancers nicknamed spirit moons daughters hula hawaiian
AtCe4z	1	RI	kilmartin ag privacy rigov policy expresses googles concern executive privacy personal potential change policy damaging 2012 scheduled march risk outlined joined larry theft heighten fraud attorneys richer profiles page storing attorney google general states 35 multiple peter information united threatens 1 concerns online googles announced recently users separate effect letter
HPBGaT	1	RI	va center campaign launch medical quit rigov providence health smoking veterans va quitsmoking nicotine retired campaign statewide national services attempts inactive initiative twoweek counseling navy force air armed patches 1800quit rhode supply including increase providence health forces department supplies veterans today successful free cessation designed members active marines eligible helpline
Hs1t5c	1	RI	development recreational 23 chafee million 42 rhode governor rigov grants dem communities announce island westerly tennis fields site restrooms woonsocket grants including variety improvements horseshoe open matching management 23 announces recreational rhode parks sports providence state docks department ri development 4216 nature handicap benefiting million awarding trail environmental basketball courts
xI1DRJ	1	RI	jobs thursday 15 rigov hot dlt march 2012 ma amtrak 10 job boston year 682806 budget number manager 76000 channel position 96000 employer location salaryhourly curran number 682816 rate woodard engineer based employer providence 2 location ri channel job 12 experience project position woonsocket location database 91000 year number employer
GAUd9a	1	RI	soc ncbi 1976 differential pers perception social attrib pubmed psychol function web ncbi javascript site warning requires management citation external file generate software perpetrated major violence phenomenon accessible purported sterotypy concept design performed victim threshold attributional blackprotagonist causal situation established dispositional factors videotape observing labeled occuring subjects black 4 ineraction
HOL4eS	1	RI	bridge opening rigov step pawtucket span river ridot bridge vehicles weight north operation open pawtucket span rhode large ridot department 18ton local final announced week begin transportation expected lift traffic detours needed longer trucks required i95 limit highway island river existing street close open occur area 28 approximately exit 9
HiPpYK	1	RI	states united lottery government blog won usagov asked anonymous lottery won run lotteries states individual follow winners slightly procedure powerball winnings states follow handle statebystate basis state bought run multistate lotteries megamillions ticket procedures teams rules generally state winners lottery learn state responsible comments content hope conversations polite 13 older
yf13Zj	1	RI	charter commission island chafee anniversary governor rigov rhode 350th colonial announce 1663 mollis secretary charter organize consul executive chafee preservation sanderson today british plan 2013 providence 350th rhode ralph lt matthew state edward ri mollis campion elizabeth colonial island lincoln anniversary historic commission signed consulategeneral celebration vice joined governor establishing
tWJPL6	1	RI	surg ncbi patellar sports arthrosc pubmed treatment knee te 2011 traumatol function web ncbi javascript site warning requires management citation external file generate software sahlgrenska institute university mariaehlarssonvgregionse academy sweden clinical neuroscience department rehabilitationphysiotherapy physiology gothenburg compare methods randomized trials review treatment optimal painful common controlled published treatments purpose summarize
x64Lz0	1	RI	propulsion nasa jet laboratory directorate mission years spacecraft saturn monitor 23 instrument degrees httpwwwnasagovvoyager return washington chillier continues ultraviolet report continued 56 shutoff collect continue team voyager reduce jupiter 110 laboratory encouraged heaters propulsion scientists international calif spectrometers working led power step operating institute active infrared 31 35 california nearby
zCaLwp	1	RI	apod scale march 12 universe interactive 2012 fascinating discover featured written image explanation day photograph astronomer cosmos universe professional 12 march flash player version recent adobe 2012 bring human galaxy flash proportion window spread discovering humanity descriptive familiar stop speckled possibly items smoothness vast bar sizes large small version ten
xj7vRJ	1	RI	report science nsfgov special nation aquatic facility rivers shes oklahomas species zoologist research state collected shows recently norman mussels part vaughn river university 30 freshwater southeastern caryn names home species pimpleback hold rabbitsfoot oklahoma approximately research location pistol grip vaughn good north colorful 300 mussels hand vaugn mussel america 55
wGldb6	1	RI	apod australia aurora february 1 red 2012 fascinating discover featured written image explanation day photograph astronomer cosmos universe professional 1 february 2012 atmosphere including magellanic earth disk galaxy ground sky showered weeks excited australia familiar aurora emanating oxygen large pictured night small distant back video highlighting particles state 1402 red
