b7K1p7	1	GA	iss radio ham reference radio ham constant mission astronauts radio ham space station international amateur companion specialists fly nations cosmonauts distress text astronauts radio earth experimentation 1983 families long program communication dozens sarex amateur emergency school russian television thousands preparation pioneered including voice similar cosmonauts duration station russians space flight
yMX3vt	1	GA	states patent united 5676977 mechanism human agsub4 semiconducting entities osub4 silver loss tetrasilver fired proliferating humans aids sites intravenous simultaneously completely active divalent firing resulting ism nontoxic bloodstream diamagnetic electrocuting ppm put utilized suppressing capable hepatomegaly chelate trigger redox molecular function triggered liver pathogens synergistic injection tetroxide devices chelation crystal
ABx6KX	1	GA	faq exportgov verification principles attestations assertions follow implemented privacy provide true make safe represented procedures organizations accordance verifying harbor practices attestations assertions requirements verify verification enforcement meet principle selfassessment compliance reviews organization accurate displayed follow personal policy safe made procedures verifying harbor individuals officer noncompliance accessible principles inhouse year eu
zbMjpI	1	GA	carriers food due freezer innovations ingestion california hazard recalled pack gel named washington instructed voluntary consumers illegal commission safety cooperation announced firm product stop dc recalled resell attempt immediately products today recall consumer travelin product food chef thermal carrier expandable units 55000 toronto canada innovations importer california packs adults posing
zY4wqz	1	GA	ncbi predict 18fdgpetct failed interim blood outcome pubmed 2012 function web ncbi javascript site warning requires management citation external file generate software italy san ppregnomolinettepiemonteit giovanni hospital hematology turin 88 2 corso battista university bramante firstline twoyear results dichotomous 015 controversial petct 691 ratio progressionfree 28 4 versus worse survival
k0rTQV	1	GA	fire recall hp due notebook batteries computer hazard expands named washington instructed voluntary consumers illegal commission safety cooperation announced firm product stop dc recalled resell attempt immediately products today recall consumer product hp computers lithiumion batteries notebook compaq additional previously 70000 162600 batteries recalled units 2009 54000 2010 alto company
85LSBE	36	GA	storm tornado watch prediction 7 center status report watch messages 7 information network service national warnings visit iwin weather interactive high 70 40 mod high 70 50 mod 40 mod 20 low high 95 f2f5 probability forecaster 70 60 table event increased category tornadoes probabilities issuing 5 low moderate events
7unSFA	7	GA	center tornado watch prediction 4 storm status report messages watch 4 information network service national warnings visit iwin weather interactive 40 mod 20 low 30 mod 30 mod 40 mod 30 mod high 70 f2f5 probability forecaster 70 60 table event increased category tornadoes probabilities issuing 5 low moderate events
5OM65u	16	GA	12 center tornado watch prediction storm status report 12 watch messages information network service national warnings visit iwin weather interactive 30 mod 20 low 20 low low 10 low low 40 mod f2f5 probability forecaster 70 60 table event increased category tornadoes probabilities issuing 5 low moderate events awareness listed
Aq2gBB	2	GA	sees dunes faces mission solstice cassini titans sees features dunes faces cassini home news titans sees dunes cassini faces titans jan 2012 23 sees dunes cassini faces titans partnership mission climatic radar result data saturns space dunes revealed agency geological moon moons european cassini titan regional nasas clues variations analysis
4dwBHm	1	GA	picture astronomy day fascinating discover featured written image explanation day photograph astronomer cosmos universe professional 11 2012 bright distant earth disk 20 fit easy weeks apogee photographed perigee dark day telescope pacific dense sun asia moon smallest full 300 annular 240 kilometers path super silhouetted filter point image visible smaller
uGYJrZ	3	GA	autoimmune diseases ncbi allergy rev pubmed gut clin leaky immunol 2012 function web ncbi javascript site warning requires management citation external file generate software md biology center usa university school research mucosal medicine maryland 21201 afasanombrcumarylandedu baltimore underlying innovative neuroendocrine disorders tight susceptible controls intercellular equilibrium diseases nonself impaired loss
wtTtVb	2	GA	chairs fall due hazard desk steelcase recalls cpsc consumers illegal instructed safety cooperation firm product voluntarily stop recalled immediately attempt recall resell conducted consumer product chairs amia desk units 11000 rapids mich distributormanufacturerimporter grand steelcase control hazard installed posing user fall pivot chair seat mechanism pins incidentsinjuries reported series number
mNYfwY	1	GA	heart living healthy live healthfindergov health learn quick guide connect website hyperlink nongovernmental direct application hhs consistent hyperlinks states services human subject information hyperlinked united application contained health endorsement department website intended provided visitors external constitute applications privacy appearance practices products policies purpose link redirected information usaccessibility privacy mapcontact act
2RAq0O	5	GA	national ruins aztec monument search ritual people house describe site reconstructed distant migration follow masonry ancient workers mortar passageways 500 holding today listen kiva search explore part drums puebloan echo pueblo great rooms fingerprints ancestral roof journey time timbers original 900year unesco site states culture world special 1987 united chaco
105uF	10	GA	11 center tornado watch prediction storm 11 status report watch messages information network service national warnings visit iwin weather interactive high 80 50 mod high 80 20 low 30 mod 10 low high 95 f2f5 probability forecaster 70 60 table event increased category tornadoes probabilities issuing 5 low moderate events
x20N	1	GA	picture astronomy day fascinating discover featured written image explanation day photograph astronomer cosmos universe professional 11 2012 bright distant earth disk 20 fit easy weeks apogee photographed perigee dark day telescope pacific dense sun asia moon smallest full 300 annular 240 kilometers path super silhouetted filter point image visible smaller
b2uIyI	2	GA	house white state union video watch enhanced transparency commitment browse house white logs visitor wait executive actions president obama federal receipt tax federal dollars tax spent people petitions create sign house inside white tour interactive event live facebook discussion participate click member facebook give click questions comments httpwwwwhitehousegovvideo ondemand library
xLXjFI	1	GA	med randomised ncbi postgrad review tr clinical 2007 systematic pubmed function web ncbi javascript site warning requires management citation external file generate software universities school medical peninsula plymouth uk exeter evaluate randomised evidence herbal individualised critically trials clinical indication medicine effectiveness summarise evidence experts methodological electronic quality trials field clinical
RfKyy	9	GA	states united financial service government answers gifts management questions homefaqstraining eventspublicationsprogramsabout indexnavigation fmsaz government make contribution money wishing financial contributions bequests send deposited treasury government express payable mailed account made gift budget specific 1843 individuals called unconditional patriotism accept general states check established united federal make gifts donation address considered
zdlHnp	1	GA	united affairs senate hearing states indian committee meeting view united affairs senate states indian committee meetings hearings webcast view seneca salamanca odawi robert indians nation ny president honorable porter school dean nm mexico administration albuquerque mr washburn law university kevin school rose professor nelson encino mr senior law ca whittier
zfTyoH	7	GA	solstice past night mission cassini images home image details smaller mimas 1123 396 dominates image dione side 698 measures 246 kilometers day miles view left mimas terrain trailing 20 area lit degrees north rotated dione moons saturnfacing hemisphere antisaturn side 559 image feet visible spacecraft meters cassini mimas sunmimasspacecraft 1833
bREk8i	1	GA	government house executive contracting white order economy state union video watch enhanced transparency commitment browse house white logs visitor wait executive actions president obama federal receipt tax federal dollars tax spent people petitions create sign house inside white tour interactive homeowners refinancing house twitter responsible answers hours brian office questions
zDzoKJ	1	GA	failure civil packs lithiumion penalty 425000 hewlettpackard report immediately agrees battery civil agreed washington cpsc palo settlement commission pay penalty 425000 safety hewlettpackard calif hp today product company dc agreement accepted provisionally alto 31 announced pdf consumer computers battery allegations defect cpsc posing settlement staff provided law overheat consumers failed
1nwTyd	2	GA	house white address weekly state union video watch enhanced transparency commitment browse house white logs visitor wait executive actions president obama federal receipt tax federal dollars tax spent people petitions create sign house inside white tour interactive presidency publish morning barack intends video address president weekly saturday obama signing money
6JoQec	24	GA	center tornado pds watch prediction 5 storm status 5 report watch messages information network service national warnings visit iwin weather interactive high 90 60 mod high 90 60 mod 60 mod 30 mod high 95 f2f5 probability forecaster 70 60 table event increased category tornadoes probabilities issuing 5 low moderate
w9Y3da	12	GA	apod saturns 22 january light hexagon 2012 fascinating discover featured written image explanation day photograph astronomer cosmos universe professional january 22 2012 planetary infrared discovered spacecraft motions saturns excluded flybys surrounds emanating rotating fully shape vortex continue corners unexpected imaged movie scientists orbiting shows saturn formation created study timelapse times
AAZrIE	2	GA	current uscert activity highimpact web current incidents regularly updated reported types summary uscert activity security page frequent multiple apple released updates safari address vulnerabilities products security os code crosssite obtain information perform vulnerabilities privileges elevated attack attacker condition execute denialofservice exploitation sensitive arbitrary operate scripting articles mitigate users ht5281 encourages
x4ZvmY	1	GA	full survivor text wiser steady clinicaltrialsgov research trial view exercise women control weight related interventions year lymphedema quality group cancer survivors combined test exercise obese life outcomes effects overweight breast groups wiser loss survivor recurrence study weightloss trial sedentary purpose extended interventions frame substudy assess cost wiser impact conducting survivor
OTaxg	1	GA	living healthfindergov healthy live adult shots learn quick guide booster connect website hyperlink nongovernmental direct application hhs consistent hyperlinks states services human subject information hyperlinked united application contained health endorsement department website intended provided visitors external constitute applications privacy appearance practices products policies purpose link redirected information usaccessibility privacy mapcontact
Av3Uqw	1	GA	eating ncbi disorders disturbances review pubmed sleep clin ter 2011 function web ncbi javascript site warning requires management citation external file generate software chieti dannunzio italy university psychiatry imaging department neuroscience chair proposed disturbances focus sleep microstructure anorexia feeding disorders binge presence neurobiological metabolism relationship differences neuroendocrinological psychiatric suffering part
zGevyz	1	GA	tests gluten ncbi sensitivity pubmed clin serological 2011 gastroenterol function web ncbi javascript site warning requires management citation external file generate software italy hospital st medicine clinical orsolamalpighi bologna department university compare gs gluten sensitivity characterize serological pattern disease celiac found gs spectrum entity markers disorders clinical glutenrelated recently lacking
5y7GeJ	11	GA	center tornado watch prediction 3 storm status report 3 watch messages information network service national warnings visit iwin weather interactive 40 mod 20 low 40 mod 10 low 30 mod low high 80 f2f5 probability forecaster 70 60 table event increased category tornadoes probabilities issuing 5 low moderate events awareness
w2SsAN	2	GA	apod 23 january deep orion canary islands 2012 fascinating discover featured written image explanation day photograph astronomer cosmos universe professional january 23 2012 indoor canary testbed galaxy ground dividing sky circle evening coast band northwestern clouds rocky tenerife national martian year constellation lights red earlier vertical rolled eye shine island
bsYPhS	1	GA	worldwide caution 24 january 2012 interests citizens issued actions high caution information 26 terrorist threats provide reminded increase state department vigilance 2011 awareness worldwide activities updated continuing update world july security replaces level violence maintain steps dated threat europe africa demonstrations assassinations middle violent including operations information terrorist variety remains
wovU97	1	GA	supporting deaf serving ncbi dua ann young pubmed children 2011 function web ncbi javascript site warning requires management citation external file generate software usa university fullerton state college department california education special findings process insight scattered spectrum meager examine design dual autism diagnostic intervention provide suggest make young research difficult
xzMFCp	41	GA	photo house january white day 2012 state union video watch enhanced transparency commitment browse house white logs visitor wait executive actions president obama federal receipt tax federal dollars tax spent people petitions create sign house inside white tour interactive january house check offices photo 2012 picks white day office deputy
4tSh9L	1	GA	apod 20 january universe 2010 fascinating discover featured written image explanation day photograph astronomer cosmos universe professional january 20 2010 years produced distant galaxy million highlights signals finally atlas humanity big showing famous bang background satellites radio ten generation video visualize space movie microwave research scientific emitted galaxies extent starts
w1KEJs	3	GA	24 apod january norway aurora 2012 fascinating discover featured written image explanation day photograph astronomer cosmos universe professional 24 january 2012 earth captured northern sky spectacular aurora recombining oxygen large activity round throwing protons sun flare pictured eagle night free latitudes days magnetosphere whats feel powerful mass cloud earths fast
d0iKKk	1	GA	corps monthly themes preparedness citizen 2011 events communities uniting preparing nation locate login contact council moved page httpcitizencorpsgovnewseventsthemes2012themesshtm andor links update questions bookmarks citizencorpsdhsgov email readygov corps notices disasterhelpgovcitizen plugins home fear register privacy federal faqs femagov citizen widgets act policy dhsgov data foia bulletins annual reports servegov contact bannersaccessibility
89BTGc	10	GA	center tornado watch prediction storm 6 status report watch messages 6 information network service national warnings visit iwin weather interactive 60 mod 20 low high 70 50 mod 30 mod 10 low high 90 f2f5 probability forecaster 70 60 table event increased category tornadoes probabilities issuing 5 low moderate events
rUrTN1	1	GA	saturn treats mission solstice nasas cassini delivers holiday saturn features releases nasas cassini home news holiday delivers treats saturn treats nasas cassini delivers holiday dec 2011 22 saturn treats nasas cassini delivers holiday show titan spacecraft radio cassini images delivered saturns pictures flying ornament system signals reindeer pasadena largest holiday
9rcmgE	1	GA	13 center tornado watch prediction storm status report 13 watch messages information network service national warnings visit iwin weather interactive 40 mod 20 low 30 mod 30 mod 40 mod 30 mod high 70 f2f5 probability forecaster 70 60 table event increased category tornadoes probabilities issuing 5 low moderate events
f8zxQx	1	GA	counselorus housing urban development department hud talk renting foreclosure 5694287 cost home counseling issues provide housing agency system call low online avoidance hud advice sponsors free agencies buying search 800 reverse default country mortgages credit voice huds interactive foreclosure home assistance visit counselors program avoidance affordable borrowers search list facing
yowC5u	1	GA	thomas congress text bill library 112th 20112012 hr ih 3784 purchases code revenue transit tax thereof grants 1986 credit profit internal income mass oil gas vehicles passenger natural amend impose windfall products fuelefficient period case infrastructure committee kucinich addition conyers concerned langevin speaker filner transportation provisions means woolsey fall consideration
u00RkQ	1	GA	lipoic inflammatory chronic text clinicaltrialsgov demyelinating full treat acid polyneuropathy view lipoic inflammatory chronic examine purpose cidp alpha acid effective study demyelinating treatment polyneuropathy firstline caused cellmediated la reactive production treatment plasma ivig effects treating progressive oxygen antiimmune activity disorder side temporarily peripheral reduce cost corticosteroids increase mediated intravenous responses
zTFYgW	1	GA	fibromyalgia ncbi rep past pubmed 2004 curr headache pain pres history function web ncbi javascript site warning requires management citation external file generate software yunusuicedu usa illini university 61605 drive illinois medicine college department peoria il concept proposed smythe developed entity sleep disabling symptoms serotonergicnorepinephric term fibromyalgia rheumatology electroencephalogram college
8nffhD	11	GA	center tornado watch prediction 2 storm status report 2 watch messages information network service national warnings visit iwin weather interactive 30 mod 20 low 30 mod 20 low 20 low 10 low 60 mod f2f5 probability forecaster 70 60 table event increased category tornadoes probabilities issuing 5 low moderate events
4ZjPJW	2	GA	10 center watch thunderstorm prediction severe storm status 10 report watch messages information network service national warnings visit iwin weather interactive 20 low 10 low 60 mod 20 low 10 low low high 90 f2f5 probability forecaster 70 60 table event increased category tornadoes probabilities issuing 5 low moderate events
yRQiwq	3	GA	ri sci ncbi ann lab ldl levels low cholesterol clin pubmed serum 2007 function web ncbi javascript site warning requires management citation external file generate software school tel center medical holon sackler israel aviv medicine internal edith department wolfson university ldl 18157 cardiovascular 24 group morbidity mortality associations increased therapy
vnrjr0	1	GA	great paterson national park falls historical search industrial played national site revolution nations parkhome industries power service role 7 largest interior 2011 jarvis economy ken building spectacular park waterfalls designated falls director key november shaping jon great harnessed americas american salazar 397th secretary twitter sign follow paterson events great falls
xreHeV	1	GA	1976 ncbi classification spine pubmed chronic pa role phila 2011 function web ncbi javascript site warning requires management citation external file generate software kingdom nuffield united centre orthopaedic oxford review systematic classification interventions describe back assess chronic determine shown ways clbp systems low pain classificationspecific treating effective reliable classified directed
aqq5tQ	1	GA	fertil soybean ncbi steril isoflavone femi pubmed 2010 exposure function web ncbi javascript site warning requires management citation external file generate software nutrition school loma university markmolympusnet 92350usa health california department linda public relevant evidence foods soy isoflavone clinical animal form evaluate men effects data concerns exposure critically feminizing supplements
luiUY	1	GA	prevent cancer living healthy learn live healthfindergov skin action quick guide connect website hyperlink nongovernmental direct application hhs consistent hyperlinks states services human subject information hyperlinked united application contained health endorsement department website intended provided visitors external constitute applications privacy appearance practices products policies purpose link redirected information usaccessibility privacy
vOSNPd	4	GA	means house dollars 40 difference white state union video watch enhanced transparency commitment browse house white logs visitor wait executive actions president obama federal receipt tax federal dollars tax spent people petitions create sign house inside white tour interactive adobe player flash content download view domain 23 december 2011 public
z8sZhn	2	GA	giant bicycle models hazard break causing fall recalls forks named washington instructed voluntary consumers illegal commission safety cooperation announced firm product stop dc recalled resell attempt immediately products today recall consumer product defy giant avail bicycles year model advanced 2012 units 900 giant bicycle park importer calif newbury fork fall
mXPpr	1	GA	bio astronaut aldrin buzz colonel usaf ret phd nasa astronaut buzz aldrin family born children comprised 20 personal combined grown phoenix cannon sons lois data driggs daughter grandson january married 1930 montclair jersey colleges cambridge point universities high manned astronautics thesis education technology aldrin graduating united west guidance doctorate degrees
nQFFyb	1	GA	med venti ncbi combination commun nucl pubmed usefulness pulmonary 2011 function web ncbi javascript site warning requires management citation external file generate software division pediatrics kaohsiung pulmonology cardiology medical pediatric department taiwan hospital university hypothesized primary decrease pulmonary children scintigraphy perfusion disorders vascularity swyerjames hypoplasiaaplasia explicitly diseases uncommon lung artery
Stnj	1	GA	hemisphere enlarged northern view documentwritelnbr polar documentwritelnn pass measurement documentwritelncenter time passtime recent extrapolated pass auroral oval plot northern measurements current shows polar satellite hemisphere extent noaa recent position poes hand plot clock noon points arrow meridian red ten map color updated auroral observed underlying statistical pass oval respect fluxes
hHJOXn	1	GA	champions house white change state union video watch enhanced transparency commitment browse house white logs visitor wait executive actions president obama federal receipt tax federal dollars tax spent people petitions create sign house inside white tour interactive mscaption textindent9000px 308px msdetail top top0px height norepeat 9999 349px positionabsolute left495px zindex
xkLUJu	1	GA	house poverty white state union video watch enhanced transparency commitment browse house white logs visitor wait executive actions president obama federal receipt tax federal dollars tax spent people petitions create sign house inside white tour interactive made recovery broad reinvestment american economic poverty alleviate act included crisis investments worse set
pAaMis	1	GA	med ncbi rev update spinal pubmed systematic manipulation 2011 function web ncbi javascript site warning requires management citation external file generate software universities school 4nt complementary medical park victoria peninsula plymouth paulposadzkipcmdacuk ex2 25 uk medicine road exeter evidence spinal clinical effectiveness type evaluate update manipulation condition critically aim patients
wICmQR	2	GA	closest dione mission solstice cassini flyby images home image details instruments dione pass surface visible primarily images flyby carthage moon spacecrafts camera moons image higher cassini earlier intended closest cassinis encounter 2011 obtained narrowangle 12 light yield flybys dec resolution linea dione 1123 top 698 epimetheus 113 cassini 86 image
