b7K1p7	2	CO	iss radio ham reference radio ham constant mission astronauts radio ham space station international amateur companion specialists fly nations cosmonauts distress text astronauts radio earth experimentation 1983 families long program communication dozens sarex amateur emergency school russian television thousands preparation pioneered including voice similar cosmonauts duration station russians space flight
yjShDI	1	CO	apod saturns painted january 13 moon iapetus 2012 fascinating discover featured written image explanation day photograph astronomer cosmos universe professional january 13 2012 increasingly meter infrared spacecraft debris flyby impact saturns walnut swoop unprecedented happened greater material seemingly dark possibly world saturn vast bright inspection images close easternmost ice moon
18ms41	1	CO	quindar tones beeps apollo contributor journal burckhard writes mark ive heard wondered space lunar purpose apollo missions beeps modules intermittently communications command served voice mike network clip dinn journal quindar tones mp3 contributor includes audio numerous check 123k contributor markus journal replies mehring space flights shuttle accurate today uhf frequencies
z4iAO8	1	CO	literature statis ncbi comprehensive review acids nucleic pubmed res 2012 function web ncbi javascript site warning requires management citation external file generate software statistics genetics human biostatistics pittsburgh university park usa 16802 pennsylvania state pa 15261 department gwas genomewide results human carefully debate decade potential combine thousands real case good
A3gA2W	3	CO	service monuments national park parks portfolio national parksportfolio cover contents foreword parks monuments acadia canyon bryce caverns carlsbad lake crater grant general glacier canyon grand teton grand hawaii springs hot lassen volcanic mesa verde mckinley mount mount rainier platt mountain rocky seqoia cave wind yellowstone yosemite zion monuments national monument
rWaL0b	1	CO	mlkdaygov receive mlk updates inbox mlkday follow twitter links photo channels good video images find previous inspiring ways media day widget weve included opportunity gallery projects search engage involved social mlk interests dont create project find toolkits widget mlk search site day ensure social date follow networks ensure social date
xeZzEq	4	CO	giss impacts level national maps nasa world security figure al paper human based s5 health 2012 shindell simultaneously food journal graphics improving change climate nearterm science mitigating interactive load moments installed computer web java note graphics require enabled browser 2050 temperature bc measures due surface increase avoided methane decrease linked
4dwBHm	1	CO	picture astronomy day fascinating discover featured written image explanation day photograph astronomer cosmos universe professional 11 2012 bright distant earth disk 20 fit easy weeks apogee photographed perigee dark day telescope pacific dense sun asia moon smallest full 300 annular 240 kilometers path super silhouetted filter point image visible smaller
oXblZR	5	CO	king luther national memorial jr martin search love beacon message man conscience equality justice freedom movement app memorial service official park parks mall national memorial movement history man photo multimedia link pages national click mall plan find memorial blossom cherry national parks mall link page emerging fair generation image society
3N9E9n	2	CO	11 apod sun utah april 2006 halo fascinating discover featured written image explanation day photograph astronomer cosmos universe professional 11 april 2006 corresponds visible shape birds millions 22 remains caught sky tiny degrees foreground icecrystals form explanation utah opposing halo clouds crystal thin night similar entering picture high radius sight
yZEBfl	1	CO	astp photo nasa id title ast01042 image pacific ocean patterns text oblique cloud view ast01053 text image orbit spacecraft soyuz american apollo soviet american ast01056 text image orbit spacecraft soyuz apollo soviet ast02093 text image blacksky spacecraft soyuz background contrasted soviet ast02096 text image blacksky spacecraft soyuz background contrasted soviet
vG8lcT	1	CO	apod thunderclouds jumping sundogs 8 november 2011 fascinating discover featured written image explanation day photograph astronomer cosmos universe professional altsee picture clicking resolution explanation version download 8 november highest 2011 phenomenon years web rapid sky reorients differently sundog return emerged words clouds lightning inspection temporarily enthusiasts past curious encouraged sum
u8jtil	1	CO	releases analysis bullying state policies department education laws states schools analysis education antibullying 46 41 current state summarizing department today models bullying released approaches report created policies laws behaviors prevalence efforts related years schools additional april country state 2011 2010 combat statutes introduce 120 address report law shows enacted bullying
xFzZ6E	1	CO	herbert utah governor gary skip navigation jan 11 2012 whats clark house gary washington month replace county economic run st george resigned district selected recommendation snow utahs party congressional appoint appointment herbert lowry earlier utah delegates 74 letter front republican david signed official governor morning large audience summit margin south
wJuTdV	1	CO	jan 8 6 2012 blotter 33rd locationsabout usnonemergency3034413333 streetboulder 803013034413300other address1805 emergency911 boulder 6a1a18 uiheadercolor favorites twitter servicesexclude uicobrand print addthisconfig servicescompact google facebook delicious var ffffff email uiheaderbackground jan 2012 friday 6 encampment verbal arrests police occupy citations music receiving protestors boulder noise report dancing called warning 1100 pm
xh3qMx	9	CO	jan 11 2012 blotter 33rd locationsabout usnonemergency3034413333 streetboulder 803013034413300other address1805 emergency911 boulder 6a1a18 uiheadercolor favorites twitter servicesexclude uicobrand print addthisconfig servicescompact google facebook delicious var ffffff email uiheaderbackground patrol 1029 observed aggravated denver motor fine stole towed confirmed police area pay tow pearl suspicion lot vehicle parents belonged pm driver
17R7oz	2	CO	lincoln memorial national search immortalized people civil saved memorial united union emancipator statesthe memory enduring inspiration temple seeks great symbol forever nation preserver words president lincoln attracts warsits marble enshrined hope freedom hearts beneath abraham 16th app memorial service official park parks mall national memorial blossom cherry national parks mall
xS4fTn	1	CO	impact multiple ncbi survival myeloma pubmed blood trisomies 2012 function web ncbi javascript site warning requires management citation external file generate software division street usa 200 mayo mn sw hematology kumarshajimayoedu medicine clinic internal department rochester 55905 ameliorates oddnumbered years 24 group adverse conclude t1420 heterogeneity survival loss 57 median
y5kaJU	1	CO	hodgkin clinicaltrialsgov eligible text relapsed view brentuximab patients refractory vedotin full lymphoma sgn35 transplant ifosfamide focus high determine doses transplant refractory radiation ice cell 2 treatment relapsed combination drugs asct infusion carboplatin stem etoposide step therapy purpose hl chemotherapy lymphoma sgn35 treating regimen give called study cells commonly shrink prior
Anazwx	2	CO	nih health january national release 12 identify scientists workings viruses news 2012 approach institutes view links related bookmark share smaller findings developed viruses human skin institutes bacteria diseases visualize provide niams jan musculoskeletal scientists health structures national discovery arthritis science reported part workings insights 13 institute cells microscope issue researchers
wXxhfH	1	CO	molina attend excellency announces inauguration house perez delegation guatemala republic otto president white presidential obama state union video watch enhanced transparency commitment browse house white logs visitor wait executive actions president obama federal receipt tax federal dollars tax spent people petitions create sign house inside white tour interactive house white
aGrvo1	2	CO	metab ncbi int nutr chocolate exerc pubmed 2006 postexerci sport milk function web ncbi javascript site warning requires management citation external file generate software applied usa laboratory university bloomington 47405 dept kinesiology health human science performance indiana rating endurancetrained results cyclists milk tte isovolumic 4 bout greater workout bouts fluid
yuYuGd	4	CO	jan 9 2011 blotter 33rd locationsabout usnonemergency3034413333 streetboulder 803013034413300other address1805 emergency911 boulder 6a1a18 uiheadercolor favorites twitter servicesexclude uicobrand print addthisconfig servicescompact google facebook delicious var ffffff email uiheaderbackground house unlocked 12390 ave sounds information police suspect pm investigated door males reported front awakened left university told leaving block residents male
zZqILK	2	CO	solstice disruption mission cassini images home image details 1062 5150 titan 660 ring angle degree northern image rings sunlit shows tethys saturnfacing plane kilometers sides center 3200 larger side miles left view acquired image visible spacecraft cassini scale 22 tethys approximately camera 7 8 red titan million 12 kilometers 2011
y5whwl	7	CO	jan 10 2011 blotter 33rd locationsabout usnonemergency3034413333 streetboulder 803013034413300other address1805 emergency911 boulder 6a1a18 uiheadercolor favorites twitter servicesexclude uicobrand print addthisconfig servicescompact google facebook delicious var ffffff email uiheaderbackground 3900 table uncooperative 59yearold arrest peace officers 12440 trespassing officer woman degree refused assault mesa obstructing dr warming center charges arrested leave
y0Ubww	4	CO	blueprint increase service efficiency announces stronger vilsack usda operations agriculture secretary operations usda century washington cutting agricultural agriculture 21st built jan costs usdas tom department economy blueprint evolving monday producers 9 streamlining plan 2012the service stronger drive americas vilsack continue presenting meet helps secretary usda years accomplishments businesses modernize taxpayers
bmrpaI	1	CO	cohort ncbi prospective metaanalysis nutr pubmed clin studies 2010 function web ncbi javascript site warning requires management citation external file generate software childrens usa institute hospital research oakland ca saturated generally fat thought reduction dietary health cardiovascular improve heart saturated inclusive related metaanalysis stroke dietary cardiovascular chd coronary objective risk
iRoY8K	1	CO	documents paris 1783 treaty revolution september 1783 states ended recognized united 3 colonies independent formally nation great britain signed treaty american diplomacy process states born britain earth france established united peace largest international newly war conflict arena 177583 formed sophisticated vaguely involving world spain brought great netherlands american independence powers
yvzlT0	2	CO	sec form accurate reviewed information necessarily commission reader complete exchange completethe securities assume determined filing 1 identity issuers information business contact 2 place principal persons 3 related clarification response clarification response clarification response clarification response industry group 4 size 5 issuer federal select 6 claimed apply exclusions exemptions type filing
z3aGiY	4	CO	blueprint increase service efficiency announces stronger vilsack usda operations agriculture secretary operations usda century washington cutting agricultural agriculture 21st built jan costs usdas tom department economy blueprint evolving monday producers 9 streamlining plan 2012the service stronger drive americas vilsack continue presenting meet helps secretary usda years accomplishments businesses modernize taxpayers
wBQwbR	1	CO	apod sun pillar violet february 5 2006 red fascinating discover featured written image explanation day photograph astronomer cosmos universe professional 5 february 2006 beautiful phenomenon snowcapped reflects distant ice nevada film 2000 unusual mysteriously unknown lake sunlight noticed state setting tahoe mysterious tahoenevada learned red mountains serene amateur capture explanation
jCGwtW	3	CO	toxicol ncbi splenda microflora pubmed environ gut health 2008 alters function web ncbi javascript site warning requires management citation external file generate software duke usa north center pharmacology doniadukeedu university durham department 27708 medical carolina fecal including assessments weekly 1111 blot group adverse daily 3 349fold treatment samples decreased remaining
xXJccI	2	CO	volcanic natural island hazards sea red december zubair pulse 60 violent rising yemeni sea navy activity helicopter captured video northern 23 began sulfor 40 located edge details eruptions dioxide white 2011 red satellite shallow forming eruption coast middecember reported imagery kilometers satellites revealed explosions recent saba showed island highresolution submarine
rUrTN1	1	CO	saturn treats mission solstice nasas cassini delivers holiday saturn features releases nasas cassini home news holiday delivers treats saturn treats nasas cassini delivers holiday dec 2011 22 saturn treats nasas cassini delivers holiday show titan spacecraft radio cassini images delivered saturns pictures flying ornament system signals reindeer pasadena largest holiday
jjHHaH	5	CO	hudno11134 hud notice rights homeownership disclosure announces revised servicemembers protects protecting militaryfederal dependents law disclosure duty civil revised washington housing department announced relief development urban notice form servicemembers emphasizes active dependents rights protected today act military duty foreclosure mandates wartime states active rate including court proceeding mortgage personnel percent valid
cjYwfD	1	CO	schedule wsdot ferries dockbound viaduct wednesday 0835 510the jackson marion construct entering close 5 impact driving offloaded drivers due thursday access exit 9 terminalawv utilizing 2012 activities customers colman 7 awv pmseattle southbound underneath dock construction traffic western northbound affect change diverted yesler 10 alaskan university vehicles overnight exiting street
zM9gMC	1	CO	1993 pharmacol physiol pregnant taste ncbi indian zinc test pubmed women function web ncbi javascript site warning requires management citation external file generate software pharmacology medical college department aligarh amu control decreased fair taste percent 70 deficiency individual tablets zinc pregnancy serum declined significantly idea group divided 45 administration advancement
o7BOor	1	CO	25 apod iron september sun 2004 fascinating discover featured written image explanation day photograph astronomer cosmos universe professional september 25 2004 september years spacecraft atomic astronomers 22 farenheit degrees observatory ultraviolet onboard equinox space sun collisions written numeral temperatures million emitted atoms extreme times roman resulting shorthand image highly xii
xIfOnn	1	CO	lacrimator aspects ncbi medical 2003 pubmed harefuah cs function web ncbi javascript site warning requires management citation external file generate software burning including signs cs swallowed stage police army conjunctivitis symptoms clinical treatment main eyes riot introduce sore agent world symptom nausea reviews nose salivation postexposure control guidelines sensation 1960s
xhFKnR	1	CO	press center jpac searches jpac photos historical casualties marine marine 222 jan pearl korean war 2012 harborhickam photos base casualties 13 joint hawaii historical files jpac photo donating tools casualty preferably family personnel member compiled submissions archival photographs frontal showing hundreds photos identifications date case unresolved records analysts teeth aid
d0WPNn	5	CO	national site roosevelt historic franklin home search estate captures back library cries home fdrthis fdrs museum hudson visit springwood loved terms started quote president presidential elected considered connection fdr place learn river twitter rooseveltvanderbilt facebook nhs follow flickr week metronorth mayoctober service bus national park days free operates poughkeepsie roosevelt
xUm0nR	1	CO	11 apod january lovejoy planet 2012 fascinating discover featured written image explanation day photograph astronomer cosmos universe professional 11 january 2012 spherical bright earth captured highlights tail skies australia putting identified cloudy bay picture frame surrounding dawn morning cursor canopus apparition lovejoy appears great created horizon milky islands road 30th
oj9bJg	1	CO	mobile mlearning gallery applications usagov adl guide considerations office developed topics planning design learning initiatives ousd provide personnel government distributed content app universal development intended readiness mlearning introduction explore sponsored purpose pertinent adl advanced basics resource mobile official options defense team initiative guide secretary function 27 return september de spanishdated
tO4ZsR	1	CO	living healthfindergov healthy live adult shots learn quick guide booster connect website hyperlink nongovernmental direct application hhs consistent hyperlinks states services human subject information hyperlinked united application contained health endorsement department website intended provided visitors external constitute applications privacy appearance practices products policies purpose link redirected information usaccessibility privacy mapcontact
jSNUzQ	1	CO	hsf realtime space human flight data control uptotheminute mission spacecraft path data make sky project applet reside significantly 336 download skywatch cache approximately access internet files 144 downloading 300 sufficient downloaded data 10 hard minutes clear required drive connection nasa time modem kbps updated official responsible amiko curator notices nasa
72csZa	1	CO	dance recreation parks boulder 3034137200about 80304 address broadway 3198 boulder 6a1a18 uiheadercolor favorites twitter servicesexclude uicobrand print addthisconfig servicescompact google facebook delicious var ffffff email uiheaderbackground chore forget dance reduce great doesnt stress worries exercise styles months variety offer ages 18 youth older classes including children adults updated 17 tuesday
7mm8y0	2	CO	deduction interest topics tax 456 topic student loan irs resources deduct loan pay generally interest 2500 paid qualified student lesser amount claimed adjustment itemize income form schedule deductions 1040 deduction deduction claim apply loan tax expenses determine education publication 970 pay higher form qualify qualified student instructions 1040 benefits solely
yol440	1	CO	boulder city briefs jan 6 news 2012 boulder 6a1a18 uiheadercolor favorites twitter servicesexclude uicobrand print addthisconfig servicescompact google facebook delicious var ffffff email uiheaderbackground held dance days free jan adult 7 8 dance community drive 5660 broadway saturday parks northboulderrecreationcenter jan sunday 7 department 8 east boulder free host adult
oGPZPt	1	CO	issues frb regulation interest releasefederal 2011 final prohibited demand press repeal payment 14 rule depositsjuly reserve release date july 2011 14 system prohibits federal deposits thursday member regulation board interest final announced demand approval repeal payment rule banks institutions reserve 627 wall authority street established repeals 21 reform federal section
hcHgpI	1	CO	nrc webcast live meeting regulatory webcasts nuclear commission broadcasts internet meetings means nrc improving public communications staff energy rin session inspections situ lbp123 requirements recovery tentative acceptance uranium maintenance criteria appeal meeting final ross tests 855 nrc strata affirmation 3150ai77 feb analyses 10 rule public project 2012 900 medical isotope
A3Pkoz	1	CO	uscis study civics materials test questions pass tools answer prepare materials correctly 6 interview 10 started test 100 study list civics naturalization asked additional section products select short naturalization process overview video test providing highlighting citizenship rights responsibilities civics video history audio format official list answers civics mp3 questions test
hAbWa2	4	CO	service mlk day project find receive mlk updates inbox mlkday follow twitter interests dont tools find toolkits create project tips widget mlk search site day ensure social date follow networks mlkdaycnsgov include serve additional opportunities official national accessibility community usagov fear privacy federal corporation notices website government site foia service
A8GVs5	3	CO	plant multiple ncbi food res pubmed moringa 2007 phytother oleifera function web ncbi javascript site warning requires management citation external file generate software pakistan faisalabad38040 university anwargilaniakuedu department chemistry agriculture tropics roots phenolics distributed compelling treatment rich employed immature activities good combination antiulcer indigenous minerals possess impressive countries quercetin moringa
bugy2B	1	CO	wildlife service fish meadows ash national refuge palmer judy conservancy amargosa courtesy wetlands managed habitat plant county nevada 24 established 1984 service amargosa approximately acres located northwest alkaline valley national nye plants fish southern listed june vegas date 90 ash desert refuge las uplands springfed wildlife animals world 18 meadows
