yojnmk	2	KS	medlineplus specific diabetics goals eat dietary page related medlineplus people dietary healthday feb 2 diabetes type friday goals news improve 17 study specific habits digested high foods index goal carbohydrates sugar participants slowly low spike glycemic blood eat daily levels servings achieved foods index consuming goal state participants low glycemic
qvXnXj	1	KS	entrez genome view viewer map resources ncbi data genbank organism sequencing projects resources related databases cytogenetic features reference sequence viewer hybrid maintained displays human ests contig tiling physical contigs stss ncbi alternate radiation maps genetic grc predicted include fish genome map graphical assembly models genes component gnomon clones path bac
xF9oGa	1	KS	inhibit glioma cancer res ncbi cell cannabinoids invasion 2008 pubmed function web ncbi javascript site warning requires management citation external file generate software biology complutense biochemistry university school madrid department molecular spain cannabinoid cannabinoidinduced experiments thcmediated blot sativa prognosis pcr critical constitutes local gliomas cdna ingredient metalloproteinase prevented apoptosis rna
y14Ssg	1	KS	urinary coli infections medlineplus tract chicken linked pages related medlineplus urinary caused healthday coli news bacteria feb long scientists chickens persons tract 15 canadian study infections wednesday suggests believed typically chickens control urinary emerging caused coli centers 85 publication disease percent issue march diseases tract report infections infectious prevention pork
jcIrm	1	KS	web student aid program financial certification loan sources grants repaid undergraduate grant federal nonfederal awarded foundation added degree students student professional cases teacher aid unlike receive earned considered postbaccalaureate bachelors enrolled pell 30 financial year total grant amounts 1 depending fulltime 2011 2013 201112 status full plans attend june award
wrDGbT	1	KS	kids rules medlineplus strict parents curb drinking pages related medlineplus imposing reduce healthday feb alcohol strict parents friday rules drink news impulses kids 17 study control whats explained research tight clinical helps online print teens approach alcoholism parental journal drinking tendencies inhibit issue study experimental published called researchers stimulus approach
zGwiyJ	1	KS	medlineplus mistakes newbiedoctors resumes found page related medlineplus grens kerry honesty show obstetrics detail research reuters health expected physicians attention applications york 100 applicants training programs 30 credit publications qualities found studies houston cancer attempts mistakes frumovitz lead author anderson willful hope dr md center professor michael honest mislead texas
xh5Gr0	6	KS	smarter babies medlineplus page related medlineplus sooner understand healthday words news feb 15 study wednesday babies foods 9month comprehension year dont closer 1 parts babies 6 type body meaning words child word exposure psychologists language pennsylvania university daily learn researchers walking elika pointing penns surface put sense doctoral psychology things
yZ7SDp	2	KS	complaint scam center telephone variation crime payday collection internet ic3 loans related delinquent obtain attempts victim delinquent debts questioned posted 2010 victims continues net companies relentlessly fraudsters checkcashing home employment federal avoid representatives legal cell payday internet firms pose agencies reported advance receive place scams ic3 involves collecting previously loan
xx2afa	2	KS	united standto army leading transition states 2020 odierno manned force armys characteristics expectations innovative evolving trained ready apply orders staff lessons threats army remains agile chief gen equipped forward articulates learned marching leader outlines led raymond combat decisive principles joint part pdf adaptive versatile recent leaner transition americas remain future
z7Gm9C	1	KS	affairs public home links point hyperlinks find site constitute services welfare linked web provided army west purpose stated sites contained authorized endorsement department consistent exercise activities information locations control external exchanges morale recreation appearance products editorial military disclaimer web aspects technical site comments master questions reporting site broken link address
xU3rxe	2	KS	fish medlineplus colon eating ward women polyps pages related medlineplus fish colon healthday feb polyps week eating risk reduce friday news types 17 developing study servings womens cancer growths colon previous develop lining research inflammation polyps link suggested small formation intestinal cancer fish reduce vanderbiltingram colon tenn inflammation polyps development
6d7nUu	1	KS	official manual state missouri 20112012 secretary map search skip site content contact opportunities directions employment enable turned web settings fully utilize application scripting browser blue official manual sos book home 20112012 detailed years states essays find blue information federal pictures state book heritage local preserve missouri 100 governments official manual
UT2FE	5	KS	house white state union video watch enhanced transparency commitment browse house white logs visitor wait executive actions president obama federal receipt tax federal dollars tax spent people petitions create sign house inside white tour interactive event live facebook discussion participate click member facebook give click questions comments httpwwwwhitehousegovvideo ondemand library
y1mjes	1	KS	living healthfindergov healthy quitting live learn quick smoking guide connect website hyperlink nongovernmental direct application hhs consistent hyperlinks states services human subject information hyperlinked united application contained health endorsement department website intended provided visitors external constitute applications privacy appearance practices products policies purpose link redirected finish eating people break smoking
xEaLTz	1	KS	catalog pia15025 page clark testing scene hardware jet serves laboratory tools situ movements rover participant turret propulsion system arm instrument vstb vehicle test calif pasadena 2012 closest mars rovers precision nasas curiosity robotic end evaluations commands response gerald jpls february missions double inside positioning bed called nasa science shows software
xEBMTJ	1	KS	med ncbi settings authoritative parenti parenting pubmed clin 2012 psychol function web ncbi javascript site warning requires management citation external file generate software usa mmonaghacnmcorg center floor 6th national washington dc community research 20010 clinical 111 ave nw michigan medical childrens t1dm behaviors diabetesspecific family hypothesized primary outcomes leads involvement
wnpouX	1	KS	preserve national park denali sled meet dogs search closures driving mile signage occasional 5 7 pm night park part 11 15 34 18 road birth due inuipiaq born litter names earth kotzebue nuna aliqsi paw sock inupiaq black white pawkavik eagle adopted pads included words date sisters sonamed alaska frontleft
T5VY8	1	KS	apod 15 prominence soho solar march 2009 prominent fascinating discover featured written image explanation day photograph astronomer cosmos universe professional 15 2009 march whats suns sporting month held spacecraft impressively earth cloud unusual fit system expelling curtain magnetic happened spectacular explanation gas quiescent related solar easily cme ejection prominence sunorbiting
AsJoIw	1	KS	school art announces competition mccarthy high 22212 congressional art ca competition high kevin district mccarthy congressional 2012 students school artistic bakersfield californias 22nd invited annual compete today congressman discovery art inspire people competition ideas high artists creative young mccarthy encourage foster forward local demonstrated students continues school entries great talent
3Wg4dC	2	KS	national park yosemite search square wilderness national 1200 deep high valleys human giant strength area parks find shrine glaciers grand granite persistence life power tranquility park sierrayosemite vast states sequoias united meadows foresight miles waterfalls ancient activities question yosemite choose answer difficult common dont reservations require campgrounds early popular fill
lBASb	2	KS	audio congress interviews slavery library days american memory voices center folklife american collections view classroom collection connection teachers resources stories slaves reflected years americans coercion spoke interviews 1930s time presentation families 1860s early twentythree lives enslavement documented discuss presented slavery 1823 individuals slaveholders states born living end recorded note learned
AntMzH	1	KS	medlineplus momstobe rates boost dogs exercise pages related medlineplus 50 healthday walks saturday feb percent recommended exercise brisk news day women pregnant 18 study 30 dog minutes finds walking lowrisk wider strategy suggested health improve exercise liverpool combat part women pregnant dog uk obesity university researchers 11000 plos findings pregnant
xOPZAf	2	KS	birthplace theodore national site roosevelt historic pets search exhibit visitor galleries preservation renovated artifacts closed renovations notice enhancing improve experience pony house held 1902 police photo white mounted roosevelt algonquin officer quentin children badger eli evans beloved captivated bear dr yale small house hard onelegged roosevelt kermit mirror peter barn
wwZCOh	1	KS	national sevilleta wildlife refuge map google address directions refugewmd google maps window opens warranty note service personal visit assumes risk made policies providing guide reusing usability control domain fish site general check information driving feature content conditions provided user directions wildlife route leaving expeditiousness representation road wolf program mexican grey
cWj8HP	1	KS	web student aid click information additional addition alternate listing format student center braille 18004333243 federal publications aid audio 18004fedaid introduce college student pages web programs federal pay section publications aid application apply web federal section free student pages fafsa publications aid called student loans pages web federal section publications explain
qQj0K	1	KS	information recreation camping federal recreationgov tour reservation great outdoors visit americas great outdoors visit americas great outdoors visit americas great outdoors visit americas great outdoors visit americas wilderness oasis swimming beach desert alpine mountain wildlife land rocky national arsenal haven flourishing toxic piece refuge reasons states resorts mountain united forests
xBvk7b	1	KS	million deceptive free offers trial ftc practices halts collected marketer 359 bogus trade including settlement ftcs personal charge offers permanently interprets bans permission practice artwork bank countries companies imposes stopped deceived house willmss consumers federal seller bogus internet inaction negativeoption marketing million free products efforts silence suspended escalade reached stamp
xBhvtQ	1	KS	catalog pia15115 page limited supply mission martian rovers rover winter mobility portait mars shows approached power nasas solar dust opportunity reduces cleans exploration panels accumulation wind mission martian images rovers 24 2011 21 camera opportunitys pancam panoramic mounted sols mosaic 2814th omits days downwardlooking 2811th mast dec view wavelengths 601
x20N	1	KS	picture astronomy day fascinating discover featured written image explanation day photograph astronomer cosmos universe professional 11 2012 bright distant earth disk 20 fit easy weeks apogee photographed perigee dark day telescope pacific dense sun asia moon smallest full 300 annular 240 kilometers path super silhouetted filter point image visible smaller
jFsjIf	1	KS	living healthfindergov healthy quitting live learn quick smoking guide connect website hyperlink nongovernmental direct application hhs consistent hyperlinks states services human subject information hyperlinked united application contained health endorsement department website intended provided visitors external constitute applications privacy appearance practices products policies purpose link redirected information usaccessibility privacy mapcontact act
yqexjv	3	KS	solstice cutoff rings mission cassini images home image details covers 396 visible planets cassini mimas closer image rings miles part kilometers shadow saturn middle 246 left view star speck rings bright mimas ringplane relative increase rings brightened factor southern visibility unilluminated side view image visible spacecraft cassini 27 21 approximately
xXGIJ9	2	KS	february media social day awareness 2012 impair stress ageappropriate capacity mental developmental youths reach ptsd challenges health disorder posttraumatic goals providers dealing wwwsamhsagovchildren children friends visit trauma resilient hope families heroes youth learn juvenile mental prevalence years challenges suffer greater stress1234567 justice generally system noting health rates document numerous higher
xz1xOe	1	KS	school kids study disease medlineplus struggle crohns colitis pages related medlineplus inflammatory mental struggles children depression result feb absences due bowel friday difficulty news school 17 largely study disease finds frequent healthday inflammatory childrens generally life years report aged quality mental provided functioning takes hospital absence health answer columbus nationwide
