z25REf	2	NY	service mobile pubmed reclaiming identity med aprjun703 army dep 2012 society humane washington usa soldiers previous knowledge program adoption enlisted bonds vital therapy awaiting animalassisted skills 3tiered benefit continue mental acquired national canine society humane wrnmmc subsequent integration health tags tiers certificate recovering military members washington community services apply open
ygGdA3	1	NY	full pain cognitive text diabetic clinicaltrialsgov therapy behavioral view neuropathic psychological intervention cognitivebehavior peripheral pain efficacy evaluate management therapy purpose neuropathic study diabetic persistent 215 sample randomized design numbers cbt intervention pharmaceutical educational compared approximately research participants conditions treatment employed size recruited cbtsc controlled standard edsc condition care target equal
d3JDvS	2	NY	national hivaids strategy office aids house national policy coordinated white colfax office grant aids house national learn director policy dr white announced office national aids operational nhas management federal strategy policy plans agencies implementing hivaids lead budget submitted hhs efforts planning aids highest jurisdictions strategy supports national crossagency comprehensive component
wf1SnP	2	NY	ncbi cancer pik3ca pubmed mutation res 2012 initiating breast function web ncbi javascript site warning requires management citation external file generate software cancer prb vanderbiltingram avenue usa pierce 2220 research tn toddmillervanderbiltedu program medicine biology 771 nashville vanderbilt department breast vumc school center 37232 university exhibit mutant oncogenes cancer luminal
wWqx36	1	NY	prime meets house netanyahu minister president white obama state union video watch enhanced transparency commitment browse house white logs visitor wait executive actions president obama federal receipt tax federal dollars tax spent people petitions create sign house inside white tour interactive statements office house oval jackson barack 5 photo white
r8k9E	9	NY	mountains great park smoky national search remnants appalachian national life straddles culture tennessee diversity border mountain renowned ancient ridge quality forest animal southern carolina mountains plant north beauty park world great smoky americas visited warblers whitetailed chances deer park yellow spotting improve elk wildlife bears black learn feel mill stars
zd62Kv	7	NY	10 apod lick march observatory moonrise 2012 fascinating discover featured written image explanation day photograph astronomer cosmos universe professional 10 march 2012 warm atmosphere lick san rim color photo reflected 36 echo perched substantial frames nickel 4200 disk viewed telescope jose long chosen rose green sunlight moon location 7 gorgeous
6T7lwo	1	NY	respiratory topics protection health safety illnesses mists cancer deaths workplaces environments states addressed lung compliance employment avert industries specifically united standards marine workers hazards gases sprays 5 construction estimated longshoring impairment general diseases protection dusts million protect hundreds standard harmful terminals death wear vapors 13 respiratory oxygen fogs respirators required
srHO6N	2	NY	internship usda programs summer strongly give consists employment career usda educational sip located program assistants internships field scientific internship paid gain position opportunity areas institute headquarters experience technical future students enrolled professional usda ambassadors washington county intern agricultural service fl research program health development plant animal attend students dc leadership
g9ZQJ0	4	NY	house white state union video watch enhanced transparency commitment browse house white logs visitor wait executive actions president obama federal receipt tax federal dollars tax spent people petitions create sign house inside white tour interactive event live facebook discussion participate click member facebook give click questions comments httpwwwwhitehousegovvideo ondemand library
eKT6DE	1	NY	8 history march today votes susan photographer suffrage anthony 18501920 taylor 18801906by demand popular pictures circa women amendment house argument vote session committee argued legislators introduced sixteen 48th constitution womans federal began representatives statement 8 document congressional march congress judiciary anthony printed address 1884 1883 women susan suffrage years anthonys
yNJJW5	1	NY	titan mission solstice cassini rhea images home image details atmosphere titan or5150 layers rays closer hazy moon haze rhea 1528 real blue rheas full views big craters orange hazes kilometers 3200 949 miles learn titan terrain visible limb disk leading lit degrees moons rhea overexposed north rotated 13 hemispheres edge
u8jtil	1	NY	releases analysis bullying state policies department education laws states schools analysis education antibullying 46 41 current state summarizing department today models bullying released approaches report created policies laws behaviors prevalence efforts related years schools additional april country state 2011 2010 combat statutes introduce 120 address report law shows enacted bullying
Af9EUc	2	NY	activities ncbi adolescent med adolesc pubmed pediatr 2008 arch physical function web ncbi javascript site warning requires management citation external file generate software usa hopkins university johns residency medicine preventive maryland baltimore status increased relationship activity weight examine adult adolescence physical cohort adolescent study longitudinal health based data national inhome
cyAHuB	1	NY	frequently faq asked questions supplement dietary dietary vitamins marketed include botanicals herbs important minerals substances remember supplements products guidelines myplate foods dietary americans variety amounts recommended health performance consume optimal promote adequate essential supplements ensure nutrients diagnose prevent dietary surgery health treat conditions intended unwanted effects cases mitigate medicines disease
wnqpWh	1	NY	back titan mission flyby solstice cassini t82 south back overview titan mission flybys home t82 flyby south titan back t82 flyby south 19 feb 2012 sector summer distances magnetic mission infrared including flyby monitor northern tail degrees samples latitude t78 insights local vims clouds rodealong miles radial fixed spring titan
w0c9sv	1	NY	heart kids benefits study medlineplus health exercise pages related medlineplus heart tuesday rest healthday physical feb health sitting time report news day kids 14 hour english benefit activity spend researchers weight children physical health teens moderate exercise vigorous pressure levels blood peers study longterm daily important cholesterol found cambridge england
oqPMKY	1	NY	mcfp outreach weekly 4 2012 illness mental reduce month stigma education raise health awareness designated outreach importance financial private including repaying managing loans difficulties bureau loan protection student complaints accepting borrowers default taking cfpb consumer tip move find allowances decisions information tenth make relocation weeks visit force corps brain experts
wx9M3j	2	NY	cons pros labor project agreements november 2 2011 2011r0360 cons pros labor project agreements analyst john moran principal cwas people lowincome community trade hiring targeted debate paths funding employment create government labor arguments cwa include agreements provisions plas workforce includes construction report projects building receive project career components asked underrepresented
xl8O0c	20	NY	grant grantsgov opportunities synopsis opportunity find precedence service disk electronic click information grant provide notification send inconsistency document email resolved notifications printed address opportunity emails change receive thing giving original requestedany modification description represent newest file oldest previous shown documents current document sections files background representing modifications arranged changed list
8faZ4	1	NY	resident aliens citizens abroad small businessselfemployed taxpayers international topics irs resources reside estate resident tax alien estimated united generally returns income subject worldwide paying rules citizen abroad states gift filing duty file resident allowed year alien 2month calendar pay due citizen residing return june regular date overseas 15 extension requesting
aZMetW	1	NY	poster epa sunwise contest jump main content contact home sunwise foundation rules uptodate including information contest official visit forms shade entry andor sunwise contest state interested promoting call sunwiseepagov supporting 202 poster 3439378 contact shade 2011 national winner seventhgrader michigan jolie family students school jolie congratulations contest participated 2011 crayola
g4wVQL	1	NY	search army goarmycom careers jobs offer qualified applicants term service cash enlist specific 40000 bonuses find variety browse menu pulldown offers interest start matches job path occupational categories wide career army experience specialties military leaders environments front changing lead army officers adjust category intelligence support combat duty army officer details
wL25BR	1	NY	conference house holds news president white obama state union video watch enhanced transparency commitment browse house white logs visitor wait executive actions president obama federal receipt tax federal dollars tax spent people petitions create sign house inside white tour interactive adobe player flash content download view domain 06 4405 march
c7t4VH	1	NY	locator hivaids service provider providers testing locator centers service housing current health location provider tool hivaids services search locationbased firstofitskind prevention aesthetics reference feel developed aidsgov site locator flexibility including descriptions functions codes version widget users vertical free identically horizontal difference conveniently items layouts specific place embed order city code
x0mmPO	1	NY	support update response blog severe weather overview 8 efforts fema ive county isnt magoffin 6 march devastated helping declaration included response kentucky mistake declared office report httpkyemkygovpagesdefaultaspx home surveys management additional area assistance damage forms live local emergency continuing completed designated state encourage anonymous assessments counties areas kentucky contact fully
yZxhRq	1	NY	teen summer wilderness academic national park offers program adventure enrichment yosemite search summer inspire golden mission actions founded nurturing consists nevada partners based personal residential 28 state offers sierra 2012 monica recreation organizations online runs world adventurous association school bar skills michael serves annually 501c3 40000 bilodeau including klean olympic
eVdYT	1	NY	forms publications irs resources methods links tax electronic forms provide media irs capabilities access source basic print function acquire additionally advanced search irsgov official materials publications published links schedules tax individual download return taxpayers irs forms income mail order recently business advised packages needed filing instructions longer receive paper page
d0iKKk	1	NY	corps monthly themes preparedness citizen 2011 events communities uniting preparing nation locate login contact council moved page httpcitizencorpsgovnewseventsthemes2012themesshtm andor links update questions bookmarks citizencorpsdhsgov email readygov corps notices disasterhelpgovcitizen plugins home fear register privacy federal faqs femagov citizen widgets act policy dhsgov data foia bulletins annual reports servegov contact bannersaccessibility
18pdxi	1	NY	volcanocams volcanic mount st helens monument national volcanic mount st helens monument national bridge tty 98601 wa monument ne headquarters 4497800 8915003 42218 yale amboy 360 box observatory ridge wa 98649 lake po 24000 326 360 toutle johnston 2742140 spirit highway helens toutle feet static north realtime approximately located ridge
wJPcoM	1	NY	inmate 057713 ellison opinions handsproceedings charles victim committed previous 24 death pecuniary smith tape pending judge february lillian january verdict release vincent homicides direct depraved defense home richard robert moon masking appeal arizona choked conviction trial published bound commission convicted start joseph cords prosecutor suffocated telephone heinous gain broke circumstances
q8oag	1	NY	crossing borders dhs information updates email official nexus states including entering id children united travel approved card passport document merchant business present airports citizens kiosks air orders military mariner 1 june 2009 beginning top back secure travelers states including entering children present united travel air passport document information resident continue
3KiV4l	4	NY	11 congress friday library events public 2012 washington back library subject information check charge offers location public congress dc free site schedules change events latest noted theatercontact floor 1130 330 visitors 130 7078000 1030 ground 230 pmlocation 202 pm noonin thomas dean childrens ambassador national 202 ground memorial buildingcontact coolidge
noKr	1	NY	constitution note 1 secure people welfare domestic america general states establish perfect united constitution justice liberty insure provide form tranquility defence posterity promote ordain union blessings common order congress vested senate house states legislative united consist granted representatives powers composed people house year states electors chosen representatives 1 state branch
ySQVYW	2	NY	inmate 038977 dixon detective serving profiling committed years murder identify jury crime sexual identified 1986 wayne indicted death 20 opened technological sentence advancement sentenced raped state suspect dixon 7 tom assault case life arizona clarence tempe killer scene 21yearold apartment connected student 30 dna stabbed strangled deana bowdoin conviction 1978
4kIXux	1	NY	reports fatalities catastrophes events weekly reports fatalities catastrophes events weekly description webpage fatalities table summaries weekly area workers include updated complete employers link report list summary oshaapproved incidents catastrophes inspection links citation states hospitalization information state investigation offices plans hours reported osha investigates preliminary operate resulting workrelated fy12 reports fatalities
yrfXg6	5	NY	inmate 136521 anderson shot agreed held kill poyson leta cut 21 bludgeon finally kagen gave hit killed bread ended bobby 50 rock trailer lantern crushing decided home driving robert knife eating august frank night hitchhiking hours death wear boy 39 yard dinner cinder block son county delahunt awoke 15yearold letas
sOwt9L	2	NY	thomas congress text bill library 112th 20112012 hr ih 3662 control number balanced 1985 spending reduction deficit emergency modify discretionary account limits amend employees budget federal savings resulting act miller kline young fleming franks arizona scott mckeon committee lamborn turner subsequently wilson reform addition west concerned government rigell hartzler speaker
aOUWj2	1	NY	oil fatty ncbi database syst fish acids rev cochrane 3 pubmed 2007 omega fo function web ncbi javascript site warning requires management citation external file generate software division hepatology ontario gastroenterology nutrition 555 hospital danturnersickkidsca toronto m5g sick ave 1x8 canada children university beneficial inflammatory fish chronic disorders antiinflammatory oil
130rZ5	3	NY	island national seashore assateague search enjoy coastal move rest existence continent sandy recreated visit forests day live bays life recreate relax time assateague maritime explore marshes waves beaches island salt ocean edge place adapted wind enjoy make thrive horses beauty assateague extraordinary distance island continue wild enjoy barrier ages visitors
mE29Ad	2	NY	prohibiting arrangements fees exclusivity standards issues frb network 29 routing debit releasefederal 2011 final interchange press restrictionsjune card rule establishing reserve release date june 29 2011 prohibiting wall issued ii arrangements fees exclusivity standards interchange network reform federal doddfrank regulation board debit final routing restrictions protection card required wednesday rule
wT7eLi	50	NY	february 15 da14 asteroid earth nearearth miss 2013 2012 discovered bring radii earth rapidly northern sky 4 fade 2013 2012 evening shadow occurring february brightness morning naked magnitude fainter meters traveling 1926 pass close closer sun reappearing approach small eye 35 diameter ring size earths quickly asteroid visibility nearearth spain
o5JrRg	1	NY	frb august open 2011august federal 30 1 9 committee press releaseminutes market 2011 release date 30 2011 august tuesday held committee open market conference federal 1 call board 9 meeting august fomc released 2011 attached minutes reserve scheduled financial economic committee descriptions information based solely decision contained conditions time policy
nCRbpx	1	NY	comparison ncbi cardiology nuclear 1986 br radiol pubmed equilibrium function web ncbi javascript site warning requires management citation external file generate software anterior major wall oblique paper questions considers technique specifically ventricle assessment remaining equilibrium option views successful regional rwm leftventricular give concludes projections pass information nuclear cardiology full problems
neYbl	1	NY	bio cooper astronaut gordon cooper leroy colonel usaf jr nasa astronaut gordon deceased ret flying 1927 born fishing home shawnee hunting personal archeology oklahoma treasure boating 4 passed 6 racing interests march 77 california included cooper data october age ventura gordon 2004 skiing afit force primary murray engineering education technology
x0oqZp	3	NY	eating ncbi disorders loneliness pubmed 2012 janapr psychol function web ncbi javascript site warning requires management citation external file generate software division 17033 eating center adolescent medical usa hershey mlevinelhmcpsuedu state pa college medicine penn disorders milton concept themes interpersonal exacerbate issues relationships disorders symptoms setting treatment health include real
wy9md2	1	NY	preserves computers personal hard drives competition desktop ftc action disk market computers proposed hard competition trade global hitachi disk market sell settlement commission federal corporation harmed storage desktop digital manufacture drives toshiba part western resolves technologies assets charges require digitals personal rival acquisition control deal hard llc disk technology market
dhMYQm	2	NY	eek recycle birds feeder birds ways creative finding youll realize containers nice reuse food completely craft beginning day throw inside times project turn stuff clean activity reusing heres household drawings jug milk bottom create feeders 1 reading bird containers complete models punch water rain instructions drain remember holes clean small
wY4gdO	1	NY	project database bioreactor ncer research landfill design fuel ord waste algae epa content area jump main navigation contact research extramural project search ncer research feed leachatepond experiments design leachate determine laboratory project informed content objective optimal local bioreactor harvesting onsite surfacepond dilution gas flocculant oil water algal designed stocks algae
wCIR3s	7	NY	inmate 223626 chappell shackleford previous apartment police young complex march early cutting report continued morning night found competition year investigation dating frustrated missing kristal attention hours incident death choked carried brusing supply scene son involvement drowned proved 2 relationship child shortly 11 12 middle air called affection ordered december kristals
wOG84K	1	NY	life fibromyalgia ncbi rheumatol 1993 pubmed comparative quality function web ncbi javascript site warning requires management citation external file generate software division rheumatic diseases university arthritis oregon sciences 97201 health portland obstructive previously results chronic pulmonary quality adversely compared consistently measured lowest controls permanent diabetes scored life dependent arthritis osteoarthritis
x4Hpxy	1	NY	harbor safe drug trafficking act elimination 2011 tough 313 states scott drug activity law federal make occur speaker criminal zealousness conspiracies hr rise virginia expansion completely united opposition safer engage bill mr laws called show money pointed distribute fivefold including expressed committee years expressions involved ward impact increase questionthis conclusions
xVtd4J	4	NY	med ncbi medical pubmed teach education taiwan 2012 function web ncbi javascript site warning requires management citation external file generate software humanities medical department taiwan university taipei chinese transplants global bring including committee welfare taiwan issues complex capabilities forms modernization program include local hope eventually aspects mainstream practice emphasizes criticized
A3DHXM	1	NY	filter polyurethane project database foam ncer research pointofuse ord epa content area jump main navigation contact research extramural project search ncer research larger point mission aguaclara collaborate technologies partners scale filtration cornell water program treatment plants safe municipal polyurethane foam focus pointofuse student drinking america building central university work teams
w4WLm	1	NY	living healthfindergov healthy live learn quick guide connect website hyperlink nongovernmental direct application hhs consistent hyperlinks states services human subject information hyperlinked united application contained health endorsement department website intended provided visitors external constitute applications privacy appearance practices products policies purpose link redirected information usaccessibility privacy mapcontact act policyfreedom ussubscribe
4wAndF	1	NY	house prague president white state union video watch enhanced transparency commitment browse house white logs visitor wait executive actions president obama federal receipt tax federal dollars tax spent people petitions create sign house inside white tour interactive adobe player flash content download view april 2009 5 2601 domain square addresses
xYQKDc	1	NY	curr ncbi rep acti pubmed effects pain headache 2011 exercise physical function web ncbi javascript site warning requires management citation external file generate software school ma usa medical 02114 medicine harvard spaulding boston department hospital rehabilitation physical incorporate nonpharmacologic formulated evidence providers manage share contemporary conditioning regimens controversial disabling recommendations
yNmV0S	1	NY	biophys ncbi evidence critical acta ro pubmed withdrawn biochim 2012 function web ncbi javascript site warning requires management citation external file generate software elsevier apologizes withdrawn editor policy full inconvenience httpwwwelseviercomlocatewithdrawalpolicy article publisher request withdrawal found elsevier bv published activity browsing empty recording activity turned recording turn back information usa
zk47ML	2	NY	photographs congress prints search library results catalog grabill online john 192 results grabill john digitized congress image larger 191 library 1 picnic hlot grabill file 1890 pp homestake 1 pretty digital print john lcdigppmsc02537 30763 2723 photographic grounds original road view hlot canyon grabill file whitewood wade 1890 pp rr
nQY3Ya	1	NY	frb 12 companiesaugust loan releaseboard rule establishing regulations savings interim holding press 2011 final issues release date 12 2011 august issued loan interim slhcs federal board holding expected final friday effect regulations register companies rule establishing savings published reserve comment office wall issued nondepository authority month street rule sought slhcs
n3QQVg	2	NY	sec form accurate reviewed information necessarily commission reader complete exchange completethe securities assume determined filing 1 identity issuers information business contact 2 place principal persons 3 related clarification response clarification response clarification response clarification response clarification response industry group 4 size 5 issuer federal select 6 claimed apply exclusions exemptions
xjpIJF	1	NY	report science nsfgov special nation dont similarity recorded chimp 987 kill species wage dna brian percent case chimpanzees war hare share killing humans important chimpanzee captivity bonobos notes violence common wild anthropologist bonobo duke evolutionary hare nsf woods wartorn lola apes endangered support young ya bush republic parents bonobos national
7DgBXv	1	NY	2011 automotive 1975 otaq lightduty trends emissions dioxide fuel carbon epa technology economy jump main content cars trucks light area search contact additions epa recent years mile previous based improvement fuel 2011 2010 mpg report projects trucks standards miles trend trends year sport provided co2 pickup dioxide reverses slight cars
z4zug5	1	NY	apod march nebula 8 seagull 2012 fascinating discover featured written image explanation day photograph astronomer cosmos universe professional 8 march 2012 bright atomic earth compact 2327 ngc young forms distance sweeping wings clouds embedded parrot popular arc portrait estimated constellation broad nebula birds birdlike dominated 2177 suggesting bird degree notably
