y0EV7z	1	NY	raise air heartattack cold medlineplus exercise risk pages related medlineplus heart people cardiac healthday news cold risk physical death snow arrest 2 bodys activities breathing march greater friday increases finds demand put shoveling oxygen study disease air heart youre college sinoway cold news isometric pennsylvania coronary state trigger vascular medicine
xneySz	1	NY	state fema contacts security advisors list state homeland click view links wwwfirstrespondertraininggov note hosted map abbreviation states points information list state contact choose est monday modified 163935 12dec2011 links nongovernment social applications web fema provided reference media companies sites endorse msgdata washington street apply management prepare federal rates homeland department
1v5xcf	1	NY	corporations small businessselfemployed small businessselfemployed topics irs resources prospective figure money realizes tax purposes entity taxes corporations special shareholders takes federal corporation separate generally income capital net distributes stock business exchange forming sole pays deductions loss taxable conducts recognized proprietorship property taxpaying profits deduct distributed tax deduction shareholders earned profit
o1BA38	1	NY	saginaw region site bay sites cleanup 5 tittabawassee river epa jump main content region cleanup 5 sites serving wisconsin tribes michigan minnesota 35 illinois indiana ohio search area contact epa 2011 24mb spring 4pp rivers april pdf issue today 2012 listserv deliver list sign subscriptionbased dowdioxin site news email epa
bY3G5x	1	NY	partnerships small businessselfemployed small businessselfemployed topics irs resources money partnership share expects existing carry skill relationship labor contributes business persons trade join losses person property profits operations losses partnership tax file partner information pay income return gains passes share includes deductions report loss annual partners profits partnerships issued partnership date
x0LsQq	1	NY	living police room conversations department seattle living room residential taking conversation place home neighborhood community comfortable bring directly open issues police area informal officers participants setting local meetings dialogue conversations designed members address group work promotes traditional small neighborhood questions discussions police officers concerns safety include local opportunity resident seattle
wBdIB7	5	NY	house white state union video watch enhanced transparency commitment browse house white logs visitor wait executive actions president obama federal receipt tax federal dollars tax spent people petitions create sign house inside white tour interactive event live facebook discussion participate click member facebook give click questions comments httpwwwwhitehousegovvideo ondemand library
yInBWz	3	NY	youth preparedness corps citizen communities uniting preparing nation locate login contact council moved page httpcitizencorpsgovgetstartedyouthyouthindexshtm andor links update questions bookmarks citizencorpsdhsgov email links plugin require plugins page view readygov corps notices disasterhelpgovcitizen plugins home fear register privacy federal faqs femagov citizen widgets act policy dhsgov data foia bulletins annual reports
zdzyf7	4	NY	living healthfindergov healthy quitting live learn quick smoking guide connect website hyperlink nongovernmental direct application hhs consistent hyperlinks states services human subject information hyperlinked united application contained health endorsement department website intended provided visitors external constitute applications privacy appearance practices products policies purpose link redirected quit tips set reasons money
lvo3iX	1	NY	frb 15 testimonyfoley supervisionjune banking 2011 financial ranking subcommittee crisis banking introduction procedures testify member regulation examination chairman corker today brown associate director members supervisory opportunity response recent boards division supervision senior federal policies institutions reserve foster financial members fair consolidated authority stability supervisory including authorities federal transactions system member
ynNYwR	1	NY	human ncbi crystal pubmed 71 science 2012 structure enterovirus function web ncbi javascript site warning requires management citation external file generate software usa purdue university sciences lafayette west department biological 47907 illness show head canyon enteroviruses children residues group hydrophilic floor interact exposed young antiviral factor fatal partly molecule pocket
yzHSJC	1	NY	ncbi pubmed pa health oxf approach public 2012 function web ncbi javascript site warning requires management citation external file generate software development zealand auckland university learning faculty teaching education addresses years theories learning behavioural impact based adolescent finally parents potentially gap effects background preventable sustained population evidencebased level method emotional
y0ebWj	1	NY	wwwnalusdagov gardening find resources horticultural american society gardening features links community society books horticultural information master internet events youth farm awards gardeners american river american public association garden gardening features links garteners community society books horticultural information master internet events youth farm awards american river daves garden mailorder facilities books
zpMNgP	11	NY	inmate andriano 191593 frequenting bars discreetly discontent andrianos poisons obtain engaging cease poison ordered insurance researched affairs resentful business profit began separate extramarital responsibilities policy scheme life increased allegedly pose death effects andriano friends working ill wendi kill hatched asked husband psychologically physically observed andriano abuse signs claimed friends abused
x9LNgj	1	NY	patient ncbi prognostic factors haematologica pubmed evaluation 2012 function web ncbi javascript site warning requires management citation external file generate software hospital de spain salamanca universitario 0 proposed results years identify involved univariate impact conclusions 28 p0007 platelet p0001 4 mortality affected 26115 survival background 2 acute identified summary gut
wmELwr	4	NY	inmate delahanty 242703 shot avenue police window sped instantly sitting christopher intersection presented arrested gun officer force back seat seconddegree result plead cactus driving men days license conceal guilty david turn conducted testimony asked road striking uribe vehicle head murder testified 31st effort lunged 10 stolen abandoned car passenger plate
hspXhu	1	NY	small edge exim business financial begin stability working source access dependable exporting youll capital expand exports internationally order marketplace obtain accept backed export guarantee confidence working provide grow capital exports business contracts commercial sales made lenders international services exporters loans financing goods effectively liquidity enabling compete small facilitate encourages loan
yxckmm	3	NY	mummies ncbi mu pubmed res melanoma 2012 history function web ncbi javascript site warning requires management citation external file generate software oncology usa center cancer 33612 florida department molecular moffitt tampa years attempts vemurafenib drive 2011 intractable survival made therapy ultimately level benefit continue accompanied 20th therapeutic reduce biology year
zYzAc0	2	NY	rats senate highlights perkins state subway sen nyc problem york uploaded 18 youtube jan weact4ej 2012 perkins rat raises 181st sen st event issues city yorkers northern justice 1 station twu extensive participated manhattan environmental train york demand infestation 100 ratfree bill subways local subway act senator read attack rat
xIhIpK	16	NY	photographs congress prints search library results catalog grabill online john 192 results grabill john digitized congress image larger 191 library 1 hlot grabill dakota film 30766 city pp neg 1 hill print john forest lcusz6278513 c1888 part deadwood copy photographic 862 bw item hlot sack grabill file 1890 pp 22
lw7OSD	1	NY	frb 2011 beige booksummaryjune 8 summary louis richmond francisco san chicago boston kansas philadelphia minneapolis st districts york cleveland dallas atlanta city report full twelve expanded related number slowing services economic accelerating technology nonfinancial industries information service federal generally philadelphia regions contrast economy led business york deceleration report atlanta manufacturing
ACzo2O	1	NY	sci risk ncbi taking induces fast thought pubmed 2012 speed psychol function web ncbi javascript site warning requires management citation external file generate software university princeton behaviors money text sex experiments speed causal greater clips slow thinking provide movie engage induces fast quickly 1 participants experiment contained content drug medium
xBhvtQ	2	NY	catalog pia15115 page limited supply mission martian rovers rover winter mobility portait mars shows approached power nasas solar dust opportunity reduces cleans exploration panels accumulation wind mission martian images rovers 24 2011 21 camera opportunitys pancam panoramic mounted sols mosaic 2814th omits days downwardlooking 2811th mast dec view wavelengths 601
AEBSjT	3	NY	inmate garcia 047398 dollar steve ended 20 21 prison lady fled bank occurring bar proceeded james drop arrested gun large garcia shots bills bars force scuffle sentenced codefendant defendants firstdegree told sheffield pled path withdrew atm guilty amount scene owned unsuccessful owner ordered refill armed city spoke dropping entered head
zW6pnr	1	NY	apod march flying 5 night earth 2012 fascinating discover featured written image explanation day photograph astronomer cosmos universe professional 5 march 2012 atmosphere earth captured spectacles rousing sunlit orange wave dark half progresses clouds brightness lightning approaching set sequence seas frame video dawn blue space purple lights haze international occurs
z3p1Js	1	NY	genetics ncbi pubmed role diagnosis world 2011 gastroenterol function web ncbi javascript site warning requires management citation external file generate software 1st greece hepatogastroenterology unit internal department etsianosuoigr ioannina division niarxou stavrou medicine box school leoforos 1186 medical po 45110 university disturbances attempts differentiation integrity homeostasis disorders prognosis hereditability receptors
AvoDcr	4	NY	week blog united government national participate qa live protection usagov consumer states week est march session 2pm national question host protection 6 answer consumer tuesday complaint trade experts usagov questions commission provide government consumerrelated answer resources file scams company answers hand chance federal learn latest questions twitter experts chat est
zcju1y	1	NY	hyb interspecies ncbi yeast pichia sorbitophila pubmed bethesda g3 2012 function web ncbi javascript site warning requires management citation external file generate software interspecies show pichia genomes contributions exchange duplicated physiological illustrates parts parents location imbalance resolved yeast period heterozygosity closely sorbitol autopolyploidization batesondobzhanskymuller loss evolution solution accelerating specific common
hc7uyn	1	NY	training 12 dol protection january workers respiratory video healthcare 2010 states department united labor video download pause note play watching problems press experiencing large fully ac code false httpwwwmacromediacomgogetflashplayer allowscriptaccesssamedomain height high middle dolmediawebcast20110112respirators quality id acrunactivecontentjs pluginspage scale end 0 menu width window 280 ffffff alertthis 426 play devicefont
AE29GO	1	NY	lessons ncbi effect research pubmed jama placebo 2011 recent function web ncbi javascript site warning requires management citation external file generate software galveston blvd usa 77555 family humanities institute medical medicine branch 301 department tx university texas habrodyutmbedu activity browsing empty recording activity turned recording turn back information usa 20894
yTQceE	2	NY	house white state union video watch enhanced transparency commitment browse house white logs visitor wait executive actions president obama federal receipt tax federal dollars tax spent people petitions create sign house inside white tour interactive event live facebook discussion participate click member facebook give click questions comments httpwwwwhitehousegovvideo ondemand library
Ag2Ep9	1	NY	libration moon animation phase svs 3894 2012 dialamoon diameter image intervals frame year axis hourly archived angle initial libration moon current animation 2012 geocentric apparent phase end dialamoon hour position shows page features terrain surface high terminator sharp jagged earth orbiter altimeter make measurements detail lunar moons unprecedented aboard elevation
5RiZ	1	NY	information house freedom act white state union video watch enhanced transparency commitment browse house white logs visitor wait executive actions president obama federal receipt tax federal dollars tax spent people petitions create sign house inside white tour interactive homeowners refinancing house twitter responsible answers hours brian office questions white deese
ctEWxj	1	NY	medlineplus write materials health easytoread people guidelines easytoread information create age complex health reading understandable background easily language level medical materials concepts etr information understanding difficulty written materials audiences reading etr process important medlineplus materials steps writing involving group language level age cultural proficiency audience attitudes background english elp reading
q0rl7y	2	NY	frb 2011 beige booksummaryseptember 7 summary louis richmond francisco san chicago boston kansas philadelphia minneapolis st districts york cleveland dallas atlanta city report full adding slow outlooks weakening increased continued volatility louis activity noted characterized twelve slowed economic cleveland contacts federal richmond sluggish led business slight expansion reported york downgrade
w8cWeK	1	NY	controlled ncbi trial nutr effec randomized pubmed investigating 2012 function web ncbi javascript site warning requires management citation external file generate software australia cstoughswineduau centre university melbourne swinburne human technology psychopharmacology represent developed anzctr results longevity brain including oxidative brachial cardiovascular neuropsychological 3 potential factor decreased australia wide 12 effects
dvS3dH	1	NY	botany specialcollectionsnalusdagov national library collections agricultural united richest library states field department world agriculture library literature determine 82 taxonomic scope resources cowan plant quote stafleu describing 1979 taxon april survey development organize national describe principles library states agricultural agriculture special acquires descriptions established preserves necessarily describes create nal indexes access
qO22	2	NY	return tax free preparation volunteers topics individuals irs resources programs assistance irs tax qualify elderly taxpayers offer free income counseling tce vita volunteer neighborhood people credit filing tax locations elderly disabled located irscertified malls return vita electronic centers special 50000 taxpayers provide convenient make generally sites libraries returns program income
xkFJvH	1	NY	apod march ngc trifid 1579 9 north 2012 fascinating discover featured written image explanation day photograph astronomer cosmos universe professional 9 march 2012 drastically colors farther ngc sky young excited colorful dark ultraviolet unlike prominent clouds reddish scatters constellation blue nebula 3 red contrasting nebulas strong emitter heroic central study
17z3zw	2	NY	agency superfund pcbs hudson site environmental protection river jump main content contact site hudson river pcbs superfund epas listserv receive hudson email project subscribe news river automatically website information epas monitoring activities taking visit standard place dredging performance data map mb kb 17 area targeted dredge 40mile 1 ppsee pg
zZ1zsG	3	NY	inmate cropper 091432 lumley committed perryvillesan murder throat brent cell juan response inmate unit 7 department contraband knife arizona march stabbing cropper murdered locked 1997 place officer corrections found shutts miller marshall steinle sentencing defense richard robert heilman start 3 joseph roland 6 colehon john resentencing plea honorable judge 2
wiBYmL	1	NY	apod 20 ngc february spiral barred 1073 galaxy 2012 fascinating discover featured written image explanation day photograph astronomer cosmos universe professional february 20 2012 years bright centers galaxy system ngc young black prominently clusters spectacular dark bar 55 red upper bars telescope sea constellation space xray captured orbiting cetus pictured
gr5jlH	6	NY	prices gasoline sample labels cheapest area gasoline prices find aaa aaas state average daily fuel report gauge prices todays averages information estimates price diesel gasoline administration energy weekly determines gasoline cost outlook whats gasoline future prices weve answers questions frequently asked mileage money gasoline gas tips save find shopping car
r654fJ	1	NY	frb fee standardsjuly releases debit lists interchange releasefederal 12 exempt press subject 2011 institutions card reserve release date july 12 2011 wall tuesday ii street wwwfederalreservegovpaymentsystemsdebitfeeshtm determine networks subject interchange fee reform federal doddfrank regulation board exempt issuer 10 billion statute intended provisions debit lists act qualify protection affiliates payment
NHIcS	3	NY	house white state union video watch enhanced transparency commitment browse house white logs visitor wait executive actions president obama federal receipt tax federal dollars tax spent people petitions create sign house inside white tour interactive event live facebook discussion participate click member facebook give click questions comments httpwwwwhitehousegovvideo ondemand library
ag7NbD	2	NY	web student aid financial loan years select 25 generally start choose youll plan student loans 10 depending repaying repay repayment time situation repayment standard month monthly pay repay youll full loans paid standard plan years 10 50 amount payments fixed repaid monthly pay payment interest higher plans standard reason plan
w4NJML	6	NY	inmate 174456 cromwell sentenced march louis robert 2003 6 cromwell count 1 sentenced murder degree maricopa 82001 death cr2001095438 county short committed lethal injection october stephanie 0351 dispatch female apartment police approximately call 8 hysterical received stick baby daughter october identified 3208 believed male ran dead heard street home flower
6FmJZT	2	NY	senate state open york information search calendars browse minutes make share votes define single state senate bills find legislative website search documents analytics senate proposals budget reports figures facts expenditure administrative senate meetings session video committee find section archives public activities webcasted firsthand hearings events action streamed senate find streaming
wnzq8f	1	NY	flammability loungeabouts childrens violation due standard recalled retailers papabear federal pajamas named washington instructed voluntary consumers illegal commission safety cooperation announced firm product stop dc recalled resell attempt immediately products today recall consumer product sleepwear pajamas childrens 10000 units estimate loungeabouts papa bear angeles los importer llc calif flammability childrens
woH18L	6	NY	inmate 137044 cota cota forged bedroom death police title hidden beat couple hands bernal feet bat meat january arrested highspeed glendale found husband alive home hammer victor repairs closet investigation checks benjamin zavala baseball pursuit november residence 30 waited bound martinez accounts guadalupe plastic 6 wrapped head repeatedly struck work
wOMVog	1	NY	ncbi pract health promot media promotion 2012 pubmed social function web ncbi javascript site warning requires management citation external file generate software usa ut university young provo brigham process expanding purposes related overarching identify media strategy written potential health indicators performance evaluation propose social metrics purpose key article role outline
yiOowh	3	NY	city thomas fish edison york market ghetto pictures work leisure motion 1894 america 1915 load set retrieve option filmto viewing download disk film future view browser 1 part modemmpeg 25 megabytesquick 12 format realmedia 288 megabytes time higher precise houston closely follow monitored vicinity location east photographed bowery walk ghetto
x20N	2	NY	picture astronomy day fascinating discover featured written image explanation day photograph astronomer cosmos universe professional 11 2012 bright distant earth disk 20 fit easy weeks apogee photographed perigee dark day telescope pacific dense sun asia moon smallest full 300 annular 240 kilometers path super silhouetted filter point image visible smaller
wAM1zS	2	NY	impact workhour ncbi med acgme pubmed reforms educ grad 2011 function web ncbi javascript site warning requires management citation external file generate software set educators resident number surgical council education mandated concern competency reducing requirements accreditation acgme graduate reduction clinical expressing hours generated july exposure regulations medical work controversy 2003
yFzPCW	4	NY	rituximabrefractory ofatumumab ncbi pubmed blood follicu monotherapy 2012 function web ncbi javascript site warning requires management citation external file generate software immunology cancer roswell institute park departments ny medicine buffalo heavily cd20 dose 91 weekly 27 22 wwwclinicaltrialsgov progressionfree rash 4 8 infusionrelated combination leukopenia survival mg therapy international years
zKBsTi	1	NY	heart telltale plos populationbased ncbi surveillance pubmed 2007 function web ncbi javascript site warning requires management citation external file generate software division united childrens hospital johnbrownsteinharvardedu harvardmit sciences states program health boston informatics america technology massachusetts determine cox2 sought monitoring inhibitors health infarction myocardial effect selective revealed population populationlevel mi
zyYvY4	1	NY	county sanctuary monitoring national keys florida coral lagniappe 2010 ii restoration reef report marine events monroe 2001 sanctuary keys national florida scott authors bailey donahue marine hatsue control transect point lines injury results years ii restore recovery vessel benthic intended established monitoring reference unimpacted analyze excel methodology permanent adjacent digital
hz4LM4	1	NY	wonderglass science nasa space story streaming downloadable file audio listen limestone 2000o incandescent carefully crystals april mix easy form heat cool 14 liquid 2003 sand materials soda glass make shuttles melts ceramic recipe years past engineering earth delbert space twenty millennia basic curators glass experimenting emeritus missourirolla day ceramics expert
zPagUv	1	NY	apod march flying 5 night earth 2012 fascinating discover featured written image explanation day photograph astronomer cosmos universe professional 5 march 2012 atmosphere earth captured spectacles rousing sunlit orange wave dark half progresses clouds brightness lightning approaching set sequence seas frame video dawn blue space purple lights haze international occurs
