wzKdqg	2	NY	beauty study medlineplus veggies fruits tools pages related medlineplus healthylooking healthday eating simple vegetables thursday complexion rosy 8 march key news fruits researchers researcher fluctuation period whitehead psychology lead scotland vegetable skincolor ross fruit andrews sixweek school consumption university st found judged appearance period skin end attractive improve added eat
yVCV3l	3	NY	1993 ncbi interactions summerfall neurotoxicology pubmed leadprotein function web ncbi javascript site warning requires management citation external file generate software division life rockville food administration drug sciences 20857 maryland metalbinding represent focus ala brain including neurotoxic calmodulin knowledge kinase examples enzyme pivotal include anhydrase regional heme inhibition emphasized proteins specific
ytoZH9	1	NY	med ncbi clinical significance concentrations oncol pubmed serum 2012 function web ncbi javascript site warning requires management citation external file generate software georgetsirakisgmailcom haematology university heraklion crete greece department hospital scd40l partial produces soluble ki67 cytokines completion cell ligand pretreatment controls evidences treatment factor cd40lcd40 plasma increased remission evaluate express
gsGzAP	1	NY	specific country information penalties embassy drug learning crime localized information start provide spots find hot health location place conditions good visa world security country medical offices consular afghanistan albania algeria andorra angola anguilla antarctica barbuda antigua argentina armenia aruba australia austria azerbaijan bahamas bahrain bangladesh barbados belarus belgium belize benin
xcNnpp	1	NY	preparedness fema resources top back top back top back est 07mar2012 modified wednesday 140249 links nongovernment social applications web fema provided reference media companies sites endorse msgdata washington street apply management prepare federal rates homeland department 4fema emergency dc 43362 20472202 sw agencyus security500 6462500text tty assistance step 46275853 800
yz5wGA	2	NY	prediction storm center compmap weather references rap analysis 12z rapid pages 1 input 2012 updated fire ruc background fields changed refresh replaced model display mesoscale svrgis apr weather tornadoes gis shapefile visit details 9 2012 19502011 updated 19552011 format shp hailwind httpwwwspcnoaagovgissvrgis reports severe converted page feedback hovered issued displayed
9uAtiT	1	NY	5 history march today perpetrated 29th boston bloody street paul 1770 5th party photographs division march regt massacre massachusetts king engraver 1770prints revere control bostonians shot slinging crowd house sentries guarding soldiers orders fired group 1770 surrounded late 5 boston contrary struck jeering hardpacked march mortally customs injuring civilians number
yCu3Zw	1	NY	metab ncbi endocrinol pubmed physiol regulatory 2012 store function web ncbi javascript site warning requires management citation external file generate software davis california 1university results years stored questions content 5 include remaining fat effects discuss differential osmotic metabolic direct result indirect capacity affects review particles state exercise localization oxidation understanding
wYsT6R	3	NY	current uscert activity highimpact web current incidents regularly updated reported types summary uscert activity security page frequent multiple apple released updates safari address vulnerabilities products security os code crosssite obtain information perform vulnerabilities privileges elevated attack attacker condition execute denialofservice exploitation sensitive arbitrary operate scripting articles mitigate users ht5281 encourages
xxYyo1	1	NY	communicating medical medlineplus aphasia encyclopedia people problems aphasia speech trouble people speak nonfluent type aphasia called person understand people put sense make aphasia kind fluent making words unaware people understand find frustrated aphasia words realize kind ability family communicate caregivers therapist aphasia improve language work person speech years stroke aphasia
xDhctS	3	NY	house white state union video watch enhanced transparency commitment browse house white logs visitor wait executive actions president obama federal receipt tax federal dollars tax spent people petitions create sign house inside white tour interactive event live facebook discussion participate click member facebook give click questions comments httpwwwwhitehousegovvideo ondemand library
yLYj9G	1	NY	attorney office justice alerts general dept california news content skip office money years embezzlement including forged victim pocketed apartment police sheriff forms arrest version bank indicating complaint victims dependent photography practice loaned records theft embezzled association vern attorneys arrested public individuals donations officer release dsa el attorney fair companies copy
jjHHaH	1	NY	hudno11134 hud notice rights homeownership disclosure announces revised servicemembers protects protecting militaryfederal dependents law disclosure duty civil revised washington housing department announced relief development urban notice form servicemembers emphasizes active dependents rights protected today act military duty foreclosure mandates wartime states active rate including court proceeding mortgage personnel percent valid
zH3BPc	1	NY	network ncbi myeloma haematologica pubmed report 2012 european function web ncbi javascript site warning requires management citation external file generate software uk cutoff workshops centralized identify purified involved based group 21 conclusions pcs state 4 samples 8 adequate plasma 2010 hybridization tests linked material 9 2 report bank emn identified
UT2FE	7	NY	house white state union video watch enhanced transparency commitment browse house white logs visitor wait executive actions president obama federal receipt tax federal dollars tax spent people petitions create sign house inside white tour interactive event live facebook discussion participate click member facebook give click questions comments httpwwwwhitehousegovvideo ondemand library
AcdGBq	4	NY	ncbi brafmutant pubmed identification clin poorprognosis oncol 2012 function web ncbi javascript site warning requires management citation external file generate software core sorge facility institute genopode quartier switzerland lausanne bioinformatics swiss ch1015 vladpopoviciisbsibch 668 developed results characteristic predicts assessment mutatedlike adding classification iii subpopulation samples population genebased survival tumors differential
pPcIpi	1	NY	program service internship house public leadership white state union video watch enhanced transparency commitment browse house white logs visitor wait executive actions president obama federal receipt tax federal dollars tax spent people petitions create sign house inside white tour interactive adobe player flash content download view 2009 28 august domain
o8Jyaz	7	NY	facts nutrition tips fit guidelines dietary americans tools based offers easy tips plate eating food diet understand teaches icon healthy wellbalanced components interactive breastfeeding weight summer general information late population updated seeking preschoolers women loss kids pregnant specific individuals recommendations calories manage balancing weight increase foods foods reduce building healthy
o3DO7T	1	NY	ncbi associate spring silver pubmed obesity permeability 2011 intestinal function web ncbi javascript site warning requires management citation external file generate software molecular center sahlgrenska metabolic university gothenburg medicine sweden clinical andersgummessonastrazenecacom academy department research cardiovascular urinary urine resistance rodent including visceral content ratio adiposity dysfunctions increased fat results impaired
bnZMbb	1	NY	1995 carbohydratecraving ncbi res obes serotonin brain pubmed obesity function web ncbi javascript site warning requires management citation external file generate software cambridge cognitive usa brain institute research sciences clinical massachusetts department technology 02139 center feedback brain sleep smoking normalweight involved tendency snack producing treatment rich plasma serotoninreleasing food couple
y7zXdD	1	NY	genomics ncbi study phylogenetic genet pubmed mol comparative 2012 function web ncbi javascript site warning requires management citation external file generate software budapest dna network institute forensic phorolmahotmailcom 1536 hungary science medicine laboratory institutes distances newest observed interpreted melody paternal traditions based field similarities 31 gave styles combination frequencies scaling
xXGIJ9	36	NY	february media social day awareness 2012 impair stress ageappropriate capacity mental developmental youths reach ptsd challenges health disorder posttraumatic goals providers dealing wwwsamhsagovchildren children friends visit trauma resilient hope families heroes youth learn juvenile mental prevalence years challenges suffer greater stress1234567 justice generally system noting health rates document numerous higher
ywODXE	3	NY	web student aid dont loan counseling find information nslds lender exit servicer ffel contact unsubsidized financial money direct year qualifies education based federal determining lender subsidized department loan students factor regulations attending student half loans school made receive academic determined time eligibility information office check loan direct studentloansgov financial exit
Ai2uUL	2	NY	current uscert activity highimpact web current incidents regularly updated reported types summary uscert activity security page frequent multiple apple released updates safari address vulnerabilities products security os code crosssite obtain information perform vulnerabilities privileges elevated attack attacker condition execute denialofservice exploitation sensitive arbitrary operate scripting articles mitigate users ht5281 encourages
xwpnc4	2	NY	curr ncbi des pharm vegf antiangiogenesis moving stra pubmed 2012 function web ncbi javascript site warning requires management citation external file generate software houston oncology cancer gynecology ann chair tx 63271 research anderson clinical department texas pressler 1155 77030 dr herman gynecologic md center vice cox university rcolemanmdandersonorg rife cpb
r1MosH	1	NY	frb agreementsjuly releases credit report releasefederal college 7 press 2011 card reserve release date july 2011 7 reserve text higher education information federal thursday payment agreements organizations 2010 board updated full issuers online includes released effect report affiliated card account database agreement credit institutions 1000 disclosure number accounts information educational
ftEw0I	1	NY	uscis study materials english test sentences tools speak application writing write materials correctly test reading speaking ability form eligibility interview started uscis prepare read n400 portion determined officer components english naturalization study additional section products select short naturalization process overview video test providing requirements citizenship process eligibility naturalization presentation practice
wNoMgn	1	NY	inmate 036366 gallardo shot chair death father answered early records hands burglary day found side kidnapping college entering home peter gallardos cell firstdegree 300 struggle arcadia residence afternoon confronted point bound feet 20yearold dna assumed convicted call cords pm mike murder door phone broke butt work rudys called sentenced proved
ztzQUR	1	NY	differ ncbi 2003 pubmed brain musicians neurosci structures function web ncbi javascript site warning requires management citation external file generate software israel usa center harvard deaconess medical 02215 school neurology massachusetts boston department beth represent supported symbols brain experiments keyboard skill voxelbyvoxel group auditory technique matched careers animal gray showing
xJIZEE	1	NY	jobs wednesday rigov hot 7 dlt march 2012 number middletown year 682732 police officers employer location ri channel 10 job 4374296 position town 12 level entry hour home assistant healthcare number employer job location 1100 jamestown position nurse 682828 ri certified body cranston 1300 hour arlington number employer job 682820
nq89wq	1	NY	frb economic outlookseptember 8 2011 speechbernanke outlook economic outlook conclude series longerterm delighted twin economic 20112012 provide minnesota speaker overview policy kick economy good club monetary cities thoughts prospects today inviting afternoon global actions trade world coordination late production policy freezing early policymakers governments term stabilize stimulus accompanied discussing financial
1d04OZ	1	NY	town house maine representatives find representative thomas johnson district senate house douglas rgreenville 27 abbot peter rsomerset nass 144 district senate house ryork ronald acton 2 collins joan racton addison dianne district 33 house 29 rharrington tilton senate rwashington raye kevin albany rbethel district senate house doxford crockett jarrod patrick
150pf	14	NY	homosexual ncbi 1996 homophobia pubmed ar abnorm psychol function web ncbi javascript site warning requires management citation external file generate software georgia psychology usa university athens 306023013 department assigned aggression monitored penile buss 29 exclusively increases affect videotapes erection admitted individuals unaware exposed erotic individual sexually nonhomophobic questionnaire denies index
wrFdVy	1	NY	ncbi hum parenting pract dev child psychiatry pubmed contribution 2012 function web ncbi javascript site warning requires management citation external file generate software melbourne australia vic university psychological sciences 3010 melissaduncombeoptusnetcomau mental characteristics variables sample regulatory examine design analysis parentteacher multiple selfreport data children risk impact 9yearold based goal inform
DmpmR	1	NY	entrez genome view viewer map resources ncbi data genbank organism sequencing projects resources related databases cytogenetic features reference sequence viewer hybrid maintained displays human ests contig tiling physical contigs stss ncbi alternate radiation maps genetic grc predicted include fish genome map graphical assembly models genes component gnomon clones path bac
xNuGnD	1	NY	minority monday national month april unity 2 health equity day skip navigation hhs overview accomplishments disparities omhs speaker equity health keynote importance advances regional mention representative role present suggested advance efforts plan owh representatives hrsa 1 3 health samhsa equity healthmoderator minority regional agencies consultantpanelists panel invited offices cms point
67QsDS	1	NY	house apply white state union video watch enhanced transparency commitment browse house white logs visitor wait executive actions president obama federal receipt tax federal dollars tax spent people petitions create sign house inside white tour interactive internship house period application program closed white submitted application materials including recommendations deadline read
4dwBHm	1	NY	picture astronomy day fascinating discover featured written image explanation day photograph astronomer cosmos universe professional 11 2012 bright distant earth disk 20 fit easy weeks apogee photographed perigee dark day telescope pacific dense sun asia moon smallest full 300 annular 240 kilometers path super silhouetted filter point image visible smaller
zb0i4q	11	NY	apod march flying 5 night earth 2012 fascinating discover featured written image explanation day photograph astronomer cosmos universe professional 5 march 2012 atmosphere earth captured spectacles rousing sunlit orange wave dark half progresses clouds brightness lightning approaching set sequence seas frame video dawn blue space purple lights haze international occurs
xfs1L9	1	NY	specialist bio acton astronaut payload loren specialist phd acton payload loren march personal married born montana 1936 7 lewiston data children received philosophy colorado degree doctor science university state 1965 bachelor montana education 1959 organizations tau union chi astronomical advancement pacific society american beta international pi sigma association science celestial
yUzuQt	72	NY	march house photo white day 2012 state union video watch enhanced transparency commitment browse house white logs visitor wait executive actions president obama federal receipt tax federal dollars tax spent people petitions create sign house inside white tour interactive house 2012 check offices photo march picks white day 30 force
zq9eU0	3	NY	inmate gonzales 058534 wagner burglary committed gasping cut 20 23 residential fled penalty stabbing returned tucked lobe stop underneath 1991 front stabbed murder february skewered arrested robbery lung husband pleas 7yearold house back aggravated arm shining opened gonzales celebrated firstdegree vcr 7 consecutive 911 deborah terms death police yard wagners
xOgAAN	2	NY	monitor lost crew uss noaa honors image sailor computer enhanced images monitor remains unknown state uss louisiana showing clay courtesy 1862 looked university gun face 2002 turret aboard found model left image sailor computer enhanced images monitor remains unknown state uss louisiana showing clay courtesy 1862 looked university gun face
zOMvzF	5	NY	thomas congress text bill library 112th 20112012 hcon ih 107 force misdemeanor high sense constitution section offensive crime 4 constitutes authorization expressing congress president article ii clear prior impeachable act military jones committee judiciary submitted concurrent mr resolution referred force misdemeanor high sense constitution section offensive crime 4 constitutes authorization
A3vOk9	24	NY	mission solstice prometheus cassini images home image details image collision ring 86 moon white drapes outermost prometheus kilometers shaping center bulge 53 miles learn small perturbs soft encke kinky discontinuous image visible ringlets ring rings ringplane 1 stars degree southern gap background ringlet unilluminated learn view side left acquired image
e6dM45	2	NY	materials 2011 day awareness symbol date day official materials 9 awareness 2012 brochures promotional including images web day print awareness pages icon fliers sized materials small exkinkos promotional accommodate signage images large fed materials awareness printer vendor day icon sized printing steps reproduction facilitate flier links spanish download click save
w0E9Zi	3	NY	inmate carreon 045169 sentenced albert carreon martinez 2003 2 sentenced county armando committed lethal death maricopa 23 1 hernandez murder degree injection count cr2001090195 2001 january hernandez mexican shoes received back feet victim shot tan shooting aragons thigh blue forehead memorial apartment hospital leg wound long 1 suspect 6 inch
ygOrCp	1	NY	agenda judiciary committee judiciary committee public agenda hearing 2012 march wednesday 14 room 1100 2c raised review bills penalty raised revising act 1 felonies 280 sb capital raised judgments 306 2 act sb executions raised mental beneficiary 3 deficit 307 reason sb murdering survivor rights inheritance guilty disease act found
f8zxQx	1	NY	counselorus housing urban development department hud talk renting foreclosure 5694287 cost home counseling issues provide housing agency system call low online avoidance hud advice sponsors free agencies buying search 800 reverse default country mortgages credit voice huds interactive foreclosure home assistance visit counselors program avoidance affordable borrowers search list facing
5FUReK	3	NY	house white state union video watch enhanced transparency commitment browse house white logs visitor wait executive actions president obama federal receipt tax federal dollars tax spent people petitions create sign house inside white tour interactive event live facebook discussion participate click member facebook give click questions comments httpwwwwhitehousegovvideo ondemand library
wB2AC9	1	NY	yard region rail site sites cleanup 5 conrail epa jump main content region cleanup 5 sites serving wisconsin tribes michigan minnesota 35 illinois indiana ohio search area contact epa pope 3123530628 community ext30628 popejanetepagov involvement 8006218431 coordinatorjanet remedial 34367 3123534367 project drexler ext drexlertimothyepagov 8006218431 managertimothy records written view reference
eFVbNf	1	NY	life form nasa science story streaming downloadable file audio listen californias 30 lake mark twain 2003 mono july didnt earthis lies lonely 1872 silent picturesque solemn hideous loneliest spot sailless desert tenant seathis graced lifeless treeless roughing travelogue wrote beautiful national astrobiologist technology richard space hoover huntsville nsstc nasas center
nnz5f	1	NY	led lighting commercial energy star led products light commercial lighting home fixtures partners partner lighting residential led retrofits energy led cooling offers projects maintenance construction save unprecedented star easy commercial cuttingedge qualified lighting opportunity renovation natural fit costs color energy parking lots produces environment virtually show products led highend commercial
qvXnXj	3	NY	entrez genome view viewer map resources ncbi data genbank organism sequencing projects resources related databases cytogenetic features reference sequence viewer hybrid maintained displays human ests contig tiling physical contigs stss ncbi alternate radiation maps genetic grc predicted include fish genome map graphical assembly models genes component gnomon clones path bac
xBio6U	1	NY	training service mobile dog program treatm pubmed med army dep aprjun639 2012 warrior usa brookeville canine connection maryland mission brain july staff physiological residential presence symptoms program treatment maryland veterans 2010 yount continues prominent posttraumatic systematically wellness reduces large investigate excellence team disorder ptsd enhances warrior national canine defense research
yk5hpw	1	NY	urged medlineplus steps desk small jockeys exercise pages related medlineplus harm warns healthday news 24 feb expert spending long health boost friday hours desk productivity work heart evidence suffer risk sitting shoulders greater time day spine disease growing spend hips feel move mind julia therapist helps saint memory occupational exercise
AjCX17	2	NY	poor impact stress adults older medlineplus sleep response pages related medlineplus adults tuesday sleep healthday marker poorly stressful situations inflammation 6 march increased levels news faced showed older study finds marker linked issues cardiovascular variety il6 health problems psychiatric diabetes disease interleukin6 called people medical sleep rochester author physiological poor
rAtlFb	1	NY	requirements reporting faqs payment card news essentials newsroom topics irs resources revenue settlement special network service irs entities internal 1099k begin thirdparty form transactions reporting payment card transitional required relief banks providing notice 201188 201189 faqs special information requirements network details 2011 2012 scheduled begin thirdparty transactions reporting occurred early
gtOUGC	1	NY	surg laser ncbi applications clinical 2006 photomed pubmed experimental function web ncbi javascript site warning requires management citation external file generate software 53226 usa university sciences clinical wisconsinmilwaukee department laboratory wavelengths cellular results chicken cell formic presents production treatment nirlightemitting include cytochrome murine increased nearinfrared therapy effects photobiomodulation represents processes
yyLBUz	1	NY	fiber neuropathy text nutritional sulfate clinicaltrialsgov full agmatine small view supplementation performing testing agmatine autonomic questionnaire monitored sulfate improvement note peripheral function fiber pain nonblinded started arginine effects additionally response end beginning caseonly neuropathic metabolite neuropathy study months patients small evaluates noted investigators biopsy skin jfk med ctr patients clinic
zkAALB	1	NY	dol internship labor program department states department united labor foster seekers retirees labors mission states earners departments welfare apply employment advancing wage promote develop working provide opportunity government opportunities labor assuring program department conditions interested internships website profitable internship agencies nation job part improving unique applicants workrelated benefits dol rights
l5nZYy	1	NY	mdufa meetings holds september meetings authority regulated discussions recommendations legislative information amendments fee periodically current process program conduct public 2012 reauthorization fy20132017 stakeholder expire user groups device hold fda developing requires medical conducts page mdufa part reauthorized 2007 act stakeholders fdaaa industry downloading file 03152012 information note updated accessing viewers
eumt4	14	NY	national historic steamtown site search bell feel back feet grease rods ground engines people vibrate hot ton smokestack smell today era life oil returned railroading firebox cinders whistle heat hear chuffchuff wheels drive turn stories relive steam buildings people museum modern railroading explore offers steamtown lore technology steam history seasonal
